Domain,Url,Product_id,Brand,Category,Model,Price,Seller,Tags,Info,Others
tiki.vn,https://tiki.vn/tham-tap-yoga-tpe-2-lop-zera-8mm-2l-xanhreu-xanh-reu-p842294.html?src=category-page-1975&2hi=1,842294,Zera,Thể thao,Thảm Tập Yoga TPE 2 Lớp ZERA-8MM-2L-XANHREU - Xanh Rêu,384.000 ₫,Sportslink,," Thảm Tập Yoga TPE 2 Lớp Zera 123457711 (8mm) được thiết kế hoa văn tinh tế, mang lại vẻ đẹp hoàn hảo. Sản phẩm được làm từ chất liệu cao cấp, êm ái và không gây kích ứng da. Đồng thời, chất liệu không bị bám bẩn, dễ vệ sinh và chùi rửa. Thảm giúp tạo sự an toàn, chống trơn trượt và tăng độ bám của cơ thể với mặt đất. Thảm có độ đàn hồi tốt, không bị bẹp, tuyệt đối không co dãn theo thời gian. Sau khi tập xong, bạn có thể cuộn tròn thảm Yoga thật gọn gàng để tiện bảo quản và vận chuyển mà không lo ảnh hưởng đến độ bền của thảm. ",""""""
tiki.vn,https://tiki.vn/kinh-boi-cho-tre-em-view-v730j-p2783491.html?src=category-page-1975&2hi=1,2783491,View,Thể thao,Kính Bơi Cho Trẻ Em View V730J,299.000 ₫,Tiki Trading,," Kính Bơi View Aquario V730J Kính Bơi View Aquario V730J được thiết kế đặc biệt không chỉ bảo vệ đôi mắt của trẻ trong khi bơi mà còn là một phụ kiện bơi lội đẹp mắt mà các bậc phụ huynh có thể dành tặng cho con em mình. Chất liệu nhựa cứng Polycarbonat cùng lớp phủ chống mờ và tia UV giúp trẻ có được tầm nhìn tốt trong khi bơi. Dây đeo cùng vành silicone mềm dẻo, bảo vệ vùng mắt khỏi nước cũng như mang đến cảm giác dễ chịu, không tạo vết hằn hay cấn. Thông tin sản phẩm Chất liệu nhựa Polycarbonat cùng silicone mềm dẻo Sản phẩm có phần tròng kính được làm từ chất liệu nhựa trong suốt Polycarbonat cho độ bền cao, độ trong suốt của kính sẽ đảm bảo được tầm nhìn rõ ràng của bạn trong khi bơi. Các chi tiết như dây đeo, vành bảo vệ được làm từ chất liệu silicone dùng trong y khoa, mềm dẻo và đảm bảo an toàn, không gây kích ứng đáng kể cho cả người có làn da nhạy cảm. Lớp tráng phủ chống mờ và tia UV gây hại cho mắt Bề mặt của kính được tráng phủ một lớp chất liệu đặc biệt có khả năng chống mờ bởi hơi nước, giữ cho kính luôn được trong suốt, đảm bảo tầm nhìn của trẻ nhỏ khi bơi lặn. Lớp tráng phủ còn có khả năng phản chiếu được tia UV gây hại cho mắt của trẻ, từ đó hạn chế tình trạng mắt bị chói và khó chịu trong khi bơi. Thiết kế đẹp mắt tiện dụng Kính được thiết kế với phần dây đeo có thể thay đổi kích cỡ dễ dàng cùng với phần khoá nhựa đặc biệt, giữ cho phần dây đeo của kính luôn ở đúng vị trí. Thanh cài ở giữa mũi có thiết kế liền mảnh không có chi tiết thừa gây khó chịu cho vùng mũi của bạn. Kính sở hữu thiết kế thể thao với những đường vát mềm mại và tinh tế, có thể dùng trong khi thi đấu, bơi lội vui chơi thông thường. Lưu ý Để cho lớp phủ chống mờ và tia UV hoạt động hiệu quả, hãy ngâm kính trong nước vài giây trước khi sử dụng. Không chạm tay cũng như vật cứng vào phần tròng kính để tránh làm hỏng lớp tráng phủ. Sau khi sử dụng nên rửa sạch kính với nước và bảo quản nơi khô ráo, mát mẻ. ",""""""
tiki.vn,https://tiki.vn/day-dan-hoi-tap-gym-s1-d-bo-day-tap-the-luc-5-mau-bo-11-chi-tiet-day-tap-khang-luc-100lb-tieu-chuan-poki-p2916833.html?src=category-page-1975&2hi=0,2916833,POKI,Thể thao,"Dây đàn hồi tập Gym S1-D, bộ dây tập thể lực 5 màu - Bộ 11 chi tiết, dây tập kháng lực 100LB tiêu chuẩn - POKI",329.000 ₫,POKI,," Ưu điểm của sản phẩm dụng cụ dâyđàn hồi kháng lực tập gym thể hình tại nhà: Chuẩn bộ dụng thay thế cả phòng gym. Bạn sẽ tiết kiệm được chi phí so với những máy tập đắt tiền Có thể theo bạn đến bất cứ đâu, giúp bạn duy trì luyện tập ngay cả khi đi du lịch Tập mọi lúc mọi nơi, mọi thời điểm. Hệ thống bài tập đa dạng nâng hứng thú trong quá trình luyện tập Chất liệu đàn hồi cao câp 2 lớp. Tay cầm cao cấp, giúp bạn dễ dàng thực hiện được nhiều bài tập Móc sắt hiện đại giúp bạn dễ dàng nâng hoặc giảm mức tạ cho phù hợp Trọng lượng kéo của 5 dây là 100LB tương đương 45,2Kg ",""""""
tiki.vn,https://tiki.vn/tham-tap-yoga-eco-friendly-tpe-xanh-la-den-6mm-p790306.html?src=category-page-1975&2hi=1,790306,Eco Friendly,Thể thao,Thảm Tập Yoga Eco Friendly TPE - Xanh Lá Đen (6mm),188.000 ₫,LUCKY DAY SHOP,," Thảm Tập Yoga Eco Friendly TPE (6mm) được sản xuất bằng chất liệu TPE (Thermoplastic Elastomer) từ cao su tự nhiên – là chất liệu cao cấp nhất để chế tạo thảm tập. Với các ưu điểm: độ đàn hồi cao, khả năng co giãn, kéo giãn và chịu lực tốt, độ bám cao, chịu nước tốt và kháng khuẩn. Vật liệu TPE được gia công theo quy trình ép khuôn bằng nhiệt, không chứa các phụ gia như toxic, latex hay chlorride; hoàn toàn thân thiện với môi trường (tái sử dụng được) và an toàn khi tiếp xúc với da, gần như không mùi sau vài tuần sử dụng. Là một lựa chọn tuyệt vời cho những bạn năng động thích một tấm thảm bền, đẹp và phong cách. Với chất lượng vượt trội, thảm được thiết kế chống trượt và êm ái, dù bạn chuyển động nhẹ nhàng Hatha, năng động trong Vinyasa, mạnh mẽ trong Ashtanga hay đổ mồ hôi nhiều trong Bikram. ",""""""
tiki.vn,https://tiki.vn/giay-the-thao-cao-cap-nu-biti-s-hunter-x-premium-dsw055833kem-kem-p773782.html?src=category-page-1975&2hi=1,773782,Biti's Việt Nam,Thể thao,Giày Thể Thao Nữ Biti's - Hunter X Premium DSW055833KEM - Kem,799.000 ₫,Tiki Trading,," Giày Thể Thao Nữ Biti's - Hunter X Premium DSW055833KEM - Kem sẽ là người bạn đồng hành lí tưởng của bạn khi tham gia các hoạt động thể thao, dã ngoại nhờ thiết kế tiện lợi và thời trang. Đế giày đàn hồi tốt, bám đất ổn định, hạn chế tình trạng trơn trượt nhờ được chế tạo từ chất liệu phylon siêu nhẹ. Sản phẩm có trọng lượng siêu nhẹ cho những bước di chuyển của bạn nhẹ nhàng và linh hoạt hơn. Công nghệ dệt Air Mesh, tạo thêm nhiều lỗ thoáng khí hơn giúp đôi chân luôn thoáng mát, thoải mái tối đa khi sử dụng trong thời gian dài. Công nghệ này cũng giúp quá trình vệ sinh giày đơn giản và nhanh chóng hơn. Sản phẩm có nhiều size để bạn linh hoạt lựa chọn sao cho phù hợp với kích cỡ chân. Hướng dẫn chọn size: ",""""""
tiki.vn,https://tiki.vn/bang-phi-tieu-chuyen-nghiep-sportslink-r6713-p790104.html?src=category-page-1975&2hi=1,790104,Sportslink,Thể thao,Bảng Phi Tiêu Chuyên Nghiệp Sportslink R6713,138.000 ₫,MacBuy,," Bảng Phi Tiêu Chuyên Nghiệp Sportslink R6713 là môn thể thao mang tính đồng đội cao, phù hợp với các hoạt động lành mạnh tại văn phong, bar, cafe shop, nhà hàng... Bảng phóng phi tiêu này được thiết kế 2 mặt phóng, mỗi mặt tương đương với một cách tính điểm khác nhau. Độ dày khoảng 2.5cm, chắc chắn với ruột gỗ và rất nhạy với phi tiêu vì bảng được bọc 1 lớp sisal ở ngoài. Các chi tiết rất rõ nét và nổi bật. Đường kính theo chuẩn quốc tế 17 inch tương đương 40cm. Tấm lưới thép giúp phân chia các ô tính điểm, tránh trường hợp gây tranh cãi khi bạn phóng trúng giữa đường kẻ của ô 10 và 20 điểm. Mũi phi tiêu băng sắt, phần đuôi làm từ các lá mỏng và nhẹ tương tự lông chim trên mũi tên giúp phi tiêu bay theo đường thẳng, tăng độ chính xác. Một bảng phóng phi tiêu đi kèm theo 6 mũi phi tiêu phân ra 2 màu cờ khác nhau dành cho 2 đội chơi. ",""""""
tiki.vn,https://tiki.vn/bo-2-doi-nut-bit-tai-chong-nuoc-dung-cho-boi-loi-aqua-block-nhap-khau-my-mack-s-12-p977093.html?src=category-page-1975&2hi=1,977093,Mack's,Thể thao,Bộ 2 Đôi Nút Bịt Tai Chống Nước Dùng Cho Bơi Lội Aqua Block Nhập Khẩu Mỹ Mack's #12,159.000 ₫,Mack's Viet Nam,," Bộ 2 Đôi Nút Bịt Tai Chống Nước Dùng Cho Bơi Lội Aqua Block Nhập Khẩu Mỹ Mack's #12 được đúc bởi Silicon và thiết kế nhiều lớp vành để giúp vừa mềm mại, vừa thoải mái lại ngăn được nước vào tai gần như tuyệt đối Đai ốc Flex độc đáo, cùng với vành Silicon 3 lớp giúp cho sản phẩm vừa khít hơn, tăng khả năng bảo vệ tai dưới nước, mà vẫn cảm thấy thoải mái. Silicon được đúc sẵn không giống các loại nút bịt tai bằng nhựa khác Giúp những vận động viên bơi lội khỏi các tác động xấu và bệnh liên quan tới tai Sản phẩm nút bịt tai Mack’s® AquaBlock® an toàn trong môi trường nước muối hoặc Clo. ",""""""
tiki.vn,https://tiki.vn/thuc-pham-bo-sung-optimum-nutrition-gold-standard-100-whey-5lb-2-27kg-p1815329.html?src=category-page-1975&2hi=0,1815329,Optimum Nutrition,Thể thao,Thực Phẩm Bổ Sung Optimum Nutrition Gold Standard 100% Whey 5lb (2.27kg),1.590.000 ₫,Optimum Nutrition,," Link xác thực sản phẩm: https://www.authenticateon.com/VN Được bầu chọn là thực phẩm bổ sung và sản phẩm protein của năm trong 12 năm liên tiếp. Đây là minh chứng cho sự cam kết của chúng tôi khi tạo ra sản phẩm bổ sung dinh dưỡng thể thao chất lương. 100% Whey Protein chứa chất tiêu hoá Lactase và Aminogen giúp hấp thụ tốt Protein và giúp những cá nhân khó hấp thụ đường lactose có thể dễ dàng sử dụng sản phẩm này. 100% Whey Protein rất dễ hoà tan và có hương vị tuyệt hảo khi hoà với sữa hoặc nước lạnh. Nếu bạn muốn thêm hương vị, trộn 100% Whey Protein với sữa chua hoặc ăn cùng với bánh ngọt. Tác Dụng: Bổ sung đạm, giúp cơ bắp phát triển, cung cấp năng lượng trực tiếp cho cơ bắp, bảo vệ cơ nạc trong các hoạt động kéo dài và tránh mệt mỏi. Thông tin dinh dưỡng: Trọng lượng 1 muỗng dùng 30.4 g Hàm lượng 1 lần dùng Calories 120 Total Fat 1g Cholesterol 40mg Sodium 110mg Total Carbohydrate 3g Sugars 1g Protein 24g Hướng dẫn sử dụng Cách dùng: Dùng 2-3 muỗng/ngày. Hòa 1 muỗng với 200 ml sữa, nước hoa quả hoặc nước lạnh. Khuấy đến khi tan đều. Gợi ý: Bạn có thể dùng với máy nghiền. Cho 1 muỗng vào máy nghiền cùng với 200 ml sữa, nước hoa quả hoặc nước lạnh. Đậy lại và nghiền khoảng 20 đến 30 giây. Thêm 1 hoặc 2 viên đá và nghiền thêm 30 giây. Bạn có thể thêm hạt lạc, sữa chua, hoặc các loại hoa quả. ",""""""
tiki.vn,https://tiki.vn/tha-m-ta-p-yoga-cho-ng-tron-truo-t-6mm-ma-u-nga-u-nhien-p2470231.html?src=category-page-1975&2hi=1,2470231,ProMat,Thể thao,Thảm tập yoga chống trơn trượt 6mm - Màu ngẫu nhiên,83.900 ₫,LUCKY DAY SHOP,," Thảm tập yoga cao cấp dày 6mm là thảm tập yoga đúc 1 lớp, có chất lượng tốt, bề mặt chống trơn trượt. Mặt dưới có độ bán dính và bám sàn cao, mặt trên mang lại cảm giác êm ái thoải mái cho người sử dụng. Chất liệu TPE + CT (Polyester + Cotton) cao cấp dày 6mm, rất êm và bền. Chất liệu không gây kích ứng da và thân thiện với môi trường Kích thước 180 x 60 cm, dày 0,7cm, với nhiều màu sắc Thảm có độ bền cao và được sử dụng trong mọi điều kiện khác nhau LƯU Ý KHI SỬ DỤNG THẢM TẬP YOGA - Khi giặt sản phẩm thì bạn nên hòa loãng xà phòng cùng với một chút nước ấm sau đó chà qua thảm nhưng không dùng bàn chải sau đó mang thảm ra phơi ngoài nắng. Ngoài ra nếu bạn giặt bằng máy giặt thì nên để ở chế độ vừa phải. - Hầu hết các thảm trong lần đầu sử dụng đều có những mủn nhỏ bay ra và bạn có thể lau sạch nó bằng một miếng giẻ ướt. Nếu không bạn cứ sử dụng sau một thời gian những mủn đó sẽ tự hết. Tuy nhiên bạn không nên giặt quá nhiều xà phòng để tẩy. - Nếu trong trường hợp thảm của bạn chỉ bị bẩn nhẹ thì bạn chỉ cần xịt nhẹ một chút nước bằng chai xịt hay miêng vải ướt để lau rồi phơi khô. Do được cấu tạo bằng chất cao su thiên nhiên nên chỉ cần một quá trình sử dụng sản phẩm có độ sáng lên rõ rệt và không còn mùi khó chịu. - Để rút ngắn thời gian phơi sản phẩm thì bạn dùng một chiếc khăn khô lau rồi mang ra phơi. Càng sử dụng các bạn càng thấy sản phẩm mềm hơn và có độ dai hơn. * Lưu ý: Sản phẩm sẽ được giao màu ngẫu nhiên ",""""""
tiki.vn,https://tiki.vn/combo-tham-yoga-va-bao-dung-mau-xanh-duong-p460440.html?src=category-page-1975&2hi=1,460440,Tiến Sport,Thể thao,Combo Thảm Yoga Và Bao Đựng (Màu Xanh Dương),174.000 ₫,Tiki Trading,," Combo Thảm Yoga Và Bao Đựng (Màu Xanh Dương) Combo Thảm Yoga Và Bao Đựng (Màu Xanh Dương) sẽ là sự lựa chọn tiên lợi và lý tưởng cho những bạn đi tập thể dục, tập Yoga Thảm Yoga, thiền ở các trung tâm, bởi không chỉ có thảm Yoga, nay sản phẩm đã được trang bị thêm bao đựng thảm có kích thước nhỏ gọn, có thể cuốn gọn bọc thảm lại để giúp bạn mang theo bên người và bảo quản. Thông tin sản phẩm 1. Thảm Yoga Màu Xanh Dương Chất liệu polyester có khả hấp thụ dầu, chống nước, chống bụi và chống cháy. Khả năng hấp thụ thấp của polyester giúp nó tự chống lại các vết bẩn một cách tự nhiên. Mặt khác, vải polyester không bị co khi giặt, chống nhăn và chống kéo dãn. Nó cũng dễ dàng được nhuộm màu và không bị hủy hoại bởi nấm mốc và là vật liệu cách nhiệt hiệu quả. Màu sắc trang nhã Tông màu xanh dương dịu mắt mang đến cảm giác nhẹ nhàng, sảng khoái, thiết kế đẹp sẽ là tạo cho bạn động lực để rèn luyện cơ thể mổi ngày. Độ bám cao, chống trơn trượt Thảm có độ bám rất tốt, giảm tối thiệu trường hợp bị dịch chuyển hay trượt trên nền trong lúc tập luyện mang lại cảm giác thật thoải mái và hoàn toàn yên tâm khi tập. 2. Bao Đựng Thảm Chất liệu nhựa tổng hợp bền chắc Sản phẩm được làm từ chất liệu nhựa tổng hợp bền chắc, khó bị sờn, rách hay biến màu trong khi sử dụng. Sản phẩm có thể làm sạch dễ dàng với nước khi bị bám bẩn. Thiết kế bao đựng có lưới cùng khoá kéo tiện lợi Bao đựng có thiết kế dạng lưới ở phần thân, giúp cho thảm đựng bên trong luôn được thông thoáng, tránh bí khí gây sinh sôi vi khuẩn gây mùi hôi, ẩm mốc khó chịu. Sản phẩm có phần dây kéo dọc theo bao đựng vô cùng chắc chắn, cho bạn dễ dàng cho thảm vào bao đựng. Dây đeo chắc chắn, dễ sử dụng Đính kèm trên bao đựng là phần dây treo chắc chắn, cho bạn có thể mang xách túi đến bất kì nơi nào đồng thời có thể treo túi đựng lên để có thể giảm thiểu không gian lưu trữ tại nhà. Dây đeo chạy dọc theo chiều dài của bao đựng nên dễ sử dụng. ",""""""
tiki.vn,https://tiki.vn/kinh-boi-view-v200s-p1085792.html?src=category-page-1975&2hi=1,1085792,View,Thể thao,Kính Bơi View V200S,279.000 ₫,Tiki Trading,," Kính Bơi View V200S là sản phẩm chuyên dùng trong bơi lội nhằm bảo vệ vùng mắt của người dùng khỏi tác động của nước, ánh nắng mặt trời làm ảnh hưởng tầm nhin trong khi bơi. Chất liệu nhựa cứng trong suốt cùng các chi tiết bằng silicone mềm dẻo, mang đến độ bền đẹp cho sản phẩm. Kính được thiết kế đẹp mắt, đồng thời tạo cảm giác thoải mái tối đa cho người dùng không gây hằn, cấn cho vùng mặt và mũi trong khi bơi. Tròng kính được làm từ chất liệu nhựa trong suốt polycarbonat cho độ bền cao, độ trong suốt của kính sẽ đảm bảo được tầm nhìn rõ ràng của bạn trong khi bơi. Các chi tiết như dây đeo, vành bảo vệ được làm từ chất liệu silicone dùng trong y khoa, mềm dẻo và đảm bảo an toàn, không gây kích ứng đáng kể cho cả người có làn da nhạy cảm. Dây đeo đôi có khả năng thay đổi kích thước dễ dàng, cho bạn thay đổi tuỳ theo kích cỡ vòng đầu của từng người. Đặc biệt phần dây đeo sẽ giữ được vị trí, không bị xê dịch do có phần thanh cài chắc chắn. Phần sóng mũi được thiết kế liền mạch, không có mối nối nên tạo cảm giác thoải mái tối đa cho người dùng. Bề mặt được tráng phủ một lớp chất liệu đặc biệt có khả năng chống mờ bởi hơi nước, giữ cho kính luôn được trong suốt, đảm bảo tầm nhìn khi bơi lặn. Lớp tráng phủ còn có khả năng phản chiếu được tia UV gây hại cho mắt của trẻ, từ đó hạn chế tình trạng mắt bị chói và khó chịu trong khi bơi. Thích hợp với nhiều đối tượng sử dụng. ",""""""
tiki.vn,https://tiki.vn/giay-the-thao-cao-cap-nu-biti-s-hunter-x-premium-dsw055833doo-do-p773781.html?src=category-page-1975&2hi=1,773781,Biti's Việt Nam,Thể thao,Giày Thể Thao Nữ Biti's - Hunter X Premium DSW055833DOO - Đỏ,799.000 ₫,Tiki Trading,," Giày Thể Thao Nữ Biti's - Hunter X Premium DSW055833DOO - Đỏ sẽ là người bạn đồng hành lí tưởng của bạn khi tham gia các hoạt động thể thao, dã ngoại nhờ thiết kế tiện lợi và thời trang. Đế giày đàn hồi tốt, bám đất ổn định, hạn chế tình trạng trơn trượt nhờ được chế tạo từ chất liệu phylon siêu nhẹ. Sản phẩm có trọng lượng siêu nhẹ cho những bước di chuyển của bạn nhẹ nhàng và linh hoạt hơn. Công nghệ dệt Air Mesh, tạo thêm nhiều lỗ thoáng khí hơn giúp đôi chân luôn thoáng mát, thoải mái tối đa khi sử dụng trong thời gian dài. Công nghệ này cũng giúp quá trình vệ sinh giày đơn giản và nhanh chóng hơn. Sản phẩm có nhiều size để bạn linh hoạt lựa chọn sao cho phù hợp với kích cỡ chân. Hướng dẫn chọn size: ",""""""
tiki.vn,https://tiki.vn/tham-tap-yoga-tang-kem-tui-dung-tham-mau-ngau-nhien-p3055219.html?src=category-page-1975&2hi=1,3055219,OEM,Thể thao,Thảm tập Yoga tặng kèm túi đựng thảm (màu ngẫu nhiên),99.900 ₫,LUCKY DAY SHOP,," Thảm thể dục là một trong những dụng cụ hỗ trợ cần thiết trong nhiều môn thể thao đặc biệt là các môn thẩm mỹ như Yoga, thiền, tập bóng…Thảm được làm từ chất liệu Xốp an toàn và rất tiện dụng cho người tập, tạo cảm giác êm ái, tránh các sự cố va chạm trầy xước với mặt sàn. Ngoài ra, thảm có độ bám dính cao, không dịch chuyển trên nhiều bề mặt tiếp xúc và có thể cuộn tròn, tiện lợi cho sử dụng cả trong và ngoài nhà. Hãy để thảm nâng đỡ từng động tác Yoga và giúp việc luyện tập của bạn thêm hiệu quả. TÍNH NĂNG NỔI BẬT Chất liệu Xốp có nhiều ưu thế hơn vải bông như không hút ẩm nhưng hấp thụ dầu và là loại vải hoàn hảo đối với những ứng dụng chống nước, chống bụi và chống cháy. Khả năng hấp thụ thấp của Xốp giúp nó tự chống lại các vết bẩn một cách tự nhiên. Mặt khác, vải Xốp không bị co khi giặt, chống nhăn và chống kéo dãn. Nó cũng dễ dàng được nhuộm màu và không bị hủy hoại bởi nấm mốc và là vật liệu cách nhiệt hiệu quả. Tính tiện lợi cao Sau khi tập xong, bạn có thể cuộn tròn thảm tập thể dục, thật gọn gàng để tiện bảo quản và vận chuyển mà không lo ảnh hưởng đến độ bền của thảm. Ngoài ra, thảm được phủ những gam màu tươi trẻ, mang lại cảm giác thật sảng khoái cho thị giác trong suốt quá trình tập. Độ bám nền cao Thảm có độ bám rất tốt, giảm tối thiệu trường hợp bị dịch chuyển hay trượt trên nền trong lúc tập luyện mang lại cảm giác thật thoải mái và hoàn toàn yên tâm khi tập. Có thể giặt được Vì sở hữu nhiều tính chất vượt trội từ chất liệu Xốp nên những khi cảm thấy thảm đã dơ và cần được vệ sinh thì bạn có thể thoải mái lau chùi hoặc chọn cách giặt thông mà không sợ ảnh hưởng đến chất lượng thảm. Còn chần chừ gì nữa? Click MUA ngay để cho những buổi tập thêm êm ái và thoải mái nhé! ",""""""
tiki.vn,https://tiki.vn/tham-tap-yoga-eco-friendly-tpe-tim-6mm-p790294.html?src=category-page-1975&2hi=0,790294,Eco Friendly,Thể thao,Thảm Tập Yoga Eco Friendly TPE - Tím (6mm),180.000 ₫,Tienphatsmart,," Thảm Tập Yoga Eco Friendly TPE (6mm) được sản xuất bằng chất liệu TPE (Thermoplastic Elastomer) từ cao su tự nhiên – là chất liệu cao cấp nhất để chế tạo thảm tập. Với các ưu điểm: độ đàn hồi cao, khả năng co giãn, kéo giãn và chịu lực tốt, độ bám cao, chịu nước tốt và kháng khuẩn. Vật liệu TPE được gia công theo quy trình ép khuôn bằng nhiệt, không chứa các phụ gia như toxic, latex hay chlorride; hoàn toàn thân thiện với môi trường (tái sử dụng được) và an toàn khi tiếp xúc với da, gần như không mùi sau vài tuần sử dụng. Là một lựa chọn tuyệt vời cho những bạn năng động thích một tấm thảm bền, đẹp và phong cách. Với chất lượng vượt trội, thảm được thiết kế chống trượt và êm ái, dù bạn chuyển động nhẹ nhàng Hatha, năng động trong Vinyasa, mạnh mẽ trong Ashtanga hay đổ mồ hôi nhiều trong Bikram. ",""""""
tiki.vn,https://tiki.vn/hop-cau-long-king-do-ngan-lkdn-6-qua-p394179.html?src=category-page-1975&2hi=1,394179,LHT,Thể thao,Hộp Cầu Lông King Đỏ Ngắn LKDN - 6 Quả,124.000 ₫,LHT,," Hộp Cầu Lông King Đỏ Ngắn LKDN - 6 Quả Hộp Cầu Lông King Đỏ Ngắn LKDN - 6 Quả được sản xuất từ lông gia cầm chất lượng tốt đã qua xử lý bởi công nghệ hiện đại, tạo nên một quả cầu với độ bền cao và độ cứng vừa phải, thích hợp sử dụng cho mọi lứa tuổi. Với trái cầu từ LHT , bạn có thể thỏa sức trình diễn sự khéo léo và kĩ thuật lôi cuốn của mình để khỏe mạnh và có những giờ vận động bổ ích. Hộp 6 quả cầu lông dài từ LHT s ẽ là phụ kiện cần thiết cho môn cầu lông mà bạn yêu thích. Hộp Cầu Lông King Đỏ Ngắn LKDN - 6 Quả Tính năng sản phẩm: - Cánh cầu được làm từ lông gia cầm loại tốt, đã được xử lí theo công nghệ hiện đại, không có mùi hôi, hạn chế bị toe lông và tăng độ bền cho sản phẩm. - Nhờ chất liệu cao cấp và được xử lí theo công nghệ tiên tiến, đường cầu bay sẽ ổn định, tạo các đường đánh nhanh và thẳng, thích hợp cho người mới chơi cầu lông. - Cầu lông là trò chơi vận động dễ dàng, phổ biến, thích hợp với mọi lứa tuổi, giúp chân và tay bạn khỏe mạnh hơn. - Bộ gồm 6 trái cầu cho bạn thoả sức vui chơi cùng bạn bè. Chất lượng tốt cho bạn thỏa sức vui chơi Thông số kỹ thuật: - Hộp gồm: 6 quả - Chất liệu: Lông vịt - Màu: Trắng GIÁ SẢN PHẨM ĐÃ BAO GỒM VAT ",""""""
