Domain,Url,Product_id,Brand,Category,Model,Price,Seller,Tags,Info,Others
tiki.vn,https://tiki.vn/dung-cu-tap-the-duc-da-nang-day-lo-xo-tummy-trimmer-p2073307.html?src=category-page-1975&2hi=0,2073307,OEM,Thể thao,Dụng cụ tập thể dục đa năng dây lò xo Tummy Trimmer,70.000 ₫,mẹ mía,," Dụng cụ tập thể dục Tummy Trimmer đa năng dây lò xo Tập thể dục là cách hiệu quả nhất giúp bạn có được một cơ thể khỏe mạnh và vóc dáng cân đối. Không chỉ thế, việc luyện tập thể dục còn giúp bạn thư giãn, cân bằng cuộc sống sau ngày dài lao động mệt nhọc. Thế nhưng, không phải ai cũng có điều kiện đến các phòng gym đầy đủ tiện nghi và tập theo phương pháp khoa học nhất, chúng tôi mang đến cho bạn cơ hội sở hữu dụng cụ tập thể dục Tummy Trimmer - việc luyện tập thể dục của bạn sẽ trở nên thoải mái và dễ dàng hơn bao giờ hết. Đặc điểm nổi bật của dụng cụ tập thể dục: - Chất liệu nhựa cao cấp, lò xo co giãn chất lượng, có khả năng chịu lực tốt, phù hợp nhiều đối tượng. Dụng cụ kết hợp nhiều bài tập vai, lưng, mông, giúp máu huyết lưu thông, giảm thiểu tình trạng mỏi cơ. - Với bài tập tổng hợp này, bạn sẽ nhanh chóng có được một vóc dáng thon gọn, chắc khỏe như ý. - Thiết kế thông minh của dây tập với vòng chân cố định, giúp bạn yên tâm khi tập luyện. - Kích cỡ dụng cụ khá nhỏ gọn 34x25 (cm) nên bạn có thể tập mọi nơi, kể cả ở những không gian chật hẹp. Dây kéo tập bụng Tummy Trimmer Một số bài tập với dụng cụ tập thể dục tummy Bài luyện tập dành cho cơ vai và mông: ngồi thẳng người hướng chân duỗi thẳng, kéo dụng cụ chủ yếu dựa vào lực cánh tay và chân. Bài tập cơ bản dành cho eo: 1. Ngồi gập người, chân duỗi thẳng về phía trước. Từ từ hạ người về phía sau cho đến khi đầu chạm đến sàn nhà rồi trở lại tư thế ngồi. 2. Nằm thẳng người trên sàn nhà, chân duỗi thẳng hướng lên trần nhà. Giữ lưng thẳng và cố định trên sàn nhà. Dùng tay kéo và hạ từ từ chân xuống (không co khuỷu chân). Các bài tập hỗ trợ giúp bạn nhanh chóng lấy lại vòng eo thon gọn, cơ thể săn chắc. Không chỉ thế, những bài tập tổng hợp này còn giúp bạn xua tan cơn nhức mỏi, lưu thông máu huyết, tăng cường sức khỏe và sự dẻo dai cho cơ thể. Để an toàn khi tập, nên lưu ý: Không được luyện tập ở tư thế đứng. Chỉ luyện tập khi đi giày thể thao đế mềm hay chân trần. Không để các vật trơn, trượt dưới đế chân. Không được kéo giãn dây trên 1m. Nên tham khảo ý kiến bác sĩ trước khi luyện tập. ",""""""
tiki.vn,https://tiki.vn/kinh-boi-phoenix-401-den-tang-kem-bit-tai-p2412419.html?src=category-page-1975&2hi=0,2412419,Phoenix,Thể thao,Kính bơi Phoenix 401(Đen) + Tặng kèm bịt tai,139.000 ₫,Đại Nam Sport,," 1.Thông tin chi tiết kính bơi Phoenix PN 401. - Mã sản phẩm: PN 401. - Hãng sản xuất: Phoenix. - Xuất xứ: Hàn Quốc. - Kính bơi phoenix PN 401 có 2 màu chủ đạo là xanh và đen. - Phoenix là nhà sản xuất uy tín trong lĩnh vực sản xuất đồ bơi trong đó kính bơi là sản phẩm được ưu chuộng nhiều trên thị trường. Với loại kính bơi phoenix này các bạn sẽ dễ dàng sử dụng nhờ vào một số ưu việt sau: + Phần mắt của kính bơi được chế tạo bằng hợp chất polycacbon cực kỳ trong suốt, cho góc nhìn rộng và không gây ảnh hưởng xấu đến thị lực. Mắt kính có khả năng chống tia UV và chống mờ sươngtốt. + Miếng đệm trên mặt và dây đeo đều được cấu tạo bằng chất silicon vừa tạo cảm giác thoải mái và ngăn nước hiệu quả đồng thời giúp cho kính không bị trượt ra bên ngoài khi bơi hay khi lặn. + Vành mũi có thể điều chỉnh để phù hợp với mọi khuôn mặt. + Sản phẩm giúpngười bơi cảm thấy tự tin và thoải máikhi đi bơi. - Kính bơi Phoenix 401 thiết kế phù hợp sử dụng cho cả người lớn và trẻ em. ",""""""
tiki.vn,https://tiki.vn/phao-trai-tim-lht-ptt-mau-ngau-nhien-p1423355.html?src=category-page-1975&2hi=1,1423355,LHT,Thể thao,Phao Trái Tim LHT PTT - Màu Ngẫu Nhiên,79.000 ₫,LHT,," Phao Trái Tim LHT PTT được dùng trong việc tập bơi ban đầu hoặc tập luyện lâu dài với các kiểu bơi như bơi sải, bơi nhái. Phao được sử dụng với các động tác: Tập tay, tập chân (hai tay bám 2 mấu ở cuối). Sản phẩm được làm bằng chất liệu mút xốp cứng cao cấp, dễ dàng sử dụng và vệ sinh sau khi bơi lội. Phao LHT thích hợp cùng với cả trẻ em lẫn người lớn. ",""""""
tiki.vn,https://tiki.vn/ghe-tap-bung-cong-muse-bg-p2405223.html?src=category-page-1975&2hi=1,2405223,BG,Thể thao,Ghế tập bụng cong muse BG,689.000 ₫,BG VIET NAM,," Giới thiệu sản phẩm B&G Ghế tập bụng cong muse màu Ghế tập bụng cong về uy tín và chất lượng. Ghế được làm bằng thép vuông 40,sơn tĩnh điện với kết cấu chắc chắn tải trọng lên tới trên 100kg. Ghế tập cong B&G một sản phẩm tập luyện cơ bụng, lưng đơn giản nhưng hiểu quả ngoài sự mong đợi.Với 15 phút tập luyện mỗi ngày, bạn sẽ có một vòng eo thon như ý,cơ bụng săn chắc,cơ lưng mạnh mẽ,dẽo daiphòng ngừa chứng đau cột sống. Bảo hành : 6tháng. ĐẶC ĐIỂM NỔI BẬT B&G Ghế tập bụng cong muse màu Động tác đơn giản nhưng hiệu quả Chỉ với 15 phút mỗi ngày cùng chế độ ăn hợp lý, bạn sẽ có 1 vòng eo như ý vì ghế lưng cong sẽ tác dụng tích cực đến vùng mỡ bụng; đồng thời giảm stress, giảm nguy cơ thoái hóa cột sống, làm săn chắc vùng đùi, ngực và mông. Thiết kế tiện dụng Ghế tập có thể điều chỉnh độ cao để tạo tác dụng tập trung lên vùng cơ trên và cơ dưới của bụng; đồng thời cũng thật gọn nhẹ, dễ sử dụng, gấp lại và cất gọn mỗi khi không dùng đến. NHỮNG ĐỘNG TÁC GỢI Ý ",""""""
tiki.vn,https://tiki.vn/bo-can-cau-kem-may-khp-winner-2-1m-day-100m-bo-phao-luoi-p606684.html?src=category-page-1975&2hi=1,606684,KHP,Thể thao,Bộ Cần Câu Kèm Máy KHP Winner (2.1m) + Dây (100m) + Bộ Phao Lưỡi - Giao Màu Ngẫu Nhiên,140.000 ₫,Cần câu KHP,," Bộ Cần Câu Kèm Máy KHP Winner (2.1m) + Dây (100m) + Bộ Phao Lưỡi có thiết kế tinh xảo và cuốn hút sẽ giúp cho những buổi đi câu dã ngoại cuối tuần của bạn thêm phần thú vị. Các khoen cần được tạo trên thân cần chắc khỏe, chịu lực tốt. Thân cần được làm từ kim loại cao cấp phối nhựa, tạo cho sản phẩm độ bền cao. Cần câu có 5 chốt, khi kéo dài ra đạt kích thước từ 1.8 - 2.1m. Máy câu với 2 chức năng kéo khác nhau, vòng thu dây và hệ thống điều chỉnh được thiết kế để có thể xoay một cách nhẹ nhàng, có chế độ cân bằng chống rung. Sức chứa dây của máy (Lbs/Yds): 4/250, 5/200, 6/160 (Tương đương 1.8kg/228m, 2.3kg/182.8m, 2.7kg/164m). Cuộn dây cước kèm theo có đường kính dây 0.45mm. ",""""""
tiki.vn,https://tiki.vn/bo-kinh-lan-ong-tho-gopro-popo-snorkel-set-blue-xanh-p854192.html?src=category-page-1975&2hi=1,854192,POPO,Thể thao,Bộ Kính Lặn Ống Thở Gopro POPO Snorkel-Set-Blue - Xanh,288.000 ₫,POPO Collection,," Bộ Kính Lặn Ống Thở Gopro POPO Snorkel-Set-Blue - Xanh hỗ trợ quá trình bơi lặn diễn ra dễ dàng và thuận lợi, được nhiều người yêu thích và tin dùng. Sản phẩm được làm từ chất liệu cao cấp, độ bền cao, được kiểm soát và chứng nhận an toàn và bảo vệ sức khỏe người dùng. Mắt kính cường lực chống trầy xước, giúp bảo vệ mắt và mũi tối ưu đồng thời tạo cảm giác chân thật khi lặn. Dây đeo đầu có nút điều chỉnh độ rộng ở hai bên Ống thở dài, hỗ trợ người dùng khi lặn, không bị sặc hay ngộp nước. ",""""""
tiki.vn,https://tiki.vn/dung-cu-tap-co-bung-da-nang-revoflex-xtreme-hd-851-p559369.html?src=category-page-1975&2hi=1,559369,Sportslink,Thể thao,Dụng Cụ Tập Cơ Bụng Đa Năng Revoflex Xtreme HD-851,199.000 ₫,Sportslink,," Dụng Cụ Tập Cơ Bụng Đa Năng Revoflex Xtreme HD-851 tích hợp nhiều bài tập đa dạng khác nhau, bạn dễ dàng sáng tạo sao cho phù hợp với khả năng và thể trạng của mình. Chất liệu chính là nhựa ABS cao cấp với khả năng chịu lực cao, bền bỉ theo thời gian. Thiết kế hiện đại, trọng lượng nhỏ gọn, thuận tiện mang theo để tập luyện bất cứ lúc nào. Chất liệu chính là nhựa ABS cứng chắc, chịu lực, bền bỉ. Dây đàn hồi được làm từ chất liệu cao su cao cấp, trọng lượng nhẹ. Tay cầm thép bọc lớp mút có thể tháo lắp dễ dàng. Đệm làm từ nhựa EVA êm ái, vững chắc. Dễ dàng sáng tạo nhiều động tác khác nhau để phù hợp cho từng mục đích tập luyện, để không gây nhàm chán và tăng sức mạnh cho hầu hết các nhóm cơ trên cơ thể. Trọng lượng nhỏ gọn, tiện lợi mang theo để tập bất cứ lúc nào và bất cứ nơi đâu. Cách tháo lắp đơn giản, nhanh chóng. Các bài tập kết hợp cho cơ xô, lưng và bụng giúp bạn cải thiện vóc dáng, thu gọn và săn chắc vùng bụng. Phù hợp với mọi thể trạng và giới tính, để các thành viên trong gia đình có thể tập cùng nhau. ",""""""
tiki.vn,https://tiki.vn/quan-the-thao-nam-training-unique-apparel-qlpy-xam-p1532855.html?src=category-page-1975&2hi=1,1532855,Unique Apparel,Thể thao,Quần Thể Thao Nam Training Unique Apparel QLPY - Xám,179.000 ₫,ThethaoUnique,," Quần Thể Thao Nam Training Unique Apparel QLPY trơn 1 màu dễ kết hợp các loại áo phông, áo ba lỗ khi sử dụng. Được thiết kế kiểu dáng thể thao hiện đại, mang lại cho bạn cảm giác thoải mái và dễ chịu khi bạn thực hiện các bài tập thể dục và cũng có thể mặc nhà hoặc đi chơi. Quần nam này được xem là hoàn hảo để tập các bài tập từ đơn giản đến phức tạp, mang đến cho bạn sự thoải mái và linh hoạt hơn trong phòng tập. Quần được thiết kế với tính năng co giãn tốt, vải thấm hút mồ hôi và hỗ trợ tốt trong việc tập gym cũng như các môn thể thao vận động khác như chạy bộ. Hướng dẫn chọn size: S M L XL Cân nặng (kg) 50 - 60 55 - 60 65 - 75 70 - 80 Chiều cao (m) 1.55 - 1.70 1.60 - 1.75 1.65 - 1.80 1.70 - 1.85 ",""""""
tiki.vn,https://tiki.vn/phao-tron-in-hinh-disney-planes-61cm-p433247.html?src=category-page-1975&2hi=1,433247,Tiến Sport,Thể thao,Phao Tròn In Hình Disney Planes (61cm),69.000 ₫,Tiki Trading,," Phao Tròn In Hình Disney Planes (61cm) Phao Tròn In Hình Disney Planes (61cm) là một phụ kiện khi bơi không thể thiếu đối với trẻ đang trong giai đoạn học bơi. Sản phẩm được làm từ chất liệu nhựa mềm, không thấm nước và có độ bền cao. Bề mặt in hình nhân vật trong phim hoạt hình Planes từ Disney vô cùng rõ nét và sinh động. Thông tin sản phẩm Nhựa mềm cho độ bền cao Phao tay được làm từ chất liệu nhựa mềm có khả năng chịu được tác động của không khí khi được bơm căn mà không rách, thủng. Sản phẩm không thấm nước nên có thể dễ dàng làm sạch khi bị bám bẩn. Chất liệu đảm bảo an toàn cho làn da của trẻ nhỏ, không gây kích ứng đáng kể khi bơi. Thiết kế phao tròn phù hợp với trẻ nhỏ Sản phẩm được thiết kế dạng phao tròn với đường kính 61 cm mặt trong láng mịn, mang đến cảm giác thoải mái cho trẻ nhỏ trong khi bơi lội dưới nước. Phần chốt khí của phao chắc chắn, đảm bảo không thoát khí làm xẹp phao cũng như để nước lọt vào bên trong khi bơi. Hình in các nhân vật hoạt hình ngộ nghĩnh Bề mặt của phao là hình in các nhân vật trong bộ phim hoạt hình Planes của hãng Disney với độ sắc nét cao cùng màu sắc sinh động. Sản phẩm phao bơi chắc chắn sẽ khiến cho bé yêu thêm phần hứng thú khi tham gia hoạt động bơi lội, tăng cường sức khoẻ. Dành cho trẻ nhỏ từ 6 tuổi trở lên. ",""""""
tiki.vn,https://tiki.vn/bo-kinh-boi-mat-trang-guong-6615-gom-mu-boi-bit-tai-kep-mui-cao-cap-poki-p2128453.html?src=category-page-1975&2hi=1,2128453,POKI,Thể thao,"Bộ kính bơi mắt tráng GƯƠNG 6615 - gồm Mũ bơi, Bịt tai kẹp mũi cao cấp - POKI",259.000 ₫,POKI,," Kính bơi thời trang MẮT TRONG cho tầm nhìn rộng và hình ảnh rõ nét. Tròng kính được làm từ chất liệu polycarbonate trong suốt, nhẹ, bền giúp người bơi quan sát rõ khi ở dưới nước. Mắt kính trong giúp nhìn rõ hơn khi sử dụng ở bể bơi trong nhà. Dây đeo đầu có nút điều chỉnh độ rộng ở hai bên giúp bé dễ dàng thao tác. Mũ bơi được làm băng 100% chất liệu silicone cao cấp. Bịt tai kẹp mũi cao cấp. ",""""""
tiki.vn,https://tiki.vn/leu-2-nguoi-tetragon-2ex-le03-mau-ngau-nhien-p452007.html?src=category-page-1975&2hi=1,452007,Lều Việt,Thể thao,Lều 2 Người Tetragon 2EX- LE03 - Màu Ngẫu Nhiên,749.000 ₫,Tiki Trading,," Lều 2 Người Tetragon 2EX- LE03 Lều 2 Người Tetragon 2EX- LE03 với thiết kế 2 lớp thì bạn sẽ được giữ ấm hơn, đặc biệt với hoàn cảnh phải cắm lều ngủ giữa rừng, trên núi cao, hay ngoài bãi biển, thì lều 2 lớp là một sự lựa chọn lý tưởng. Bạn chỉ cần bước vào trong lều, sau đó kéo khóa cửa lại kín đáo, và bạn sẽ có một buổi tối ấm áp trong rừng, hoặc bãi biển khi đi du lịch cùng bạn bè, người thân. Sản phẩm có kích thước 210*135+50*115 cm, phù hợp sử dụng cho 2 người. Các tính năng nổi bật - Thiết kế đặc biệt với 2 lớp, bảo vệ bạn và những người bạn đồng hành khỏi bị muỗi và côn trùng khác đốt. - Kích thước phù hợp sử dụng cho 2 người - Thiết kế gọn nhẹ, lều có thể xếp lại gọn gàng, cho vào trong túi nhỏ, thuận tiện mang theo khi đi du lịch, dã ngoại, picnic,… - Kiểu dáng trẻ trung, màu xanh dương đẹp mắt. - Làm bằng chất liệu vải dù, nhẹ, chống thấm nước tốt. - Sản phẩm có khung được làm bằng thép chắc chắn, giúp lều đứng vững, nên bạn có thể yên tâm khi sử dụng. - Gọng lều bằng sợi cacbon nhẹ rất bền bỉ, có thể dựng trên sàn bê tông, đất, cát mà không cần căng dây. - Lều sử dụng khóa kéo thuận tiện. - Những đường may tỉ mỉ và khéo léo, sẽ giúp kéo dài thêm tuổi thọ cho sản phẩm. - Trang bị túi đựng lều tiện lợi. Thông số kỹ thuật - Sản xuất tại Việt Nam - Kích thước: 210*135+50*115 cm - Chất liệu: Vải Dù - Màu: Xanh Dương Mô tả tính năng Lều 2 lớp chống muỗi và côn trùng tốt hơn - Lều Tetragon 2EX- LE03 thiết kế đặc biệt với 2 lớp, bảo vệ bạn và những người bạn đồng hành khỏi bị muỗi và côn trùng khác đốt. - Thiết kế 2 lớp thì bạn sẽ được giữ ấm hơn, đặc biệt với hoàn cảnh phải cắm lều ngủ giữa rừng, trên núi cao, hay ngoài bãi biển, thì lều 2 lớp là một sự lựa chọn lý tưởng. Bạn chỉ cần bước vào trong lều, sau đó kéo khóa cửa lại kín đáo, và bạn sẽ có một buổi tối ấm áp trong rừng, hoặc bãi biển khi đi du lịch cùng bạn bè, người thân. - Ngoài ra, với khoảng trống 50 cm trước cửa lều thì bạn có thể để vật dụng cá nhân bên ngoài, và toàn bộ không gian bên trong sử dụng để ngủ thật rộng rãi, thoải mái. Lều sử dụng phù hợp cho 2 người Lều Tetragon 2EX- LE03 có kích thước 210*135+50*115 cm, phù hợp sử dụng cho 2 người. Thiết kế thông minh, chắc chắn - Lều Tetragon 2EX- LE03 có khung lều có thể gấp lại linh hoạt, nên bạn có thể xếp lều gọn gàng, cho vào túi nhỏ và bạn có thể mang theo lều đi khắp nơi không sợ nắng mưa. - Lều được làm bằng chất liệu vải dù, vô cùng gọn nhẹ, siêu bền, và khả năng chống thấm nước tốt, bạn có thể mang theo khi đi du lịch, dã ngoại, picnic,.. để sử dụng rất tiện lợi. - Sản phẩm có khung được làm bằng thép chắc chắn, giúp lều đứng vững, nên bạn có thể yên tâm khi sử dụng. - Gọng lều bằng sợi cacbon nhẹ rất bền bỉ, có thể dựng trên sàn bê tông, đất, cát mà không cần căng dây. Thiết kế tiện dụng, kiểu dáng trẻ trung - Sử dụng khóa kéo thuận tiện. - Những đường may tỉ mỉ và khéo léo, sẽ giúp kéo dài thêm tuổi thọ cho sản phẩm. - Kiểu dáng trẻ trung, màu xanh dương đẹp mắt. - Sản phẩm trang bị túi đựng lều tiện lợi. ",""""""
tiki.vn,https://tiki.vn/bang-mo-hoi-tay-dai-ash-xam-p423867.html?src=category-page-1975&2hi=1,423867,Tiến Sport,Thể thao,Băng Mồ Hôi Tay Dài ASH - Xám,99.000 ₫,Tiki Trading,," Băng Mồ Hôi Tay Dài ASH *Sản phẩm có nhiều màu: Tiki sẽ giao ngẫu nhiên khi khách đặt nhé* Băng Mồ Hôi Tay Dài ASH được làm từ chất liệu vải tổng hợp với khả năng thấm hút cao, giúp giữ cho phần tay của bạn khô thoáng trong các hoạt động thể dục thể thao. Băng có khả năng co giãn phù hợp với mọi kích cỡ cổ tay, mang đến sự thoải mái và linh động cho của người dùng. Sản phẩm có thể được làm sạch một cách nhanh chóng sau mỗi lần sử dụng. Thông tin sản phẩm Chất liệu vải tổng hợp cao cấp Băng tay được làm từ chất liệu vải tổng hợp gồm 90% cotton và 10% lycra, mang đến độ bền và thấm hút cao. Chất liệu êm ái, không tạo cảm giác khó chịu cho người dùng khi đeo trên tay. Thiết kế băng quấn tay tiện dụng Sản phẩm có thiết kế băng quấn tay, giúp hạn chế mồ hôi do tay tiết ra lan xuống phần bàn tay gây trơn trượt khi cầm nắm vật dụng. Sản phẩm đặc biệt phù hợp cho người dùng tham gia các bộ môn thể thao thể dục. Sắc xám mạnh mẽ cùng logo thêu sang trọng Sản phẩm có tông màu xám đặc trưng, đem đến cái nhìn mạnh mẽ và sạch sẽ khi dùng. Bề mặt của băng được thêu logo màu đỏ, bền chắc và không bay màu khi giặt. ",""""""
tiki.vn,https://tiki.vn/hop-2-doi-nut-bit-tai-pillow-soft-mack-s-6-p977099.html?src=category-page-1975&2hi=1,977099,Mack's,Thể thao,Hộp 2 Đôi Nút Bịt Tai Pillow Soft® Mack's #6,109.000 ₫,Mack's Viet Nam,," Hộp 2 Đôi Nút Bịt Tai Pillow Soft® Mack's #6 được sản xuất tại Mỹ, và đang là sản phẩm nút bịt tai bán chạy nhất làm từ Silicon tại thị trường Mỹ Tính chất độc đáo của Silicon, biến đổi hình dạng giúp sản phẩm vừa với ống tai của mọi kích cỡ tai, và đem lại sự thoải mái nhất cho ống tai Thương hiệu số 1 được các bác sỹ khuyên dùng để có giấc ngủ sâu, và yên tĩnh đặc biệt khi bạn ngủ cùng với những người hay ngáy Thương hiệu số 1 được bác sỹ khuyên dùng cho các vận động viên bơi lội để tránh khỏi các tác động xấu với tai Vừa hơn, và thoải mái hơn, khít hơn so với các loại nút tai thông thường Cách ly ống tai khỏi nước với chất liệu không độc hại, không dị ứng Sử dụng tốt cho bơi, tắm, ngủ, học, sự kiện ồn ào, hay đi máy bay Chỉ số đo mức độ giảm tiếng ồn (NRR) – 22 dB ",""""""
tiki.vn,https://tiki.vn/combo-xa-don-treo-tuong-2018-gang-tay-tap-xa-don-kt-80cm-130cm-p3707879.html?src=category-page-1975&2hi=0,3707879,Đại Nam Sport,Thể thao,Combo xà đơn treo tường 2018 + Găng tay tập xà đơn (KT 80cm-130cm),239.000 ₫,Đại Nam Sport,," 1.Các thông số kỹ thuật của xà đơn treo tường 2018. - Mã sản phẩm: XD80-130. - Chất liệu: Thép inox 201. - Dày: 2.11mm. - Chiều rộng lắp: 90cm-120cm. - Kèm theo 1 găng tay tập xà đơn. 2.Cấu tạo của xà đơn treo tường 2018 thế hệ mới. - Xà đơn treo tường 2018 được thiết kế với thân xà được đúc nguyên khối bằng thép chịu lực cao,chống gỉ với độ dày ống thép lên tới 2,11mm. - Mút cầm tay được cải tiến với độ dày cực cao,độ bền cao,thấm hút mồ hôi,có độ êm ái tốt.Cấu tạo lên tới 3 lớp. - 2 đầu silicon chịu lực cũng được cải tiến thành hình lục giác,nhằm gia tăng độ bám hút với bề mặt lắp.Ngoài ra độ dày của mút silicon cũng được tăng lên gấp đôi so với các loại xà đơn treo tường đang có trên thị trường. - Điểm nhấn của sản phẩm thế hệ mới này chính là tích hợp thêm khoá chống xoay,tạo độ an toàn tuyệt đối cho người sử dụng. 3.Cách lắp xà đơn treo tường 2018 không cần bắt vít. - Đầu tiên bạn phải đo chính xác chiều rộng vị trí cần lắp,sau đó lựa chọn kích thước xà đơn treo tường gắn cửa phù hợp. - Xà đơn treo tường 2018 có 2 kích thước như sau: + Kích thước điều chỉnh từ 60cm-110cm,lắp cho chiều rộng từ 60cm-90cm. + Kích thước điều chỉnh từ 80cm-130cm,lắp cho chiều rộng từ 90cm-120cm. - Tiếp theo xoay 2 đầu ra ra bằng nhau cho tới khi 2 mặt cao su dính vào 2 bề mặt lắp,dùng 1 tay giữa đầu xà,còn tay kia vặn ở giữa thân xà ngược chiều với chiều vặn 2 đầu xà ban đầu.Vặn cho tới khi thật chặt. - Cuối cùng là vặn chốt an toàn 2 đầu xà lại thật chắc chắn. 4.Hình ảnh găng tay tập xà đơn và tập gym. ",""""""
tiki.vn,https://tiki.vn/bang-mo-hoi-tay-ngan-ash-mau-ngau-nhien-p427105.html?src=category-page-1975&2hi=1,427105,Tiến Sport,Thể thao,Băng mồ hôi tay ngắn ASH (Màu Ngẫu Nhiên),99.000 ₫,Tiki Trading,," Băng mồ hôi tay ngắn ASH Băng mồ hôi tay ngắn ASH giúp cho vùng cổ tay, bàn tay của người dùng luôn khô thoáng trong quá trình lao động nặng, chơi thể thao với cường độ cao. Sản phẩm được làm từ chất liệu vải tổng hợp cao cấp thấm hút tốt và có độ bền cao. Thiết kế dạng quấn tay tiện lợi, dễ dàng làm sạch sau mỗi lần sử dụng. Thông tin sản phẩm Chất liệu vải tổng hợp cao cấp Băng tay được làm từ chất liệu vải tổng hợp gồm 90% cotton và 10% lycra, mang đến độ bền và thấm hút cao. Chất liệu êm ái, không tạo cảm giác khó chịu cho người dùng khi đeo trên tay. Sản phẩm có thể được làm sạch dễ dàng bằng máy hay giặt bằng tay. Thiết kế băng quấn tay tiện dụng Sản phẩm có thiết kế băng quấn tay, giúp hạn chế mồ hôi do tay tiết ra lan xuống phần bàn tay gây trơn trượt khi cầm nắm vật dụng. Sản phẩm đặc biệt phù hợp cho người dùng tham gia các bộ môn thể thao thể dục. Sắc màu mạnh mẽ, tinh tế với hoa văn thêu Sản phẩm được nhuộm màu sắc mạnh mẽ, bền đẹp và không bị ra màu khi làm sạch. Bề mặt của sản phẩm còn có thêu tên thương hiệu, sắc nét và tinh tế, mang đến sự cá tính cho người dùng. Sản phẩm có nhiều màu sắc khác nhau và sẽ được giao ngẫu nhiên đến tay người dùng. ",""""""
