Domain,Url,Product_id,Brand,Category,Model,Price,Seller,Tags,Info,Others
tiki.vn,https://tiki.vn/tham-tap-yoga-tpe-1-lop-8mm-tim-tang-tui-dung-tham-va-day-buoc-tham-p2463173.html?src=category-page-1975&2hi=0,2463173,Đại Nam Sport,Thể thao,Thảm tập yoga TPE 1 lớp 8mm (Tím) + Tặng túi đựng thảm và dây buộc thảm,299.000 ₫,Đại Nam Sport,," 1.Thông số kỹ thuật thảm tập yoga TPE cao cấp 1 lớp 8mm. - Xuất xứ: Đài Loan. - Độ dày: 8mm - Kích thước thảm yoga: (Dài x Rộng x Dày) 183 x 61 x 0.8 (cm) - Trọng lượng: 1.2 kg. - Chất liệu chính: Chất liệu TPE + CT (Polyester + Cotton). - Màu sắc: Tím. 2.Đặc điểm nổi bật của thảm tập yoga TPE 1 lớp 8mm cao cấp Đài Loan. Màu sắc trang nhã. - Với tông màu tím nhạt tươi tắn khoẻ mạnh,tạo cho bạn một động lực để rèn luyện và tập luyện mỗi ngày. Chất liệu Polyester & Cotton cao cấp. - Chất liệu Polyester & Cotton có nhiều ưu thế hơn các loại thảm khác bởi khả năng hút ẩm,hấp thụ hơi ẩm từ mồ hôi và môi trường cực kì tốt.Đặc biệt là khả năng chống bụi bẩn rất hiệu quả. - Đặc biệt chất liệu Polyester & Cotton không bị nhăn khi giặt hoặc vệ sinh,chống kéo dãn cực kì tốt. Độ bám cao,chống trơn trượt. - Thảm có độ bám rất tốt,giảm tối thiểu trường hợp bị dịch chuyển hay trượt nền trong quá trình tập luyện.Mang lại cảm giác an toàn và thoải mái cho người sử dụng. Tiện lợi,dễ dàng vệ sinh. - Sau khi tập xong bạn có thể cuộn tròn thất dễ dàng và tiện lợi để bảo quản hoặc vận chuyển đi lại tới nơi tập luyện. - Sản phẩm làm từ chất liệu polyester nên những khi cảm thấy thảm đã dơ bẩn cần được vệ sinh thì bạn có thể thoải mái lau chùi hoặc chọn cách giặt bằng tay thông thường mà không lo ảnh hưởng tới chất liệu của thảm tập yoga . ",""""""
tiki.vn,https://tiki.vn/day-dan-hoi-tap-the-luc-20-60lb-den-p1762815.html?src=category-page-1975&2hi=0,1762815,Đại Việt Sport,Thể thao,Dây Đàn Hồi Tập Thể Lực 20-60LB Đen,220.000 ₫,Daiviet Sport,," Dây đàn hồi tập thể lực 20-60LB được sử dụng nhiều với các bài tập cardio, luyện sức bền hay thể lực. Kích thước: rộng 2.2cm, dày 0.5. Chu vi 208 cm Lực đàn hồi mà dây cung cấp 20-60LB. Chất liệu được làm từ cao su cao cấp có độ đàn hồi cao và siêu bền. Thích hợp cho nữ giới và nam giới hay những vẫn động chuyên nghiệp luyện tập. Tập thể dục với dây đàn hồi làm nhóm cơ trở nên săn chắc hơn, phù hợp nhất với các bài tập mông, bụng eo. Tác dụng của dây mang lại là loại bỏ lượng mỡ dư thừa ngay khi bạn tập luyện Các bài tập với dây đàn hồi tập thể lực 20- 60Lb: Tập mông với động tác nằm sấp chống tay duỗi thẳng chân đá ra sau. Tập mông với động tác nằm nghiêng, chân trên duỗi thẳng đá ngang. Tập chân với động tác nằm nghiêng, chân trên duỗi thẳng đá ra sau. Tập mông với động tác nằm sấp, siết mông căng dây ngang vai nâng lên trên. ",""""""
tiki.vn,https://tiki.vn/banh-tap-65-tron-65cm-p128969.html?src=category-page-1975&2hi=1,128969,Tiến Sport,Thể thao,Banh Tập Trơn (65cm),149.000 ₫,Tiki Trading,," Banh Tập Trơn (65cm) Banh Tập Trơn (65cm) được làm từ chất liệu cao su tốt, có khả năng chịu được lực tác động lớn mà không biến dạng hay bể khi được bơm căng. Sản phẩm phù hợp để sử dụng khi luyện tập thể hình, yoga,,… giúp cho người dùng có thể tập các động tác khó một cách dễ dàng. Sản phẩm có tông màu tươi sáng, bắt mắt đồng thời có thể dễ dàng làm sạch khi bị bám bẩn. Thông tin sản phẩm Chất liệu cao su tốt, chắc chắn và bền bỉ Với chất liệu cao su tốt, banh tập có độ bền cao, chịu được tác động của lực mà không xáy ra tình trạng giãn, rách hay bể khi bơm căng để sử dụng. Chất liệu láng mịn, không gây khó chịu cho người dùng, đồng thời có thể làm sạch một cách nhanh chóng sau mỗi lần sử dụng. Thiết kế dạng cầu tròn với dụng cụ bơm tiện ích Banh tập được thiết kế với dạng cầu tròn, có thể bơm và xả hơi một cách tuỳ ý. Đi kèm với banh là dụng cụ bơm hơi hai đầu tiện ích, giúp cho người dùng có thể nhanh chóng chuẩn bị banh để tập luyện mà không phải tốn quá nhiều công sức. Phù hợp để rèn luyện sức khoẻ Sản phẩm phù hợp để sử dụng trong mục đích rèn luyện sự dẻo dai của cơ thể. Người dùng có thể tập được những độc tác khó trong yoga, thể dục thể hình một cách dễ dàng với sự trợ lực của banh tập. Banh có thể được sử dụng tại nhà, nơi làm việc, phòng tập,… đều phù hợp. ",""""""
tiki.vn,https://tiki.vn/kinh-boi-chong-tia-uv-popo-m2360-xanh-bien-p880784.html?src=category-page-1975&2hi=1,880784,POPO,Thể thao,Kính Bơi Chống Tia UV POPO M2360 - Xanh Biển,179.000 ₫,POPO Collection,," Kính Bơi Chống Tia UV POPO M2360 - Xanh Biển hỗ trợ thực hiện các động tác và kỹ thuật bơi tốt hơn đồng thời đem đến trải nghiệm chân thật. Kính bơi được thiết kế thông minh, chống nước ôm trọn cả 2 mắt đảm bảo người đeo không bị đau nơi sống mũi. Sản phẩm phù hơp cho người lớn và trẻ em trên 6 tuổi Mắt kính bơi của POPO Collection được làm từ chất liệu polycarbonate trong suốt, nhẹ, bền giúp người bơi quan sát rõ khi ở dưới nước. Mắt kính được tráng gương, chống lóa, chống tia UV, chống sương mờ qua bài kiểm tra chống sương mờ. Thiết kế khóa bấm, dễ dàng điều chỉnh, không còn nỗi lo kẹp tóc. ",""""""
tiki.vn,https://tiki.vn/ao-tap-nam-anta-85829169-3-xam-p3104583.html?src=category-page-1975&2hi=0,3104583,ANTA,Thể thao,Áo Tập Nam Anta 85829169-3 - Xám,189.500 ₫,,," Áo Tập Nam Anta 85829169-3 - Xám là trang phục giúp các chàng trai làm mới phong cách của chính mình. Kiểu dáng đơn giản, trẻ trung thích hợp cho mọi lứa tuổi. Chất lượng đến từng đường kim kẻ chỉ. Thấm hút mồ hôi tốt cho bạn hoạt động và làm việc cả ngày mà không bận tâm gì cả. Áo luôn được đánh giá là mẫu trang phục mang tính ứng dụng cao, có thể kết hợp cùng các cùng quần jeans dài, quần âu khi đi làm, đi chơi. Hoặc phối cùng quần short đơn giản khi dạo phố, du lịch,… Bạn có thể diện áo cùng các phụ kiện giày, dép đa dạng để thêm tự tin khẳng định gu thời trang trẻ trung, khỏe khoắn của chính mình. Hướng dẫn chọn size: Size XS S M L XL XXL Chiều dài áo / Vòng ngực 160/80A 165/84A 170/88A 175/92A 180/96A 185/100A Chiều dài quần / Vòng eo 160/68A 165/72A 170/76A 175/80A 180/84A 185/88A ",""""""
tiki.vn,https://tiki.vn/kinh-boi-tam-nhin-180-do-chong-suong-mo-popo-big-frame-red-do-p855298.html?src=category-page-1975&2hi=0,855298,POPO,Thể thao,Kính Bơi Tầm Nhìn 180 Độ Chống Sương Mờ POPO Big Frame Red - Đỏ,179.000 ₫,POPO Collection,," Kính Bơi Tầm Nhìn 180 Độ Chống Sương Mờ POPO Big Frame Red - Đỏ hỗ trợ thực hiện các động tác và kỹ thuật bơi tốt hơn đồng thời đem đến trải nghiệm chân thật. Mắt kính làm từ polycarbonate trong suốt, tráng gương, độ bền cao, nhẹ. Các góc cạnh được xử lý cẩn thận, tỉ mỉ, chắc chắn, bảo vệ sức khỏe người dùng. Kính bơi có tầm nhìn 180 độ, chống sương mờ cho phép bạn quan sát dễ dàng khi bơi. Thết kế viền silicone ôm trọn cả 2 mắt đảm bảo người đeo không bị đau nơi sống mũi. ",""""""
tiki.vn,https://tiki.vn/na-cao-su-hop-kim-sieu-chuan-xanh-p3606577.html?src=category-page-1975&2hi=1,3606577,OEM,Thể thao,Ná Cao Su Hợp Kim Siêu Chuẩn (Xanh),120.000 ₫,BIG WORLD STORE,, ,""""""
tiki.vn,https://tiki.vn/bong-don-mat-xa-mdbuddy-md1258-p3332451.html?src=category-page-1975&2hi=0,3332451,MDBuddy,Thể thao,Bóng đơn mát xa MDBuddy MD1258,99.000 ₫,MDBuddy Việt Nam,," BÓNG ĐƠN MÁT XA MDBuddy MD1258 I. LỢI ÍCH SẢN PHẨM Bóng đơn mát xa MDBuddy MD1258 là sản phẩm thông dụng để massage nhỏ gọn nhưng chất lượng. Có thể vừa giải trí căng thẳng đầu óc vừa thư giãn cơ thể chỉ với 1 di chuyển nhỏ bằng cách lăn bóng. Thử tưởng tượng bạn đang mệt mỏi giữa giờ nghỉ ngắn ngủi của cuộc họp, chỉ cần lấy quả bóng từ trong túi ra và lăn nhẹ trên đùi, chân, vai,... xua tan ê ẩm và nhức mỏi, sảng khoái tinh thần. Sản phẩm cũng phù hợp với người đang phục hồi sau chấn thương, luyện tập các bài cầm nắm, lăn bóng tăng sức mạnh đôi tay II. ĐẶC ĐIỂM NỔI BẬT Chất liệu cao su nhiệt dẻo TPR Chất liệu cao su nhiệt dẻo TPR, cầm rất chắc tay, chuyển động thư giãn cơ tuyệt vời Sản phẩm nhỏ gọn, bắt mắt Trọng lượng 200g, kích thước nằm gọn trong lòng bàn tay vô cùng thuận tiện Màu sắc: Màu cam tươi trẻ, khỏe khoắn, bắt mắt Hiệu quả của sản phẩm Giúp lưu thông máu, giải tỏa tình trạng ê mỏi do đặc thù công việc ngồi lâu hay phải đứng lâu, lao động nặng III. HƯỚNG DẪN SỬ DỤNG Đặt sản phẩm trên cơ thể. Dùng tay lăn thật mạnh, dứt khoát Thực hiện động tác liên tục từ 10-20 phút ",""""""
tiki.vn,https://tiki.vn/phao-tron-in-hinh-hello-kitty-61cm-p433246.html?src=category-page-1975&2hi=1,433246,Tiến Sport,Thể thao,Phao Tròn In Hình Hello Kitty (61cm),69.000 ₫,Tiki Trading,," Phao Tròn In Hình Hello Kitty (61cm) Phao Tròn In Hình Hello Kitty (61cm) sẽ giúp cho trẻ nhỏ vui đùa một cách thích thú dưới nước trong những ngày hè nóng bức. Sản phẩm được làm từ chất liệu nhựa mềm chống nước, có thể bơm căng mà không lơ rách hay biến dạng. Hình in Hello Kitty là một điểm nhấn nổi bật của sản phẩm, chắc chắn sẽ khiến cho con trẻ thêm phần hứng thú khi bơi. Thông tin sản phẩm Nhựa mềm cho độ bền cao Phao tay được làm từ chất liệu nhựa mềm có khả năng chịu được tác động của không khí khi được bơm căn mà không rách, thủng. Sản phẩm không thấm nước nên có thể dễ dàng làm sạch khi bị bám bẩn. Chất liệu đảm bảo an toàn cho làn da của trẻ nhỏ, không gây kích ứng đáng kể khi bơi. Thiết kế phao tròn phù hợp với trẻ nhỏ Sản phẩm được thiết kế dạng phao tròn với đường kính 61 cm mặt trong láng mịn, mang đến cảm giác thoải mái cho trẻ nhỏ trong khi bơi lội dưới nước. Phần chốt khí của phao chắc chắn, đảm bảo không thoát khí làm xẹp phao cũng như để nước lọt vào bên trong khi bơi. Hình in Hello Kitty đáng yêu Bề mặt của phao là hình in cô mèo Hello Kitty đáng yêu cùng các chi tiết trang trí hoa nhiều màu sắc vô cùng đáng yêu. Sản phẩm phao bơi chắc chắn sẽ khiến cho bé yêu thêm phần hứng thú khi tham gia hoạt động bơi lội, tăng cường sức khoẻ. Dành cho trẻ nhỏ từ 6 tuổi trở lên. ",""""""
tiki.vn,https://tiki.vn/kinh-boi-can-8-0-do-chong-uv-popo-gog-myopia-8-0-p855004.html?src=category-page-1975&2hi=1,855004,POPO,Thể thao,Kính Bơi Cận 8.0 Độ Chống UV POPO Gog-Myopia-8.0,189.000 ₫,POPO Collection,," Kính Bơi Cận 8.0 Độ Chống UV POPO Gog-Myopia-8.0 giúp người bị cận đi bơi dễ dàng, thoải mái, bảo vệ đôi mắt tối ưu, dành cho người lớn và trẻ em trên 8 tuổi. Bộ sản phẩm đầy đủ gồm 01 kính bơi và 01 hộp nhựa đựng kính bơi cao cấp . Kính bơi được đảm kiểm soát chất lượng chặt chẽ theo tiêu chuẩn châu Âu với chứng nhận CE. Tròng kính được làm từ polycarbonate trong suốt, nhẹ, bền giúp người bơi quan sát rõ khi ở dưới nước. Thiết kế thể thao, trẻ trung và năng động, các góc cạnh được xử lý cẩn thận, an toàn trong quá trình sử dụng. Kính bơi cận 8.0 độ, góc nhìn rộng, chống xước, chống tia UV, chống lóa, chống mờ sương hiệu quả. Dây đeo, viền mắt kính được làm bằng chất liệu silicone cao cấp Dây đeo có nút điều chỉnh độ rộng ở hai bên, giúp kính ôm sát, cho trải nghiệm chân thật hơn. Khóa thiết kế thông minh giúp đeo kính và tháo kính dễ dàng trong 3 bước. Hướng dẫn chọn kính bơi với mắt cận Khi mua kính bơi cận nên chọn kính có độ cận nhỏ hơn độ cận thực tế là 0.5 hoặc vừa bằng độ thực. Tuyệt đối không được đeo kính bơi cận quá độ sẽ gây chóng mặt, cực kì nguy hiểm khi bơi. Công thức: Độ cận kính bơi = độ cận thị + độ loạn thị/2. Ví dụ: Nếu mắt trái của bạn có độ cận – 2,5 và độ loạn +0, khi đó bạn nên chọn loại kính bơi có độ cận = -2,5 + 0/2 = -2,5 độ cận. Ví dụ: Nếu mắt phải của bạn có độ cận – 3,0 và độ loạn +1, khi đó bạn nên chọn loại kính bơi có độ cận = -3,0 + 1/2 = -2,5 độ cận. ",""""""
tiki.vn,https://tiki.vn/quan-ao-the-thao-monica-bo-lung-den-vien-trang-gy-2028-p630624.html?src=category-page-1975&2hi=1,630624,Monica,Thể thao,Quần Áo Thể Thao Monica Bộ Lửng Đen Viền Trắng GY 2028,290.000 ₫,ALITA,," Quần Áo Thể Thao Monica Bộ Lửng Đen Viền Trắng GY 2028 giúp các bạn nữ tôn lên đường cong hiệu quả nhờ vào thiết kế trẻ trung,vừa kín đáo nhưng cũng vừa gợi cảm, khoe khéo đôi chân thon dài. Nhờ vào thiết kế tinh tế và màu sắc nổi bật, bộ quần áo thể thao Monica giúp các bạn nữ toát lên hơi thở của tuổi trẻ và là trợ thủ đắc lực trong những hoạt động thể thao, thể hình. Chất liệu thun cao cấp nhập từ Hàn Quốc, độ co giãn và đàn hồi tốt để bạn linh hoạt và thoải mái khi vận động. Dễ giặt, nhanh khô, tiết kiệm nhiều thời gian giặt giũ. Có thể mặc khi tham gia nhiều môn thể thao khác nhau như: chạy bộ, tập gym, yoga.. Hướng dẫn chọn Size: ",""""""
tiki.vn,https://tiki.vn/bop-tay-go-thanh-xuan-sport-tx-dc441131-p684737.html?src=category-page-1975&2hi=1,684737,Thanh Xuân Sport,Thể thao,Bóp Tay Gỗ Thanh Xuân Sport TX-DC441131,49.000 ₫,Tiki Trading,," Bóp Tay Gỗ Thanh Xuân Sport TX-DC441131 chuyên dùng cho các bạn àm việc văn phòng sử dụng máy tính thường xuyên, giúp bạn giải trí, tăng cường sức khỏe trong quá trình làm việc. Tiện lợi, gọn nhẹ, dễ dàng sử dụng ở bất kỳ đâu: trong văn phòng, trên xe, ở nhà, đi du lịch... Giúp giảm mệt mỏi nhanh chóng Quay lại làm việc sảng khoái và hiệu quả Thiết kế nhỏ gọn vừa vặn Lõi thép, cán gỗ cao cấp chống trơn, chống thấm mồ hôi ",""""""
tiki.vn,https://tiki.vn/con-lan-tap-co-bung-2-banh-roller-push-up-p3335739.html?src=category-page-1975&2hi=0,3335739,OEM,Thể thao,Con Lăn Tập Cơ Bụng 2 Bánh Roller Push Up,95.900 ₫,Thiên đường mua sắm,," Con Lăn Tập Cơ Bụng 2 Bánh Roller Push Up Con lăn tập cơ bụng tại nhà đang được rất nhiều người lựa chọn để tạp luyện, bởi tính tiện ích sản phẩm rất cao từ việc tiết kiệm chi phí, chủ động trong thời gian và cũng không kén chọn không gian. Trong số đó có sản phẩm Con lăn tập cơ bụng là dụng cụ đang được rất nhiều khách hàng ưa chuộng và tìm kiếm Con lăn tập cơ bụng hiệu quả tác động đến cơ thể bạn nhanh chóng với phương pháp đốt cháy lượng mỡ dư thừa trong cơ thể bạn và ngăn chặn sự phát triển của các tế bào mỡ mới từ đó sẽ giúp cho cơ thể bạn trở lên săn chắc, không còn bị chảy xệ. Thông tin về sản phẩm Máy Tập Cơ Bụng 2 bánh tặng kèm thảm : Chất liệu: nhựa ABS, inox Bộ sản phẩm bao gồm: 1 trục inox, 2 bánh xe, 2 tay cầm. Màu sắc: Xanh kết hợp đen, đen toàn bộ Sản phẩm: Đường kính bánh xe 16cm, chiều dài trục inox 25cm, Bao bì: 20 x 11 x 22cm Trọng lượng: 800g ",""""""
tiki.vn,https://tiki.vn/bo-ta-deo-chan-7-thanh-sportslink-4-3kg-p602804.html?src=category-page-1975&2hi=1,602804,Sportslink,Thể thao,Bộ Tạ Đeo Chân 7 Thanh Sportslink (4.3kg),199.000 ₫,Sportslink,," Bộ Tạ Đeo Chân 7 Thanh Sportslink (4.3kg) dùng để rèn luyện thể dục thể thao, tăng cường sức chịu đựng của đôi chân. Tạ đeo chân 7 thanh trọng lượng 4.3kg/đôi, mỗi bên nặng 2.15kg, bạn có thể tháo rời từng thanh, để giảm trọng lượng phù hợp với người tập. Tạ đeo chân dùng cho tập luyện thể dục thể thao, tập bắp chân, cơ đùi. Mục đích: dùng để rèn luyện thể dục thể thao, tăng cường sức chịu được của đôi chân. ",""""""
tiki.vn,https://tiki.vn/dao-xep-da-nang-victorinox-huntsman-1-3713-t7-p472432.html?src=category-page-1975&2hi=0,472432,Victorinox,Thể thao,Dao Xếp Đa Năng Victorinox -  Huntsman 1.3713.T7,1.500.000 ₫,Tiki Trading,," Dao Xếp Đa Năng Victorinox - Huntsman 1.3713.T7 Dao Xếp Đa Năng Victorinox - Huntsman 1.3713.T7 với kích thước chiều dài sau khi gấp gọn chỉ có 91 mm tạo cho bạn một sự trải nghiệm tuyệt vời. Sản phẩm phù hợp cho những bạn hay di chuyển xa nhưng ngại mang theo đồ đạc linh tinh. Tiện lợi hơn nữa là sản phẩm có một chiếc khoen chìa khoá để bạn có thể móc vào, tránh thất thoát hoặc khó tìm giữa đống đồ đạc lớn. Chiếc dao xếp này là một sự tích hợp 15 chức năng chỉ trong 1, nên vô cùng tiện dụng. Chất liệu dụng cụ Thép không gỉ - cung cấp cho sản phẩm một độ bền hoàn hảo và rất linh hoạt trong quá trình sử dụng, không dễ bị xước, mẻ. Kích thước : 91 mm Thiết kế đẹp mắt tiện dụng: Sản phẩm với nhiều món nhỏ bên trong nhưng vẫn được thiết kế khéo léo và đẹp mắt, mang đến sự cá tính và thời trang. Đây không còn là một chiếc dao đa năng thông thường mà còn như một món đồ trang trí đẳng cấp mang thương hiệu Victorinox. Sản phẩm bao gồm: 1. Dao lớn 2. Dao nhỏ 3. Đồ khui nút bần 4. Dụng cụ mở lon 5. Tuốt nơ vít nhỏ 6. Dụng cụ mở chai 7. Tuốt nơ vít 8. Tuốt dây điện 9. Đồ đục lỗ 10. Khoen chìa khoá 11. Nhíp 12. Tăm 13. Kéo 14. Dụng cụ đa năng 15. Cưa để cưa gỗ Các chú ý - Sản phẩm Victorinox được hưởng chế độ bảo hành trọn đời. Victorinox chỉ đổi hàng nếu có sai sót từ nhà sản xuất như dao bị mẻ, đóng mở khó khăn... - Victorinox khuyến cáo không sử dụng sai công dụng của các items trên sản phẩm. Đôi nét về Victorinox Victorinox - niềm tự hào của Thụy Sĩ - là một thương hiệu nổi tiếng, có truyền thống hơn 100 năm, dẫn đầu kỹ nghệ sản xuất dao bếp, luôn được các đầu bếp nổi tiếng thế giới ưa chuộng, chuyên dùng. Thép sử dụng làm dao là loại đặc biệt, được trui luyện theo kỹ thuật xưa. Một con dao Victorinox được sản xuất qua 11 công đoạn và kéo dài trong 7 ngày. Từ thép tấm, các nghệ nhân cắt bằng máy để định hình rồi đem vô lò rèn mài cho các cạnh thẳng, sau đó mài lưỡi bén, đánh bóng, in logo công ty, vô cán, hoàn chỉnh... ",""""""
tiki.vn,https://tiki.vn/do-choi-bong-ro-tre-em-tru-sat-kem-2-bong-p2339281.html?src=category-page-1975&2hi=0,2339281,OEM,Thể thao,Đồ Chơi Bóng Rổ Trẻ Em (Trụ Sắt Kèm 2 Bóng),193.000 ₫,7giftshop,," Thông Tin Sản Phẩm Đồ Chơi Bóng Rổ Trẻ Em (Trụ Sắt Kèm 2 Bóng) Chiều cao luôn được các bậc phụ huynh quan tâm và lo lắng làm thế nào để bé yêu của mình đạt chuẩn tốt? Ngoài các yếu tố về dinh dưỡng, di truyền thì thể thao sẽ giúp bé rất nhiều trong việc phát triển và điều chỉnh chiều cao. Một bộ đồ chơi bóng rổ sẽ giúp bé phát triển chiều cao và cho bé rèn luyện thể chất tốt nhất. Bộ sản phẩm gồm có 4 cột tháo rời được dễ dàng điều chỉnh chiều cao phù hợp cho từng giai đoạn phát triển của bé. Bốn (4) cột này có các điểm nối cố định với nhau bằng cách vặn vào nhau + 1 rổ hứng bóng + 1 tấm chắn banh + 1 đế để cột bóng rổ + 1 quả bóng lớn + 1 quả bóng nhỏ + 1 cây bơm bóng. Đế bóng rổ có thể bỏ cát hoặc nước để trụ lại chắc chắn cho bé chơi đồng thời giúp cố định cột bóng rổ tốt hơn không bị ngã. ",""""""
tiki.vn,https://tiki.vn/day-nhay-tay-nam-hop-kim-nhom-cao-cap-aolikes-al3202-p4465433.html?src=category-page-1975&2hi=0,4465433,AOLIKES,Thể thao,Dây nhảy tay nắm hợp kim nhôm cao cấp Aolikes AL3202,199.000 ₫,Aolikes Việt Nam,," GIỚI THIỆU VỀ THƯƠNG HIỆU AOLIKES DÂY NHẢY TAY NẮM HỢP KIM NHÔM CAO CẤP AOLIKES AL3202 Nhảy dây không còn là bài tập quá xa lạ gì với mỗi người chơi thể thao hoặc không chơi thể thao. Vừa mang tính chất giải trí, vừa là một phương thức rèn luyện thể lực quan trọng, hoạt động nhảy dây đơn giản nhưng hiệu quả thì đáng để so sánh với các phòng tập chuyên nghiệp Nếu bạn muốn đốt mỡ, hãy chọn nhảy dây. Đây là cách xuống cân nhanh nhất bạn từng biết. Triệt tiêu mỡ thừa tối đa, làm săn chắc các bó cơ và duy trì vóc dáng cân đối hoàn hảo Ngoài ra tập nhảy dây còn giúp ổn định nhịp tim, điều chỉnh bệnh lý liên quan đến huyết áp, tuần hoàn hô hấp tốt hơn người bình thường và tăng sức bền, cải thiện sức khỏe THÔNG TIN CHI TIẾT Đơn vị tính: 1 chiếc Trọng lượng: 500g Màu sắc: Xanh/ Bạc/ Đỏ Chất liệu: Nhựa bọc dây thép cáp Đặc tính sản phẩm: Dây chống nước, cách điện, độ bền cao. Đảm bảo không méo mó, không biến dạng, quăng quật thoải mái Tay cầm inox chắc chắn, trên thân tay cầm thiết kế vân sần tăng độ ma sát, chống bám dính mồ hôi Có chức năng tăng giảm kích thước chiều dài dây tiện lợi Tặng kèm túi đựng chuyên dụng, dễ cất giữ, mang theo dây đến nhiều địa điểm tập KÍCH THƯỚC SẢN PHẨM Chiều dài dây: 2,8m Chiều dài tay cầm: 14cm HƯỚNG DẪN TẬP LUYỆN Có 4 lưu ý bạn cần nhớ đối với kỹ thuật nhảy dây để đạt hiệu quả tốt nhấ Nhảy cao hơn và chậm hơn Sử dụng cổ tay thay vì cánh tay Giữ khuỷu tay sát với sườn của bạn Giữ thân của bạn thẳng đứng Để xem thêm các sản phẩm chính hãng đến từ thương hiệu Aolikes, Quý Khách hàng vui lòng chọn vào gian hàng của chúng tôi trên góc phải màn hình. ",""""""
