Domain,Url,Product_id,Brand,Category,Model,Price,Seller,Tags,Info,Others
mediamart.vn,https://mediamart.vn/cssk/philips/tong-do-cat-toc-cho-tre-em-philips-hc1055.htm,,Philips,Máy cạo râu,Tông đơ cắt tóc cho trẻ em Philips HC1055,849.000,,," . Hệ thống cắt an toàn. Các đầu cắt lượn tròn đặc biệt. Răng cắt ngắn hơn bằng gốm. Lược tỉa nhiều độ dài (1-12 mm). . . . . Hình ảnh tham khảo: Tông đơ cắt tóc cho trẻ em Philips HC1055. . . . . . . . . . . . . . . . . . . . . . . . . . . . . . . . . . . . . . . . . . Thông số kỹ thuật: Tông đơ cắt tóc cho trẻ em Philips HC1055. . . . . . . . . . Thông tin: Tông đơ cắt tóc cho trẻ em Philips HC1055. . . IPX 7 chống thấm nước để rửa máy an toàn và dễ dàng. . . Máy cắt tóc của chúng tôi đạt tiêu chuẩn chống thấm nước IPX 7, nhờ vậy bạn có thể rửa sạch máy an toàn và dễ dàng sau mỗi lần sử dụng.. . . Bạn có thể điều chỉnh lược tỉa theo nhiều độ dài khác nhau từ 1 mm đến 12 mm.. . . Bạn có thể điều chỉnh lược tỉa theo nhiều độ dài khác nhau từ 1 mm đến 12 mm.. . . Hệ thống cắt được thiết kế đặc biệt để sử dụng an toàn. . . Với các răng cắt ngắn hơn bằng gốm và đầu cắt lượn tròn, lưỡi cắt chuyên biệt của máy có thể dễ dàng giữ và cắt những sợi tóc mảnh, đảm bảo không kéo tóc hay làm xước da trẻ.. . . Răng cắt ngắn hơn bằng gốm. . . Dễ dàng giữ và cắt những sợi tóc mảnh, ngắn dài khác nhau.. . . Các đầu cắt lượn tròn đặc biệt. . . Bảo vệ da đầu của trẻ, tránh trầy xước.. . . Máy cắt tóc chạy êm nhất của chúng tôi ở 55 db(A). . . Máy chạy cực êm ở cường độ âm thanh 55 db(A), để trẻ luôn cảm thấy thoải mái trong khi cắt tóc.. . . Lưỡi dao mỏng để dễ dàng cắt những sợi tóc mảnh của trẻ. Lưỡi dao mỏng được thiết kế để chạm đến những chỗ khó cắt xung quanh vành tai, giúp dễ dàng cắt những sợi tóc mảnh của trẻ.. . . . . . Tư Vấn Mua Chăm sóc sức khỏe, Làm đẹp. . . . . . ",""""""
mediamart.vn,https://mediamart.vn/cssk/oralb/dau-chai-rang-oralb-sensitive-eb-172.htm,,Oral-B,Máy cạo râu,Đầu chải răng Oral-B Sensitive EB 17-2,400.000,,," . . . . Hình ảnh tham khảo: Đầu chải răng Oral-B Sensitive EB 17-2. . . . . . . . . . . . . . . Thông số kỹ thuật: Đầu chải răng Oral-B Sensitive EB 17-2. . . . . . . . . . . Tư Vấn Mua Chăm sóc sức khỏe, Làm đẹp. . . . . . ",""""""
mediamart.vn,https://mediamart.vn/cssk/oralb/dau-chai-rang-oralb-trizone-eb-302.htm,,Oral-B,Máy cạo râu,Đầu chải răng Oral-B TriZone EB 30-2,400.000,,," . . . . Hình ảnh tham khảo: Đầu chải răng Oral-B TriZone EB 30-2. . . . . . . . . . . . . . . Thông số kỹ thuật: Đầu chải răng Oral-B TriZone EB 30-2. . . . . . . . . . . Tư Vấn Mua Chăm sóc sức khỏe, Làm đẹp. . . . . . ",""""""
mediamart.vn,https://mediamart.vn/cssk/philips/tong-do-cat-toc-philips-hc3426.htm,,Philips,Máy cạo râu,Tông đơ cắt tóc Philips HC3426,1.290.000,,," . Lưỡi cắt bằng thép không gỉ. Lược chải tóc cho trẻ em. 13 cài đặt độ dài. Dùng không dây 60 phút/sạc 8 giờ. . . . . Hình ảnh tham khảo: Tông đơ cắt tóc Philips HC3426. . . . . . . . . . . . . . . . . . . . . . . . . . . . . . . . . . . . . . . . . . . . . . . . . . . Thông số kỹ thuật: Tông đơ cắt tóc Philips HC3426. . . . . . . . . . Thông tin: Tông đơ cắt tóc Philips HC3426. . . Gồm lược chải tóc cho trẻ em với 12 độ dài điều chỉnh được từ 1-23mm. . . Lược chải thân thiện với tóc trẻ em, có các đầu lượn tròn và răng lược ngắn, đặc biệt thích hợp dùng cho những thành viên nhỏ nhất trong gia đình. Lược trượt êm ái trên da mà không làm xước, giúp luôn cắt tóc an toàn và dễ chịu. Chỉ cần chọn và khóa cố định độ dài bạn muốn bằng cách dùng lược có thể điều chỉnh, cung cấp 12 cài đặt độ dài từ 1 đến 23mm, với độ chính xác 2mm giữa các độ dài. Hoặc dùng không có lược để cắt tỉa sát 0,5mm.. . . Lưỡi cắt bằng thép có thể tự mài sắc cho độ bén bền lâu. . . Lưỡi cắt bằng thép không gỉ có thể tự mài sắc cho độ bén bền lâu.. . . Dễ dàng chọn và khóa cố định 13 cài đặt độ dài: 0,5 đến 23mm. . . Chỉ cần chọn và khóa cố định độ dài bạn muốn bằng cách dùng lược có thể điều chỉnh, cung cấp 12 cài đặt độ dài từ 1 đến 23mm, với độ chính xác 2mm giữa các độ dài. Hoặc dùng không có lược để cắt tỉa sát 0,5mm.. . . Lưỡi cắt 'Tháo nhanh' để làm sạch dễ dàng. . . Chỉ cần bấm mở đầu có thể tháo rời để tháo nhanh và rửa sạch lưỡi cắt.. . . Bảo hành 2 năm được cộng thêm 3 năm khi bạn đăng ký sản phẩm trực tuyến. . . Tất cả các sản phẩm cắt tỉa của chúng tôi đều được chế tạo để có độ bền cao. Các sản phẩm được bảo hành toàn cầu và tương thích với điện áp toàn cầu. Chỉ cần đăng ký máy cắt tóc của bạn trên www.philips.com/5years để nhận thêm 3 năm bảo hành, cộng với bảo hành Philips 2 năm tiêu chuẩn, bạn sẽ được bảo hành tổng cộng là 5 năm trên toàn cầu.. . . Các lưỡi cắt không bao giờ cần dầu bôi trơn. . . Không cần dầu bôi trơn, để dễ bảo trì và tiết kiệm thời gian.. . . Dùng không dây 60 phút sau 8 giờ sạc. . . Dùng máy cắt tóc có cắm dây hoặc không dây để có công suất tối đa và tự do di chuyển thoải mái với 60 phút dùng không dây sau 8 giờ sạc điện.. . . Bộ phận cắt làm sắc kép giảm ma sát. . . Thoải mái tạo ra mọi kiểu tóc với công nghệ DualCut nâng cao của chúng tôi, kết hợp thành phần cắt làm sắc kép giảm ma sát. Thành phần cắt cải tiến này được thiết kế để hoạt động liên tục, cắt nhanh gấp hai lần so với các máy cắt tóc Philips thông thường.*. . . . . . . Tư Vấn Mua Chăm sóc sức khỏe, Làm đẹp. . . . . . ",""""""
mediamart.vn,https://mediamart.vn/cssk/oralb/dau-chai-rang-oralb-3d-white-eb-182.htm,,Oral-B,Máy cạo râu,Đầu chải răng Oral-B 3D White EB 18-2,400.000,,," . . . . Hình ảnh tham khảo: Đầu chải răng Oral-B 3D White EB 18-2. . . . . . . . . . . . . . . Thông số kỹ thuật: Đầu chải răng Oral-B 3D White EB 18-2. . . . . . . . . . . Tư Vấn Mua Chăm sóc sức khỏe, Làm đẹp. . . . . . ",""""""
mediamart.vn,https://mediamart.vn/cssk/oralb/dau-chai-rang-tre-em-oralb-eb-102-k.htm,,Oral-B,Máy cạo râu,Đầu chải răng trẻ em Oral-B EB 10-2 K,400.000,,," . . . . Hình ảnh tham khảo: Đầu chải răng trẻ em Oral-B EB 10-2 K. . . . . . . . . . . . . . . Thông số kỹ thuật: Đầu chải răng trẻ em Oral-B EB 10-2 K. . . . . . . . . . . Tư Vấn Mua Chăm sóc sức khỏe, Làm đẹp. . . . . . ",""""""
mediamart.vn,https://mediamart.vn/cssk/oralb/dau-chai-rang-oralb-crossaction-eb-502.htm,,Oral-B,Máy cạo râu,Đầu chải răng Oral-B CrossAction EB 50-2,400.000,,," . . . . Hình ảnh tham khảo: Đầu chải răng Oral-B CrossAction EB 50-2. . . . . . . . . . . . . . . Thông số kỹ thuật: Đầu chải răng Oral-B CrossAction EB 50-2. . . . . . . . . . . Tư Vấn Mua Chăm sóc sức khỏe, Làm đẹp. . . . . . ",""""""
mediamart.vn,https://mediamart.vn/cssk/oralb/ban-chai-danh-rang-dien-oralb-pro600-d16513.htm,,Oral-B,Máy cạo râu,Bàn chải đánh răng điện Oral-B Pro600 D16.513,1.900.000,,," . - Bàn chải đánh răng điện cao cấp Oral-B. . - Rung sau mỗi 30 giây để báo cho người dùng chuyển vị trí đánh răng. . - Tự động báo hiệu khi hết 2 phút. . . . . Hình ảnh tham khảo: Bàn chải đánh răng điện Oral-B Pro600 D16.513. . . . . . . . . . . . . . . . . . . . . Thông số kỹ thuật: Bàn chải đánh răng điện Oral-B Pro600 D16.513. . . . . . . . . . Thông tin: Bàn chải đánh răng điện Oral-B Pro600 D16.513. . . THÔNG TIN CHI TIẾT. . . . . Thương hiệu. . Oral-B. . . . Xuất xứ thương hiệu. . Đức. . . . Sản xuất tại. . Đức. . . . Model. . D16.513 Pro600. . . . Hướng dẫn bảo quản. . Nơi khô ráo, dưới 30 độ C, tránh ánh nắng trực tiếp. . . . Hạn sử dụng. . Xem trên bao bì sản phẩm. . . . . . MÔ TẢ SẢN PHẨM. . . Bàn Chải Đánh Răng Điện Oral-B Pro600 D16.513. thiết kế thân bàn chải với kích thước vừa phải và được bọc cao su chống trơn trượt khiến cho cảm giác cầm nắm khá thoải mái và chắc tay.. . Ngoài ra, thân bàn chải cũng được thiết kế khá kín nhằm mang đến khả năng chống nước để bảo vệ các thành phần quan trọng bên trong tốt hơn.. . Là dòng bàn chải điện cao cấp nên Oral-B Pro 600 sử dụng công nghệ 3D Action khác với 2D Action được sử dụng ở bàn chải điện Oral-B Vitality. Bên cạnh tác động xoay liên tục để làm sạch bề mặt răng thì lông bàn chải còn có thể rung. Hai tác động này kết hợp với nhau khiến cho hiệu quả làm sạch mảng bám và vi khuẩn trên bề mặt và kẽ răng đạt hiệu quả cao nhất.. . Daily Clean là chế độ hẹn giờ khi đánh răng. Nó cho phép người dùng có thể biết chính xác khi nào thì nên chuyển vị trí của đầu bàn chải và khi nào thì nên kết thúc việc đánh răng. Cụ thể hơn, bộ đếm thời gian được tích hợp bên trong bàn chải điện Oral-B sẽ bắt đầu đếm ngược từ khi người dùng bắt đầu bật bàn chải điện. Với tính năng Protimer, sau mỗi 30 giây, bàn chải sẽ rung hoặc kêu để báo hiệu người dùng chuyển sang nửa khác của hàm răng (mỗi hàm răng sẽ được chia thành 2 nửa, tổng cộng có 4 nửa hàm sẽ được vệ sinh trong thời gian 4 x 30 = 120 giây (2 phút) sau 2 phút, bàn chải sẽ dừng lại bởi đây là thời gian tối ưu để người dùng vệ sinh răng miệng và đạt được kết quả cao nhất mà không gây tổn hại đến men răng và nướu.. . . . . . . Tư Vấn Mua Chăm sóc sức khỏe, Làm đẹp. . . . . . ",""""""
mediamart.vn,https://mediamart.vn/cssk/oralb/ban-chai-danh-rang-pin-oralb-stages-power-db4510k.htm,,Oral-B,Máy cạo râu,Bàn chải đánh răng pin Oral-B Stages Power DB4510K,520.000,,," . - Bàn chải pin Oral-B thay đầu cho trẻ em. . - Dành cho bé từ 3 tuổi trở lên. . - Hình ảnh dễ thương, ngộ nghĩnh. . . . . Hình ảnh tham khảo: Bàn chải đánh răng pin Oral-B Stages Power DB4510K. . . . . . . . . . . . . . . . . . Thông số kỹ thuật: Bàn chải đánh răng pin Oral-B Stages Power DB4510K. . . . . . . . . . Thông tin: Bàn chải đánh răng pin Oral-B Stages Power DB4510K. . . THÔNG TIN CHI TIẾT. . . . . Thương hiệu. . Oral-B. . . . Xuất xứ thương hiệu. . Đức. . . . Sản xuất tại. . Trung Quốc. . . . Model. . DB4510K Stages Power. . . . Hướng dẫn bảo quản. . Nơi khô ráo, dưới 30 độ C, tránh ánh nắng trực tiếp. . . . Hạn sử dụng. . Xem trên bao bì sản phẩm. . . . . . MÔ TẢ SẢN PHẨM. . . Bàn Chải Đánh Răng Pin Oral-B Stages Power DB4510K. thiết kế với đầu bàn chải mềm mại cho bé, chải sạch tận gốc từng kẽ răng hơn so với bàn chải bằng tay.. . Bàn chải pin Oral B thiết kế xinh xắn giúp bé đánh răng dễ dàng, thích thú, ngăn ngừa sâu răng.. . Thiết kế thân bàn chải giúp bé cầm nắm chắc chắn.. . Các hình ảnh hoạt hình nghộ nghĩnh.. . Pin bàn chải đánh răng có thể thay, chịu nước.. . . . . . . Tư Vấn Mua Chăm sóc sức khỏe, Làm đẹp. . . . . . ",""""""
mediamart.vn,https://mediamart.vn/cssk/oralb/ban-chai-danh-rang-oralb-vitality-trizone-d12513.htm,,Oral-B,Máy cạo râu,Bàn chải đánh răng Oral-B Vitality TriZone D12.513,1.050.000,,," . - Bàn chải điện Oral-B có thiết kế đơn giản, dễ sử dụng. . - Có thể sạc lại nhiều lần. . - Bộ hẹn giờ tự động báo cho người dùng biết khi đã hết 2 phút đánh răng. . . . . Hình ảnh tham khảo: Bàn chải đánh răng Oral-B Vitality TriZone D12.513. . . . . . . . . . . . . . . . . . . . . Thông số kỹ thuật: Bàn chải đánh răng Oral-B Vitality TriZone D12.513. . . . . . . . . . Thông tin: Bàn chải đánh răng Oral-B Vitality TriZone D12.513. . . THÔNG TIN CHI TIẾT. . . . . Thương hiệu. . Oral-B. . . . Xuất xứ thương hiệu. . Đức. . . . Sản xuất tại. . Đức. . . . Model. . D12.513 Vitality TriZone. . . . Hướng dẫn bảo quản. . Nơi khô ráo, dưới 30 độ C, tránh ánh nắng trực tiếp. . . . Hạn sử dụng. . Xem trên bao bì sản phẩm. . . . . . MÔ TẢ SẢN PHẨM. . . Bàn Chải Đánh Răng Điện Oral-B Vitality Trizone D12.513. là một trong những bàn chải đánh răng điện bán chạy nhất hiện nay của hãng sản xuất Oral-B.. . Được thiết kế với kiểu dáng chắc chắn và kích thước tối ưu giúp người dùng có thể cầm một cách thoải mái khi đánh răng. Thêm vào đó, nhà sản xuất cũng đã thiết kế để sản phẩm này có khả năng chống nước và trang bị thêm bọc cao su để không bị rơi khi sử dụng.. . 2D Action là tính năng cơ bản nhất được áp dụng ở bàn chải điện Oral-B Vitality. Với tính năng 2D Action này, bàn chải sẽ xoay liên tục tạo ra sự lực tác động giữa lông bàn chải và bề mặt răng, nhờ vậy nên các mảng bám và thức ăn thừa trên bề mặt răng và khe răng sẽ được loại bỏ gần như hoàn toàn.. . Daily Clean là chế độ hẹn giờ khi đánh răng. Nó cho phép người dùng có thể biết chính xác khi nào thì nên chuyển vị trí của đầu bàn chải và khi nào thì nên kết thúc việc đánh răng. Cụ thể hơn, bộ đếm thời gian được tích hợp bên trong bàn chải điện Oral-B sẽ bắt đầu đếm ngược từ khi người dùng bắt đầu bật bàn chải điện. Sau 2 phút, bàn chải sẽ dừng lại bởi đây là thời gian tối ưu để người dùng vệ sinh răng miệng và đạt được kết quả cao nhất mà không gây tổn hại đến men răng và nướu.. . . . . . . Tư Vấn Mua Chăm sóc sức khỏe, Làm đẹp. . . . . . ",""""""
mediamart.vn,https://mediamart.vn/cssk/oralb/ban-chai-danh-rang-pin-oralb-pro-health-db4510.htm,,Oral-B,Máy cạo râu,Bàn chải đánh răng pin Oral-B Pro Health DB4510,520.000,,," . - Bàn chải đánh răng điện sử dụng pin. . - Thiết kế gọn nhẹ, đơn giản và dễ sử dụng. . - Phù hợp để mang theo trong các chuyến công tác, du lịch, dã ngoại. . . . . Hình ảnh tham khảo: Bàn chải đánh răng pin Oral-B Pro Health DB4510. . . . . . . . . . . . . . . . . . . . . Thông số kỹ thuật: Bàn chải đánh răng pin Oral-B Pro Health DB4510. . . . . . . . . . Thông tin: Bàn chải đánh răng pin Oral-B Pro Health DB4510. . . THÔNG TIN CHI TIẾT. . . . . Thương hiệu. . Oral-B. . . . Xuất xứ thương hiệu. . Đức. . . . Sản xuất tại. . Trung Quốc. . . . Model. . DB4510 Pro Health. . . . Hướng dẫn bảo quản. . Nơi khô ráo, dưới 30 độ C, tránh ánh nắng trực tiếp. . . . Hạn sử dụng. . Xem trên bao bì sản phẩm. . . . . . MÔ TẢ SẢN PHẨM. . . Bàn Chải Đánh Răng Pin Oral-B Pro Health DB4510. tốc độ rung độc đáo giúp bàn chải đánh răng một cách nhẹ nhàng đạt hiệu quả sâu sắc giữa kẽ răng và dọc theo đường viền cơ lợi.. . Được đánh giá là một sản phẩm bàn chải đánh răng điện có thiết kế vô cùng đơn giản và dễ sử dụng trong khi hiệu quả làm sạch lại vượt trội hơn hẳn so với các loại bàn chải đánh răng thông thường khác.. . Với thiết kế sử dụng pin, sản phẩm bàn chải đánh răng điện này có thể được sử dụng một cách dễ dàng trong các chuyến đi du lịch, dã ngoại hoặc trong những chuyến đi công tác kéo dài nhiều ngày.. . . . . . . Tư Vấn Mua Chăm sóc sức khỏe, Làm đẹp. . . . . . ",""""""
mediamart.vn,https://mediamart.vn/cssk/oralb/ban-chai-danh-rang-oralb-vitality-crossaction-d12513.htm,,Oral-B,Máy cạo râu,Bàn chải đánh răng Oral-B Vitality CrossAction D12.513,1.050.000,,," . - Bàn chải điện Oral-B có thiết kế đơn giản, dễ sử dụng. . - Có thể sạc lại nhiều lần. . - Bộ hẹn giờ tự động báo cho người dùng biết khi đã hết 2 phút đánh răng. . . . . Hình ảnh tham khảo: Bàn chải đánh răng Oral-B Vitality CrossAction D12.513. . . . . . . . . . . . . . . . . . . . . Thông số kỹ thuật: Bàn chải đánh răng Oral-B Vitality CrossAction D12.513. . . . . . . . . . Thông tin: Bàn chải đánh răng Oral-B Vitality CrossAction D12.513. . . THÔNG TIN CHI TIẾT. . . . . Thương hiệu. . Oral-B. . . . Xuất xứ thương hiệu. . Đức. . . . Sản xuất tại. . Đức. . . . Model. . D12.513 Vitality CrossAction. . . . Hướng dẫn bảo quản. . Nơi khô ráo, dưới 30 độ C, tránh ánh nắng trực tiếp. . . . Hạn sử dụng. . Xem trên bao bì sản phẩm. . . . . . MÔ TẢ SẢN PHẨM. . . Bàn Chải Đánh Răng Điện Oral-B Vitality Crossaction D12.513. là một trong những bàn chải đánh răng điện bán chạy nhất hiện nay của hãng sản xuất Oral-B.. . Được thiết kế với kiểu dáng chắc chắn và kích thước tối ưu giúp người dùng có thể cầm một cách thoải mái khi đánh răng. Thêm vào đó, nhà sản xuất cũng đã thiết kế để sản phẩm này có khả năng chống nước và trang bị thêm bọc cao su để không bị rơi khi sử dụng.. . 2D Action là tính năng cơ bản nhất được áp dụng ở bàn chải điện Oral-B Vitality. Với tính năng 2D Action này, bàn chải sẽ xoay liên tục tạo ra sự lực tác động giữa lông bàn chải và bề mặt răng, nhờ vậy nên các mảng bám và thức ăn thừa trên bề mặt răng và khe răng sẽ được loại bỏ gần như hoàn toàn.. . Daily Clean là chế độ hẹn giờ khi đánh răng. Nó cho phép người dùng có thể biết chính xác khi nào thì nên chuyển vị trí của đầu bàn chải và khi nào thì nên kết thúc việc đánh răng. Cụ thể hơn, bộ đếm thời gian được tích hợp bên trong bàn chải điện Oral-B sẽ bắt đầu đếm ngược từ khi người dùng bắt đầu bật bàn chải điện. Sau 2 phút, bàn chải sẽ dừng lại bởi đây là thời gian tối ưu để người dùng vệ sinh răng miệng và đạt được kết quả cao nhất mà không gây tổn hại đến men răng và nướu.. . . . . . . Tư Vấn Mua Chăm sóc sức khỏe, Làm đẹp. . . . . . ",""""""
mediamart.vn,https://mediamart.vn/cssk/omron/can-dien-tu-omron-hn-283.htm,,OMRON,Máy cạo râu,Cân điện tử OMRON HN-283,299.000,,," . Cân điện tử, chính xác tới 100g - Thiết kế trang nhã với mặt kính chịu lực. . . . . Hình ảnh tham khảo: Cân điện tử OMRON HN-283. . . . . . . . . . . . . . . Thông số kỹ thuật: Cân điện tử OMRON HN-283. . . . . . . . . . Thông tin: Cân điện tử OMRON HN-283. . . Cân điện tử. , dễ sử dụng và đảm bảo vệ sinh, là sản phẩm lý tưởng cho việc chăm sóc sức khỏe gia đình bạn.. . Tính năng nổi bật:. . . Dễ sử dụng, thiết kế đẹp.. . Màu sắc trang nhã với ánh bạc.. . 4 cảm biến cho kết quả trọng lượng cơ thể chính xác hơn.. . Tự động tắt sau 6 giây. . . Thông số kỹ thuật:. . . Trọng lượng: 64 g(cả pin). . Pin: 1 pin AAA. . Tuổi thọ pin: khoảng 2 tháng.. . . . . . . Tư Vấn Mua Chăm sóc sức khỏe, Làm đẹp. . . . . . ",""""""
mediamart.vn,https://mediamart.vn/cssk/philips/may-cao-rau-philips-pq217.htm,,Philips,Máy cạo râu,Máy cạo râu Philips PQ217,690.000,,," . Cạo sát một cách thoải mái,Ôm theo đường cong trên khuôn mặt. Hệ Thống Reflex Action tự động điều chỉnh theo mọi đường cong. Dao cạo tự mài bén, Máy cạo râu có thể sạc lại. . . . . Hình ảnh tham khảo: Máy cạo râu Philips PQ217. . . . . . . . . . . . . . . . . . . . . . . . . . . . . . . . . . . . . . . . . . Thông số kỹ thuật: Máy cạo râu Philips PQ217. . . . . . . . . . Thông tin: Máy cạo râu Philips PQ217. . . Cạo sát một cách thoải mái. . . Đầu cạo nhập khẩu cho bạn trải nghiệm cạo sát thoải mái. . . Ôm theo đường cong trên khuôn mặt. . . Căn chỉnh các lưỡi dao sát với da hơn để cạo sát nhất; đầu cạo xoay độc lập ôm theo đường cong trên mặt.. . . Hệ Thống Reflex Action. . . Tự động điều chỉnh theo mọi đường cong trên khuôn mặt và cổ. . . Dao cạo tự mài bén. . . Lưỡi dao tự mài bén bền lâu đến hai năm.. . . Máy cạo râu có thể sạc lại. . . Máy cạo râu có thể sạc lại, cạo râu không dây tối đa 30 phút.. . . . . . . Tư Vấn Mua Chăm sóc sức khỏe, Làm đẹp. . . . . . ",""""""
mediamart.vn,https://mediamart.vn/cssk/philips/may-cao-rau-philips-at610.htm,,Philips,Máy cạo râu,Máy cạo râu Philips AT610,1.180.000,,," . - Cạo ướt hoặc khô đều được. . - Lưỡi CloseCut lướt nhẹ nhàng cho mỗi lần cạo. . - Có độ bám ergonomic với lớp phủ chống trượt kiểm soát chặt quá trình cạo. . - Thích hợp với mọi loại điện áp. . - Dễ dàng vệ sinh sau mỗi lần dùng. . . . . Hình ảnh tham khảo: Máy cạo râu Philips AT610. . . . . . . . . . . . . . . Thông số kỹ thuật: Máy cạo râu Philips AT610. . . . . . . . . . Thông tin: Máy cạo râu Philips AT610. . . Aquatec: sảng khoái khi cạo râu ướt với bọt cạo râu hoặc cạo râu khô dễ dàng. . . Đầu bịt Aquatec trên máy cạo râu giúp cho máy có khả năng chống thấm nước 100%. Dùng máy cạo râu trong khi tắm cùng với kem hoặc bọt cạo râu ưa thích của bạn giúp bảo vệ da tốt hơn. Một cách tự nhiên, bạn cũng có thể cạo râu khô để thuận tiện. Sau khi cạo xong, bạn chỉ cần bật đầu cạo lên và rửa dưới vòi nước để làm sạch máy cạo râu một cách dễ dàng.. . . Lưới cắt CloseCut lướt nhẹ nhàng để cắt sát êm ái.. . . Lưỡi cắt CloseCut có các góc tròn, lướt nhẹ nhàng trên da để có thể cạo râu sát mà vẫn thoải mái.. . . Lưỡi dao hoạt động ổn định tới 2 năm.. . . Để có hiệu suất tối ưu, hãy thay các đầu cạo 2 năm một lần.. . . Sạc 10 giờ sẽ sử dung không dây được hơn 30 phút.. . . Sử dụng không dây tiện lợi. Cho bạn 30+ phút sử dụng không dây. Sạc đầy trong 10 giờ.. . . Tay cầm tiện dụng để điều khiển tốt và chính xác hơn.. . . Tay cầm máy cạo râu có vị trí nắm tiện dụng với vỏ chống trượt, bảo đảm điều khiển tốt để cạo chính xác hơn.. . . Bảo hành 2 năm, điện áp toàn cầu và lưỡi cắt có thể thay thế.. . . Tất cả các máy cạo râu của chúng tôi đều có chế độ bảo hành toàn cầu 2 năm và có thể tự điều chỉnh để phù hợp với mọi mức điện áp.. . . . . . Tư Vấn Mua Chăm sóc sức khỏe, Làm đẹp. . . . . . ",""""""
