Domain,Url,Product_id,Brand,Category,Model,Price,Seller,Tags,Info,Others
mediamart.vn,https://mediamart.vn/cssk/philips/may-cao-rau-philips-pt720.htm,,Philips,Máy cạo râu,Máy cạo râu Philips PT720,1.500.000,,," . Đầu cạo Linh hoạt Nâng và Cắt. Dùng không dây 40 phút/sạc 8h. Có thể sử dụng có dây và không dây. Chỉ cần xả nước để làm sạch. . . . . Hình ảnh tham khảo: Máy cạo râu Philips PT720. . . . . . . . . . . . . . . . . . . . . . . . . . . . . . Thông số kỹ thuật: Máy cạo râu Philips PT720. . . . . . . . . . Thông tin: Máy cạo râu Philips PT720. . . Lưỡi cạo Nâng và Cắt nâng râu lên để cắt, giúp cạo sát da. . Hệ thống lưỡi kép Nâng và Cắt nâng râu lên để cắt một cách thoải mái phần dưới da.. . . Flex & Float điều chỉnh theo đường cong khuôn mặt và cổ. . Tự động điều chỉnh khớp với mỗi đường cong của khuôn mặt và cổ của bạn để cạo trơn tru hơn.. . . Lưỡi cạo Nâng & Cắt Siêu đẳng nâng râu lên để cắt sát với da hơn. . Lưỡi cạo đầu tiên nâng từng sợi râu trong khi lưỡi cạo thứ hai cắt một cách thoải mái phần dưới da, cho da thật nhẵn nhụi.. . . 45+ phút cạo râu, 8 giờ sạc. . . Pin lithium-ion công suất cao, tiết kiệm năng lượng cho phép bạn cạo râu nhiều hơn cho mỗi lần sạc. Bạn sẽ có 45+ phút cạo râu - khoảng 15 lần cạo râu - sau 8 giờ sạc. Hãy cắm điện trong 3 phút và bạn sẽ có đủ điện cho một lần cạo râu.. . . Có thể sử dụng có dây và không dây. . Có thể sử dụng có dây và không dây. . . Chỉ cần xả nước để làm sạch. . Chỉ cần bật đầu cạo lên và rửa sạch hoàn toàn dưới vòi nước.. . . Màn hình LED. . Chỉ báo: Pin đầy, Pin yếu, Sạc điện, Thay đầu cạo, Sạc nhanh. . . . . . . Tư Vấn Mua Chăm sóc sức khỏe, Làm đẹp. . . . . . ",""""""
mediamart.vn,https://mediamart.vn/cssk/philips/may-cao-rau-philips-at620.htm,,Philips,Máy cạo râu,Máy cạo râu Philips AT620,1.380.000,,," . - Cạo ướt và khô đều dễ dàng. . - Máy cạo râu không dây. . - Máy cạo râu không thấm nước, không gây kích ứng da. . - Tự động điều chỉnh theo các đường cong của khuôn mặt, ngăn ngừa tổn thương da. . . . . Hình ảnh tham khảo: Máy cạo râu Philips AT620. . . . . . . . . . . . . . . . . . Thông số kỹ thuật: Máy cạo râu Philips AT620. . . . . . . . . . Thông tin: Máy cạo râu Philips AT620. . . Aquatec: sảng khoái khi cạo râu ướt với bọt cạo râu hoặc cạo râu khô dễ dàng. . . Đầu bịt Aquatec trên máy cạo râu giúp cho máy có khả năng chống thấm nước 100%. Dùng máy cạo râu trong khi tắm cùng với kem hoặc bọt cạo râu ưa thích của bạn giúp bảo vệ da tốt hơn. Một cách tự nhiên, bạn cũng có thể cạo râu khô để thuận tiện. Sau khi cạo xong, bạn chỉ cần bật đầu cạo lên và rửa dưới vòi nước để làm sạch máy cạo râu một cách dễ dàng.. . . Lưới cắt CloseCut lướt nhẹ nhàng để cắt sát êm ái.. . . Lưỡi cắt CloseCut có các góc tròn, lướt nhẹ nhàng trên da để có thể cạo râu sát mà vẫn thoải mái.. . . Lưỡi dao hoạt động ổn định tới 2 năm.. . . Để có hiệu suất tối ưu, hãy thay các đầu cạo 2 năm một lần.. . . Sạc 10 giờ sẽ sử dung không dây được hơn 30 phút.. . . Sử dụng không dây tiện lợi. Cho bạn 30+ phút sử dụng không dây. Sạc đầy trong 10 giờ.. . . Tay cầm tiện dụng để điều khiển tốt và chính xác hơn.. . . Tay cầm máy cạo râu có vị trí nắm tiện dụng với vỏ chống trượt, bảo đảm điều khiển tốt để cạo chính xác hơn.. . . Đầu tỉa: hoàn hảo cho tóc mai và ria mép.. . . Đầu tỉa có chiều rộng chuẩn hoàn hảo cho việc tỉa tóc mai và ria mép.. . . Bảo hành 2 năm, điện áp toàn cầu và lưỡi cắt có thể thay thế.. . . Tất cả các máy cạo râu của chúng tôi đều có chế độ bảo hành toàn cầu 2 năm và có thể tự điều chỉnh để phù hợp với mọi mức điện áp.. . . . . . Tư Vấn Mua Chăm sóc sức khỏe, Làm đẹp. . . . . . ",""""""
mediamart.vn,https://mediamart.vn/cssk/camry/can-dien-tu-camry-eb9370s671.htm,,Camry,Máy cạo râu,Cân điện tử Camry EB9370-S671,359.000,,," . Thiết kế siêu mỏng, Chịu lực siêu bền, Cân đo chính xác trọng lượng cơ thể. Trọng lượng tối đa: 150kg, Sai số cho phép: 100g. Mặt kính chịu lực 6mm. Sử dụng 1 pin. . . . . Hình ảnh tham khảo: Cân điện tử Camry EB9370-S671. . . . . . . . . . . . . . . Thông số kỹ thuật: Cân điện tử Camry EB9370-S671. . . . . . . . . . . Tư Vấn Mua Chăm sóc sức khỏe, Làm đẹp. . . . . . ",""""""
mediamart.vn,https://mediamart.vn/cssk/philips/may-cao-rau-philips-s5070.htm,,Philips,Máy cạo râu,Máy cạo râu Philips S5070,2.280.000,,," . Bảo vệ tốt hơn 10 lần so với dao cạo thông thường. Dùng không dây 40 phút/sạc 1 giờ. Hệ thống lưỡi cạo ComfortCut. Đầu tỉa chính xác SmartClick. Đầu cạo được thiết kế lượn tròn để bảo vệ da. . . . . Hình ảnh tham khảo: Máy cạo râu Philips S5070. . . . . . . . . . . . . . . . . . . . . . . . . . . . . . . . . . . . Thông số kỹ thuật: Máy cạo râu Philips S5070. . . . . . . . . . Thông tin: Máy cạo râu Philips S5070. . . Cạo khô hoặc ướt, bảo vệ da. . . Bảo vệ tốt hơn 10 lần so với dao cạo thông thường. . Dùng không dây 40 phút/sạc 1 giờ. . Hệ thống lưỡi cạo ComfortCut. . Đầu tỉa chính xác SmartClick. . Đầu cạo được thiết kế lượn tròn để bảo vệ da. . . . Cạo sát mà không cắt xước vào da. Hệ thống lưỡi cạo ComfortCut của chúng tôi có các đầu cạo được thiết kế lượn tròn trượt êm ái trên khuôn mặt và bảo vệ làn da.. . Cạo khô thoải mái hoặc cạo ướt khoan khoái với Aquatec. . . Chọn cách cạo râu bạn thích. Với đầu bịt Khô & Ướt Aquatec, bạn có thể chọn cạo khô nhanh và thoải mái. Hoặc bạn có thể cạo ướt với kem cạo râu hay bọt cạo râu, kể cả khi tắm.. . Các cạnh lượn tròn cạo êm ái, bảo vệ da tốt hơn. . . Cạo râu thoải mái dù cạo khô hay ướt. Các lưỡi cạo ComfortCut của chúng tôi có các đầu cạo được thiết kế lượn tròn trượt êm ái trên da bạn mà không làm trầy xước da.. . Đầu cạo linh hoạt theo 5 hướng để cạo nhanh và sát. . . Đầu cạo Flex linh hoạt theo 5 hướng có thể tự do di chuyển theo 5 hướng khác nhau, đảm bảo tiếp xúc sát với da giúp bạn cạo râu nhanh và sát kể cả ở vùng cổ và quai hàm.. . Đầu tỉa dễ lắp ráp giúp tỉa ria mép và tóc mai hoàn hảo. . . Dùng đầu tỉa chính xác thân thiện với làn da để hoàn tất diện mạo của bạn. Đây là phụ kiện lý tưởng để bảo vệ bộ ria mép và cạo tóc mai đẹp.. . Cạo không dây 40 phút. . . Bạn sẽ có 40 phút cạo râu với khoảng 13 lần cạo sau 1 giờ sạc. Máy cạo râu này chỉ vận hành ở chế độ không dây.. . 1 giờ sạc pin. . . Cạo lâu hơn với mỗi lần sạc, nhờ có pin công suất cao, bền lâu và tiết kiệm năng lượng của chúng tôi. Sạc nhanh trong 5 phút và bạn sẽ có đủ điện cho một lần cạo râu.. . Chỉ báo khóa du lịch và pin 1 mức độ. . Màn hình trực quan hiển thị mọi thông tin liên quan, cho phép bạn có được hiệu suất tốt nhất trên máy cạo râu: - Chỉ báo pin 1 mức độ - Chỉ báo pin yếu - Chỉ báo khóa du lịch. . . . . . Tư Vấn Mua Chăm sóc sức khỏe, Làm đẹp. . . . . . ",""""""
mediamart.vn,https://mediamart.vn/cssk/camry/can-suc-khoe-camry-br9203h131.htm,,Camry,Máy cạo râu,Cân sức khỏe Camry BR9203(H131),259.000,,," . - Dạng cân cơ học cho kết quả chính xác, sai số thấp: Sản phẩm là dạng cân cơ học cho trọng lượng cân tối đa là 130kg với sai số nhỏ hơn 1kg. . - Thiết kế đẹp mắt và tinh xảo. . - Kích thước nhỏ gọn, tiện lợi: Sản phẩm dạng hình chững nhật với kích thước 266 x 268 x 55mm, nhỏ gọn mà không tốn quá nhiều diện tích sử dụng cũng như bảo quản khi không sử dụng.. - Sản phấm thích hợp sử dụng tại nhà, nơi làm việc hay các phòng khám vừa và nhỏ.. . . . . Hình ảnh tham khảo: Cân sức khỏe Camry BR9203(H131). . . . . . . . . . . . . . . Thông số kỹ thuật: Cân sức khỏe Camry BR9203(H131). . . . . . . . . . Thông tin: Cân sức khỏe Camry BR9203(H131). . . Cân Sức Khỏe Camry BR9203-H131. Cân sức khỏe Camry BR9203-H131 giúp bạn cân trọng lượng cơ thể cho người thân và bé cưng một cách chính xác và nhanh chóng. Với chỉ số sai số nhỏ, và trọng lượng tối đa lên đến 130 kg, sẽ đáp ứng mọi nhu cầu cân đo trọng lượng cơ thể của các thành viên trong gia đình. Cân được thiết kế gọn nhẹ, bạn có thể dễ dàng di chuyển và không tốn nhiều diện tích khi sử dụng.. . . . . Thông tin sản phẩm. . Trọng lượng lên đến 130 kg. Sử dụng 2 lò xo chịu lực để đo trọng lượng cân. Cân có trọng lượng lên đến 130 kg, đáp ứng mọi nhu cầu đo trọng lượng cơ thể của các thành viên trong gia đình.. . Cân chính xác. - Cân chính xác với sai số cho phép nhỏ hơn 1 kg, nên bạn có thể theo dõi sức khỏe thường xuyên một cách chính xác, từ đó điều chỉnh chế độ dinh dưỡng hợp lý.. - Đơn vị chia nhỏ nhất của cân là 100 gram, giúp bạn biết rõ chỉ số cân nặng của bé cưng.. . Thiết kế tiện dụng, đẹp mắt. - Cân được thiết kế với kích thước nhỏ gọn 266 x 268 x 55 mm, không chiếm nhiều diện tích khi sử dụng hoặc khi cất giữ. Trọng lượng của cân nhẹ, bạn có thể di chuyển đến mọi vị trí để thực hiện việc cân đo.. - Cân được làm từ chất liệu nhựa cao cấp, có kết cấu vững chắc, giúp cho việc sử dụng cân được lâu bền. Ngoài ra, với chất liệu nhựa, cho bề mặt bóng mịn, bạn dễ dàng vệ sinh cân. Chỉ cần một chiếc khăn ướt, trong vài phút là cân sẽ sạch sẽ trông như mới.. - Mặt đồng hồ hiển thị số đo rõ ràng, giúp bạn nhìn rõ ràng chỉ số cân nặng của mình.. - Cân được thiết kế đẹp mắt với hoa văn bông hoa màu xanh trên nền trắng thật trang nhã, mang lại tính thẩm mỹ cao.. . Hướng dẫn sử dụng cân. - Đặt cân trên một mặt phẳng.. - Điều chỉnh chỉ số trên mặt cân về mức cân bằng (0kg).. - Bước lên cân, đứng thẳng cho đến khi chỉ số cân dừng lại cho bạn biết kết quả.. . . . . . Tư Vấn Mua Chăm sóc sức khỏe, Làm đẹp. . . . . . ",""""""
mediamart.vn,https://mediamart.vn/cssk/camry/can-dien-tu-camry-eb906120.htm,,Camry,Máy cạo râu,Cân điện tử Camry EB9061-20,329.000,,," . Trọng lượng tối đâ 150Kg, Kích thước: 300x295x23mm. Màn hình điện tử LCD: 1 inch. Kính chịu lực siêu bền với độ dày siêu mỏng 6mm. Thiết kế tinh xảo phù hợp với với mọi không gian. . . . . Hình ảnh tham khảo: Cân điện tử Camry EB9061-20. . . . . . . . . . . . . . . Thông số kỹ thuật: Cân điện tử Camry EB9061-20. . . . . . . . . . . Tư Vấn Mua Chăm sóc sức khỏe, Làm đẹp. . . . . . ",""""""
mediamart.vn,https://mediamart.vn/cssk/philips/may-cao-rau-philips-s1070.htm,,Philips,Máy cạo râu,Máy cạo râu Philips S1070,1.490.000,,," . Hệ thống bảo vệ da. Lưỡi tự mài, đầu cạo 3 chiều. Công nghệ Aquatec, cạo khô và ướt. Sử dụng 45 phút mỗi lần sạc. . . . . Hình ảnh tham khảo: Máy cạo râu Philips S1070. . . . . . . . . . . . . . . . . . Thông số kỹ thuật: Máy cạo râu Philips S1070. . . . . . . . . . . Tư Vấn Mua Chăm sóc sức khỏe, Làm đẹp. . . . . . ",""""""
mediamart.vn,https://mediamart.vn/cssk/philips/may-cao-rau-philips-at750.htm,,Philips,Máy cạo râu,Máy cạo râu Philips AT750,1.880.000,,," . - Máy cạo râu không thấm nước, không gây kích ứng da. . - Sạc trong 8 tiếng. . - Hệ thống lưỡi kép: Lưỡi đầu tiên nâng và lưỡi thứ 2 sẽ cạo, tạo sự thoải mái. . - Tự động điều chỉnh theo các đường cong của khuôn mặt, ngăn ngừa tổn thương da. . . . . . . Hình ảnh tham khảo: Máy cạo râu Philips AT750. . . . . . . . . . . . . . . Thông số kỹ thuật: Máy cạo râu Philips AT750. . . . . . . . . . Thông tin: Máy cạo râu Philips AT750. . . Được tối ưu để sử dụng với kem hoặc bọt cạo râu, để tăng sự thoải mái cho da. . . Đầu bịt Aquatec để cạo khô thoải mái và cạo ướt khoan khoái. Tối ưu khi dùng với kem hoặc bọt cạo râu để tăng sự thoải mái cho da, ngay cả khi đứng dưới vòi tắm.. . . Lượn êm ái trên đường cong khuôn mặt. . . Đầu bảo vệ tròn, ma sát thấp sẽ điều chỉnh theo đường cong khuôn mặt để hạn chế tổn thương cho da.. . . Để cạo sát thoải mái. . . Để cạo sát, hệ thống lưỡi cạo kép lắp trong máy cạo râu Philips sẽ nâng râu lên để cắt sát hơn thật thoải mái.. . . Máy cạo râu có thể rửa sạch với hệ thống QuickRinse. . . Với hệ thống QuickRinse để rửa sạch dưới vòi nước và có thể dùng khi tắm. . . Cạo không dây trong hơn 40 phút trong một lần sạc. . . Công suất không dây trên 40 phút cho 14 lần cạo. Sạc đầy đủ trong 8 giờ, để luôn sẵn sàng khi bạn cần.. . . . . . Tư Vấn Mua Chăm sóc sức khỏe, Làm đẹp. . . . . . ",""""""
mediamart.vn,https://mediamart.vn/cssk/philips/may-cao-rau-philips-s1030.htm,,Philips,Máy cạo râu,Máy cạo râu Philips S1030,1.290.000,,," . Hệ thống bảo vệ da. Lưỡi tự mài, đầu cạo 3 chiều. Công nghệ Aquatec, cạo khô và ướt. Sử dụng 45 phút mỗi lần sạc. . . . . Hình ảnh tham khảo: Máy cạo râu Philips S1030. . . . . . . . . . . . . . . . . . Thông số kỹ thuật: Máy cạo râu Philips S1030. . . . . . . . . . . Tư Vấn Mua Chăm sóc sức khỏe, Làm đẹp. . . . . . ",""""""
mediamart.vn,https://mediamart.vn/cssk/camry/can-suc-khoe-camry-br2015_h103.htm,,Camry,Máy cạo râu,Cân sức khỏe Camry  BR2015_H103,199.000,,," . - Kích thước: 243 x 268 x 42mm. . - Trọng lượng tối đa: 120 kg. . - Sai số cho phép: <1kg. . - Sử dụng 2 lò xo chịu lực để đo trọng lượng cân. . - Đơn vị chia nhỏ nhất: 100g. . - Màu sắc: Hình ảnh thể thao, bắt mắt. . - Kết cấu tinh xảo, bền đẹp. . - Xuất xứ: Công nghệ Mỹ sản xuất tại Hồng Kông. . - Có thể sử dụng để: cân trọng lượng cơ thể, cân trọng lượng cho bé. . . . . . . Hình ảnh tham khảo: Cân sức khỏe Camry BR2015_H103. . . . . . . . . . . . . . . Thông số kỹ thuật: Cân sức khỏe Camry BR2015_H103. . . . . . . . . . Thông tin: Cân sức khỏe Camry BR2015_H103. . . Cân Sức Khỏe Camry BR2015_H103. . Cân Sức Khỏe Camry BR2015_H103 giúp bạn kiểm tra chính xác trọng lượng cơ và sức khỏe thường xuyên, từ đó bạn sẽ chủ động hơn trong việc giữ gìn vóc dáng thân hình của mình.. Thiết kế độc đáo với nhựa ABS cao cấp cho mức cân giới hạn lên đến 130kg, đồng thời, chất liệu nhựa cao cấp giúp việc làm sạch và di chuyển cân cũng trở nên dễ dàng và nhanh chóng hơn.. . . . . . . Tính năng sản phẩm:. - Có thể sử dụng để: cân trọng lượng cơ thể, cân trọng lượng cho bé….. - Chất liệu nhựa cao cấp có kết cấu vững chắc, giúp việc làm sạch và di chuyển cân trở nên nhẹ nhàng và nhanh chóng hơn.. - Trọng lượng cân tối đa 130kg: Phù hợp với nhu cầu đo trọng lượng cơ thể của các thành viên trong gia đình.. - Mặt đồng hồ hiển thị số đo rõng ràng và thể hiện tính chuyên nghiệp cũng như nâng cao yếu tố thẩm mỹ.. - Kích thước và thiết kế gọn nhẹ 243 x 268 x 42mm thuận lợi cho việc vệ sinh và di chuyển.. - Sử dụng 2 lò xo chịu lực để đo trọng lượng cân.. . . . . . Tư Vấn Mua Chăm sóc sức khỏe, Làm đẹp. . . . . . ",""""""
mediamart.vn,https://mediamart.vn/cssk/philips/may-cao-rau-philips-pq206.htm,,Philips,Máy cạo râu,Máy cạo râu Philips PQ206,380.000,,," . - Cạo sát một cách thoải mái. . - Căn chỉnh các lưỡi dao sát với da hơn để cạo sát nhất; đầu cạo xoay độc lập ôm theo đường cong trên mặt.. . - Lưỡi dao tự mài bén bền lâu đến hai năm.. . - Máy cao râu không dây dùng pin 2AA. . - Thân thiện với môi trường. . . . . Hình ảnh tham khảo: Máy cạo râu Philips PQ206. . . . . . . . . . . . . . . . . . . . . Thông số kỹ thuật: Máy cạo râu Philips PQ206. . . . . . . . . . Thông tin: Máy cạo râu Philips PQ206. . . Cạo râu sạch sẽ mang lại sự tự tin. . Cạo sát một cách thoải mái. Đầu cạo nhập khẩu cho bạn trải nghiệm cạo sát thoải mái. . . . . . Ôm theo đường cong trên khuôn mặt. Căn chỉnh các lưỡi dao sát với da hơn để cạo sát nhất; đầu cạo xoay độc lập ôm theo đường cong trên mặt.. . . . . Dao cạo tự mài bén. Lưỡi dao tự mài bén bền lâu đến hai năm.. . . . . Máy cao râu không dây dùng pin 2AA. Cạo râu không cần dùng dây tối đa 60 phút. . . . . Nguồn: Philips.com.vn. . . . . . . . Tư Vấn Mua Chăm sóc sức khỏe, Làm đẹp. . . . . . ",""""""
mediamart.vn,https://mediamart.vn/cssk/philips/tong-do-cat-toc-philips-qc5115.htm,,Philips,Máy cạo râu,Tông đơ cắt tóc Philips QC5115,990.000,,," . An toàn cho trẻ em. Lưỡi cắt không gỉ. Dễ dàng vệ sinh. 11 cài đặt. . . . . Hình ảnh tham khảo: Tông đơ cắt tóc Philips QC5115. . . . . . . . . . . . . . . . . . . . . . . . . . . . . . Thông số kỹ thuật: Tông đơ cắt tóc Philips QC5115. . . . . . . . . . Thông tin: Tông đơ cắt tóc Philips QC5115. . . An toàn cho trẻ em. Tông đơ cắt tóc với đầu cắt và lược lượn tròn trượt êm ái trên da mà không làm xước ra, giúp cắt tóc an toàn và dễ chịu, thao tác dễ dàng và điều khiển tối ưu.. . . Lưỡi cắt không gỉ. Lưỡi cắt bằng thép không gỉ, tự mài sắc duy trì sự sắc bén lâu dài để bảo đảm hiệu suất cắt tốt nhất và chỉ phải bảo trì tối thiểu.. . . Dễ dàng vệ sinh. Tông đơ cắt tóc Philips QC5115 có mô tơ mạnh mẽ và cực kỳ êm ái, ít rung giúp cắt tóc dễ dàng, nhanh chóng.. . . 11 cài đặt. Tông đơ cắt tóc Philips QC5115 trang bị 11 cài đặt độ dài, có thể khóa cố định từ 3 đến 21mm hoặc 0,5mm.. . . . . . . Tư Vấn Mua Chăm sóc sức khỏe, Làm đẹp. . . . . . ",""""""
mediamart.vn,https://mediamart.vn/cssk/philips/may-cao-rau-philips-at600.htm,,Philips,Máy cạo râu,Máy cạo râu Philips AT600,890.000,,," . - Điện áp tự động: 100-240 V. . - Tiêu hao điện tối đa: 2,0 W. . - Hệ Thống Cạo Râu: Aquatec ướt & khô, Đầu cạo CloseCut. . - Thời gian sạc: 10 giờ. . - Chỉ báo trên màn hình: Pin yếu, Sạc điện. . - Hoạt động: Pin sạc, Sử dụng không dây. . - Thời gian cạo: 30+ phút, tối đa 10 lần cạo. . - Màn hình: Chỉ báo 1 LED. . - Làm sạch: Hoàn toàn không thấm nước. . - Tay cầm: Tay cầm dễ dàng thuận tiện. . - Màu sắc: Đen & Xanh. . . . . Hình ảnh tham khảo: Máy cạo râu Philips AT600. . . . . . . . . . . . . . . Thông số kỹ thuật: Máy cạo râu Philips AT600. . . . . . . . . . Thông tin: Máy cạo râu Philips AT600. . . Aquatec: sảng khoái khi cạo râu ướt với bọt cạo râu hoặc cạo râu khô dễ dàng. . . Đầu bịt Aquatec trên máy cạo râu giúp cho máy có khả năng chống thấm nước 100%. Dùng máy cạo râu trong khi tắm cùng với kem hoặc bọt cạo râu ưa thích của bạn giúp bảo vệ da tốt hơn. Một cách tự nhiên, bạn cũng có thể cạo râu khô để thuận tiện. Sau khi cạo xong, bạn chỉ cần bật đầu cạo lên và rửa dưới vòi nước để làm sạch máy cạo râu một cách dễ dàng.. . . Lưới cắt CloseCut lướt nhẹ nhàng để cắt sát êm ái.. . . Lưỡi cắt CloseCut có các góc tròn, lướt nhẹ nhàng trên da để có thể cạo râu sát mà vẫn thoải mái.. . . Lưỡi dao hoạt động ổn định tới 2 năm.. . . Để có hiệu suất tối ưu, hãy thay các đầu cạo 2 năm một lần.. . . Sạc 10 giờ sẽ sử dụng không dây được hơn 30 phút.. . . Sử dụng không dây tiện lợi. Cho bạn 30+ phút sử dụng không dây. Sạc đầy trong 10 giờ.. . . Tay cầm tiện dụng để điều khiển tốt và chính xác hơn.. . . Tay cầm máy cạo râu có vị trí nắm tiện dụng với vỏ chống trượt, bảo đảm điều khiển tốt để cạo chính xác hơn.. . . Bảo hành 2 năm, điện áp toàn cầu và lưỡi cắt có thể thay thế.. . . Tất cả các máy cạo râu của chúng tôi đều có chế độ bảo hành toàn cầu 2 năm và có thể tự điều chỉnh để phù hợp với mọi mức điện áp.. . . . . . Tư Vấn Mua Chăm sóc sức khỏe, Làm đẹp. . . . . . ",""""""
