Domain,Url,Product_id,Rating,Comment,Review Time,Bought Time
tiki.vn,https://tiki.vn/ghe-van-phong-lung-luoi-e0-nomaline-xanh-luc-den-p4154077.html?src=category-page-1883.2150&2hi=0,4154077,5,"Cực kì hài lòng. Sản phẩm tốt, ngồi rất thoải mái, màu sắc đẹp, mua đúng đợi được giảm giá nên giá cả hợp lí :"">",2018-12-27 10:01:13,2018-12-19 08:09:56
tiki.vn,https://tiki.vn/ban-lien-ke-thong-minh-nabu-frlk03-p4612235.html?src=category-page-1883.2150&2hi=0,4612235,3,"Mặt bàn đẹp, chắc chắn, các chỗ khoan ốc làm ko cẩn thận. Mặt bàn, khung cũng khá chắc chắn, có thể điều chỉnh độ cân bằng giữa các chân bàn.
Tuy nhiên các lỗ khoan đinh ốc làm bị lệch khá nhiều, và có điều khó chấp nhận là có vài cái con tán bị sai kích thước, buộc phải ra ngoài tiệm mua bù vào cho phù hợp. Nói chung là gia công ko cẩn thận.
Được cái là các chi tiết trên mặt bàn khá tiện dụng, như chỗ để ly, ipad, laptop ...",2018-09-27 04:19:44,2018-09-19 08:59:22
tiki.vn,https://tiki.vn/tu-vai-3-buong-8-ngan-khung-go-p4986613.html?src=category-page-1883.2150&2hi=0,4986613,4,Cũng được. Nói chung là so với giá thì dùng cũng ok. Hơi mệt khoản lắp ráp thôi chứ chưa có vấn đề gì,2018-12-14 03:41:22,2018-10-25 02:54:59
tiki.vn,https://tiki.vn/tu-vai-3-buong-8-ngan-khung-go-p4986613.html?src=category-page-1883.2150&2hi=0,4986613,2,"Lắp đặt rất khó và cực. Các thanh gỗ và mối nối không khớp với nhau. Phải dùng búa gõ mệt thấy mẹ luôn. Vải trùm tủ cũng không kín hết tủ, bọc tới đáy thì bị hở ra, rất dễ bị gián chuột bò vào.",2018-12-13 17:01:18,2018-11-26 14:37:23
tiki.vn,https://tiki.vn/ke-sach-sepaltec-1575-nau-dam-p1578907.html?src=category-page-1883.2150&2hi=0,1578907,3,"Chất lượng chưa tương xứng với giá. Hoàn thiện chưa tốt, các thành gỗ rỗng, chỗ ghép hơi lệch, khó đạt được tiêu chí của Nhật.",2018-06-09 23:36:48,2018-06-06 03:15:57
tiki.vn,https://tiki.vn/thung-nhua-dung-do-co-banh-xe-nhieu-mau-sac-giao-mau-ngau-nhien-p4884693.html?src=category-page-1883.2150&2hi=0,4884693,3,bình thường. hình thức đẹp tuy nhiên giá chưa giảm là 500k có vẻ quá đắt cho sp này. sp này giá sau giảm là 190k có vẻ vẫn đắt. nếu nhìn trc thì mình k mua vs mức giá 190k,2018-11-28 03:58:20,2018-11-11 06:44:11
tiki.vn,https://tiki.vn/ke-sach-5-tang-nguyen-hanh-nh-s590-ngang-90cm-giao-ngau-nhien-p3776721.html?src=category-page-1883.2150&2hi=0,3776721,3,"kệ ko chắc chắn. Đầu tiên là vấn đề tiki giao chậm, mình ở HN mà hơn 10 ngày mới nhận đc hàng
Shipper ok
Tuy nhiên ko biết có phải do mình lắp lại ko mà giá khá ọp ẹp, nhất là chân đế, ko chắc chắn tẹo nào. 
Ai mua nên cân nhắc.Chưa kể ko đc chọn mẫu mà giao ngẫu nhiên",2018-12-23 11:03:53,2018-12-07 06:51:51
