Domain,Url,Product_id,Brand,Category,Model,Price,Seller,Tags,Info,Others
adayroi.com,https://www.adayroi.com/tui-xach-the-thao-ronal-tx18-mau-den-logo-xanh-la-p-1315471?offer=1315471_BEH,1315471,Ronal,Túi xách nam,Túi xách thể thao Ronal TX18 màu đen logo xanh lá, 159.000đ,HẢI HIỆP PHONG,"Balo nam Ronal,Túi xách thể thao Ronal TX18,Túi xách thể thao Ronal,Túi xách tập Gym","Sản phẩm được làm từ chất liệu vải dù. Đường chỉ dày, đều và đẹp mắt. Màu sắc hài hòa, sang trọng. Bảo hành 36 tháng. Bảo hành (Tháng) 36tháng Chất liệu vải Vải dù Xuất xứ Việt Nam Chất liệu Vải dù Màu sắc Đen Xuất xứ Việt Nam Chất liệu Vải dù Bảo hành (Tháng) 36tháng Màu sắc Đen Kích thước 53 x 30 x 20cm. Túi xách du lịch thể thao của thương hiệu Ronal là một trong những mẫu túi thời trang bán chạy hiện nay. Thiết kế dáng túi rộng giúp bạn dễ dàng sắp xếp vật dụng cá nhân một cách khoa học và gọn gàng. Thích hợp cho những buổi tập gym, du lịch, về quê, lên phố. Túi xách có thiết kế với tông màu đen in logo Ronal nổi bật, có 1 ngăn chứa đồ rộng rãi, ngăn phụ bên hông đựng những vật dụng câng thiết khác.Túi xách Ronal được may bằng chất liệu vải dù cao cấp đảm bảo độ dày dặn, bền, chịu lực tốt phù hợp mang đồ đạc nặng cho bạn yên tâm sử dụng. Hướng dẫn sử dụng: Không để sản phẩm gần lửa hoặc những nơi có nhiệt độ cao Không dùng bàn ủi để ủi thắng Không giặt bằng máy Thông tin thương hiệu: Ronal đã và đang trở thành một trong những thương hiệu ba lô, túi xách hàng đầu Việt Nam với mục tiêu chinh phục khách hàng bằng chính chất lượng và kiểu dáng thời trang hiện đại. Các dòng sản phẩm của Ronal đều được sử dụng chất liệu vải nhập từ Hàn Quốc, các khóa kéo chất lượng được sản xuất tại Việt Nam, cũng như mọi thiết kế đều được đầu tư kỹ lưỡng nhằm mang đến nhiều tiện ích nhất cho người sử dụng.",""""""
adayroi.com,https://www.adayroi.com/tui-xach-du-lich-dah2-tnam0005n-mau-nau-p-PRI1076367?offer=PRI1076367_BFS,PRI1076367,DaH2,Túi xách nam,Túi xách du lịch DaH2 TNAM0005N màu nâu, 399.000đ,DO DA H2,"Túi xách nam DaH2,túi đeo chéo du lịch,túi xách du lịch,túi xách,DaH2","Túi xách du lịch DaH2 TNAM0005N màu nâu được thiết kế kiểu dáng thời trang cùng chất liệu da bền đẹp rất phù hợp cho các chuyến đi chơi, du lịch, dã ngoại. Túi phù hợp cho cả nam và nữ.. Chất liệu da cao cấp, mềm mịn . Thiết kế ngăn lớn tạo không gian thoải mái để đựng đồ . Quai xách kèm dây đeo có thể tháo rời . Màu nâu . Đường may tỉ mỉ, chắc chắn . Xuất xứ: Việt Nam . Bảo hành bề mặt da 12 tháng . Xuất xứ Việt Nam Chất liệu Da Rộng 23cm Cao 19cm Dài 45cm. Hướng dẫn bảo quản Vệ sinh bằng khăn ẩm mềm Tránh tiếp xúc trực tiếp với môi trường xăng dầu, kiềm Sử dụng loại xi phù hợp với màu sắc, chất liệu da Thông tin thương hiệu DaH2 là thương hiệu túi xách, phụ kiện chuyên về đồ da cao cấp, sản xuất tại Việt Nam. Các sản phẩm DaH2 sở hữu màu sắc sang trọng, đường chỉ may chắc chắn, cho bạn những sản phẩm đẹp về hình thức, bền về chất lượng. Nhờ áp dụng các công nghệ sản xuất tiên tiến cùng chất liệu da thật 100%, DaH2 mang đến cho khách hàng những sản phẩm đồ da mềm mại, dẻo dai, bền bỉ, càng sử dụng lâu càng sáng bóng. Qua nhiều năm phát triển, thương hiệu đồ da DaH2 ngày càng được ưa chuộng nhằm tôn lên vẻ ngoài sang trọng, thời trang cho khách hàng với mức giá vô cùng hợp lý.",""""""
adayroi.com,https://www.adayroi.com/tui-xach-du-lich-dah2-tnam0005n-mau-den-p-PRI1076389?offer=PRI1076389_BFS,PRI1076389,DaH2,Túi xách nam,Túi xách du lịch DaH2 TNAM0005N màu đen, 399.000đ,DO DA H2,Túi xách nam DaH2,"Túi xách du lịch DaH2 TNAM0005N màu đen được thiết kế kiểu dáng thời trang cùng chất liệu da bền đẹp rất phù hợp cho các chuyến đi chơi, du lịch, dã ngoại. Túi phù hợp cho cả nam và nữ.. Chất liệu da cao cấp, mềm mịn . Thiết kế ngăn lớn tạo không gian thoải mái để đựng đồ . Quai xách kèm dây đeo có thể tháo rời . Màu đen . Đường may tỉ mỉ, chắc chắn . Xuất xứ: Việt Nam . Bảo hành bề mặt da 12 tháng . Xuất xứ Việt Nam Chất liệu Da Rộng 23cm Cao 19cm Dài 45cm. Hướng dẫn bảo quản Vệ sinh bằng khăn ẩm mềm Tránh tiếp xúc trực tiếp với môi trường xăng dầu, kiềm Sử dụng loại xi phù hợp với màu sắc, chất liệu da Thông tin thương hiệu DaH2 là thương hiệu túi xách, phụ kiện chuyên về đồ da cao cấp, sản xuất tại Việt Nam. Các sản phẩm DaH2 sở hữu màu sắc sang trọng, đường chỉ may chắc chắn, cho bạn những sản phẩm đẹp về hình thức, bền về chất lượng. Nhờ áp dụng các công nghệ sản xuất tiên tiến cùng chất liệu da thật 100%, DaH2 mang đến cho khách hàng những sản phẩm đồ da mềm mại, dẻo dai, bền bỉ, càng sử dụng lâu càng sáng bóng. Qua nhiều năm phát triển, thương hiệu đồ da DaH2 ngày càng được ưa chuộng nhằm tôn lên vẻ ngoài sang trọng, thời trang cho khách hàng với mức giá vô cùng hợp lý.",""""""
adayroi.com,https://www.adayroi.com/tui-xach-nam-lata-ca12-nau-dam-p-PRI948911?offer=PRI948911_F4M,PRI948911,LATA,Túi xách nam,Túi xách nam LATA CA12 nâu đậm, 425.000đ,NGUYEN TAN,Túi xách nam LATA,"Túi xách nam LATA CA12 nâu đậm được làm từ da tổng hợp cao cấp, thiết kế đơn giản cùng đường chỉ may tỉ mỉ, tinh tế là phụ kiện hoàn hảo mang đến cho phái mạnh phong cách lịch lãm mà vẫn hợp thời trang.. Chất liệu da tổng hợp cao cấp, không thấm nước . Lớp lót bên trong bằng nhung bền bỉ và rất êm . Quai xách đơn chắc chắn, kèm dây quai đeo có thể điều chỉnh độ dài . 2 ngăn chính đựng vừa sách vở, laptop và nhiều ngăn nhỏ . Xuất xứ: Việt Nam . Xuất xứ Việt Nam Chất liệu Da Số đo sản phẩm thực tế Chiều ngang : 36cm, Độ cao: 28cm, Độ rộng: 7cm. Phụ kiện cho nam giới là một khái niệm rộng lớn mà trong đó phần đông chỉ chú ý đến giày và dây lưng. Những chiếc túi xách cũng là món đồ phụ kiện không kém phần quan trọng, nhất là khi bạn đã bước ra khỏi ghế nhà trường và bắt đầu đi làm. Dành thời gian và tiền bạc để chọn ra ít nhất một vài chiếc túi có chất lượng tốt mà có thể sử dụng trong đa số hoàn cảnh là rất đáng giá. Túi xách nam LATA CA12 nâu đậm được làm từ chất liệu da tổng hợp cao cấp, siêu bền, siêu mềm giúp bạn sử dụng trong thời gian dài mà không cần lo lắng sản phẩm bị bong hay nổ da. Mép túi được may khít và phẳng, đường chỉ may hoàn thiện tỉ mỉ, tinh tế. Túi xách LATA CA12 hoàn toàn có thể gọi là một chiếc túi xách đa năng. Sở dĩ như vậy vì chiếc túi dù nhỏ gọn nhưng vẫn đựng được rất nhiều thứ. Ngoài ngăn chính có kích thước vừa một chiếc laptop 14inch thì sản phẩm còn có các ngăn khác để đựng sổ, bút, điện thoại... rất gọn gàng. THÔNG TIN BẢO HÀNH Bảo hành suốt thời gian sử dụng với nguyên phụ liệu hư hỏng, lỗi kỹ thuật của nhà sản xuất như: đường may bị lỗi, sứt chỉ, móc khóa hư Trong thời gian sử dụng nếu dây kéo bị hư hỏng sẽ được thay miễn phí Bảo hành tại cửa hàng LATA: 690 Cách Mạng Tháng Tám, phường 5, quận Tân Bình, TP. HCM LƯU Ý : Không bảo hành với những trường hợp bị rách đứt, bị móc rách hoặc ảnh hưởng của nhiệt độ cao. Hướng dẫn bảo quản Không nên để túi tiếp xúc nhiều với xà phòng Có thể vệ sinh bằng khăn ẩm và các dung dịch làm sạch đã pha loãng Trong trường hợp không có sẵn dung dịch làm sạch, có thể pha loãng dầu gội đầu và lau túi nhẹ nhàng với khăn sạch hoặc dùng cồn cùng một chút ít xà phòng để chà nhẹ lên bề mặt vết bẩn Lau khô hoàn toàn sau khi vệ sinh Thông tin thương hiệu LATA là một trong những thương hiệu túi xách được ưa chuộng trên thị trường hiện nay. Hướng đến đối tượng khách hàng là những bạn trẻ, LATA chú trọng đến thiết kế mang phong cách hiện đại và trẻ trung. Chất liệu cao cấp, tính tiện dụng cao và giá cả hợp lý, LATA sẽ là lựa chọn tốt nhất dành cho bạn.",""""""
adayroi.com,https://www.adayroi.com/tui-xach-nam-lata-ca12-nau-vang-p-PRI948898?offer=PRI948898_F4M,PRI948898,LATA,Túi xách nam,Túi xách nam LATA CA12 nâu vàng, 425.000đ,NGUYEN TAN,Túi xách nam LATA,"Túi xách nam LATA CA12 nâu vàng được làm từ da tổng hợp cao cấp, thiết kế đơn giản cùng đường chỉ may tỉ mỉ, tinh tế là phụ kiện hoàn hảo mang đến cho phái mạnh phong cách lịch lãm mà vẫn hợp thời trang.. Chất liệu da tổng hợp cao cấp, không thấm nước . Lớp lót bên trong bằng nhung bền bỉ và rất êm . Quai xách đơn chắc chắn, kèm dây quai đeo có thể điều chỉnh độ dài . 2 ngăn chính đựng vừa sách vở, laptop và nhiều ngăn nhỏ . Xuất xứ: Việt Nam . Xuất xứ Việt Nam Chất liệu Da Số đo sản phẩm thực tế Chiều ngang : 36cm, Độ cao: 28cm, Độ rộng: 7cm. Phụ kiện cho nam giới là một khái niệm rộng lớn mà trong đó phần đông chỉ chú ý đến giày và dây lưng. Những chiếc túi xách cũng là món đồ phụ kiện không kém phần quan trọng, nhất là khi bạn đã bước ra khỏi ghế nhà trường và bắt đầu đi làm. Dành thời gian và tiền bạc để chọn ra ít nhất một vài chiếc túi có chất lượng tốt mà có thể sử dụng trong đa số hoàn cảnh là rất đáng giá. Túi xách nam LATA CA12 nâu vàng ​ được làm từ chất liệu da tổng hợp cao cấp, siêu bền, siêu mềm giúp bạn sử dụng trong thời gian dài mà không cần lo lắng sản phẩm bị bong hay nổ da. Mép túi được may khít và phẳng, đường chỉ may hoàn thiện tỉ mỉ, tinh tế. Túi xách LATA CA12 hoàn toàn có thể gọi là một chiếc túi xách đa năng. Sở dĩ như vậy vì chiếc túi dù nhỏ gọn nhưng vẫn đựng được rất nhiều thứ. Ngoài ngăn chính có kích thước vừa một chiếc laptop 14inch thì sản phẩm còn có các ngăn khác để đựng sổ, bút, điện thoại... rất gọn gàng. THÔNG TIN BẢO HÀNH Bảo hành suốt thời gian sử dụng với nguyên phụ liệu hư hỏng, lỗi kỹ thuật của nhà sản xuất như: đường may bị lỗi, sứt chỉ, móc khóa hư Trong thời gian sử dụng nếu dây kéo bị hư hỏng sẽ được thay miễn phí Bảo hành tại cửa hàng LATA: 690 Cách Mạng Tháng Tám, phường 5, quận Tân Bình, TP. HCM LƯU Ý : Không bảo hành với những trường hợp bị rách đứt, bị móc rách hoặc ảnh hưởng của nhiệt độ cao. Hướng dẫn bảo quản Không nên để túi tiếp xúc nhiều với xà phòng Có thể vệ sinh bằng khăn ẩm và các dung dịch làm sạch đã pha loãng Trong trường hợp không có sẵn dung dịch làm sạch, có thể pha loãng dầu gội đầu và lau túi nhẹ nhàng với khăn sạch hoặc dùng cồn cùng một chút ít xà phòng để chà nhẹ lên bề mặt vết bẩn Lau khô hoàn toàn sau khi vệ sinh Thông tin thương hiệu LATA là một trong những thương hiệu túi xách được ưa chuộng trên thị trường hiện nay. Hướng đến đối tượng khách hàng là những bạn trẻ, LATA chú trọng đến thiết kế mang phong cách hiện đại và trẻ trung. Chất liệu cao cấp, tính tiện dụng cao và giá cả hợp lý, LATA sẽ là lựa chọn tốt nhất dành cho bạn.",""""""
adayroi.com,https://www.adayroi.com/tui-xach-nam-lata-ca12-mau-den-p-PRI948925?offer=PRI948925_F4M,PRI948925,LATA,Túi xách nam,Túi xách nam LATA CA12 màu đen, 425.000đ,NGUYEN TAN,Túi xách nam LATA,"Túi xách nam LATA CA12 màu đen được làm từ da tổng hợp cao cấp, thiết kế đơn giản cùng đường chỉ may tỉ mỉ, tinh tế là phụ kiện hoàn hảo mang đến cho phái mạnh phong cách lịch lãm mà vẫn hợp thời trang.. Chất liệu da tổng hợp cao cấp, không thấm nước . Lớp lót bên trong bằng nhung bền bỉ và rất êm . Quai xách đơn chắc chắn, kèm dây quai đeo có thể điều chỉnh độ dài . 2 ngăn chính đựng vừa sách vở, laptop và nhiều ngăn nhỏ . Xuất xứ: Việt Nam . Xuất xứ Việt Nam Chất liệu Da Số đo sản phẩm thực tế Chiều ngang : 35cm, Độ cao: 28cm, Độ rộng: 7cm. Phụ kiện cho nam giới là một khái niệm rộng lớn mà trong đó phần đông chỉ chú ý đến giày và dây lưng. Những chiếc túi xách cũng là món đồ phụ kiện không kém phần quan trọng, nhất là khi bạn đã bước ra khỏi ghế nhà trường và bắt đầu đi làm. Dành thời gian và tiền bạc để chọn ra ít nhất một vài chiếc túi có chất lượng tốt mà có thể sử dụng trong đa số hoàn cảnh là rất đáng giá. Túi xách nam LATA CA12 màu đen​ được làm từ chất liệu da tổng hợp cao cấp, siêu bền, siêu mềm giúp bạn sử dụng trong thời gian dài mà không cần lo lắng sản phẩm bị bong hay nổ da. Mép túi được may khít và phẳng, đường chỉ may hoàn thiện tỉ mỉ, tinh tế. Túi xách LATA CA12 hoàn toàn có thể gọi là một chiếc túi xách đa năng. Sở dĩ như vậy vì chiếc túi dù nhỏ gọn nhưng vẫn đựng được rất nhiều thứ. Ngoài ngăn chính có kích thước vừa một chiếc laptop 14inch thì sản phẩm còn có các ngăn khác để đựng sổ, bút, điện thoại... rất gọn gàng. THÔNG TIN BẢO HÀNH Bảo hành suốt thời gian sử dụng với nguyên phụ liệu hư hỏng, lỗi kỹ thuật của nhà sản xuất như: đường may bị lỗi, sứt chỉ, móc khóa hư Trong thời gian sử dụng nếu dây kéo bị hư hỏng sẽ được thay miễn phí Bảo hành tại cửa hàng LATA: 690 Cách Mạng Tháng Tám, phường 5, quận Tân Bình, TP. HCM LƯU Ý : Không bảo hành với những trường hợp bị rách đứt, bị móc rách hoặc ảnh hưởng của nhiệt độ cao. Hướng dẫn bảo quản Không nên để túi tiếp xúc nhiều với xà phòng Có thể vệ sinh bằng khăn ẩm và các dung dịch làm sạch đã pha loãng Trong trường hợp không có sẵn dung dịch làm sạch, có thể pha loãng dầu gội đầu và lau túi nhẹ nhàng với khăn sạch hoặc dùng cồn cùng một chút ít xà phòng để chà nhẹ lên bề mặt vết bẩn Lau khô hoàn toàn sau khi vệ sinh Thông tin thương hiệu LATA là một trong những thương hiệu túi xách được ưa chuộng trên thị trường hiện nay. Hướng đến đối tượng khách hàng là những bạn trẻ, LATA chú trọng đến thiết kế mang phong cách hiện đại và trẻ trung. Chất liệu cao cấp, tính tiện dụng cao và giá cả hợp lý, LATA sẽ là lựa chọn tốt nhất dành cho bạn.",""""""
adayroi.com,https://www.adayroi.com/cap-laptop-kimta-senior-msn0116gy-mau-xam-p-PRI909391?offer=PRI909391_N2Q,PRI909391,Kimtabags,Túi xách nam,Cặp laptop Kimta Senior MSN0116GY màu xám, 574.000đ,NUMBER ONE,Túi xách nam Kimtabags,"Cặp laptop Kimta Senior MSN0116GY màu xám được thiết kế với kiểu dáng thời trang, khỏe khoắn. Các ngăn được phân chia khoa học mang tới sự tiện lợi tối đa cho người sử dụng, giúp bạn thoải mái di chuyển mọi nơi cùng với tất cả những vật dụng cần thiết.. Chất liệu: Vải nylon phối da bò có khả năng chống thấm nước, chống bám bụi, không mùi hôi và không độc hại . Có ngăn chống sốc đựng laptop chuyên dụng, chống va vấp . Dây kéo YKK chắc chắn, trơn tru . Quai đeo 2 trong 1 chuyển đổi giữa balo và cặp táp khi cần thiết. . Kích thước (RộngxCaoxSâu): 40x32x14 (cm) ( Phù hợp với laptop 15 inch) . Trọng lượng: 1,07kg . Xuất xứ: Việt Nam . Sản phẩm được bảo hành trọn đời . Xuất xứ Việt Nam Chất liệu vải Vải nylon Số đo sản phẩm thực tế 40x32x14 (cm) ( Phù hợp với laptop 15 inch). Ngày nay, một chiếc túi xách đa năng là sự lựa chọn hàng đầu của mọi người, từ học sinh, sinh viên đến người đi làm bởi sự tiện lợi và gọn nhẹ của nó. Chỉ với một chiếc túi với kích cỡ vừa phải, bạn đã có thể cất gọn những vật dụng cần mang theo bên mình như laptop, điện thoại, ví, bình đựng nước...và lấy ra sử dụng dễ dàng ở mọi nơi khi cần. Chiếc túi xách cũng là món phụ kiện kết hợp với trang phục, góp phần tạo nên hình ảnh trẻ trung, năng động hay cá tính tùy thuộc vào sản phẩm mà bạn lựa chọn. Cặp laptop Kimta Senior MSN0116GY màu xám được thiết kế với kiểu dáng thời trang, khỏe khoắn. Các ngăn được phân chia khoa học mang tới sự tiện lợi tối đa cho người sử dụng, giúp bạn thoải mái di chuyển mọi nơi cùng với tất cả những vật dụng cần thiết. Hướng dẫn bảo quản Không để sản phẩm ở những không gian hẹp, hoặc bị chèn ép Giặt và phơi khô sản phẩm định kỳ Không đựng khối lượng quá nặng Thông tin thương hiệu Kimtabags được thành lập năm 2007, là một xưởng sản xuất balo - túi xách có qui mô nhỏ. Kimtabags mong muốn tạo ra những loại túi có chất lượng tốt, bền đẹp, có công năng phù hợp với các mục đích khác nhau của người sử dụng. Công ty đã, đang và sẽ phấn đấu theo phương châm: ""Chất lượng thật tốt - Giá hợp lý - Giao hàng đúng tiến độ - Dịch vụ chu đáo"" để đạt được niềm tin của Quý Khách Hàng.",""""""
adayroi.com,https://www.adayroi.com/cap-laptop-kimta-senior-msn0116br-mau-nau-p-PRI909387?offer=PRI909387_N2Q,PRI909387,Kimtabags,Túi xách nam,Cặp laptop Kimta Senior MSN0116BR màu nâu, 574.000đ,NUMBER ONE,Túi xách nam Kimtabags,"Cặp laptop Kimta Senior MSN0116BR màu nâu được thiết kế với kiểu dáng thời trang, khỏe khoắn. Các ngăn được phân chia khoa học mang tới sự tiện lợi tối đa cho người sử dụng, giúp bạn thoải mái di chuyển mọi nơi cùng với tất cả những vật dụng cần thiết.. Chất liệu: Vải nylon phối da bò có khả năng chống thấm nước, chống bám bụi, không mùi hôi và không độc hại . Có ngăn chống sốc đựng laptop chuyên dụng, chống va vấp . Dây kéo YKK chắc chắn, trơn tru . Quai đeo 2 trong 1 chuyển đổi giữa balo và cặp táp khi cần thiết. . Kích thước (RộngxCaoxSâu): 40x32x14 (cm) ( Phù hợp với laptop 15 inch) . Trọng lượng: 1,07kg . Xuất xứ: Việt Nam . Sản phẩm được bảo hành trọn đời . Xuất xứ Việt Nam Chất liệu vải Vải nylon Số đo sản phẩm thực tế 40x32x14 (cm) ( Phù hợp với laptop 15 inch). Ngày nay, một chiếc túi xách đa năng là sự lựa chọn hàng đầu của mọi người, từ học sinh, sinh viên đến người đi làm bởi sự tiện lợi và gọn nhẹ của nó. Chỉ với một chiếc túi với kích cỡ vừa phải, bạn đã có thể cất gọn những vật dụng cần mang theo bên mình như laptop, điện thoại, ví, bình đựng nước...và lấy ra sử dụng dễ dàng ở mọi nơi khi cần. Chiếc túi xách cũng là món phụ kiện kết hợp với trang phục, góp phần tạo nên hình ảnh trẻ trung, năng động hay cá tính tùy thuộc vào sản phẩm mà bạn lựa chọn. Cặp laptop Kimta Senior MSN0116BR màu nâu được thiết kế với kiểu dáng thời trang, khỏe khoắn. Các ngăn được phân chia khoa học mang tới sự tiện lợi tối đa cho người sử dụng, giúp bạn thoải mái di chuyển mọi nơi cùng với tất cả những vật dụng cần thiết. Hướng dẫn bảo quản Không để sản phẩm ở những không gian hẹp, hoặc bị chèn ép Giặt và phơi khô sản phẩm định kỳ Không đựng khối lượng quá nặng Thông tin thương hiệu Kimtabags được thành lập năm 2007, là một xưởng sản xuất balo - túi xách có qui mô nhỏ. Kimtabags mong muốn tạo ra những loại túi có chất lượng tốt, bền đẹp, có công năng phù hợp với các mục đích khác nhau của người sử dụng. Công ty đã, đang và sẽ phấn đấu theo phương châm: ""Chất lượng thật tốt - Giá hợp lý - Giao hàng đúng tiến độ - Dịch vụ chu đáo"" để đạt được niềm tin của Quý Khách Hàng.",""""""
adayroi.com,https://www.adayroi.com/cap-laptop-kimta-senior-msn0116bl-bl-mau-den-p-PRI909372?offer=PRI909372_N2Q,PRI909372,Kimtabags,Túi xách nam,Cặp laptop Kimta Senior MSN0116BL/BL màu đen, 574.000đ,NUMBER ONE,Túi xách nam Kimtabags,"Cặp laptop Kimta Senior MSN0116BL/BL màu đen được thiết kế với kiểu dáng thời trang, khỏe khoắn. Các ngăn được phân chia khoa học mang tới sự tiện lợi tối đa cho người sử dụng, giúp bạn thoải mái di chuyển mọi nơi cùng với tất cả những vật dụng cần thiết.. Chất liệu: Vải nylon phối da bò có khả năng chống thấm nước, chống bám bụi, không mùi hôi và không độc hại . Có ngăn chống sốc đựng laptop chuyên dụng, chống va vấp . Dây kéo YKK chắc chắn, trơn tru . Quai đeo 2 trong 1 chuyển đổi giữa balo và cặp táp khi cần thiết. . Kích thước (RộngxCaoxSâu): 40x32x14 (cm) ( Phù hợp với laptop 15 inch) . Trọng lượng: 1,07kg . Xuất xứ: Việt Nam . Sản phẩm được bảo hành trọn đời . Xuất xứ Việt Nam Chất liệu vải Vải nylon Số đo sản phẩm thực tế 40x32x14 (cm) ( Phù hợp với laptop 15 inch). Ngày nay, một chiếc túi xách đa năng là sự lựa chọn hàng đầu của mọi người, từ học sinh, sinh viên đến người đi làm bởi sự tiện lợi và gọn nhẹ của nó. Chỉ với một chiếc túi với kích cỡ vừa phải, bạn đã có thể cất gọn những vật dụng cần mang theo bên mình như laptop, điện thoại, ví, bình đựng nước...và lấy ra sử dụng dễ dàng ở mọi nơi khi cần. Chiếc túi xách cũng là món phụ kiện kết hợp với trang phục, góp phần tạo nên hình ảnh trẻ trung, năng động hay cá tính tùy thuộc vào sản phẩm mà bạn lựa chọn. Cặp laptop Kimta Senior MSN0116BL/BL màu đen được thiết kế với kiểu dáng thời trang, khỏe khoắn. Các ngăn được phân chia khoa học mang tới sự tiện lợi tối đa cho người sử dụng, giúp bạn thoải mái di chuyển mọi nơi cùng với tất cả những vật dụng cần thiết. Hướng dẫn bảo quản Không để sản phẩm ở những không gian hẹp, hoặc bị chèn ép Giặt và phơi khô sản phẩm định kỳ Không đựng khối lượng quá nặng Thông tin thương hiệu Kimtabags được thành lập năm 2007, là một xưởng sản xuất balo - túi xách có qui mô nhỏ. Kimtabags mong muốn tạo ra những loại túi có chất lượng tốt, bền đẹp, có công năng phù hợp với các mục đích khác nhau của người sử dụng. Công ty đã, đang và sẽ phấn đấu theo phương châm: ""Chất lượng thật tốt - Giá hợp lý - Giao hàng đúng tiến độ - Dịch vụ chu đáo"" để đạt được niềm tin của Quý Khách Hàng.",""""""
