Domain,Url,Product_id,Brand,Category,Model,Price,Seller,Tags,Info,Others
tiki.vn,https://tiki.vn/dong-ho-day-silicon-nu-timex-ironman-essentials-38mm-tw5m17300-p3004573.html?src=category-page-914.27498.8371&2hi=0,3004573,Timex,Đồng hồ,,1.650.000 ₫,DAINESE VIETNAM,," Đồng Hồ Dây Silicon Nam Timex Ironman Essentials 38mm - TW5M17300 sử dụng dây silicon thời trang, bền chắc, thiết kế đơn giản, mang đến cho bạn cảm giác thoải mái khi đeo. Sản phẩm có vỏ thép không gỉ bền bỉ, dễ dàng phối đồ, là một item thời trang được ưa chuộng bởi các tín đồ thời trang trên thế giới. Đồng hồ được làm từ dây chuyền công nghệ tiên tiến của Mỹ với mặt đồng hồ được chế tác từ kính khoáng có tráng lớp chống xước cứng cáp, chống chịu va đập tốt. Vỏ đồng hồ có bề mặt bóng sáng, bền đẹp, giúp bảo vệ lõi máy bên trong hiệu quả. Kiểu dáng mặt tròn đơn giản, tinh tế mang phong cách hiện đại, trẻ trung, năng động. Đồng hồ có khả năng chống thấm nước cao, dùng tốt trong môi trường nước như đi mưa, rửa tay, rửa mặt,... ",""""""
tiki.vn,https://tiki.vn/dong-ho-nam-day-thep-khong-gi-julius-ja-426-40mm-mat-den-p619808.html?src=category-page-914.27498.8371&2hi=0,619808,Julius,Đồng hồ,,590.000 ₫,Black Cat Watch,," Đồng Hồ Nam Dây Thép Không Gỉ Julius JA - 426 (40mm) - Mặt Đen có thiết kế thời trang với khung viền màu bạc sáng bóng sang trọng cùng dây thép cá tính, sản phẩm giúp tôn lên vẻ ngoài lịch lãm và sành điệu cho các quý ông. Dây đeo làm từ các mắt xích kim loại bóng sáng và chống rỉ sét. Khung viền bằng thép không gỉ siêu bền, bảo vệ tối ưu lõi máy bên trong khỏi các tác nhân gây hại từ môi trường. Mặt kính pha khoáng cao cấp, chống va đập và dễ dàng lau sạch bằng khăn mềm khi bám bụi. Đồng hồ có khả năng chống thấm nước 3 ATM. ",""""""
tiki.vn,https://tiki.vn/dong-ho-nu-julius-ja-1018-8mm-nude-p988605.html?src=category-page-914.27498.8371&2hi=0,988605,Julius,Đồng hồ,,549.000 ₫,Black Cat Watch,," Đồng Hồ Nữ Julius JA 1018 (8mm) - Nude được thiết kế từ dây chuyền công nghệ hiện đại đến từ Hàn Quốc của thương hiệu nổi tiếng Julius. Đồng hồ kiểu dáng độc đáo, hiện đại phối tông màu nổi bật, kết hợp hệ thống số cũng như kim chỉ giờ chính xác, rõ ràng, không chỉ mang đến cho bạn phong cách trẻ trung, sang trọng mà còn giúp quản lý thời gian dễ dàng. Thiết kế khóa gài dễ sử dụng, có thể điều chỉnh sao cho vừa vặn với cổ tay, tạo cảm giác thoải mái khi đeo. Sản phẩm có dây được làm bằng da Genuine Leather có độ bền cao. Vỏ máy được làm từ hợp kim mạ ion vàng hồng, sử dụng công nghệ mạ IP chân không tiên tiến giúp đem lại độ sáng bóng và bền màu. Đồng hồ có thể chịu nước, có thể đi mưa, rửa tay, rửa mặt; tuy nhiên không dùng đi tắm, đi bơi. Ngoài ra, bạn có thể phối đồng hồ cùng nhiều kiểu trang phục khác nhau mỗi khi đi làm, đi học hay đi chơi cùng bạn bè, người thân. ",""""""
tiki.vn,https://tiki.vn/dong-ho-unisex-day-da-timex-fairfield-tw2p97900-p582749.html?src=category-page-914.27498.8371&2hi=0,582749,Timex,Đồng hồ,,1.399.000 ₫,Tiki Trading,," Đồng Hồ Unisex Dây Da Timex Fairfield TW2P97900 có lối phối màu trẻ trung với tông màu nâu trầm của dây đeo kết hợp với mặt màu xám phong cách giúp tạo điểm nhấn cổ điển, thanh lịch và mà vẫn rất thời trang cho người mang. Phái mạnh có thể kết hợp chiếc đồng hồ này với 1 hoặc 2 vòng tay bằng da, dây thừng hay kim loại để trông nổi bật và cá tính hơn. Sử dụng công nghệ đèn nền INDIGLO có chức năng phát sáng bề mặt, giúp dễ quan sát trong môi trường ánh sáng yếu. Dây đeo màu nâu da bò, được làm bằng chất liệu da cao cấp, chống bong tróc và sờn rách. Sử dụng khóa cài xỏ lỗ truyền thống. Vỏ đồng hồ bằng thép không gỉ siêu bền, chống hoen gỉ. Mặt kính khoáng có tráng lớp chống xước cứng cáp, chống chịu va đập tốt. Màu sắc mặt: Xám. Màu sắc số hiển thị: Nâu nhạt. Có nút điều chỉnh bên hông. Đồng hồ có khả năng chịu nước 30m. Chỉ số giờ, phút chi tiết và chuẩn xác. ",""""""
tiki.vn,https://tiki.vn/dong-ho-nu-the-thao-skmei-1252-dha560-p3518983.html?src=category-page-914.27498.8371&2hi=0,3518983,SKMEI,Đồng hồ,,237.000 ₫,Chuẩn Mua,," Đồng Hồ Nữ SKMEI 1252 Dây Sắt - DHA560 Đồng Hồ điện tử mặt vuông SKMEI 1252 có khả năng chống thấm nước 3ATM, sử dụng tốt trong môi trường nước như đi mưa, rửa tay,… cho bạn sự yên tâm. Thiết kế mặt vuông cách điệu tinh tế, độc đáo, nhỏ nhắn và xinh xắn thu hút mọi ánh nhìn. Quả thật sẽ là món phụ kiện thời trang sang trọng, thanh lịch và thật hấp dẫn dành cho các bạn nữ nhà mình... THÔNG TIN CHI TIẾT TỪ Thương hiệu: Skmei Chính Hãng Kiểu máy: Quartz Dành cho: Nữ Chất liệu mặt trước: Kính cứng Chất liệu dây: Hợp kim Mặt kính: Phẳng Kích thước mặt: 25mm x 30mm Kích thước dây: 10mm Độ dày mặt: 9mm Độ dày dây: 2mm Xem giờ / phút điện tử Số lịch: Lịch ngày / tháng điện tử Độ chịu nước: Chịu nước tốt; tránh các hoạt động bơi lội Năng lượng sử dụng: Pin chuẩn Chức năng: + Xem giờ/phút, thứ/ngày/tháng + Hẹn giờ báo thức + Bấm giờ BỘ SẢN PHẨM BÁN CHUẨN GỒM 1 Đồng hồ Skmei Chính Hãng 1 Phiếu bảo hành 1 Hộp đồng hồ Logo Skmei ",""""""
tiki.vn,https://tiki.vn/dong-ho-nam-kingnuos-tayaki-mhwking01-trang-p2151755.html?src=category-page-914.27498.8371&2hi=0,2151755,KINGNUOS,Đồng hồ,,148.000 ₫,Thời trang cao cấp,," Mỗi người mỗi tính khác nhau , sở thích cũng vậy không ai giống ai cả . Có người thì thích đơn giản , có người thì thích cầu kì và cũng có người thì thích những thứ cổ điển . Tìm được một chiếc đồng hồ đẹp mang phong cách thời trang hiện đại hợp với mình thì nó quá đơn giản nhưng nếu bắt bạn tìm một chiếc đồng hồ cổ điển nhưng vẫn thể hiện được phong cách thời trang không kém cạnh những chiếc đồng hồ hiện đại thì nó lại là một chuyện khó . Tuy nhiên , đồng hồ KINGNUOS 1850 làm được điều đó . Mặc dù với thiết đơn giản , cổ điển nhưng KINGNUOS vẫn cuốn hút được mọi ánh nhìn bởi sự sang trọng , lịch lãm và mạnh mẽ . Đặc biệt là vẫn không hề thua thiệt những chiếc đồng hồ khác . ------- Thông tin sản phẩm --------- Đồng hồ Kingnous chính hãng Phong cách thời trang : thanh lịch cổ điển Năng lượng : Pin Số kim : 3 kim , có lịch Kích thước mặt: đường kính: 4.2cm, độ dày 10mm Kích thước dây: chiều rộng khoảng 2.0cm, chiều dài 24cm ",""""""
tiki.vn,https://tiki.vn/dong-ho-nu-julius-ju1162-xanh-duong-p2000289.html?src=category-page-914.27498.8371&2hi=0,2000289,Julius,Đồng hồ,,1.231.000 ₫,Thời trang An Nhiên,," Thương hiệu: JULIUS Mã sản phẩm: JA-828 JU1162 (Xanh đen) Dành cho: Nữ, sinh viên, nhân viên văn phòng, doanh nhân… Chất liệu dây: Dây da Genuine Leather bền bỉ Chất liệu mặt kính: Mặt kính khoáng cao cấp trong suốt rõ nét, độ cứng cao (chống va đập tốt ở mức sinh hoạt hàng ngày) Kích thước bề mặt: 3,5cm (Mặt tròn) Độ dày: 0,9cm Tổng độ dài đồng hồ: 22,5cm Độ rộng của dây: 1cm Kiểu khóa: Khóa gài Chất liệu vỏ máy: Hợp kim mạ ion vàng hồng, sử dụng công nghệ mạ IP chân không tiên tiến giúp đem lại độ sáng bóng và bền màu và không bốc hơi, viền được đính hạt sang trọng Máy: Quartz Nhật MIYOTA (sản xuất bởi Citizen Nhật Bản), có lịch ngày, thứ, 24h tiện lợi Khả năng chịu nước: Chống thấm nước 3ATM (30m) có thể đi mưa, rửa tay, rửa mặt. Tránh tiếp xúc với môi trường hóa chất như giặt đồ, tắm gội. ",""""""
tiki.vn,https://tiki.vn/dong-ho-co-nam-kinyued-jyd-j018-day-da-chay-full-kim-p9346857.html?src=category-page-914.27498.8371&2hi=0,9346857,Kinyued,Đồng hồ,,900.000 ₫,Thời trang cao cấp,," Thông tin sản phẩm Tên sản phẩm: Đồng hồ cơ nam Kinyued JYD-J018dây da chạy full kim Model: JYD-J018 Kích thước mặt đồng hồ: Đường kính 41mm, Dày 12mm Kích thước dây đồng hồ: Rộng 22mm, Dài 23cm Trọng lượng: 0.15Kg Chất liệu mặt kính: Kính khoáng cường lực tăng khả năng chống trầy xước Chất liệu dây: Dây da cao cấp, đẹp, bền Tiêu chuẩn chống thấm 3ATM Loại máy: Máy cơ lên cót và tự tích cót, không cần dùng pin. Số kim: 5 kim đều chạy. Kim nhỏ góc 3 giờ Chỉ lịch Ngày Kim nhỏ góc 9 giờ Chỉ lịch Thứ Kim nhỏ góc 12 giờ thể hiện chế độ 24 giờ. Hình trăng sao, mặt trời góc 12 giờ di chuyển thể hiện ngày và đêm Bộ sản phẩm gồm:01 đồng hồ, hộp đựng, giấy hướng dẫn, thẻ bảo hành chính hãng ",""""""
tiki.vn,https://tiki.vn/dong-ho-nu-day-kim-loai-timex-the-fairfield-tw2r26500-37mm-p989374.html?src=category-page-914.27498.8371&2hi=0,989374,Timex,Đồng hồ,,1.854.000 ₫,DAINESE VIETNAM,," Thiết kế sang trọng, đẹp mắt Đồng Hồ Nữ Dây Kim Loại Timex The Fairfield TW2R26500 (37mm) được thiết kế với kiểu dáng trẻ trung với phần dây đeo màu vàng sang trọng và đẹp mắt, giúp người đeo tự tin thể hiện phong cách thời trang của mình khi kết hợp với nhiều trang phục khác nhau. Phần mặt đồng hồ có thiết kế đơn giản với những vạch chia số và kim chỉ giờ truyền thống nhưng vẫn tạo nên nét thanh lịch và quý phái cho người đeo. Chất liệu thép không gỉ chắc chắn Chiếc đồng hồ có phần dây đeo được làm từ chất liệu kim loại cao cấp chống rỉ sét. Vỏ đồng hồ cũng được làm bằng thép không ghỉ siêu bền, cho bạn thời gian sử dụng lâu dài. Bên cạnh đó, đồng hồ có mặt kính khoáng có tráng lớp chống trầy xước cứng cáp, chống chịu va đập tốt cho bạn yên tâm sử dụng nếu chẳng may để đồng hồ va đập với một vật nào đó. Dễ dàng sử dụng Đồng hồ nữ dây kim loại Timex The Fairfield TW2R26500 được trang bị kiểu máy Quartz – loại kiểu máy cho thời gian chính xác cao, giúp bạn gái có thể quản lý quỹ thời gian của mình một cách dễ dàng cho những kế hoạch trong một ngày. Vạch giờ và kim chỉ giờ phút được thiết kế to, rõ, cho bạn dễ dàng theo dõi giờ giấc. Cũng như những chiếc đồng hồ khác, nút điều chỉnh được thiết kế bên hông cho bạn tiện chỉnh giờ theo đúng chuẩn. Phần dây bấm tiện dụng, bạn chỉ cần mang đồng hồ vào tay, chỉnh kích cỡ cho phù hợp và bấm khóa lại là xong. Phần khóa này chắc chắn, không bị bung ra khi hoạt động mạnh. Công nghệ Indiglo tiên tiến Đây là công nghệ độc quyền được cấp bằng sáng chế của Timex. Công nghệ Indiglo dựa trên hiện tượng phát quang khi dòng điện đi qua một tấm film mỏng giúp cho đồng hồ có thể dễ dàng xem vào ban đêm. Công nghệ này còn đặt biệt ở chỗ đồng hồ được chiếu sáng toàn bộ bề mặt chứ không chỉ một điểm như những chiếc đồng hồ trang bị đèn khác. Khả năng chống nước đạt chuẩn Được trang bị khả năng chống nước đạt chuẩn 3ATM, có thể chịu nước lên đến độ sâu 30m, chiếc đồng hồ Timex The Fairfield TW2R26500 sẽ cho bạn những trải nghiệm tuyệt vời khi sử dụng. Giờ đây bạn không cần phải mất thời gian tháo đồng hồ ra khi rửa chén, tắm mà vẫn có thể đeo nó bên mình mà không sợ bị thấm nước hay ảnh hưởng đến chất lượng của máy như một số loại đồng hồ khác. ",""""""
tiki.vn,https://tiki.vn/dong-ho-nam-day-luoi-thep-khong-gi-wwoor-8028-p8014468.html?src=category-page-914.27498.8371&2hi=0,8014468,WWOOR,Đồng hồ,,350.000 ₫,Thời trang cao cấp,," Đồng Hồ Nam Dây Thép Không Gỉ WWOOR 8028 với thiết kế mặt tròn trẻ trung kết hợp với tông màu sang trọng, đẳng cấp của dây đeo góp phần tạo nên vẻ ngoài chỉn chu, lịch thiệp cho các quý ông. Vỏ đồng hồ và dây đeo bằng thép không gỉ chống ăn mòn, chống oxi hóa. Thiết kế mỏng hợp thời trang. Mặt đeo gia công từ mặt kính cao cấp, hạn chế trầy xước có độ cứng cao, chịu va đập và giữ vẻ ngoài sáng bóng dài lâu theo thời gian. Có nút điều chỉnh tiện dụng bên hông. Khóa gài tiện lợi có thể tùy chỉnh độ dài phù hợp. Khi đeo đồng hồ ôm sát cổ tay thoải mái, không gây ra cảm giác nhờn rít. Khung đồng hồ được làm từ kim loại sáng bóng. Dây đeo được làm từ thép lưới vô cùng độc đáo. Đồng hồ có khả năng chống thấm nước 3ATM: dùng tốt trong môi trường nước như đi mưa, rửa tay, rửa mặt. Phù hợp đeo đi làm, đi học, dạo phố, xem phim, làm quà tặng bạn bè, người thâ Dễ dàng kết hợp với nhiều phong cách trang phục: Áo thun, áo sơ mi, quần kaki, quần Jeans, giày Sneakers, ",""""""
tiki.vn,https://tiki.vn/dong-ho-day-da-nu-ms520c-mangosteen-han-quoc-do-p2009431.html?src=category-page-914.27498.8371&2hi=0,2009431,Mangosteen,Đồng hồ,,1.475.000 ₫,Luckytime,," Thương hiệu: MANGOSTEEN Seoul – Hàn quốc Mã sản phẩm: MS520C (Đỏ) Dành cho: Nữ, sinh viên, nhân viên văn phòng, doanh nhân… Chất liệu dây: Dây Da Chất liệu mặt kính: Kính khoáng cứng cao cấp trong suốt rõ nét, độ cứng cao Chất liệu mặt sau: Thép không gỉ khắc logo của hãng Kích thước bề mặt: 3,5cm (Mặt tròn) Độ rộng của dây: 1,8cm Chất liệu vỏ máy : Hợp kim cao cấp mạ thép không gỉ, sử dụng công nghệ mạ IPG chân không tiên tiến giúp đem lại độ sáng bóng và bền màu Máy: Quartz Nhật MIYOTA 2035 Sản xuất tại Hàn Quốc Chống thấm nước 3ATM có thể đi mưa, rửa tay, rửa mặt. Tránh tiếp xúc với môi trường hóa chất như giặt đồ, tắm gội. Bảo hành: 24 tháng, hậu mãi 3 năm chi phí thấp sau bảo hành Sản phẩm full box chính hãng như hình ",""""""
tiki.vn,https://tiki.vn/dong-ho-nam-day-da-henry-london-hl39-ls-0071-knightsbridge-38-5mm-p2621635.html?src=category-page-914.27498.8371&2hi=0,2621635,HENRY LONDON,Đồng hồ,,4.945.000 ₫,Thời trang An Nhiên,," Đồng Hồ Nam Dây Da Henry London HL39-LS-0071 Knightsbridge (38,5mm) thiết kế đơn giản tinh tế sang trọng, vỏ máy thép không gỉ sử dụng công nghệ mạ chân không IPG tiên tiến được nhiều khách hàng yêu thích. Không chỉ chú trọng vẻ bề ngoài tinh tế mà đồng hồ còn tỉ mỉ trong việc nghiên cứu và chế tạo những bộ máy với các chức năng đỉnh cao. Trải qua quy trình kiểm định khắt khe trong tất cả các khâu, từ tuyển chọn chất liệu, quy trình sản xuất và cuối cùng là quy trình kiểm tra thành phẩm để đảm bảo những chiếc đồng hồ đạt chuẩn tất cả những tiêu chuẩn trước khi phân phối ra thị trường. Những mẫu Henry London hoặc được thiết kế với phong cách cổ điển với hình mẫu kiểu cách đơn giản, hoặc theo phong cách thời trang hiện đại với những mẫu vừa là đồng hồ vừa là trang sức dành cho nữ và những mẫu đồng hồ thể thao mạnh mẽ cho nam. Tất cả đều có những chi tiết được gia công tinh tế với những đường nét bóng mượt, bề mặt sáng bóng không một tì vết. Đối với sắc màu vàng hay đồng, Henry London sử dụng công nghệ mạ ion chân không, giúp đồng hồ lưu giữ được màu sắc óng ánh trong nhiều năm. Bên cạnh đó, khả năng chống thấm nước 3ATM, cơ kính cứng khoáng cũng góp phần hoàn thiện cho sự hoàn hảo của đồng hồ Henry London. ",""""""
tiki.vn,https://tiki.vn/dong-ho-nu-day-da-orient-ra-ag0019b10b-36mm-den-p10379669.html?src=category-page-914.27498.8371&2hi=0,10379669,ORIENT,Đồng hồ,,6.540.000 ₫,Đồng Hồ Hdwatch,," Đồng Hồ Nữ Dây Da Orient RA-AG0019B10B (36mm) - Đen không chỉ là công cụ hiển thị giờ mà nó còn có công dụng như một trang sức không thể thiếu trong cuộc sống. Đồng hồ phong cách trẻ trung là sự lựa chọn số 1 của những bạn trẻ, được thiết kế nhẹ nhàng tinh tế, cá tính, không quá cầu kỳ, tất cả đều sẽ giúp bạn nổi bật, và sang trọng nhất. Phần kim đồng hồ vô cùng chính xác và rõ ràng, ngoài ra các vạch chia giờ được thiết kế rõ nét nhờ vậy bạn có thể dễ dàng quan sát. Đây là dòng đồng hồ được chế tạo để chịu áp suất nước. Bạn sẽ không phải tháo mỗi khi rửa tay, rửa mặt, không phải lo trời mưa. Bạn có thể mix đồng hồ cùng các trang phục hàng ngày để tạo nét đẹp cho đôi tay và khẳng định phong cách thời trang của riêng mình. ",""""""
tiki.vn,https://tiki.vn/dong-ho-nam-day-thep-orient-sab0b007cb-41mm-vang-anh-kim-p10379793.html?src=category-page-914.27498.8371&2hi=0,10379793,ORIENT,Đồng hồ,,4.810.000 ₫,Đồng Hồ Hdwatch,," Đồng Hồ Nam Dây Thép Orient SAB0B007CB (41mm) - Vàng Ánh Kim không chỉ là công cụ hiển thị giờ mà nó còn có công dụng như một trang sức không thể thiếu trong cuộc sống. Đồng hồ phong cách trẻ trung là sự lựa chọn số 1 của những bạn trẻ, được thiết kế nhẹ nhàng tinh tế, cá tính, không quá cầu kỳ, tất cả đều sẽ giúp bạn nổi bật, và sang trọng nhất. Phần kim đồng hồ vô cùng chính xác và rõ ràng, ngoài ra các vạch chia giờ được thiết kế rõ nét nhờ vậy bạn có thể dễ dàng quan sát. Đây là dòng đồng hồ được chế tạo để chịu áp suất nước. Bạn sẽ không phải tháo mỗi khi rửa tay, rửa mặt, không phải lo trời mưa. Bạn có thể mix đồng hồ cùng các trang phục hàng ngày để tạo nét đẹp cho đôi tay và khẳng định phong cách thời trang của riêng mình. ",""""""
tiki.vn,https://tiki.vn/dong-ho-nam-day-thep-orient-mako-iii-ra-aa0003r19b-42mm-do-p10379610.html?src=category-page-914.27498.8371&2hi=0,10379610,ORIENT,Đồng hồ,,8.800.000 ₫,Đồng Hồ Hdwatch,," Đồng Hồ Nam Dây Thép Orient Mako III RA-AA0003R19B (42mm) - Đỏ không chỉ là công cụ hiển thị giờ mà nó còn có công dụng như một trang sức không thể thiếu trong cuộc sống. Đồng hồ phong cách trẻ trung là sự lựa chọn số 1 của những bạn trẻ, được thiết kế nhẹ nhàng tinh tế, cá tính, không quá cầu kỳ, tất cả đều sẽ giúp bạn nổi bật, và sang trọng nhất. Phần kim đồng hồ vô cùng chính xác và rõ ràng, ngoài ra các vạch chia giờ được thiết kế rõ nét nhờ vậy bạn có thể dễ dàng quan sát. Đây là dòng đồng hồ được chế tạo để chịu áp suất nước. Bạn sẽ không phải tháo mỗi khi rửa tay, rửa mặt, không phải lo trời mưa. Bạn có thể mix đồng hồ cùng các trang phục hàng ngày để tạo nét đẹp cho đôi tay và khẳng định phong cách thời trang của riêng mình. ",""""""
tiki.vn,https://tiki.vn/dong-ho-nam-day-thep-orient-ra-ag0028l10b-40-5mm-xanh-duong-p10379631.html?src=category-page-914.27498.8371&2hi=0,10379631,ORIENT,Đồng hồ,,8.080.000 ₫,Đồng Hồ Hdwatch,," Đồng Hồ Nam Dây Thép Orient RA-AG0028L10B (40.5mm) - Xanh Dương không chỉ là công cụ hiển thị giờ mà nó còn có công dụng như một trang sức không thể thiếu trong cuộc sống. Đồng hồ phong cách trẻ trung là sự lựa chọn số 1 của những bạn trẻ, được thiết kế nhẹ nhàng tinh tế, cá tính, không quá cầu kỳ, tất cả đều sẽ giúp bạn nổi bật, và sang trọng nhất. Phần kim đồng hồ vô cùng chính xác và rõ ràng, ngoài ra các vạch chia giờ được thiết kế rõ nét nhờ vậy bạn có thể dễ dàng quan sát. Đây là dòng đồng hồ được chế tạo để chịu áp suất nước. Bạn sẽ không phải tháo mỗi khi rửa tay, rửa mặt, không phải lo trời mưa. Bạn có thể mix đồng hồ cùng các trang phục hàng ngày để tạo nét đẹp cho đôi tay và khẳng định phong cách thời trang của riêng mình. ",""""""
tiki.vn,https://tiki.vn/dong-ho-nam-day-da-kapten-son-campus-black-leather-40mm-p1026728.html?src=category-page-914.27498.8371&2hi=0,1026728,Kapten & Son,Đồng hồ,,4.669.000 ₫,Ưu Đãi Vàng,," Đồng Hồ Nam Dây Da Kapten & Son Campus Black Leather (40mm) thể hiện phong cách thời trang đơn giản, thanh lịch nhưng không kém phần tinh tế và sang trọng dành bạn. Với thiết kế mặt siêu mỏng 7mm đây là món phụ kiện không thể thiếu của phong cách thời trang hiện đại. Dây đeo da được gia công tỉ mỉ, chống sờn rách trong suốt thời gian sử dụng. Phù hợp đeo đi làm, đi học, dạo phố, xem phim, làm quà tặng bạn bè, người thân... ",""""""
tiki.vn,https://tiki.vn/dong-ho-unisex-day-cao-su-q-q-smile-solar-mini-series-rp01j009y-xanh-luc-p3815785.html?src=category-page-914.27498.8371&2hi=0,3815785,Q&Q Smile Solar,Đồng hồ,,794.000 ₫,Watch World,," Đồng Hồ Unisex Dây Cao Su Q&Q Smile Solar Mini Series RP01J009Y - Xanh Lục thiết kế đơn giản tinh tế trẻ trung sang trọng, không chỉ chú trọng vẻ bề ngoài tinh tế mà đồng hồ còn tỉ mỉ trong việc nghiên cứu và chế tạo những bộ máy với các chức năng đỉnh cao. Trải qua quy trình kiểm định khắt khe trong tất cả các khâu, từ tuyển chọn chất liệu, quy trình sản xuất quy trình kiểm tra thành phẩm để đảm bảo những chiếc đồng hồ đạt chuẩn tất cả những tiêu chuẩn trước khi phân phối ra thị trường. Sản phẩm được gia công tinh tế khả năng chống thấm nước, cơ kính cứng khoáng cũng góp phần hoàn thiện cho sự hoàn hảo của đồng hồ. ",""""""
tiki.vn,https://tiki.vn/dong-ho-nu-day-thep-khong-gi-316l-romanson-em4252lwwh-26mm-trang-p3052221.html?src=category-page-914.27498.8371&2hi=0,3052221,Romanson,Đồng hồ,,10.070.000 ₫,Galle Watch,," Đồng Hồ Nữ Dây Thép Không Gỉ 316L Romanson EM4252LWWH (26mm) có kiểu dáng đơn giản nhưng vô cùng tinh tế, mang lại vẻ sang trọng và lịch lãm cho quý ông cũng như vẻ thanh lịch cho bạn nữ. Mặt đồng hồ có thiết kế hài hòa tạo nên nét cá tính, sự nhã nhặn cho người đeo. Vỏ đồng hồ bằng kim loại không gỉ chống oxi hóa, đảm bảo sự vận hành hiệu quả lõi máy bên trong. Dây đeo bằng thép không gỉ cao cấp vừa bền đẹp, lại vừa sang trọng. Mặt kính Sapphire cao cấp trong suốt rõ nét, độ cứng cao, chống va đập tốt. Sản phẩm có khả năng chịu nước cao, chống thấm nước 3ATM và đặc biệt dành cho nam, nữ, sinh viên, nhân viên văn phòng, doanh nhân,... ",""""""
