Domain,Url,Product_id,Brand,Category,Model,Price,Seller,Tags,Info,Others
tiki.vn,https://tiki.vn/dong-ho-nam-day-thep-khong-gi-casio-mtp-vd01d-1evudf-den-p3133259.html?src=category-page-914.27498.8371&2hi=1,3133259,Casio,Đồng hồ,,1.037.000 ₫,Đồng Hồ Mắt Kính 247,," Đồng Hồ Nam Dây Thép Không Gỉ Casio MTP-V002SG-9AUDF - Đen - Sở hữu thiết kế đầy sang trọng không chỉ là một công cụ đo thời gian mà còn là một món đồ giúp tôn lên đẳng cấp, sự sành điệu của bạn. Dây đồng hồ được làm từ thép không gỉ cao cấp, chất liệu này có ưu điểm là có độ thẩm mỹ cao, không gây dị ứng như dây kim loại thông thường. Mặt kính được chế tác bằng kính cứng pha khoáng, có khả năng chịu lực và chống trầy tốt, hạn chế trầy xước khi va chạm, chỉ cần đánh bóng khi cần để duy trì trạng thái sáng đẹp như mới. Phần kim đồng hồ vô cùng chính xác và rõ ràng, ngoài ra các vạch chia giờ được thiết kế rõ nét nhờ vậy bạn có thể dễ dàng quan sát. Đây là dòng đồng hồ được chế tạo để chịu áp suất nước 5 ATM (tương đương 50m). Bạn sẽ không phải tháo mỗi khi rửa tay, rửa mặt, không phải lo trời mưa... Bạn có thể mix đồng hồ cùng các trang phục hàng ngày để tạo nét đẹp cho đôi tay và khẳng định phong cách thời trang của riêng mình ",""""""
tiki.vn,https://tiki.vn/dong-ho-nu-day-da-casio-ltp-v300l-4audf-33mm-hong-p1038392.html?src=category-page-914.27498.8371&2hi=0,1038392,Casio,Đồng hồ,,1.283.400 ₫,Đại Lý Casio Phước Lộc,," Đồng Hồ Nữ Dây Da Casio LTP-V300L-4AUDF (33mm) là một thiết kế vừa cá tính, cũng không kém phần ngọt ngào với tông màu hồng. Số giờ được thể hiện chi tiết, có 3 kim chỉ giờ và lịch hiển thị thứ, ngày, giờ theo 24 giờ và số phút. Mặt kính khoáng, chống va đập hiệu quả. Dây đeo bằng da màu hồng, êm ái với đường chỉ may tinh tế, ôm sát cổ tay mang lại cảm giác thoải mái khi đeo. Sản phẩm có khả năng chống nước lên đến 3ATM, tương đương 30m, để bạn có thể thỏa thích khi rửa tay hoặc đi dưới mưa. Bạn có thể diện chiếc đồng hồ với quần jeans, áo phông và giày sneakers năng động... đến những buổi họp mặt bạn bè, các cuộc họp hay đơn giản là một cuộc gặp gỡ gia đình đều được. ",""""""
tiki.vn,https://tiki.vn/dong-ho-thoi-trang-nu-day-da-hloios-pkhrhlo002-3-36mm-do-p1989073.html?src=category-page-914.27498.8371&2hi=1,1989073,HLoios,Đồng hồ,,129.000 ₫,NXV Fashion,," Đồng Hồ Thời Trang Nữ Dây Da Hloios PKHRHLO002-3 - Ngày nay, đồng hồ không chỉ là công cụ hiển thị giờ mà nó còn có công dụng như một trang sức không thể thiếu trong cuộc sống. Đồng hồ dây da cao cấp phong cách trẻ trung là sự lựa chọn số 1 của những bạn trẻ, được thiết kế nhẹ nhàng tinh tế, cá tính, không quá cầu kỳ, tất cả đều sẽ giúp bạn nổi bật, và sang trọng nhất. Phần kim đồng hồ vô cùng chính xác và rõ ràng, ngoài ra các vạch chia giờ được thiết kế rõ nét nhờ vậy bạn có thể dễ dàng quan sát. Đây là dòng đồng hồ được chế tạo để chịu áp suất nước 3 ATM (tương đương 30m). Bạn sẽ không phải tháo mỗi khi rửa tay, rửa mặt, không phải lo trời mưa... Bạn có thể mix đồng hồ cùng các trang phục hàng ngày để tạo nét đẹp cho đôi tay và khẳng định phong cách thời trang của riêng mình. ",""""""
tiki.vn,https://tiki.vn/dong-ho-nam-doanh-nhan-6-kim-vinoce-ch411-l12-1a7v-nau-p835642.html?src=category-page-914.27498.8371&2hi=0,835642,VINOCE,Đồng hồ,,879.000 ₫,Đồng Hồ 247,," Đồng Hồ Nam Dây Da VINOCE CH411 L12 - 1A7V (40mm) - Nâu được thiết kế theo phong cách Châu Âu cổ điển, sang trọng và lịch lãm, kiểu dáng này được giới thượng lưu ưa chuộng bởi vì phong cách sang trọng và dễ dàng kết hợp với các loại trang phục. Mặt kính Sapphire chống trầy, sáng rõ, chịu lực, chịu nhiệt tốt, chống thấm nước và bụi bẩn xâm nhập, giữ cho chiếc đồng hồ luôn mới. Vỏ máy bằng thép không gỉ 316L, sáng bóng, xi mạ IP chống phai màu, chịu nhiệt cao, không phai màu, không kích ứng da. Dây da bò thật vân da cá sấu nhập khẩu Italia, mềm mại, dễ chịu, độ dẻo cao, không bị bong nổ, chống thấm tốt, khóa gài tiện dụng phù hợp mọi cổ tay. Máy quartz nhập khẩu từ Nhật Bản chạy giờ chuẩn xác, tính năng ổn định, tuổi thọ pin lâu dài. Công nghệ chống nước 3ATM đáp ứng được các nhu cầu tiếp xúc với nước như rửa tay, đi mưa. Núm chỉnh giờ khắc logo Vinoce tinh xảo, độc đáo. Thiết kế khác biệt với 3 đồng hồ nhỏ bên trong hiển thị: 24h trong ngày, thứ, tháng; ô hiển thị ngày dạng tròn ở mốc 4-5h dễ quan sát. Ba núm điều chỉnh giờ bên hông đồng hồ cho phép bạn dễ dàng trong việc chỉnh giờ, thứ, ngày, tháng. ",""""""
tiki.vn,https://tiki.vn/dong-ho-nu-day-da-tong-hop-kezzi-pkhrke003-3-28mm-den-p1415431.html?src=category-page-914.27498.8371&2hi=0,1415431,KEZZI,Đồng hồ,,350.000 ₫,Thời trang cao cấp,," Đồng Hồ Nữ Dây Da Tổng Hợp Kezzi PKHRKE003-3 (Đen) là sản phẩm được nhiều bạn nữ lựa chọn bởi sở hữu vẻ ngoài đẹp mắt, tinh tế và nữ tính thích hợp cho nhiều đối tượng sử dụng như: nhân viên văn phòng, học sinh, sinh viên,... Đồng hồ có dây da màu đen cá tính và sang trọng, được làm bằng da cao cấp, hạn chế bong tróc, sờn rách. Sử dụng khóa cài xỏ lỗ truyền thống. Mặt đồng hồ được chế tạo bởi chất liệu kính khoáng có độ cứng rất cao nên hạn chế trầy xước và vỡ khi bị va chạm mạnh, khi bị trầy chỉ cần đánh bóng là sáng đẹp như mới. Trên mặt có họa tiết nơ đính đá xinh xắn tạo điểm nhấn đặc biệt cho đồng hồ. Nút vặn điều chỉnh được thiết kế lồi vừa phải, không làm vướng trong quá trình sử dụng, đồng thời nút vặn giúp bạn điều chỉnh thời gian theo giờ phút mong muốn. Đồng hồ có khả năng chống nước ở mức 3 ATM (30m), chịu được nước ở mức độ đi mưa, rửa tay…, không sử dụng trong rửa xe, tắm vòi sen, bơi lội... để hạn chế việc đồng hồ bị vô nước, sẽ làm giảm chất lượng bộ máy. Không chỉ chú trọng vẻ bề ngoài tinh tế mà đồng hồ còn tỉ mỉ trong việc nghiên cứu và chế tạo những bộ máy với các chức năng đỉnh cao. Trải qua quy trình kiểm định khắt khe trong tất cả các khâu, từ tuyển chọn chất liệu, quy trình sản xuất và cuối cùng là quy trình kiểm tra thành phẩm để đảm bảo những chiếc đồng hồ đạt chuẩn tất cả những tiêu chuẩn trước khi phân phối ra thị trường. ",""""""
tiki.vn,https://tiki.vn/dong-ho-henry-london-hl39-s-0100-chiswick-p2643487.html?src=category-page-914.27498.8371&2hi=0,2643487,HENRY LONDON,Đồng hồ,,3.680.000 ₫,Thời trang An Nhiên,," Đồng Hồ Henry London HL39-S-0100 Chiswick có kiểu dáng đơn giản nhưng vô cùng tinh tế, mang lại vẻ sang trọng và lịch lãm cho quý ông. Mặt đồng hồ có thiết kế hài hòa tạo nên vẻ thanh lịch và đẳng cấp cho phái mạnh. Mặt kính khoáng cao cấp trong suốt rõ nét, độ cứng cao, chống va đập tốt. Đồng hồ được làm bằng dây da Genuine Leather cao cấp vừa bền đẹp, lại vừa sang trọng cùng chất liệu vỏ máy hợp kim mạ màu bạc, sử dụng công nghệ mạ IP chân không tiên tiến. Sản phẩm có khả năng chịu nước cao, chống thấm nước 3ATM và đặc biệt dành cho nam, sinh viên, nhân viên văn phòng, doanh nhân,... ",""""""
tiki.vn,https://tiki.vn/dong-ho-nu-julius-han-quoc-ju970-vang-p2622391.html?src=category-page-914.27498.8371&2hi=0,2622391,Julius,Đồng hồ,,590.000 ₫,Black Cat Watch,," Đồng Hồ Nữ Julius Hàn Quốc JU970 có kiểu dáng đơn giản nhưng vô cùng tinh tế, mang lại vẻ sang trọng và xinh xắn cho bạn nữ. Mặt đồng hồ thiết kế hài hòa tạo nên vẻ thanh lịch và sang trọng cho phái đẹp. Mặt kính khoáng tăng cường độ cứng, chống va đập, trong suốt, bóng sáng tăng chiều sâu cho thiết kế bên trong kết hợp với mặt tròn cổ điển, với 3 kim chỉ giờ, phút, giây mang đến cho người đeo sự sang trọng cùng cá tính nổi bật. Mốc giờ 12 kết hợp nạm kim loại tạo nên nét cuốn hút khi nhìn vào, đồng thời mặt đồng hồ thoáng giúp người sử dụng có thể xem giờ chính xác. ",""""""
tiki.vn,https://tiki.vn/dong-ho-nu-ja-1096-julius-han-quoc-day-da-p3669145.html?src=category-page-914.27498.8371&2hi=0,3669145,Julius,Đồng hồ,,789.000 ₫,Luckytime,," Thương hiệu: Julius – Hàn Quốc Mã sản phẩm: JA 1096 Dành cho: Nữ, sinh viên, nhân viên văn phòng, doanh nhân Chất liệu dây: Dây da Kích thước bề mặt: 3,2cm (Mặt tròn) Độ dày: 0,8cm Tổng độ dài của dây: 21cm Độ rộng của dây: 1,2cm Kiểu khóa: Khóa bằng kim Đồng Hồ Nữ Dây Da Julius JA 1096 được thiết kế từ dây chuyền công nghệ hiện đại đến từ Hàn Quốc của thương hiệu nổi tiếng Julius. Đồng hồ kiểu dáng độc đáo, hiện đại phối tông màu nổi bật, kết hợp hệ thống số cũng như kim chỉ giờ chính xác, rõ ràng, không chỉ mang đến cho bạn phong cách trẻ trung, sang trọng mà còn giúp quản lý thời gian dễ dàng. Thiết kế khóa bằng kim dễ sử dụng, có thể điều chỉnh sao cho vừa vặn với cổ tay, tạo cảm giác thoải mái khi đeo. Sản phẩm có dây được làm bằng da Genuine Leather có độ bền cao. Vỏ máy được làm từ hợp kim mạ ion, sử dụng công nghệ mạ IP chân không tiên tiến giúp đem lại độ sáng bóng và bền màu. Đồng hồ có thể chịu nước, có thể đi mưa, rửa tay, rửa mặt; tuy nhiên không dùng đi tắm, đi bơi. Ngoài ra, bạn có thể phối đồng hồ cùng nhiều kiểu trang phục khác nhau mỗi khi đi làm, đi học hay đi chơi cùng bạn bè, người thân. Bảo hành: 12 tháng, hậu mãi 3 năm chi phí thấp sau bảo hành. Đổi mới nếu bị vô nước hay hư máy do nhà sản xuất. Thay dây miễn phí 1 lần, thay pin trọn đời, mua phụ kiện giá ưu đãi khi có thẻ bảo hành ",""""""
tiki.vn,https://tiki.vn/dong-ho-co-lo-may-mat-vuong-tevise-8383d-day-da-p10039421.html?src=category-page-914.27498.8371&2hi=0,10039421,TEVISE,Đồng hồ,,575.000 ₫,TINY,," Giới thiệu Thương hiệu Đồng hồ TEVISE Năm 1952 một người thợ đồng hồ nổi tiếng Thụy Sỹ là Tevise Philippe đã sang Hồng Kông và xây dựng nên thương hiệu đồng hồ nổi tiếng mang tên ông để cạnh trạnh với các thương hiệu đồng hồ giá rẻ của người bản địa Thông tin sản phẩm: Tên sản phẩm: Đồng hồ cơ nam Tevise 8383D Máy cơ Automatic công nghệ Thụy sỹ Model: 8383D Kích thước mặt đồng hồ: Dài 47mm, Rộng 37mm, Dày 15 mm Kích thước dây đồng hồ: Rộng 20mm, Dài 24cm Chất liệu mặt kính: Kính khoáng cường lực tăng khả năng chống trầy xước Chất liệu dây: Dây da cao cấp Tiêu chuẩn chống thấm 3ATM Loại máy: Máy cơ lên cót và tự tích cót, không cần dùng pin. ",""""""
tiki.vn,https://tiki.vn/dong-ho-nu-chinh-hang-royal-crown-6306ss-p7035979.html?src=category-page-914.27498.8371&2hi=0,7035979,Royal Crown,Đồng hồ,,1.699.000 ₫,Royal Crown Watch,," Được thiết kế bởi Royal Crown một thương hiệu nổi tiếng thế với vỏ đồng hồ làm bằng chất liệu hợp kim cao cấp phủ Platium hoặc Rose Gold (Vàng hồng) 3 lớp bền màu nhất, chất liệu hợp kim làm tăng độ cứng của chấu bám vào những viên đá nên bạn không lo rơi, rụng đá. Đá đính trên đồng hồ là đá CZ độ cứng 8,3 và mức tỏa sáng tương tự như kim cương. Mặt kính đồng hồ là mặt kính khoáng với độ chống xước và phản xạ ánh sáng tốt. Đá đính trên vỏ và dây đồng hồ là đá CZ- Zirconia với độ cứng từ 8- 8,5 (Chất lượng rất tốt nếu so với Ruby: 9 và Kim cương: 10). Độ chống nước 30M là trong điều kiện tiêu chuẩn. Trong điều kiện sử dụng bình thường cho phép đi mưa, rửa tay. Với thiết kế tinh tế được chế tác thủ công bởi nhưng người thợ kim hoàn có tay nghề lâu năm nhất, đồng hồ sẽ mang lại cho bạn vẻ ngoài sang trọng, đẳng cấp khi kết hợp món phụ kiện này với những trang phục thường ngày. Dù là trang phục công sở, trang phục dạ tiệc, đi chơi, hẹn hò... Bạn vẫn sẽ cực kì nổi bật và xinh đẹp hơn bất kì ai. ",""""""
tiki.vn,https://tiki.vn/dong-ho-nu-day-da-skmei-9095-dha424-p2825711.html?src=category-page-914.27498.8371&2hi=0,2825711,SKMEI,Đồng hồ,,259.000 ₫,Chuẩn Mua,," ĐỒNG HỒ NỮ SKMEI 9095 DÂY DA - DHA424 Với phong cách thời trang hiện đại, Skmei 9095 thu hút phái đẹp ngay từ cái nhìn đầu tiên. Skmei 9095 sở hữu thiết kế mặt tròn theo phong cách cổ điển tạo nên nét thời trang sang trọng cho bạn gái. Thương hiệu: Skmei Chính Hãng Kiểu máy: Quart Dành cho: Nữ Chất liệu vỏ: Thép không gỉ Chất liệu mặt trước: Kính cứng pha khoáng Chất liệu dây: Dây da Mặt kính: Bo cong vát nhẹ Kích thước mặt: 33mm - 40mm (Luôn vành không tính mấu gắn dây) Kích thước dây: 1.7cm Độ dày mặt: 10,m Độ dày dây: 2mm Tổng chiều dài: 24mm Số kim: 2 kim Độ chịu nước: Chịu nước tốt; tránh các hoạt động bơi lội Năng lượng sử dụng: Pin chuẩn BỘ SẢN PHẨM BÁN CHUẨN GỒM 1 Đồng hồ Skmei Chính Hãng 1 Phiếu bảo hành 1 Hộp đồng hồ Logo Skmei ",""""""
tiki.vn,https://tiki.vn/dong-ho-casio-nam-day-kim-loai-dinh-kim-cuong-that-a159wad-1-bac-p5417789.html?src=category-page-914.27498.8371&2hi=1,5417789,Casio,Đồng hồ,,1.121.000 ₫,Đồng Hồ Mắt Kính 247,," Đồng Hồ Nam Dây Kim Loại Casio A159WAD-1 - Bạc là dòng sản phẩm khá đẹp và không thể thiếu của nhiều người. Với thiết kế trẻ trung, tinh tế thì dòng sản phẩm này đang được nhiều người hướng đến chọn mua nhiều nhất. Kim cương tự nhiên trên mặt số Chống nước Dây đeo bằng thép không gỉ Đèn LED Đồng hồ bấm giờ 1/100 giây Vật liệu vỏ / gờ: Nhựa / Mạ crôm Chốt có thể điều chỉnh Mặt kính nhựa Tuổi thọ pin xấp xỉ: 7 năm với pin CR2016 ",""""""
tiki.vn,https://tiki.vn/dong-ho-nu-halei-hl457-day-trang-p8145660.html?src=category-page-914.27498.8371&2hi=0,8145660,HALEI,Đồng hồ,,219.600 ₫,Đồng hồ 888,," GỢI Ý SỬ DỤNG VÀ BẢO DƯỠNG Nên tránh: - Va chạm và tiếp xúc với chất ăn mòn, nhiệt độ cao hoặc từ trường mạnh. - Sử dụng bất kì dung môi, chất làm sạch, chất tẩy công nghiệp, chất dính, sơn hoặc các chất xịt mỹ phẩm. - Đeo đồng hồ cùng các vòng đeo tay vì dễ tạo vết xước hay làm hỏng mặt đồng hồ. - Chỉnh nút chỉnh giờ khi đồng hồ bị ướt. - Để đồng hồ nơi nhiệt độ thay đổi đột ngột. - Sử dụng, nhấn các nút hoặc cài đặt ở dưới nước. Nên làm: - Làm sạch đồng hồ theo định kỳ vải mềm hơi ẩm để gia tăng tuổi thọ đồng hồ. - Nếu xuất hiện hơi nước ngưng tụ, cần mang đồng hồ đến Trung Tâm Dịch Vụ Khách Hàng của các hãng càng nhanh càng tốt để giảm thiểu hư hỏng bên trong. - Thay pin khi đồng hồ chạy sai giờ hoặc chuyển động kim giây không đều vì rò rỉ điện do pin chết có thể gây ra hỏng hóc ",""""""
tiki.vn,https://tiki.vn/dong-ho-nu-day-dinh-da-royal-crown-3816rg-33-5x25mm-vang-hong-p2325283.html?src=category-page-914.27498.8371&2hi=0,2325283,Royal Crown,Đồng hồ,,2.339.000 ₫,Royal Crown Watch,," Đồng Hồ Nữ Dây Đính Đá Royal Crown 3816RG (33,5x25mm) - Vàng Hồng có thiết kế tinh tế có mặt đồng hồ được tạo bởi vỏ trai tự nhiên, viền đồng hồ được đính đá CZ tự nhiên cao cấp một cách tỉ mỉ, thủ công, dây đồng hồ được làm thủ công, đính đá cao cấp mang đên sự sang trọng và bền bỉ cho người đeo. Được thiết kế bởi Royal Crown một thương hiệu nổi tiếng thế với vỏ đồng hồ làm bằng chất liệu hợp kim cao cấp phủ Platium hoặc Rose Gold (Vàng hồng) 3 lớp bền màu nhất, chất liệu hợp kim làm tăng độ cứng của chấu bám vào những viên đá nên bạn không lo rơi, rụng đá. Đá đính trên đồng hồ là đá CZ độ cứng 8,3 và mức tỏa sáng tương tự như kim cương. Mặt kính đồng hồ là mặt kính khoáng với độ chống xước và phản xạ ánh sáng tốt. Đá đính trên vỏ và dây đồng hồ là đá CZ- Zirconia với độ cứng từ 8- 8,5 (Chất lượng rất tốt nếu so với Ruby: 9 và Kim cương: 10). Độ chống nước 30M là trong điều kiện tiêu chuẩn. Trong điều kiện sử dụng bình thường cho phép đi mưa, rửa tay. Với thiết kế tinh tế được chế tác thủ công bởi nhưng người thợ kim hoàn có tay nghề lâu năm nhất, đồng hồ sẽ mang lại cho bạn vẻ ngoài sang trọng, đẳng cấp khi kết hợp món phụ kiện này với những trang phục thường ngày. Dù là trang phục công sở, trang phục dạ tiệc, đi chơi, hẹn hò... Bạn vẫn sẽ cực kì nổi bật và xinh đẹp hơn bất kì ai. ",""""""
tiki.vn,https://tiki.vn/dong-ho-nam-day-nhua-casio-mw-240-4bvdf-40mm-p1734917.html?src=category-page-914.27498.8371&2hi=0,1734917,Casio,Đồng hồ,,465.000 ₫,Đồng Hồ Mắt Kính 247,," Đồng Hồ Nam Dây Nhựa Casio MW-240-4BVDF (40mm) sở hữu thiết kế đầy sang trọng không chỉ là một công cụ đo thời gian mà còn là một món đồ giúp tôn lên đẳng cấp, sự sành điệu của bạn. Dây đồng hồ được làm từ nhựa cao cấp, chất liệu này có ưu điểm là có độ thẩm mỹ cao, không gây dị ứng như dây kim loại thông thường. Mặt kính được chế tác bằng kính cứng pha khoáng, có khả năng chịu lực và chống trầy tốt, hạn chế trầy xước khi va chạm, chỉ cần đánh bóng khi cần để duy trì trạng thái sáng đẹp như mới. Phần kim đồng hồ vô cùng chính xác và rõ ràng, ngoài ra các vạch chia giờ được thiết kế rõ nét nhờ vậy bạn có thể dễ dàng quan sát. Đây là dòng đồng hồ được chế tạo để chịu áp suất nước 5ATM (tương đương 30m). Bạn sẽ không phải tháo mỗi khi rửa tay, rửa mặt, không phải lo trời mưa... Bạn có thể mix đồng hồ cùng các trang phục hàng ngày để tạo nét đẹp cho đôi tay và khẳng định phong cách thời trang của riêng mình. ",""""""
