Domain,Url,Product_id,Brand,Category,Model,Price,Seller,Tags,Info,Others
tiki.vn,https://tiki.vn/dong-ho-nu-day-da-eyki-eet8410l-30mm-den-mat-den-p642118.html?src=category-page-914.27498.8371&2hi=1,642118,EYKI,Đồng hồ,,418.000 ₫,Alola,," Đồng Hồ Nữ Dây Da Eyki EET8410L (30mm) - Đen Mặt Đen có thiết kế mặt hiển thị phối số dạng vạch kẻ cổ điển, kết hợp cùng khung viền bạc sáng bóng nổi bật trên nền đa cá tính của dây đeo, tạo nên tổng thể hài hòa và có tính thẩm mỹ cao cho sản phẩm. Dây đeo màu đen cá tính, được làm bằng chất liệu da cao cấp. Sử dụng khóa xỏ lỗ truyền thống. Vỏ đồng hồ bằng thép không gỉ siêu bền, bảo vệ tối ưu lõi máy và pin khỏi tác nhân oxi hóa từ môi trường. Mặt kính cứng cáp giúp bảo vệ đồng hồ khỏi các va chạm. Màu sắc mặt: Đen. Màu sắc dây: Đen. Có nút điều chỉnh bên hông. Đồng hồ có khả năng chịu nước 1 ATM, có thể đeo đi dưới mưa nhỏ, rửa tay dưới dòng chảy nhẹ. ",""""""
tiki.vn,https://tiki.vn/dong-ho-unisex-day-thep-khong-gi-casio-a158wa-1df-33mm-p1342439.html?src=category-page-914.27498.8371&2hi=0,1342439,Casio,Đồng hồ,,698.000 ₫,Đồng Hồ Mắt Kính 247,," Đồng Hồ Unisex Dây Thép Không Gỉ Casio A158WA-1DF sẽ thu hút bạn từ cái nhìn đầu tiên với thiết kế tinh tế, sắc sảo trong từng đường nét. Mặt đồng hồ được gia công từ chất liệu kính khoáng có độ cứng, chịu lực và chống trầy xước tốt đảm bảo được độ an toàn cho chiếc đồng hồ khi bạn lỡ tay va chạm vào bề mặt cứng. Dây đồng hồ làm từ thép không gỉ bền chắc. Kiểu dáng đồng hồ trẻ trung với độ chịu nước 3ATM giúp bạn an tâm hơn khi phải tiếp xúc hay sử dụng nước trong các hoạt động hằng ngày. Phần kim đồng hồ vô cùng chính xác và rõ ràng, ngoài ra các vạch chia giờ được thiết kế rõ nét nhờ vậy bạn có thể dễ dàng quan sát. Một chiếc đồng hồ độc đáo góp phần không nhỏ trong việc giúp bạn khẳng định đẳng cấp cũng như thể hiện gu thẩm mỹ của mình, vì vậy chiếc đồng hồ Casio thời trang này chính là một sự lựa chọn thích hợp dành cho bạn. ",""""""
tiki.vn,https://tiki.vn/dong-ho-nam-day-nhua-casio-ae-1200wh-1bvdf-42mm-den-p1342449.html?src=category-page-914.27498.8371&2hi=1,1342449,Casio,Đồng hồ,,931.000 ₫,Đồng Hồ Mắt Kính 247,," Đồng Hồ Nam Dây Nhựa Casio AE-1200WH-1BVDF sẽ thu hút bạn từ cái nhìn đầu tiên với thiết kế tinh tế, sắc sảo trong từng đường nét. Mặt đồng hồ được gia công từ chất liệu kính khoáng có độ cứng, chịu lực và chống trầy xước tốt đảm bảo được độ an toàn cho chiếc đồng hồ khi bạn lỡ tay va chạm vào bề mặt cứng. Dây đồng hồ làm từ nhựa siêu nhẹ, êm tay. Kiểu dáng đồng hồ trẻ trung với độ chịu nước 3ATM giúp bạn an tâm hơn khi phải tiếp xúc hay sử dụng nước trong các hoạt động hằng ngày. Phần kim đồng hồ vô cùng chính xác và rõ ràng, ngoài ra các vạch chia giờ được thiết kế rõ nét nhờ vậy bạn có thể dễ dàng quan sát. Một chiếc đồng hồ độc đáo góp phần không nhỏ trong việc giúp bạn khẳng định đẳng cấp cũng như thể hiện gu thẩm mỹ của mình, vì vậy chiếc đồng hồ Casio thời trang này chính là một sự lựa chọn thích hợp dành cho bạn. ",""""""
tiki.vn,https://tiki.vn/dong-ho-nu-day-thep-julius-ja-1040-25mm-xanh-p1342305.html?src=category-page-914.27498.8371&2hi=1,1342305,Julius,Đồng hồ,,877.000 ₫,Black Cat Watch,," Đồng Hồ Nữ Dây Thép Julius Ja 1040 sở hữu thiết kế đầy sang trọng không chỉ là một công cụ đo thời gian mà còn là một món đồ giúp tôn lên đẳng cấp, sự sành điệu của bạn. Dây đồng hồ được làm từ thép mạ IP cao cấp, chất liệu này có ưu điểm là có độ thẩm mỹ cao, không gây dị ứng, bền màu. Mặt kính được chế tác bằng Mineral Glass (mặt khoáng), có khả năng chịu lực và chống trầy tốt, hạn chế trầy xước khi va chạm, chỉ cần đánh bóng khi cần để duy trì trạng thái sáng đẹp như mới. Chất liệu vỏ máy là hợp kim, sử dụng công nghệ mạ IP chân không tiên tiến giúp đem lại độ sáng bóng và bền màu. Phần kim đồng hồ vô cùng chính xác và rõ ràng, ngoài ra các vạch chia giờ được thiết kế rõ nét nhờ vậy bạn có thể dễ dàng quan sát. Đây là dòng đồng hồ được chế tạo để chịu áp suất nước 3 bar (tương đương 30m). Bạn sẽ không phải tháo mỗi khi rửa tay, rửa mặt, không phải lo trời mưa bất chợt... Bạn có thể mix đồng hồ cùng các trang phục hàng ngày để tạo nét đẹp cho đôi tay và khẳng định phong cách thời trang của riêng mình. ",""""""
tiki.vn,https://tiki.vn/dong-ho-nam-nibosi-day-thep-luoi-cao-cap-thoi-trang-js-nb2309m-p2649883.html?src=category-page-914.27498.8371&2hi=0,2649883,NIBOSI,Đồng hồ,,333.000 ₫,Janus Shop,," Là món phụ kiện không thể thiếu của cả nam lẫn nữ, chiếc đồng hồ giúp bạn khẳng định cá tính thời trang của chính mình. Đồng hồ NIBOSI 2309M sở hữu thiết kế sang trọng với các chi tiết được chế tác tinh xảo, góp phần nâng tầm phong cách của người đeo. Bên cạnh đó, phần kim và số được thể hiện rõ ràng nhưng cũng không kém phần tinh tế, vừa đáp ứng nhu cầu quản lý thời gian vừa tô điểm thêm cho set trang phục của bạn. Với đồng hồ NIBOSI 2309M bạn nam có thể sử dụng trong mọi dịp, từ đi làm, đi chơi hay tham dự những buổi tiệc. Bộ sản phẩm gồm: 1 đồng hồ, 1 hộp đồng hồ, 1 tool chỉnh khoá, 1 thẻ bảo hành. ",""""""
tiki.vn,https://tiki.vn/dong-ho-nam-day-luoi-thep-khong-gi-wwoor-8018-tntt0012-35mm-den-p884146.html?src=category-page-914.27498.8371&2hi=0,884146,WWOOR,Đồng hồ,,350.000 ₫,Thời trang cao cấp,," Đồng Hồ Nam Dây Lưới Thép Không Gỉ WWOOR 8018 TNTT0012 (35mm) - Đen với thiết kế mặt tròn trẻ trung kết hợp với tông màu sang trọng, đẳng cấp của dây đeo góp phần tạo nên vẻ ngoài chỉn chu, lịch thiệp cho các quý ông. Vỏ đồng hồ và dây đeo bằng thép không gỉ chống ăn mòn, chống oxi hóa. Thiết kế mỏng hợp thời trang. Mặt đeo gia công từ mặt kính cao cấp, hạn chế trầy xước có độ cứng cao, chịu va đập và giữ vẻ ngoài sáng bóng dài lâu theo thời gian. Có nút điều chỉnh tiện dụng bên hông. Khóa gài tiện lợi có thể tùy chỉnh độ dài phù hợp. Khi đeo đồng hồ ôm sát cổ tay thoải mái, không gây ra cảm giác nhờn rít. Khung đồng hồ được làm từ kim loại sáng bóng. Dây đeo được làm từ thép lưới vô cùng độc đáo. Đồng hồ có khả năng chống thấm nước 3ATM: dùng tốt trong môi trường nước như đi mưa, rửa tay, rửa mặt. Phù hợp đeo đi làm, đi học, dạo phố, xem phim, làm quà tặng bạn bè, người thân... Dễ dàng kết hợp với nhiều phong cách trang phục: Áo thun, áo sơ mi, quần kaki, quần Jeans, giày Sneakers,... ",""""""
tiki.vn,https://tiki.vn/dong-ho-nu-day-dinh-da-royal-crown-5308rg-25mm-vang-hong-p2325417.html?src=category-page-914.27498.8371&2hi=0,2325417,Royal Crown,Đồng hồ,,1.399.000 ₫,Royal Crown Watch,," Đồng Hồ Nữ Dây Đính Đá Royal Crown 5308RG (25mm) - Vàng Hồng có thiết kế tinh tế có mặt đồng hồ được tạo bởi vỏ trai tự nhiên, viền đồng hồ được đính đá CZ tự nhiên cao cấp một cách tỉ mỉ, thủ công, dây đồng hồ được làm thủ công, đính đá cao cấp mang đên sự sang trọng và bền bỉ cho người đeo. Được thiết kế bởi Royal Crown một thương hiệu nổi tiếng thế giới với vỏ đồng hồ làm bằng chất liệu hợp kim cao cấp phủ Platium hoặc Rose Gold (Vàng hồng) 3 lớp bền màu nhất, chất liệu hợp kim làm tăng độ cứng của chấu bám vào những viên đá nên bạn không lo rơi, rụng đá. Đá đính trên đồng hồ là đá CZ độ cứng 8,3 và mức tỏa sáng tương tự như kim cương. Mặt kính đồng hồ là mặt kính khoáng với độ chống xước và phản xạ ánh sáng tốt. Đá đính trên vỏ và dây đồng hồ là đá CZ- Zirconia với độ cứng từ 8- 8,5 (Chất lượng rất tốt nếu so với Ruby: 9 và Kim cương: 10). Độ chống nước 30M là trong điều kiện tiêu chuẩn. Trong điều kiện sử dụng bình thường cho phép đi mưa, rửa tay. Với thiết kế tinh tế được chế tác thủ công bởi nhưng người thợ kim hoàn có tay nghề lâu năm nhất, đồng hồ sẽ mang lại cho bạn vẻ ngoài sang trọng, đẳng cấp khi kết hợp món phụ kiện này với những trang phục thường ngày. Dù là trang phục công sở, trang phục dạ tiệc, đi chơi, hẹn hò... Bạn vẫn sẽ cực kì nổi bật và xinh đẹp hơn bất kì ai. ",""""""
tiki.vn,https://tiki.vn/dong-ho-nu-julius-han-quoc-ja-426-hong-p1949479.html?src=category-page-914.27498.8371&2hi=0,1949479,Julius,Đồng hồ,,650.000 ₫,Luckytime,," Nhãn hiệu: Julius Mã Sản Phẩm: JA426 Hồng Giới tính: Nữ Thể loại: Đồng hồ quartz Chất liệu : Thép không gỉ Độ dày mặt: 0.6cm Đường kính mặt: 3cm Kích thước dây: 21 x1.4cm Chống thấm nước: 3ATM (Chịu nước đi mưa, rửa tay, ) Tránh mang lúc hoạt động va chạm nút Bảo hành: 12 tháng, hậu mãi 3 năm chi phí thấp sau bảo hành. Mua phụ kiện giá ưu đã khi có thẻ bảo hành. ",""""""
tiki.vn,https://tiki.vn/dong-ho-nam-day-da-timex-the-fairfield-tw2r26100-41mm-p989364.html?src=category-page-914.27498.8371&2hi=0,989364,Timex,Đồng hồ,,1.554.000 ₫,DAINESE VIETNAM,," Đồng Hồ Nam Dây Da Timex The Fairfield TW2R26100 (41mm) là chiếc đồng hồ thời trang cá tính và hiện đại cho những tín đồ sành mốt. Dây da trắng phối mặt trắng làm tăng sự trẻ trung và hiện đại cho tổng thể chiếc đồng hồ. Đặc biệt, mặt đồng hồ được làm bằng thép không gỉ và tráng một lớp chống xước bảo vệ. Sử dụng công nghệ đèn nền INDIGLO có chức năng phát sáng bề mặt, giúp dễ quan sát trong môi trường ánh sáng yếu. Được làm bằng da cao cấp, chống bong tróc, sờn rách. Sử dụng khóa cài xỏ lỗ truyền thống. Vỏ đồng hồ bằng thép không gỉ siêu bền, chống hoen ố. Mặt đồng hồ màu trắng cá tính, được chế tác từ kính Mineral có tráng lớp chống xước cứng cáp, chống chịu va đập tốt. Có nút điều chỉnh tiện lợi. Đồng hồ có khả năng chịu nước 30m. Chỉ số giờ, phút chi tiết và chuẩn xác. ",""""""
tiki.vn,https://tiki.vn/dong-ho-nam-skmei-kieu-dang-the-thao-day-da-dep-mat-thu-hut-js-9106-p2595529.html?src=category-page-914.27498.8371&2hi=0,2595529,SKMEI,Đồng hồ,,369.000 ₫,Janus Shop,," Kiểu dáng thời trang sành điệu Chiếc đồng hồ nam dây da cao cấp skmei9106c đến từ thương hiệu có uy tín, với kiểu dáng sang trọng, dây màu đen phối đỏ sành điệu, không kén màu da tay người đeo. Ngoài ra, thiết kế mặt đồng hồ lớn giúp bạn dễ dàng quan sát giờ khi cần thiết, cùng với thiết kế mặt bên trong độc đáo mang tính năng động thể thao thiết kế cao cấp Khi bạn đeo chiếc đồng hồ nam dây da cao cấp skmei9106c vào tay, bạn sẽ thấy tự tin vì cá tính trẻ trung mạnh mẽ nhờ vào kiểu dáng và chất liệu dây da cao cấp, điều này không chỉ tạo nên độ bền cao mà còn làm tăng tính an toàn cho làn da tay bạn tiện dụng Bạn có thể sở hữu chiếc đồng hồ nam dây da cao cấp skmei9106c cho bản thân , hoặc có thể làm quà tặng sang trọng cho những người thân trong những dịp đặc biệt quan trọng. Một chiếc đồng hồ thích hợp với hầu hết các bạn nam, dễ dàng phối cùng với những kiểu trang phục của bạn. ",""""""
tiki.vn,https://tiki.vn/dong-ho-nam-day-cao-su-casio-ae-1200wh-1bvdf-42-x-42-mm-den-p845432.html?src=category-page-914.27498.8371&2hi=0,845432,Casio,Đồng hồ,,911.000 ₫,Đại Lý Casio Phước Lộc,," Đồng Hồ Nam Dây Cao Su Casio AE-1200WH-1BVDF (42 x 42 mm) - Đen với thiết kế mặt vuông cổ điển kết hợp cùng tông màu năng động, trẻ trung của dây đeo giúp mang lại vẻ ngoài đầy phong cách cho người đeo. Dây đeo cao su bền bỉ, chống đứt gãy giúp gia tăng độ bền trong suốt thời gian sử dụng. Mặt đeo gia công từ kính cứng cao cấp, chống trầy xước. Có nút điều chỉnh tiện dụng bên hông. Khi đeo ôm sát cổ tay thoải mái, không gây ra cảm giác nhờn rít khi đeo. Dễ dàng kết hợp với nhiều trang phục khác nhau: Áo Thun, áo Sơ Mi, quần Jeans, quần Kaki, giày Sneakers,... ",""""""
tiki.vn,https://tiki.vn/dong-ho-nu-day-da-skmei-9058cg-trang-p475380.html?src=category-page-914.27498.8371&2hi=0,475380,SKMEI,Đồng hồ,,287.100 ₫,Đồng hồ 888,," Đồng Hồ Nữ Dây Da SKMEI 9058CG - Trắng Đồng Hồ Nữ Dây Da SKMEI 9058CG - Trắng thiết kế dây đeo có vân da độc đáo phối cùng tôn màu trắng đẹp mắt vừa nổi bật vừa tôn lên phong thái nhẹ nhàng, ưa nhìn cho phái đẹp. Mặt đồng hồ dạng tròn cổ điển, kim chỉ giờ dạng chữ số La Mã tinh tế. Động cơ chuyển động và pin sản xuất theo tiêu chuẩn Nhật Bản cho khả năng báo giờ chính xác, độ bền cao. Thông tin sản phẩm Chất liệu kính, thép không gỉ và da cao cấp Mặt đồng hồ làm bằng chất liệu kính chịu lực và khó trầy xước. Khung đồng hồ làm từ chất liệu thép không gỉ. Dây đeo bằng da mềm mại tạo cảm giác thoải mái, êm tay. Động cơ chuyển động và pin nhập khẩu từ Nhật Bản, mặt sau bằng inox không gây dị ứng cho da. Thiết kế thanh lịch, màu trắng đẹp mắt Đồng Hồ Nữ Dây Da SKMEI 9058CG được thiết kế thanh lịch với mặt tròn cổ điển, kim chỉ giờ dạng chữ số La Mã đẹp mắt. Dây đeo có vân da độc đáo phối cùng tông nền mặt màu trắng đẹp mắt vừa nổi bật vừa tôn lên phong thái nhẹ nhàng, ưa nhìn cho phái đẹp. K hả năng chống thấm nước 3ATM Đồng hồ có khả năng chống thấm nước 3ATM: dùng tốt trong môi trường nước như đi mưa, rửa tay, rửa mặt (không bấm nút dưới nước hay khi đồng hồ bị ướt). Thông số kỹ thuật - Thương hiệu: SKMEI - Chất liệu mặt trước: Kính - Chất liệu vỏ: Thép không gỉ - Chất liệu dây: Da - Chất liệu mặt sau: Thép không gỉ - Kích thước mặt: 3cm - Kích thước dây: 25 x1.2 cm - Loại mặt: Mặt tròn - Màu sắc: Trắng - Độ chịu nước: 3 ATM - Năng lượng sử dụng: Pin Bảo hành: 12 tháng cho máy. Khách hàng giữ lại hóa đơn và phiếu bảo hành (nếu có) để tiện sử dụng chính sách bảo hành. Quy trình bảo hành: Khách hàng gửi sản phẩm trực tiếp về Tiki: - Từ 1 đến 3 ngày : phản hồi tình trạng và hướng xử lý kể từ ngày nhận - Từ 3 đến 7 ngày : Xử lý lỗi và trả sản phẩm lại cho khách hàng Thời gian bảo hành: - Bảo hành máy và các hư hỏng kỹ thuật trong thời gian bảo hành. - Chỉ bảo hành trên máy và pin. Khi bị hư hỏng, quý khách vui lòng đem đến công ty để được bảo hành tại trung tâm chính hãng. Tuyệt đối không tự ý tháo rời hoặc đem ra nơi khác sửa chữa. Chính sách bảo hành: 1.1. Sản phẩm bảo hành Thời hạn bảo hành sản phẩm được tính kể từ ngày mua của khách hàng sử dụng. Thời gian mua được ghi đầy đủ trên phiếu bảo hành, hoặc hóa đơn khi mua kèm đồng hồ. 1.2. Điều kiện bảo hành hợp lệ Đồng hồ sẽ được bảo hành nếu thỏa mãn đầy đủ các điều kiện sau: - Đồng hồ còn trong hạn bảo hành tại thời điểm khách hàng yêu cầu, Áp dụng như mục 1.1 - Hư hỏng do chất lượng linh kiện hay lỗi kỹ thuật trong quy trình sản xuất. - Thay pin trong thời hạn bảo hành đối với khách hàng mua tại Việt Nam - Đồng hồ không thuộc trường hợp bị từ chối bảo hành quy định tại điều 1.3 1.3. Điều kiện từ chối bảo hành Đồng hồ thuộc một trong những điều kiện sau sẽ mất quyền bảo hành: · Trầy xước về dây hoặc mặt kiếng bị vỡ do va chạm trong quá trình sử dụng. · Sử dụng không theo hướng dẫn của hãng, tự ý thay đổi máy móc bên trong, không cẩn thận hoặc do bị tai nạn. · Đồng hồ được sửa chữa ở những nơi không thuộc thẩm quyền của hãng. 1.4. Dịch vụ ngoài bảo hành Trong trường hợp Khách hàng có nhu cầu yêu cầu dịch vụ sửa chữa ngoài bảo hành, hoặc các dịch vụ khác phát sinh khi thời gian bảo hành sử dụng cho sản phẩm đã hết, nhà cung cấp có trách nhiệm phục vụ và sửa chữa sản phẩm với thái độ và tinh thần cao nhất. Khách hàng sẽ thanh toán các chi phí phát sinh cho việc sửa chữa như linh kiện thay thế, tiền công và chi phí khác (nếu có) dựa theo thỏa thuận giữa 2 bên. Hướng dẫn bảo quản - Không tiếp xúc với các hóa chất và để ở nơi có nhiệt độ cao quá 60 độ C hoặc thấp hơn 10 độ C. Tránh các va đập mạnh, nơi có từ trường mạnh. ",""""""
tiki.vn,https://tiki.vn/dong-ho-unisex-day-da-timex-expedition-mid-size-scout-tw4b11100-36mm-mat-xanh-duong-p1323375.html?src=category-page-914.27498.8371&2hi=1,1323375,Timex,Đồng hồ,,1.275.000 ₫,Tiki Trading,," Đồng Hồ Unisex Dây Da Timex Expedition Mid-Size Scout TW4B11100 (36mm) - Mặt Xanh Dương sử dụng dây da sang trọng, thoải mái khi đeo, vỏ thép không gỉ bền bỉ, dễ dàng mix với các trang phục thời trang, là một item thời trang được ưa chuộng bởi các tín đồ thời trang trên thế giới. Sản phẩm được làm từ dây chuyền công nghệ tiên tiến của Mỹ với mặt đồng hồ được chế tác từ kính khoáng có tráng lớp chống xước cứng cáp, chống chịu va đập tốt. Vỏ đồng hồ có bề mặt bóng sáng, bền đẹp, bảo vệ lõi máy bên trong hiệu quả. Sự đơn giản trong thiết kế, không quá cầu kỳ chi tiết, nhưng từng đường nét đều có thể cảm nhận được sự tinh tế. Kiểu dáng mặt tròn được thiết kế cầu kỳ cùng gam màu hiện đại, giúp bạn tự tin phong cách hiện đại, năng động khi phối với trang phục thời trang khác nhau. Đồng hồ thu hút những tín đồ thời trang qua chính thiết kế đơn giản ở từng chi tiết nhỏ tuy nhiên vẫn không làm mất đi vẻ sang trọng, quý phái, thuần khiết, khóa dạng luồn mang lại sự tiện dụng, phù hợp với mọi khổ tay. Đồng hồ có khả năng chống thấm nước cao, dùng tốt trong môi trường nước như đi mưa, rửa tay, rửa mặt (không bấm nút dưới nước hay khi đồng hồ bị ướt). ",""""""
tiki.vn,https://tiki.vn/dong-ho-nu-day-da-julius-ja-704-nau-p468985.html?src=category-page-914.27498.8371&2hi=0,468985,Julius,Đồng hồ,,524.000 ₫,Hệ Thống Đồng Hồ Vinawatch,," Đồng Hồ Nữ Dây Da Julius JA-704- Nâu Đồng Hồ Nữ Dây Da Julius JA-704 - Nâu với dây đeo bằng da thật tự nhiên, mềm mại, tạo cảm giác thoải mái, không làm đau tay. Mặt kính khoáng siêu cứng chống trầy xước, chống chịu lực tốt, lại sáng đẹp. Thiết kế đơn giản, sang trọng, thanh lịch. Mặt đồng hồ trang trí tối giản, các mốc giờ thể hiện bằng đá pha lê. Thông tin sản phẩm Dây da thật bền đẹp, mặt kinh khoáng chịu lực tốt Đồng Hồ Nữ Dây Da Julius JA-312 - Nâu với dây đeo bằng da thật tự nhiên, mềm mại, tạo cảm giác thoải mái, không làm đau tay. Mặt kính khoáng siêu cứng chống trầy xước, chống chịu lực tốt, lại sáng đẹp. Vỏ máy 304L không gỉ, được mạ IP chân không chống được oxy hóa. Thiết kế độc đáo, mới lạ Đồng Hồ Nữ Dây Da Julius JA-704 - Nâu thiết kế đơn giản, sang trọng, thanh lịch. Mặt đồng hồ trang trí tối giản, các mốc giờ thể hiện bằng đá pha lê . Dây da được xử lý qua quy trình hiện đại, tạo màu sắc vàng kim thời trang, vân da chìm độc đáo. Khả năng chịu nước 3 ATM, mang tính ứng dụng cao Sản phẩm có khả năng chịu nước 3ATM. Đây là dòng đồng hồ được chế tạo để chịu áp suất nước 3 bar (tương đương 30m). Bạn sẽ không phải tháo mỗi khi rửa tay, không phải lo trời mưa bất chợt. Thông số kỹ thuật - Model: JA-704 - Thương hiệu: Julius - Tên thương mại: Julius JA-704 - Xuất xứ: Hàn Quốc - Kiểu máy: Quartz (Pin) - Đồng hồ dành cho: Nữ - Màu sắc: Nâu - Mặt đồng hồ: Hình tròn - Kích thước mặt: 30mm - Chất liệu vỏ: Thép không gỉ - Chất liệu dây: Da - Chất liệu kính: Kính khoáng - Chịu nước: 3 ATM Điều kiện bảo hành: Theo chính sách bảo hành của các Hãng Đồng hồ, tất cả Đồng hồ chính hãng khi bán ra đều kèm theo 1 thẻ Bảo hành hoặc sổ bảo hành có giá trị toàn cầu và chỉ được cấp một lần duy nhất khi bán ra. Khách hàng giữ lại hóa đơn để sử dụng chính sách bảo hành. Trường hợp được bảo hành - Bảo hành: 1 năm kể từ ngày mua. - Bảo hành máy và các hư hỏng kỹ thuật trong thời gian bảo hành. - Chỉ bảo hành trên máy và pin. Khi bị hư hỏng, quý khách vui lòng đem đến công ty để được bảo hành tại trung tâm chính hãng. Tuyệt đối không tự ý tháo rời hoặc đem ra nơi khác sửa chữa. - Các linh kiện của bộ máy bên trong bị hư hỏng trong thời hạn bảo hành - Thay pin trong thời hạn bảo hành đối với khách hàng mua tại Việt Nam Những trường hợp không được bảo hành - Trầy xước, tróc xi dây, vỏ, mặt kính đồng hồ do người sử dụng. - Trầy xước về vỏ, dây, mặt kính hoặc bị vỡ do va chạm trong quá trình sử dụng - Sử dụng không theo hướng dẫn của hãng, tự ý sửa đồng hồ và thay đổi máy móc bên trong, không cẩn thận hoặc do tai nạn. - Đồng hồ được sửa chữa ở những nơi không thuộc thẩm quyền của hãng. Hướng dẫn bảo quản - Không tiếp xúc với các hóa chất và để ở nơi có nhiệt độ cao quá 60 độ C hoặc thấp hơn 10 độ C. Tránh các va đập mạnh, nơi có từ trường mạnh. ",""""""
