Domain,Url,Product_id,Brand,Category,Model,Price,Seller,Tags,Info,Others
tiki.vn,https://tiki.vn/dong-ho-nam-day-kim-loai-skmei-9070cs-trang-p475422.html?src=category-page-914.27498.8371&2hi=0,475422,SKMEI,Đồng hồ,,269.100 ₫,Đồng hồ 888,," Đồng Hồ Nam Dây Kim Loại SKMEI 9070CS - Trắng Đồng Hồ Nam Dây Kim Loại SKMEI 9070CS - Trắng thiết kế mặt đồng hồ có màu trắng phối cùng sắc bạc của dây đeo mang lại phong cách thời trang thanh lịch cho phong cách phái mạnh. Dây đeo dạng mắt xích đẹp mắt. Giao diện tròn dễ nhìn, có chế độ hiển thị giờ kim, ngày và thứ trong tuần bằng Tiếng Anh và Trung Quốc. Từng chi tiết được gia công tỉ mỉ làm nổi bật đẳng cấp tinh tế của người dùng. Thông tin sản phẩm Chất liệu kính chịu lực và kim loại cao cấp Mặt đồng hồ làm bằng chất liệu kính chịu lực và khó trầy xước. Khung đồng hồ làm từ chất liệu thép không gỉ. Dây đeo bằng kim loại cao cấp, bền đẹp. Động cơ chuyển động và pin nhập khẩu từ Nhật Bản bền đẹp cho khả năng báo giờ chính xác và độ bền cao. Thiết kế tinh tế, mặt trắng thanh lịch Đồng Hồ Nam Dây Kim Loại SKMEI 9070CS - Trắng được thiết kế tinh tế với mặt tròn đơn giản, bên trong hiển thị 3 mặt dễ quan sát, tiện theo dõi phương hướng và tọa độ. Kim giờ được chế tác tinh xảo. Đồng hồ có chế độ hiển thị giờ kim, ngày và thứ trong tuần bằng Tiếng Anh và Trung Quốc. Dây đeo dạng mắt xích đẹp mắt. Nền mặt đồng hồ có màu trắng phối cùng sắc bạc của dây đeo mang lại phong cách thời trang thanh lịch cho phong cách phái mạnh. K hả năng chống thấm nước 3ATM Đồng hồ có khả năng chống thấm nước 3ATM: dùng tốt trong môi trường nước như đi mưa, rửa tay, rửa mặt (không bấm nút dưới nước hay khi đồng hồ bị ướt). Thông số kỹ thuật - Thương hiệu: SKMEI - Chất liệu mặt trước: Kính cứng pha khoáng - Chất liệu dây: Kim loại - Khung máy: Hợp kim chống gỉ - Kích thước mặt: 4cm - Kích thước dây: 22.6 x 4cm - Loại mặt: Mặt tròn - Màu sắc: Trắng - Độ chịu nước: 3 ATM - Năng lượng sử dụng: Pin Bảo hành: 12 tháng cho máy. Khách hàng giữ lại hóa đơn và phiếu bảo hành (nếu có) để tiện sử dụng chính sách bảo hành. Quy trình bảo hành: Khách hàng gửi sản phẩm trực tiếp về Tiki: - Từ 1 đến 3 ngày : phản hồi tình trạng và hướng xử lý kể từ ngày nhận - Từ 3 đến 7 ngày : Xử lý lỗi và trả sản phẩm lại cho khách hàng Thời gian bảo hành: - Bảo hành máy và các hư hỏng kỹ thuật trong thời gian bảo hành. - Chỉ bảo hành trên máy và pin. Khi bị hư hỏng, quý khách vui lòng đem đến công ty để được bảo hành tại trung tâm chính hãng. Tuyệt đối không tự ý tháo rời hoặc đem ra nơi khác sửa chữa. Chính sách bảo hành: 1.1. Sản phẩm bảo hành Thời hạn bảo hành sản phẩm được tính kể từ ngày mua của khách hàng sử dụng. Thời gian mua được ghi đầy đủ trên phiếu bảo hành, hoặc hóa đơn khi mua kèm đồng hồ. 1.2. Điều kiện bảo hành hợp lệ Đồng hồ sẽ được bảo hành nếu thỏa mãn đầy đủ các điều kiện sau: - Đồng hồ còn trong hạn bảo hành tại thời điểm khách hàng yêu cầu, Áp dụng như mục 1.1 - Hư hỏng do chất lượng linh kiện hay lỗi kỹ thuật trong quy trình sản xuất. - Thay pin trong thời hạn bảo hành đối với khách hàng mua tại Việt Nam - Đồng hồ không thuộc trường hợp bị từ chối bảo hành quy định tại điều 1.3 1.3. Điều kiện từ chối bảo hành Đồng hồ thuộc một trong những điều kiện sau sẽ mất quyền bảo hành: · Trầy xước về dây hoặc mặt kiếng bị vỡ do va chạm trong quá trình sử dụng. · Sử dụng không theo hướng dẫn của hãng, tự ý thay đổi máy móc bên trong, không cẩn thận hoặc do bị tai nạn. · Đồng hồ được sửa chữa ở những nơi không thuộc thẩm quyền của hãng. 1.4. Dịch vụ ngoài bảo hành Trong trường hợp Khách hàng có nhu cầu yêu cầu dịch vụ sửa chữa ngoài bảo hành, hoặc các dịch vụ khác phát sinh khi thời gian bảo hành sử dụng cho sản phẩm đã hết, nhà cung cấp có trách nhiệm phục vụ và sửa chữa sản phẩm với thái độ và tinh thần cao nhất. Khách hàng sẽ thanh toán các chi phí phát sinh cho việc sửa chữa như linh kiện thay thế, tiền công và chi phí khác (nếu có) dựa theo thỏa thuận giữa 2 bên. Hướng dẫn bảo quản - Không tiếp xúc với các hóa chất và để ở nơi có nhiệt độ cao quá 60 độ C hoặc thấp hơn 10 độ C. Tránh các va đập mạnh, nơi có từ trường mạnh. ",""""""
tiki.vn,https://tiki.vn/dong-ho-nam-the-thao-skmei-1258-dha487-p2777033.html?src=category-page-914.27498.8371&2hi=0,2777033,SKMEI,Đồng hồ,,259.000 ₫,Chuẩn Mua,," Đồng hồ Nam thể thao SKMEI 1258 - DHA487 Với ưu điểm màn hình hiển thị số lớn Skmei 1258 giúp bạn dễ dàng nắm bắt được thời gian chỉ với cái lướt mắt .Dây nhựa PU cao cấp (loại nhựa không nguyên chưa tái chế, không có chất độc hại như những mẫu đồng hồ nhựa rẻ tiền khác) mềm mại đeo êm tay không gây ngứa khó chịu cho bạn. Sản phẩm chống nước chuẩn 5atm giúp bạn có thể hoạt động ngoài trời, rửa tay, đi mưa mà không cần lo ngại. THÔNG TIN CHI TIẾT - Thương hiệu: Skmei Chính Hãng - Kiểu máy: Quartz - Dành cho: Nam - Chất liệu vỏ: Cao Su và Nhựa - Chất liệu mặt trước: Kính cứng pha khoáng - Chất liệu dây: Cao su mềm, êm tay - Mặt kính: Phẳng - Kích thước mặt: 35mm - 50mm (Luôn vành không tính mấu gắn dây) - Độ dày mặt: 16m - Kích thước dây: 20mm - Độ dày dây: 2mm - Cân nặng: 80g - Siêu nhẹ - Xem giờ/phút điện tử - Số lịch: Lịch ngày / tháng điện tử - Độ chịu nước: Chịu nước tốt; tránh các hoạt động bơi lội - Năng lượng sử dụng: Pin chuẩn Chức năng: + Xem giờ/phút, thứ/ngày/tháng + Hẹn giờ báo thức + Bấm giờ + Đèn led xem buổi tối BỘ SẢN PHẨM BÁN CHUẨN GỒM 1 Đồng hồ SKMEI chính hãng 1 Phiếu bảo hành 1 Họp đồng hồ Logo Skmei ",""""""
tiki.vn,https://tiki.vn/dong-ho-nam-day-da-casio-mtp-1375l-7avdf-42mm-den-p767447.html?src=category-page-914.27498.8371&2hi=0,767447,Casio,Đồng hồ,,1.712.000 ₫,Đại Lý Casio Phước Lộc,," Đồng Hồ Nam Dây Da Casio MTP-1375L-7AVDF (42mm) - Đen tạo nên điểm nhấn mạnh mẽ, năng động nơi cổ tay với mặt kính khoáng bóng sáng kết hợp cùng tông màu cá tính, bụi bặm của chất liệu dây da, góp phần giúp cho set đồ thường ngày của các chàng thêm phần trẻ trung và thu hút. Vỏ đồng hồ bằng thép không gỉ chống ăn mòn, chống oxi hóa giúp gia tăng tuổi thọ bền lâu. Mặt đeo gia công từ kính khoáng có độ cứng cao, chống chịu va đập và trầy xước trong quá trình sử dụng. Nút điều chỉnh bên hông thao tác dễ dàng và chuẩn xác. Tông màu thanh lịch, dễ phối với áo Sơ Mi, Veston để đi làm hay áo Thun, quần Jeans để dạo phố. ",""""""
tiki.vn,https://tiki.vn/dong-ho-nam-day-da-casio-mtp-v004l-7audf-30-2mm-den-p1038234.html?src=category-page-914.27498.8371&2hi=0,1038234,Casio,Đồng hồ,,642.000 ₫,Đại Lý Casio Phước Lộc,," Đồng Hồ Nam Dây Da Casio MTP-V004L-7AUDF (30.2mm) mang phong cách cổ điển nhưng sang trọng, với mặt đồng hồ tròn màu bạc kết hợp với dây da cao cấp màu đen là phụ kiện không thể thiếu giúp tôn lên phong cách thời trang của các quý ông Chất liệu kính cứng giúp cho đồng hồ chống chịu va đập tốt, hạn chế trầy xước và giữ được độ sáng bóng đẹp mắt dài lâu. Khả năng chống nước tốt ở độ sâu 30m, chống va đập, trầy xước, độ chính xác +-20 giây/tháng. Vỏ đồng hồ bằng thép không gỉ, bảo vệ lõi máy bên trong hiệu quả. Vạch chia giờ chi tiết và rõ ràng từng giây với khung chia 24 giờ. Có nút điều chỉnh tiện lợi ở vị trí bên hông mặt đồng hồ. Phù hợp khi phối với áo sơ mi, áo vest, quần kaki công sở hoặc áo thun, quần jeans thường ngày. ",""""""
tiki.vn,https://tiki.vn/dong-ho-nam-the-thao-skmei-1251-dha504-tang-hop-sat-p4142447.html?src=category-page-914.27498.8371&2hi=0,4142447,SKMEI,Đồng hồ,,249.000 ₫,NhatTuyen,," Đồng hồ Nam thể thao SKMEI 1251 - DHA504 Đồng hồ điện tử thể thao Skmei phối màu kiểu dáng thể thao khỏe khoắn, chất liệu cao cấp, phù hợp với những người chơi thể thao, làm việc ngoài trời... Tính năng cài đặt thời gian ở hai nơi tùy chọn, chuông báo thức, hiển thị ngày, hiển thị phút, tính giờ tiện dụng, nhanh gọn. Mặt kính nhập khẩu cao cấp, chống nước, chịu ma sát tốt, vỏ ngoài PU đàn hồi cao cấp, siêu chống rung. Dây PU cao cấp nhập khẩu từ Đức, mềm mại, thoải mái, khóa gài thép không gỉ, tiện dụng, dễ đóng mở. Mặt dạ quang EL nhập khẩu giúp bạn nhìn thời gian rõ nét dưới điều kiện thiếu ánh sáng . Máy, pin nhập khẩu Nhật Bản đảm bảo chuẩn xác, tuổi thọ cao; chống nước 5ATM thoải mái rửa tay, đi mưa, tắm không cần phải tháo. THÔNG TIN CHI TIẾT - Thương hiệu: Skmei Chính Hãng - Kiểu máy: Quartz - Dành cho: Nam - Chất liệu vỏ: Cao Su và Nhựa - Chất liệu mặt trước: Kính cứng pha khoáng - Chất liệu dây: Cao su mềm, êm tay - Mặt kính: Phẳng - Kích thước mặt: 49mm (Luôn vành không tính mấu gắn dây) - Kích thước dây: 25mm - Độ dày mặt: 17m - Tổng chiều dài: 240cm - Cân nặng: 80g - Siêu nhẹ - Xem giờ/phút điện tử - Số lịch: Lịch ngày / tháng điện tử - Độ chịu nước: Chịu nước tốt; tránh các hoạt động bơi lội - Năng lượng sử dụng: Pin chuẩn Chức năng: + Theo dõi 2 múi giờ với đồng hồ kim và điện tử + Xem giờ/phút, thứ/ngày/tháng + Hẹn giờ báo thức + Bấm giờ + Đèn led xem buổi tối BỘ SẢN PHẨM BÁN CHUẨN GỒM 1 Đồng hồ SKMEI chính hãng 1 Phiếu bảo hành 1 Hộp đồng hồ Logo Skmei ",""""""
tiki.vn,https://tiki.vn/dong-ho-nu-day-thep-khong-gi-julius-ja-959-30mm-vang-p648592.html?src=category-page-914.27498.8371&2hi=0,648592,Julius,Đồng hồ,,835.000 ₫,Black Cat Watch,," Đồng Hồ Nữ Dây Thép Không Gỉ Julius JA-959 (30mm) - Vàng có kiểu dáng nhẹ nhàng và quý phái với thiết kế mặt hình tròn trong suốt đính đá lấp lánh giúp tạo nên điểm nhấn đầy thu hút cho cổ tay bạn gái. Vỏ đồng hồ được làm từ hợp kim thép không gỉ, cho bề mặt bóng sáng, bền đẹp, bảo vệ lõi máy bên trong hiệu quả. Sản phẩm có dây đeo bằng thép không gỉ cao cấp, tạo cho đồng hồ vẻ ngoài sáng bóng hoàn hảo, tăng vẻ sang trọng cho người đeo. Đồng hồ có khả năng chống thấm nước 3ATM, dùng tốt trong môi trường nước như đi mưa, rửa tay, rửa mặt (không bấm nút dưới nước hay khi đồng hồ bị ướt). ",""""""
tiki.vn,https://tiki.vn/dong-ho-nu-han-quoc-day-da-julius-ja-952-xanh-den-p960729.html?src=category-page-914.27498.8371&2hi=0,960729,Julius,Đồng hồ,,1.141.000 ₫,Thời trang An Nhiên,," Đồng Hồ Nữ Hàn Quốc Dây Da JULIUS JA-952 - Xanh Đen được thiết kế với kiểu dáng thời trang, thanh lịch nhưng không kém phần sang trọng, hứa hẹn sẽ đem lại vẻ xinh xắn, đáng yêu cho các bạn nữ. Đồng hồ được làm bằng chất liệu kim loại mạ ion vàng, vừa bền chắc, vừa đảm bảo tính thẩm mỹ cho sản phẩm. Mặt kính khoáng cao cấp, trong suốt, có độ cứng cao, chống trầy xước và chống va đập tốt. Dây da bền chắc, thời trang, mang lại cho bạn cảm giác yên tâm khi sử dụng. Mặt đồng hồ hình tròn được thiết kế đẹp mắt, tạo nét sang trọng và tinh tế cho bạn gái. Đồng hồ có độ chịu nước 3 ATM cho bạn rửa tay hay đi mưa thoải mái, không cần tháo ra. Các cô nàng có thể phối đồng hồ cùng các phụ kiện thời trang khác như vòng tay, nhẫn, dây chuyền,..khi đi làm, đi chơi, shopping hay làm quà tặng người thân, bạn bè ",""""""
tiki.vn,https://tiki.vn/dong-ho-nam-day-da-casio-mtp-1374l-7avdf-43-5mm-nau-p1038236.html?src=category-page-914.27498.8371&2hi=0,1038236,Casio,Đồng hồ,,1.713.600 ₫,Đồng Hồ 247,," Đồng Hồ Nam Dây Da Casio MTP-1374L-7AVDF (43.5mm) mang phong cách cổ điển nhưng sang trọng, với mặt đồng hồ tròn viền vàng kết hợp với dây da cao cấp màu nâu có vân là phụ kiện không thể thiếu giúp tôn lên phong cách thời trang của các quý ông Chất liệu kính cứng giúp cho đồng hồ chống chịu va đập tốt, hạn chế trầy xước và giữ được độ sáng bóng đẹp mắt dài lâu. Khả năng chống nước tốt ở độ sâu 30m, chống va đập, trầy xước, độ chính xác +-20 giây/tháng. Vỏ đồng hồ bằng thép không gỉ, bảo vệ lõi máy bên trong hiệu quả. Vạch chia giờ chi tiết và rõ ràng từng giây với khung chia 24 giờ. Có nút điều chỉnh tiện lợi ở vị trí bên hông mặt đồng hồ. Phù hợp khi phối với áo sơ mi, áo vest, quần kaki công sở hoặc áo thun, quần jeans thường ngày. ",""""""
tiki.vn,https://tiki.vn/dong-ho-nam-day-nhua-casio-mq-24-1b2ldf-den-p4898375.html?src=category-page-914.27498.8371&2hi=0,4898375,Casio,Đồng hồ,,338.000 ₫,Đồng Hồ Mắt Kính 247,," Đồng Hồ Nam Dây Nhựa Casio MQ-24-1B2LDF - Đen được làm bằng chất liệu nhựa cao cấp không gây kích ứng da, chống thấm mồ hôi, sản phẩm nhựa không độc hại với người dùng. Sản phẩm mang đậm chất Sport được thiết kế với kiểu dáng bên ngoài mạnh mẽ, đa dạng chức năng khác nhau cho bạn tùy chỉnh. Có nhiều chức năng khác và có thể làm một chiếc đồng hồ bấm giây chạy đua trong các cuộc thi thể thao cực kì chính xác. ",""""""
tiki.vn,https://tiki.vn/dong-ho-day-vai-nu-timex-weekender-nylon-strap-tw2r80600-p3004527.html?src=category-page-914.27498.8371&2hi=0,3004527,Timex,Đồng hồ,,1.404.000 ₫,DAINESE VIETNAM,," Đồng Hồ Dây Vải Nữ Timex Weekender Nylon Strap - TW2R80600 sử dụng dây vải thời trang, bền chắc, thiết kế đơn giản, mang đến cho bạn cảm giác thoải mái khi đeo. Sản phẩm có vỏ thép không gỉ bền bỉ, dễ dàng phối đồ, là một item thời trang được ưa chuộng bởi các tín đồ thời trang trên thế giới. Đồng hồ được làm từ dây chuyền công nghệ tiên tiến của Mỹ với mặt đồng hồ được chế tác từ kính khoáng có tráng lớp chống xước cứng cáp, chống chịu va đập tốt. Vỏ đồng hồ có bề mặt bóng sáng, bền đẹp, giúp bảo vệ lõi máy bên trong hiệu quả. Kiểu dáng mặt tròn đơn giản, tinh tế mang phong cách hiện đại, trẻ trung, năng động. Đồng hồ có khả năng chống thấm nước cao, dùng tốt trong môi trường nước như đi mưa, rửa tay, rửa mặt,... ",""""""
tiki.vn,https://tiki.vn/dong-ho-nam-timex-day-da-timex-fairfield-41mm-chronograph-tw2r37700-p1946341.html?src=category-page-914.27498.8371&2hi=0,1946341,Timex,Đồng hồ,,2.699.400 ₫,DAINESE VIETNAM,," Đồng hồ Nam dây da Timex Fairfield 41mm Chronograph - TW2R37700 sử dụng dây da sang trọng, thoải mái khi đeo, vỏ thép không gỉ bền bỉ, dễ dàng mix với các trang phục thời trang, là một item thời trang được ưa chuộng bởi các tín đồ thời trang trên thế giới. Sản phẩm được làm từ dây chuyền công nghệ tiên tiến của Mỹ với mặt đồng hồ được chế tác từ kính khoáng có tráng lớp chống xước cứng cáp, chống chịu va đập tốt. Vỏ đồng hồ có bề mặt bóng sáng, bền đẹp, bảo vệ lõi máy bên trong hiệu quả.Sự đơn giản trong thiết kế, không quá cầu kỳ chi tiết, nhưng từng đường nét đều có thể cảm nhận được sự tinh tế. Kiểu dáng mặt tròn được thiết kế cầu kỳ cùng gam màu hiện đại, giúp bạn tự tin phong cách hiện đại, năng động khi phối với trang phục thời trang khác nhau. Đồng hồ thu hút những tín đồ thời trang qua chính thiết kế đơn giản ở từng chi tiết nhỏ tuy nhiên vẫn không làm mất đi vẻ sang trọng, quý phái, thuần khiết, khóa dạng luồn mang lại sự tiện dụng, phù hợp với mọi khổ tay. Đồng hồ có khả năng chống thấm nước cao, dùng tốt trong môi trường nước như đi mưa, rửa tay, rửa mặt (không bấm nút dưới nước hay khi đồng hồ bị ướt). ",""""""
tiki.vn,https://tiki.vn/dong-ho-nam-day-nhua-casio-aeq-100bw-9avdf-den-p4898349.html?src=category-page-914.27498.8371&2hi=0,4898349,Casio,Đồng hồ,,1.438.000 ₫,Đồng Hồ Mắt Kính 247,," Đồng Hồ Nam Dây Nhựa Casio AEQ-100BW-9AVDF - Đen được làm bằng chất liệu nhựa cao cấp không gây kích ứng da, chống thấm mồ hôi, sản phẩm nhựa không độc hại với người dùng. Sản phẩm mang đậm chất Sport được thiết kế với kiểu dáng bên ngoài mạnh mẽ, đa dạng chức năng khác nhau cho bạn tùy chỉnh. Có nhiều chức năng khác và có thể làm một chiếc đồng hồ bấm giây chạy đua trong các cuộc thi thể thao cực kì chính xác. ",""""""
tiki.vn,https://tiki.vn/dong-ho-doi-day-da-skmei-ske9058-ddd01-03c-tang-pin-nhat-va-moc-khoa-khoi-nguyen-p647369.html?src=category-page-914.27498.8371&2hi=0,647369,SKMEI,Đồng hồ,,469.000 ₫,Khôi Nguyên,," Đồng Hồ Đôi Dây Da SKMEI SKE9058-DDD01-03C (Tặng Pin Nhật Và Móc Khóa Khôi Nguyên) với mặt đồng hồ làm bằng chất liệu kính chịu lực và khó trầy xước. Khung đồng hồ làm từ chất liệu thép không gỉ. Dây đeo bằng da mềm mại tạo cảm giác thoải mái, êm tay. Động cơ chuyển động và pin nhập khẩu từ Nhật Bản, cho khả năng báo giờ chính xác và độ bền lý tưởng. Đồng hồ có khả năng chống thấm nước 3ATM: dùng tốt trong môi trường nước như đi mưa, rửa tay, rửa mặt (không bấm nút dưới nước hay khi đồng hồ bị ướt). Lưu ý Đối với dây da tránh tiếp xúc với nước thường xuyên dễ hao mòn. Tránh va chạm và tiếp xúc với chất ăn mòn, nhiệt độ cao hoặc từ trường mạnh Tránh sử dụng bất kì dung môi, chất làm sạch, chất tẩy công nghiệp, chất dính, sơn hoặc các chất xịt mỹ phẩm Tránh đeo đồng hồ cùng các vòng đeo tay vì dễ tạo vết xước hay làm hỏng mặt đồng hồ. Tránh chỉnh nút chỉnh giờ khi đồng hồ bị ướt. Tránh để đồng hồ nơi nhiệt độ thay đổi đột ngột. Tránh sử dụng, nhấn các nút hoặc cài đặt ở dưới nước. ",""""""
tiki.vn,https://tiki.vn/dong-ho-nam-day-da-skmei-9058cg-trang-p475383.html?src=category-page-914.27498.8371&2hi=0,475383,SKMEI,Đồng hồ,,287.100 ₫,Đồng hồ 888,," Đồng Hồ Nam Dây Da SKMEI 9058CG - Trắng Đồng Hồ Nam Dây Da SKMEI 9058CG - Trắng được thiết kế đẹp mắt phối cùng tông màu trắng tinh tế mang lại vẻ thanh lịch và trẻ trung cho phong cách nam giới. Kim chỉ giờ dạng chữ số La Mã được gia công tinh xảo, tỉ mỉ. Đồng hồ có khả năng chống thấm nước 3ATM tiện sử dụng hằng ngày, có thể rửa tay và đi mưa. Thông tin sản phẩm Chất liệu kính, thép không gỉ và da cao cấp Mặt đồng hồ làm bằng chất liệu kính chịu lực và khó trầy xước. Khung đồng hồ làm từ chất liệu thép không gỉ. Dây đeo bằng da mềm mại tạo cảm giác thoải mái, êm tay. Động cơ chuyển động và pin nhập khẩu từ Nhật Bản, mặt sau bằng inox không gây dị ứng cho da. Thiết kế sang trọng, màu trắng tinh tế Đồng Hồ Nam Dây Da SKMEI 9058CG - Trắng được thiết kế sang trọng với mặt tròn tinh tế, kim chỉ giờ dạng chữ số La Mã đẹp mắt. Từng chi tiết được gia công tinh xảo, tỉ mỉ xứng đáng là phụ kiện thời trang đẳng cấp của đấng mày râu. Dây đeo có vân da độc đáo phối mặt đồng hồ màu trắng tinh tế mang lại vẻ thanh lịch và trẻ trung cho phong cách nam giới. K hả năng chống thấm nước 3ATM Đồng hồ có khả năng chống thấm nước 3ATM: dùng tốt trong môi trường nước như đi mưa, rửa tay, rửa mặt (không bấm nút dưới nước hay khi đồng hồ bị ướt). Thông số kỹ thuật - Thương hiệu: SKMEI - Chất liệu mặt trước: Kính - Chất liệu vỏ: Thép không gỉ - Chất liệu dây: Da - Chất liệu mặt sau: Thép không gỉ - Kích thước mặt: 4cm - Kích thước dây: 25 x1.2 cm - Loại mặt: Mặt tròn - Màu sắc: Trắng - Độ chịu nước: 3 ATM - Năng lượng sử dụng: Pin Bảo hành: 12 tháng cho máy. Khách hàng giữ lại hóa đơn và phiếu bảo hành (nếu có) để tiện sử dụng chính sách bảo hành. Quy trình bảo hành: Khách hàng gửi sản phẩm trực tiếp về Tiki: - Từ 1 đến 3 ngày : phản hồi tình trạng và hướng xử lý kể từ ngày nhận - Từ 3 đến 7 ngày : Xử lý lỗi và trả sản phẩm lại cho khách hàng Thời gian bảo hành: - Bảo hành máy và các hư hỏng kỹ thuật trong thời gian bảo hành. - Chỉ bảo hành trên máy và pin. Khi bị hư hỏng, quý khách vui lòng đem đến công ty để được bảo hành tại trung tâm chính hãng. Tuyệt đối không tự ý tháo rời hoặc đem ra nơi khác sửa chữa. Chính sách bảo hành: 1.1. Sản phẩm bảo hành Thời hạn bảo hành sản phẩm được tính kể từ ngày mua của khách hàng sử dụng. Thời gian mua được ghi đầy đủ trên phiếu bảo hành, hoặc hóa đơn khi mua kèm đồng hồ. 1.2. Điều kiện bảo hành hợp lệ Đồng hồ sẽ được bảo hành nếu thỏa mãn đầy đủ các điều kiện sau: - Đồng hồ còn trong hạn bảo hành tại thời điểm khách hàng yêu cầu, Áp dụng như mục 1.1 - Hư hỏng do chất lượng linh kiện hay lỗi kỹ thuật trong quy trình sản xuất. - Thay pin trong thời hạn bảo hành đối với khách hàng mua tại Việt Nam - Đồng hồ không thuộc trường hợp bị từ chối bảo hành quy định tại điều 1.3 1.3. Điều kiện từ chối bảo hành Đồng hồ thuộc một trong những điều kiện sau sẽ mất quyền bảo hành: · Trầy xước về dây hoặc mặt kiếng bị vỡ do va chạm trong quá trình sử dụng. · Sử dụng không theo hướng dẫn của hãng, tự ý thay đổi máy móc bên trong, không cẩn thận hoặc do bị tai nạn. · Đồng hồ được sửa chữa ở những nơi không thuộc thẩm quyền của hãng. 1.4. Dịch vụ ngoài bảo hành Trong trường hợp Khách hàng có nhu cầu yêu cầu dịch vụ sửa chữa ngoài bảo hành, hoặc các dịch vụ khác phát sinh khi thời gian bảo hành sử dụng cho sản phẩm đã hết, nhà cung cấp có trách nhiệm phục vụ và sửa chữa sản phẩm với thái độ và tinh thần cao nhất. Khách hàng sẽ thanh toán các chi phí phát sinh cho việc sửa chữa như linh kiện thay thế, tiền công và chi phí khác (nếu có) dựa theo thỏa thuận giữa 2 bên. Hướng dẫn bảo quản - Không tiếp xúc với các hóa chất và để ở nơi có nhiệt độ cao quá 60 độ C hoặc thấp hơn 10 độ C. Tránh các va đập mạnh, nơi có từ trường mạnh. ",""""""
