Domain,Url,Product_id,Rating,Comment,Review Time,Bought Time
adayroi.com,https://www.adayroi.com/kem-duong-the-the-body-shop-spa-of-the-world-japanese-camellia-cream-350ml-p-PRI997248?offer=PRI997248_089012,PRI997248,5,"Chị gái mình đang xài loại này nè, da chị ấy càng ngày càng mềm mại, mình muốn mua xài lắm nhưng giá hơi đắt, đơi adr giảm giá mình sẽ mua về dùng",2017-04-05 17:04:00,
adayroi.com,https://www.adayroi.com/kem-duong-the-the-body-shop-spa-of-the-world-japanese-camellia-cream-350ml-p-PRI997248?offer=PRI997248_089012,PRI997248,5,Hàng Adayroi đa dạng thật vừa giao hang nhanh mà mua hang lại được tích điểm bang thẻ VinID nữa,2017-04-05 16:29:00,
adayroi.com,https://www.adayroi.com/kem-chong-nang-ohui-day-shield-perfect-sun-red-spf50-pa-50ml-p-979250?offer=979250_150126,979250,5,"Sản phẩm rất tốt, không gây bức bí cho da, thẩm thấu nhanh mùi rất dễ chịu. Mình đánh giá rất cao sp này.",2018-10-31 13:36:00,
adayroi.com,https://www.adayroi.com/kem-chong-nang-danh-cho-da-nhay-cam-mau-da-isis-pharma-uveblock-light-tinted-spf50-40ml-p-PRI455733?offer=PRI455733_M3H,PRI455733,4,"Nhờ Thành phần không gây kích ứng, đặc biệt cho da nhạy cảm nên mình mới dám mua từ adayroi đó",2017-04-12 10:02:00,
adayroi.com,https://www.adayroi.com/tinh-dau-hoa-nhai-susinia-10ml-p-PRI72443?offer=PRI72443_D7Z,PRI72443,4,mình thích nhất mùi này nè,2015-06-18 10:33:00,
adayroi.com,https://www.adayroi.com/kem-chong-nang-danh-cho-da-nhay-cam-khong-mau-isis-pharma-uveblock-invisible-spf-50-40ml-p-PRI455739?offer=PRI455739_150159,PRI455739,4,"Kem chống nắng dành cho da nhạy cảm (không màu) Isis Pharma Uveblock Invisible SPF 50 giá tốt hơn lazada và chỗ khác, i like it",2017-04-12 09:58:00,
adayroi.com,https://www.adayroi.com/kem-duong-da-tay-va-mong-the-body-shop-almond-hand-nail-cream-100ml-p-PRI1071711?offer=PRI1071711_089012,PRI1071711,5,"móng tay của mình that sự rất yếu, rất dễ gãy còn da tay thì hay bị khô nữa, từ khi sử dung Kem dưỡng da tay và móng The Body Shop Almond Hand & Nail Cream này thì da tay đã đỡ khô và móng tay cũng cứng hơn nhiều, đây đúng là một sản phẩm tốt.",2017-04-07 10:06:00,
adayroi.com,https://www.adayroi.com/kem-duong-da-tay-va-mong-the-body-shop-almond-hand-nail-cream-100ml-p-PRI1071711?offer=PRI1071711_089012,PRI1071711,4,tay và móng của mình hay tiếp xúc hóa chất nhiều nên Kem dưỡng da tay và móng The Body Shop Almond Hand & Nail Cream 100m là 1 lựa chọn hợp lí,2017-04-05 16:47:00,
adayroi.com,https://www.adayroi.com/kem-chong-nang-bao-ve-toi-da-cho-da-nhay-cam-isis-pharma-uveblock-spf80-invisible-40ml-p-PRI455717?offer=PRI455717_150159,PRI455717,4,"Kem chống nắng bảo vệ tối đa cho da nhạy cảm Isis Pharma Uveblock SPF80 Invisible là thứ mình cần nhất , hên là adayroi có bán",2017-04-12 09:33:00,
adayroi.com,https://www.adayroi.com/tinh-dau-thu-gian-l-occitane-lavender-essential-oil-5ml-p-PRI1104992?offer=PRI1104992_P6F,PRI1104992,5,"nghiện mùi hương này, nó giúp mình cảm thấy thư giản vô cùng, phòng ngủ với phòng tắm mình đều dùng mùi này, cảm thấy đời sống vợ chồng cũng hòa khí tốt hơn :)",2017-05-25 00:46:00,
adayroi.com,https://www.adayroi.com/kem-duong-lam-diu-da-danh-cho-da-bi-ngua-man-do-kho-chiu-va-bi-viem-la-roche-posay-lipikar-baume-ap-200ml-p-PRI632741?offer=PRI632741_094098,PRI632741,5,"sản phẩm chính hãng nên yên tâm không lo hàng dỏm,giá cạnh tranh",2018-10-24 18:13:00,
adayroi.com,https://www.adayroi.com/kem-duong-lam-diu-da-danh-cho-da-bi-ngua-man-do-kho-chiu-va-bi-viem-la-roche-posay-lipikar-baume-ap-200ml-p-PRI632741?offer=PRI632741_094098,PRI632741,5,"bị mẩn ở lưng nên mua về dùng thử, da đỡ hơn hẳn",2018-10-24 17:52:00,
adayroi.com,https://www.adayroi.com/kem-duong-lam-diu-da-danh-cho-da-bi-ngua-man-do-kho-chiu-va-bi-viem-la-roche-posay-lipikar-baume-ap-200ml-p-PRI632741?offer=PRI632741_094098,PRI632741,5,"Tuýp kem dưỡng to,dùng tiết kiệm,rất hiệu quả và an toàn vs da bdiet là da em bé. Bé nhà mình k bit có fai do dãi rớt nhiu k mà cằm bị nốt như chàm,ra lan ra xung quanh. Mình bôi chỉ có 4 ngày,da lại láng mịn như chưa bjo bị tổn thương. Da tay mình nhạy cảm, dị ứng vs chất tẩy rửa, bị bong chóc, nứt đau nhiu ở đầu ngón tay, chịu khó bôi 1 tg, ngon luôn  Vì hơi bóng nên fan kem còn lại jo mình dùng để bôi dưỡng da mặt buổi tối. Nhìn chung là rất ưng e này. Hihi",2018-10-24 15:09:00,
adayroi.com,https://www.adayroi.com/bo-my-pham-xit-khoang-118ml-va-sua-tam-organia-500g-p-PRI160679?offer=PRI160679_CFR,PRI160679,5,"Mình đang xài, giá cả hợp lý dùng được rất lâu, da được cải thiện rất nhiều",2015-06-18 10:03:00,
adayroi.com,https://www.adayroi.com/kem-tay-te-bao-chet-toan-than-sakura-body-scrub-200ml-p-PRI511452?offer=PRI511452_M-M6Z,PRI511452,4,Kem tẩy tế bào chết toàn thân Sakura Body Scrub Dưỡng da láng mịn và đẩy lùi những vết sần sùi trên da giúp mình tự tin hơn trong cuộc sống,2017-04-13 10:16:00,
adayroi.com,https://www.adayroi.com/kem-ngua-ran-da-cho-phu-nu-mang-thai-a-pply-skin-tightening-moisture-cream-100ml-p-414559?offer=414559_MS7,414559,5,"mới mua về , dùng được vài ngày thấy có hiệu quả đáng kể ủng hộ shop dài dài",2018-11-01 10:37:00,
adayroi.com,https://www.adayroi.com/gel-tam-huu-co-l-occitane-lavender-shower-gel-organic-certified-250ml-p-PRI923311?offer=PRI923311_P6F,PRI923311,5,"Sản phẩm tốt thích hợp cho da dễ dị ứng với hóa chất, hương liệu",2017-08-23 10:32:00,
adayroi.com,https://www.adayroi.com/sua-duong-can-bang-da-va-lam-mem-da-hbmic-ph-5-5-solution-500ml-p-PRI31012?offer=PRI31012_D64,PRI31012,4,"Solution này được ak nhe, lại tốn tiền nữa rồi.",2015-06-11 00:44:00,
adayroi.com,https://www.adayroi.com/bo-duong-the-the-body-shop-almond-milk-honey-soothing-restoring-body-butter-200ml-p-PRI1072875?offer=PRI1072875_089012,PRI1072875,5,"sản phẩm này nhìn mẫu hợp đẹp quá, đọc sơ thấy công dung tốt quá chắc phải order về dung thử",2017-04-07 17:37:00,
adayroi.com,https://www.adayroi.com/bo-duong-the-the-body-shop-almond-milk-honey-soothing-restoring-body-butter-200ml-p-PRI1072875?offer=PRI1072875_089012,PRI1072875,4,"cái này xài tốt hơn pond và các sản phẩm khác, rất đúng loại mình cần cho da mình",2017-04-05 17:20:00,
adayroi.com,https://www.adayroi.com/kem-duong-da-chan-l-occitane-shea-butter-foot-cream-150ml-p-PRI950856?offer=PRI950856_P6F,PRI950856,4,Hiệu quả cảm nhận được. Mùi hương thư giãn,2017-07-19 14:17:00,
adayroi.com,https://www.adayroi.com/gel-tan-mo-giam-beo-crevil-cellutite-gel-200ml-p-PRI736932?offer=PRI736932_MSQ,PRI736932,5,"đã sử dụng thử sản phẩm này, hỗ trợ mình giảm mỡ béo",2017-06-10 11:46:00,
adayroi.com,https://www.adayroi.com/kem-tan-mo-dr-oz-550g-p-PRI571668?offer=PRI571668_MS7,PRI571668,4,"mua cho mẹ mình xài lúc đầu mẹ ko dùng , về sau dùng đến muốn hết hộp lại bảo mua thêm 1 hộp nữa chắc xài thấy hiệu quả nè :)",2018-11-08 16:59:00,
adayroi.com,https://www.adayroi.com/kem-tan-mo-dr-oz-550g-p-PRI571668?offer=PRI571668_MS7,PRI571668,5,"em cũng giới thiệu nhiều người dùng lắm , hầu như họ bảo ok hàng này xài cũng dc hihi",2018-11-08 16:57:00,
adayroi.com,https://www.adayroi.com/kem-tan-mo-dr-oz-550g-p-PRI571668?offer=PRI571668_MS7,PRI571668,4,mình mới sanh xong ra tháng thấy view khen mua thử xài thì cũng hiệu quả đó mà giá thành hơi cao ạ :),2018-11-08 16:43:00,
adayroi.com,https://www.adayroi.com/kem-tan-mo-dr-oz-550g-p-PRI571668?offer=PRI571668_MS7,PRI571668,5,"mình dùng nhiều sp kem tan mỡ nhưng cũng k thấy mấy hiệu quả , mà xài đến sp này nó hợp hay sao ý , xài mà 1 tuần mình giảm dc 2cm luôn . mà bụng mình như bụng bia nó nhão mà xài giảm v hàng tuyệt vời lắm nhé",2018-11-08 16:41:00,
adayroi.com,https://www.adayroi.com/kem-tan-mo-dr-oz-550g-p-PRI571668?offer=PRI571668_MS7,PRI571668,5,"mua 1 hộp này đáng tiền xài được tháng hơn mà còn chưa hết , may sức có tí xíu mà nóng muốn tan mỡ luôn , nói chung hài lòng lắm ạ",2018-11-08 16:39:00,
adayroi.com,https://www.adayroi.com/kem-tan-mo-dr-oz-550g-p-PRI571668?offer=PRI571668_MS7,PRI571668,4,"hàng đến bao bì thì ok đó , mà mới thử 1 ngày cũng chưa biết kết quả sao , mình ráng dùng hết hộp xem sao",2018-11-08 16:37:00,
adayroi.com,https://www.adayroi.com/kem-tan-mo-dr-oz-550g-p-PRI571668?offer=PRI571668_MS7,PRI571668,5,"nói chung giá cũng không đắt , chủ yếu là chất lượng mà mua về xài cũng dc 1 tuần thấy cũng khá giảm đáng kể",2018-11-08 16:35:00,
adayroi.com,https://www.adayroi.com/kem-tan-mo-dr-oz-550g-p-PRI571668?offer=PRI571668_MS7,PRI571668,5,"hàng chất lượng tuyệt vời , thoa kem đến đâu thấm đến đó , mua sp này đúng tiện lợi tặng theo mỡ bụng xài ưng ghê luôn đó",2018-11-08 16:34:00,
adayroi.com,https://www.adayroi.com/kem-tan-mo-dr-oz-550g-p-PRI571668?offer=PRI571668_MS7,PRI571668,4,"hũ to chà bá xài tiết kiệm vô cùng , mới mua về chưa thấy kết quả nhưng thoa lên kem nóng vô cùng , nói chung là thấy cảm giác nóng vùng mỡ",2018-11-08 16:33:00,
adayroi.com,https://www.adayroi.com/kem-tan-mo-dr-oz-550g-p-PRI571668?offer=PRI571668_MS7,PRI571668,5,"bữa mua 1 hũ , được tặng kèm theo quà tặng miếng dán tan mỡ kết hợp xài chung 1 tháng e giảm được 3-5 cm e ko tin vào mắt mình luôn",2018-11-01 16:27:00,
adayroi.com,https://www.adayroi.com/kem-tan-mo-dr-oz-550g-p-PRI571668?offer=PRI571668_MS7,PRI571668,5,hàng này xài tốt cho 5 điểm,2018-11-01 10:35:00,
adayroi.com,https://www.adayroi.com/kem-tan-mo-dr-oz-550g-p-PRI571668?offer=PRI571668_MS7,PRI571668,5,chất lượng sản phẩm tuyệt vời,2018-10-26 15:13:00,
adayroi.com,https://www.adayroi.com/kem-tan-mo-dr-oz-550g-p-PRI571668?offer=PRI571668_MS7,PRI571668,5,"sản phẩm này xài ok lắm nè , mình thấy hiệu quả đáng kể",2018-10-26 15:11:00,
adayroi.com,https://www.adayroi.com/kem-tay-da-chet-the-body-shop-almond-milk-honey-exfoliating-cream-scrub-250ml-p-PRI1072823?offer=PRI1072823_089012,PRI1072823,5,Kem tẩy da chết The Body Shop Almond Milk & Honey Exfoliating Cream Scrub công dung rất tốt không những tẩy được tế bào chết mà còn làm mêm mịn da nữa. dùng là ghiền.,2017-04-07 16:02:00,
adayroi.com,https://www.adayroi.com/kem-tay-da-chet-the-body-shop-almond-milk-honey-exfoliating-cream-scrub-250ml-p-PRI1072823?offer=PRI1072823_089012,PRI1072823,5,"Kem tẩy da chết The Body Shop Almond Milk & Honey Exfoliating Cream Scrub xứng đáng được 5 sao, xài khá tốt, tế bào chết trên da mình được tẩy sạch cả",2017-04-05 17:02:00,
adayroi.com,https://www.adayroi.com/kem-duong-trang-da-toan-than-isis-pharma-body-tone-reveal-100ml-p-PRI455621?offer=PRI455621_M3H,PRI455621,4,Da mình đen ngâm nhưng từ khi xài sis Pharma Body Tone Reveal mình hoàn toàn tin tưởng hãng này nhiều,2017-04-12 09:34:00,
adayroi.com,https://www.adayroi.com/tinh-chat-duong-the-the-body-shop-british-rose-instant-glow-body-essence-250ml-p-PRI994478?offer=PRI994478_089012,PRI994478,5,"xài cả bộ vơi cả sữa tắm nữa rất là thơm, đi làm về chỉ muốn tắm em này rồi bôi lotion ngủ đến sáng vẫn còn thơm, da mịn nữa thích lắm",2017-04-05 17:57:00,
adayroi.com,https://www.adayroi.com/tinh-chat-duong-the-the-body-shop-british-rose-instant-glow-body-essence-250ml-p-PRI994478?offer=PRI994478_089012,PRI994478,5,"Tinh chất dưỡng thể The Body Shop British Rose Instant Glow Body Essence này mình vừa mới đặt hôm qua và đã nhận được hang, nghe nói là rất tốt hy vọng là Như mong đợi :v",2017-04-05 00:42:00,
adayroi.com,https://www.adayroi.com/tinh-chat-duong-the-the-body-shop-british-rose-instant-glow-body-essence-250ml-p-PRI994478?offer=PRI994478_089012,PRI994478,5,"Da mình rất khô, từ khi được nhỏ bạn tư vấn mua tinh chất dưỡng thể The Body Shop da mình được cải thiện rõ rệt, da sáng mịn màng, rạng rỡ hơn trước nhiều",2017-04-05 00:27:00,
adayroi.com,https://www.adayroi.com/tay-te-bao-chet-ximenia-the-body-shop-spa-of-the-world-african-ximenia-scrub-350ml-p-PRI1005662?offer=PRI1005662_089012,PRI1005662,4,"ximenia The Body Shop Spa Of The World African Ximenia Scrub hiệu quả đáng kể với làn da của mình, cám ơn adayroi nhiêu nha",2017-04-05 16:38:00,
adayroi.com,https://www.adayroi.com/tay-te-bao-chet-muoi-bien-the-body-shop-spa-of-the-world-dead-sea-salt-scrub-350ml-p-PRI1005705?offer=PRI1005705_089012,PRI1005705,5,"Tẩy tế bào chết muối biển The Body Shop Spa Of The World Dead Sea Salt Scrub này rất tốt không sợ dị ứng nhé vì mình là 1 tín đồ của nó đây, that sự da mình rất nhạy cảm và dễ dị ứng lắm ko phải dung lại nào cũng dc nhưng mình lại sử dung dc loại muối biển này",2017-04-05 17:01:00,
adayroi.com,https://www.adayroi.com/tay-te-bao-chet-muoi-bien-the-body-shop-spa-of-the-world-dead-sea-salt-scrub-350ml-p-PRI1005705?offer=PRI1005705_089012,PRI1005705,4,Tẩy tế bào chết muối biển The Body Shop Spa Of The World Dead Sea Salt Scrub là một sản phẩm mà mình ưa chuộng nhất tại adayroi,2017-04-05 15:38:00,
adayroi.com,https://www.adayroi.com/sua-non-tu-nhien-sokiss-first-milk-natural-100g-p-PRI831179?offer=PRI831179_M-NRQ,PRI831179,5,"Tắm sữa non rất mịn da, thích lắm như đang đi spa",2017-05-13 14:20:00,
adayroi.com,https://www.adayroi.com/sua-tam-gervenne-trang-da-tinh-chat-sua-de-900g-p-PRI169346?offer=PRI169346_CHK,PRI169346,3,"Mua cho bà xã lọ sữa tắm này,. tắm thơm phức nhé cả nhà. da dẻ cũng mềm mại hơn, đặc biệt thơm lâu, ngủ cứ phải hít hà suốt thôi à =))",2017-02-09 15:14:00,
adayroi.com,https://www.adayroi.com/sua-tam-trang-da-huong-hoa-hong-geo-perfume-body-cleanser-rose-spa-600ml-p-PRI147450?offer=PRI147450_M-NUF,PRI147450,5,Rất tôt khi đóng gói,2017-11-19 17:54:00,
adayroi.com,https://www.adayroi.com/sua-tam-trang-da-huong-hoa-hong-geo-perfume-body-cleanser-rose-spa-600ml-p-PRI147450?offer=PRI147450_M-NUF,PRI147450,4,"Chai to 600ml dùng lâu nên tính ra giá cả khá phải chăng, mùi hương thơm mát mình khá thích, dùng xong da mịn, sáng da",2017-02-06 00:44:00,
adayroi.com,https://www.adayroi.com/sua-tam-trang-da-huong-hoa-hong-geo-perfume-body-cleanser-rose-spa-600ml-p-PRI147450?offer=PRI147450_M-NUF,PRI147450,5,Thích mùi này quá,2015-06-16 15:59:00,
adayroi.com,https://www.adayroi.com/sua-tam-the-body-shop-british-rose-shower-gel-250ml-p-PRI994434?offer=PRI994434_089012,PRI994434,5,"mình nghiện mùi hoa hồng của body shop lắm lắm, tắm xong bám lên áo quần thơm được cả ngày luôn thích lắm, lọ 250ml dùng được cả 2 tháng nữa không đắt mấy",2017-04-05 17:56:00,
adayroi.com,https://www.adayroi.com/sua-tam-the-body-shop-british-rose-shower-gel-250ml-p-PRI994434?offer=PRI994434_089012,PRI994434,5,"Hôm trước mình mới mua em này về dùng mà không thấy có giảm giá, này được giảm giá 10% like gê, chắc phải mua thêm để dành sử dụng mới được",2017-04-05 16:15:00,
adayroi.com,https://www.adayroi.com/sua-tam-the-body-shop-british-rose-shower-gel-250ml-p-PRI994434?offer=PRI994434_089012,PRI994434,5,"Sữa tắm The Body Shop British Rose Shower Gel này phải nói là nó rất tốt khi sử dung nó tạo cho tôi làn da thơm mát và mềm mịn mấy đứa bạn đứa nào cũng hỏi sao da tôi mềm thế, that tui không ki bo mà giới thiệu cho họ sử dung luôn sản phẩm này, đứa nào cũng thích cả :v",2017-04-05 00:26:00,
adayroi.com,https://www.adayroi.com/kem-duong-am-cho-da-kich-ung-a-derma-skincare-cream-50ml-p-PRI494958?offer=PRI494958_M3H,PRI494958,5,"Cho mình hỏi, sản phẩm này có phải là chính hãng k ạ? Adayroi fan foi hay của đối tác ạ? Liên hệ giúp m 0945022117",2017-09-26 22:22:00,
adayroi.com,https://www.adayroi.com/sua-duong-the-the-body-shop-almond-milk-honey-soothing-restoring-body-lotion-200ml-p-PRI1072913?offer=PRI1072913_089012,PRI1072913,5,Phải nói là mình công nhận sản phẩm này tốt thật mình sử dung cũng được gần 2 tuần rồi mà giờ da mình cảm giác rất mịn và tươi sang. Sữa dưỡng thể The Body Shop Almond Milk & Honey Soothing & Restoring Body Lotion là số 1,2017-04-07 16:05:00,
adayroi.com,https://www.adayroi.com/sua-duong-the-the-body-shop-almond-milk-honey-soothing-restoring-body-lotion-200ml-p-PRI1072913?offer=PRI1072913_089012,PRI1072913,4,"Hôm qua sao không thấy sản phẩm này ta, giờ mới tìm thấy lỡ mua tip khác mất rồi",2017-04-05 17:21:00,
adayroi.com,https://www.adayroi.com/sua-duong-the-hoa-anh-dao-l-occitane-cherry-blossom-shimmering-lotion-250ml-p-PRI1043488?offer=PRI1043488_P6F,PRI1043488,3,Huong thom diu nhung nhanh mat mui,2017-08-26 21:15:00,
adayroi.com,https://www.adayroi.com/sua-duong-the-hoa-anh-dao-l-occitane-cherry-blossom-shimmering-lotion-250ml-p-PRI1043488?offer=PRI1043488_P6F,PRI1043488,4,"Lotion có mùi thơm nhọt dịu nhẹ, ko bị gắt. Apply lên da thấm nhanh, ko bị nhờn hay rít. Lần trc mua trên ADR cũng đc giảm giá ^^",2017-05-25 11:39:00,
adayroi.com,https://www.adayroi.com/sua-tam-lifebuoy-thien-nhien-850g-p-PRI351989?offer=PRI351989_CHK,PRI351989,3,"trong mấy loại, thì loại chiết xuất từ khổ qua này tắm có vẻ thích nhất nè. Mùi thơm dịu nhẹ, lưu lâu, cả nhà mình ai cũng thích dùng sữa tắm thiên nhiên này.",2017-02-09 14:31:00,
adayroi.com,https://www.adayroi.com/sua-tam-muoi-bien-st-ives-400ml-p-PRI169005?offer=PRI169005_CHK,PRI169005,5,Sữa tắm sài rất ok,2017-09-01 16:09:00,
adayroi.com,https://www.adayroi.com/sua-tam-shower-mate-green-tea-body-shower-gel-550g-p-PRI30478?offer=PRI30478_HW6,PRI30478,3,Sữa tắm Showermate body natrure Green tea,2015-06-19 15:54:00,
adayroi.com,https://www.adayroi.com/sua-chong-nang-za-true-white-ex-power-block-uv-spf50-pa-50ml-p-PRI872931?offer=PRI872931_094098,PRI872931,5,"giá tốt, bữa mình mua xài ok lắm",2017-06-09 09:36:00,
adayroi.com,https://www.adayroi.com/sua-tam-tram-tra-the-body-shop-tea-tree-body-wash-250ml-p-PRI1003637?offer=PRI1003637_089012,PRI1003637,5,"Giao hang nhanh, hang dung nhu hinh. Good",2017-11-14 21:07:00,
adayroi.com,https://www.adayroi.com/sua-tam-tram-tra-the-body-shop-tea-tree-body-wash-250ml-p-PRI1003637?offer=PRI1003637_089012,PRI1003637,5,"Tìm mãi mới được một sản phẩm ưng ý để mua tặng chị  gái, chắc mua loại này thôi,  vì loại này có loại bỏ bụi bẩn, bã nhờn, diệt khuẩn, kiểm soát dầu thừa vì chị gái mình đi làm thường xuyên ra ngoài để gặp khách hàng",2017-04-05 17:19:00,
adayroi.com,https://www.adayroi.com/sua-tam-tram-tra-the-body-shop-tea-tree-body-wash-250ml-p-PRI1003637?offer=PRI1003637_089012,PRI1003637,5,"Sữa tắm tràm trà The Body Shop Tea Tree Body Wash, hiệu quả rất tốt nó vừa duyệt khuẩn và bã nhờn mà còn làm cho làm da tôi mềm mịn và thơm mát",2017-04-05 15:01:00,
adayroi.com,https://www.adayroi.com/sua-duong-the-tinh-chat-o-liu-xanh-organia-aroma-green-body-essence-lotion-400ml-p-PRI147490?offer=PRI147490_CFR,PRI147490,3,có oliu là thích rồi,2015-06-18 15:07:00,
adayroi.com,https://www.adayroi.com/co-cha-got-chan-2-mat-vacosi-p01-p-PRI975922?offer=PRI975922_M-NRQ,PRI975922,5,"Chà gót chân sạch, chà rất sướng",2017-05-16 15:25:00,
adayroi.com,https://www.adayroi.com/sua-tam-huong-cam-the-body-shop-satsuma-shower-gel-250ml-p-PRI1071504?offer=PRI1071504_089012,PRI1071504,5,Sữa tắm dịu nhẹ. Hương cam hơi khác so với các sản phẩm khác. Lúc mới đầu khá hắc nhưng sau khi hòa tan thành xà phòng và tắm thì lại rất dễ chịu,2017-09-28 15:22:00,
adayroi.com,https://www.adayroi.com/sua-tam-o-liu-the-body-shop-olive-shower-gel-250ml-p-PRI1071481?offer=PRI1071481_089012,PRI1071481,5,Hài lòng về sản phẩm và dịch vụ,2017-09-02 10:03:00,
adayroi.com,https://www.adayroi.com/sua-tam-o-liu-the-body-shop-olive-shower-gel-250ml-p-PRI1071481?offer=PRI1071481_089012,PRI1071481,5,"Adroi giao hành cực kỳ nhanh, mới đặt hôm qua 2 lọ Sữa tắm ô liu The Body Shop Olive Shower Gel 250ml này thì trưa nay đã nhận được rồi",2017-04-07 17:28:00,
adayroi.com,https://www.adayroi.com/sua-tam-o-liu-the-body-shop-olive-shower-gel-250ml-p-PRI1071481?offer=PRI1071481_089012,PRI1071481,4,"Tắm bằng Sữa tắm ô liu The Body Shop Olive Shower Gel thật là thích, mua 3 chai tại adayroi xài thấy cực kì tốt",2017-04-05 16:30:00,
adayroi.com,https://www.adayroi.com/sua-tam-lifebuoy-bao-ve-vuot-troi-10-chai-850g-p-PRI149791?offer=PRI149791_CHK,PRI149791,5,Dịch vụ xuất sắc. Sáng order trưa đã giao ngay.,2017-09-26 22:45:00,
adayroi.com,https://www.adayroi.com/sua-tam-lux-magical-spell-530g-p-PRI1280412?offer=PRI1280412_CHK,PRI1280412,1,,2018-10-25 14:02:00,
adayroi.com,https://www.adayroi.com/sua-tam-duong-the-dove-deeply-nourishing-530g-p-PRI1072192?offer=PRI1072192_CHK,PRI1072192,5,dịch vụ nhanh tuyệt vời,2017-08-18 00:06:00,
adayroi.com,https://www.adayroi.com/sua-tam-duong-the-dove-deeply-nourishing-530g-p-PRI1072192?offer=PRI1072192_CHK,PRI1072192,5,mùi thơm. dưỡng ẩm rất thik.,2017-08-17 10:15:00,
adayroi.com,https://www.adayroi.com/sua-tam-lifebuoy-cham-soc-da-850g-p-PRI387097?offer=PRI387097_CHK,PRI387097,5,rất hài lòng,2017-06-18 01:31:00,
adayroi.com,https://www.adayroi.com/tay-te-bao-chet-o-liu-the-body-shop-olive-exfoliating-cream-250ml-p-PRI1073189?offer=PRI1073189_089012,PRI1073189,5,Tẩy tế bào chết ô liu The Body Shop Olive Exfoliating Cream  dung rất hiệu quả nhất là người có làm da khô Như mình. mình dung rất nhiều loại nhưng chỉ có thằng này là ưng ý nhất,2017-04-07 17:26:00,
adayroi.com,https://www.adayroi.com/tay-te-bao-chet-o-liu-the-body-shop-olive-exfoliating-cream-250ml-p-PRI1073189?offer=PRI1073189_089012,PRI1073189,5,"Hàng của The Body Shop xài ít khi bị dị ứng. Tẩy tbc oliu này xài rất ok nhé. Dịu nhẹ, loại bỏ da chết. Tẩy xong da mịn màng, sờ thích lắm. Nếu có giảm giá nữa mình sẽ mua 2 hủ để dành :))",2017-04-05 17:36:00,
