Domain,Url,Product_id,Brand,Category,Model,Price,Seller,Tags,Info,Others
mediamart.vn,https://mediamart.vn/soundbar/samsung/loa-soundbar-samsung-hwn300xv.htm,,Samsung,Loa Soundbar,Loa Soundbar Samsung HW-N300/XV,2.790.000,,," . Thiết kế 1 thanh loa tối ưu không gian sống. Kết nối không dây với TV và nhiều thiết bị. Điều khiển thông minh với một remote duy nhất. . . . . Hình ảnh tham khảo: Loa Soundbar Samsung HW-N300/XV. . . . . . . . . . . . . . . . . . . . . . . . . . . . . . . . . . . . . . . . . . Thông số kỹ thuật: Loa Soundbar Samsung HW-N300/XV. . . . Thông số loa Soundbar. . . . . . . . Thông tin: Loa Soundbar Samsung HW-N300/XV. . . Nâng Tầm Giải Trí Tại Gia. Kết nối với TV và trải nghiệm sức mạnh lan toả âm thanh mạnh mẽ từ loa thanh N300 tinh tế và nhỏ gọn. Giải trí đỉnh cao, đắm chìm trong không gian âm nhạc mạnh mẽ và sắc nét vượt trội.. . . *Loa thanh kết nối không dây với TV qua Bluetooth.. . . Bùng Nổ Âm Trầm Mạnh Mẽ. Trải nghiệm sắc âm trầm mạnh mẽ với loa trung và hai loa trầm (woofer) tích hợp ngay trong loa thanh Sound+. Nhiều không gian hơn, tận hưởng sắc trầm trọn vẹn hơn.. . . Chơi Nhạc Bất Tận với Cổng USB Tích Hợp. Đơn giản kết nối thiết bị với cổng USB 2.0 được tích hợp sẵn trong loa thanh N300, phát bất tận các bản nhạc yêu thích và đắm chìm trong không gian âm nhạc cá tính riêng của bạn.. . . Âm Thanh Đa Chiều Lan Tỏa. Tính năng Mở Rộng Âm Thanh Vòm độc đáo lan tỏa âm thanh chất lượng cao, trải rộng đến nhiều hướng và đồng đều ở khắp nơi. Hiệu ứng âm thanh vòm mạnh mẽ cuốn bạn vào không gian giải trí đa sắc màu và sống động đến không ngờ.. . . Kết Nối Không Dây với TV. Kết nối loa thanh N300 với Samsung TV* hoàn toàn dễ dàng thông qua Bluetooth mà không cần dây cắm phức tạp. Bạn có thể thưởng thức tất cả nội dung giải trí hấp dẫn với chất lượng âm thanh sắc nét, tuyệt vời nhất ở bất kỳ đâu.. . . *Tương thích với một số dòng TV Samsung hỗ trợ Bluetooth.. . . Khuấy Động Âm Nhạc Với Bluetooth. Loa thanh sử dụng kết nối Bluetooth không dây đến các thiết bị khác, cho bạn thưởng thức âm nhạc từ điện thoại với chất lượng hoàn hảo ở mọi nơi, loại bỏ dây nối.. . . Điều Khiển Thông Minh - Một Cho Tất Cả. Bạn không cần nhiều remote để điều khiển các thiết bị. Từ việc bật tắt, điều chỉnh âm lượng, thậm chí hiệu ứng âm thanh và nhiều tính năng chính của loa thanh N300 có thể được điều chỉnh chỉ với One Remote thông minh ngay trên giao diện TV.. *Tương thích với một số dòng TV Samsung. Vui lòng liên hệ với nhân viên cửa hàng để biết thêm chi tiết.. . . Ứng Dụng Quản Lý Âm Thanh Từ Xa. Điều khiển loa thanh Samsung dễ dàng trên điện thoại di động và máy tính bảng chạy hệ điều hành Android™ với ứng dụng Quản Lý Âm Thanh Từ Xa của Samsung. Chỉ cần kết nối sử dụng Bluetooth™ để điều khiển tất cả các tính năng chính của loa thanh và tận hưởng những bài hát yêu thích trên thiết bị di động thông qua một ứng dụng duy nhất.. *Android được đăng ký bản quyền của Google Inc. *Bluetooth được đăng ký bản quyền của Bluetooth SIG Inc.. . . . . . . Tư Vấn Mua Loa Sound Bar. . . . . . ",""""""
mediamart.vn,https://mediamart.vn/soundbar/lg/loa-soundbar-lg-sj7-21-ch.htm,,LG,Loa Soundbar,Loa Soundbar LG SJ7 2.1 CH,2.990.000,,," . . . . Hình ảnh tham khảo: Loa Soundbar LG SJ7 2.1 CH. . . . . . . . . . . . . . . . . . . . . . . . . . . . . . . . . . . . . . . . . . . . . . . . . . . . . . . . . . . . Thông số kỹ thuật: Loa Soundbar LG SJ7 2.1 CH. . . . Thông số loa Soundbar. . . Công suất loa. . 320W. . . . . . . . . Thông tin: Loa Soundbar LG SJ7 2.1 CH. . . Thông số kỹ thuật. . . . PRODUCT HIGHLIGHTS. . . . . Rear Surround. . Yes. . . . Built-in Battery. . Yes. . . . Bluetooth Streaming. . Yes. . . . Adaptive Sound Control (ASC). . Yes. . . . Sound Sync Wireless. . Yes. . . . HDMI In/Out. . Yes. . . . Wireless Active Subwoofer. . Yes. . . . . . . SPEAKER - CHANNEL / OUTPUT POWER. . . . . Soundbar Mode - Channels. . 2.1ch. . . . Soundbar Mode - Total Output Power. . 320W (Secondary Speaker Using AC Power) 140W (Secondary Speaker Using Li-ion Battery). . . . Rear Surround Mode - Channels. . 4.1ch. . . . Rear Surround Mode - Total Output Power. . 320W (Secondary Speaker Using AC Power) 140W (Secondary Speaker Using Li-ion Battery). . . . Portable Mode - Channels. . 2.1ch (Primary Speaker) 2.0 (Secondary Speaker). . . . Portable Mode - Total Output Power. . 160W 30W. . . . . . . FEATURES. . . . . Bluetooth Remote App (Android). . Yes. . . . Bluetooth Stand-By. . Yes. . . . Auto Music Play (BLE). . Yes. . . . TV Remote Compatibility. . Yes. . . . Audio Return Channel (ARC). . Yes. . . . LCD Display Auto Dimming. . Yes. . . . Subwoofer Level Control. . Yes. . . . Wall Mountable. . Yes. . . . . . . SOUND MODES. . . . . Adaptive Sound Control (ASC): Default. . Yes. . . . Standard. . Yes. . . . Bass Blast. . Yes. . . . Cinema. . Yes. . . . . . . AUDIO FORMAT. . . . . LPCM. . Yes. . . . Dolby Digital. . Yes. . . . DTS Digital Surround. . Yes. . . . . . . CONNECTIVITY. . . . . Wireless Active Subwoofer. . Yes. . . . Bluetooth (ver. 4.0). . Yes. . . . LG TV Sound Sync (Bluetooth). . Yes. . . . LG TV Sound Sync (Optical). . Yes. . . . HDMI 1.4 Out. . Yes (1). . . . HDMI 1.4 In. . Yes (1). . . . Optical Input. . Yes (1.0). . . . USB Host. . No (Service Only). . . . SIMPLINK (HDMI CEC). . Yes. . . . . . . SPEAKER. . . . . Front. . 60W x 2. . . . Subwoofer. . 200W (wireless). . . . . . . BUILT-IN BATTERY (SECONDARY SPEAKER). . . . . Battery Type. . Li-ion Battery. . . . Battery Capacity. . 5200mAh. . . . Battery Charging Time. . 3hr 40min. . . . Battery Life. . Up to 4 hours of playback. . . . . . . POWER. . . . . Soundbar Standby Power Consumption. . Less than 0.5W. . . . Subwoofer Standby Power Consumption. . Less than 0.5W. . . . . . . DIMENSIONS / WEIGHT. . . . . TV Matching. . 43"" and above. . . . Speakers (WxHxD). . 13.4"" x 2.9"" x 4.3"". . . . Subwoofer (W x H x D). . 6.7"" x 12.6"" x 9.9"". . . . Subwoofer Net Weight. . 9.26 lbs. . . . . . . INCLUDED ACCESSORIES. . . . . Remote Control. . Yes. . . . Batteries. . Yes (AAA). . . . Optical Cable. . Yes. . . . Vertical Table Stand. . Yes. . . . . . . . . Tư Vấn Mua Loa Sound Bar. . . . . . ",""""""
mediamart.vn,https://mediamart.vn/soundbar/samsung/loa-sound-bar-samsung-hwms650-3-ch.htm,,Samsung,Loa Soundbar,Loa Sound Bar Samsung HW-MS650 3.0 CH,7.990.000,,," . - 3 Kênh âm thanh (tích hợp Kênh trung tâm). - 9 loa tích hợp gồm 3 loa Tweeter và 6 Loa Woofer. - HD Audio (96kHz/24bit). - Kết Nối Wi-Fi / Bluetooth 4.0. . . . . Hình ảnh tham khảo: Loa Sound Bar Samsung HW-MS650 3.0 CH. . . . . . . . . . . . . . . . . . . . . . . . . . . . . . . . . . . . . . . Thông số kỹ thuật: Loa Sound Bar Samsung HW-MS650 3.0 CH. . . . Thông số loa Soundbar. . . . . . . . Thông tin: Loa Sound Bar Samsung HW-MS650 3.0 CH. . . Âm Thanh Chuẩn, Trải Nghiệm Chuẩn. . . . . Uy Lực Âm Trầm Mạnh Mẽ. . Công nghệ Distortion Cancelling dự đoán chuyển động và giảm biến dạng âm thanh trước khi được phát ra, cho bạn âm trầm sâu hơn và chính xác hơn mà không cần thêm loa trầm rời (subwoofer).. . . . Âm Thanh Không Dây Đa Chiều. . Phụ kiện Loa Sau Không Dây* nâng tầm chất lượng Soundbar lên thành hệ thống âm thanh vòm chất lượng cao mà không cần dây nối**. Bạn có thể tạo ra hệ thống kênh với trải nghiệm âm thanh sắc nét hoàn hảo.. . . * Loa Sau Không Dây Samsung là phụ kiện bán rời (Mã sản phẩm: SWA-9000S). **Thiết bị kết nối không dây cần kết nối với nguồn điện. Bộ loa sau có thể kết nối với thiết bị bằng dây cáp.. . Thưởng Thức ""Điểm Ngọt"" Chuẩn Mọi Vị Trí. . Không còn lo lắng lựa chọn chỗ ngồi lý tưởng để thưởng thức âm nhạc chất lượng cao. Cảm nhận âm thanh đồng đều tuyệt vời ở bất kỳ đâu trong phòng với loa Tweeter cải tiến.. . . Âm Thanh HD Sống Động Như Thật. . Cảm nhận sắc âm tuyệt vời và hòa mình vào nhịp điệu với âm thanh độ phân giải cao (HD Audio) chân thực đến bất ngờ. HD Audio giữ được nguyên vẹn chất lượng và độ tròn đầy của âm thanh gốc ban đầu qua chuẩn 96KHz/24bit.. . . 9 Loa Tích Hợp. . Soundbar được thiết kế 9 loa với 9 bộ khuếch đại riêng mang đến âm thanh rõ nét và sống động như thật. Cấu hình loa được thiết kế và điều chỉnh bởi Phòng Thử nghiệm Âm thanh (Samsung Audio Lab).. . . . Công Nghệ Điều Khiển Đa Loa Độc Quyền. . Trải nghiệm âm thanh hoàn hảo. Với công nghệ Samsung độc đáo, bộ loa đa hướng phát ra âm thanh đồng thời mang đến sắc trầm mạnh mẽ hơn.. . . Chất Lượng Âm Thanh Đỉnh Cao. . Các kĩ sư âm thanh hàng đầu tại Phòng thí nghiệm California đã áp dụng phương pháp nghiên cứu và mô hình khoa học máy tính tiên tiến để mang đến chất lượng âm thanh cân bằng tuyệt đối, mang đẳng cấp thế giới.. . . Kết Nối Không Dây với TV. . Kết nối Soundbar với Samsung TV* hoàn toàn dễ dàng thông qua Bluetooth mà không cần dây cắm phức tạp. Bạn có thể thưởng thức tất cả nội dung giải trí hấp dẫn với chất lượng âm thanh sắc nét, tuyệt vời nhất.. . . * Tương thích với một số dòng TV Samsung. Liên hệ các cửa hàng để biết thêm chi tiết.. . Kết Hợp Hoàn Hảo, Không Giới Hạn. . Thiết kế tối giản. Dễ dàng treo Loa Soundbar trực tiếp trên TV mà không cần thêm lỗ khoan trên tường. Đặc biệt, chỉ cần một cáp nguồn khởi động cho cả hai thiết bị (TV và Loa), giảm thiểu kết nối dây phức tạp.. . *Giá Treo One Mount (Mã sản phẩm: WMN300SB) được bán rời. . . Điều Khiển Thông Minh - Một Cho Tất Cả. . Bạn không cần nhiều Remote để điều khiển các thiết bị. Từ việc bật tắt, điều chỉnh âm lượng, thậm chí hiệu ứng âm thanh và nhiều tính năng chính của Loa Soundbar có thể được điều chỉnh với Điều khiển TV Samsung thông qua giao diện TV.. . . Trải Nghiệm Âm Thanh 4K Thực Sự Mượt Mà. . Nội dung UHD 4K, hay Đầu đĩa Blu-ray UHD 4K kết hợp cùng Samsung Soundbar Sound+sẽ là sự kết hợp hoàn hảo mang lại trải nghiệm giải trí bất tận, mà không bỏ lỡ bất kỳ nội dung chất lượng cao nào. Chỉ cần kết nối cổng 4K Pass-Through, tất cả nội dung UHD 4K sẽ được trình chiếu mượt mà cùng hệ thống âm thanh vòm sống động, chân thực.. . . Chế Độ Âm Thanh Thông Minh. . Chọn chế độ âm thanh hay để Soundbar giúp bạn điều chỉnh âm thanh. Tính năng động đáo tự động phân tích âm thanh và cân chỉnh chất lượng phát ra tốt nhất cho từng nội dung giải trí.. . . . Kết Nối Âm Nhạc Không Giới Hạn. . Samsung Soundbar Sound+ có thể phát nhạc từ điện thoại hoặc máy tính bảng khuấy động nhịp điệu theo cách riêng của bạn. Chỉ cần kết nối qua Bluetooth hoặc Wi-Fi để thưởng thức các bài hát yêu thích.. . . Ứng Dụng Multiroom. . Ứng dụng nghe nhạc Samsung Multiroom mang đến trải nghiệm âm nhạc thú vị với chất lượng hoàn hảo hoàn toàn dễ dàng.. . . . . . . . . . . Tư Vấn Mua Loa Sound Bar. . . . . . ",""""""
mediamart.vn,https://mediamart.vn/soundbar/panasonic/loa-soundbar-panasonic%C2%A0schtb485gak.htm,,Panasonic,Loa Soundbar,Loa SoundBar Panasonic SC-HTB485GAK 2.1,2.490.000,,," . . . . Hình ảnh tham khảo: Loa SoundBar Panasonic SC-HTB485GAK 2.1. . . . . . . . . . . . . . . Thông số kỹ thuật: Loa SoundBar Panasonic SC-HTB485GAK 2.1. . . . Thông số loa Soundbar. . . Công suất loa. . 250W. . . . . . . . . Thông tin: Loa SoundBar Panasonic SC-HTB485GAK 2.1. . . . Kiểu dáng hiện đại. . Dàn âm thanh Sound Bar Panasonic SCHTB485GAK có kiểu dáng thiết kế thanh mảnh, sang trọng cùng màu sắc nhã nhặn mang lại vẻ hiện đại cho ngôi nhà bạn.Dàn âm thanh mang khả năng treo tường độc đáo.. . . Âm thanh sống động. . Dàn âm thanh có trang bị EQ đặt sẵn 4 chế độ( Dữ dội, Trong trẻo, Êm dịu, Thanh âm) giúp bạn có thể lựa chọn chế độ nhạc mà mình muốn, cho bạn những dây phút giải trí thú vị,. . . Đầy đủ kết nối. . Dàn âm thanh có đầy đủ các kết nối USB, Bluetooth, NFC, giúp bạn dễ dàng kết nối và trải nghiệm những bản nhạc thú vị từ những thiết bị khác như điện thoại, máy tính... . . Điều khiển dễ dàng. . Dàn âm thanh Sound Bar Panasonic SCHTB485GAK điều khiển dễ dàng với điều khiển Bass& Treble,giúp bạn dễ dàng sử dụng.. . . . . . Tư Vấn Mua Loa Sound Bar. . . . . . ",""""""
mediamart.vn,https://mediamart.vn/soundbar/samsung/loa-sound-bar-samsung-hwm550-31-ch.htm,,Samsung,Loa Soundbar,Loa Sound Bar Samsung HW-M550 3.1 CH,5.990.000,,," . - 3.1 kênh tích hợp kênh trung tâm. . - Loa Thanh kết nối Loa siêu trầm không dây. . - 6 loa tích hợp gồm 3 loa Tweeter và 3 loa Mid-range. . - Kết nối Bluetooth 2.1. . . . . . . Hình ảnh tham khảo: Loa Sound Bar Samsung HW-M550 3.1 CH. . . . . . . . . . . . . . . Thông số kỹ thuật: Loa Sound Bar Samsung HW-M550 3.1 CH. . . . Thông số loa Soundbar. . . Công suất loa. . 340W. . . . . . . . . Thông tin: Loa Sound Bar Samsung HW-M550 3.1 CH. . . Chất Lượng Âm Thanh. . • 3.1 Kênh (tích hợp Kênh trung tâm), Công suất 340W. . • Loa Thanh kết nối Loa siêu trầm không dây. . • 6 loa tích hợp gồm 3 loa Tweeter và 3 loa Mid-range. . Kết Nối. . • Bluetooth 2.1. . • HDMI, Cáp quang, USB. . Kích Thước Loa Chính. . • Dài x Cao x Rộng: 1010 x 54 x 87.5 mm. . • Khối lượng: 2.6 kg. . Kích Thước Loa Siêu Trầm. . • Dài x Cao x Rộng: 200 x 392 x 378 mm. . • Khối lượng: 7.2 kg. . . . . . Tư Vấn Mua Loa Sound Bar. . . . . . ",""""""
mediamart.vn,https://mediamart.vn/soundbar/lg/soundbar-lg-21-sk8.htm,,LG,Loa Soundbar,SoundBar LG 2.1 SK8,4.990.000,,," . Dolby Atmos, Âm thanh có độ phân giải cao. Nâng cấp âm thanh. Tích hợp Chromecast. Hoạt động với Google Assistant. . . . . Hình ảnh tham khảo: SoundBar LG 2.1 SK8. . . . . . . . . . . . . . . . . . . . . . . . . . . . . . . . . . . . . . . Thông số kỹ thuật: SoundBar LG 2.1 SK8. . . . Thông số loa Soundbar. . . Công suất loa. . 360W. . . . . . . . . Thông tin: SoundBar LG 2.1 SK8. . . Âm thanh rạp chiếu phim tại gia với Dolby Atmos®. Hệ thống Loa thanh LG SK8 2.1 được trang bị âm thanh chuẩn Hollywood bởi những người tiên phong trong ngành công nghiệp Dolby. Dolby Atmos di chuyển trong không gian ba chiều, cho phép tái tạo âm thanh giải trí chân thực hơn.. . . Âm thanh có độ phân giải cao. Âm nhạc số đã đạt đến chất lượng tuyệt đỉnh, góp phần mang đến một trải nghiệm nghe nhạc chân thực hơn, hấp dẫn hơn. Loa thanh LG có chứng nhận Hi-Res có thể phát âm thanh stereo dạng lossess với chất lượng lên đến 96kHz/24-bit.. . . Hoạt động với Google Assistant. Bạn có thể phát nhạc, bỏ qua bản nhạc và điều chỉnh âm lượng trên loa thanh LG bằng giọng nói của bạn. Bạn chỉ cần một thiết bị khác có cài đặt sẵn Google Assistant như Loa LG ThinQ.. *Tính năng này khả dụng khi loa bật.. . . Tích hợp Chromecast. Phát nhạc trực tuyến không dây từ Sound Bar từ các ứng dụng phổ biến* như Pandora và Google Play Music. Tích hợp Chromecast tương thích với điện thoại thông minh/máy tính bảng. Các thiết bị tích hợp Google Assistant như loa LG ThinQ có thể phát nhạc trực tuyến sang thiết bị này và thiết bị âm thanh Chromecast khác trong toàn bộ ngôi nhà.. *Vui lòng kiểm tra với nhà cung cấp nội dung vì dịch vụ hoặc sản phẩm có thể thay đổi bất cứ lúc nào. Yêu cầu phải có kết nối Internet. Một số dịch vụ có thể yêu cầu phải đăng ký.. . . Điều khiển âm thanh tương thích. Phim hành động, phim truyện, thể thao, âm nhạc và thậm chí là tin tức ban đêm tất cả đều có cấu hình âm thanh khác nhau, vì vậy bạn không nên nghe tất cả theo cùng một cách: Điều khiển âm thanh tương thích sẽ xác định nội dung đang phát và tự động điều chỉnh chế độ âm thanh để tạo ra trải nghiệm âm thanh lý tưởng.. . . Điều khiển bằng điều khiển từ xa của TV. Loa thanh LG đi kèm điều khiển từ xa của loa, nhưng bạn cũng có thể điều khiển loa bằng điều khiển từ xa TV của chính bạn*.. * Bộ điều khiển từ xa TV của LG, Sony, Philips, Sharp, Panasonic, Vizio, Toshiba và Samsung cũng có thể điều khiển loa LG Sound Bar.. . . . . . Tư Vấn Mua Loa Sound Bar. . . . . . ",""""""
mediamart.vn,https://mediamart.vn/soundbar/panasonic/loa-soundbar-panasonic%C2%A0schtb18eg-21.htm,,Panasonic,Loa Soundbar,Loa SoundBar Panasonic SC-HTB18EG 2.1,1.990.000,,, . . . . Hình ảnh tham khảo: Loa SoundBar Panasonic SC-HTB18EG 2.1. . . . . . . . . . . . . . . . . . Thông số kỹ thuật: Loa SoundBar Panasonic SC-HTB18EG 2.1. . . . Thông số loa Soundbar. . . . . . . . . Tư Vấn Mua Loa Sound Bar. . . . . . ,""""""
mediamart.vn,https://mediamart.vn/soundbar/samsung/loa-soundbar-samsung-hwm450xv.htm,,Samsung,Loa Soundbar,Loa soundbar Samsung HW-M450/XV,5.290.000,,," . Kiểu dáng sang trong, hiện đại phù hợp với nhiều không gian sống.. Công nghệ âm thanh độc quyền Surround Sound Expansion mang lại âm thanh sống động, chân thực.. Công suất 320W mạnh mẽ đáp ứng tốt mọi nhu cầu nghe nhạc, xem phim.. Hỗ trợ nhiều chuẩn kết nối như: jack 3.5, bluetooh, USB.... . . . . Hình ảnh tham khảo: Loa soundbar Samsung HW-M450/XV. . . . . . . . . . . . . . . . . . . . . . . . . . . . . . . . . . . . . . . . . . . . . . . . . . . . . . Thông số kỹ thuật: Loa soundbar Samsung HW-M450/XV. . . . Thông số loa Soundbar. . . Công suất loa. . 320W. . . . . . . . . Thông tin: Loa soundbar Samsung HW-M450/XV. . . Âm Trầm Mạnh Mẽ. Với thiết kế không dây tiện lợi, bạn có thể dễ dàng lắp đặt loa âm trầm (subwoofer) để đắm mình thưởng thức những sắc trầm mạnh mẽ sống động như thật.. . . Âm Thanh Đa Chiều Lan Tỏa. Tính năng Surround Sound Expansion độc đáo lan tỏa âm thanh chất lượng cao, trải rộng đến nhiều hướng và đồng đều ở khắp nơi. Hiệu ứng âm thanh vòm mạnh mẽ cuốn bạn vào không gian giải trí đa sắc màu.. . . Điều Khiển Thông Minh - Một Cho Tất Cả. Bạn không cần nhiều Remote để điều khiển các thiết bị. Từ việc bật tắt, điều chỉnh âm lượng, thậm chí hiệu ứng âm thanh và nhiều tính năng chính của Loa Soundbar có thể được điều chỉnh với Điều khiển TV Samsung thông qua giao diện TV.. . . Kết Nối Không Dây với TV. Kết nối Soundbar với TV Samsung* hoàn toàn dễ dàng không cần dây cắm cồng kềnh thông qua Bluetooth. Bạn có thể thưởng thức tất cả nội dung giải trí hấp dẫn với chất lượng âm thanh sắc nét, tuyệt vời nhất.. . . * Tương thích với một số dòng TV Samsung. Liên hệ các cửa hàng để biết thêm chi tiết.. . . Khuấy Động Âm Nhạc với Bluetooth. Soundbar sử dụng kết nối Bluetooth không dây đến các thiết bị khác, cho bạn thưởng thức âm nhạc từ điện thoại, máy tính với chất lượng hoàn hảo ở bất cứ nơi đâu, không cần dây nối.. . . Ứng Dụng Quản Lý Âm Thanh Samsung Từ Xa. Điều khiển Soundbar dễ dàng trên điện thoại di động và máy tính bảng chạy hệ điều hành Android™ với Ứng dụng quản lý âm thanh Samsung từ xa. Chỉ cần kết nối sử dụng Bluetooth™ để điều khiển tất cả các tính năng chính của Soundbar và tận hưởng những bài hát yêu thích trên thiết bị di động thông qua một ứng dụng duy nhất.. *Android được đăng ký bản quyền của Google Inc. Bluetooth được đăng ký bản quyền của Bluetooth SIG Inc.. . . . . . . Tư Vấn Mua Loa Sound Bar. . . . . . ",""""""
mediamart.vn,https://mediamart.vn/soundbar/fenda/loa-soundbar-fenda-t160x.htm,,Fenda,Loa Soundbar,Loa SoundBar Fenda T-160X,1.290.000,,," . Thiết kế thanh dài tinh tế và hiện đại.. Kết nối không dây Bluetooth giúp thoải mái phát nhạc từ thiết bị di động một cách nhanh chóng.. Remote đi kèm giúp thuận tiện cho người dùng tùy chỉnh theo ý muốn.. . . . . . Hình ảnh tham khảo: Loa SoundBar Fenda T-160X. . . . . . . . . . . . . . . Thông số kỹ thuật: Loa SoundBar Fenda T-160X. . . . Thông số loa Soundbar. . . Công suất loa. . 40W. . . . . . . . . Thông tin: Loa SoundBar Fenda T-160X. . . Thiết kế thời trang bắt mắt. Loa Soundbar Fenda T-160X có kiểu dáng hình chữ nhật, thiết kế thời trang cùng với kiểu dáng bắt mắt, hiện đại mang lại tính thẩm mỹ cao.. . . Kết nối không dây linh hoạt. Loa bluetooth Fenda có hỗ trợ kết nối không dây linh hoạt qua bluetooth , cho phép bạn phát nhạc từ các thiết bị âm thanh khác như điện thoại, máy tính bảng,.... . . Giải trí thoải mái. Loa bluetooth Fenda T-160X mang đến chất lượng âm thanh đảm bảo với cường độ lớn nhưng vẫn giữ nguyên được chất nhạc vốn có của nó. Tổng công suất của loa là 40 W cho ra chất lượng âm thanh ổn định, sống động và ít bị nhiễu kể cả khi âm lượng ở mức cực đại.. . . Dễ dàng sử dụng. Loa bluetooth Fenda T-160X được tích hợp sẵn các nút điều chỉnh ngay trên đầu hơn nữa thiết kế thêm nút tăng giảm âm bass giúp người dùng dễ dàng điều chỉnh âm thanh theo ý muốn, rất tiện lợi.. . . . . . . . . Tư Vấn Mua Loa Sound Bar. . . . . . ",""""""
