Domain,Url,Product_id,Brand,Category,Model,Price,Seller,Tags,Info,Others
mediamart.vn,https://mediamart.vn/soundbar/sony/loa-soundbar-sony-ht-nt5-21-ch.htm,,Sony,Loa Soundbar,Loa Soundbar Sony HT-NT5 2.1 CH/ Wifi/ Bluetooth,10.493.000,,," . - Khả năng giải mã & phát nhạc âm thanh chất lượng cao Hi-res Audio.. . - Hệ thống loa: 2.1 CH. . - Loa subwoofer không dây. . - Giải mã âm thanh vòm định dạng Dolby Digital. . - Hiệu ứng âm thanh Clearaudio +. . - Công nghệ giả lập âm thanh vòm S-Force Pro, Dolby TrueHD, DTS-HD... . - Ứng dụng điều khiển SongPal Link. . - Công suất 400 W. . - Kết nối: Bluetooth, HDMI, USB, Wifi. . - Năm sản xuất: 2016. . . . . Hình ảnh tham khảo: Loa Soundbar Sony HT-NT5 2.1 CH/ Wifi/ Bluetooth. . . . . . . . . . . . . . . . . . . . . . . . . . . Thông số kỹ thuật: Loa Soundbar Sony HT-NT5 2.1 CH/ Wifi/ Bluetooth. . . . Thông số loa Soundbar. . . Công suất loa. . 400W. . . . . . . . . Thông tin: Loa Soundbar Sony HT-NT5 2.1 CH/ Wifi/ Bluetooth. . . Loa Soundbar 2.1 kênh với Âm thanh độ phân giải cao/Wi-Fi. . Được chế tác cho âm thanh cao cấp. . Khám phá trải nghiệm âm thanh rõ nét sâu lắng trong mỗi bài hát và từng bản nhạc phim với bộ HT-NT5 cùng các linh kiện âm thanh chuyên biệt và công nghệ âm thanh độ phân giải cao.. . . Loa subwoofer không dây. . Loa subwoofer không dây củng cố từng âm trầm và bản nhạc, cho những âm trầm mạnh mẽ đầy thổn thức.. . Bộ khuếch đại S-Master HX. . Bộ khuếch đại S-Master HX tiếp thêm năng lượng cho mỗi loa đơn, cùng lúc loại bỏ những biến dạng âm, cho trải nghiệm âm thanh độ phân giải cao tốt nhất.. . Loa siêu thanh tweeter đứng. . Những loa tweeter chuyên biệt này có thể đạt đến tần số cao nhất, cho bạn cảm nhận đến từng chi tiết âm thanh.. . . Mạch loa woofer SIGMA. . Một mạch từ tính bên trong loa woofer tạo ra âm trầm trung thực cao, phản hồi nhanh với độ biến dạng thấp.. . Hệ thống loa 3 đường tiếng. . Một loa woofer và hai loa tweeter ở mỗi bên của loa soundbar cùng nhau mang đến âm thanh trên toàn dải tần số tràn ngập căn phòng của bạn.. . Điều khiển loa thông minh. . Hệ thống này sẽ tối ưu hóa việc sử dụng loa cho âm thanh tinh chỉnh trong một khu vực nghe rộng, dù loa soundbar của bạn được gắn trên tường hay đặt trên mặt phẳng.. . . Đắm chìm trong thế giới âm thanh. . Công nghệ âm thanh vòm giả lập của chúng tôi sẽ đưa bạn chìm đắm vào những bộ phim yêu thích bằng cách mô phỏng các âm thanh ba chiều phong phú, cho bạn cảm giác vô cùng chân thật.. . . Âm thanh độ phân giải cao là gì?. . Cũng như khi chuyển từ video chất lượng tiêu chuẩn sang chất lượng HD, các bài hát với âm thanh Hi-Res sẽ có chất lượng cao hơn nhiều so với các tệp MP3 và hơn cả các đĩa CD, cho phép bạn nghe được từng hơi thở, từng tiếng trống và từng nốt nhạc.. . . Nâng cấp DSEE HX. . Thưởng thức từng chi tiết của bản ghi gốc. DSEE HX mang đến âm thanh chất lượng studio bằng cách khôi phục chi tiết mất đi trong quá trình nén.. . . Kết nối với tất cả - Các cổng quang học, HDMI và USB. . Giờ đây bạn có thể thưởng thức âm thanh chất lượng cao trên mọi nội dung nhờ có 3 ngõ vào HDMI, 1 ngõ ra HDMI, USB, cùng các kết nối kỹ thuật số và analog.. . Cổng HDMI. . Với 3 ngõ vào HDMI tương thích HDCP 2.2, bạn có thể kết nối với đầu Internet TV, đầu phát Blu-ray Disc™, máy chơi game cũng như TV của bạn.. . Cổng USB. . Thưởng thức âm nhạc với các định dạng tệp đa dạng, bao gồm MP3, FLAC và DSD với âm thanh độ phân giải cao.. . Kết nối mạng LAN. . Phát âm thanh từ mạng tại nhà của bạn qua Wi-Fi® băng tầng kép 2.4GHz/5GHz hoặc ethernet.. . Tương thích HDR. . Tín hiệu HDR mang đến hình ảnh có độ chi tiết, màu sắc và độ tương phản vượt trội, với phạm vi độ sáng rộng hơn so với các định dạng video khác.. . Công nghệ bảo vệ nội dung HDCP 2.2. . HDCP 2.2 - HT-NT5 tương thích với chuẩn bảo vệ nội dung số HDCP 2.2, vì vậy bạn luôn sẵn sàng cho các định dạng 4K tương lai.. . . Được thiết kế phù hợp với TV của bạn. . Thiết kế tối giản của HT-NT5 sẽ không che khuất tầm nhìn của bạn mà còn giúp bạn dễ dàng treo loa lên tường, trong khi bộ phận điều khiển loa thông minh giúp tối ưu hóa âm thanh với mọi cài đặt. Thiết bị còn tương thích hoàn toàn với chất lượng 4K, vì vậy bạn có thể thưởng thức một bức tranh sống động như thật cùng âm thanh chân thực.. . . Những âm thanh luôn bên bạn. . Phát nhạc trực tiếp cho tất cả các không gian trong nhà với SongPal Link. . Hãy cùng thưởng thức âm nhạc tuyệt vời khắp ngôi nhà với trải nghiệm nghe đa không gian, được điều khiển thông qua ứng dụng SongPal. Sử dụng SongPal Link để kết nối hệ thống loa và loa soundbar của Sony với nhau, sau đó truyền phát nhạc ở nhiều phòng khác nhau.. . . Phát trực tiếp với Google Cast. . Phát nhạc, podcast và radio từ hơn 100 ứng dụng âm nhạc, bao gồm cả Google Play™ Music và nhiều hơn nữa.. . Âm thanh không dây. . Nghe nhạc trực tiếp từ Internet qua kết nối Wi-Fi®, hoặc dùng Bluetooth® để phát trực tiếp từ laptop, điện thoại hoặc máy tính bảng.. . . Bluetooth® tốt hơn. . LDAC là một công nghệ âm thanh từ Sony cho phép bạn thưởng thức âm thanh không dây chất lượng cao qua Bluetooth®. Với LDAC bạn có thể phát nhạc trực tiếp với chất lượng tương đương âm thanh độ phân giải cao, cho trải nghiệm nghe không dây tuyệt vời.. . Nguồn: Sony.com.vn. . . . . . Tư Vấn Mua Loa Sound Bar. . . . . . ",""""""
mediamart.vn,https://mediamart.vn/soundbar/sony/loa-soundbar-sony-ht-rt3-51-ch.htm,,Sony,Loa Soundbar,Loa Soundbar Sony HT-RT3 5.1 CH/ NFC/ Bluetooth,4.543.000,,," . - Loa Sound bar Sony HT-RT3 kĩ thuật số. . - Hệ thống loa 5.1 CH (kênh). . - Loa subwoofer không dây, Loa Bass Reflex. . - Giải mã âm thanh vòm định dạng Dolby Digital. . - Hiệu ứng âm thanh Clearaudio +. . - Âm thanh S-Master tinh tế, chất lượng âm thanh rõ ràng. . - Công suất 600 W. . - Kết nối: Bluetooth, HDMI, USB, NFC. . - Năm sản xuất: 2016. . . . . Hình ảnh tham khảo: Loa Soundbar Sony HT-RT3 5.1 CH/ NFC/ Bluetooth. . . . . . . . . . . . . . . . . . . . . Thông số kỹ thuật: Loa Soundbar Sony HT-RT3 5.1 CH/ NFC/ Bluetooth. . . . Thông số loa Soundbar. . . Công suất loa. . 600W. . . . . . . . . Thông tin: Loa Soundbar Sony HT-RT3 5.1 CH/ NFC/ Bluetooth. . . Điều kì diệu từ những bộ phim. . Đắm mình trong từng bộ phim với âm thanh vòm 5.1 kênh trung thực. Các loa sau và loa subwoofer ngoài sẽ hoạt động cùng với loa soundbar 3 kênh để mang đến hiệu ứng âm thanh vòm như trong rạp chiếu phim, đồng thời bộ khuếch đại kỹ thuật số S-Master đảm bảo âm thanh luôn thuần khiết nhất.. . . Tổng công suất đầu ra 600W. . Cho âm thanh của các bộ phim thêm sống động với tổng công suất đầu ra 600W.. . Âm thanh vòm 5.1 kênh chân thực. . Sự kết hợp giữa năm kênh loa và một loa subwoofer giúp bạn chìm đắm trong âm thanh trên toàn dải tần số.. . NFC và Bluetooth®. . Kết nối Bluetooth® nhanh chóng với điện thoại thông minh tương thích qua NFC một chạm.. . Cảm nhận từng khung cảnh. . Âm thanh vòm 5.1 kênh mang đến âm thanh trung thực như tại rạp hát. . Hãy chọn chỗ ngồi thoải mái nhất để tận hưởng dàn âm thanh của rạp hát tại nhà HT-RT3. Một loa soundbar, loa subwoofer và loa sau tạo nên âm thanh vòm chân thực, cho bạn đắm chìm vào các bộ phim yêu thích.. . . Dolby® Digital. . Tận hưởng âm thanh vòm 5.1 kênh chất lượng cao với Dolby® Digital.. . Phát mọi bài hát bạn yêu thích. . NFC và Bluetooth - Truyền phát tất cả âm nhạc yêu thích của bạn đến loa soundbar qua kết nối Bluetooth®. Bắt đầu ngay lập tức khi bạn thực hiện kết nối một chạm qua NFC.. . . Cài đặt nhanh chóng chỉ trong vài giây. . HT-RT3 gần như sẵn sàng sử dụng ngay sau khi mở hộp. Chỉ cần cắm điện, kết nối các dây loa theo màu và tận hưởng âm thanh vòm 5.1 kênh trung thực. Tất cả các dây cáp đều nối vào loa subwoofer, vì vậy bạn có thể giữ cho mọi thứ gọn gàng và ngăn nắp.. . HDMI ARC. . HDMI ARC (Kênh trao đổi âm thanh) cho phép bạn kết nối với TV chỉ bằng một dây cáp duy nhất, ít cáp hơn và dễ kiểm soát hơn.. . . Cổng USB. . Kết nối ổn định với điện thoại thông minh, máy tính bảng và các thẻ USB để bạn có thể sạc thiết bị hoặc phát các tệp MP3.. . Ngõ vào quang học. . Thưởng thức âm thanh vòm chất lượng cao từ đĩa Blu-ray và DVD với ngõ vào quang học.. . Nguồn: Sony.com.vn. . . . . . Tư Vấn Mua Loa Sound Bar. . . . . . ",""""""
mediamart.vn,https://mediamart.vn/soundbar/sony/loa-soundbar-sony-ht-ct390-21-ch.htm,,Sony,Loa Soundbar,Loa Soundbar Sony HT-CT390 2.1 CH/ NFC/ Bluetooth,5.383.000,,," . - Loa Sound bar Sony HT-CT390 NFC One-touch . . - Hệ thống loa 2.1 CH (kênh). . - Loa subwoofer không dây, Loa Bass Reflex. . - Giải mã âm thanh vòm định dạng Dolby Digital. . - Hiệu ứng âm thanh Clearaudio +. . - Âm thanh S-Force Front Surround. . - Kết nối điều khiển SongPal. . - Công suất 300 W. . - Kết nối: Bluetooth, HDMI, USB, NFC. . - Năm sản xuất: 2016. . . . . Hình ảnh tham khảo: Loa Soundbar Sony HT-CT390 2.1 CH/ NFC/ Bluetooth. . . . . . . . . . . . . . . . . . . . . . . . Thông số kỹ thuật: Loa Soundbar Sony HT-CT390 2.1 CH/ NFC/ Bluetooth. . . . Thông số loa Soundbar. . . Công suất loa. . 300W. . . . . . . . . Thông tin: Loa Soundbar Sony HT-CT390 2.1 CH/ NFC/ Bluetooth. . . Âm thanh lớn và hay hơn. . Thưởng thức trọn vẹn các giai điệu trong tất cả các bộ phim và bài hát của bạn với chiếc loa soundbar 2.1 kênh. Công suất đầu ra 300W mang lại không gian âm nhạc sôi động, trong khi loa subwoofer không dây sẽ điểm thêm chiều sâu bằng những âm bass vang dội.. . . Tổng công suất đầu ra 300W. . Thổi hồn vào từng bài hát, chương trình và các bộ phim với âm lượng và độ rõ nét tương xứng nhờ công suất đầu ra định mức 300W.. . Âm thanh vòm 2.1 kênh. . Các màng loa ở mỗi đầu của loa soundbar tạo nên những âm thanh tầm trung và cao rõ nét, trong khi đó, loa subwoofer không dây sẽ lấp đầy không gian với những âm trầm thổn thức.. . . S-Force Front Surround. . Công nghệ âm thanh vòm giả lập của chúng tôi sẽ giúp bạn sống cùng các bộ phim yêu thích bằng cách mô phỏng âm thanh vòm theo phong cách điện ảnh. Loa subwoofer không dây cho những âm trầm sâu lắng tràn ngập khắp không gian.. . . Được thiết kế phù hợp với không gian của bạn. . Với thiết kế siêu mỏng chỉ 5,2cm, HT-CT390 sẽ khiến bạn quên mất cảm giác đó là chiếc TV. Việc treo tường thật dễ dàng và thiết kế màu đen đầy cuốn hút cũng hòa hợp hoàn hảo với hệ thống home cinema của bạn.. . Dễ dàng treo tường. . Các đường viền của loa soundbar tạo nên điểm nhấn bên cạnh chiếc TV treo tường của bạn.. . . Thiết kế gọn nhẹ. . Thiết kế mỏng sẽ không ảnh hưởng hay che khuất màn hình TV, vì vậy bạn sẽ luôn xem được những hình ảnh trọn vẹn.. . Cổng USB. . Kết nối USB giúp bạn có thể phát các bản nhạc MP3 dễ dàng.. . . HDMI ARC. . HDMI ARC (Kênh trao đổi âm thanh) cho phép bạn kết nối với TV chỉ bằng một dây cáp duy nhất, ít cáp hơn và dễ kiểm soát hơn.. . Ngõ vào quang học. . Thưởng thức âm thanh vòm chất lượng cao từ đĩa Blu-ray và DVD với ngõ vào quang học.. . . Phát mọi bài hát bạn yêu thích. . NFC và Bluetooth®. . Bắt đầu phát nhạc ngay khi kết nối Bluetooth® một chạm qua NFC.. . . Thế giới âm nhạc trong tầm tay của bạn. . Thưởng thức âm nhạc trọn vẹn với SongPal. . Cài đặt SongPal trên iPhone và điện thoại Android để phát nhạc, cài đặt thiết bị và nhiều hơn nữa - tất cả chỉ thông qua một ứng dụng.. . Nguồn: sony.vom.vn. . . . . . Tư Vấn Mua Loa Sound Bar. . . . . . ",""""""
mediamart.vn,https://mediamart.vn/soundbar/sony/dan-am-thanh-sound-bar-sony-hts100f.htm,,Sony,Loa Soundbar,Loa Sound bar Sony HT-S100F,2.443.000,,," . Thiết kế một-thanh (không loa Sub), mỏng tinh tế, dễ dàng lắp đặt. Cải tiến với công suất 120W mạnh mẽ . Công nghệ giả lập âm thanh vòm S-Force Surround. Kết nối đơn giản với TV qua cổng HDMI, Kết nối không dây với Bluetooth. . . . . Hình ảnh tham khảo: Loa Sound bar Sony HT-S100F. . . . . . . . . . . . . . . . . . Thông số kỹ thuật: Loa Sound bar Sony HT-S100F. . . . Thông số loa Soundbar. . . . . . . . . Tư Vấn Mua Loa Sound Bar. . . . . . ",""""""
mediamart.vn,https://mediamart.vn/soundbar/sony/loa-soundbar-sony-dolby-atmos-htx9000f.htm,,Sony,Loa Soundbar,Loa Soundbar Sony Dolby Atmos HT-X9000F,8.393.000,,," . Công nghệ S-Force PRO / Vertical Surround Engine 7.1.2 kênh tái tạo trường âm thanh 3D một cách tự nhiên. Công nghệ âm thanh vòm Dolby Atmos đỉnh cao . Công suất 300W mạnh mẽ vượt trội. Tương thích 4K HDR, phát âm thanh Hi-res đúng chuẩn. 3 cổng HDMI hỗ trợ kết nối 4K HDR. . . . . Hình ảnh tham khảo: Loa Soundbar Sony Dolby Atmos HT-X9000F. . . . . . . . . . . . . . . . . . . . . . . . . . . Thông số kỹ thuật: Loa Soundbar Sony Dolby Atmos HT-X9000F. . . . Thông số loa Soundbar. . . . . . . . Thông tin: Loa Soundbar Sony Dolby Atmos HT-X9000F. . . Thưởng thức âm thanh bao trùm với âm thanh vòm tối đa 7.1.2 kênh. . Công nghệ âm thanh vòm Vertical Surround Engine mới nhất của chúng tôi mang đến chất lượng âm thanh Dolby Atmos sống động trong một thiết bị thanh mảnh. Dù bố trí ở đâu, hai loa trước sẽ tái tạo âm thanh ""theo chiều dọc"" (vertical), tạo nên hiệu ứng âm thanh vòm giả lập chân thực như thể đang bao trùm lấy bạn.. . . Chất lượng âm thanh được nâng cấp lên gần 7.1.2ch. . Giờ đây, bạn có thể thưởng thức mọi nội dung ở chất lượng tối đa 7.1.2ch. Với Bộ xử lý tín hiệu kỹ thuật số tiên tiến, bạn chỉ cần nhấn một nút trên điều khiển từ xa để chuyển đổi âm thanh ở chất lượng bất kỳ thành âm thanh vòm sống động.. . Lựa chọn cài đặt lý tưởng. . Một nút bấm, mọi âm thanh – hãy chọn chế độ âm thanh phù hợp rồi thưởng thức.. . . Chế độ rạp chiếu phim. . Lắng nghe và cảm nhận mọi hành động khi âm thanh tiến lại gần từ phía sau rồi bao quanh bạn, cho bạn cảm giác thực sự đắm chìm như trong rạp chiếu phim.. . . Thưởng thức phim với chất lượng 4K HDR. . HT-X9000F hỗ trợ mọi định dạng home cinema mới nhất với Đọc và xử lý nhiều định dạng 4K HDR 18 Gb/giây và HDCP 2.2.. . Kết nối với mọi thiết bị. . Chỉ cần một cáp để kết nối hình ảnh và âm thanh cho thiết bị và TV.. . . Kết nối không dây với TV.. . Phát âm thanh không dây qua loa Soundbar.. . . . . . . Kết nối với mọi thiết bị. . Chỉ cần một cáp để kết nối hình ảnh và âm thanh cho thiết bị và TV.. . . . . . . Kết nối một cáp với HDMI ARC. . HDMI ARC cho phép truyền tín hiệu âm thanh và điều khiển từ TV mà chỉ cần một cáp nối.. . . Kết nối để phát nhạc không giới hạn. . Bạn có thể mở những album yêu thích qua kết nối USB hoặc nghe trực tiếp không dây nhờ công nghệ Bluetooth®.. . . Nghe trực tiếp với công nghệ Bluetooth®. . Nghe nhạc trực tiếp không dây với công nghệ Bluetooth®.. . . Kết nối với USB. . Cắm cáp USB để mở album nhạc yêu thích.. . . . . . Tư Vấn Mua Loa Sound Bar. . . . . . ",""""""
