Domain,Url,Product_id,Brand,Category,Model,Price,Seller,Tags,Info,Others
mediamart.vn,https://mediamart.vn/soundbar/lg/loa-sound-bar-lg-sj4r-41-ch.htm,,LG,Loa Soundbar,Loa Sound Bar LG SJ4R 4.1 CH,2.490.000,,," . Kết nối Bluetooth. Âm thanh vòm Rear Surround. Subwoofer không dây. Công nghệ ASC, Cân bằng âm thanh - Auto Sound Engine. . . . . Hình ảnh tham khảo: Loa Sound Bar LG SJ4R 4.1 CH. . . . . . . . . . . . . . . . . . . . . . . . . . . . . . . . . . . . . . . . . . . . . . . . Thông số kỹ thuật: Loa Sound Bar LG SJ4R 4.1 CH. . . . Thông số loa Soundbar. . . Công suất loa. . 420W. . . . . . . . . Thông tin: Loa Sound Bar LG SJ4R 4.1 CH. . . . Công nghệ âm thanh vòm Rear Surround. . LG cung cấp hệ thống loa phía sau 120W, giúp mang đến hiệu ứng âm thanh vòm mà bạn đã mong ước từ lâu. Bên cạnh đó, SJ4R còn tô lên vẻ thẩm mỹ của không gian khi kết nối không dây với đầu thu, không cần bất cứ hệ thống dây dẫn nào.. . . Trải nghiệm như thật với âm thanh độ phân giải cao. . SJ4R có thể phát các định dạng WAV, FLAC và ALAC cũng như các tệp tin lên đến 24 bit và 96KHz. Đây đều là những định dạng có độ phân giải âm thanh rất cao so với đĩa CD.. . . Loa siêu trầm không dây tuyệt hảo. . Thoải mái đặt loa ở những vị trí tốt nhất mà không cần phải lo lắng về hệ thống dây cáp.. . . ASC - công nghệ âm thanh đỉnh cao. . Công nghệ ASC sẽ giúp phân tích các nội dung trong thời gian thực. Ví dụ, khi ASC nhận ra bạn đang nghe một đoạn hội thoại, hệ thống sẽ tự động điều chỉnh để mang lại âm thanh trong trẻo hơn. Hoặc đối với các âm thanh phim hành động, hệ thống sẽ tăng âm trầm để mang lại hiệu ứng tốt hơn.. . . Auto Sound Engine giúp cân bằng âm thanh. . Dù ở bất kỳ mức âm lượng nào, công nghệ Auto Sound Engine của LG sẽ đảm bảo âm thanh luôn cân bằng và tần số luôn ổn định ở mọi thời điểm.. . . Thiết kế tương xứng hoàn hảo với TV. . Không chỉ tôn lên vẻ đẹp của TV, thiết kế đơn giản nhưng cực kỳ tinh tế của SJ4R còn hòa hợp hoàn hảo không gian phòng khách nhà bạn.. . . Chế độ chờ Bluetooth ""đánh thức"" loa khi yêu cầu. . Ở trạng thái bình thường, SJ4R sẽ ở chế độ nghỉ. Tuy nhiên, khi âm thanh được kết nối qua Bluetooth, hệ thống sẽ khởi động tức thì.. . . Auto Music Play - âm thanh theo chân bạn. . Khi Auto Music Play được kích hoạt, âm thanh sẽ theo chân bạn ngay khi bước vào phòng. Đó là nhờ hệ thống có thể tự động phát lại âm thanh từ thiết bị được kết nối khi phát hiện thiết bị đó đang ở gần.. . . Điều khiển linh hoạt. . Loa thanh của LG có đi kèm với bộ điều khiển từ xa nhưng bạn cũng có thể sử dụng *bộ điều khiển từ xa của TV. (*Bộ điều khiển từ xa của các hãng LG, Sony, Philips, Sharp, Panasonic, Vizio, Toshiba và Samsung).. . . Nguồn: lg.com. . . . . . Tư Vấn Mua Loa Sound Bar. . . . . . ",""""""
mediamart.vn,https://mediamart.vn/soundbar/lg/loa-soundbar-21-lg-sj3.htm,,LG,Loa Soundbar,Loa SoundBar 2.1 LG SJ3,1.990.000,,," . Thiết kế hoàn hảo, Loa siêu trầm không dây. Công nghệ âm thanh ASC. Tính năng Auto Sound Engine. Kết nối Bluetooth. . . . . Hình ảnh tham khảo: Loa SoundBar 2.1 LG SJ3. . . . . . . . . . . . . . . . . . . . . . . . . . . . . . . . . . . . . . . . . . . . . . . . Thông số kỹ thuật: Loa SoundBar 2.1 LG SJ3. . . . Thông số loa Soundbar. . . . . . . . Thông tin: Loa SoundBar 2.1 LG SJ3. . . Loa siêu trầm không dây tuyệt hảo. Thoải mái đặt loa ở những vị trí tốt nhất mà không cần phải lo lắng về hệ thống dây cáp. . . ASC - công nghệ âm thanh đỉnh cao. Công nghệ ASC sẽ giúp phân tích các nội dung trong thời gian thực. Ví dụ, khi ASC nhận ra bạn đang nghe một đoạn hội thoại, hệ thống sẽ tự động điều chỉnh để mang lại âm thanh trong trẻo hơn. Hoặc đối với các âm thanh phim hành động, hệ thống sẽ tăng âm trầm để mang lại hiệu ứng tốt hơn.. . . Auto Sound Engine giúp cân bằng âm thanh. Dù ở bất kỳ mức âm lượng nào, công nghệ Auto Sound Engine của LG sẽ đảm bảo âm thanh luôn cân bằng và tần số luôn ổn định ở mọi thời điểm. . . Thiết kế tương xứng hoàn hảo với TV. Không chỉ tôn lên vẻ đẹp của TV, thiết kế đơn giản nhưng cực kỳ tinh tế của SJ3 còn hòa hợp hoàn hảo không gian phòng khách nhà bạn. . . Chế độ chờ Bluetooth ""đánh thức"" loa khi yêu cầu. Ở trạng thái bình thường, SJ3 sẽ ở chế độ nghỉ. Tuy nhiên, khi âm thanh được kết nối qua Bluetooth, hệ thống sẽ khởi động tức thì.. . . Đồng bộ âm thanh với TV mà không cần dây kết nối. Thoải mái kết nối loa thanh SJ3 với các TV có tương thích với Bluetooth mà không cần bất cứ hệ thống dây dẫn phức tạp nào. (*Điều khiển từ xa của hãng LG, Sony, Philips, Sharp, Panasonic, Vizio, Tosh.. . . . . . . Tư Vấn Mua Loa Sound Bar. . . . . . ",""""""
mediamart.vn,https://mediamart.vn/soundbar/sony/loa-soundbar-sony-htct290bm.htm,,Sony,Loa Soundbar,Loa Soundbar Sony HT-CT290/BM 2.1CH,3.493.000,,," . Thiết kế mỏng tinh tế. Công nghệ S-Force Pro Front Surround tái tạo không gian âm thanh vòm rộng hơn với chỉ 2.1 kênh. Công nghệ ClearAudio+ mang lại âm thanh giàu nhạc tính đáng kinh ngạc. . . . . Hình ảnh tham khảo: Loa Soundbar Sony HT-CT290/BM 2.1CH. . . . . . . . . . . . . . . . . . . . . . . . . . . . . . . . . Thông số kỹ thuật: Loa Soundbar Sony HT-CT290/BM 2.1CH. . . . Thông số loa Soundbar. . . Công suất loa. . 300W. . . . . . . . . Thông tin: Loa Soundbar Sony HT-CT290/BM 2.1CH. . . Thiết lập rạp chiếu phim của riêng bạn. . Trở thành trung tâm thế giới giải trí của chính bạn với hệ thống âm thanh 2.1 kênh này. Với tổng công suất 300 W mạnh mẽ, một loa soundbar thanh mảnh và loa subwoofer linh hoạt có thể xếp đặt theo 2 cách, bạn sẽ được trải nghiệm âm thanh như tại rạp chiếu phim tràn ngập xung quanh mình.. . . . Tổng công suất đầu ra 300W. . Thổi hồn vào từng bài hát, chương trình và các bộ phim với âm lượng và độ rõ nét tương xứng nhờ công suất đầu ra định mức 300W.. . . Âm thanh vòm 2.1 kênh phía trước. . Các màng loa ở mỗi đầu của loa soundbar tạo nên những âm thanh tầm trung và cao rõ nét, trong khi đó, loa subwoofer không dây sẽ lấp đầy không gian với những âm trầm thổn thức.. . Đắm chìm trong âm thanh. . S-Force PRO Front Surround. . Công nghệ âm thanh vòm giả lập của chúng tôi sẽ mang đến cho bạn cảm giác như được sống cùng các bộ phim yêu thích bằng cách mô phỏng âm thanh vòm theo phong cách rạp chiếu phim.. . . Xem phim, nghe nhạc thuận tiện hơn. . Dễ dàng kết nối. . Thưởng thức kết nối âm thanh chất lượng cao và ổn định, cho phép bạn xem và nghe mọi nội dung với một loạt kết nối có dây và công nghệ không dây Bluetooth®.. . . . HDMI ARC. . HDMI ARC (Kênh trao đổi âm thanh) cho phép bạn kết nối với TV chỉ bằng một cáp.. . . Cổng USB. . Sạc pin và truy cập các tệp nhạc từ nhiều thiết bị qua cổng USB.. . . Ngõ vào quang học. . Thưởng thức âm thanh chất lượng cao khi xem phim và nhiều nội dung khác khi kết nối qua ngõ vào quang học, dành cho các TV không tương thích với HDMI ARC.. . . Phát trực tiếp không dây qua Bluetooth. . Phát trực tiếp tất cả những bản nhạc yêu thích từ điện thoại thông minh của bạn qua mạng không dây với công nghệ Bluetooth®.. . Thiết lập phù hợp với bạn. . Khung viền mảnh giúp loa trông thật hài hòa với thiết lập Home Cinema của bạn, rất lý tưởng để treo tường hay đặt trên kệ TV.. . . Dễ dàng treo tường. . Khi treo trên tường, các đường viền ấn tượng của loa soundbar làm nổi bật thiết kế của TV.. . . Thiết kế gọn nhẹ. . Thiết kế thanh mảnh sẽ không làm ảnh hưởng hay che khuất tầm nhìn, vì vậy bạn sẽ luôn xem được những hình ảnh trọn vẹn.. . . Thiết kế dễ xếp gọn. . Tận hưởng hiệu ứng tối đa của từng âm trầm với loa subwoofer không dây. Được thiết kế với 2 cách xếp đặt thuận tiện, thậm chí bạn có thể đặt loa trong tủ kê TV hoặc trên giá để tích hợp hoàn hảo vào hệ thống rạp hát tại nhà.. . . Dựng đứng hoặc đặt nằm ngang. . Giờ đây, bạn có thể dựng đứng hoặc đặt ngang loa subwoofer không dây để tận dụng tối đa không gian phòng khách.. . Thông số. . . Thiết kế mỏng tinh tế. . Công nghệ S-Force Pro Front Surround tái tạo không gian âm thanh vòm rộng hơn với chỉ 2.1 kênh. . Công nghệ ClearAudio+ mang lại âm thanh giàu nhạc tính đáng kinh ngạc. . Công suất 300W mạnh mẽ. . Kết nối không dây với Bluetooth cùng điện thoại. . Loa sub kết nối không dây tiện lợi. . Thưởng thức âm nhạc dễ dàng qua USB. . Kích thước/ trọng lượng: 97 x 47 x 22 cm/ 11kg (bao gồm thùng). . . . . . . Tư Vấn Mua Loa Sound Bar. . . . . . ",""""""
mediamart.vn,https://mediamart.vn/soundbar/sony/loa-sound-bar-sony-htst5000.htm,,Sony,Loa Soundbar,Loa Sound Bar Sony HT-ST5000 Dolby Atmos 7.1.2,25.830.000,,," . Công nghệ S-Force Pro Front Surround 7.1.2 kênh tái tạo trường âm thanh 3D một cách tự nhiên. Công nghệ âm thanh vòm Dolby Atmos đỉnh cao . Công suất 800W mạnh mẽ vượt trội. Tương thích 4K HDR, phát âm thanh Hi-res đúng chuẩn. 3 cổng HDMI hỗ trợ kết nối 4K HDR. . . . . Hình ảnh tham khảo: Loa Sound Bar Sony HT-ST5000 Dolby Atmos 7.1.2. . . . . . . . . . . . . . . . . . . . . . . . . . . Thông số kỹ thuật: Loa Sound Bar Sony HT-ST5000 Dolby Atmos 7.1.2. . . . Thông số loa Soundbar. . . Công suất loa. . 300W. . . . . . . . . Thông tin: Loa Sound Bar Sony HT-ST5000 Dolby Atmos 7.1.2. . . . . Công nghệ S-Force Pro Front Surround 7.1.2 kênh tái tạo trường âm thanh 3D một cách tự nhiên. . . . Công nghệ âm thanh vòm Dolby Atmos đỉnh cao. . . . Công suất 800W mạnh mẽ vượt trội. . . . Tương thích 4K HDR, phát âm thanh Hi-res đúng chuẩn. . . . 3 cổng HDMI hỗ trợ kết nối 4K HDR. . . . Công nghệ loa Chất Lỏng Từ đồng trục và Củ loa Subwoofer Sigma 180mm không dây, truyền tải âm thanh cân bằng giữa các dãy và âm Bass chắc chắn, rõ ràng. . . . . . . . . . HT-ST5000, đạt được đánh giá 5 sao từ What Hi-Fi?. . 'Sản phẩm này của Sony thực sự tuyệt đỉnh với đầy đủ các tính năng và là Soundbar duy nhất hiện nay có trang bị công nghệ Dolby Atmos, thật xứng đáng để chúng tôi đề cử' (tháng 5 năm 2017). . . Sống động như biểu diễn trực tiếp. . Thưởng thức những sắc thái âm thanh tinh tế nhất chất lượng hơn cả CD với Âm thanh độ phân giải cao. Niềm đam mê âm nhạc quy tụ trong từng chi tiết từ tín hiệu đến loa mang đến cảm giác như nghệ sĩ đang biểu diễn trước mặt bạn.. . . . . . Khám phá trải nghiệm âm thanh đắm chìm trọn vẹn. . Công nghệ S-Force PRO Front Surround 7.1.2 kênh. . Hệ thống âm thanh vòm giả lập kết hợp Xử lý tín hiệu kỹ thuật số với S-Force PRO Front Surround cùng công nghệ mặt sóng để mô phỏng trường âm thanh ba chiều tự nhiên chỉ từ một loa soundbar và loa subwoofer.. . . . . . . . . . . . . Vật liệu chất lượng, thiết kế tối ưu. . Được thiết kế và chế tạo với các thành phần chất lượng cao để mang đến âm thanh đắm chìm tuyệt đỉnh.. . . . . . . . . . . . . . . . . . . . Loa đồng trục. . Loa woofer và loa tweeter phối hợp hoạt động bên trong một bộ loa duy nhất để mang đến âm thanh được căn chỉnh chuẩn xác trên mọi tần số.. . . . . . . . . . . . . . . . . . . . Chất lượng âm thanh và hình ảnh tối ưu. . Xem và nghe chính xác đến từng chi tiết với khả năng phát Âm thanh độ phân giải cao và hình ảnh HDR, mang đến hiệu suất mạnh mẽ cho phim và nhạc.. . . . . . . . . . . Xem hình ảnh rõ ràng với HDR. . HDR cho phép mang đến hình ảnh có độ chi tiết, màu sắc và độ tương phản vượt trội, với phạm vi độ sáng rộng hơn nhiều so với các định dạng video khác.. . . . . . Luôn luôn kết nối. . Tiếp tục bổ sung cho thiết lập Home Cinema của bạn với 3 ngõ vào HDMI tương thích HDCP 2.2, 1 ngõ ra HDMI ARC, SPDIF quang học, AUX analog và một kết nối USB.. . . . . . . . . . 3 cổng HDMI. . Dễ dàng kết nối với thiết bị hiện tại của bạn bằng 3 ngõ vào HDMI và 1 ngõ ra HDMI ARC.. . . . . . . Cổng USB. . Chỉ cần kết nối thiết bị USB của bạn để thưởng thức Âm thanh độ phân giải cao.. . . . . . Thưởng thức âm nhạc của bạn. . Tận hưởng khả năng phát nhạc tức thì và dễ dàng với NFC và công nghệ không dây Bluetooth®.. . . . . . . Phát trực tiếp âm thanh không dây chất lượng cao. . LDAC là công nghệ âm thanh của Sony cho phép bạn thưởng thức âm thanh không dây chất lượng cao qua Bluetooth®. Với tốc độ truyền dữ liệu nhanh gấp ba lần, LDAC sẽ mang đến cho bạn trải nghiệm nghe nhạc không dây cao cấp.. . . . . . . . . . . . . . . . . . . . . . . . . . Tư Vấn Mua Loa Sound Bar. . . . . . ",""""""
mediamart.vn,https://mediamart.vn/soundbar/sony/loa-soundbar-sony-htct290wm.htm,,Sony,Loa Soundbar,Loa Soundbar Sony HT-CT290/WM 2.1CH,3.913.000,,," . Thiết kế mỏng tinh tế. Công nghệ S-Force Pro Front Surround tái tạo không gian âm thanh vòm rộng hơn với chỉ 2.1 kênh. Công nghệ ClearAudio+ mang lại âm thanh giàu nhạc tính đáng kinh ngạc. . . . . Hình ảnh tham khảo: Loa Soundbar Sony HT-CT290/WM 2.1CH. . . . . . . . . . . . . . . . . . . . . . . . Thông số kỹ thuật: Loa Soundbar Sony HT-CT290/WM 2.1CH. . . . Thông số loa Soundbar. . . Công suất loa. . 300W. . . . . . . . . Thông tin: Loa Soundbar Sony HT-CT290/WM 2.1CH. . . Thiết lập rạp chiếu phim của riêng bạn. . Trở thành trung tâm thế giới giải trí của chính bạn với hệ thống âm thanh 2.1 kênh này. Với tổng công suất 300 W mạnh mẽ, một loa soundbar thanh mảnh và loa subwoofer linh hoạt có thể xếp đặt theo 2 cách, bạn sẽ được trải nghiệm âm thanh như tại rạp chiếu phim tràn ngập xung quanh mình.. . . . Tổng công suất đầu ra 300W. . Thổi hồn vào từng bài hát, chương trình và các bộ phim với âm lượng và độ rõ nét tương xứng nhờ công suất đầu ra định mức 300W.. . . Âm thanh vòm 2.1 kênh phía trước. . Các màng loa ở mỗi đầu của loa soundbar tạo nên những âm thanh tầm trung và cao rõ nét, trong khi đó, loa subwoofer không dây sẽ lấp đầy không gian với những âm trầm thổn thức.. . Đắm chìm trong âm thanh. . S-Force PRO Front Surround. . Công nghệ âm thanh vòm giả lập của chúng tôi sẽ mang đến cho bạn cảm giác như được sống cùng các bộ phim yêu thích bằng cách mô phỏng âm thanh vòm theo phong cách rạp chiếu phim.. . . Xem phim, nghe nhạc thuận tiện hơn. . Dễ dàng kết nối. . Thưởng thức kết nối âm thanh chất lượng cao và ổn định, cho phép bạn xem và nghe mọi nội dung với một loạt kết nối có dây và công nghệ không dây Bluetooth®.. . . . HDMI ARC. . HDMI ARC (Kênh trao đổi âm thanh) cho phép bạn kết nối với TV chỉ bằng một cáp.. . . Cổng USB. . Sạc pin và truy cập các tệp nhạc từ nhiều thiết bị qua cổng USB.. . . Ngõ vào quang học. . Thưởng thức âm thanh chất lượng cao khi xem phim và nhiều nội dung khác khi kết nối qua ngõ vào quang học, dành cho các TV không tương thích với HDMI ARC.. . . Phát trực tiếp không dây qua Bluetooth. . Phát trực tiếp tất cả những bản nhạc yêu thích từ điện thoại thông minh của bạn qua mạng không dây với công nghệ Bluetooth®.. . Thiết lập phù hợp với bạn. . Khung viền mảnh giúp loa trông thật hài hòa với thiết lập Home Cinema của bạn, rất lý tưởng để treo tường hay đặt trên kệ TV.. . . Dễ dàng treo tường. . Khi treo trên tường, các đường viền ấn tượng của loa soundbar làm nổi bật thiết kế của TV.. . . Thiết kế gọn nhẹ. . Thiết kế thanh mảnh sẽ không làm ảnh hưởng hay che khuất tầm nhìn, vì vậy bạn sẽ luôn xem được những hình ảnh trọn vẹn.. . . Thiết kế dễ xếp gọn. . Tận hưởng hiệu ứng tối đa của từng âm trầm với loa subwoofer không dây. Được thiết kế với 2 cách xếp đặt thuận tiện, thậm chí bạn có thể đặt loa trong tủ kê TV hoặc trên giá để tích hợp hoàn hảo vào hệ thống rạp hát tại nhà.. . . Dựng đứng hoặc đặt nằm ngang. . Giờ đây, bạn có thể dựng đứng hoặc đặt ngang loa subwoofer không dây để tận dụng tối đa không gian phòng khách.. . Thông số. . . Thiết kế mỏng tinh tế. . Công nghệ S-Force Pro Front Surround tái tạo không gian âm thanh vòm rộng hơn với chỉ 2.1 kênh. . Công nghệ ClearAudio+ mang lại âm thanh giàu nhạc tính đáng kinh ngạc. . Công suất 300W mạnh mẽ. . Kết nối không dây với Bluetooth cùng điện thoại. . Loa sub kết nối không dây tiện lợi. . Thưởng thức âm nhạc dễ dàng qua USB. . Kích thước/ trọng lượng: 97 x 47 x 22 cm/ 11kg (bao gồm thùng). . . . . . . Tư Vấn Mua Loa Sound Bar. . . . . . ",""""""
mediamart.vn,https://mediamart.vn/soundbar/sony/loa-soundbar-sony-ht-ct80-21-ch.htm,,Sony,Loa Soundbar,Loa Soundbar Sony HT-CT80 2.1 CH,1.990.000,,," . - Số kênh 2.1 kênh. . - Công suất 80W (RMS) với thiết kế đồng bộ với TV. . - Tích hợp USB playback (MP3, WMA, AAC). . - Kết nối với TV qua cổng optical. . - Loa subwoofer có dây. . - Kết nối không dây “Một-chạm” với NFC + Bluetooth. . - Công nghệ amply kỹ thuật số S-Master Digital Amplifier. . - Điều khiển thiết bị từ điện thoại Android với ứng dụng miễn phí Song Pal. . . . . Hình ảnh tham khảo: Loa Soundbar Sony HT-CT80 2.1 CH. . . . . . . . . . . . . . . Thông số kỹ thuật: Loa Soundbar Sony HT-CT80 2.1 CH. . . . Thông số loa Soundbar. . . Công suất loa. . 80W. . . . . . . . . Thông tin: Loa Soundbar Sony HT-CT80 2.1 CH. . . Loa Sound bar Sony HT-CT80 - Mang lại trải nghiệm rạp chiếu phim thật dễ dàng. . . Hãy ngồi ngay hàng ghế đầu để thưởng thức loa dạng thanh HT-CT80. Trải nghiệm âm thanh rõ ràng và sống động khi xem phim hoặc nghe nhạc với loa subwoofer không dây và âm thanh vòm ảo 2.1ch. Loa có kiểu dáng phù hợp với TV của bạn và rất dễ thiết lập để bạn có thể trải nghiệm những bộ phim điện ảnh, những bản nhạc hay những buổi hòa nhạc thú vị ngay trong căn phòng của mình.. . . Âm thanh vòm. . Loa dạng thanh 2.1ch mang đến cảm nhận trung thực hơn khi xem phim với âm thanh rạp hát 80W.. . . Kết nối không dây. . Phát trực tiếp nhạc không dây từ một số điện thoại thông minh hoặc máy tính bảng sử dụng trải nghiệm nghe một chạm NFC qua Bluetooth.. . Trải nghiệm xem phim sinh động thú vị. . . Âm thanh vòm giả lập. . Một thanh loa nhỏ gọn kết hợp với một loa subwoofer tạo ra âm thanh vòm ảo tràn ngập khắp phòng, mang những phút giây giải trí vào cuộc sống của bạn.. . Âm thanh trung thực. . Bằng cách khôi phục và tối ưu hóa các tín hiệu âm thanh, bộ khuếch đại kỹ thuật số S-Master làm phong phú và tăng cường âm thanh cho các cuộc đối thoại, âm nhạc, và âm thanh từ môi trường xung quanh từ bất kỳ nguồn nào.. . . Được thiết kế phù hợp với TV của bạn. . Tối ưu âm thanh phát lại. . Kết hợp công nghệ âm thanh Sony, ClearAudio+ tối ưu hóa âm thanh, do đó bạn có thể nghe nhạc, hội thoại và các hiệu ứng âm thanh rõ ràng hơn và chuyên biệt hơn.. . . Nằm dưới màn hình, không phải phía trước. . Thiết kế thanh mảnh gọn gàng, cho bạn dễ dàng kết hợp đặt thật tinh tế phía dưới bất kỳ màn hình TV nào từ 32"" (81,3cm) trở lên, dàn loa sẽ cho bạn thưởng thức trọn vẹn màn hình cùng âm thanh ấn tượng. Với nhiều tùy chọn lắp đặt và thiết kế phong cách, HT-CT80 luôn hiện diện tinh tế trong nhà bạn dù được treo hay đặt lên kệ.. . Âm thanh của bạn. Phong cách của bạn.. . . Đặt ngay phía dưới màn hình của bạn. . Hãy đặt loa dạng thanh trên kệ phía dưới TV, và hãy thưởng thức âm thanh được phát ra từ độ cao lý tưởng khi bạn ngồi xem từ chiếc ghế sofa.. . . Gắn trên tường. . Âm thanh được hướng thẳng về phía bạn từ hai loa ở mặt trước, mang lại trải nghiệm sống động như đang xem tại rạp hát.. . . Thoải mái sử dụng thiết bị không dây. . Dù ở chính diện hoặc hai bên, loa subwoofer không dây với âm thanh hướng thẳng ra phía trước tạo ra tiếng bass phong phú, vang dội và có thể đặt ở bất cứ đâu.. . . Phát trực tiếp liên tục. . Chỉ cần chạm vào loa dạng thanh trên điện thoại thông minh hoặc máy tính bảng NFC để kết nối Bluetooth nhanh. Không có NFC? Không vấn đề gì – bạn chỉ cần phát trực tiếp nhạc không dây bằng cách kết nối thủ công với Bluetooth.. . Nguồn: sony.com.vn. . . . . . Tư Vấn Mua Loa Sound Bar. . . . . . ",""""""
