Domain,Url,Product_id,Brand,Category,Model,Price,Seller,Tags,Info,Others
mediamart.vn,https://mediamart.vn/soundbar/sony/he-thong-home-cinema-51-kenh-voi-loa-soundbar-va-cong-nghe-bluetooth%C2%AE-hts500rf.htm,,Sony,Loa Soundbar,Dàn âm thanh Sony HT-S500RF,6.293.000,,," . - Âm thanh vòm chân thực 5.1 kênh sẽ tràn ngập khắp căn phòng của bạn. - Các loa sau nối dây và một loa subwoofer bên ngoài. - Dễ dàng kết nối với HDMI ARC. - Phát lại âm thanh USB. - Kết nối Bluetooth®. . . . . Hình ảnh tham khảo: Dàn âm thanh Sony HT-S500RF. . . . . . . . . . . . . . . . . . Thông số kỹ thuật: Dàn âm thanh Sony HT-S500RF. . . . Thông số loa Soundbar. . . . . . . . Thông tin: Dàn âm thanh Sony HT-S500RF. . . Âm thanh sống động như tại rạp chiếu phim. Trải nghiệm âm thanh như tại rạp chiếu phim ngay ở nhà nhờ hệ thống âm thanh 5.1 kênh với các loa sau nhỏ gọn có tổng công suất đầu ra 1000 W. Hãy đắm chìm trong khoảnh khắc lay động của âm thanh vòm chân thực.. . . Âm thanh vòm 5.1 kênh chân thực. Hãy chọn chỗ ngồi tốt nhất trong nhà. Một loa Soundbar, loa subwoofer và hai loa sau mạnh mẽ mang lại trải nghiệm như trong rạp chiếu phim thực sự.. . Khả năng kết nối BLUETOOTH®. Phát nhạc từ điện thoại thông minh qua kết nối Bluetooth®.. Năm loa đơn và một loa subwoofer cho âm thanh ngập tràn. Cảm nhận âm thanh mạnh mẽ khi xem phim với loa sau đặt trên giá hoặc gắn trên tường một cách kín đáo, cộng với một loa Soundbar 3 kênh và loa subwoofer.. . Hỗ trợ định dạng DTS. Định dạng DTS tạo ra âm thanh vòm động, thổi hồn cho phim và âm nhạc.. . Dolby® Digital. Tận hưởng âm thanh vòm 5.1 kênh chất lượng cao với Dolby® Digital.. . Phát nhạc trực tiếp từ điện thoại thông minh. Phát bài hát từ điện thoại thông minh qua kết nối Bluetooth® và thưởng thức những giai điệu bạn yêu thích mà không cần dây nối.. . Dễ dàng duyệt và điều khiển với ứng dụng Sony | Music Center. Với ứng dụng Sony | Music Center, bạn có thể điều khiển nhạc được phát không dây và phát qua USB.. . . Thiết lập dễ dàng, có thể sử dụng ngay lập tức. Hãy sẵn sàng, điều tuyệt vời sẽ đến ngay lập tức. Chỉ cần cắm vào và thưởng thức 5.1 kênh âm thanh vòm đích thực. Toàn bộ dây cáp đều nối vào loa subwoofer nên hệ thống sẽ rất gọn gàng và đẹp mắt.. . HDMI ARC. HDMI ARC (Kênh trao đổi âm thanh) cho phép bạn kết nối với các loại TV tương thích chỉ bằng một cáp.. . Ngõ vào quang học. Kết nối với đầu vào quang học và thưởng thức âm thanh chất lượng cao khi xem phim và nhiều nội dung khác.. . Cổng USB. Kết nối với nhạc trên ổ USB, điều khiển phát lại trên màn hình hoặc bằng ứng dụng Sony | Music Center trên điện thoại.. . . THÔNG SỐ KỸ THUẬT & CÁC TÍNH NĂNG. Nhạc phim còn trở nên chân thực hơn với 5.1 kênh âm thanh vòm. Với các loa sau nối dây và một loa subwoofer bên ngoài, loa Soundbar 3 kênh này mang đến âm thanh sâu lắng tràn ngập phòng để bạn xem phim, nhạc và nhiều nội dung khác.. Âm thanh vòm chân thực 5.1 kênh sẽ tràn ngập khắp căn phòng của bạn. Các loa sau nối dây và một loa subwoofer bên ngoài. Dễ dàng kết nối với HDMI ARC. Phát lại âm thanh USB. Kết nối Bluetooth®. . . . . . Tư Vấn Mua Loa Sound Bar. . . . . . ",""""""
mediamart.vn,https://mediamart.vn/soundbar/lg/soundbar-lg-41-sk5r.htm,,LG,Loa Soundbar,SoundBar LG 4.1 SK5R,2.900.000,,," . DTS Virtual:X. Âm thanh có độ phân giải cao. Bộ loa vệ tinh không dây. . . . . Hình ảnh tham khảo: SoundBar LG 4.1 SK5R. . . . . . . . . . . . . . . . . . . . . . . . . . . . . . . . . . . . . . . . . . Thông số kỹ thuật: SoundBar LG 4.1 SK5R. . . . Thông số loa Soundbar. . . Công suất loa. . 480W. . . . . . . . . Thông tin: SoundBar LG 4.1 SK5R. . . DTS Virtual: X. . Hứa hẹn mang lại hiệu ứng âm thanh vòm đa chiều. Trải nghiệm âm thanh rạp chiếu phim sống động bất cứ lúc nào. Với DTS Virtual: X, sản phẩm Loa thanh LG SK5R luôn mang đến âm thanh đa chiều trong ngôi nhà bạn với mọi loại nội dung. Bạn có thể thưởng thức âm thanh rộng hơn, cao hơn, đắm chìm hơn ngay cả với chương trình TV hay trò chơi thể thao yêu thích của bạn.. . . Âm thanh có độ phân giải cao. Âm nhạc số đã đạt đến chất lượng tuyệt đỉnh, góp phần mang đến một trải nghiệm nghe nhạc chân thực hơn, hấp dẫn hơn. Loa thanh LG có chứng nhận Hi-Res có thể phát âm thanh stereo dạng lossess với chất lượng lên đến 96kHz/24-bit.. . . Loa vòm không dây. Hệ thống loa thanh LG SK5R với bộ loa vòm không dây, mang đến sự đơn giản và thuận tiện, trải nghiệm âm thanh rạp chiếu phim cao cấp.. *Bắt buộc phải có dây loa để nối đầu thu với hai loa sau.. . . Điều khiển âm thanh tương thích. Phim hành động, phim truyện, thể thao, âm nhạc và thậm chí là tin tức ban đêm tất cả đều có cấu hình âm thanh khác nhau, vì vậy bạn không nên nghe tất cả theo cùng một cách: Điều khiển âm thanh tương thích sẽ xác định nội dung đang phát và tự động điều chỉnh chế độ âm thanh để tạo ra trải nghiệm âm thanh lý tưởng.. . . Điều khiển bằng điều khiển từ xa của TV. Loa thanh LG đi kèm điều khiển từ xa của loa, nhưng bạn cũng có thể điều khiển loa bằng điều khiển từ xa TV của chính bạn*.. * Bộ điều khiển từ xa TV của LG, Sony, Philips, Sharp, Panasonic, Vizio, Toshiba và Samsung có thể điều khiển loa LG Sound Bar.. . . Thiết kế hài hòa. Thiết kế hiện đại tuyệt đẹp hòa nhập hoàn hảo trong mọi thiết kế nội thất.. . . . . . Tư Vấn Mua Loa Sound Bar. . . . . . ",""""""
mediamart.vn,https://mediamart.vn/soundbar/sony/he-thong-home-cinema-51-kenh-voi-loa-soundbar-va-cong-nghe-bluetooth%C2%AE-hts700rf.htm,,Sony,Loa Soundbar,Dàn âm thanh Sony HT-S700RF,8.393.000,,," . - Tổng công suất đầu ra 1000 W . - Âm thanh vòm chân thực 5.1 kênh . - Loa cao cho âm thanh ở mức ngang tai. - Dễ dàng kết nối với HDMI ARC. - Phát lại âm thanh USB. . . . . Hình ảnh tham khảo: Dàn âm thanh Sony HT-S700RF. . . . . . . . . . . . . . . . . . . . . . . . . . . . . . . . . . . . . . . Thông số kỹ thuật: Dàn âm thanh Sony HT-S700RF. . . . Thông số loa Soundbar. . . . . . . . Thông tin: Dàn âm thanh Sony HT-S700RF. . . Tận hưởng âm thanh của rạp chiếu phim ngay trong phòng khách. . Thưởng thức âm thanh như thể bạn đang xem phim ngoài rạp. Hệ thống âm thanh 5.1 kênh kín đáo với loa đứng phía sau và tổng công suất đầu ra 1000 W cho bạn chìm đắm trong sự kỳ diệu của âm thanh vòm đích thực.. . . Tổng công suất đầu ra 1000 W. Thưởng thức âm thanh sâu lắng và chi tiết hơn khi xem phim, nghe nhạc và chơi game với tổng công suất đầu ra 1000 W.. . Âm thanh vòm 5.1 kênh chân thực. Hãy chọn chỗ ngồi tốt nhất trong nhà. Một loa Soundbar, loa subwoofer và hai loa sau mạnh mẽ mang lại trải nghiệm như trong rạp chiếu phim thực sự.. . Khả năng kết nối BLUETOOTH®. Phát nhạc từ điện thoại thông minh qua kết nối Bluetooth. . Đắm mình trong âm thanh như ở rạp chiếu phim. Thông qua loa Soundbar 3 kênh, loa subwoofer và các loa đứng phía sau mạnh mẽ, bạn có thể khiến phòng của mình ngập tràn những âm thanh ấn tượng như trong phim.. . . Hỗ trợ định dạng DTS. Định dạng DTS tạo ra âm thanh vòm động, thổi hồn cho phim và âm nhạc.. . Dolby® Digital. Tận hưởng âm thanh vòm 5.1 kênh chất lượng cao với Dolby® Digital.. Các loa đứng mang đến âm thanh vòm thực sự. Với chiều cao 120 cm và màng loa toàn dải 65 mm, các loa đứng phía sau của chúng tôi được bố trí hoàn hảo để mang lại hiệu ứng âm thanh mạnh mẽ như trong rạp chiếu phim.. . Phát nhạc trực tiếp từ điện thoại thông minh. Phát bài hát từ điện thoại di động của bạn qua kết nối Bluetooth® và tận hưởng các bài hát yêu thích mà không cần dây nối.. . Dễ dàng duyệt và điều khiển với ứng dụng Sony | Music Center. Với ứng dụng Sony | Music Center, bạn có thể điều khiển nhạc được phát không dây và phát qua USB.. . . Thiết lập dễ dàng, có thể sử dụng ngay lập tức. Hãy sẵn sàng, điều tuyệt vời sẽ đến ngay lập tức. Chỉ cần cắm vào và thưởng thức 5.1 kênh âm thanh vòm đích thực. Toàn bộ dây cáp đều nối vào loa subwoofer nên hệ thống sẽ rất gọn gàng và đẹp mắt.. . . HDMI ARC. HDMI ARC (Kênh trao đổi âm thanh) cho phép bạn kết nối với các loại TV tương thích chỉ bằng một cáp.. . Ngõ vào quang học. Kết nối với đầu vào quang học và thưởng thức âm thanh chất lượng cao khi xem phim và nhiều nội dung khác.. . Cổng USB. Kết nối với nhạc trên ổ USB, điều khiển phát lại trên màn hình hoặc bằng ứng dụng Sony | Music Center trên điện thoại.1. . THÔNG SỐ KỸ THUẬT & CÁC TÍNH NĂNG. Mang âm thanh trung thực như ở rạp chiếu phim về phòng khách nhà bạn.. . Tổng công suất đầu ra 1000 W cho âm thanh mạnh mẽ bao trùm lấy bạn nhờ loa cao phía sau và loa subwoofer cỡ lớn tạo âm trầm sâu lắng.. Âm thanh vòm chân thực 5.1 kênh sẽ tràn ngập khắp căn phòng của bạn. Loa cao cho âm thanh ở mức ngang tai. Dễ dàng kết nối với HDMI ARC. Phát lại âm thanh USB. . . . . . . . Tư Vấn Mua Loa Sound Bar. . . . . . ",""""""
mediamart.vn,https://mediamart.vn/soundbar/samsung/loa-sound-bar-samsung-hwm360.htm,,Samsung,Loa Soundbar,Loa Sound Bar Samsung HW-M360,4.290.000,,," . Âm thanh đa chiều sống động. Kết nối Bluetooth không dây với nhiều thiết bị. Quản lý âm thanh từ xa qua một ứng dụng. . . . . Hình ảnh tham khảo: Loa Sound Bar Samsung HW-M360. . . . . . . . . . . . . . . . . . . . . . . . . . . . . . . . . . . . . . . . . . . . . Thông số kỹ thuật: Loa Sound Bar Samsung HW-M360. . . . Thông số loa Soundbar. . . Công suất loa. . 200W. . . . . . . . . Thông tin: Loa Sound Bar Samsung HW-M360. . . Âm Thanh Không Dây Đa Chiều. . Wireless Rear Kit* nâng tầm chất lượng Soundbar lên thành hệ thống âm thanh vòm đỉnh cao mà không cần dây nối**. Bạn có thể tạo ra hệ thống kênh với trải nghiệm âm thanh sắc nét hoàn hảo.. . . * Samsung Wireless Rear Speaker Kit có thể được mua rời (Mã sản phẩm: SWA-8500S). ** ** Wireless Surround yêu cầu có cáp nguồn. Bộ loa sau có thể kết nối với thiết bị thông qua dây cáp.. . Âm Trầm Mạnh Mẽ. . Với thiết kế không dây tiện lợi, bạn có thể dễ dàng lắp đặt loa âm trầm (subwoofer) để đắm mình thưởng thức những sắc trầm mạnh mẽ sống động như thật.. . . Âm Thanh Đa Chiều Lan Tỏa. . Tính năng Surround Sound Expansion độc đáo lan tỏa âm thanh chất lượng cao, trải rộng đến nhiều hướng và đồng đều ở khắp nơi. Hiệu ứng âm thanh vòm mạnh mẽ cuốn bạn vào không gian giải trí đa sắc màu.. . . Điều Khiển Thông Minh - Một Cho Tất Cả. . Bạn không cần nhiều Remote để điều khiển các thiết bị. Từ việc bật tắt, điều chỉnh âm lượng, thậm chí hiệu ứng âm thanh và nhiều tính năng chính của Loa Soundbar có thể được điều chỉnh với Điều khiển TV Samsung thông qua giao diện TV.. . . Kết Nối Không Dây với TV. . Kết nối Soundbar với TV Samsung* hoàn toàn dễ dàng không cần dây cắm cồng kềnh thông qua Bluetooth. Bạn có thể thưởng thức tất cả nội dung giải trí hấp dẫn với chất lượng âm thanh sắc nét, tuyệt vời nhất.. . . * Tương thích với một số dòng TV Samsung. Liên hệ các cửa hàng để biết thêm chi tiết.. . Khuấy Động Âm Nhạc với Bluetooth. . Soundbar sử dụng kết nối Bluetooth không dây đến các thiết bị khác, cho bạn thưởng thức âm nhạc từ điện thoại, máy tính với chất lượng hoàn hảo ở bất cứ nơi đâu, không cần dây nối.. . . Ứng Dụng Quản Lý Âm Thanh Samsung Từ Xa. . Điều khiển Soundbar dễ dàng trên điện thoại di động và máy tính bảng chạy hệ điều hành Android™ với Ứng dụng quản lý âm thanh Samsung từ xa. Chỉ cần kết nối sử dụng Bluetooth™ để điều khiển tất cả các tính năng chính của Soundbar và tận hưởng những bài hát yêu thích trên thiết bị di động thông qua một ứng dụng duy nhất.. . *Android được đăng ký bản quyền của Google Inc. Bluetooth được đăng ký bản quyền của Bluetooth SIG Inc.. . . Nguồn: samsung.com. . . . . . Tư Vấn Mua Loa Sound Bar. . . . . . ",""""""
mediamart.vn,https://mediamart.vn/soundbar/samsung/loa-sound-bar-samsung-hwk450-21-ch.htm,,Samsung,Loa Soundbar,Loa Sound Bar Samsung HW-K450 2.1 CH,2.990.000,,," . - Loa soundbar Samsung HW-K450 2.1 CH. - Thiết kế dạng thanh dài. - Công suất: 300W. - Hệ thống kênh: 2.1 kênh. - Âm thanh: Dolby Digital, DTS Digital Surround.. - Loa Subwoofer Bass Reflex. - Định dạng giải mã: AAC, MP3, WAV, WMA, OGG, FLAC. - Kết nối : Bluetooth, USB, HDMI, TV SoundConnect, Auto Power Link... - Sản xuất: 2016. . . . . Hình ảnh tham khảo: Loa Sound Bar Samsung HW-K450 2.1 CH. . . . . . . . . . . . . . . . . . . . . . . . . . . . . . . . . . . . Thông số kỹ thuật: Loa Sound Bar Samsung HW-K450 2.1 CH. . . . Thông số loa Soundbar. . . Công suất loa. . 300W. . . . . . . . . Thông tin: Loa Sound Bar Samsung HW-K450 2.1 CH. . . Thưởng Thức Âm Thanh Vòm Không Dây. . Bộ Loa sau giúp bạn dễ dàng khám phá thế giới âm thanh vòm đỉnh cao với kết nối không dây tiện lợi. Kết hợp cùng Soundbar, bạn có thể tạo nên hệ thống loa 4.1 kênh, cho trải nghiệm âm thanh thật như cuộc sống.. . . *Bộ Loa Sau Không Dây Samsung có thể mua riêng (Mã sản phẩm tại hãng: SWA-8000S).. . Biến Ngôi Nhà Thành Thế Giới Giải Trí. . TV SoundConnect biến ngôi nhà bạn thành trung tâm giải trí với khả năng kết nối thông minh các thiết bị đến TV. Bạn có thể thưởng thức tất cả nội dung giải trí hấp dẫn với chất lượng âm thanh sắc nét, tuyệt vời nhất.. . . . Âm thanh vòm từ mọi góc độ. . . Âm trầm mạnh mẽ. . . Khuấy Động Âm Thanh Với Bluetooth. . . Điều khiển dễ dàng. . . Âm nhạc sống động đến mọi nơi. . . . . . Tư Vấn Mua Loa Sound Bar. . . . . . ",""""""
mediamart.vn,https://mediamart.vn/soundbar/samsung/loa-soundbar-samsung-hwms550.htm,,Samsung,Loa Soundbar,Loa Soundbar Samsung HW-MS550 2.0 CH,6.290.000,,," . Uy lực âm trầm mạnh mẽ với công nghệ mới độc quyền. Âm thanh đồng đều hoàn hảo với loa Tweeter cải tiến. Âm thanh chất lượng cao cho trải nghiệm chuẩn. . . . . Hình ảnh tham khảo: Loa Soundbar Samsung HW-MS550 2.0 CH. . . . . . . . . . . . . . . . . . . . . . . . . . . . . . . . . . . . . . . . . . . . . . . . . . . . . . Thông số kỹ thuật: Loa Soundbar Samsung HW-MS550 2.0 CH. . . . Thông số loa Soundbar. . . Công suất loa. . 450W. . . . . . . . . Thông tin: Loa Soundbar Samsung HW-MS550 2.0 CH. . . . Âm Thanh Không Dây Đa Chiều. . Loa Soundbar Samsung HW-MS550. được mệnh danh là chiếc Loa bán chạy nhất thế giới của Samsung. Với Phụ kiện Loa Sau Không Dây* nâng tầm chất lượng Soundbar lên thành hệ thống âm thanh vòm chất lượng cao mà không cần dây nối**. Bạn có thể tạo ra hệ thống kênh với trải nghiệm âm thanh sắc nét hoàn hảo.. . . Thưởng Thức ""Điểm Ngọt"" Chuẩn Mọi Vị Trí. . Giờ đây bạn không còn lo lắng lựa chọn chỗ ngồi lý tưởng để thưởng thức âm nhạc chất lượng cao. Bạn có thể cảm nhận âm thanh đồng đều tuyệt vời ở bất kỳ đâu trong phòng với loa Tweeter cải tiến của. Soundbar Samsung HW-MS550. .. . . Âm Thanh HD Sống Động Như Thật. . Samsung HW-MS550. giúp bạn có thể. . Cảm nhận sắc âm tuyệt vời và hòa mình vào nhịp điệu với âm thanh độ phân giải cao (HD Audio) chân thực đến bất ngờ. HD Audio giữ được nguyên vẹn chất lượng và độ tròn đầy của âm thanh gốc ban đầu qua chuẩn 96KHz/24bit.. . . Công Nghệ Điều Khiển Đa Loa Độc Quyền. . Trải nghiệm âm thanh hoàn hảo. Với công nghệ Samsung độc đáo, bộ loa đa hướng phát ra âm thanh đồng thời mang đến sắc trầm mạnh mẽ hơn.. . . Kết Nối Không Dây với TV. . Kết nối. Soundbar HW-MS550. với Samsung TV* hoàn toàn dễ dàng thông qua Bluetooth mà không cần dây cắm phức tạp. Bạn có thể thưởng thức tất cả nội dung giải trí hấp dẫn với chất lượng âm thanh sắc nét, tuyệt vời nhất.. . . * Tương thích với một số dòng TV Samsung. Liên hệ các cửa hàng để biết thêm chi tiết.. . Kết Hợp Hoàn Hảo, Không Giới Hạn. . HW-MS550. có thiết kế tối giản. Dễ dàng treo Loa Soundbar trực tiếp trên TV mà không cần thêm lỗ khoan trên tường. Đặc biệt, chỉ cần một cáp nguồn khởi động cho cả hai thiết bị (TV và Loa), giảm thiểu kết nối dây phức tạp.. . . Điều Khiển Thông Minh - Một Cho Tất Cả. . Bạn không cần nhiều Remote để điều khiển các thiết bị. Từ việc bật tắt, điều chỉnh âm lượng, thậm chí hiệu ứng âm thanh và nhiều tính năng chính của. Loa Soundbar MS550. có thể được điều chỉnh với Điều khiển TV Samsung thông qua giao diện TV.. . . Chế Độ Âm Thanh Thông Minh. . Chọn chế độ âm thanh hay để. Loa Soundbar. . MS550. giúp bạn điều chỉnh âm thanh. Tính năng động đáo tự động phân tích âm thanh và cân chỉnh chất lượng phát ra tốt nhất cho từng nội dung giải trí.. . . Kết Nối Âm Nhạc Không Giới Hạn. . Samsung Soundbar Sound+ có thể phát nhạc từ điện thoại hoặc máy tính bảng khuấy động nhịp điệu theo cách riêng của bạn. Chỉ cần kết nối qua Bluetooth hoặc Wi-Fi để thưởng thức các bài hát yêu thích.. . . Ứng Dụng Multiroom. . Loa Soundbar Samsung HW-MS550. được trang bị Ứng dụng nghe nhạc Samsung Multiroom mang đến trải nghiệm âm nhạc thú vị với chất lượng hoàn hảo hoàn toàn dễ dàng.. . . . . . . . . Tư Vấn Mua Loa Sound Bar. . . . . . ",""""""
mediamart.vn,https://mediamart.vn/soundbar/lg/loa-soundbar-lg-sj8-41-ch.htm,,LG,Loa Soundbar,Loa Soundbar LG SJ8 4.1 CH,3.990.000,,," . - Loa Sound bar LG SJ8 4.1 kênh. - Thiết kế: dạng thanh dài, loa subwoofer không dây. - Công suất: 300W. - Phù hợp với Tivi 50 inch trở lên. . . . . Hình ảnh tham khảo: Loa Soundbar LG SJ8 4.1 CH. . . . . . . . . . . . . . . . . . . . . . . . . . . . . . . . . . . . . . . . . . . . . . . . . . . . . . . . . Thông số kỹ thuật: Loa Soundbar LG SJ8 4.1 CH. . . . Thông số loa Soundbar. . . Công suất loa. . 420W. . . . . . . . . Thông tin: Loa Soundbar LG SJ8 4.1 CH. . . Loa Sound bar LG SJ8 - Công suất lớn, Âm thanh bùng nổ. . Hãy ngồi ngay hàng ghế đầu để thưởng thức loa dạng thanh SH8. Trải nghiệm âm thanh rõ ràng và sống động khi xem phim hoặc nghe nhạc với loa subwoofer không dây và âm thanh vòm ảo 4.1 CH. Loa có kiểu dáng phù hợp với TV của bạn và rất dễ thiết lập để bạn có thể trải nghiệm những bộ phim điện ảnh, những bản nhạc hay những buổi hòa nhạc thú vị ngay trong căn phòng của mình.. . . Thưởng thức âm thanh chi tiết hơn và mạnh mẽ hơn. . Mang âm thanh của cuộc sống vào phòng khách của gia đình bạn với loa Soundbar LG SJ8 với hệ thống loa sẽ mang lại một trải nghiệm âm thanh tinh khiết.. . . Âm thanh vòm trải rộng. . Với tính năng âm thanh vòm trải rộng, dàn âm thanh giải trí của LG có khả năng tối ưu hóa không gian trải nghiệm và trải đều âm thanh trên khắp diện tích bề mặt chiếc TV, từ đó giúp tạo nên hiệu ứng âm thanh mượt mà, rõ nét như từ chính loa Tivi thật sự. Loa dạng thanh 4.1 kênh công suất lớn 300W mang đến cảm nhận trung thực hơn khi xem phim.. . . - Công nghệ Auto Sound Engine: Tối ưu hóa âm thanh, giúp âm thanh luôn chính xác và cân bằng.. . - Công nghệ DTS Digital Surround: Tái tạo chính xác tín hiệu âm thanh từ nguồn phát, giúp âm thanh có độ trầm, bổng rõ ràng.. . - Công nghệ Dolby Digital: Giúp loa thanh phát ra những âm thanh đa chiều, liền mạch và dễ dàng lan tỏa khắp căn phòng.. . - Công nghệ Adaptive Sound Control: Là một công nghệ nâng cao âm thanh độc đáo của LG. Công nghệ này sẽ phân tích nội dung đang phát và điều chỉnh sao cho phù hợp như tăng âm lượng cho cuộc hội thọai và giảm tạp âm.. . . Nhân đôi trải nghiệm với kết nối không dây. . Nhờ vào khả năng kết nối Bluetooth, giờ đây bạn đã có thể thỏa sức tận hưởng âm nhạc của mình trên màn hình lớn cùng chất lượng âm thanh tuyệt vời với chỉ cần kích hoạt tính năng. Việc loại bỏ những kết nối dây rườm rà giúp cho thiết kế đặc biệt của chiếc TV và Loa vẫn giữ được nét thanh lịch, sắc sảo của mình, đồng thời không gian căn phòng cũng được tối ưu hóa toàn diện. Hơn thế nữa, bạn có thể khởi động và điều khiển âm lượng bằng Bluetooth thông qua Smartphones.. . . Kết nối không dây với loa trầm phụ. . Kết hợp sự đơn giản của Soundbar với chất lượng âm thanh trầm như sấm để cung cấp cho bạn một môi trường âm thanh thực sự làm phong phú thêm. Các siêu sub-woofer đi kèm với LG Soundbar hoàn hảo, và cung cấp một trải nghiệm âm bass năng động và phong phú. Ngoài ra, với thiết kế không dây của nó, nó là siêu dễ dàng để thiết lập và điều chỉnh hệ thống giải trí gia đình của bạn.. . . Chiếc Sound Bar này của LG được tích hợp Google Cast, cho phép bạn truyền phát các ứng dụng nghe nhạc từ thiết bị cá nhân tới loa của bạn. Ban có thể truyền từ điện thoại Android, máy tính bảng, iPhone, iPad, Mac, máy tính xách tay Windows hoặc Chromebook. Google Cast tương thích với các thiết bị sau (có Wifi bật sẵn): điện thoại thông minh và máy tính bảng sử dụng Android phiên bản 2.3 trở lên; iPhone, iPad và iPod sử dụng iOS7 trở lên; Chrome dành cho Mac và Windows; Chrome OS.. . Chia sẻ nội dung qua HDMI. . Loa Soundbar 4.1 LG SJ8 được trang bị cổng HDMI có thể dễ dàng xuất âm thanh có chất lượng cao.. . . . . . Tư Vấn Mua Loa Sound Bar. . . . . . ",""""""
