Domain,Url,Product_id,Brand,Category,Model,Price,Seller,Tags,Info,Others
mediamart.vn,https://mediamart.vn/quatsuoi/sunhouse/suoi-dien-halogen-sunhouse-shd7015.htm,,Sunhouse,Quạt sưởi,Quạt sưởi halogen Sunhouse SHD7015,345.000,,," . Tốc độ làm nóng nhanh, tỏa nhiệt đều. Giữ lượng oxy, không gây khó thở và khô da. Hai chế độ ra nhiệt (400W - 800W), tiết kiệm 50% điện năng. Lưới tản nhiệt, chống chói mắt. . . . . Hình ảnh tham khảo: Quạt sưởi halogen Sunhouse SHD7015. . . . . . . . . . . . . . . . . . . . . Thông số kỹ thuật: Quạt sưởi halogen Sunhouse SHD7015. . . . . . . . . . Thông tin: Quạt sưởi halogen Sunhouse SHD7015. . . Tỏa nhiệt nhanh chóng. Quạt sưởi halogen Sunhouse SHD7015 có tốc độ làm nóng nhanh, tỏa nhiệt đều hơn.. . . Lưới tản nhiệt chống chói. Quạt sưởi halogen Sunhouse SHD7015 sử dụng lưới tản nhiệt giúp chống chói mắt hiệu quả.. . . Không làm khô da. Quạt sưởi halogen Sunhouse SHD7015 giữ lượng oxy, không gây khó thở và khô da, đảm bảo an toàn sức khỏe khi trời hanh.. . . Tiết kiệm điện năng. Quạt sưởi halogen Sunhouse SHD7015 hoạt động với hai chế độ ra nhiệt (400W - 800W) giúp tiết kiệm 50% điện năng.. . . An toàn khi sử dụng. Quạt sưởi halogen Sunhouse SHD7015 có chế độ ngắt điện khi quạt bị nghiêng hay đổ và hoạt động trở lại bình thường.. . . Thiết kế nhỏ gọn. Quạt sưởi halogen Sunhouse SHD7015 được thiết kế nhỏ gọn, đơn giản, tiện lợi, dễ dàng mang theo mỗi khi di chuyển.. . . Tiết kiệm chi phí. Quạt sưởi halogen Sunhouse SHD7015 với bóng đèn hồng ngoại siêu bền giúp tiết kiệm chi phí tối đa.. . . . . . . Tư Vấn Mua Quạt sưởi. . . . . . ",""""""
mediamart.vn,https://mediamart.vn/quatsuoi/tiross/quat-suoi-hai-chieu-tiross-ts944.htm,,Tiross,Quạt sưởi,"Quạt sưởi Tiross TS944 hai chiều, điện ion âm",568.000,,," . - Loại: Quạt sưởi 2 chiều. Công suất max: 2000W. - Sưởi ấm, làm nóng đều không khí. Không đốt khí ô xi trong phòng. - Chức năng thổi mát. Điện ion âm; 05 tốc độ, góc quay 900. . . . . Hình ảnh tham khảo: Quạt sưởi Tiross TS944 hai chiều, điện ion âm. . . . . . . . . . . . . . . Thông số kỹ thuật: Quạt sưởi Tiross TS944 hai chiều, điện ion âm. . . . . . . . . . Thông tin: Quạt sưởi Tiross TS944 hai chiều, điện ion âm. . . * Đặc điểm nổi bật của Quạt sưởi hai chiều Tiross TS944. . Thiết kế hiện đại, phù hợp mọi không gian. . Quạt sưởi hai chiều Tiross TS944 hai chiều có thiết kế hiện đại, hình dáng nhỏ gọn, dễ cất đặt, di chuyển trong mọi không gian gia đình. Là sản phẩm tiện dụng cho mọi nhà trong thời tiết lạnh của mùa đông. . . . . . . Hiệu quả và an toàn. . Với công suất lên tới 2000W giúp xua tan cái lạnh giá mùa đông. An toàn khi sử dụng mà không hại sức khỏe: Không lo chập cháy, hay bị ô nhiễm khí độc Cacbon như sưởi ấm bằng than.... . . . . . . Đa tác dụng. . Tiết kiệm chi phí khi sử dụng. Ngoài chức năng sưởi ấm trong mùa đông, bạn có thể sử dụng được cho cả mùa hè nóng bức với chức năng làm mát. Không đốt cháy khí oxi, cho gia đình bạn không khí trong lành ngay tại nhà.. . . . . . . . . Tư Vấn Mua Quạt sưởi. . . . . . ",""""""
mediamart.vn,https://mediamart.vn/quatsuoi/sunhouse/quat-suoi-2-bong-quazt-sunhouse-shd7010-hong.htm,,Sunhouse,Quạt sưởi,QUẠT SƯỞI 2 bóng Quazt SUNHOUSE SHD7010 ( Hồng ),299.000,,," . Nhựa ABS chịu nhiệt toàn phần, chắc chắn và chịu nhiệt. Chân đế vững chắc có thể tháo rời và gập lại khi bảo quản vệ sinh. Hai chế độ ra nhiệt (400W - 800W). Bóng Quartz (2 bóng) chống chói mắt. . . . . Hình ảnh tham khảo: QUẠT SƯỞI 2 bóng Quazt SUNHOUSE SHD7010 ( Hồng ). . . . . . . . . . . . . . . Thông số kỹ thuật: QUẠT SƯỞI 2 bóng Quazt SUNHOUSE SHD7010 ( Hồng ). . . . . . . . . . Thông tin: QUẠT SƯỞI 2 bóng Quazt SUNHOUSE SHD7010 ( Hồng ). . . Sưởi ấm bằng bóng Quartz (2 bóng) chống chói mắt. . Quạt sưởi 2 bóng Quazt Sunhouse SHD7010 ( Hồng ) sưởi ấm bằng 2 bóng Quartz, chống chói mắt, ngay sau khi bật nên sẽ không tốn nhiều thời gian cho việc phải chờ đợi làm ấm phòng tắm.. . . . . Có thể lắp đặt ở phòng khách, phòng ngủ. . Ngoài lắp trong phòng tắm thì Quạt sưởi 2 bóng Quazt Sunhouse SHD7010 có thể được lắp đặt treo trong phòng ngủ, phòng khách, bếp tùy thuộc vào nhu cầu sử dụng,tiện dụng.. . . . . . . Thiết kế tiện lợi. . Quạt sưởi 2 bóng Quazt Sunhouse SHD7010,2 bóng thiết kế có hai công tắc điều khiển riêng biệt cho hai bóng nên có thể tùy chỉnh dễ dàng như ý muốn và tiết kiệm điện năng.. . . . . . . Không gây khô da. . Quạt sưởi 2 bóng Quazt Sunhouse SHD7010 không tạo ra cảm giác khô da, không đốt cháy oxy và giảm các triệu chứng đau, sưng, phù nề, bầm tím, khớp, gout, giảm chứng căng thẳng, mệt mỏi….. . . . . . . . . Tư Vấn Mua Quạt sưởi. . . . . . ",""""""
mediamart.vn,https://mediamart.vn/quatsuoi/kangaroo/quat-suoi-kangaroo-kg1015.htm,,Kangaroo,Quạt sưởi,Quạt sưởi Kangaroo KG1015,690.000,,," . Công suất 900W. . Sưởi ấm nhanh, kiểu dáng sang trọng. Tút năng điều chỉnh cao thấp tiện dụng. Lồng quạt bảo vệ an toàn, điều chỉnh quay đều 90 độ, tỏa nhiệt đều. Tự ngắt khi quá tải , tiết kiệm điện năng. . . . . Hình ảnh tham khảo: Quạt sưởi Kangaroo KG1015. . . . . . . . . . . . . . . Thông số kỹ thuật: Quạt sưởi Kangaroo KG1015. . . . . . . . . . Thông tin: Quạt sưởi Kangaroo KG1015. . . Thiết kế sang trọng. Quạt sưởi Kangaroo KG1015 với kiểu dáng nhỏ gọn, màu trắng kết hợp với xanh đen cho quạt mang nét đẹp sang trọng và tinh tế. Quạt dễ di chuyển, thích hợp sử dụng cho nhiều không gian như phòng ngủ, phòng học, phòng khách…. . . Sưởi ấm bằng đèn Halogen an toàn và chất lượng. Quạt sưởi sử dụng đèn Halogen không gây chói mắt, không làm khô da, không đốt cháy oxy, quạt sưởi Kangaroo KG1015 cho người dùng một không gian sử dụng ấm cúng và an toàn, tạo cảm giác thư giãn cao sau những giờ làm việc, học tập căng thẳng và mệt nhọc.. . . Chân đế vững chắc, dễ thay đổi chiều cao. Quạt với chân đế thiết kế chắc chắn cho vận hành êm và vững chãi. Thân quạt có thể thay đổi chiều cao cho phép linh hoạt sử dụng ở các không gian và mục đích khác nhau, gia tăng tiện lợi cho người dùng.. . . 2 mức nhiệt cùng góc quay 90 độ. Quạt điều chỉnh đơn giản bằng các nút nhấn và núm vặn trên chân đế. Với công suất 900 W, 2 mức nhiệt và góc quay 90 độ cho phép quạt làm ấm hiệu quả trên diện tích rộng, gia tăng lợi ích sử dụng.. . . Hẹn giờ lên đến 180 phút. Với chế độ hẹn giờ lên đến 180 phút, người dùng có thể linh hoạt lựa chọn và sử dụng quạt cho các thời điểm và mục đích khác nhau, vừa an toàn lại tiết kiệm điện năng sử dụng.. . . Chống cháy, tự ngắt khi nghiêng đổ hay khi quá nhiệt. Với lồng quạt và vỏ nhựa phía sau chống cháy tuyệt đối, người dùng có thể yên tâm về chất lượng sử dụng quạt sưởi. Kèm theo đó là chế độ tự ngắt khi quá nhiệt, khi nghiêng đổ gia tăng sự bảo vệ cho quạt, chống hư hại và chập cháy an toàn hơn cho người dùng.. . . . . . . Tư Vấn Mua Quạt sưởi. . . . . . ",""""""
mediamart.vn,https://mediamart.vn/quatsuoi/tiross/quat-suoi-hai-chieu-tiross-ts945.htm,,Tiross,Quạt sưởi,"Quạt sưởi Tiross TS945 hai chiều, điện ion âm",599.000,,," . - Loại: Quạt sưởi 2 chiều. Công suất max: 2000W. - Sưởi ấm, làm nóng đều không khí. Không đốt khí ô xi trong phòng. - Chức năng thổi mát. Điện ion âm; 05 tốc độ, góc quay 900. . . . . Hình ảnh tham khảo: Quạt sưởi Tiross TS945 hai chiều, điện ion âm. . . . . . . . . . . . . . . Thông số kỹ thuật: Quạt sưởi Tiross TS945 hai chiều, điện ion âm. . . . . . . . . . Thông tin: Quạt sưởi Tiross TS945 hai chiều, điện ion âm. . . Thời tiết lạnh giá khi vào mùa đông kèm theo mưa ẩm ướt khiến bạn và người thân yêu dễ bị mắc bệnh. Giải pháp nào giúp bạn xua tan cái lạnh. . . . . . . Quạt sưởi. . 2 chiều Tiross (TS-945). . . Thông tin sản phẩm quạt sưởi 2 chiều Tiross:. . . Loại: Quạt sưởi 2 chiều. . Công suất: 2000W. . . . . . Tính năng:. . . . . Sưởi ấm, làm nóng đều không khí. . Không đốt khí ô xi trong phòng. . 05 tốc độ, góc quay 900. . Chức năng thổi mát. . Điện Ion âm. . . Sản phẩm. quạt sưởi. 2 chiều Tiross BH 6 tháng. Sản phẩm Quạt sưởi 2 chiều Tiross Nk chính hãng từ Ba Lan, sx TQ.. . . . Một số lưu ý khi sử dụng quạt sưởi:. . . . - Nên đặt. quạt sưởi. ở các góc phòng, không đặt ở gần giường.. . - Nên sử dụng ở chế độ 1 để sưởi ấm.. . - Để khắc phục tình trạng khô môi, nẻ da, người dùng nên đặt một chậu nước trong phòng hoặc sử dụng máy phun tạo ẩm.. . - Không để các vật như quần áo, giấy báo… lên quạt.. . . . . . . . Tư Vấn Mua Quạt sưởi. . . . . . ",""""""
mediamart.vn,https://mediamart.vn/quatsuoi/sunhouse/quat-suoi-sunhouse-shd7005.htm,,Sunhouse,Quạt sưởi,Quạt sưởi Sunhouse SHD7005,675.000,,," . Công suất 800W, 2 chế độ điều chỉnh công suất, Đèn Halogen siêu bền tuổi thọ cao.. . Lồng bảo vệ an toàn, Dây cắm bền chắc, chịu được công suất cao.. . Lồng và vỏ nhựa phía sau chống cháy tuyệt đối, Giá đỡ chế tạo bằng nhựa ABS. . . . . Hình ảnh tham khảo: Quạt sưởi Sunhouse SHD7005. . . . . . . . . . . . . . . . . . Thông số kỹ thuật: Quạt sưởi Sunhouse SHD7005. . . . . . . . . . Thông tin: Quạt sưởi Sunhouse SHD7005. . . Bóng đèn halogen siêu bền. Quạt sưởi sunhouse SHD7005 sử dụng bóng đèn Halogen siêu bền cho tuổi thọ hoạt động tương đối cao.. . . 2 mức điều chỉnh công suất. Quạt sưởi sunhouse SHD7005 có 2 chế độ điều chỉnh công suất với mức tối đa lên tới 1000W.. . . Lồng quạt chắc chắn. Quạt sưởi sunhouse SHD7005 có lồng bảo vệ an toàn bằng kim loại tăng độ bền và đảm bảo an toàn cho trẻ em.. . . Giá đỡ bằng nhựa ABS. Quạt sưởi sunhouse SHD7005 với giá đỡ chế tạo bằng nhựa ABS, chắc chắn, chịu va đập.. . . Làm ấm bằng tia hồng ngoại. Quạt sử dụng công nghệ làm ấm bằng tia hồng ngoại giúp người sử dụng cảm thấy ấm lên nhanh chóng.. . . Chức năng hẹn giờ tiện dụng. Quạt sưởi sunhouse SHD7005 trang bị chức năng hẹn giờ tiện lợi giúp giải quyết vấn đề quên tắt quạt.. . . . . . Tư Vấn Mua Quạt sưởi. . . . . . ",""""""
mediamart.vn,https://mediamart.vn/quatsuoi/tiross/may-suoi-dau-tiross-ts9213-13-thanh-man-hinh-led-hen-gio-dieu-khien-gia-phoi.htm,,Tiross,Quạt sưởi,"Máy sưởi dầu Tiross TS9213 13 thanh, màn hình LED, hẹn giờ, điều khiển, giá phơi",2.490.000,,," . Máy sưởi dầu 13 thanh, màn hình LED, có hẹn giờ, giá phơi. Công suất 2500W,3 chế độ nóng, Điều khiển từ xa tiện dụng . Diện tích sử dụng: 10-25m2, chế độ Eco tiết kiệm điện tối đa. Không đốt cháy oxi, không gây khô da, có chế độ dành riêng cho người già và trẻ . . . . . Hình ảnh tham khảo: Máy sưởi dầu Tiross TS9213 13 thanh, màn hình LED, hẹn giờ, điều khiển, giá phơi. . . . . . . . . . . . . . . . . . . . . . . . Thông số kỹ thuật: Máy sưởi dầu Tiross TS9213 13 thanh, màn hình LED, hẹn giờ, điều khiển, giá phơi. . . . . . . . . . Thông tin: Máy sưởi dầu Tiross TS9213 13 thanh, màn hình LED, hẹn giờ, điều khiển, giá phơi. . . Hoạt động theo nguyên tắc thanh nhiệt. 13 thanh nhiệt của máy là nguồn cung cấp nhiệt và dầu đóng vai trò là trung gian duy trì nhiệt và nhiệt được tỏa ra qua các thanh sưởi. Nhiệt độ trong phòng tăng lên nhờ vào sự lưu thông không khí trong phòng.. . . Máy sử dụng nguyên liệu dầu. Máy Sưởi dầu TIROSS sử dụng nhiên liệu là dầu, tuy nhiên trong quá trình sử dụng hoàn toàn không phải thay thế dầu vì máy có chức năng xoay vòng nhiên liệu. Chỉ việc cắm điện và sử dụng.. . . Có hẹn giờ tự động, điều khiển từ xa. TIROSS TS9213có chế độ hẹn giờ tự động, điều khiển từ xa, thuận tiện cho người sử dụng không phải di chuyển. Chế độ hẹn giờ tự động khi đã đủ nhiệt độ cần thiết phục vụ nhu cầu mang lại sự tiện lợi nhất cho người dùng.. . . Thiết kế tiện lợi, an toàn. Máy sưởi dầu TIROSS tiện lợi, an toàn có bánh xe tiện di chuyển, có giá phơi đi kèm để bạn có thể sấy quần áo và có chế độ tạo ẩm làm cân bằng độ ẩm không khí.. . . . . Màn hình LCD hiển thị thông tin. Máy sưởi dầu có màn hình LCD thông minh hiển thị thông tin, nhiệt độ để người dùng dễ dàng kiểm soát nhiệt độ theo yêu cầu.. . . An toàn cho người già và trẻ nhỏ. Máy sưởi dầu TIROSS khá an toàn cho gia đình bởi không gây khô da, khó thở an toàn cho trẻ nhỏ và người già.. . . . . . . Tư Vấn Mua Quạt sưởi. . . . . . ",""""""
mediamart.vn,https://mediamart.vn/quatsuoi/tiross/may-suoi-dau-11-thanh-tiross-ts9212.htm,,Tiross,Quạt sưởi,Máy sưởi dầu 11 thanh Tiross TS9212,2.280.000,,," . Máy sưởi dầu điện tử, 11 thanh. Công suất 2200W, 3 chế độ nóng. Có giá phơi, điều khiển từ xa. Diện tích sử dụng: 15-20m2. . . . . Hình ảnh tham khảo: Máy sưởi dầu 11 thanh Tiross TS9212. . . . . . . . . . . . . . . . . . . . . . . . . . . Thông số kỹ thuật: Máy sưởi dầu 11 thanh Tiross TS9212. . . . . . . . . . Thông tin: Máy sưởi dầu 11 thanh Tiross TS9212. . . Kiểu dáng sang trọng. Sưởi Dầu Tiross TS9212 có kiểu dáng khá cầu kỳ, đẹp mắt. Có bánh xe dễ dàng di chuyển đặt được mọi nơi trong không gian nhà bạn.. . . Công suất cao. Tiross TS9212 với công suất 2200W cùng với 11 thanh nhiệt giúp không khí được làm ấm nhanh chóng nhưng không làm khô da và kích ứng da, khó chịu như một số loại máy sưởi thông thường.. . . Tiết kiệm điện năng. Sưởi dầu với 11 thanh phát nhiệt làm nóng cực nhanh. Giúp không gian nhà bạn ấm lên nhanh chóng mà vẫn cực tiết kiệm điện năng.. . . Hẹn giờ. Máy sưởi dầu Tiross có chế độ hẹn giờ giúp cho bạn có giấc ngủ ngon mà không bị quá nóng như những thiết bị sưởi thông thường.. . . An toàn cho sức khỏe. Khi máy hoạt động, các tấm sưởi sẽ được làm nóng và truyền nhiệt qua dầu ra môi trường bên ngoài vì thế sẽ không đốt cháy oxy, không làm khô da.. Dầu được làm nóng bên trong các thanh chứa kín, tuyệt đối không gây mùi khó chịu.. . . . . . Tư Vấn Mua Quạt sưởi. . . . . . ",""""""
mediamart.vn,https://mediamart.vn/quatsuoi/sunhouse/quat-suoi-sunhouse-shd7006.htm,,Sunhouse,Quạt sưởi,QUẠT SƯỞI SUNHOUSE SHD7006 hẹn giờ,890.000,,," . - Công suất (W)1000W. . - Sử dụng công nghệ làm ấm bằng tia hồng ngoại giúp người sử dụng cảm thấy ấm lên nhanh chóng. . . - Độ cao và chiều cao có thể được điều chỉnh bằng tay. . . - Hai chế độ điều chỉnh, tự động khởi động, có chức năng hẹn giờ.. . . . . Hình ảnh tham khảo: QUẠT SƯỞI SUNHOUSE SHD7006 hẹn giờ. . . . . . . . . . . . . . . . . . . . . . . . . . . Thông số kỹ thuật: QUẠT SƯỞI SUNHOUSE SHD7006 hẹn giờ. . . . . . . . . . Thông tin: QUẠT SƯỞI SUNHOUSE SHD7006 hẹn giờ. . . Thiết kế tinh tế, hiện đại. Quạt sưởi Sunhouse SHD7006 được thiết kế tinh tế, phù hợp với cuộc sống hiện đại. Kiểu quạt đứng, gọn nhẹ, tiện dụng, thuận tiện cho việc bố trí xếp đặt ở mọi không gian. Là sự lựa chọn tốt nhất cho mọi gia đình giữa mùa đông giá lạnh.. . . Chế độ hẹn giờ. Quạt có chế độ hẹn giờ tiện dụng giúp bạn dễ dàng cài đặt thời gian phù hợp tùy theo nhu cầu sử dụng.. . . Sưởi ấm bằng tia hồng ngoại. Quạt sưởi Sunhouse sưởi ấm bằng tia hồng ngoại có tác dụng tốt cho da và sức khỏe của bạn. Ngoài ra, tia hồng ngoại còn khử trùng phòng, cho căn phòng của bạn luôn ấm áp, sạch sẽ.. . . Đảm bảo sức khỏe cho gia đình. Quạt sưởi góp phần đảm bảo đảm sức khỏe cho các thành viên trong gia đình ban. Giúp bạn tránh được các trường hợp đột quỵ ở người già. Cảm lạnh, viêm phổi, viêm họng ở trẻ em.. . . . . . . Tư Vấn Mua Quạt sưởi. . . . . . ",""""""
mediamart.vn,https://mediamart.vn/quatsuoi/sunhouse/quat-suoi-hong-ngoai-sunhouse-shd7013.htm,,Sunhouse,Quạt sưởi,Quạt sưởi hồng ngoại Sunhouse SHD7013,335.000,,," . - Tốc độ làm nóng nhanh, tỏa nhiệt đều. . - Giữ lượng oxy không gây khó thở và khô da. . - Hai chế độ ra nhiệt (400W - 800W). . - Đèn thạch anh chống chói mắt. . . . . Hình ảnh tham khảo: Quạt sưởi hồng ngoại Sunhouse SHD7013. . . . . . . . . . . . . . . Thông số kỹ thuật: Quạt sưởi hồng ngoại Sunhouse SHD7013. . . . . . . . . . Thông tin: Quạt sưởi hồng ngoại Sunhouse SHD7013. . . Thông tin: Quạt sưởi hồng ngoại Sunhouse SHD7013. . Sưởi điện hồng ngoại Sunhouse SHD7013 sự lựa chọn hàng đầu của các gia đình:. Thời tiết mùa đông khắc nghiệt luôn là điều lo lắng đối với gia đình có con nhỏ và người cao tuổi. Bạn cần chú ý để bảo vệ sức khỏe cho chính mình và người thân. Ngoài việc mặc đủ ấm thì bạn phải đặc biệt lưu tâm thời điểm tắm rửa, vệ sinh cơ thể tránh để bị đột quỵ vì chênh lệch nhiệt độ đột ngột. Sưởi điện hồng ngoại Sunhouse SHD7013 - một sản phẩm sưởi ấm tốt cho sức khỏe.. . Sưởi điện hồng ngoại Sunhouse SHD7013 có tốc độ làm nóng nhanh, tỏa nhiệt đều, cho bạn cảm giác ấm áp trong mùa đông mà không sợ bị khô da.. . Sunhouse SHD7013 có chế độ ngắt điện khi quạt bị nghiêng hay đổ và hoạt động trở lại bình thường. Công suất tiêu thụ điện nhỏ, giúp bạn tiết kiệm chi phí tối đa.. . Sưởi điện hồng ngoại Sunhouse SHD7013 có nút bật/ tắt tiện dụng. Sưởi điện Sunhouse an toàn cho gia đình có người già và trẻ nhỏ bởi khả năng điều chỉnh quạt với chế độ tắt mở an toàn.. Máy sưởi thiết kế tiện lợi, an toàn, đẹp, dễ hoạt động và không gây ra nhiễu sóng… phù hợp với các không gian gia đình nhỏ.. . Sưởi điện hồng ngoại Sunhouse SHD7013 sử dụng hệ thống đèn hồng ngoại an toàn. Chất liệu cực kỳ bền chắc, sáng bóng sạch sẽ, đảm bảo cho bạn sử dụng lâu bền theo thời gian.. Có móc cuốn dây điện tiện dụng khi di chuyển và bảo quản.. . . . . . Tư Vấn Mua Quạt sưởi. . . . . . ",""""""
mediamart.vn,https://mediamart.vn/quatsuoi/kangaroo/den-suoi-halogen-kangaroo-kg1011c.htm,,Kangaroo,Quạt sưởi,Đèn sưởi Halogen Kangaroo KG1011C,445.000,,," . - Công suất: 400W, 800W, 1200W. . - Sưởi ấm nhanh, không gây tiếng ồn. . - Có tính năng quay đảo hướng phát nhiệt, phạm vi phát nhiệt rộng. . - Lưới tản nhiệt thiết kế an toàn,phòng ngừa bỏng, giật. . . . . Hình ảnh tham khảo: Đèn sưởi Halogen Kangaroo KG1011C. . . . . . . . . . . . . . . Thông số kỹ thuật: Đèn sưởi Halogen Kangaroo KG1011C. . . . . . . . . . Thông tin: Đèn sưởi Halogen Kangaroo KG1011C. . . . Kiểu dáng nhỏ gọn. . Đèn sưởi Halogen Kangaroo KG1011C với thiết kế kiểu dáng nhỏ gọn, có quai xách nên thuận tiện cho việc di chuyển.. . . . . . . Tính năng quay đảo hướng phát nhiệt. . Có tính năng quay đảo hướng phát nhiệt giống như quạt giúp tỏa nhiệt đều ở xung quanh phòng và rất tiện lợi trong mùa đông.. . . . . Lưới tản nhiệt an toàn. . Đèn sưởi Halogen Kangaroo KG1011C có lưới tản nhiệt thiết kế an toàn, phòng ngừa bỏng, giật.. . . . . Phát nhiệt bằng bóng Halogen. . Sử dụng công nghệ phát nhiệt bằng bóng Halogen,giúp tỏa nhiệt nhanh, rất tiện lợi khi làm ấm phòng tắm.. . . . . An toàn. . Đèn sưởi Halogen Kangaroo KG1011C tự động ngắt điện khi bị nghiêng đổ, an toàn chống cháy nổ.. . . . . . . . Tư Vấn Mua Quạt sưởi. . . . . . ",""""""
mediamart.vn,https://mediamart.vn/quatsuoi/sunhouse/quat-suoi-2-bong-quazt-sunhouse-shd7010-trang.htm,,Sunhouse,Quạt sưởi,Quạt sưởi 2 bóng Quazt Sunhouse SHD7010 ( Trắng ),299.000,,," . Nhựa ABS chịu nhiệt toàn phần, chắc chắn và chịu nhiệt. Chân đế vững chắc có thể tháo rời và gập lại khi bảo quản vệ sinh. Hai chế độ ra nhiệt (400W - 800W). Bóng Quartz (2 bóng) chống chói mắt. . . . . Hình ảnh tham khảo: Quạt sưởi 2 bóng Quazt Sunhouse SHD7010 ( Trắng ). . . . . . . . . . . . . . . Thông số kỹ thuật: Quạt sưởi 2 bóng Quazt Sunhouse SHD7010 ( Trắng ). . . . . . . . . . Thông tin: Quạt sưởi 2 bóng Quazt Sunhouse SHD7010 ( Trắng ). . . Sưởi ấm bằng bóng Quartz (2 bóng) chống chói mắt. . Quạt sưởi 2 bóng Quazt Sunhouse SHD7010 ( Hồng ) sưởi ấm bằng 2 bóng Quartz, chống chói mắt, ngay sau khi bật nên sẽ không tốn nhiều thời gian cho việc phải chờ đợi làm ấm phòng tắm.. . . . . Có thể lắp đặt ở phòng khách, phòng ngủ. . Ngoài lắp trong phòng tắm thì Quạt sưởi 2 bóng Quazt Sunhouse SHD7010 có thể được lắp đặt treo trong phòng ngủ, phòng khách, bếp tùy thuộc vào nhu cầu sử dụng,tiện dụng.. . . . . . . Thiết kế tiện lợi. . Quạt sưởi 2 bóng Quazt Sunhouse SHD7010,2 bóng thiết kế có hai công tắc điều khiển riêng biệt cho hai bóng nên có thể tùy chỉnh dễ dàng như ý muốn và tiết kiệm điện năng.. . . . . . . Không gây khô da. . Quạt sưởi 2 bóng Quazt Sunhouse SHD7010 không tạo ra cảm giác khô da, không đốt cháy oxy và giảm các triệu chứng đau, sưng, phù nề, bầm tím, khớp, gout, giảm chứng căng thẳng, mệt mỏi….. . . . . . . . . Tư Vấn Mua Quạt sưởi. . . . . . ",""""""
