Domain,Url,Product_id,Brand,Category,Model,Price,Seller,Tags,Info,Others
mediamart.vn,https://mediamart.vn/quatsuoi/goldsun/may-suoi-mica-goldsun-premium-gpmh04m.htm,,Goldsun,Quạt sưởi,Máy sưởi Mica Goldsun Premium GPMH04M,2.280.000,,," . Công nghệ sưởi mica bằng dải sóng hồng ngoại. . Công suất 2200W, 2 chế độ sưởi. . Không đốt oxy, không phát sáng. . Ngắt khi quá nhiệt và khi đổ. . . . . Hình ảnh tham khảo: Máy sưởi Mica Goldsun Premium GPMH04M. . . . . . . . . . . . . . . Thông số kỹ thuật: Máy sưởi Mica Goldsun Premium GPMH04M. . . . . . . . . . Thông tin: Máy sưởi Mica Goldsun Premium GPMH04M. . . Thông tin: Máy sưởi Mica Goldsun Premium GPMH04M. . . MÁY SƯỞI MICA GOLDSUN PREMIUM GPMH04M - ĐIỀU KHIỂN CƠ. Máy sưởi là một trong những thiết bị vô cùng cần thiết để tăng cường nhiệt độ trong mùa đông lạnh giá. Với thiết kế hiện đại làm ấm nhanh chóng cho bạn cảm giác ấm áp tỏa đều khắp cơ thể mà không sợ bị khô da. Đảm bảo an toàn và phục vụ tối ưu cho nhu cầu sưởi ấm của mùa đông năm nay.. . . Thông số kĩ thuật:. Công suất sưởi tối đa: 2200W. Chế độ sưởi: 2 chế độ 1000W/2200W. Bảo hành 2 năm toàn quốc. . . Ưu điểm vượt trội:. Công nghệ sưởi mica bằng dải sóng hồng ngoại là công nghệ sưởi tiên tiến nhất Châu Âu - lần đầu tiên có mặt trên thị trường Việt Nam. Tỏa hơi ấm nhanh chóng chỉ sau 1 - 2 phút sử dụng thay vì 15 phút với các thiết bị sưởi ấm thông thường như sưởi bóng, sưởi may xo, sưởi halogen..v....v. . . Công nghệ sưởi tiên tiến và an toàn nhất Châu Âu:. - Không đốt oxy, không phát sáng, không nóng không khí, chỉ phát nhiệt khi gặp các bề mặt vật thể do đó tiết kiệm tới 40% điện năng tiêu thụ.. - An toàn tự động ngắt khi có vật phủ lên như: ri đô, quần áo, khăn…v…v.. Dễ dàng điều chỉnh nhiệt độ tăng giảm theo nhiệt độ phòng, đối lưu nhiệt nhanh, đều và ổn định.. An toàn tuyệt đối cho sức khỏe, ngắt khi quá nhiệt và khi đổ. Đặc biệt, sử dụng được trong phòng tắm do áp dụng tiêu chuẩn IP24.. Thiết kế chân đế dạng bánh xe để dễ dàng di chuyển từ phòng này sang phòng khác.. . . . . . . Tư Vấn Mua Quạt sưởi. . . . . . ",""""""
mediamart.vn,https://mediamart.vn/quatsuoi/nagakawa/quat-suoi-nagakawa-naht5312p-co-dieu-khien.htm,,Nagakawa,Quạt sưởi,Quạt sưởi Nagakawa NA-HT5312P có điều khiển,,,," . Công suất 2000W. . Thiết kế hiện đại với kiểu dáng siêu mỏng, màu sắc trang nhã. Hẹn giờ, phím điều chỉnh cảm ứng, điều khiển từ xa. Hẹn giờ, phím điều chỉnh cảm ứng,. Tự động ngắt khi nhiệt độ trong phòng tăng cao. Tự động ngắt khi nhiệt độ trong phòng tăng cao từ 40 > 45 độ C. . . . . Hình ảnh tham khảo: Quạt sưởi Nagakawa NA-HT5312P có điều khiển. . . . . . . . . . . . . . . . . . Thông số kỹ thuật: Quạt sưởi Nagakawa NA-HT5312P có điều khiển. . . . . . . . . . Thông tin: Quạt sưởi Nagakawa NA-HT5312P có điều khiển. . . 1. Những lợi ích khi sử dụng quạt sưởi Nagakawa NA-HT5312P. + Có khả năng làm ấm gian phòng một cách nhanh chóng, giúp cho không gian sống của bạn luôn ở trạng thái ấm áp, hạn chế được các loại bệnh dễ gặp trong mùa đông như : cảm lạnh, sổ mũi,... bảo vệ sức khoẻ đồng thời giữ vững hạnh phúc cho gia đình bạn.. . + Giá các loại quạt sưởi Nagakawa tương đối rẻ, phù hợp với điều kiện kinh tế của đại đa số các hộ gia đình, bạn có thể bảo vệ sức khoẻ của gia đình một cách hiệu quả mà chi phí bỏ ra không hề lớn.. . . . + Chỉ với một chiếc máy sưởi bạn có thể sử dụng được cho nhiều phòng tiện lợi hơn nhiều so với việc bạn mua chiếc máy điều hoà - chỉ sử dụng cho một không gian nhất định.. . + Khi hoạt động quạt sưởi không sáng nên sẽ không làm làm ảnh hưởng tới giấc ngủ của bạn.. . + Quạt có chế độ hẹn giờ vừa giúp bạn tiết kiệm điện năng lại vừa đảm bảo an toàn cho gia đình bạn, đặc biệt là các em nhỏ.. . + Sử dụng bộ điều khiển từ xa, phím điều khiển cảm ứng rất thuận tiện cho việc sử dụng, bạn sẽ không phải rời khỏi giường, hay di chuyển lại chiếc quạt sưởi Nagakawa để tắt mà chỉ cần dùng phím điều khiển từ xa đã có thể điều chỉnh được.. . + Quạt sưởi Nagakawa NA-HT5312P được thiết kế nhỏ gọn, trang nhã khá bắt mắt, tiện lợi cho việc di chuyển đồng thời có thể đặt ở nhiều vị trí khác nhau mà không làm mất đi nét thẩm mỹ vốn có của gian phòng.. . + An toàn khi sử dụng : sử dụng ""quạt sưởi an toàn"" vì có bộ công tắc có thể bật tắt đồng thời khi đổ quạt sẽ tự động ngắt.. . 2. Tính năng nổi bật của sản phẩm. . Thiết kế hiện đại với kiểu dáng siêu mỏng, màu sắc trang nhã. Hẹn giờ, phím điều chỉnh cảm ứng, điều khiển từ xa. Hẹn giờ, phím điều chỉnh cảm ứng,. Tự động ngắt khi nhiệt độ trong phòng tăng cao. Tự động ngắt khi nhiệt độ trong phòng tăng cao từ 40 > 45 độ C. Có công tắc an toàn đổ tự ngắt. Hiển thị nhiệt độ trong phòng. Điều chỉnh nhiệt độ trong phòng từ 15 35 độC. Có màng lọc sạch bụi bẩn.. Công nghệ mới ( PTC-Ceramic, tăng khả năng làm nóng và tiết kiệm điện.. Không đốt cháy oxy trong phòng. Công suất 1200W, 2000W. Điện áp: 220V – 50Hz. . . . . . Tư Vấn Mua Quạt sưởi. . . . . . ",""""""
mediamart.vn,https://mediamart.vn/quatsuoi/kohn/den-suoi-kohn-eco-kd02g-2-bong-vang.htm,,KOHN,Quạt sưởi,Đèn sưởi nhà tắm Kohn ECO KD02G - 2 bóng,399.000,,," . Đèn sưởi nhà tắm 2 bóng vàng chống chõi mắt. . Không đốt cháy oxy. . Diện tích sử dụng:2-4m2. . 2 công tắc bật tắt riêng từng bóng đèn. . . . . Hình ảnh tham khảo: Đèn sưởi nhà tắm Kohn ECO KD02G - 2 bóng. . . . . . . . . . . . . . . . . . . . . Thông số kỹ thuật: Đèn sưởi nhà tắm Kohn ECO KD02G - 2 bóng. . . . . . . . . . Thông tin: Đèn sưởi nhà tắm Kohn ECO KD02G - 2 bóng. . . Thông tin: Đèn sưởi nhà tắm Kohn ECO KD02G - 2 bóng. . . Thiết kế treo tường tiện lợi. Đèn sưởi Kohn ECO KD02G được thiết kế treo tường với góc treo phù hợp để tăng tối đa hiệu quả làm ấm. Màu sắc trang nhã phù hợp với mọi không gian nhà tắm giúp không gian nhà tắm sang trọng hơn.. . . Bóng đèn mạ vàng. Bóng đèn sưởi được phủ lớp mạ vàng giúp làm giảm độ chói sáng nhưng không làm giảm hiệu quả làm ấm, ánh đèn vàng với bức xạ hồng ngoại không làm ảnh hưởng đến mắt, da.. . . Mỗi bóng đèn đều có công tắc riêng biệt. Đèn sưởi Kohn ECO KD02G 2 bóng, mỗi bóng đèn đều có công tắc riêng biệt và có nắp đậy chống nước đảm bảo an toàn khi sử dụng.. . . Tốt cho sức khỏe. Đèn không tạo ra cảm giác khô da, không đốt cháy oxy và giảm các triệu chứng đau, phù nề, bầm tím, khớp, giảm chứng căng thẳng, mệt mỏi…có lợi cho sức khỏe nhất là đối với trẻ em, người già.. . . Có thể lắp đặt ở phòng khách, phòng ngủ. Ngoài lắp trong phòng tắm thì đèn sưởi Đèn sưởi Kohn ECO KD02G có thể được lắp đặt treo trong phòng ngủ, phòng khách, bếp tùy thuộc vào nhu cầu sử dụng.. . . . . . . . . . Tư Vấn Mua Quạt sưởi. . . . . . ",""""""
mediamart.vn,https://mediamart.vn/quatsuoi/sunhouse/den-suoi-phong-tam-sunhouse-shd3822-2-bong-trang.htm,,Sunhouse,Quạt sưởi,"Đèn sưởi nhà tắm Sunhouse SHD3822, 2 bóng",390.000,,," . Công suất 550W. Công nghệ sưởi không đốt cháy Oxi, giữ ấm cho da. Sử dụng an toàn, chống nước IPX4, chống chập điện.. Công tắc độc lập cho từng bóng, dễ dàng điều chỉnh nhiệt độ.. . . . . Hình ảnh tham khảo: Đèn sưởi nhà tắm Sunhouse SHD3822, 2 bóng. . . . . . . . . . . . . . . Thông số kỹ thuật: Đèn sưởi nhà tắm Sunhouse SHD3822, 2 bóng. . . . . . . . . . Thông tin: Đèn sưởi nhà tắm Sunhouse SHD3822, 2 bóng. . . Đặc điểm nổi bật của Đèn sưởi nhà tắm Sunhouse SHD3822. . . Sưởi ấm bằng tia hồng ngoại. . Đèn sưởi nhà tắm Sunhouse SHD3822 sưởi ấm tức thì bằng tia hồng ngoại ngay sau khi bật nên sẽ không tốn nhiều thời gian chờ đợi làm ấm phòng tắm.. . . Có thể lắp đặt ở phòng khách, phòng ngủ. . Ngoài lắp trong phòng tắm thì đèn sưởi SUNHOUSE SHD3822 có thể được lắp đặt treo trong phòng ngủ, phòng khách, bếp tùy thuộc vào nhu cầu sử dụng.. . . Thiết kế tiện lợi. . Đèn sưởi có hai công tắc điều khiển riêng biệt cho hai bóng nên có thể tùy chỉnh dễ dàng như ý muốn và tiết kiệm điện năng.. . . Bóng đèn chịu nhiệt. . Với công nghệ chịu nhiệt siêu bền, bóng thủy tinh chính hãng sunhouse được có khả năng chịu nước lên tới 4 độ C khi đèn đang hoạt động. . . Không gây khô da. . Đèn không tạo ra cảm giác khô da, không đốt cháy oxy và giảm các triệu chứng đau, sưng, phù nề, bầm tím, khớp, gout, giảm chứng căng thẳng, mệt mỏi….. . . . . . Tư Vấn Mua Quạt sưởi. . . . . . ",""""""
mediamart.vn,https://mediamart.vn/quatsuoi/comet/den-suoi-hai-bong-comet-cm8539.htm,,Comet,Quạt sưởi,"Đèn sưởi nhà tắm Comet CM8539, 2 bóng",690.000,,," . Loại thiết bị: Đèn sưởi. . Công suất (W): 275W. . . . . Hình ảnh tham khảo: Đèn sưởi nhà tắm Comet CM8539, 2 bóng. . . . . . . . . . . . . . . . . . Thông số kỹ thuật: Đèn sưởi nhà tắm Comet CM8539, 2 bóng. . . . . . . . . . Thông tin: Đèn sưởi nhà tắm Comet CM8539, 2 bóng. . . Sưởi ấm bằng tia hồng ngoại. Đèn sưởi 2 bóng Comet CM8539 với các tính năng sưởi ấm tức thì bằng tia hồng ngoại ngay sau khi bật nên sẽ không tốn nhiều thời gian cho việc phải chờ đợi làm ấm phòng tắm.. . . Có thể lắp đặt ở phòng khách, phòng ngủ. Ngoài lắp trong phòng tắm thì đèn sưởi nhà tắm 2 bóng Comet CM8539 có thể được lắp đặt treo trong phòng ngủ, phòng khách, bếp tùy thuộc vào nhu cầu sử dụng.. . . Thiết kế tiện lợi. Đèn sưởi nhà tắm 2 bóng Comet CM8539 thiết kế có hai công tắc điều khiển riêng biệt cho hai bóng nên có thể tùy chỉnh dễ dàng như ý muốn và tiết kiệm điện năng.. . . Không gây khô da. Đèn không tạo ra cảm giác khô da, không đốt cháy oxy và giảm các triệu chứng đau, sưng, phù nề, bầm tím, khớp, gout, giảm chứng căng thẳng, mệt mỏi….. . . . . . Tư Vấn Mua Quạt sưởi. . . . . . ",""""""
mediamart.vn,https://mediamart.vn/quatsuoi/hanil/may-suoi-hanil-eh-809-lam-bong-bang-bong-halogel-2-bong.htm,,Hanil,Quạt sưởi,Đèn sưởi Hanil EH-809 2 bóng,490.000,,," . Công suất 800W có thể làm ấm nhanh chóng trong phạm vi từ 3m2 – 13m2. . Kiểu dáng nhỏ gọn không chiếm nhiều diện tích trong phòng. . Chế độ ngắt an toàn sẽ giúp bạn an tâm hơn khi sử dụng. . . . . . . Hình ảnh tham khảo: Đèn sưởi Hanil EH-809 2 bóng. . . . . . . . . . . . . . . Thông số kỹ thuật: Đèn sưởi Hanil EH-809 2 bóng. . . . . . . . . . Thông tin: Đèn sưởi Hanil EH-809 2 bóng. . . . Mang không khí ấm áp vào phòng. . Quạt sưởi ấm. Hanil EH-809. làm nhiệt bằng đèn Halogen sẽ giúp bạn xua tan không khí giá lạnh trong những ngày thời tiết không tốt. Với công suất 800W, máy có thể làm ấm nhanh chóng trong phạm vi từ 3m2 – 13m2.. . . Thiết kế thân thiện và an toàn. Kiểu dáng nhỏ gọn không chiếm nhiều diện tích trong phòng nhưng vẫn mang lại khả năng sưởi ấm hiệu quả. Chế độ ngắt an toàn sẽ giúp bạn an tâm hơn khi sử dụng.. . . . . . . . . . Tư Vấn Mua Quạt sưởi. . . . . . ",""""""
mediamart.vn,https://mediamart.vn/quatsuoi/tiross/quat-suoi-dau-tiross-ts-923.htm,,Tiross,Quạt sưởi,Máy sưởi dầu TIROSS TS-923 9 thanh,990.000,,," . - Công suất: 2000W. . - Quạt sưởi ấm được thiết kế với 9 thanh phát nhiệt. - 3 mức công suất thấp, vừa, cao, với dải điều chỉnh nhiệt độ rộng. - Không đốt cháy oxy, giữ cân bằng độ ẩm trong phòng.. . . . . Hình ảnh tham khảo: Máy sưởi dầu TIROSS TS-923 9 thanh. . . . . . . . . . . . . . . . . . Thông số kỹ thuật: Máy sưởi dầu TIROSS TS-923 9 thanh. . . . . . . . . . Thông tin: Máy sưởi dầu TIROSS TS-923 9 thanh. . . Hoạt động theo nguyên tắc thanh nhiệt. Máy hoạt động theo nguyên tắc thanh nhiệt là nguồn cung cấp nhiệt và dầu đóng vai trò là trung gian duy trì nhiệt và nhiệt được tỏa ra qua các thanh sưởi. Nhiệt độ trong phòng tăng lên nhờ vào sự lưu thông không khí trong phòng.. . . . . . . . Tỏa ra hơi ấm từ lượng dầu được đốt nóng. Sưởi dầu tiross 9 thanh TS-923 cho bạn cảm giác ấm áp trong mùa đông mà không sợ bị khô da hay cảm giác ấm nóng lan tỏa không đều trên cơ thể, máy sưởi dầu tỏa ra hơi ấm xuất phát từ lượng dầu có trong máy được đốt nóng.. . . . . . . Tự động điều chỉnh, cân đối nhiệt độ. Sưởi dầu tiross 9 thanh TS-923 Tự động điều chỉnh và cân đối nhiệt độ phòng, đảm bảo độ nóng vừa phải và đều đặn.. . . . . . . Bánh xe di chuyển dễ dàng. Sưởi dầu tiross 9 thanh TS-923 có chân đế bánh xe, chắc chắn và dễ di chuyển đến các vị trí khác nhau trong phòng. . . . . . . 3 mức công suất khác nhau. Sưởi dầu tiross 9 thanh TS-923 với 9 tấm sưởi cùng 3 mức công suất: thấp, vừa, cao, với dải điều chỉnh nhiệt độ rộng giúp sưởi ấm hiệu quả.. . . . . . . Có thể dùng để sấy khô quần áo. Sưởi dầu TS-923 có thể sấy khô quần áo trong ngày thời tiết ẩm hay mưa, đem lại cảm giác thật thơm tho sạch sẽ cho quần áo của bạn.. . . . . . . . . Chức năng bảo vệ quá nhiệt an toàn. Sưởi dầu TS-923 tỏa ra hơi ấm từ lượng dầu được đốt nóng, ngoài ra chức năng bảo vệ quá nhiệt giúp an toàn hơn khi sử dụng.. . . . . . . . . Kiểu dáng hiện đại, sang trọng. Sưởi dầu tiross 9 thanh TS-923 kiểu dáng thời trang, hiện đại, sang trọng, phù hợp với nhiều không gian khác nhau.. . . . . . . . . . Tư Vấn Mua Quạt sưởi. . . . . . ",""""""
mediamart.vn,https://mediamart.vn/quatsuoi/sunhouse/den-suoi-kohn-kukp02g-2-bong.htm,,Sunhouse,Quạt sưởi,Đèn sưởi nhà tắm Kohn KU/KP02G - 2 bóng,550.000,,," . Đèn sưởi nhà tắm 2 bóng, công suất 550W, treo tường. Diện tích phòng tắm 2 - 4 m². Kiểu đèn sưởi bóng vàng chống chói mắt. Không đốt cháy oxy, Khả năng chống nước IPX4, chống chập điện. . . . . Hình ảnh tham khảo: Đèn sưởi nhà tắm Kohn KU/KP02G - 2 bóng. . . . . . . . . . . . . . . Thông số kỹ thuật: Đèn sưởi nhà tắm Kohn KU/KP02G - 2 bóng. . . . . . . . . . Thông tin: Đèn sưởi nhà tắm Kohn KU/KP02G - 2 bóng. . . Kiểu dáng nhỏ gọn. Đèn sưởi phòng tắm Kohn-Braun KU/KP02G 2 bóng được thiết kế đẹp mắt, màu sắc trang nhã, thích hợp với diện tích phòng tắm 2-4 m2.. . . Bóng đèn mạ vàng. Đèn sưởi với 2 bóng đèn sưởi được bao phủ lớp mạ vàng giúp giảm độ chói sáng nhưng không làm giảm hiệu quả làm ấm.. . . Sưởi ấm bằng tia hồng ngoại. Đèn sưởi phòng tắm Kohn-Braun KU/KP02G 2 bóng sử dụng nguyên lý bức xạ hồng ngoại giúp đạt được nhiệt độ 30ºC trong 2-3 giây, sưởi ấm tức thì.. . . Công tắc riêng biệt. Đèn sưởi phòng tắm Kohn-Braun KU/KP02G 2 bóng trang bị 2 công tắc riêng biệt cho 2 bóng giúp bạn dễ dàng điều khiển riêng cho từng bóng.. . . An toàn cho sức khỏe. Đèn sưởi phòng tắm Kohn-Braun KU/KP02G 2 bóng có lợi cho sức khỏe, nhất là trẻ em trong những ngày mùa đông không có ánh sáng mặt trời.. . . Sử dụng đa năng. Đèn sưởi Kohn-Braun KU/KP02G 2 bóng có thể được lắp đặt, treo trong phòng tắm, phòng ngủ, phòng khách, bếp tùy thuộc vào nhu cầu sử dụng.. . . . . . Tư Vấn Mua Quạt sưởi. . . . . . ",""""""
mediamart.vn,https://mediamart.vn/quatsuoi/tiross/den-suoi-tiross-ts9291-550w.htm,,Tiross,Quạt sưởi,"Đèn sưởi nhà tắm Tiross TS9291, 2 bóng",390.000,,," . Đèn sưởi nhà tắm, 2 bóng, Công suất: 550W/2 bóng. Công tắc 2 bóng độc lập. Ứng dụng công nghệ làm nóng tiên tiến, không gây khô da. Thiết kế gọn nhẹ, sang trọng phù hợp với nhiều không gian sử dụng. . . . . Hình ảnh tham khảo: Đèn sưởi nhà tắm Tiross TS9291, 2 bóng. . . . . . . . . . . . . . . Thông số kỹ thuật: Đèn sưởi nhà tắm Tiross TS9291, 2 bóng. . . . . . . . . . Thông tin: Đèn sưởi nhà tắm Tiross TS9291, 2 bóng. . . Thiết kế đẹp mắt. Đèn sưởi nhà tắm TIROSS TS9291 kiểu dáng gọn, thiết kế đẹp mắt, đèn sưởi này làm cho không gian phòng tắm nhà bạn thêm sang trọng.. . . Không gây chói mắt. Bề mặt bóng hồng ngoại bao phủ lớp mạ vàng, có tác dụng bớt độ chói sáng, tăng độ ẩm mà không làm giảm hiệu quả làm ấm.. . . Làm ấm nhanh chóng. Đèn sưởi ấm sử dụng nguyên lý bức xạ hồng ngoại, giúp đạt được nhiệt độ 30ºC trong 2-3 giây. Bạn có thể tắm ngay sau khi bật đèn.. . . Không gây khô da. Bóng đèn hồng ngoại, không tạo ra cảm giác khô dacho bạn, không đốt cháy oxy, giảm các triệu chứng đau, sưng, phù nề, bầm,tím, khớp, gout, chứng căng thẳng, mệt mỏi.. . . 2 công tắc điều khiển. Thiết kế 2 công tắc đều khiển hai bóng hoạt động độc lập giúp người sử dụng dễ dàng điều chỉnh chế độ sáng.. . . . . . . Tư Vấn Mua Quạt sưởi. . . . . . ",""""""
mediamart.vn,https://mediamart.vn/quatsuoi/tiross/quat-suoi-tiross-ts928.htm,,Tiross,Quạt sưởi,"Quạt sưởi TIROSS TS928 có điều khiển, hẹn giờ",690.000,,," . Công suất: 1800W. . Quạt 2 chiều ceramic vừa sưởi ấm mùa đông, vừa làm mát mùa hè. Góc quay lên tới 90 độ giúp bạn có thể điều chỉnh quạt tỏa nhiệt theo ý muốn. . Chế độ hẹn giờ tắt tự động tắt quạt sưởi khi nhiệt độ đã ấm hơn, tiện lợi khi sử dụng. . . . . Hình ảnh tham khảo: Quạt sưởi TIROSS TS928 có điều khiển, hẹn giờ. . . . . . . . . . . . . . . Thông số kỹ thuật: Quạt sưởi TIROSS TS928 có điều khiển, hẹn giờ. . . . . . . . . . Thông tin: Quạt sưởi TIROSS TS928 có điều khiển, hẹn giờ. . . Thiết kế nhỏ gọn. . Sưởi ceramic hai chiều tiross TS928 thiết kế chắc chắn với kích thước nhỏ, không tốn diện tích và dễ dàng di chuyển.. . . Bảo vệ da. . Tiross TS928 sưởi ấm bằng cách đốt nóng thanh gốm nên không gây khô da, bảo vệ sức khỏe cho mọi thành viên từ trẻ nhỏ tới người già.. . . Tỏa nhiệt đều, làm ấm nhanh chóng. . Sưởi ceramic hai chiều tiross TS928 làm ấm không khí nhanh chóng, phạm vi phát nhiệt rộng, giúp người sử dụng cảm thấy ấm lên nhanh chóng, tỏa nhiệt đều trong không khí.. . . Góc quay 90 độ tiện lợi. . Sưởi ceramic hai chiều tiross TS928 với góc quay lên tới 90 độ giúp bạn có thể điều chỉnh quạt tỏa nhiệt đều trong cả phòng hoặc cho quạt sưởi một vị trí cố định.. . . Điều khiển từ xa thông minh. . Sưởi ceramic hai chiều tiross TS928 có điều khiển thông minh, hiện đại, dễ dàng điều chỉnh tăng giảm nhiệt độ thích hợp mà không cần di chuyển.. . . Chức năng hẹn giờ tự động. . Sưởi ceramic hai chiều tiross TS928 trang bị chế độ hẹn giờ tắt tự động tắt quạt sưởi khi nhiệt độ đã ấm hơn, tiện lợi khi sử dụng.. . . Tiết kiệm chi phí. . Sưởi ceramic hai chiều tiross TS928 với chế độ hoạt động bền bỉ, nhiều chức năng tiện ích giúp cắt giảm tối đa chi phí.. . . An toàn khi sử dụng. . Chức năng an toàn của sưởi ceramic hai chiều tiross TS928 sẽ giúp máy tự tắt nếu bị đổ mang lại sự an toàn khi sử dụng.. . . . . . Tư Vấn Mua Quạt sưởi. . . . . . ",""""""
mediamart.vn,https://mediamart.vn/quatsuoi/sunhouse/den-suoi-kohn-eco-kn03g-3-bong.htm,,Sunhouse,Quạt sưởi,Đèn sưởi nhà tắm Kohn ECO KN03G - 3 bóng,590.000,,," . Đèn sưởi nhà tắm 3 bóng, công suất 825W, treo tường. Diện tích phòng tắm 4 - 6 m². Kiểu đèn sưởi bóng vàng chống chói mắt. Không đốt cháy oxy, Khả năng chống nước IPX4, chống chập điện. . . . . Hình ảnh tham khảo: Đèn sưởi nhà tắm Kohn ECO KN03G - 3 bóng. . . . . . . . . . . . . . . Thông số kỹ thuật: Đèn sưởi nhà tắm Kohn ECO KN03G - 3 bóng. . . . . . . . . . Thông tin: Đèn sưởi nhà tắm Kohn ECO KN03G - 3 bóng. . . Kiểu dáng nhỏ gọn. Đèn sưởi phòng tắm Kohn-Braun KN03G 3 bóng được thiết kế đẹp mắt, màu sắc trang nhã, thích hợp với diện tích phòng tắm 4-6 m2.. . . Bóng đèn mạ vàng. Đèn sưởi với 3 bóng đèn sưởi được bao phủ lớp mạ vàng giúp giảm độ chói sáng nhưng không làm giảm hiệu quả làm ấm.. . . Sưởi ấm bằng tia hồng ngoại. Đèn sưởi phòng tắm Kohn-Braun KN03G 3 bóng sử dụng nguyên lý bức xạ hồng ngoại giúp đạt được nhiệt độ 30ºC trong 2-3 giây, sưởi ấm tức thì.. . . Công tắc riêng biệt. Đèn sưởi phòng tắm Kohn-Braun KN03G 3 bóng trang bị 2 công tắc riêng biệt cho 3 bóng giúp bạn dễ dàng điều khiển.. . . An toàn cho sức khỏe. Đèn sưởi phòng tắm Kohn-Braun KN03G 3 bóng có lợi cho sức khỏe, nhất là trẻ em trong những ngày mùa đông không có ánh sáng mặt trời.. . . Sử dụng đa năng. Đèn sưởi Kohn-Braun KN03G 3 bóng có thể được lắp đặt, treo trong phòng tắm, phòng ngủ, phòng khách, bếp tùy thuộc vào nhu cầu sử dụng.. . . . . . . Tư Vấn Mua Quạt sưởi. . . . . . ",""""""
