Domain,Url,Product_id,Brand,Category,Model,Price,Seller,Tags,Info,Others
mediamart.vn,https://mediamart.vn/quatsuoi/kangaroo/quat-suoi-3-bong-kangaroo-kg1018c.htm,,Kangaroo,Quạt sưởi,Quạt sưởi Kangaroo KG1018C - 2 bóng,349.000,,," . Quạt sưởi 2 bóng, Công suất 400/800W, Tản nhiệt bằng bóng halogen. Có lưới tản nhiệt thiết kế an toàn, phòng ngừa bỏng, giật.. Thiết kế núm vặn tròn dễ dàng điều chỉnh . Kích thước 365x180x390 cm. . . . . Hình ảnh tham khảo: Quạt sưởi Kangaroo KG1018C - 2 bóng. . . . . . . . . . . . . . . . . . Thông số kỹ thuật: Quạt sưởi Kangaroo KG1018C - 2 bóng. . . . . . . . . . Thông tin: Quạt sưởi Kangaroo KG1018C - 2 bóng. . . Thiết kế nhỏ gọn. Quạt sưởi Kangaroo KG1018C có thiết kế nhỏ với kích thước 365x180x390cm gọn thuận tiện cho không gian vừa nhỏ.. . . . . Lưới tản nhiệt an toàn. Quạt sưởi Kangaroo KG1018C có lưới tản nhiệt thiết kế an toàn, phòng ngừa bỏng, giật.. . . . . . Tản nhiệt bằng bóng Halogen. Quạt sưởi Kangaroo KG1018C tản nhiệt bằng 2 bóng halogen giúp căn phòng khoảng 15 m2 có thể ấm lên chỉ trong vài phút. Công suất vừa giúp tiết kiệm điện năng cho gia đình.. . . . . . Núm vặn điều chỉnh dễ dàng. Quạt sưởi Kangaroo KG1018C được thiết kế núm văn tròn cho bạn dễ dàng điều chỉnh chế độ nhanh chóng.. . . . . . . Tư Vấn Mua Quạt sưởi. . . . . . ",""""""
mediamart.vn,https://mediamart.vn/quatsuoi/goldsun/suoi-halogen-3-bong-goldsun-ghlh2001.htm,,Goldsun,Quạt sưởi,Sưởi halogen 3 bóng Goldsun GHLH-2001,499.000,,," . - Sưởi halogen loại 3 bóng. - Điều khiển cơ. - Diện tích sưởi ấm 6 - 10m2. - 3 mức công suất 400W/800W/1200W. - Điện Áp 220v, 50Hz. - Chế độ xoay. - Chế độ an toàn đổ tự ngắt. - Kích thước: 325*167*618 (cm). - Bảo hành 12 tháng- Sưởi halogen loại 3 bóng. - Điều khiển cơ. - Diện tích sưởi ấm 6 - 10m2. - 3 mức công suất 400W/800W/1200W. - Điện Áp 220v, 50Hz. - Chế độ xoay. - Chế độ an toàn đổ tự ngắt. - Kích thước: 325*167*618 (cm). - Bảo hành 12 tháng. . . . . Hình ảnh tham khảo: Sưởi halogen 3 bóng Goldsun GHLH-2001. . . . . . . . . . . . . . . Thông số kỹ thuật: Sưởi halogen 3 bóng Goldsun GHLH-2001. . . . . . . . . . Thông tin: Sưởi halogen 3 bóng Goldsun GHLH-2001. . . Công suất lớn. . Sưởi halogen 3 bóng Goldsun GHLH-2001 có 3 mức công suất khác nhau: 400W, 800W, 1200W cho bạn lựa chọn khi sử dụng. . . . . . . . . Tính năng quay đảo hướng phát nhiệt. . Có tính năng quay đảo hướng phát nhiệt giống như quạt giúp tỏa nhiệt đều ở xung quanh phòng và rất tiện lợi trong mùa đông.. . . . . . . Lưới tản nhiệt an toàn. . Sưởi halogen 3 bóng Goldsun GHLH-2001 có lưới tản nhiệt thiết kế an toàn, phòng ngừa bỏng, giật.. . . . . Phát nhiệt bằng bóng Halogen. . Sử dụng công nghệ phát nhiệt bằng bóng Halogen,giúp tỏa nhiệt nhanh, rất tiện lợi khi làm ấm phòng tắm.. . . . . Nhỏ gọn, an toàn. . Sưởi halogen 3 bóng Goldsun GHLH-2001 được thiết kế nhỏ gọn nên phù hợp cho các phòng có diện tích nhỏ. Sưởi halogen 3 bóng Goldsun GHLH-2001 tự động ngắt điện khi bị nghiêng đổ, an toàn chống cháy nổ.. . . . . . . Tư Vấn Mua Quạt sưởi. . . . . . ",""""""
mediamart.vn,https://mediamart.vn/quatsuoi/tiross/quat-suoi-dau-tiross-ts926.htm,,Tiross,Quạt sưởi,"Máy sưởi dầu TIROSS TS-926, 13 thanh, quạt thổi, giá phơi",2.380.000,,," . - Công suất: 2800W. . - Loại: 13 thanh, có giá phơi sấy quần áo, quạt. - Không đốt cháy oxy, giữ cân bằng độ ẩm trong phòng.. - Chức năng bảo vệ quá nhiệt, an toàn khi sử dụng. . . . . Hình ảnh tham khảo: Máy sưởi dầu TIROSS TS-926, 13 thanh, quạt thổi, giá phơi. . . . . . . . . . . . . . . Thông số kỹ thuật: Máy sưởi dầu TIROSS TS-926, 13 thanh, quạt thổi, giá phơi. . . . . . . . . . Thông tin: Máy sưởi dầu TIROSS TS-926, 13 thanh, quạt thổi, giá phơi. . . Tỏa ra hơi ấm từ lượng dầu được đốt nóng. . Máy sưởi dầu TIROSS TS926 có 13 thanh, quạt cho bạn cảm giác ấm áp trong mùa đông mà không sợ bị khô da hay cảm giác ấm nóng lan tỏa không đều trên cơ thể, máy tỏa ra hơi ấm xuất phát từ lượng dầu có trong máy được đốt nóng.. . . Máy được các bà mẹ mới sinh ưa chuộng. . Chính vì thế, máy sưởi dầu được các bà mẹ mới sinh ưa chuộng nhất bởi ngoài chức năng sưởi ấm, máy sưởi dầu còn thay thế chiếc bàn là làm khô tã hay khăn của bé sơ sinh một cách nhanh chóng.. . . Hoạt động theo nguyên tắc thanh nhiệt. . Máy sưởi dầu hoạt động theo nguyên tắc sau: Thanh nhiệt là nguồn cung cấp nhiệt và dầu đóng vai trò là trung gian duy trì nhiệt và nhiệt được tỏa ra qua các thanh sưởi. Nhiệt độ trong phòng tăng lên nhờ vào sự lưu thông không khí trong phòng.. . Thiết kế tiện lợi, an toàn. . Tiện lợi, an toàn, đẹp, dễ hoạt động và không gây ra nhiễu sóng… phù hợp với các vị trí như phòng nghiên cứu khoa học, bệnh viện, khách sạn, phòng tập và phòng ngủ…. Máy sưởi dầu sẽ giữ ấm cho căn phòng của bạn trong mùa đông giá lạnh.. . . . . . . Tư Vấn Mua Quạt sưởi. . . . . . ",""""""
mediamart.vn,https://mediamart.vn/quatsuoi/sunhouse/suoi-dau-11-thanh-sunhouse-shd7082-do-co-gian-phoi.htm,,Sunhouse,Quạt sưởi,Máy sưởi dầu Sunhouse SHD7082 - 11 thanh (Có giàn phơi),2.490.000,,," . Công suất 2500W, Cài đặt tự động 3 chế độ hóng. Cài đặt nhiệt độ Phòng (5-35 độ). Chức năng ECO, Thời gian hẹn giờ 9 tiếng. Bảo vệ khi quá nóng,Công tắc cảm ứng. . . . . Hình ảnh tham khảo: Máy sưởi dầu Sunhouse SHD7082 - 11 thanh (Có giàn phơi). . . . . . . . . . . . . . . Thông số kỹ thuật: Máy sưởi dầu Sunhouse SHD7082 - 11 thanh (Có giàn phơi). . . . . . . . . . Thông tin: Máy sưởi dầu Sunhouse SHD7082 - 11 thanh (Có giàn phơi). . . An toàn với chức năng bảo vệ khi quá nhiệt. . An toàn với chức năng bảo vệ khi quá nhiệt. Sử dụng nguyên liệu dầu tốt nhất, Máy sưởi dầu Sunhouse SHD7082 với thời gian sử dụng lên đến 10 năm.. . . Hoạt động theo nguyên tắc thanh nhiệt. . Máy sưởi dầu Sunhouse SHD7082 có công suất 2500W với 11 tấm sưởi giúp làm ấm nhanh chóng.. . . Thiết kế tiện lợi, an toàn. . Tiện lợi với 3 chế độ lựa chọn công suất, khóa an toàn và chân để có bánh xe giúp di chuyển dễ dàng. Tiện lợi với nút điều khiển bằng cơ dễ dàng khi sử dụng.. . . . . . . Tư Vấn Mua Quạt sưởi. . . . . . ",""""""
mediamart.vn,https://mediamart.vn/quatsuoi/sunhouse/suoi-dien-ceramic-sunhouse-shd7073.htm,,Sunhouse,Quạt sưởi,Quạt sưởi điện Ceramic Sunhouse SHD7073,2.490.000,,," . Sưởi gốm PTC, công suất 1100/2000W. Điều khiển nhiệt độ kỹ thuật số từ 5℃-35 ℃, Có cánh quạt, hẹn giờ 12h,. Có điều khiển từ xa,cảm biến nghiêng, Dễ mang vác, Đề nhựa có thể tháo rời. Kích thước: L250*W250*H800(mm). . . . . Hình ảnh tham khảo: Quạt sưởi điện Ceramic Sunhouse SHD7073. . . . . . . . . . . . . . . . . . . . . . . . . . . Thông số kỹ thuật: Quạt sưởi điện Ceramic Sunhouse SHD7073. . . . . . . . . . Thông tin: Quạt sưởi điện Ceramic Sunhouse SHD7073. . . . Sưởi gốm PTC, công suất 1100/2000W. Kích thước: L250*W250*H800(mm). Điều khiển điện tử. Điều khiển nhiệt độ kỹ thuật số từ 5℃ to 35 ℃, Có cánh quạt, hẹn giờ 12h,. . Có điều khiển từ xa.. Cảm biến nghiêng, Dễ mang vác,. Đế nhựa có thể tháo rời. . . . . . Tư Vấn Mua Quạt sưởi. . . . . . ",""""""
mediamart.vn,https://mediamart.vn/quatsuoi/goldsun/suoi-halogen-3-bong-goldsun-ghlh2002-1200w.htm,,Goldsun,Quạt sưởi,Sưởi halogen 3 bóng Goldsun GHLH-2002 1200W,489.000,,," . - Điều khiển cơ. - Điều khiển cơ. - Diện tích sưởi ấm 6 - 10m2. - 3 mức công suất 400W/800W/1200W. - Điện Áp 220v, 50Hz. - Chế độ xoay. - Chế độ an toàn đổ tự ngắt. - Kích thước: 350*195*548 (cm). - Bảo hành 12 tháng. . . . . Hình ảnh tham khảo: Sưởi halogen 3 bóng Goldsun GHLH-2002 1200W. . . . . . . . . . . . . . . Thông số kỹ thuật: Sưởi halogen 3 bóng Goldsun GHLH-2002 1200W. . . . . . . . . . Thông tin: Sưởi halogen 3 bóng Goldsun GHLH-2002 1200W. . . Công suất lớn. . Sưởi halogen 3 bóng Goldsun GHLH-2002 có 3 mức công suất khác nhau: 400W, 800W, 1200W cho bạn lựa chọn khi sử dụng. . . . . . . . . Tính năng quay đảo hướng phát nhiệt. . Có tính năng quay đảo hướng phát nhiệt giống như quạt giúp tỏa nhiệt đều ở xung quanh phòng và rất tiện lợi trong mùa đông.. . . . . . . Lưới tản nhiệt an toàn. . Sưởi halogen 3 bóng Goldsun GHLH-2002có lưới tản nhiệt thiết kế an toàn, phòng ngừa bỏng, giật.. . . . . Phát nhiệt bằng bóng Halogen. . Sử dụng công nghệ phát nhiệt bằng bóng Halogen,giúp tỏa nhiệt nhanh, rất tiện lợi khi làm ấm phòng tắm.. . . . . Nhỏ gọn, an toàn. . Sưởi halogen 3 bóng Goldsun GHLH-2002 được thiết kế nhỏ gọn nên phù hợp cho các phòng có diện tích nhỏ. Sưởi halogen 3 bóng Goldsun GHLH-2002 tự động ngắt điện khi bị nghiêng đổ, an toàn chống cháy nổ.. . . . . . . Tư Vấn Mua Quạt sưởi. . . . . . ",""""""
mediamart.vn,https://mediamart.vn/quatsuoi/kangaroo/den-suoi-kangaroo-kg247-2-bong.htm,,Kangaroo,Quạt sưởi,"Đèn sưởi nhà tắm Kangaroo KG247, 2 bóng",645.000,,," . Công suất 550W. . Sử dụng nguyên lý bức xạ hồng ngoại giúp không khí ấm lên trong vòng 2-3 giây. . Công nghệ và thiết kế Australia, Chứng nhận sản phẩm đạt chuẩn Châu Âu RoHS. . Màu sắc trang nhã phù hợp với mọi không gian nhà tắm. . . . . Hình ảnh tham khảo: Đèn sưởi nhà tắm Kangaroo KG247, 2 bóng. . . . . . . . . . . . . . . Thông số kỹ thuật: Đèn sưởi nhà tắm Kangaroo KG247, 2 bóng. . . . . . . . . . Thông tin: Đèn sưởi nhà tắm Kangaroo KG247, 2 bóng. . . Thiết kế treo tường tiện lợi. Đèn sưởi nhà tắm Kangaroo KG247 được thiết kế treo tường với góc treo phù hợp để tăng tối đa hiệu quả làm ấm. Màu sắc trang nhã phù hợp với mọi không gian nhà tắm giúp không gian nhà tắm sang trọng hơn.. . . Bóng đèn mạ vàng. Bóng đèn sưởi được phủ lớp mạ vàng giúp làm giảm độ chói sáng nhưng không làm giảm hiệu quả làm ấm, ánh đèn vàng với bức xạ hồng ngoại không làm ảnh hưởng đến mắt, da.. . . Mỗi bóng đèn đều có công tắc riêng biệt. Đèn sưởi KANGAROO KG247 2 bóng, mỗi bóng đèn đều có công tắc riêng biệt và có nắp đậy chống nước đảm bảo an toàn khi sử dụng.. . . Sưởi ấm bằng tia hồng ngoại. Chức năng sưởi ấm bằng bóng đèn sử dụng nguyên lý bức xạ hồng ngoại giúp đạt nhiệt độ 30°C trong 2-3 giây.. . . Tốt cho sức khỏe. Đèn không tạo ra cảm giác khô da, không đốt cháy oxy và giảm các triệu chứng đau, phù nề, bầm tím, khớp, giảm chứng căng thẳng, mệt mỏi…có lợi cho sức khỏe nhất là đối với trẻ em, người già.. . . Có thể lắp đặt ở phòng khách, phòng ngủ. Ngoài lắp trong phòng tắm thì đèn sưởi KANGAROO KG247 có thể được lắp đặt treo trong phòng ngủ, phòng khách, bếp tùy thuộc vào nhu cầu sử dụng.. . . . . . . Tư Vấn Mua Quạt sưởi. . . . . . ",""""""
mediamart.vn,https://mediamart.vn/quatsuoi/sunhouse/quat-suoi-dien-ceramic-sunhouse-shd7075.htm,,Sunhouse,Quạt sưởi,Quạt sưởi điện Ceramic Sunhouse SHD7075,2.890.000,,," . Công suất 1200/2000W, Công suất tạo ẩm: 300ml/h, Bình tích nước: 1.6L. Có chế độ phun ẩm, tạo không khí dễ chịu, không khô da. Nút điều khiển điện tử, hẹn giờ 12h, có điều khiển từ xa. Có bộ lọc chống bụi, cảm biến nghiêng. . . . . Hình ảnh tham khảo: Quạt sưởi điện Ceramic Sunhouse SHD7075. . . . . . . . . . . . . . . . . . . . . Thông số kỹ thuật: Quạt sưởi điện Ceramic Sunhouse SHD7075. . . . . . . . . . Thông tin: Quạt sưởi điện Ceramic Sunhouse SHD7075. . . . Màn hình Led. . Quạt Sưởi Điện Ceramic Sunhouse SHD7075 được trang bị màn hình Led sáng giúp bạn dễ dàng quan sát và điều chỉnh quạt. Ngoài ra quạt có chế độ đảo chiều giúp hơi ấm lan tỏa khắp căn phòng của bạn.. . . Tính năng phun sương tạo ẩm. . Quạt sưởi điện Ceramic Sunhouse tích hợp hệ thống phun sương tránh tình trạng đèn nóng làm khô da, hơn nữa quạt còn có công nghệ sưởi không đốt cháy Oxi, giữ ấm cho da rất an toàn.. . . . Công suất 1300-2000W. . Quạt Sưởi Điện Ceramiccó công suất 1300-2000W khả lớn giúp làm ấm căn phòng của bạn nhanh chóng với tốc độ làm nóng nhanh, tỏa nhiệt đều.. . . . Chế độ hẹn giờ. . Quạt sưởi điện Ceramic SHD7075 có chế độ hẹn giờ tiện dụng lên đến 12 tiếng giúp bạn dễ dàng cài đặt thời gian phù hợp tùy theo nhu cầu sử dụng, hơn nữa chế độ Eco tiết kiệm năng lượng, giúp bạn tiết kiệm điện năng khá nhiều.. . . . . Lưới tản nhiệt an toàn. . Quạt sưởi điện Ceramic Sunhouse có lưới tản nhiệt thiết kế an toàn, phòng ngừa bỏng, giật. Ngoài ra quạt có chế độ ngắt điện khi quạt bị nghiêng hay đổ và hoạt động trở lại bình thường. . . . . Phát nhiệt bằng bóng Halogen. . Sunhouse SHD7075 sử dụng công nghệ phát nhiệt bằng bóng Halogen, giúp tỏa nhiệt nhanh, rất tiện lợi khi làm ấm phòng tắm, hơn nữa đèn thạch anh chống chói mắt, giúp bé yêu ngủ ngon hơn.. . . . . . . Tư Vấn Mua Quạt sưởi. . . . . . ",""""""
mediamart.vn,https://mediamart.vn/quatsuoi/sunhouse/den-suoi-3-bong-sunhouse-shd3813.htm,,Sunhouse,Quạt sưởi,Đèn sưởi nhà tắm Sunhouse SHD3813 - 3 bóng,690.000,,," . Đèn sưởi nhà tắm 3 bóng, 825W, Diện tích sử dụng 7 - 10 (m2). Công nghệ sưởi không đốt cháy Oxi, giữ ấm cho da . Sử dụng an toàn chống nước IPX4, chống chập điện . Công tắc độc lập dễ dàng điều chỉnh nhiệt độ , tiết kiệm điện năng chỉ 150đ/lần sử . . . . . Hình ảnh tham khảo: Đèn sưởi nhà tắm Sunhouse SHD3813 - 3 bóng. . . . . . . . . . . . . . . Thông số kỹ thuật: Đèn sưởi nhà tắm Sunhouse SHD3813 - 3 bóng. . . . . . . . . . Thông tin: Đèn sưởi nhà tắm Sunhouse SHD3813 - 3 bóng. . . Thiết kế bắt mắt. Đèn Sưởi Phòng Tắm Sunhouse SHD3813 được thiết kế bắt với văn hoa sang trọng tô điểm thêm vẻ sang trọng cho phòng tắm nhà bạn. Ngoài ra là một vật dụng rất cần thiết vào trời đông giá rét những tia sáng sẽ sưởi ấm cho bạn và gia đình.. . . Sưởi ấm bằng tia hồng ngoại. Đèn sưởi nhà tắm sưởi ấm tức thì bằng tia hồng ngoại ngay sau khi bật nên sẽ không tốn nhiều thời gian chờ đợi làm ấm phòng tắm. Đặc biệt với tia hồng ngoại người già không còn bệnh xương khớp, trẻ nhỏ phát triển tốt hấp thu chất dinh dưỡng tốt hơn khi không có mặt trời.. . . Tiết kiệm điện năng. Đèn sưởi phòng tắm Sunhouselàm ấm nhanh chóng với 3 bóng vàng giảm chói, ấm ngay từ những lần bật đầu tiên, mỗi bóng có công suất lên đến 275W đạt 825W. Sử dụng rất tiến kiệm điện mỗi lần bạn tắm chỉ mất có 150 đồng.. . . Đảm bảo cho sức khỏe. Đèn sưởi không tạo ra cảm giác khô da, không đốt cháy oxy và giảm các triệu chứng đau, mệt mỏi…có lợi cho sức khỏe nhất là đối với trẻ em, người già, nhất là trẻ em trong những ngày mùa đông không có ánh sáng mặt trời.. . . . . . Tư Vấn Mua Quạt sưởi. . . . . . ",""""""
mediamart.vn,https://mediamart.vn/quatsuoi/sunhouse/quat-suoi-halogen-sunhouse-shd7016.htm,,Sunhouse,Quạt sưởi,Quạt sưởi Halogen Sunhouse SHD7016,439.000,,," . Tốc độ làm nóng nhanh, tỏa nhiệt đều. Giữ lượng oxy, không gây khó thở và khô da. Lưới tản nhiệt, chống chói mắt. Có chế độ ngắt điện khi quạt bị nghiêng hay đổ và hoạt động trở lại bình thường. . . . . Hình ảnh tham khảo: Quạt sưởi Halogen Sunhouse SHD7016. . . . . . . . . . . . . . . Thông số kỹ thuật: Quạt sưởi Halogen Sunhouse SHD7016. . . . . . . . . . Thông tin: Quạt sưởi Halogen Sunhouse SHD7016. . . Công suất lớn. . Quạt sưởi Halogen Sunhouse SHD7016 có 3 mức công suất khác nhau: 400W, 800W, 1000W cho bạn lựa chọn khi sử dụng. . . . . . . . . Tính năng quay đảo hướng phát nhiệt. . Có tính năng quay đảo hướng phát nhiệt giống như quạt giúp tỏa nhiệt đều ở xung quanh phòng và rất tiện lợi trong mùa đông.. . . . . . . Lưới tản nhiệt an toàn. . Quạt sưởi Halogen Sunhouse SHD7016 có lưới tản nhiệt thiết kế an toàn, phòng ngừa bỏng, giật.. . . . . Phát nhiệt bằng bóng Halogen. . Sử dụng công nghệ phát nhiệt bằng bóng Halogen,giúp tỏa nhiệt nhanh, rất tiện lợi khi làm ấm phòng tắm.. . . . . Nhỏ gọn, an toàn. . Quạt sưởi Halogen Sunhouse SHD7016 được thiết kế nhỏ gọn nên phù hợp cho các phòng có diện tích nhỏ. Quạt sưởi Halogen Sunhouse SHD7016 tự động ngắt điện khi bị nghiêng đổ, an toàn chống cháy nổ.. . . . . . . Tư Vấn Mua Quạt sưởi. . . . . . ",""""""
mediamart.vn,https://mediamart.vn/quatsuoi/korihome/may-suoi-thap-korihome-ehk-101-s.htm,,KORIHOME,Quạt sưởi,Máy sưởi tháp KORIHOME EHK-101-S,3.400.000,,," . - Công suất hoạt động 1600~2500W. . - Điều khiển cảm ứng điện. . - Kiểm soát nhiệt độ kỹ thuật số từ 15oC đến 28oC. . - Quay 90o, 12h hẹn giờ, điều khiển từ xa. . . . . Hình ảnh tham khảo: Máy sưởi tháp KORIHOME EHK-101-S. . . . . . . . . . . . . . . Thông số kỹ thuật: Máy sưởi tháp KORIHOME EHK-101-S. . . . . . . . . . Thông tin: Máy sưởi tháp KORIHOME EHK-101-S. . . Đặc điểm nổi bật của Quạt sưởi KORIHOME - EHK-101-S. . . Kiểu dáng hiện đại. . Quạt sưởi KORIHOME - EHK-101-S với thiết kế dạng cây đứng thẳng sang trọng, lịch lãm, phù hợp với không gian hiện đại.. . . Kiểm soát nhiệt độ kỹ thuật số từ 15oC đến 28oC. . Quạt sưởi KORIHOME - EHK-101-S kiểm soát nhiệt độ bằng kỹ thuật số từ 15oC đến 28oC giúp không lo quá nóng hoặc quá lạnh.. . . Cửa tản nhiệt nhôm cao cấp. . Quạt sưởi KORIHOME - EHK-101-S có cửa tản nhiệt bằng nhôm cao cấp đảm bảo độ bền khi hoạt động.. . . Điều khiển từ xaQuạt sưởi KORIHOME - EHK-101-S có điều khiển cảm ứng điện từ xa thuận tiện khi sử dụng.. . . Màn hình LED hiển thị. . Quạt sưởi KORIHOME - EHK-101-S sử dụng màn hình LED hiển thị thuận lợi cho sử dụng và điều chỉnh nhiệt độ.. . . Chế độ tự ngắt khi máy bị đổ. . Quạt sưởi KORIHOME - EHK-101-S tự động ngắt điện khi bị nghiêng đổ, an toàn chống cháy nổ.. . . Công suất hoạt động 1600~2500W. . Quạt sưởi KORIHOME - EHK-101-S có công suất hoạt động 100 - 2500W đảm bảo cung cấp đủ hơi ấm cho gia đình bạn trong mùa đông.. . . . . . Tư Vấn Mua Quạt sưởi. . . . . . ",""""""
mediamart.vn,https://mediamart.vn/quatsuoi/tiross/quat-suoi-dau-tiross-ts926-1.htm,,Tiross,Quạt sưởi,Máy sưởi dầu TIROSS TS926-1 13 thanh,1.890.000,,," . - Công suất: 2300W-2700W. . - Không đốt cháy oxy, giữ cân bằng độ ẩm trong phòng.. . - Chức năng bảo vệ quá nhiệt, an toàn khi sử dụng. . - Tỏa ra hơi ấm từ lượng dầu được đốt nóng. . . . . Hình ảnh tham khảo: Máy sưởi dầu TIROSS TS926-1 13 thanh. . . . . . . . . . . . . . . Thông số kỹ thuật: Máy sưởi dầu TIROSS TS926-1 13 thanh. . . . . . . . . . Thông tin: Máy sưởi dầu TIROSS TS926-1 13 thanh. . . Tỏa ra hơi ấm từ lượng dầu được đốt nóng. . Máy sưởi dầu TIROSS TS926-1 có 13 thanh, quạt cho bạn cảm giác ấm áp trong mùa đông mà không sợ bị khô da hay cảm giác ấm nóng lan tỏa không đều trên cơ thể, máy tỏa ra hơi ấm xuất phát từ lượng dầu có trong máy được đốt nóng.. . . . . Máy được các bà mẹ mới sinh ưa chuộng. . Chính vì thế, máy sưởi dầu được các bà mẹ mới sinh ưa chuộng nhất bởi ngoài chức năng sưởi ấm, máy sưởi dầu còn thay thế chiếc bàn là làm khô tã hay khăn của bé sơ sinh một cách nhanh chóng.. . . . . . . . . Hoạt động theo nguyên tắc thanh nhiệt. . Máy sưởi dầu hoạt động theo nguyên tắc sau: Thanh nhiệt là nguồn cung cấp nhiệt và dầu đóng vai trò là trung gian duy trì nhiệt và nhiệt được tỏa ra qua các thanh sưởi. Nhiệt độ trong phòng tăng lên nhờ vào sự lưu thông không khí trong phòng.. . . . . . . . . Thiết kế tiện lợi, an toàn. . Tiện lợi, an toàn, đẹp, dễ hoạt động và không gây ra nhiễu sóng… phù hợp với các vị trí như phòng nghiên cứu khoa học, bệnh viện, khách sạn, phòng tập và phòng ngủ…. Máy sưởi dầu sẽ giữ ấm cho căn phòng của bạn trong mùa đông giá lạnh.. . . . . . . . . Tư Vấn Mua Quạt sưởi. . . . . . ",""""""
mediamart.vn,https://mediamart.vn/quatsuoi/tiross/may-suoi-dau-tiross-ts9215-15-thanh-man-hinh-led-hen-gio-dieu-khien-gia-phoi.htm,,Tiross,Quạt sưởi,"Máy sưởi dầu Tiross TS9215 15 thanh, màn hình LED, hẹn giờ, điều khiển, giá phơi",2.690.000,,," . Công suất 2200W cùng với 15 thanh nhiệt giúp không khí được làm ấm nhanh chóng. Tích hợp giá phơi và hộp để nước thơm tiện dụng. Chế độ giành riêng cho người già và trẻ nhỏ. . . . . Hình ảnh tham khảo: Máy sưởi dầu Tiross TS9215 15 thanh, màn hình LED, hẹn giờ, điều khiển, giá phơi. . . . . . . . . . . . . . . Thông số kỹ thuật: Máy sưởi dầu Tiross TS9215 15 thanh, màn hình LED, hẹn giờ, điều khiển, giá phơi. . . . . . . . . . Thông tin: Máy sưởi dầu Tiross TS9215 15 thanh, màn hình LED, hẹn giờ, điều khiển, giá phơi. . . . Hoạt động theo nguyên tắc thanh nhiệt. 15 thanh nhiệt của máy là nguồn cung cấp nhiệt và dầu đóng vai trò là trung gian duy trì nhiệt và nhiệt được tỏa ra qua các thanh sưởi. Nhiệt độ trong phòng tăng lên nhờ vào sự lưu thông không khí trong phòng.. . . Máy sử dụng nguyên liệu dầu. Máy Sưởi dầu TIROSS sử dụng nhiên liệu là dầu, tuy nhiên trong quá trình sử dụng hoàn toàn không phải thay thế dầu vì máy có chức năng xoay vòng nhiên liệu. Chỉ việc cắm điện và sử dụng.. . . Có hẹn giờ tự động, điều khiển từ xa. TIROSS TS9213 có chế độ hẹn giờ tự động, điều khiển từ xa, thuận tiện cho người sử dụng không phải di chuyển. Chế độ hẹn giờ tự động khi đã đủ nhiệt độ cần thiết phục vụ nhu cầu mang lại sự tiện lợi nhất cho người dùng.. . . Thiết kế tiện lợi, an toàn. Máy sưởi dầu TIROSS tiện lợi, an toàn có bánh xe tiện di chuyển, có giá phơi đi kèm để bạn có thể sấy quần áo và có chế độ tạo ẩm làm cân bằng độ ẩm không khí.. . . Màn hình LCD hiển thị thông tin. Máy sưởi dầu có màn hình LCD thông minh hiển thị thông tin, nhiệt độ để người dùng dễ dàng kiểm soát nhiệt độ theo yêu cầu.. . . An toàn cho người già và trẻ nhỏ. Máy sưởi dầu TIROSS khá an toàn cho gia đình bởi không gây khô da, khó thở an toàn cho trẻ nhỏ và người già.. . . . . . . Tư Vấn Mua Quạt sưởi. . . . . . ",""""""
