Domain,Url,Product_id,Brand,Category,Model,Price,Seller,Tags,Info,Others
mediamart.vn,https://mediamart.vn/quatsuoi/midea/quat-suoi-2-bong-nk-media-snv3.htm,,Midea,Quạt sưởi,Quạt sưởi 2 bóng NK Media SNV3,189.000,,," . - Chất liệu nhựa cứng ABS chịu nhiệt, siêu bền không bị biến dạng. . - 2 bóng sưởi ra nhiệt 400 W – 800W, tiết kiệm 50% điện năng. . - Tốc độ làm nóng không gian nhanh, toả nhiệt đều. . - Công nghệ sưởi ấm an toàn, không đốt cháy oxy, không gây khô da. . . . . Hình ảnh tham khảo: Quạt sưởi 2 bóng NK Media SNV3. . . . . . . . . . . . . . . Thông số kỹ thuật: Quạt sưởi 2 bóng NK Media SNV3. . . . . . . . . . Thông tin: Quạt sưởi 2 bóng NK Media SNV3. . . Sưởi ấm bằng tia hồng ngoại. . Quạt sưởi 2 bóng NK Midea SNV3 với các tính năng sưởi ấm tức thì bằng tia hồng ngoại ngay sau khi bật nên sẽ không tốn nhiều thời gian cho việc phải chờ đợi làm ấm phòng tắm.. . . . . . . Có thể lắp đặt ở phòng khách, phòng ngủ. . Ngoài lắp trong phòng tắm thì quạt sưởi 2 bóng NK Midea SNV3 có thể được lắp đặt treo trong phòng ngủ, phòng khách, bếp tùy thuộc vào nhu cầu sử dụng,tiện dụng.. . . . . . . Thiết kế tiện lợi. . Quạt sưởi 2 bóng NK Midea SNV3 thiết kế có hai công tắc điều khiển riêng biệt cho hai bóng nên có thể tùy chỉnh dễ dàng như ý muốn và tiết kiệm điện năng.. . . . . . . Không gây khô da. . Quạt sưởi 2 bóng NK Midea SNV3 không tạo ra cảm giác khô da, không đốt cháy oxy và giảm các triệu chứng đau, sưng, phù nề, bầm tím, khớp, gout, giảm chứng căng thẳng, mệt mỏi….. . . . . . . . . Tư Vấn Mua Quạt sưởi. . . . . . ",""""""
mediamart.vn,https://mediamart.vn/quatsuoi/nonan/quat-suoi-dau-nonan-13-thanh-sd-03.htm,,Nonan,Quạt sưởi,Máy sưởi dầu NONAN SD-03 13 thanh,990.000,,," . Công suất max : 2500W. . Có chân đế bánh xe, chắc chắn và dễ di chuyển đến các vị trí khác nhau trong phòng. . Tỏa ra hơi ấm xuất phát từ lượng dầu có trong máy được đốt nóng. . Có bộ phận điều chỉnh và cân đối nhiệt đảm bảo độ nóng vừa phải. . . . . Hình ảnh tham khảo: Máy sưởi dầu NONAN SD-03 13 thanh. . . . . . . . . . . . . . . Thông số kỹ thuật: Máy sưởi dầu NONAN SD-03 13 thanh. . . . . . . . . . Thông tin: Máy sưởi dầu NONAN SD-03 13 thanh. . . Thiết kế tiện lợi. . Tấm sưởi của máy sưởi dầu Nonan SD-03 có chân đế bánh xe, chắc chắn và dễ di chuyển đến các vị trí khác nhau trong phòng. Dầu được đốt trong các ống kín, không tạo ra mùi khó chịu hay mùi khét như các loại máy sưởi khác. Bên cạnh chức năng sưởi ấm phòng trong mùa đông, chiếc máy sưởi dầu còn có thể làm nhiệm vụ của một chiếc máy sấy khô quần áo trong ngày thời tiết ẩm hay mưa, đem lại cảm giác thật thơm tho sạch sẽ cho quần áo của bạn.. . . Công năng tuyệt vời. . Máy sưởi dầu hiện đại cho bạn cảm giác ấm áp trong mùa đông mà không sợ bị khô da hay cảm giác ấm nóng lan tỏa không đều trên cơ thể. Không như các loại máy sưởi khác sử dụng sợi đốt hay đèn Halogen, máy sưởi dầu tỏa ra hơi ấm xuất phát từ lượng dầu có trong máy được đốt nóng.Chính vì thế, máy sưởi dầu được các bà mẹ mới sinh ưa chuộng nhất bởi ngoài chức năng sưởi ấm, máy sưởi dầu còn thay thế chiếc bàn là làm khô tã hay khăn của bé sơ sinh một cách nhanh chóng.. . . Thân thiện vời mẹ và bé. . Nếu như các loại máy sưởi khác đốt nóng không khí xung quanh, làm nóng rất nhanh nhưng lại khiến cho da bạn bị rát và khô, máy sưởi dầu làm ấm nóng dần dần, bạn sẽ mất khoảng 15-20 phút để cảm nhận được hơi ấm lan tỏa xung quanh mình. Hơn thế nữa, máy có bộ phận điều chỉnh và cân đối nhiệt đảm bảo độ nóng vừa phải, đều đặn. Bởi thế rất thích hợp cho các bà mẹ và bé mới sinh.. . . . . . . Tư Vấn Mua Quạt sưởi. . . . . . ",""""""
mediamart.vn,https://mediamart.vn/quatsuoi/kangaroo/den-suoi-3-bong-kangaroo-kg252a.htm,,Kangaroo,Quạt sưởi,"Đèn sưởi nhà tắm Kangaroo KG252A, 3 bóng",590.000,,," . - Bóng đèn mạ vàng chống chói mắt. . - Sử dụng nguyên lý bức xạ hồng ngoại giúp không khí ấm lên trong vòng 2-3 giây. . - Công nghệ và thiết kế Australia. . - Đạt chứng nhận đạt tiêu chuẩn sản phẩm an toàn chất lượng của Australia SAA. . . . . Hình ảnh tham khảo: Đèn sưởi nhà tắm Kangaroo KG252A, 3 bóng. . . . . . . . . . . . . . . Thông số kỹ thuật: Đèn sưởi nhà tắm Kangaroo KG252A, 3 bóng. . . . . . . . . . Thông tin: Đèn sưởi nhà tắm Kangaroo KG252A, 3 bóng. . . * Đặc điểm nổi bật của. Đèn sưởi nhà tắm Kangaroo KG252A. . Thiết kế treo tường tiện lợi. . Đèn sưởi nhà tắm Kangaroo KG252A được thiết kế treo tường với góc treo phù hợp để tăng tối đa hiệu quả làm ấm. Màu sắc trang nhã phù hợp với mọi không gian nhà tắm giúp không gian nhà tắm sang trọng hơn.. . . . . Bóng đèn mạ vàng. . Bóng đèn sưởi được phủ lớp mạ vàng giúp làm giảm độ chói sáng nhưng không làm giảm hiệu quả làm ấm, ánh đèn vàng với bức xạ hồng ngoại không làm ảnh hưởng đến mắt, da.. . . . . . . Mỗi bóng đèn đều có công tắc riêng biệt. . Đèn sưởi nhà tắm KANGAROO 3 bóng, mỗi bóng đèn đều có công tắc riêng biệt và có nắp đậy chống nước đảm bảo an toàn khi sử dụng.. . . . . . . Sưởi ấm bằng tia hồng ngoại. . Chức năng sưởi ấm bằng bóng đèn sử dụng nguyên lý bức xạ hồng ngoại giúp đạt nhiệt độ 30°C trong 2-3 giây.. . . . . . . Tốt cho sức khỏe. . Đèn không tạo ra cảm giác khô da, không đốt cháy oxy và giảm các triệu chứng đau, phù nề, bầm tím, khớp, giảm chứng căng thẳng, mệt mỏi…có lợi cho sức khỏe nhất là đối với trẻ em, người già.. . . . . . . Có thể lắp đặt ở phòng khách, phòng ngủ. . Ngoài lắp trong phòng tắm thì đèn sưởi nhà tắm KANGAROO KG252A có thể được lắp đặt treo trong phòng ngủ, phòng khách, bếp tùy thuộc vào nhu cầu sử dụng.. . . . . . . . Tư Vấn Mua Quạt sưởi. . . . . . ",""""""
mediamart.vn,https://mediamart.vn/quatsuoi/hanil/quat-suoi-hanil-eh-600.htm,,Hanil,Quạt sưởi,Quạt sưởi Hanil EH-600,490.000,,," . - Làm nóng bằng 2 bóng halogen.. . - Điều chỉnh góc sưởi (5 độ, 15 độ, 25 độ).. . - Chế độ ngắt an toàn.. . - Công suất: 300W/600W.. . . . . Hình ảnh tham khảo: Quạt sưởi Hanil EH-600. . . . . . . . . . . . . . . . . . . . . Thông số kỹ thuật: Quạt sưởi Hanil EH-600. . . . . . . . . . Thông tin: Quạt sưởi Hanil EH-600. . . Thông tin: Quạt sưởi Hanil EH-600. . . Đặc điểm nổi bật của Sưởi Hanil EH-600 nóng bằng bóng Halogen 600W, 2 bóng. . . Thiết kế hiện đại, phù hợp mọi không gian. . Được thiết kế với hình dáng nhỏ gọn, dễ cất đặt, di chuyển trong mọi không gian gia đình. Là sản phẩm tiện dụng cho mọi nhà trong thời tiết lạnh của mùa đông. . . Hiệu quả và an toàn. . Với công suất lên tới 600W giúp xua tan cái lạnh giá mùa đông. An toàn khi sử dụng mà không hại sức khỏe: Không lo chập cháy, hay bị ô nhiễm khí độc Cacbon như sưởi ấm bằng than. . . Khả năng tỏa ấm đều. . Với khả năng điều chỉnh các góc độ sưởi (5 độ, 15 độ, 25 độ), hơi ấm sẽ được tỏa đều khắp phòng, đảm bảo đem lại giấc ngủ an lành cho bạn và gia đình. Bên cạnh đó chức năng tự ngắt an toàn càng khiến bạn yên tâm hơn khi sử dụng. . . . . . . . . Tư Vấn Mua Quạt sưởi. . . . . . ",""""""
mediamart.vn,https://mediamart.vn/quatsuoi/hanil/quat-suoi-hanil-ehv-1000bl-cs-1100w.htm,,Hanil,Quạt sưởi,Quạt sưởi Hanil EHV-1000BL,990.000,,," . Kiểu dáng nhỏ gọn, thời trang, chân đế vững chắc, dễ dàng tháo rời. . 2 mức công suất 550W/1100W cho bạn tha hồ lựa chọn mức độ làm ấm nhanh chóng. . Chế độ tự động ngắt khi nhiệt độ quá nóng, bạn và gia đình sẽ luôn cảm thấy an toàn. . . . . . . Hình ảnh tham khảo: Quạt sưởi Hanil EHV-1000BL. . . . . . . . . . . . . . . Thông số kỹ thuật: Quạt sưởi Hanil EHV-1000BL. . . . . . . . . . Thông tin: Quạt sưởi Hanil EHV-1000BL. . . . Nhỏ gọn, thời trang. . Quạt sưởi Hanil EHV1000BL kiểu dáng nhỏ gọn, thời trang, chân đế vững chắc, dễ dàng tháo rời mỗi khi di chuyển mang lại sự tiện lợi cho người sử dụng.. . . 2 mức công suất 550W/1100W. . Quạt sưởi Hanil EHV1000BL hoạt động với 2 mức công suất 550W/1100W cho bạn tha hồ lựa chọn mức độ làm ấm nhanh chóng và chuẩn xác nhất theo nhu cầu sử dụng.. . . Bóng halogel tiết kiệm. . Quạt sưởi Hanil EHV1000BL có chức năng làm nóng bằng bóng halogel an toàn, tiết kiệm điện và mang lại hiệu quả cao trong sử dụng.. . . Chế độ tự ngắt an toàn. . Quạt sưởi Hanil EHV1000BL có chế độ tự động ngắt khi nhiệt độ quá nóng, bạn và gia đình sẽ luôn cảm thấy an tâm khi sử dụng sản phẩm.. . . Chức năng xoay 2 bên tiện lợi. . Quạt sưởi Hanil EHV1000BL trang bị thêm chức năng xoay hai bên tiện lợi, dễ dàng sử dụng.. . . Phù hợp với diện tích 7m2 - 13m2. . Quạt sưởi Hanil EHV1000BL thích hợp dùng cho phòng có diện tích 7m2 ~ 13m2.. . . . . . Tư Vấn Mua Quạt sưởi. . . . . . ",""""""
mediamart.vn,https://mediamart.vn/quatsuoi/sunhouse/den-suoi-kohn-eco-kn02g-2-bong.htm,,Sunhouse,Quạt sưởi,Đèn sưởi nhà tắm Kohn ECO KN02G - 2 bóng,490.000,,," . Đèn sưởi nhà tắm 2 bóng, công suất 550W, treo tường. Diện tích phòng tắm 2 - 4 m². Kiểu đèn sưởi bóng vàng chống chói mắt. Không đốt cháy oxy, Khả năng chống nước IPX4, chống chập điện. . . . . Hình ảnh tham khảo: Đèn sưởi nhà tắm Kohn ECO KN02G - 2 bóng. . . . . . . . . . . . . . . Thông số kỹ thuật: Đèn sưởi nhà tắm Kohn ECO KN02G - 2 bóng. . . . . . . . . . Thông tin: Đèn sưởi nhà tắm Kohn ECO KN02G - 2 bóng. . . Kiểu dáng nhỏ gọn. Đèn sưởi phòng tắm Kohn-Braun KN02G 2 bóng được thiết kế đẹp mắt, màu sắc trang nhã, thích hợp với diện tích phòng tắm 2-4 m2.. . . Bóng đèn mạ vàng. Đèn sưởi với 2 bóng đèn sưởi được bao phủ lớp mạ vàng giúp giảm độ chói sáng nhưng không làm giảm hiệu quả làm ấm.. . . Sưởi ấm bằng tia hồng ngoại. Đèn sưởi phòng tắm Kohn-Braun KN02G 2 bóng sử dụng nguyên lý bức xạ hồng ngoại giúp đạt được nhiệt độ 30ºC trong 2-3 giây, sưởi ấm tức thì.. . . Công tắc riêng biệt. Đèn sưởi phòng tắm Kohn-Braun KN02G 2 bóng trang bị 2 công tắc riêng biệt cho 2 bóng giúp bạn dễ dàng điều khiển riêng cho từng bóng.. . . An toàn cho sức khỏe. Đèn sưởi phòng tắm Kohn-Braun KN02G 2 bóng có lợi cho sức khỏe, nhất là trẻ em trong những ngày mùa đông không có ánh sáng mặt trời.. . . Sử dụng đa năng. Đèn sưởi Kohn-Braun KN02G 2 bóng có thể được lắp đặt, treo trong phòng tắm, phòng ngủ, phòng khách, bếp tùy thuộc vào nhu cầu sử dụng.. . . . . . . Tư Vấn Mua Quạt sưởi. . . . . . ",""""""
mediamart.vn,https://mediamart.vn/quatsuoi/tiross/quat-suoi-dau-tiross-ts-925.htm,,Tiross,Quạt sưởi,"Máy sưởi dầu TIROSS TS-925 9 thanh Có hẹn giờ, Quạt thổi",1.790.000,,," . - Công suất: 2100W-2500W. . - TS-925 được thiết kế 9 thanh sưởi khiến cho lượng nhiệt tỏa ra nhanh chóng, thời gian làm ấm được rút ngắn.. - Kết hợp với quạt gió thổi hơn ấm ra xa hơn, đều hơn giúp cho phạm vi phát nhiệt rộng, sưởi ấm và làm nóng đều không khí.. . . . . Hình ảnh tham khảo: Máy sưởi dầu TIROSS TS-925 9 thanh Có hẹn giờ, Quạt thổi. . . . . . . . . . . . . . . Thông số kỹ thuật: Máy sưởi dầu TIROSS TS-925 9 thanh Có hẹn giờ, Quạt thổi. . . . . . . . . . Thông tin: Máy sưởi dầu TIROSS TS-925 9 thanh Có hẹn giờ, Quạt thổi. . . Tỏa ra hơi ấm từ lượng dầu được đốt nóng. . Máy sưởi dầu TIROSS TS-925 có 9 thanh, quạt cho bạn cảm giác ấm áp trong mùa đông mà không sợ bị khô da hay cảm giác ấm nóng lan tỏa không đều trên cơ thể, máy tỏa ra hơi ấm xuất phát từ lượng dầu có trong máy được đốt nóng.. . . . . Máy được các bà mẹ mới sinh ưa chuộng. . Chính vì thế, máy sưởi dầu được các bà mẹ mới sinh ưa chuộng nhất bởi ngoài chức năng sưởi ấm, máy sưởi dầu còn thay thế chiếc bàn là làm khô tã hay khăn của bé sơ sinh một cách nhanh chóng.. . . . . . . . . Hoạt động theo nguyên tắc thanh nhiệt. . Máy sưởi dầu hoạt động theo nguyên tắc sau: Thanh nhiệt là nguồn cung cấp nhiệt và dầu đóng vai trò là trung gian duy trì nhiệt và nhiệt được tỏa ra qua các thanh sưởi. Nhiệt độ trong phòng tăng lên nhờ vào sự lưu thông không khí trong phòng.. . . . . . . . . Thiết kế tiện lợi, an toàn. . Tiện lợi, an toàn, đẹp, dễ hoạt động và không gây ra nhiễu sóng… phù hợp với các vị trí như phòng nghiên cứu khoa học, bệnh viện, khách sạn, phòng tập và phòng ngủ…. Máy sưởi dầu sẽ giữ ấm cho căn phòng của bạn trong mùa đông giá lạnh.. . . . . . . . . Tư Vấn Mua Quạt sưởi. . . . . . ",""""""
mediamart.vn,https://mediamart.vn/quatsuoi/kohn/den-suoi-nha-tam-kohn-eco-model-keo2g.htm,,KOHN,Quạt sưởi,Đèn sưởi nhà tắm Kohn Eco KEO2G - 2 bóng,499.000,,," . - Công suất 550W. . - 2 công tắc điều khiển riêng biệt cho từng bóng sưởi, có thể bật tắt từng bóng. . - Đèn sưởi phòng tắm Kohn KE 02G 2 bóng vàng là loại lắp treo tường hoặc đặt trên kệ và sử dụng sưởi ấm ở một số nơi trong nhà như trong phòng tắm, phòng khách, nơi con trẻ học tập hoặc thư phòng nghiên cứu của bố mẹ.. . . . . Hình ảnh tham khảo: Đèn sưởi nhà tắm Kohn Eco KEO2G - 2 bóng. . . . . . . . . . . . . . . . . . . . . Thông số kỹ thuật: Đèn sưởi nhà tắm Kohn Eco KEO2G - 2 bóng. . . . . . . . . . Thông tin: Đèn sưởi nhà tắm Kohn Eco KEO2G - 2 bóng. . . Đèn sưởi nhà tắm Kohn KE02G 2 bóng vàng mới nhất của Braun. . Đèn sưởi nhà tắm Kohn KE02G 2 bóng vàng hồng ngoại giảm chói là model mới nhất của năm nay của Braun, gọn gàng, khỏe khoắn pha chút mềm mại từ các đường vuốt cong giữa đèn tạo lên sự khác biệt so với nhiều dòng đèn sưởi trước đây.. . Đèn sưởi nhà tắm Kohn KE 02G thuộc dòng ECO tiết kiệm điện nhưng không làm giảm độ ấm của đèn, được sản xuất trên dây chuyền công nghệ của Đức ngay tại Việt Nam sẽ giúp người dùng thêm an tâm khi sử dụng.. . . Về hình thức của đèn sưởi Kohn KE02G. . Đèn sưởi nhà tắm 2 bóng Kohn KE02G có hoa văn trang trí 4 góc đèn dạng hoa văn chìm, đường nét mềm mại. Giữa đèn có mở góc phá cách với 2 đường lượn ôm thon thả rất mềm mại điểm thêm đường cong chìm thấp hẳn xuống so với phần đèn còn lại để tạo nên sự khác biệt và phá cách kiểu dáng như dáng một người phụ nữ thắt đáy lưng ong nhưng lại pha nét cứng cáp khi kết hợp vời đường bo có gờ cạnh của đèn. Sự kết hợp này thể hiện cách nhìn hoàn toàn mới trong thiết kế khá thú vị.. . Đèn sưởi Kohn KE 02G 2 bóng năm 2015 có kích thước lớn hơn dòng Kohn KN02G, phần bóng sưởi cũng lớn hơn một chút.. . . Về mặt cấu tạo của đèn 2 bóng sưởi Kohn KE02G. . . Bề mặt bóng hồng ngoại làm bằng thủy tinh cứng, chịu nhiệt, chịu nước, chống nổ. . Toàn bộ vỏ đèn sưởi được sản xuất bằng chất liệu nhựa cao cấp, chịu nhiệt.. . . Về công năng của đèn sưởi nhà tắm 2 bóng Kohn KE02G. . . Bóng sưởi nhà tắm Kohn KE 02G ấm nhanh siêu tốc mà không đốt cháy oxy. Về độ ấm theo ghi nhận chúng tôi thấy ấm áp, bóng sưởi to lớn nên cho độ tỏa nhiệt cũng rộng hơn, chóa đèn bên trong rộng cho phản xạ nhiệt tốt hơn ra bên ngoài.. . Khả năng tạo ấm áp nhanh cho nhà tắm, đặc biệt là khu vực có đèn chiếu rọi sẽ đạt được khoảng 30 độ sau khi đèn bật được 5s. . Do trang bị đèn sưởi bước sóng hồng ngoại đặc trưng và tiêu chuẩn chống nước IPX2 nên ngoài lợi ích về sưởi ấm còn có nhiều lợi ích về mặt sức khỏe cho người dùng và an toàn trong môi trường hơi nước ẩm ướt như nhà tắm. . Diện tích nhà tắm phù hợp khoảng 1,5m² – 3m² và còn tùy một số điều kiện khác.. . . . . . . Tư Vấn Mua Quạt sưởi. . . . . . ",""""""
mediamart.vn,https://mediamart.vn/quatsuoi/sunhouse/quat-suoi-halogen-sunhouse-shd7020.htm,,Sunhouse,Quạt sưởi,Quạt sưởi Halogen Sunhouse SHD7020,299.000,,," . - Tốc độ làm nóng nhanh, tỏa nhiệt đều. . - Giữ lượng oxy không gây khó thở và khô da. . - Hai chế độ ra nhiệt (400W - 800W). . - Đèn thạch anh chống chói mắt. . . . . Hình ảnh tham khảo: Quạt sưởi Halogen Sunhouse SHD7020. . . . . . . . . . . . . . . . . . Thông số kỹ thuật: Quạt sưởi Halogen Sunhouse SHD7020. . . . . . . . . . Thông tin: Quạt sưởi Halogen Sunhouse SHD7020. . . Sưởi điện hồng ngoại Sunhouse SHD7020. . Sưởi điện là thiết bị điện dân dụng sử dụng trong mùa đông, thời tiết lạnh người già và trẻ nhỏ có sức đề kháng yếu hơn người trưởng thành vì vậy mà cần phải sưởi ấm nhiều hơn, hiểu được điều này Sunhouse đã cho ra đời dòng sản phẩm sưởi điện hồng ngoại SHD7020 gởi điện SHD 7020 chắc chắn sẽ làm bạn hài lòng.. . . Sưởi điện hồng ngoại Sunhouse SHD7020. . Thông số kỹ thuật của sưởi hồng ngoại Sunhouse SHD7020. . - Tên sản phẩm: Sưởi điện hồng ngoại Sunhouse. - Mã sản phẩm: SHD7020. - Điện áp: 220V-50Hz. - Công suất điều chỉnh: 400/800W. - Kích thước: (400x185x360)mm. - Bảo hành: 12 tháng. . Thông tin sản phẩm sưởi hồng ngoại Sunhouse SHD7020. . - Tốc độ làm nóng nhanh, tỏa nhiệt đều. - Giữ lượng oxy không gây khó thở và khô da. - Hai chế độ ra nhiệt (400W – 800W). - Đèn thạch anh chống chói mắt. - Có chế độ ngắt điện khi quạt bị nghiêng hay đổ và hoạt động trở lại bình thường. - Có móc cuốn dây điện tiện dung khi di chuyển và bảo quản. - Đèn hồng ngoại siêu bền. - Sản phẩm dùng điện không được nhúng vào nước. . Ưu điểm nổi bật của sưởi điện hồng ngoại Sunhouse SHD7020. . - Sưởi điện hồng ngoại Sunhouse SHD7020 sưởi ấm nhanh với công suất tối đa lên đến 800W, 2 mức nhiệt khác nhau, nếu trời không rét thì bạn có thể bật 1 nấc 400W, trời lạnh hơn nữa thì bạn có thể bật hai bóng 800W.. . - Sưởi điện sử dụng đèn thạch anh chống chói mắt, tốc độ làm nóng nhanh, nhiệt tỏa đều không đốt cháy oxi nên không làm khô da.. . - Ưu điểm vượt trội là sưởi có chế độ tự ngắt khi bị đổ và hoạt động trở lại ngay sau khi dựng ngay ngắn. Bạn có thể yên tâm khi để trên giường đi ngủ. Mùa đông của bạn sẽ không còn lạnh với sưởi điện SHD7020. . - Sưởi điện được thiết kế nhỏ gọn thuận tiện cho bạn có thể di chuyển mọi nơi dùng.. . - Sưởi điện hồng ngoại Sunhouse SHD7020 tốt cho người già và trẻ nhỏ. Sưởi được bảo hành 12 tháng. . . . . . Tư Vấn Mua Quạt sưởi. . . . . . ",""""""
mediamart.vn,https://mediamart.vn/quatsuoi/sunhouse/den-suoi-kohn-kukp03g-3-bong.htm,,Sunhouse,Quạt sưởi,Đèn sưởi nhà tắm Kohn KU/KP03G - 3 bóng,650.000,,," . Đèn sưởi nhà tắm 3 bóng, công suất 825W, treo tường. Diện tích phòng tắm 4 - 6 m². Kiểu đèn sưởi bóng vàng chống chói mắt. Không đốt cháy oxy, Khả năng chống nước IPX4, chống chập điện. . . . . Hình ảnh tham khảo: Đèn sưởi nhà tắm Kohn KU/KP03G - 3 bóng. . . . . . . . . . . . . . . Thông số kỹ thuật: Đèn sưởi nhà tắm Kohn KU/KP03G - 3 bóng. . . . . . . . . . Thông tin: Đèn sưởi nhà tắm Kohn KU/KP03G - 3 bóng. . . Kiểu dáng nhỏ gọn. Đèn sưởi phòng tắm Kohn-Braun KU/KP03G 3 bóng được thiết kế đẹp mắt, màu sắc trang nhã, thích hợp với diện tích phòng tắm 4-6 m2.. . . Bóng đèn mạ vàng. Đèn sưởi với 3 bóng đèn sưởi được bao phủ lớp mạ vàng giúp giảm độ chói sáng nhưng không làm giảm hiệu quả làm ấm.. . . Sưởi ấm bằng tia hồng ngoại. Đèn sưởi phòng tắm Kohn-Braun KU/KP03G 3 bóng sử dụng nguyên lý bức xạ hồng ngoại giúp đạt được nhiệt độ 30ºC trong 2-3 giây, sưởi ấm tức thì.. . . Công tắc riêng biệt. Đèn sưởi phòng tắm Kohn-Braun KU/KP03G 3 bóng trang bị 2 công tắc riêng biệt giúp bạn dễ dàng điều khiển.. . . An toàn cho sức khỏe. Đèn sưởi phòng tắm Kohn-Braun KU/KP03G 3 bóng có lợi cho sức khỏe, nhất là trẻ em trong những ngày mùa đông không có ánh sáng mặt trời.. . . Sử dụng đa năng. Đèn sưởi Kohn-Braun KU/KP03G 3 bóng có thể được lắp đặt, treo trong phòng tắm, phòng ngủ, phòng khách, bếp tùy thuộc vào nhu cầu sử dụng.. . . . . . . Tư Vấn Mua Quạt sưởi. . . . . . ",""""""
