Domain,Url,Product_id,Rating,Comment,Review Time,Bought Time
adayroi.com,https://www.adayroi.com/tui-deo-cheo-lata-hn00-nau-nhat-p-PRI949641?offer=PRI949641_F4M,PRI949641,5,rất ưng ý. ko có j để chê,2017-06-17 15:00:00,
adayroi.com,https://www.adayroi.com/balo-nu-thoi-trang-senszx-b024-mau-hong-hoa-tiet-hoa-vang-p-PRI1071986?offer=PRI1071986_OUN,PRI1071986,3,cặp hơi mỏng,2017-07-20 16:54:00,
adayroi.com,https://www.adayroi.com/tui-deo-cheo-nu-phoi-vien-1-khoa-mau-nau-huy-hoang-p-PRI58306?offer=PRI58306_129248,PRI58306,3,"Túi khá to, đụng được nhiều đồ",2015-06-17 00:15:00,
adayroi.com,https://www.adayroi.com/vi-nu-da-bo-mau-nau-kim-oanh-p-PRI496845?offer=PRI496845_M3Q,PRI496845,5,"Mình rất ưng ý sản phẩm này, chất da mềm, cầm tay chắc chắn, nhìn bên ngoài cũng đẹp hơn trong ảnh, với mức giá giảm nhiều như thế này thì đây đúng là sản phẩm đáng mua",2017-02-08 11:36:00,
adayroi.com,https://www.adayroi.com/vi-nu-da-bo-mau-nau-kim-oanh-p-PRI496845?offer=PRI496845_M3Q,PRI496845,4,"Sản phẩm giá tốt quá nhưng mình lại không thích màu nâu này lắm, đang đợi sản phẩm tương tự nhưng màu khác.",2017-01-10 16:51:00,
adayroi.com,https://www.adayroi.com/tui-deo-cheo-hop-vuong-da-tong-hop-mau-nau-huy-hoang-p-PRI58105?offer=PRI58105_129248,PRI58105,3,"Túi đeo chéo tiện lợi, da đẹp bền, xài êm lắm",2015-06-11 14:13:00,
adayroi.com,https://www.adayroi.com/vi-da-nu-ngang-dai-tron-mau-hong-canh-sen-dap-logo-huy-hoang-p-PRI58171?offer=PRI58171_129248,PRI58171,4,Trẻ trung và tinh tế.,2015-06-16 15:46:00,
adayroi.com,https://www.adayroi.com/vi-da-nu-ngang-dai-tron-mau-hong-canh-sen-dap-logo-huy-hoang-p-PRI58171?offer=PRI58171_129248,PRI58171,5,"Phụ kiện không thể thiếu nhé, màu hồng nhẹ nhàng",2015-06-15 15:04:00,
adayroi.com,https://www.adayroi.com/vi-da-nu-huy-hoang-p-PRI58188?offer=PRI58188_129248,PRI58188,4,"Chất liệu da mềm mại, thiết kế đơn giản, tuy chưa có gì phá cách nhưng mình thích những sản phẩm basic như thế này, dễ phối hợp với quần áo và các loại phụ kiện khác",2017-02-08 11:38:00,
adayroi.com,https://www.adayroi.com/vi-cam-tay-da-ca-sau-van-gai-lung-2-gap-mau-nau-vang-huy-hoang-p-PRI58239?offer=PRI58239_129248,PRI58239,4,thích da ví này lắm nè,2015-06-17 10:18:00,
adayroi.com,https://www.adayroi.com/vi-cam-tay-da-ca-sau-van-gai-lung-2-gap-mau-nau-vang-huy-hoang-p-PRI58239?offer=PRI58239_129248,PRI58239,3,mình nhận được rồi ưng ý lắm ad,2015-06-13 00:14:00,
adayroi.com,https://www.adayroi.com/balo-hinh-hop-mau-bo-dam-huy-hoang-p-PRI348082?offer=PRI348082_129248,PRI348082,3,Balo nay đựng đươc lap 15inch ko,2017-09-07 19:45:00,
adayroi.com,https://www.adayroi.com/vi-cam-tay-da-ca-sau-van-gai-3-gap-mau-nau-huy-hoang-p-PRI58246?offer=PRI58246_129248,PRI58246,4,Cực kỳ cá tính và độc đáo.,2015-06-16 15:47:00,
adayroi.com,https://www.adayroi.com/athletic-bag-mau-nau-phoi-2-soc-huy-hoang-p-PRI58094?offer=PRI58094_129248,PRI58094,4,"gam màu nhẹ, có thể phối với nhiều loại trang phục..",2015-06-15 15:09:00,
adayroi.com,https://www.adayroi.com/athletic-bag-mau-nau-phoi-2-soc-huy-hoang-p-PRI58094?offer=PRI58094_129248,PRI58094,3,thích túi này quá...cái màu nhìn cũng sang nữa,2015-06-10 11:57:00,
adayroi.com,https://www.adayroi.com/vi-nu-venuco-madrid-b04w68-mau-xanh-la-cay-in-hoa-tiet-hoa-p-PRI1107042?offer=PRI1107042_185016,PRI1107042,5,hàng đẹp. 😍,2017-11-30 13:00:00,
adayroi.com,https://www.adayroi.com/vi-khoa-keo-venuco-madrid-w12-mau-xanh-navy-p-PRI1107346?offer=PRI1107346_185016,PRI1107346,5,"Giao hàng nhanh, nhiệt tình. Hàng đẹp!",2017-09-08 22:24:00,
adayroi.com,https://www.adayroi.com/vi-khoa-keo-venuco-madrid-w12-mau-xanh-la-p-PRI1107355?offer=PRI1107355_185016,PRI1107355,5,,2018-11-11 23:40:00,
adayroi.com,https://www.adayroi.com/balo-da-tong-hop-nap-gap-mau-nau-huy-hoang-p-PRI58095?offer=PRI58095_129248,PRI58095,4,"nhiều ngăn lớn, nhỏ tiện dụng tiện dụng vô cùng",2015-06-13 10:25:00,
adayroi.com,https://www.adayroi.com/tui-deo-cheo-hop-vuong-da-tong-hop-mau-vang-da-bo-huy-hoang-p-PRI58102?offer=PRI58102_129248,PRI58102,5,Chất da đẹp và phong cách lắm cả nhà nhé^^,2015-06-16 16:15:00,
adayroi.com,https://www.adayroi.com/tui-deo-cheo-hop-vuong-da-tong-hop-mau-vang-da-bo-huy-hoang-p-PRI58102?offer=PRI58102_129248,PRI58102,3,"Túi có rất nhiều ngăn, đựng được khá nhiều đồ.",2015-06-12 00:27:00,
adayroi.com,https://www.adayroi.com/tui-deo-cheo-nu-naza-t60560-mau-do-xanh-p-1331679?offer=1331679_144032,1331679,5,Mua túi được giảm code khuyến mãi nên giá tốt . Like,2018-10-24 18:06:00,
adayroi.com,https://www.adayroi.com/tui-deo-cheo-nu-naza-t60560-mau-do-xanh-p-1331679?offer=1331679_144032,1331679,5,"Mẫu mã xịn xò , giá ngon. Vote 5 saoo",2018-10-24 17:40:00,
adayroi.com,https://www.adayroi.com/tui-deo-cheo-nu-naza-t60560-mau-do-xanh-p-1331679?offer=1331679_144032,1331679,5,chất liệu ok mà giá còn mềm nữa . Mình sẽ tiếp tục ủng hộ,2018-10-24 14:54:00,
adayroi.com,https://www.adayroi.com/vi-da-tong-hop-ngang-dai-mau-nau-vang-huy-hoang-p-PRI58163?offer=PRI58163_129248,PRI58163,3,"Ví sang quá, thích hợp đi dự tiệc",2015-06-11 14:15:00,
adayroi.com,https://www.adayroi.com/vi-cam-tay-da-ca-sau-van-da-bung-3-gap-mau-den-huy-hoang-p-PRI58243?offer=PRI58243_129248,PRI58243,3,"nhìn cũng sang đó chứ, lại nhiều ngăn thật tiện dụng...",2015-06-10 00:33:00,
adayroi.com,https://www.adayroi.com/vi-nu-bonia-p880-723-04-da-bo-mau-do-hang-chinh-hang-p-846423?offer=846423_143081,846423,5,"Tôi đã mua màu đỏ và rất thích ,muốn mua thêm màu nâu thì mua thế nào",2018-10-24 18:06:00,
adayroi.com,https://www.adayroi.com/vi-nu-bonia-p880-723-04-da-bo-mau-do-hang-chinh-hang-p-846423?offer=846423_143081,846423,5,Hàng xịn giá tốt hơn cả cửa hàng hihi .,2018-10-24 17:40:00,
adayroi.com,https://www.adayroi.com/vi-nu-bonia-p880-723-04-da-bo-mau-do-hang-chinh-hang-p-846423?offer=846423_143081,846423,5,"chất lượng khá ổn , giá vẫn hơi cao nhưng áp code giảm giá thì cũng được .",2018-10-24 14:54:00,
adayroi.com,https://www.adayroi.com/tui-xach-nu-venuco-madrid-bc01m001g-tron-xanh-la-p-PRI1081448?offer=PRI1081448_185016,PRI1081448,5,túi đẹp và dễ sử dụng.,2018-01-13 03:46:00,
adayroi.com,https://www.adayroi.com/tui-xach-nu-venuco-madrid-s160-xanh-la-dam-p-PRI1081877?offer=PRI1081877_185016,PRI1081877,5,"Mua lâu ròi bây giờ mới vote. Túi dùng bền lắm , đáng đồng tiền",2018-10-24 18:02:00,
adayroi.com,https://www.adayroi.com/tui-xach-nu-venuco-madrid-s160-xanh-la-dam-p-PRI1081877?offer=PRI1081877_185016,PRI1081877,5,"Gía thì không quá cao , chất lượng ổn , được áp code nên rất happy hihi",2018-10-24 17:38:00,
adayroi.com,https://www.adayroi.com/tui-xach-nu-venuco-madrid-s160-xanh-la-dam-p-PRI1081877?offer=PRI1081877_185016,PRI1081877,5,"Đóng gói đẹp , sản phẩm không bị móp , nói chung là OK",2018-10-24 14:48:00,
adayroi.com,https://www.adayroi.com/vi-nu-gianni-conti-g588159ros-mau-do-p-1330708?offer=1330708_QKA,1330708,5,Xinh vậy nè,2018-10-31 12:58:00,
adayroi.com,https://www.adayroi.com/vi-nu-gianni-conti-588373rej-mau-do-p-1330243?offer=1330243_QKA,1330243,5,Mẫu này yêu thế :),2018-10-31 12:41:00,
adayroi.com,https://www.adayroi.com/vi-nu-gianni-conti-2148526-blu-mau-xanh-navy-p-1330963?offer=1330963_QKA,1330963,5,Đựng điện thoại vừa in ấy.,2018-10-31 13:05:00,
adayroi.com,https://www.adayroi.com/vi-nu-gianni-conti-2148529-red-mau-do-p-1330965?offer=1330965_QKA,1330965,5,Mình mua làm quà cho bã xã. Bà mê tít,2018-10-30 12:11:00,
adayroi.com,https://www.adayroi.com/vi-nu-gianni-conti-2148529-red-mau-do-p-1330965?offer=1330965_QKA,1330965,5,,2018-09-26 19:55:00,
adayroi.com,https://www.adayroi.com/vi-nu-da-bo-gianni-conti-1288294bla-mau-den-p-1331016?offer=1331016_QKA,1331016,5,Mẫu này xinh thế.,2018-10-31 12:31:00,
adayroi.com,https://www.adayroi.com/vi-nu-da-bo-gianni-conti-1288294bla-mau-den-p-1331016?offer=1331016_QKA,1331016,5,Mẫu phong thư này đẹp quá. Tháng sau phải mua tặng sinh nhật vợ mới được,2018-10-30 12:20:00,
adayroi.com,https://www.adayroi.com/vi-nu-gianni-conti-1248295mus-mau-vang-phoi-den-p-1331013?offer=1331013_QKA,1331013,5,"Sản phẩm đẹp, dùng rất thích. Nhưng còn hơi ít mẫu, mong tương lai sẽ ra thêm nhiều mẫu túi nữ đa dạng hơn.",2018-11-02 11:04:00,
