Domain,Url,Product_id,Brand,Category,Model,Price,Seller,Tags,Info,Others
mediamart.vn,https://mediamart.vn/quat-dieu-hoa/sunhouse/may-lam-mat-khong-khi-sunhouse-shd7762.htm,,Sunhouse,Quạt điều hòa,Quạt điều hòa Sunhouse SHD7762,6.590.000,,," . - Giải pháp làm mát tối ưu, giảm tới 15 độ C trong điều kiện lý tưởng: Nhiệt độ môi trường >= 42 độ C, Độ ẩm môi trường <=40% và phòng thoáng... . - Chế độ làm mát, chế độ ion âm, Dễ dàng di chuyển . - 3 cấp độ gió, chế độ đảo chiều tự động, Thân nhựa ABS . - An toàn sức khỏe, làm sạch không khí, Giải nhiệt ngày hè. . . . . Hình ảnh tham khảo: Quạt điều hòa Sunhouse SHD7762. . . . . . . . . . . . . . . Thông số kỹ thuật: Quạt điều hòa Sunhouse SHD7762. . . . Bộ lọc Quạt ĐH. . . . . . . . Thông tin: Quạt điều hòa Sunhouse SHD7762. . . . . . Màu sắc. . Trắng - Ghi. . . . Điện áp. . 220V - 50Hz. . . . Công suất. . 180W. . . . Dung tích. . 50 lít. . . . Lưu lượng gió. . 6.000 m. 3. /h. . . . Thời gian làm mát liên tục. . 8 giờ. . . . Hẹn giờ. . 7.5 giờ. . . . Diện tích làm mát. . 40 m. 2. . . . Khối lượng. . 20 Kg. . . . Kích thước. . 700 x 460 x 1160 mm. . . . Cấp độ gió. . 3 cấp độ. . . . Chất liệu. . Thân nhựa ABS. . . . Điều khiển. . Cảm ứng. . . . Tiện ích khác. . Chế độ làm mát, chế độ ion âm. Bình chứa nước kết nối trực tiếp với máy bơm. . . . Thương hiệu. . SUNHOUSE. . . . Bảo hành. . 12 tháng. . . . Thông tin chung. . QUẠT ĐIỀU HOÀ - MÁY LÀM MÁT KHÔNG KHÍ SUNHOUSE SHD7762. . . . - Giải pháp làm mát tối ưu, giảm tới 15 độ C trong điều kiện lý tưởng: Nhiệt độ môi trường >= 42 độ C, Độ ẩm môi trường <=40% và phòng thoáng. . . . - Chế độ làm mát, chế độ ion âm. . . . - 3 cấp độ gió, chế độ đảo chiều tự động. . . . - Thân nhựa ABS, động cơ đồng – bảo vệ kép. . . . - An toàn sức khỏe, làm sạch không khí. . . . . . . . . Tư Vấn Mua Quạt điều hòa. . . . . . ",""""""
mediamart.vn,https://mediamart.vn/quat-dieu-hoa/masterkool/quat-dieu-hoa-masterkool-cte06-thailand-hong.htm,,MasterKool,Quạt điều hòa,Quạt điều hòa MasterKool CTE06 Thailand (Hồng),1.990.000,,," . Làm mát không khí bằng công nghệ ANION. Giảm 80% điện năng so với điều hòa. Thiết kế đặc biệt cho các phòng ngủ với luồng không khí nhẹ dịu. Có chức năng hẹn giờ, có thể tắt máy vào ban đêm mà không cần phải thức dậy.. . . . . Hình ảnh tham khảo: Quạt điều hòa MasterKool CTE06 Thailand (Hồng). . . . . . . . . . . . . . . Thông số kỹ thuật: Quạt điều hòa MasterKool CTE06 Thailand (Hồng). . . . Bộ lọc Quạt ĐH. . . . . . . . Thông tin: Quạt điều hòa MasterKool CTE06 Thailand (Hồng). . . * Đặc điểm nổi bật của Quạt điều hòa MasterKool CTE06:. . Thiết kế gọn nhẹ. Chiếc Quạt điều hòa MasterKool CTE06 sở hữu thiết kế gọn nhẹ với khối lượng 7.8Kg và bình chứa nước dung tích 7.5 lít. Nhờ khối lượng không quá nặng, bạn có thể dễ dàng di chuyển Quạt điều hòa hay vệ sinh thiết bị mà không tốn quá nhiều công sức.. . . . . Làm sạch không khí bằng công nghệ Anion. Quạt điều hòa MasterKool CTE06 làm mát không khí bằng công nghệ Anion, giúp loại bỏ bụi bẩn, các loại vi khuẩn nấm mốc có hại đồng thời khử sạch mùi hôi khó chịu nhằm mang đến cho bạn và người thân một không gian sống an toàn và sạch khuẩn.. . . Chức năng hẹn giờ. Quạt có chức năng hẹn giờ cực kỳ tiện lợi. Nhờ chức năng này mà có thể tắt máy vào ban đêm mà không cần phải thức dậy.. . . . Tiết kiệm điện. Quạt điều hòa MasterKool CTE06 Tiết kiệm điện có công suất 85W. Với công suất này sử dụng Quạt điều hòa rất tiết kiệm điện mà vẫn làm mát, hạ nhiệt độ tốt, Giảm 80% điện năng so với điều hòa.. . . . . . . . Tư Vấn Mua Quạt điều hòa. . . . . . ",""""""
mediamart.vn,https://mediamart.vn/quat-dieu-hoa/masterkool/quat-dieu-hoa-masterkool-cte06-thailand-xanh-la.htm,,MasterKool,Quạt điều hòa,Quạt điều hòa MasterKool CTE06 Thailand (Xanh lá),1.990.000,,," . Làm mát không khí bằng công nghệ ANION. Giảm 80% điện năng so với điều hòa. Thiết kế đặc biệt cho các phòng ngủ với luồng không khí nhẹ dịu. Có chức năng hẹn giờ, có thể tắt máy vào ban đêm mà không cần phải thức dậy.. . . . . Hình ảnh tham khảo: Quạt điều hòa MasterKool CTE06 Thailand (Xanh lá). . . . . . . . . . . . . . . Thông số kỹ thuật: Quạt điều hòa MasterKool CTE06 Thailand (Xanh lá). . . . Bộ lọc Quạt ĐH. . . . . . . . Thông tin: Quạt điều hòa MasterKool CTE06 Thailand (Xanh lá). . . * Đặc điểm nổi bật của Quạt điều hòa MasterKool CTE06:. . Thiết kế gọn nhẹ. . Chiếc. Quạt điều hòa MasterKool CTE06. sở hữu thiết kế gọn nhẹ với khối lượng 7.8Kg và bình chứa nước dung tích 7.5 lít. Nhờ khối lượng không quá nặng, bạn có thể dễ dàng di chuyển Quạt điều hòa hay vệ sinh thiết bị mà không tốn quá nhiều công sức.. . . Làm sạch không khí bằng công nghệ Anion. . . Quạt điều hòa MasterKool. CTE06 làm mát không khí bằng công nghệ Anion, giúp loại bỏ bụi bẩn, các loại vi khuẩn nấm mốc có hại đồng thời khử sạch mùi hôi khó chịu nhằm mang đến cho bạn và người thân một không gian sống an toàn và sạch khuẩn.. . . Chức năng hẹn giờ. . Quạt. có chức năng hẹn giờ cực kỳ tiện lợi. Nhờ chức năng này mà có thể tắt máy vào ban đêm mà không cần phải thức dậy.. . . . Tiết kiệm điện. . Quạt điều hòa. MasterKool CTE06. Tiết kiệm điện có công suất 85W. Với công suất này sử dụng. Quạt điều hòa tiết kiệm điện. mà vẫn làm mát, hạ nhiệt độ tốt, Giảm 80% điện năng so với điều hòa.. . . . . . . . Tư Vấn Mua Quạt điều hòa. . . . . . ",""""""
mediamart.vn,https://mediamart.vn/quat-dieu-hoa/saiko/quat-dieu-hoa-saiko-ac9110cl.htm,,Saiko,Quạt điều hòa,Quạt điều hòa Saiko AC-9110CL,1.890.000,,," . 3 cấp độ gió, cho phép người dùng tùy ý lựa chọn tốc độ thích hợp. Diện tích làm mát: 15m2. Tiết kiệm điện 90% so với máy lạnh cùng diện tích sử dụng . Làm mát nhanh với công nghệ Speed Cooling . Chức năng: Lọc không khí, hẹn giờ 1-8h. . . . . Hình ảnh tham khảo: Quạt điều hòa Saiko AC-9110CL. . . . . . . . . . . . . . . Thông số kỹ thuật: Quạt điều hòa Saiko AC-9110CL. . . . Bộ lọc Quạt ĐH. . . . . . . . Thông tin: Quạt điều hòa Saiko AC-9110CL. . . * Đặc điểm nổi bật của Quạt điều hòa Saiko AC-9110CL:. . Làm mát tuyệt vời. . Quạt điều hòa Saiko AC-9110CL. với khả năng àm mát có thể đạt 26 độ (+/-2), không làm khô da, tạo không khí mát mẻ dễ chịu tương tự như bên bồ hoặc bờ biển.. . . . . Tiết kiệm tiền. . . Quạt điều hòa. Saiko AC-9110CL tiết kiệm chi phí ban đầu khoảng 30-40% so với. máy điều hoà không khí. cùng diện tích sử dụng. Không tốn chi phí lắp đặt, bảo trì.. . . . Tiết kiệm điện. . Trong cùng một diện tích sử dụng thì. Quạt điều hòa Saiko. chỉ tiêu hao bằng 10% đến 12% điện năng so với máy điều hòa không khí.. . . Chất lượng không khí. . Quạt điều hòa Saiko. còn là hệ thống thông gió, lọc sạch không khí, cung cấp luồng không khí tươi sạch, mát lạnh và giàu OXY.. . . . Dành cho không gian mở. . Quạt điều hòa Saiko giá rẻ. khác biệt với máy điều hoà ở chỗ không bắt buộc trong không gian kín mà hoạt động tốt nhất tại không giản mở hoặc ngoài trời.. . . . Công nghệ làm mát SPEED COOLING. . Các sản phẩm. SAIKO. được trang bị hệ thống Speed Cooling, được nghiên cứu bởi các kỹ sư hàng đầu, nhằm tối ưu hoá hệ thống lưu thông gió không bị tiêu hao năng lượng và làm mát nhanh hơn 20%.. . . . . . . Dàn lạnh 3D hiện đại. Giàn mát được thiết kế 3d theo cấu trúc tổ ong áp dụng polyme thế hệ mới cho sự hấp thụ nước cao, chống ải cao, kháng nấm mốc và kéo dài tuổi thọ. Sản phẩm không chứa phenol , rất an toàn.. . . . Chất lượng siêu bền. Các linh kiện, máy bơm, motor đều được sản xuất chuyên dụng với độ bền cao. Hệ thống giàn mát được thử nghiệm 10000 giờ trong môi trường khắc nghiệt trước khi được trang bị vào Quạt điều hòa SAIKO. . . . . . Động cơ mạnh mẽ. Động cơ được đúc nguyên khối, chống ăn mòn, chống thấm nước, chống tác động bên ngoài, hoạt độc bền bỉ, tuổi thọ sử dụng rất cao. 100% động cơ cuốn bằng dây đồng. Tiêu chuẩn chống thấm nước IP 54. . . . Di chuyển dễ dàng. . Quạt điều hòa Saiko. được trang bị hệ thống bánh xe tiện lợi để có thể di chuyển linh hoạt, không bị gắn cố định tại một vị trí như điều hoà. Bánh xe có tính năng chịu lực, ma sát cao và hệ thống khoá an toàn.. . . . . . Sử dụng đơn giản. Với cấu tạo đơn giản, cơ học ( Giàn mát, động cơ motor, cánh quạt ) nên Quạt điều hòa Saiko hoạt động tự động. Bộ điều khiển được thiết kế đầy đủ chức năng nhưng đơn giản nên dễ dàng sử dụng.. . . . . . 3 tốc độ gió. Quạt điều hòa Saiko AC-9110CL có 3 tốc độ gió cho phép bạn tùy chỉnh theo nhu cầu, sở thích của mình. . . . Tấm lọc bụi và côn trùng. Quạt điều hòa Saiko được trang bị tấm chặn côn trùng và lọc bụi. Tấm lọc bụi làm sạch không khí được lưu thông, cung cấp cho bạn, không khí trong lành mát mẻ đồng thời cản côn trùng xâm nhập máy do đó máy sẽ an toàn và sạch hơn.. . . . . . . . . . . . Tư Vấn Mua Quạt điều hòa. . . . . . ",""""""
mediamart.vn,https://mediamart.vn/quat-dieu-hoa/boss/quat-dieu-hoa-boss-s106.htm,,Boss,Quạt điều hòa,Quạt điều hòa Boss S-106,6.990.000,,," . Công nghệ inverter tiết kiệm điện. Tạo ion âm làm sạch, làm mát không khí. Có hẹn giờ, có điều khiển từ xa,thân thiện với môi trường. Không gây ồn, dung tích bình nước lớn 30L. . . . . Hình ảnh tham khảo: Quạt điều hòa Boss S-106. . . . . . . . . . . . . . . Thông số kỹ thuật: Quạt điều hòa Boss S-106. . . . Bộ lọc Quạt ĐH. . . . . . . . Thông tin: Quạt điều hòa Boss S-106. . . Thiết kế tiện lợi, chắc chắn. . Kiểu dáng bắt mắt, chất liệu nhựa ABS chắc chắn, màu sắc đơn giản nhưng vô cùng trang nhã, tiện lợi khi chuyển khắp nơi.. . . Lọc sạch không khí. . Quạt hơi nước Boss S106 với khả năng làm sạch không khí, cung cấp độ ẩm, giúp ngôi nhà bạn trở nên sạch khuẩn, trong lành.. . Làm mát nhanh chóng, toả đều khắp nhà. . Với dung tích bình chứa lớn, cho thời gian sử dụng lâu dài, hướng gió 2 chiều giúp luồng gió mát đảo đều khắp căn phòng.. . . . Điều khiển từ xa. . Quạt hơi nước Boss được trang bị điều khiển từ xa tiện lợi giúp bạn dễ dàng sử dụng, không phải di chuyển nhiều để điều khiển quạt theo ý muốn.. . . Không gây tiếng ồn. . Với công suất hoạt động 160W, quạt chạy một cách êm ái, không gây ồn, giúp bạn có một không gian thải mái.. . . . . . . Tư Vấn Mua Quạt điều hòa. . . . . . ",""""""
mediamart.vn,https://mediamart.vn/quat-dieu-hoa/boss/quat-dieu-hoa-boss-s101.htm,,Boss,Quạt điều hòa,Quạt điều hòa Boss S-101,5.990.000,,," . Công suất: 180W, dung tích chứa nước: 35 lít. 3 tốc độ gió, Tạo ion lọc không khí. Điều khiển từ xa. Bánh xe 360 độ giúp di chuyển tốt. . . . . Hình ảnh tham khảo: Quạt điều hòa Boss S-101. . . . . . . . . . . . . . . . . . . . . . . . Thông số kỹ thuật: Quạt điều hòa Boss S-101. . . . Bộ lọc Quạt ĐH. . . . . . . . Thông tin: Quạt điều hòa Boss S-101. . . Khả năng di chuyển tốt. . Cùng với thiết kế hiện đại, sang trọng, quạt điều hoà Boss S-101 được trang bị bánh xe 360 độ giúp việc di chuyển mọi nơi trong không gian nhà dễ dàng hơn.. . . Sử dụng trong nhiều giờ. . Không cần phải châm nước liên tục hay gián đoạn không gian mát mẻ, dung tích cực lớn của quạt điều hòa giúp quạt hoạt động liên tục trong nhiều giờ.. . . 3 tốc độ gió. . Tuỳ vào nhu cầu sử dụng, người dùng có thể lựa chọn một trong ba tốc độ gió phù hợp trong từng không gian khác nhau.. . . Remote điều khiển từ xa. . Người dùng có thể tuỳ ý điều chỉnh không gian trở nên mát mẻ nhờ hệ thống và bảng điều khiển nhiều chức năng ở đầu thân quạt điều hòa Boss.. . . . . . . Tư Vấn Mua Quạt điều hòa. . . . . . ",""""""
mediamart.vn,https://mediamart.vn/quat-dieu-hoa/saiko/quat-dieu-hoa-saiko-ac9170cl.htm,,Saiko,Quạt điều hòa,Quạt điều hòa Saiko AC-9170CL,2.990.000,,," . Cung cấp luồng không khí tươi mát, sảng khoái như bên hồ , biển . . Tiết kiệm điện 90% so với máy lạnh cùng diện tích sử dụng . Làm mát nhanh với công nghệ Speed Cooling . 4 cấp độ gió cho phép người dùng tùy ý lựa chọn mức phù hợp nhất. Có điều khiển từ xa tiện lợi. . . . . Hình ảnh tham khảo: Quạt điều hòa Saiko AC-9170CL. . . . . . . . . . . . . . . Thông số kỹ thuật: Quạt điều hòa Saiko AC-9170CL. . . . Bộ lọc Quạt ĐH. . . . . . . . Thông tin: Quạt điều hòa Saiko AC-9170CL. . . * Đặc điểm nổi bật của Quạt điều hòa Saiko AC-9170CL. . :. . Làm mát tuyệt vời. Nhiệt độ làm mát có thể đạt 26 độ (+/-2), không làm khô da, tạo không khí mát mẻ dễ chịu tương tự như bên bồ hoặc bờ biển.. . . . . Tiết kiệm tiền. Quạt điều hòa Saiko AC-9170CL tiết kiệm chi phí ban đầu khoảng 30-40% so với máy điều hoà cùng diện tích sử dụng. Không tốn chi phí lắp đặt, bảo trì.. . . . . . . . . Tiết kiệm điện. Trong cùng một diện tích sử dụng thì Quạt điều hòa Saiko chỉ tiêu hao bằng 10% đến 12% điện năng so với máy điều hòa không khí.. . . . . . . . . Chất lượng không khí. Quạt điều hòa Saiko còn là hệ thống thông gió, lọc sạch không khí, cung cấp luồng không khí tươi sạch, mát lạnh và giàu OXY.. . . . . . . . . Dành cho không gian mở. Quạt điều hòa Saiko khác biệt với máy điều hoà ở chỗ không bắt buộc trong không gian kín mà hoạt động tốt nhất tại không giản mở hoặc ngoài trời.. . . Công nghệ làm mát SPEED COOLING. Các sản phẩm SAIKO được trang bị hệ thống Speed Cooling, được nghiên cứu bởi các kỹ sư hàng đầu, nhằm tối ưu hoá hệ thống lưu thông gió không bị tiêu hao năng lượng và làm mát nhanh hơn 20%.. . . . . . . Dàn lạnh 3D hiện đại. Giàn mát được thiết kế 3d theo cấu trúc tổ ong áp dụng polyme thế hệ mới cho sự hấp thụ nước cao, chống ải cao, kháng nấm mốc và kéo dài tuổi thọ. Sản phẩm không chứa phenol , rất an toàn.. . . . Chất lượng siêu bền. Các linh kiện, máy bơm, motor đều được sản xuất chuyên dụng với độ bền cao. Hệ thống giàn mát được thử nghiệm 10000 giờ trong môi trường khắc nghiệt trước khi được trang bị vào Quạt điều hòa SAIKO. . . . . . Động cơ mạnh mẽ. Động cơ được đúc nguyên khối, chống ăn mòn, chống thấm nước, chống tác động bên ngoài, hoạt độc bền bỉ, tuổi thọ sử dụng rất cao. 100% động cơ cuốn bằng dây đồng. Tiêu chuẩn chống thấm nước IP 54. . . . Di chuyển dễ dàng. Quạt điều hòa Saiko được trang bị hệ thống bánh xe tiện lợi để có thể di chuyển linh hoạt, không bị gắn cố định tại một vị trí như điều hoà. Bánh xe có tính năng chịu lực, ma sát cao và hệ thống khoá an toàn.. . . . . . Sử dụng đơn giản. Với cấu tạo đơn giản, cơ học ( Giàn mát, động cơ motor, cánh quạt ) nên Quạt điều hòa Saiko hoạt động tự động. Bộ điều khiển được thiết kế đầy đủ chức năng nhưng đơn giản nên dễ dàng sử dụng.. . . . . . 4 tốc độ gió. Quạt điều hòa Saiko AC-9170CL có 4 tốc độ gió cho phép bạn tùy chỉnh theo nhu cầu, sở thích của mình. . . . Tấm lọc bụi và côn trùng. Quạt điều hòa Saiko được trang bị tấm chặn côn trùng và lọc bụi. Tấm lọc bụi làm sạch không khí được lưu thông, cung cấp cho bạn, không khí trong lành mát mẻ đồng thời cản côn trùng xâm nhập máy do đó máy sẽ an toàn và sạch hơn.. . . . Điều khiển từ xa. Thiết kế bảng điều khiển từ xa với các nút nhấn đơn giản, màn hình hiển thị LED hiện đại giúp bạn tùy chỉnh các chức năng, chế độ, tốc độ gió dễ dàng. . . . . . . . . . . . Tư Vấn Mua Quạt điều hòa. . . . . . ",""""""
mediamart.vn,https://mediamart.vn/quat-dieu-hoa/sunhouse/quat-dieu-hoa-sunhouse-shd7725-xanhthailand.htm,,Sunhouse,Quạt điều hòa,Quạt điều hòa Sunhouse SHD7725 (Xanh),4.990.000,,," . Giải pháp làm mát tối ưu, giảm tới 15 độ C . Công suất 120W tiết kiệm điện, 3 cấp độ gió tùy ý lựa chọn. Làm sạch không khí nhờ chức năng sục Ozon. Phím bấm cảm ứng, có điều khiển từ xa cho phép sử dụng quạt dễ dàng, tiện lợi . . . . . Hình ảnh tham khảo: Quạt điều hòa Sunhouse SHD7725 (Xanh). . . . . . . . . . . . . . . Thông số kỹ thuật: Quạt điều hòa Sunhouse SHD7725 (Xanh). . . . Bộ lọc Quạt ĐH. . . . . . . . Thông tin: Quạt điều hòa Sunhouse SHD7725 (Xanh). . . . * Đặc điểm nổi bật của Quạt điều hòa Sunhouse SHD7725:. . Khả năng hạ nhiệt độ tốt. Quạt điều hòa SUNHOUSE SHD7725 được đánh giá cao về khả năng hạ nhiệt độ, cho phép giảm tới 15 độ C. Nhờ đó, nhiệt độ trong phòng sẽ thoáng mát hơn, không còn cảm giác khó chịu, nóng nực vào mùa hè. Đồng thời, 3 cấp độ gió cùng chế độ đảo chiều tự động cho phép người dùng có thể thoải mái lựa chọn mức gió phù hợp.. . . Công nghệ lấy gió đa chiều​. Quạt điều hòa hoạt động dựa trên nguyên lý bốc hơi nước tự nhiên. Không khí nóng xung quanh sẽ được hút vào tấm làm mát từ nhiều hướng khác nhau, sau khi đi qua tấm làm mát nhiệt độ không khí được giảm xuống và thổi ra ngoài. Như vậy có nghĩa là không khí càng được hút vào nhiều thì khả năng hạ nhiệt độ càng nhanh. Dựa trên nguyên lý đó, Quạt điều hòa SUNHOUSE SHD7725 với công nghệ lấy gió đa chiều giúp tăng cường khả năng làm mát không khí.. . . Điều khiển cảm ứng. Tương tự các loại Quạt điều hòa SUNHOUSE khác, Quạt điều hòa SUNHOUSE SHD7725 cũng được thiết kế công tắc điều khiển từ xa cảm ứng, thuận tiện khi sử dụng. Nhờ đó bạn có thể khởi động và chọn chế độ làm mát bằng cách ấn vào các biểu tượng trên bảng điều khiển trên chiếc quạt. Bảng điều khiển cũng được chú thích bằng những hình ảnh và tiếng Việt dễ hiểu, giúp mọi người có thể sử dụng được dễ dàng.. . . Thiết kế gọn nhẹ. Quạt điều hòa SUNHOUSE SHD7725 có kích thước là 535 x 390 x 950 mm, khối lượng 13kg và bình chứa nước dung tích 23 lít. Với thiết kế 4 bánh xe linh hoạt, bạn sẽ không tốn quá nhiều công sức mỗi khi chuyển quạt sang vị trí mong muốn hay muốn vệ sinh lau chùi.. Bên cạnh đó, điểm nhấn ấn tượng của chiếc Quạt điều hòa giá rẻ này là cấu tạo thân nhựa ABS an toàn cho sức khỏe và nguyên lý hoạt động thân thiện với môi trường, không thải chất độc hại. Nhìn chung, sử dụng Quạt điều hòa vào mùa hè không chỉ giúp làm mát, bảo vệ sức khỏe, hạn chế tình trạng khô da mà còn giúp bảo vệ môi trường và tiết kiệm điện.. . . Hệ điều hành thông minh. Màn hình hiển thị chỉ số thông tin cho người sử dụng thông báo thiết lập bật/tắt của mỗi bộ phận. Nút điều khiển sẽ giúp điều chỉnh hướng cho quạt điều chỉnh hướng gió hướng lên xuống hay 2 phía trái phải. Mức gió quạt ra thường rất cao, hàng trăm cho đến trên nghìn m3 khí/giờ sẽ triệt tiêu không khí nóng hừng hực của mùa hè.. . Mặt khác, quạt được trang bị thêm chế độ gió êm nhẹ khi bật ở phòng ngủ, giúp giấc ngủ của bạn trở nên thư thái, nhẹ nhàng hơn.. Chế độ điều chỉnh hướng gió mát se se hợp lý hỗ trợ quý vị định bốn hướng rộng khắp khu vực đặt quạt theo hướng từ dưới lên trên và từ trái qua phải sẽ làm mát mẻ toàn căn phòng căn phòng.. Bạn sẽ khỏi phải lo lắng các vấn đề như khô ở da dẻ, mắt, mũi cổ họng như khi dùng điều hòa.. . Ưu điểm đắt giá của quạt điều hòa SUNHOUSE SHD7725. Quạt điều hòa Sunhouse vô cùng tiết kiệm lượng điện tiêu thụ và vì thế khi sử dụng sẽ tạo người tiêu dùng hoàn toàn không còn suy tư bởi chi phí điện năng trong mùa nóng này. Mức hao điện chỉ xấp xỉ 10-20% mỗi khi chiếc quạt đá như này hoạt động so cùng điều hòa nhiệt độ vậy thôi.. Quạt SUNHOUSE SHD7725 cũng không đem đến hơi sương thẫm nước trong không gian như quạt phun sương, cho nên sẽ loại bỏ các tình trạng không được tốt cho việc hít thở.. Đảm bảo và mang đến sức khỏe cho người tiêu dùng còn phải nhắc tới áp dụng cơ chế mang tới ion âm đẩy vào không khí để loại bỏ vi sinh bất lợi và nấm gây hại, làm sạch sẽ không khí.. . . . . . . Tư Vấn Mua Quạt điều hòa. . . . . . ",""""""
