Domain,Url,Product_id,Brand,Category,Model,Price,Seller,Tags,Info,Others
adayroi.com,https://www.adayroi.com/2n1d-luu-tru-phong-deluxe-tai-emt-homestay-hue-danh-cho-02-nguoi-lon-p-1726170?offer=1726170_172015,1726170,EMT HOMESTAY,Resort,2N1Đ Lưu Trú Phòng Deluxe Tại EMT Homestay - Huế Dành Cho 02 Người Lớn,218.000đ,EMT HOMESTAY,"Resort khác EMT HOMESTAY,Homestay Huế,Khách sạn giá rẻ Huế,EMT Homestay",". . EMT Homestay tọa lạc tại 33 Nguyễn Trường Tộ, cách sân bay Phú Bài 15km và rất gần ga Huế, bạn chỉ mất 5 phút để đi bộ đến sông Hương cũng như dễ dàng di chuyển đến các địa điểm du lịch nổi tiếng của cố đô như Tử Cấm Thành (2km), chợ Đông Ba (2km), Bảo tàng cổ vật cung đình Huế (1.9km). Hệ thống phòngnghỉ gồm có 21 phòng với đầy đủ các hạng phòng, có thể đáp ứngmọi nhu cầu của du khách. Các phòng với đầy đủ các trang thiết bị gọn gàng, sạch sẽ, hiện đại sẽ mang đến cho bạn cảm giác như đang ở trong chính ngôi nhà của mình. Phòng Deluxe - EMT Homestay Ngoài trang thiết bị hiện đại, một trong những lý do khiến EMT Homestay được nhiều du khách lựa chọn và là điểm đến quen thuộc mỗi khi có dịp tham quan tại Huế chính là đội ngũ nhân viên phục vụ nhiệt tình và chu đáo, luôn sẵn sàng đáp ứng nhu cầu của khách hàng, mang lại cho du khách sự thoải mái và vui vẻ. Click Mua ngay để nhận ưu đãi hấp dẫn tại Adayroi.com!",""""""
adayroi.com,https://www.adayroi.com/goi-2n1d-hodota-resort-vung-tau-thien-duong-camping-check-in-cuc-chat-tai-leu-go-p-1649422?offer=1649422_QTP,1649422,HODOTA RESORT,Resort,"Gói 2N1Đ Hodota Resort Vũng Tàu - Thiên Đường Camping, Check In Cực Chất Tại Lều Gỗ",299.000đ,HODOTA RESORT,"Resort Vũng Tàu HODOTA RESORT,Hodota Resort Vũng Tàu,Resort Vũng Tàu,Cắm trại",". . Vũng Tàu đã quá nổi tiếng với vô số những điểm đến tuyệt đẹp, hấp dẫn du khách trong và ngoài nước. Thành phố biển Vũng Tàu còn có một thiên đường cắm trại đang gây sốt khiến du khách đứng ngồi không yên mang tên Hodota Resort & Boating Center. Hodota Resort & Boating Center nằm ngay ngã ba tiếp giáp Bình Châu, Hồ Tràm và Hồ Cốc và khu nghỉ dưỡng này nằm trong khu vực biển Suối Ồ -Sông Lô, Bình Châu, Bà Rịa, Vũng Tàu. Và cũng chính nhờ vị trí đắc địa này mà khi đến Hodota bạn còn có thể kết hợp tham quan và khám phá rất nhiều điểm du lịch nổi tiếng kế bên. Ngay từ khi mới bước chân đến Hodota, chắc chắn bạn sẽ bị choáng ngợp bởi ở đây có rất nhiều không gian khác nhau, cảnh trítự nhiên mới mẻ, hoang sơ, thoáng đãng. Ở đây còn có bãi biển trải dài cùng bờ cát trắng mịn cùng những rặng phi lao, xen lẫn thấp thoáng sau cồn cát biển. Đến với khu nghỉ dưỡng Hodota, chắc hẳn ai cũng sẽ cảm giác như đang lạc vào một phim trường chụp ảnh nào đó bởi mọi ngóc ngách ở đây chỗ nào view cũng đẹp. Và nếu bạn là những tín đồ “sống ảo” thì Hodota Resort & Boating Center chắc chắn sẽ là điểm đến lí tưởng dành cho bạn bởi ở đây có rất nhiều background cho bạn sống ảo mà đi đến đâu cũng chỉ muốn giơ máy lên tạo dáng. Lều gỗ cực hot tại Hodota Resort Vũng Tàu Thật sự, đến Hodota chỉ ngắm cảnh, check in thôi cũng đã đủ mệt vì cảnh ở đây đẹp đến ngất ngây. Nhưng nếu đã đến Hodota rồi thì bạn đừng quên hòa mình xuống bãi biển Suối Ồ trong xanh, mát rượi, cùng bạn bè trải nghiệm những hoạt động vui chơi thú vị như chèo thuyền kayak, thuyền phao, thử thách bản thân với đu dây zipline mạo hiểm hay nhẹ nhàng ngồi câu cá thư giãn... Và bạn sẽ không khỏi bất ngờ bởi những chiếc thuyền mà du khách đến đây được trải nghiệm đều do ông bà chủ của Hodota Resort tạo nên bằng tâm huyết của mình dành cho khu du lịch xinh đẹp này. Có thể nói, mô hình du lịch nghỉ dưỡng, cắm trại ở Vũng Tàu đang mọc lên như nấm nhưng khu nghỉ dưỡng Hodota Resort & Boating Center ra đời vẫn không bị lu mờ mà ngược lại, đây dần dần đang trở thành điểm đến cực hot cho những chuyến đi thư giãn, nghỉ ngơi vào dịp cuối tuần. Click Mua ngay để nhận ưu đãi hấp dẫn tại Adayroi.com!",""""""
adayroi.com,https://www.adayroi.com/khu-da-ngoai-suoi-nuoc-mui-ne-cho-4-nguoi-co-bai-tam-rieng-01-dem-p-quadruple-p-dv_87182282?offer=dv_87182282_RTQ,dv_87182282,SUỐI NƯỚC RESORT,Resort,Khu Dã Ngoại Suối Nước - Mũi Né Cho 4 Người - Có Bãi Tắm Riêng - 01 Đêm P. Quadruple,599.000đ,SUỐI NƯỚC RESORT,"Resort Mũi Né SUỐI NƯỚC RESORT,khu dã ngoại Suối Nước Mũi Né,Suoi Nuoc Open Air Resort,nghĩ dưỡng tại mũi né",". . Là mộtđiểm du lịch Phan Thiết khá mới, không gian biển ở Khu dã ngoại Suối Nước Mũi Né còn hoang sơ yên ắng, như một thiếu nữ đẹp đang ngủ. Sự ví von đượm chút lãng mạn này như làm cho du khách thêm tò mò hơn về vẻ đẹp của nó. Suối Nước thuộc phường Mũi Né, nằm đoạn giữaHòn Rơmvà Hòn Nghề, có chiều dài khoảng 10km. Đây là cung đường ven biển tuyệt đẹp quen thuộc vẫn được du khách thu vào tầm ngắm của mình, mỗi khi có dịp đi quan trong hành trình Phan Thiết -Nha Trang. Suối Nước Open Air Resort - Thiên Đường Nghỉ Dưỡng Khu du lịchDã Ngoại Suối Nướclà nơi bạn sẽ được tận hưởng một khung cảnh tuyệt đẹp của các bãi tắm đẹp với nền cát trắng mịn, nước biển trong xanh, ánh nắng chan hòa, cách TP. Phan Thiết khoảng 35km, TP. HCM khoảng 150km, là nơi lý tưởng cho những chuyến du lịch dã ngoại và cắm trại. So với khu vựcbiển Mũi Néồn ào mà du khách từng biết đến, nơi thủ phủ của những khu nghỉ dưỡng lúc nào cũng đông đúc, thì Suối Nước như bức tranh hoàn toàn trái ngược với sự bình yên đến lặng lẽ. Chính sự bình yên lặng lẽ này đã chinh phục mạnh mẽ du khách, nhất là những người thích được ngắm nhìn biển khi còn mộc mạc chân phương. Khi đến đây bạn sẽ cảm thấy tuyệt vời bởi không gian rộng rãi thoáng mát, chào đón những tia nắng ấm áp vào buổi sáng sớm,hay những làn gió mát lạnh từ biển thổi vào, quý khách sẽ được đắm mình vào những làng nước trong xanh, được đi dạo và ngắm nhữngbãi biển dài, với những làng cát trắng xinh đẹp. Không chỉ bởi vẻ đẹp của bãi biển còn khá hoang sơ, không gian thật trong lành, SuốiNước còn tạo ấn tượng bởi quang cảnh hữu tình đến lạ lẫm của rừng tràm nước sát biển. Thêm vào đó là những đồi cát mênh mang nhoài ra biển, với những con suối nhỏ róc rách dòng nước mát lành chảy ra từ động cát trông thật độc đáo. Vào mùa hè, sóng ở khu vực biển Suối Nước này khá êm khá nhẹ, thế nên du khách có thể bơi lội thỏa thích trong dòng nước trong vắt và mát lạnh ở đây. Khu du lịchSuối Nước là nơi rất thích hợp cho các hoạt động cắm trại dã ngoại, là nơi được tất cả du khách lựa chọn là điểm đếnđầu tiên khi đến với TP. Phan Thiết, là nơi sẽ giúp quý khách quên đi những mệt mõi, căng thẳng trong cuộc sống thường ngày. Nếu như bạn đang có dự định đi tour du lịch Phan Thiết Mũi Né trong những ngày tới, mà còn băn khoăn về hành trình có vẻ mang tính lặp lại, thì đừng ngần ngại chọn điểm đến Suối Nước Mũi Né nhé. Chắc chắn nơi này sẽ là một niềm vui mới và nguồn hứng khởi mới cho bạn, giúp bạn thêm một lần khám phá và trải nghiệm những điều tuyệt vời của biển mà có thể đã từ lâu bị chôn vùi bởi những hành trình du lịch biển đã có vẻ hơi cũ kỹ. Nhanh tay click Mua ngay hôm nay để nhận được những ưu đãi hấp dẫn tại Adayroi bạn nhé! Khách hàng vui lòng liên hệ số điện thoại 1900 1901 để được hỗ trợ đặt chỗ.",""""""
adayroi.com,https://www.adayroi.com/goi-2n1d-nha-hobbit-hodota-resort-vung-tau-thien-duong-camping-check-in-cuc-chat-p-1174561?offer=1174561_QTP,1174561,HODOTA RESORT,Resort,"Gói 2N1Đ Siêu Hot Hodota Resort Vũng Tàu - Thiên Đường Camping, Check In Sang Chảnh Mới",599.000đ,HODOTA RESORT,"Resort Vũng Tàu HODOTA RESORT,Cắm trại,Resort Vũng Tàu,Hodota Resort Vũng Tàu",". . Vũng Tàu đã quá nổi tiếng với vô số những điểm đến tuyệt đẹp, hấp dẫn du khách trong và ngoài nước. Thành phố biển Vũng Tàu còn có một thiên đường cắm trại đang gây sốt khiến du khách đứng ngồi không yên mang tên Hodota Resort & Boating Center. Hodota Resort & Boating Center nằm ngay ngã ba tiếp giáp Bình Châu, Hồ Tràm và Hồ Cốc và khu nghỉ dưỡng này nằm trong khu vực biển Suối Ồ -Sông Lô, Bình Châu, Bà Rịa, Vũng Tàu. Và cũng chính nhờ vị trí đắc địa này mà khi đến Hodota bạn còn có thể kết hợp tham quan và khám phá rất nhiều điểm du lịch nổi tiếng kế bên. Ngay từ khi mới bước chân đến Hodota, chắc chắn bạn sẽ bị choáng ngợp bởi ở đây có rất nhiều không gian khác nhau, cảnh trítự nhiên mới mẻ, hoang sơ, thoáng đãng. Ở đây còn có bãi biển trải dài cùng bờ cát trắng mịn cùng những rặng phi lao, xen lẫn thấp thoáng sau cồn cát biển. Đến với khu nghỉ dưỡng Hodota, chắc hẳn ai cũng sẽ cảm giác như đang lạc vào một phim trường chụp ảnh nào đó bởi mọi ngóc ngách ở đây chỗ nào view cũng đẹp. Và nếu bạn là những tín đồ “sống ảo” thì Hodota Resort & Boating Center chắc chắn sẽ là điểm đến lí tưởng dành cho bạn bởi ở đây có rất nhiều background cho bạn sống ảo mà đi đến đâu cũng chỉ muốn giơ máy lên tạo dáng. Nhà thỏ Hobbit Thật sự, đến Hodota chỉ ngắm cảnh, check in thôi cũng đã đủ mệt vì cảnh ở đây đẹp đến ngất ngây. Nhưng nếu đã đến Hodota rồi thì bạn đừng quên hòa mình xuống bãi biển Suối Ồ trong xanh, mát rượi, cùng bạn bè trải nghiệm những hoạt động vui chơi thú vị như chèo thuyền kayak, thuyền phao, thử thách bản thân với đu dây zipline mạo hiểm hay nhẹ nhàng ngồi câu cá thư giãn... Và bạn sẽ không khỏi bất ngờ bởi những chiếc thuyền mà du khách đến đây được trải nghiệm đều do ông bà chủ của Hodota Resort tạo nên bằng tâm huyết của mình dành cho khu du lịch xinh đẹp này. Có thể nói, mô hình du lịch nghỉ dưỡng, cắm trại ở Vũng Tàu đang mọc lên như nấm nhưng khu nghỉ dưỡng Hodota Resort & Boating Center ra đời vẫn không bị lu mờ mà ngược lại, đây dần dần đang trở thành điểm đến cực hot cho những chuyến đi thư giãn, nghỉ ngơi vào dịp cuối tuần. Click Mua ngay để nhận ưu đãi hấp dẫn tại Adayroi.com!",""""""
adayroi.com,https://www.adayroi.com/2n1d-thao-nguyen-resort-4-moc-chau-p-standard-gom-buffet-sang-be-boi-p-dv_73554060?offer=dv_73554060_RUN,dv_73554060,THẢO NGUYÊN RESORT/ THẢO NGUYÊN HOTEL,Resort,2N1Đ Thảo Nguyên Resort 4* Mộc Châu P. Standard Gồm: Buffet Sáng + Bể Bơi,610.000đ,THẢO NGUYÊN,"Resort khác THẢO NGUYÊN RESORT/ THẢO NGUYÊN HOTEL,Resort Mộc Châu,Thảo Nguyên Resort Mộc Châu",". . Thảo Nguyên Resort được xây dựng trên cao nguyên Mộc Châu, là khu du lịch, nghỉ dưỡng hấp dẫnvùng Tây Bắc. Với diện tích 6 ha, các villa nằm rải rác trên các sườn đồi được thiết kế sang trọng, khoáng đạt và là sự tổng hòa tuyệt vời giữa thiên nhiên và những nét tinh hoa kiến trúc. Adayroi mang đến cho bạn voucher2N1Đ Thảo Nguyên Resort 4* Mộc Châu P. Standard Gồm: Buffet Sáng + Bể Bơi giá chỉ 610.000VND, giảm 24% so với giá gốc 800.000VND! Thảo Nguyên Resort với thiết kế độc đáo đưa “không gian sống” thơ mộng vào mỗi bungalow để du khách có thể tận hưởng nghỉ ngơi, an dưỡng giữa không gian thiên nhiên xanh, bốn mùa hoa nở cùng khí hậu trong lành mát mẻ. Resort bao gồm 100 phòng nghỉ được các kiến trúc sư thổi hồn vào trong các thiết kế, tất cả các phòng đều hướng ra không gian xanh bao la để du khách có thể hòa mình vào với thiên nhiên. Mỗi một Villa lại mang những nét tinh hoa kiến trúc riêng, luôn tạo sự mới lạ cho du khách Thảo Nguyênluôn luôn sẵn sàng cung cấp những tiện ích và dịch vụ cao cấp cho bạn từ nghỉ dưỡng, ẩm thực, chăm sóc sức khỏe, sắc đẹp tại spa hàng đầu Mộc Châu. Với tiêu chí đặt sự hài lòng khách hàng lên trên hết, Thảo Nguyênluôn cố gắng đáp ứng tất cả các nhu cầu của bạn dù là nhỏ nhất. Bể bơi bốn mùa cao cấp và hiện đại bậc được xây dựng trong nhà với diện tích lớn và nhiều tiện ích, bao gồm khu bể bơi cho người lớn và khu bể bơi cho trẻ em. Ngoài ra, phòng tập Gym, phòng tập Aerobic cũng được trang bị trang thiết bị đồng bộ. Bên cạnh đó, sau một ngày vui chơi, khám phá hoặc gặp gỡ đối tác, du khách có thểlựa chọn một góc thoải mái, thả mình trên những chiếc ghế thoải mái, thưởng thức ly nước mát lạnh, hấp dẫn được pha chế bởi barista tại quầycafe - bar củaThảo NguyênResort. Khu vực Quầy Bar và karaoke của resort xứng đáng là một khu giải trí theo tiêu chí lịch sự và thư giãn, được thiết kế theo lối kiến trúc độc đáo và bắt mắt Không gian sang trọngcùng tinh hoa ẩm thực quốc tế và chất lượng dịch vụ hàng đầu sẽ mang lại ấn tượng tuyệt vời cho khách mời của quý vị. Thoải mái lựa chọn thực đơn, phong cách thiết kế tiệc và ban nhạc phục vụ tại chỗ. Thậm chí quý khách có thể lên thực đơn hoàn toàn mới với sự tư vấn chuyên nghiệp của đội ngũ bếp và tổ chức sự kiện. Quây quần bên bàn tiệc, vừa thưởng thức những hương vị hảo hạng cùng thức uống tuyệt vời, vừa chiêm ngưỡng thiết kế tinh xảo đẳng cấp của Thảo Nguyên. Thảo Nguyên Resort là một thế giới kiến trúc hiện đại và đẳng cấp, hòa mình vào khí hậu se lạnh của cao nguyên, bốn mùa hoa nở. Đội ngũ nhân viên chuyên nghiệp, nhiệt tình cùng với những dịch vụ cao cấp và đặc sắc, Thảo Nguyên Resort sẽ mang đến cho quý khách những ngày nghỉ tuyệt vời với nhiều cung bậc cảm xúc, hòa mình vào thiên nhiên. Nhanh tay click Mua ngay hôm nay để nhậnnhững ưu đãi hấp dẫn tại Adayroi bạn nhé! Khách hàng vui lòng liên hệ số điện thoại 1900 1901 để được hỗ trợ đặt chỗ.",""""""
adayroi.com,https://www.adayroi.com/bao-ninh-beach-resort-4-quang-binh-gia-uu-dai-cuoi-nam-phong-standard-an-sang-buffet-p-1242934?offer=1242934_165015,1242934,BẢO NINH BEACH RESORT,Resort,Bảo Ninh Beach Resort 4* Quảng Bình- Giá Ưu Đãi Cuối Năm Phòng Standard + Ăn Sáng Buffet,Siêu khuyến mại: ,BẢO NINH BEACH RESORT,"Resort khác BẢO NINH BEACH RESORT,Bảo Ninh Beach Resort 4* Quảng Bình,Bảo Ninh Beach Resort,nghỉ dưỡng cuối năm",". . Du lịch miền Trung đang ngày càng hấp dẫn du khách, song song vớiđó là việc phát triển của những resort, khách sạn được đầu tư kỹ lưỡng. Bạn đang lên kế hoạch nghỉ dưỡng tại Quảng Bình dịp cuối năm? Bảo Ninh Beach Resort chắc chắn sẽkhiến bạn thích mê ngay khi mới đặt chân tới, đảm bảo sẽ giúp bạncó một kỳ nghỉ đáng nhớ. Bảo Ninh Resort - Lựa chọn sáng suốt cho kỳ nghỉ cuối năm Bảo Ninh Beach Resort - khu du lịch sinh thái biển cao cấp tại thành phố biển Đồng Hới, tọa lạc trên một bán đảo cát trắng tuyệt đẹp tại với tổng diện tích 6,3ha. Bảo Ninh Beach Resort cách trung tâm thành phố 2km, cách sân ga Đồng Hới 5km, bến xe 3km và cách sân bay Đồng Hới 9km.Đến với Bảo Ninh, du khách sẽ được đắm mình trong dòng nước xanh mát của biển buổi bình minh, ngắm nhìn mặt trời lặn lúc hoàng hôn hay thưởng thức các món đặc sản đậm đà hương vị biển. Bảo Ninh Resort được nhiều người lựa chọn cho kỳ nghỉ của mình vì nằm ngay trên bán đảo Bảo Ninh rất thuận tiện trong việc di chuyển tới những danh lam thắng cảnh tại Quảng Bình như Động Thiên Đường, Thành cổ Quảng Trị, Động Phong Nha,... Ngoài ra khách du lịch còn được tận hưởng không khí trong lành bên bãi biển trong xanh với bờ cát trắng trải dài. Bảo Ninh Beach Resort được xây dựng từ năm 2012.Resort được thiết kế có rất nhiều cây xanh với 100 phòng nghỉ đạt tiêu chuẩn 4 sao, 2 bể bơi ngoài trời và 2 nhà hàng có thể đáp ứng được cả những thực khách khó tính. Tại đây bạn còn được trải nghiệm các phương pháp massage toàn thân, massage chân, xông hơi chuyên nghiệp. Đến với Bảo Ninh Resort Quảng Bình,bạn sẽhoàn toàn hài lòng với thái độ phục vụ của nhân viên. Sảnh rộng rãi sang trọng tại Bảo Ninh Resort Nằm giữa màu xanh của biển, của trời, xen kẽ trong khuôn viên resort là những khoảng xanh mơn mởn cùng sắc hoa tươi khoe mình dưới nắng vàng rực rỡ. Bảo Ninh Beach Resort được thiết kế theo kiến trúc hiện đại ở trong phòng và không gian bên ngoài gần gũi với thiên nhiên. Khuôn viên xanh của Bảo Ninh Resort Hệ thống phòng Standard đầy đủ tiện nghi Bên cạnh khuôn viên xanh mướt và trong lành, Bảo Ninh Beach Resort còn làmhài lòng du khách bằng không gian nghỉ dưỡng thoải mái, dễ chịu. Phong cách thiết kế trang nhã, hài hòa cùng không gian nội thất lãng mạnđã tạo nên bầu không khí dễ chịu chẳng khác gì bạn đang ở trong ngôi nhà của chính mình. Mọi vật dụng đều được bố trí khéo léo, tạo nên bầu không khí nhẹ nhàng và thân thiện cho du khách. Phòng Standard tại Bảo Ninh Beach Resort được trang bị đầy đủ trang thiết bị và tiện nghi, đảm bảo mang lại cho bạn khoảng thời gian nghỉ dưỡng hài lòng, bao gồm: Tivi truyền hình cáp, phòng tắm đứng, vòi sen, tủ lạnh, điều hòa nhiệt độ 2 chiều, két sắt... Khám phá các dịch vụ khác ngay tại resort Với mong muốn khách hàng được thư giãn và cảm nhận phong cách phục vụ chuyên nghiệp, khu vực hồ bơi ngoài trời của Bảo Ninh Beach Resort dành riêng cho các du khách đặt phòng tại đây sẽ đem đến cho bạn cơ hội đắm mình dưới làn nước trong veo và mát lạnh. Quầy bar cạnh hồ bơi Khu vực nhà hàngluôn sẵn sàng phục vụ thực khách với thực đơn đa dạng từ các món hải sản tươi ngon tại địa phương. Trong khung cảnh thiên nhiên hữu tình, bạn sẽ được thưởng thức các món ăn ngon, thấm đượm hương vị biển mặn mà do bàn tay củađội ngũ đầu bếp chuyên nghiệp chế biến. Resort còn phục vụ nhu cầu giải trí của bạn với dịch vụ phòng karaoke được đầu tư các thiết bị kỹthuật tiên tiến, âm thanh hiện đại. Nơi đây sẽ mang đến cho các du khách ""bữa tiệc"" âm nhạc sống động khi bạn muốn thư giãn giữa những bản nhạc bất tận. Phòng karaoke tại resort Đặc biệt, resort còn có bãi biển riêng rộng rãi, thích hợp cho các hoạt động tắm biển hoặc tham gia vui chơi thể thao, cắm trại, du lịch bằng tàu hay trải nghiệm các môn thể thao như bơi xuồng cao su, lướt ván... hay đơn giản là cùng nhaungắm biển trong không gian cực kỳ lãng mạn. Đừng bỏ quaBảo Ninh Beach Resort trong kế hoạch nghỉ dưỡng cuối nămcủa bạn!",""""""
adayroi.com,https://www.adayroi.com/viva-boutique-resort-3-mui-ne-2n1d-p-standard-an-sang-buffet-p-1828519?offer=1828519_090013,1828519,VIVA BOUTIQUE RESORT,Resort,Viva Boutique Resort 3* Mũi Né 2N1Đ P. Standard + Ăn Sáng Buffet,737.000đ,VIVA BOUTIQUE,"Resort Mũi Né VIVA BOUTIQUE RESORT,Viva Boutique Resort,resort Mũi Né",". . Tọa lạc tại vùng biển Mũi Né, một trong những địa điểm nổi tiếng của Phan Thiết được rất nhiều người biết đến với những bờ cát trắng trải dài, biển xanh và những hàng dừa cong vút. Chỉ với 5 phút lái xe từ khách sạn, quý khách có thể tham quan, khám phá các điểm du lịch và dịch vụ nổi tiếng của thành phố. Khách sạn không chỉ làm hài lòng quý khách bởi không gian lý tưởng với thiết kê phòng ngủ hiện đại kết hợp sự hòa quyện và gần gũi với thiên nhiên biển-trời, Viva Boutique Resort còn tạo được ấn tượng bởi phong cách phục vụ chuyên nghiệp, nhiệt tình và thân thiện của đội ngũ nhân viên giàu kinh nghiệm luôn sẵn sàng phục vụ quý khách hàng. Hãy đến với Viva Boutique Resort để trải nghiệm sự ấm cúng và lòng mến khách! Nghỉ dưỡng 2N1Đ phòng Standard Đến Viva Boutique Resortcùng voucher hấp dẫn từ Adayroi, du khách có cơ hội tận hưởng 2N1Đnghỉ dưỡng tại căn phòng Standard với diện tích 20m2, gồm 01 giường đôi lớn hoặc 02 giường đơn.Điểm nhấn nổi bật là ban công rộng hướng tầm nhìn khung cảnh trong lành, thoáng mát, giúp căn phòng luôn tràn ngập ánh sáng tự nhiên. Đặc biệt, phòng được thiết kế theo phong cách đơn giản,tôn lên vẻ thanh lịch, trang nhã, tạo cảm giác thoải mái, dễ chịu cho du khách. Phòng Standard bao gồm ăn sáng tại Viva Boutique Resort Trải nghiệm các dịch vụ Resort Nhà hàng nhỏ nhắn, xinh xắn được đặt trong khuôn viên khách sạn sẽ mang đến cho thực khách khoảng thời gian nghỉ ngơi dễ chịu. Không gian được bày trí hiện đại, tạo cảm giác lãng mạn, ấm cúng, thực đơn đa dạng, phong phú, đồ ăn tươi ngon, bổ dưỡng, giúp bạn nhanh chóng phục hồi tinh thần, thể chất sau những giờ vui chơi, làm việc mệt mỏi. Bên cạnh vị trí đẹp, Viva Boutique Resortcòn cung cấp chuỗi dịch vụ toàn diện, chất lượng cao gồm: Hồ bơi, nhà hàng, spa, dịch vụ phòng, thang máy, xe đưa đón sân bay, cho thuê xe đap, giặt ủi, tour, lễ tân 24h, giữ hành lí... Ngoài ra, đội ngũ nhân viên được đào tạo bài bản, thái độ phục vụ chuyên nghiệp, thân thiện, nhiệt tình cũng giúp Viva Boutique Resort “ghi điểm” trong mắt bạn bè Quốc tế. Hồ bơi ngoài trời Quầy bar khách sạn Dịch vụ Spa bãi biển Nhanh tay click Mua ngay hôm nay để nhận những ưu đãi hấp dẫn tại Adayroi bạn nhé! Khách hàng vui lòng liên hệ số điện thoại 1900 1901 để được hỗ trợ đặt chỗ.",""""""
