Domain,Url,Product_id,Brand,Category,Model,Price,Seller,Tags,Info,Others
adayroi.com,https://www.adayroi.com/-combo-2n1d-pu-luong-retreat-resort-p-valley-view-bungalow-xe-don-tien-tu-ha-noi-p-dv_99957278?offer=dv_99957278_097017,dv_99957278,PÙ LUÔNG RETREAT,Resort,"[Combo 2N1Đ] Pù Luông Retreat Resort, P.Valley View Bungalow + Xe Đón Tiễn Từ Hà Nội",3.100.000đ,PÙ LUÔNG RETREAT,"Resort khác PÙ LUÔNG RETREAT,Resort Thanh Hóa ,Pù Luông Retreat Resort",". . Cách Hà Nội 180km, tương đương gần 4h xe chạy, Pù Luông Retreat được xây dựng xinh xắn ẩn mình giữa núi rừng nguyên sinh, những nếp nhà yên bình của bản Đôn -Bá Thước, Thanh Hóa. Một địa thế tuyệt đẹp với những dãy núi của Sapa, những thửa ruộng bậc thang Mù Cang Chải, những khúc cua tay áo từa tựa Hà Giang, những ngôi làng truyền thống của Mai Châu với di sản văn hóa độc đáo, tất cả sẽ hội tụ ở Pù Luông. Khu du lịch Pù Luông ẩn mình giữa thiên nhiên tươi đẹp Pù Luông Retreat là thế giới hoàn toàn khác với nếp sống thành thị nhộn nhịp và ồn ào, một nơi thiên nhiên hoàn toàn hoang sơ. Hãy sử dụng mọi giác quan của bạn để cảm nhận về Pù Luông. Khu retreat được xây dựng lưng tựa núi, phía trước hướng tầm nhìn ra thung lũng ngát xanh. Thậm chí, chẳng cần bước ra ngoài, bạn chỉ cần đứng ở cửa sổ nhìn ra cũng đủ để thấy trước mặt mình là một bức tranh tuyệt đẹp. Gần gũi với thiên nhiên, mang màu sắc văn hóa riêng của vùng miền nhưng vẫn đủ sự tinh tế của một khu nghỉ dưỡng. Lấy cảm hứng từ thiên nhiên, Pù Luông Retreat được xây dựng hoàn toàn từ nguyên liệu tự nhiên dân dã với mái cọ, nội thất tre gỗ… Các phòng nghỉ và bungalow là sự kết hợp hài hòa, tinh tế, luôn có cảm giác an nhiên, tự tại. Mọi góc nhỏ nơi đây đều rất nên thơ, những khung cửa sổ ngập tràn nắng mai nhìn ra thửa ruộng bậc thang, những chiếc ghế đu bằng gỗ mộc mạc. Điều tuyệt vời ở đây là bể bơi nước tràn, chỉ cần tựa lưng vào thành bể, ngắm nhìn những đỉnh núi trùng điệp trải dài phía trước, mọi căng thẳng, áp lực dường như đều tan biến. Phòng Valley View Bungalow có diện tích 42m2, tầm nhìn ngoạn mục hướng núi đồi, ngay từ giường ngủ của mình, bạn có thể ngắm nhìn cảnh sắc thiên nhiên tươi đẹp. Phòng tắm đá cẩm thạch với vòi sen nước nóng luôn sẵn sàng để phục vụ du khách chu đáo. Nằm giữa khu bảo tồn thiên nhiên và cũng đi theo “con đường” du lịch sinh thái, thế nên ở Pù Luông Reatreat cũng không có quá nhiều tiện nghi. Lưu trú tại đây, bạn sẽ tạm biệt với tủ lạnh, điều hòa, ti vi… Đừng vội nhăn mặt tiếc nuối, bởi bạn sẽ có một cuộc chạy trốn ngắn ngày đầy ắp sự bình yên. Nghỉ ngơi ở Pù Luông Retreat, du khách có thể tận hưởng nhiều trải nghiệm thú vị như chèo kayak trên suối, đi bè tre trên sông, trekking qua các bản làng truyền thống và những thửa ruộng bậc thang, tham quan khu guồng nước khổng lồ, thác nước tự nhiên, hang động kì vĩ… Click Mua ngay để nhận những ưu đãi hấp dẫn tại Adayroi.com!",""""""
adayroi.com,https://www.adayroi.com/furama-resort-5-da-nang-2n1d-xe-dua-di-tham-quan-pho-co-hoi-an-khong-tinh-phi-p-409782?offer=409782_QJK,409782,FURAMA RESORT DA NANG,Resort,Furama Resort 5* Đà Nẵng 2N1Đ - Xe Đưa Đi Tham Quan Phố Cổ Hội An Không Tính Phí,3.815.000đ,FURAMA RESORT,Resort Đà Nẵng FURAMA RESORT DA NANG,". . Có thể bạn chưa biết? Đà Nẵng không chỉ nổi tiếng với nhiều danh thắng tuyệt đẹp làm say lòng du khách như núi Ngũ hành sơn, đỉnh Bà Nà, bán đảo Sơn Trà, đèo Hải Vân, sông Hàn thơ mộng, bãi biển Mỹ Khê đẹp trênhành tinh, Đà Nẵng còn níu chân du khách bởi nền ẩm thực đặc sắc, không khí trong lành, nụ cười hồn hậu của cư dân và những dịch vụ hấp dẫn. Chính vì vậy, Đà Nẵng đã liên tục được bình chọn là một trong những điểm du lịch không thể bỏ qua khi đến Việt Nam. Mới đây, người dùng của trang TripAdvisor đã đánh giá Đà Nẵng là thành phố hấp dẫn trên thế giới. Đây thực sự là tin vui với ngành du lịch Việt Nam, bởi đánh giá của TripAdvisor không phải do một vài biên tập viên du lịch tự đưa ra, mà do kết quả bình chọn của rất nhiều du khách đã từng đến và trải nghiệm vẻ đẹp của vùng đất này. Đến Đà Nẵng lần này, Adayroi.com mang đến ưu đãi tuyệt vời cho bạn khi tận hưởng 02 ngày 01 đêm nghỉ dưỡng tại Furama Resort, miễn phí xe đưa đi tham quan phố cổ Hội Ancho 02 người . Tận hưởng kì nghỉ dưỡng Furama Resort 5* Đà Nẵng Furama Resort 5* có vị trí lý tưởng khi tọa lạc ngay trung tâm thành phố, gần chợ, siêu thị, trung tâm giải trí, ngân hàng... thuận tiện cho cả khách du lịch và khách doanh nhân khi đến với Đà Nẵng.Với vị trí thuận lợi nên từ khách sạn du khách dễ dàng tiếp cận những điểm tham quan du lịch nổi tiếng của thành phố như: Bãibiển Mỹ Khê, bảo tàng Chăm, Ngũ Hành Sơn, cầu Rồng,... Với vị trí thuận tiện, không gian đẳng cấp cùng các dịch vụ nghỉ dưỡng tuyệt vời, Furama Resort 5* đã hân hạnh tiếp đón nhiều quan chức, hoàng thân, và cácngôi sao nổi tiếng trên thế giới như Tổng thống Nathan của Singapore, Tổng thống Papoulias của Hy Lạp, nữ hoàng Sofia Tây Ban Nha, Thái tử Henrik của Đan Mạch, Tổng thư ký ASEAN Pitsuwan cũng như Hoa hậu thế giới 2008 Ksenia Sukhinova,... cùng rất nhiều nhân vật nổi tiếng khác. Lối kiến trúc tại Furama Resort 5* là sự pha trộn hoàn hảo của kiến trúc hiện đại được thiết kế theo phong cách và nghệ thuật truyền thống Việt Nam. Ngoại thất và nội thất tại khách sạn sang trọng mà ấm cúng. Hệ thống phòng nghỉ tại khách sạn đều có không gian rộng rãi, điểm đặc biệt tại các phòng của khách sạn là đều được thiết kế với cửa sổ lớn. Tất cả các phòng tại đây đều được thiết kế trang nhã và có ban công riêng nhìn ra quang cảnh nhiệt đới. Trong phòng có sàn gỗ và thảm thanh lịch cùng tủ quần áo không cửa ngăn, không gian tiếp khách rộng rãi và phòng tắm lớn lát đá cẩm thạch. Phòng Garden View được trang bị phòng tắm riêng với vòi sen nước nóng, TV truyền hình cáp, tủ lạnh mini và khu vực tiếp khách thoải mái. Ngoài ra, với chất lượng dịch vụ cao cấp, wifiđược cung cấp miễn phí trong toàn bộ khuôn viên khách sạn sẽ làm cho kỳ nghỉ của bạn thật sự hoàn hảo. Phòng Garden Deluxe tiện lợi 02 giường đơn View hướng vườn tuyệt đẹp Café Indochine phục vụ đủ các mónẩm thực toàn châu Á và quốc tế đa dạng trong không gianPháp lãng mạn. Tại đây cũng có Don Cipriani’s phục vụ các món ăn Ý truyền thống và nhà hàng bít-tết trước biển The Fan. Hai Van Lounge là 1 trong 3 quầy bar có ban nhạc Philippines trình diễn hàng đêm, mang đến sự lựa chọn đa dạng cho du khách. Furama Resort 5* còn cung cấp các liệu pháp spa và làm đẹp cao cấp, bao gồm nhiều kiểu massagevà chăm sóc da mặt. Khách có thể thư giãn trong phòng xông hơi ướt và phòng xông hơi khô hoặc tận hưởng dịch vụ massagecạnh hồ bơi. Water Sport House trong khuôn viên resort có các thiết bị cho khách chơi lướt ván buồm, chèo thuyền kayak trên biển và lướt sóng. Resortcũng có các lớp tập yoga và Thái Cực Quyền trên bãi biển. Các vị khách nhỏ tuổi sẽ thích thú với rạp chiếu phim và phòng trò chơi được trang bị máy Play Station 3. Tham gia các hoạt động thú vị tại Furama Resort 5* Hồ bơi riêng đẳng cấp Thông tin cho bạn: Furama Resort 5* Website: http://www.furamavietnam.com/ Địa chỉ:Số 105, Đường Võ Nguyên Giáp, Phường Khuê Mỹ, Quận Ngũ Hành Sơn, Đà Nẵng. Nhanh tay click Mua ngay hôm nay để nhận những ưu đãi hấp dẫn tại Adayroi.com bạn nhé! Khách hàng vui lòng liên hệ số điện thoại 1900 1901 để được hỗ trợ đặt chỗ.",""""""
adayroi.com,https://www.adayroi.com/uu-dai-tet-3n2d-silk-path-grand-resort-spa-sapa-5-nghi-duong-sang-chanh-p-2048324?offer=2048324_140113,2048324,SILK PATH GRAND RESORT & SPA SAPA,Resort,Ưu Đãi Tết_3N2Đ Silk Path Grand Resort & Spa Sapa 5* - Nghỉ Dưỡng Sang Chảnh,3.900.000đ,SILK PATH,"Resort khác SILK PATH GRAND RESORT & SPA SAPA,Khách sạn 5* Sapa",". . ​Tọa lạc trên ngọn đồi riêng với tầm nhìn ôm trọn dãy núi Hoàng Liên Sơn, Silk Path Grand Resort & Spa sở hữu vẻ đẹp tinh tế, quý phái theo đúng tinh thần Châu Âu nhờ phong cách kiến trúc Đông Dương đặc trưng thời Pháp thuộc, cùng họa tiết trang trí đậm nét Sapa bản địa. Silk Path Grand Resort & Spa 5* - Khu nghỉ dưỡng nằm trên ngọn đồi xinh đẹp Đây là khu nghỉ dưỡng sang trọng đầu tiên trong bộ sưu tập các khu nghỉ dưỡng 5* tiêu biểu đầu tư và quản lý bởi thương hiệu Silk Path Hotels & Resorts, Silk Path Grand Resort & Spa Sapa sở hữu 152 phòng ngủ và biệt thự sang trọng với tổng diện tích lên tới 2ha. Lấy cảm hứng từ những tòa lâu đài Pháp kiêu sa, Silk Path Grand Resort & Spa Sapa đã khéo léo tái hiện không gian nghỉ dưỡng cổ điển và kiêu hãnhtưởng chỉ tìm thấy tại Paris hoa lệ. Trần nhà cao, nội thất bằng gỗ được tạo hình cầu kỳ, đèn chùm lớn làm từ vàng và đồng, bộ sưu tập những tác phẩm nghệ thuật đắt giá, những chi tiết trang trí hoa văn thổ cẩm bằng vải trên tường ẩn chứa bản sắc dân tộc H’mong, Tày, Dao, những bức tranh sơn mài, những tấm thảm dệt tay khéo léo hay bình gốm họa tiết trang nhã….tất cả như đưa lữ khách vượt thời gian, sống lại khoảng ký ức lấp lánh của Sapa một thời. Nghỉ dưỡng tại Silk Path Grand Resort & Spa Sapa, dù trong phòng khách, bên hiên nhà, dọc lối đi hay tại những khu vườn nhỏ, đâu đâu bạn cũng có thể chiêm ngưỡngnhững đóa hồng cổ, hồng Đà Lạt, cẩm tú cầu, đào rừng hay các loài hoa quý ngào ngạt hương sắc. Đặc biệt, khi nàng Xuân gõ cửa, toàn bộ khu nghỉ dưỡng được điểm tô bởi hàng trăm cây hoa mơ, mận, đào rừng khiến khung cảnh càng trở nên lãng mạn, thơ mộng. Tưởng tượng mỗi sớm mai thức giấc, bước một bước, bạn sẽ thấy mình bên hiên ban công rộng mở, tận hưởng khu vườn nhỏ nên thơ, hít hà chút trong veo của sáng sớm vùng cao và thưởng ngoạn khung cảnh kỳ vĩ của dãy Hoàng Liên Sơn. Khi hoàng hôn nhẹ buông là lúc những ánh nắng cuối ngày rớt xuống những đóa hoa, khu vườn và len lỏi vào bể bơi, phòng ngủ. Đắm mình trong khung cảnh hoàng hôn nhuộm đỏ phố núi, bạn sẽ quên đi mọi mỏi mệt, ngột ngạt của cuộc sống thường nhật, để góp nhặt thêm những kỷ niệm tuyệt đẹp. Bể bơi trong nhà với tầm nhìn hướng núi tuyệt đẹp Và tất nhiên, một kỳ nghỉ kiểu Âu sẽ không thể thiếu tiệc trà chiều mang phong cách quý tộc. Khay bánh 3 tầng với những loại bánh nhỏ xinh và trà thượng hạng được đầu bếp của Café 1500 chuẩn bị tỉ mỉ, chờ bạn thưởng thức. Khu ẩm thực Hệ thống phòng nghỉ với view tuyệt đẹp ​Thiết kế theo phong cách xen lẫn cổ kính và hiện đại, khách sạn Silk Path Grand Resort & Spa 5* với hệ thốngphòng nghỉ rộng rãi, thoáng mát và sạch sẽ. Phòng Classiccó không gian mở vớibề mặt kính lớn, giúp bạn tận hưởngánh sáng, không khí và hướng nhìn tuyệt đẹp ra dãy Fansipan bồng bềnh mây phủ và hướng phố cổ tấp nập. Phòng Classic -Silk Path Grand Resort & Spa 5* Trở về sau ngày dài tham quan, Chi Spa là nơi lý tưởng để thư giãn và tái tạo năng lượng. Tại đây, những trị liệu cân bằng độc đáo, liệu pháp Tắm lá người dao được nâng tầm 5 sao hứa hẹn đưa bạn vào hành trình tìm lại chính mình qua 05 giác quan và xúc cảm. Kiến trúc xanh nhờ hệ thống vườn cây được chăm sóc tỉ mỉ mang tới sự bầu không khí trong lành và thư thái cho nơi đây, cùng với vị trí thuận tiện cho du khách đắm mình trong nền văn hoá dân tộc độc đáo và phong cách sống của người dân bản địa. Bên cạnh đó, khu nghỉ dưỡng còn có nhiều hoạt động quanh năm phù hợp với mọi thành viên trong gia đình, từ câu lạc bộ dành cho trẻ em đến những dịch vụ giải trí cho cha mẹ như karaoke, thư viện, bể bơi, cũng như những hoạt động tham quan ngoài trời thú vị. Phòng Hội nghị Hội thảo Phòng Karaoke Phòng tập Gym Click Mua ngay để nhận ưu đãi hấp dẫn từ Adayroi.com!",""""""
adayroi.com,https://www.adayroi.com/thao-nguyen-resort-4-moc-chau-2n1d-biet-thu-5-phong-ngu-cho-10-nguoi-buffet-sang-p-dv_12946807?offer=dv_12946807_RUN,dv_12946807,THẢO NGUYÊN RESORT/ THẢO NGUYÊN HOTEL,Resort,Thảo Nguyên Resort 4* Mộc Châu 2N1Đ: Biệt Thự 5 Phòng Ngủ Cho 10 Người + Buffet Sáng,4.020.000đ,THẢO NGUYÊN,"Resort khác THẢO NGUYÊN RESORT/ THẢO NGUYÊN HOTEL,Resort Mộc Châu,Thảo Nguyên Resort Mộc Châu",". . Thảo Nguyên Resort được xây dựng trên cao nguyên Mộc Châu, là khu du lịch, nghỉ dưỡng củavùng Tây Bắc. Với diện tích 6ha, các villa nằm rải rác trên các sườn đồi được thiết kế sang trọng, khoáng đạt và là sự tổng hòa tuyệt vời giữa thiên nhiên và những nét tinh hoa kiến trúc. Adayroi mang đến cho bạn voucher 2N1Đ Thảo Nguyên Resort 4* Mộc Châu Biệt Thự 5 Phòng Ngủ Cho 10 Người+ Buffet Sáng giá chỉ 4.020.000VND, giảm 33% so với giá gốc 6.000.000VND! Thảo Nguyên Resort với thiết kế độc đáo đưa “không gian sống” thơ mộng vào mỗi bungalow để du khách có thể tận hưởng nghỉ ngơi, an dưỡng giữa không gian thiên nhiên xanh, bốn mùa hoa nở cùng khí hậu trong lành mát mẻ. Resort bao gồm 100 phòng nghỉ được các kiến trúc sư thổi hồn vào trong các thiết kế, tất cả các phòng đều hướng ra không gian xanh bao la để du khách có thể hòa mình vào với thiên nhiên. Mỗi một Villa lại mang những nét tinh hoa kiến trúc riêng, luôn tạo sự mới lạ cho du khách Hệ thống phòng ngủ tại villa luôn thoáng mát mang đến cho bạn cảm giác thư thái Thảo Nguyênluôn luôn sẵn sàng cung cấp những tiện ích và dịch vụ cao cấpcho bạn từ nghỉ dưỡng, ẩm thực, chăm sóc sức khỏe, sắc đẹp tại spa hàng đầu Mộc Châu. Với tiêu chí đặt sự hài lòng khách hàng lên trên hết, Thảo Nguyênluôn cố gắng đáp ứng tất cả các nhu cầu của bạn dù là nhỏ nhất. Bể bơi bốn mùa cao cấp và hiện đạiđược xây dựng trong nhà với diện tích lớn và nhiều tiện ích, bao gồm khu bể bơi cho người lớn và khu bể bơi cho trẻ em. Ngoài ra, phòng tập Gym, phòng tập Aerobic cũng được trang bị trang thiết bị đồng bộ. Bên cạnh đó, sau một ngày vui chơi, khám phá hoặc gặp gỡ đối tác, du khách có thểlựa chọn một góc thoải mái, thả mình trên những chiếc ghế thoải mái, thưởng thức ly nước mát lạnh, hấp dẫn được pha chế bởi barista tại quầycafe - bar củaThảo NguyênResort. Khu vực Quầy Bar và karaoke của resort xứng đáng là một khu giải trí theo tiêu chí lịch sự và thư giãn, được thiết kế theo lối kiến trúc độc đáo và bắt mắt Không gian sang trọngcùng tinh hoa ẩm thực quốc tế và chất lượng dịch vụ hàng đầu sẽ mang lại ấn tượng tuyệt vời cho khách mời của quý vị. Thoải mái lựa chọn thực đơn, phong cách thiết kế tiệc và ban nhạc phục vụ tại chỗ. Thậm chí quý khách có thể lên thực đơn hoàn toàn mới với sự tư vấn chuyên nghiệp của đội ngũ bếp và tổ chức sự kiện. Quây quần bên bàn tiệc, vừa thưởng thức những hương vị hảo hạng cùng thức uống tuyệt vời, vừa chiêm ngưỡng thiết kế tinh xảo đẳng cấp của Thảo Nguyên. Thảo Nguyên Resort là một thế giới kiến trúc hiện đại và đẳng cấp, hòa mình vào khí hậu se lạnh của cao nguyên, bốn mùa hoa nở. Đội ngũ nhân viên chuyên nghiệp, nhiệt tình cùng với những dịch vụ cao cấp và đặc sắc, Thảo Nguyên Resort sẽ mang đến cho quý khách những ngày nghỉ tuyệt vời với nhiều cung bậc cảm xúc, hòa mình vào thiên nhiên. Nhanh tay click Mua ngay hôm nay để nhận được những ưu đãi hấp dẫn tại Adayroi bạn nhé! Khách hàng vui lòng liên hệ số điện thoại 1900 1901 để được hỗ trợ đặt chỗ.",""""""
adayroi.com,https://www.adayroi.com/-hot-3n2d-sun-spa-quang-binh-resort-5-buffet-sang-01-bua-trua-toi-danh-cho-2-nguoi-p-938786?offer=938786_OGG,938786,INDOCHINA TRAVEL SERVICES,Resort,[HOT] 3N2Đ Sun Spa Quảng Bình Resort 5* Buffet Sáng + 01 Bữa Trưa/Tối Dành Cho 2 Người,4.170.000đ,INDOCHINA TRAVEL SERVICES,"Resort khác INDOCHINA TRAVEL SERVICES,Khách sạn 5* Quảng Bình",". . Sun Spa Resort 5* - Trải nghiệm nghỉ dưỡng tuyệt vời ở vùng biển Quảng Bình Trải dài trên bán đảo cát trắng tuyệt đẹp với 3 mặt giáp biển, được người dân địa phương ví von như ""nàng tiên cá xoải mình giữa hai làn nước xanh thẳm"", một bên là đại dương bao la, một bên là dòng sông Nhật Lệ hiền hòa,Sun Spa Resortlà một điểm sáng trong bức tranh Đồng Hới nên thơ thuộc khu vực miền Trung.ĐếnSun Spa Resort 5*, bạn có thể tự do tắm biển, thư giãn thỏa thích ở hồ bơi trong những ngày nắng hè oi bức, tận hưởngdịch vụ massage hoặc tranh thủ thời gian để du ngoạn và khám phá vẻ đẹp của mảnh đất miền Trung.Gói nghỉ dưỡng 3 ngày 2 đêm tại Sun Spa Resort 5* - phòng Superior Garden View sẽ là món quà thú vịmà Adayroi.com muốn gửi tặng đến bạn trong mùa hè này. Với lối kiến trúc sang trọng kết hợp hài hòa cùng thiên nhiên, Sun Spa Resort 5* sở hữu bãi biển riêng biệt, trên 10 khu biệt thự tuyệt đẹp và hơn 234 phòng nghỉ đạt tiêu chuẩn quốc tế hướng biển. Tất cả các phòng đều có đầy đủ tiện nghi mà bạn mong muốn từ một khu nghỉ mát chất lượng hàng đầu, bao gồm truyền hình cáp, máy lạnh, internet phủ sóng toàn bộ resort, két sắt, bồn tắm trong phòng,… Thiết kế hài hòa với thiên nhiên Khu vực sảnh rộng lớn Phòng Superior Garden View - Không gian nghỉ dưỡng trong lành Lựa chọn nghỉ ngơi tạiphòngSuperior Garden ViewcủaSun Spa Resort sẽ khiến bạn hài lòng bằng một không gian hết sức sang trọng và thoáng đãng. Phòng nghỉ có hưởng nhìn ra khu vườn nhiệt đới quanh năm xanh tốt. Căn phòng luôn ngập tràn ánh sáng tự nhiên cùng sự hài hòa của toàn bộ các vật dụng nội thất, tạo cảm giác thoải mái, dễ chịu cho du khách. PhòngSuperior Garden View sở hữuphòng tắm với một bồn tắm, máy sấy tóc, tivi cùngmột giường đôi hoặc hai giường đơn,... Trải nghiệm các tiện ích khác Không những làm hài lòng du khách bằng không gian nghỉ ngơi hiện đại,Sun Spa Resort còn cung cấp các dịch vụ chất lượng ngay tại khu nghỉ dưỡng. Nổi bật trong khuôn viên resort là hồ bơi ngoài trời trong vắt, được thiết kế hòa hợp với cảnh quan và cây xanh, biến nơi đây trở thànhkhu vực thư giãn lí tưởng dành cho mọi du khách. Đặc biệt, với vị trí nằm hướng ra bãi biển Nhật Lệhiền hòa,La Bella Spasẽ mang lại những trải nghiệm thư giãn, hồi phụcsức sống bằng các phương pháp trị liệu,chăm sóc toàn diện cho sức khỏe và vẻ đẹp của bạn. Chỉ sử dụng sản phẩm tự nhiên, đội ngũ nhân viêntay nghề cao tạiLa Bella Spasẽ tạo ra các cuộc hành trình đánh thức mọi giác quancủa bạn. Khu vực La Bella Spa Phòng tập Gym, rèn luyện sức khỏe Sun Spa Resort sẽ khiến bạn ngạc nhiên bằng sựpha trộn thú vị củaẩm thực châu Á và phương Tây. Bạn có thể cùng nhau thưởng thức nghệ thuật pha chế cocktails và xem ban nhạc Philippino biểu diễn tạiOcean Barngoài trời có không gian thoáng đãng nhìn ra biển và bể bơi, chuyên phục vụ các loại rượu nổi tiếng trên thế giới; hay chọn cho mình một chỗ ngồi thật lãng mạn, dùng bữa tối ngon miệng với các món Á - Âu đậmhương vị hấp dẫn, thực đơn phong phú tại cácnhà hàng Sun Café, Golden Lotus, Asian Delight. Chưa dừng lại ở đó,Sun Spa Resort còn cung cấp thêm nhiều dịch vụ giải trí khác, nhằm đáp ứngcác nhu cầu của du khách nhưphòng karaoke, sân bóng đá, sân tennis, cho thuêxe đạp, sân chơi dành cho trẻ em,... Hay bạn có thể trải nghiệm các trò chơi trên biển đầy tính thử tháchnhưlướt ván, cano, trượt nước, mô - tô nước... Nếu có nhu cầu tổ chức các buổi hội thảo, hội nghị, khu vực phòng họp được trang bị đầy đủ các thiết bị hiện đại, diện tích lớnsẽ đáp ứng nhu cầu của quý khách hàng. Phòng karaoke Thể thao trên biển Phòng hội nghị Và chắc chắn một yếu tố không thể thiếu đã giúp cho Sun Spa Resort tạo được ấn tượng trong lòng khách hàng, đó chính là phong cách phục vụ chuyên nghiệp, chu đáo và niềm nở của đội ngũ nhân viên. Tất cả đều hướng đến mục tiêu làm cho bạn cảm thấy hài lòng trong suốt kì nghỉ dưỡng của mình. Click Mua ngay và cùng Adayroi.com trải nghiệm một kì nghỉ đáng nhớ tại Sun Spa Resort!",""""""
