Domain,Url,Product_id,Brand,Category,Model,Price,Seller,Tags,Info,Others
tiki.vn,https://tiki.vn/vong-tay-da-ma-nao-do-ms185-vong-tay-phong-thuy-cho-nguoi-menh-hoa-tho-thuy-nam-va-nu-p9420648.html?src=category-page-914.8374&2hi=0,9420648,OEM,Trang sức,,99.000 ₫,Xtop VN,," Đảm bảo hàng bán ra giống hình 100% Luôn cam kết chất lượng và giá bán luôn tốt Bảo hành 5 năm dây và đá Đổi ngay nếu lỗi từ nhà sản xuất Vòng Đá Mã Não Đỏ MS185 được làm từ mã não đỏ có nguồn gốc từ thạch anh, có đặc tính khá giống với thạch anh. Nhưng nếu nhìn dưới kính lúp thì ta thấy đá mã não đỏ có cấu tạo vi hạt cao hơn nên có bề mặt sáng bóng, mịn hơn. Người ta tìm thấy đá mã não quanh các miệng núi lửa, nên đá mã não có giá trị khá cao. Đá mã não có độ cứng cao bởi nó hình thành dưới áp suất lớn dưới lòng đất. Mã não đỏ là loại đá phong thủy được ưa chuộng từ xưa, nó thường được dùng trong các nghi lễ. Tác dụng: Vòng đá mã não MS185 có tác dụng rất tốt trong y học. Đá mã não có thể giúp hạ sốt, giảm đầy bụng, cải thiện hệ tiêu hóa. Đá mã não tượng trưng cho sự trường thọ, hóa giải bệnh tật, cải thiện tinh thần. Có thể làm giảm stress, qua đó giúp tinh thần người đeo thoải mái hơn. Xua đuổi tà ma, giúp chủ nhân tránh được các điều xấu trong cuộc sống. Đá mã não phù hợp với những người mệnh Thổ và Hỏa. Cách bảo quản: Không nên đeo vòng đá mã não đỏ suốt 24h liên tục (trừ những loại vòng tay cố định ). Hãy tháo chúng ra khi hoạt động mạnh để tránh va đập. Lưu ý khi sử dụng mỹ phẩm, vì các hóa chất có trong các loại mỹ phẩm có thể ảnh hưởng xấu tới vẻ đẹp của đá. Nếu lỡ dính những chất này lên thì phải lau rửa ngay lập tức. Ánh nắng mặt trời cũng là một yếu tố có hại. Hãy tránh mang chúng theo khi bạn đi tắm nắng hoặc phải làm việc trong thời gian dài dưới ánh nắng mặt trời. ",""""""
tiki.vn,https://tiki.vn/vong-co-bo-tat-pho-hien-5cm-thach-anh-den-ab2-p5930689.html?src=category-page-914.8374&2hi=0,5930689,868,Trang sức,,260.000 ₫,868,," Phổ Hiền Bồ Tát là một trong Ngũ Thiền Bồ Tát của Phật Giáo. Ngài thường xuất hiện bên cạnh hai vị bồ tát là Thích Ca và Văn Thù Sư Lợi. Ngài là biểu tượng có sức mạnh trí tuệ, sự kiên trì, bền bỉ để vượt qua mọi thử thách. Những người đang chuẩn bị thi cử, khởi nghiệp cầu nguyện trước Phổ Hiền Bồ Tát sẽ nhận được sự che chở của ngài. Hình tượng của Phổ Hiền Bồ Tá được mô tả lại: Ngài cưỡi trên lưng voi thể hiện sức mạnh vượt qua mọi thử thách; một tay mang nhành hoa sen biểu tượng cho sự tinh khiết; một tay ngài mang ngọc như ý biểu tượng cho vạn sự như ý, mãn nguyện. Phổ Hiền Bồ Tát là vị phật bản mệnh cho người tuổi Thìn và tuổi Tỵ. Xuất xứ : Đài loan Kính thước mặt dây chuyền : 3.2 cm x 5 cm, vòng cổ dây dài 50cm Chất liệu : đá thạch anh đen Ý nghĩa: Phật Phổ Hiền Bồ tát bổ trợ cho người tuổi Thìn, Tỵ là thần bảo vệ cho những người sinh năm Thìn, Tỵ. Phổ Hiền Bồ tát phù hộ cho họ kéo dài tuổi thọ, cả đời yên ổn và tránh xa các loại bệnh tật, tai hoạ. Những người sinh năm tăng thêm trí nhớ, phù hộ cho họ có của cải dồi dào, gia đình yên vui hoà hợp. Bộ sản phẩm bao gồm mặt Phật, móc dây chuyền và vòng cổ dây dù, Hình sản phẩm do shop tự chụp, hình thật không chỉnh sửa photoshop. ",""""""
tiki.vn,https://tiki.vn/vong-tay-ma-bac-inverse-heart-tatiana-vb2220b-bac-p2217199.html?src=category-page-914.8374&2hi=0,2217199,Tatiana,Trang sức,,109.000 ₫,Tatiana,," Vòng Tay Mạ Bạc Inverse Heart Tatiana VB2220B là phụ kiện không thể thiếu cho bạn gái, không chỉ trong những buổi tiệc, những dịp đặc biệt quan trọng mà trong cuộc sống hàng ngày phụ nữ cũng cần những chiếc vòng tay, bông tai, vòng cổ để tô điểm cho vẻ ngoài của mình thêm phần quý phái và nổi bật. Được thiết kế có kiểu dáng đơn giản, gia công đẹp mắt, sẽ là lựa chọn hoàn hảo cho các cô nàng mỗi khi tham gia các bữa tiệc, hẹn hò cùng bạn bè tôn nét nữ tính, sang trọng và không kém phần hiện đại. Không chỉ có tác dụng tô điểm vẻ đẹp, mà còn giúp phái đẹp thể hiện gu riêng của mình. Thiết kế tinh tế, sang trọng, đầy nữ tính cho bạn thoải mái ""mix - match"" với các trang phục khác nhau. Thể hiện cá tính của bản thân với sản phẩm đến từ Tatiana. Với thiết kế đơn giản, kiểu dáng đẹp mắt ấn tượng sẽ tăng phần hiện đại cho bạn gái. ",""""""
tiki.vn,https://tiki.vn/vong-co-choker-twice-line-tatiana-cd2535-trang-p1700233.html?src=category-page-914.8374&2hi=1,1700233,Tatiana,Trang sức,,49.000 ₫,Tatiana,," Vòng Cổ Choker Twice Line Tatiana CD2535 - Xu hướng Tattoo Choker bắt nguồn từ những năm 80, 90, là đại diện tiêu biểu cho phong cách Gothic Punk hầm hố hot nhất thời điểm đó. Sự trở lại của những xu hướng Retro giúp kiểu vòng cổ độc đáo này lại gây sốt một lần nữa trong giới trẻ. Vòng cổ ôm sát cổ tôn nét kiêu kỳ, quyến rũ và rạng rỡ của chiếc cổ xinh xắn. Dây đeo thể hiện sự khỏe khoắn, cá tính, các cô nàng tha hồ khoe chiếc cổ cao đầy kiêu hãnh, duyên dáng và gợi cảm. Đây là sự lựa chọn lý tưởng cho những ai thực sự đam mê hình ảnh cổ điển, nhẹ nhàng và thanh lịch ",""""""
tiki.vn,https://tiki.vn/day-chuyen-nhanh-hoa-sakura-da-zircon-hong-showfay-jewelry-45cm-p4586493.html?src=category-page-914.8374&2hi=1,4586493,Showfay Jewelry,Trang sức,,119.000 ₫,WIX SHOP,," Dây Chuyền Nhành Hoa Sakura - Đá Zircon Hồng Showfay Jewelry (45cm) - Kiểu dáng thiết kế tinh tế, trang nhã. Trang sức hợp thời trang, dễ phối đồ. Hợp kim Bạc cao cấp giảm hoen rỉ, xỉn màu. ",""""""
tiki.vn,https://tiki.vn/chuoi-ngoc-trai-nu-hoang-sac-dep-db-1825-bao-ngoc-jewelry-p8293587.html?src=category-page-914.8374&2hi=0,8293587,Bảo Ngọc Jewelry,Trang sức,,1.840.000 ₫,Bảo Ngọc Jewelry,, - Ngọc Trai Nuôi Cấy Nước Ngọt Tự Nhiên - Kích Thước Hạt Ngọc: 6 - 7 Ly - Chiều dài : 45cm - Màu Sắc : Trắng ,""""""
tiki.vn,https://tiki.vn/nhan-ma-bac-thai-juweel-tatiana-nb2351-bac-p1700273.html?src=category-page-914.8374&2hi=1,1700273,Tatiana,Trang sức,,79.000 ₫,Tatiana,," Nhẫn Mạ Bạc 925 Olive Tatiana NB1006 là phụ kiện không thể thiếu cho bạn gái, không chỉ trong những buổi tiệc, những dịp đặc biệt quan trọng mà trong cuộc sống hàng ngày phụ nữ cũng cần những chiếc vòng tay, bông tai, nhẫn... để tô điểm cho vẻ ngoài của mình thêm phần quý phái và nổi bật. Nhẫn được thiết kế có kiểu dáng đơn giản, gia công đẹp mắt, sẽ là lựa chọn hoàn hảo cho các cô nàng mỗi khi tham gia các bữa tiệc, hẹn hò cùng bạn bè tôn nét nữ tính, sang trọng và không kém phần hiện đại. Nhẫn không chỉ có tác dụng tô điểm vẻ đẹp, mà còn giúp phái đẹp thể hiện gu riêng của mình. Thiết kế tinh tế, sang trọng, đầy nữ tính cho bạn thoải mái ""mix - match"" với các trang phục khác nhau. Thể hiện cá tính của bản thân với sản phẩm đến từ thương hiệu Tatiana. Với thiết kế đơn giản, kiểu dáng đẹp mắt ấn tượng sẽ tăng phần hiện đại cho bạn gái. ",""""""
tiki.vn,https://tiki.vn/day-chuyen-statement-tassel-tatiana-dh2581-den-p2373005.html?src=category-page-914.8374&2hi=1,2373005,Tatiana,Trang sức,,99.000 ₫,Tatiana,," Dây Chuyền Statement Tassel Tatiana DH2581 (Đen) là phụ kiện không thể thiếu cho bạn gái, không chỉ trong những buổi tiệc, những dịp đặc biệt quan trọng mà trong cuộc sống hàng ngày phụ nữ cũng cần những chiếc vòng tay, bông tai, vòng cổ để tô điểm cho vẻ ngoài của mình thêm phần quý phái và nổi bật. Được thiết kế có kiểu dáng đơn giản, gia công đẹp mắt, sẽ là lựa chọn hoàn hảo cho các cô nàng mỗi khi tham gia các bữa tiệc, hẹn hò cùng bạn bè tôn nét nữ tính, sang trọng và không kém phần hiện đại. Không chỉ có tác dụng tô điểm vẻ đẹp, mà còn giúp phái đẹp thể hiện gu riêng của mình. Thiết kế tinh tế, sang trọng, đầy nữ tính cho bạn thoải mái ""mix - match"" với các trang phục khác nhau. Thể hiện cá tính của bản thân với sản phẩm đến từ Tatiana. Với thiết kế đơn giản, kiểu dáng đẹp mắt ấn tượng sẽ tăng phần hiện đại cho bạn gái. ",""""""
tiki.vn,https://tiki.vn/vong-da-thach-anh-den-ms25-p5526165.html?src=category-page-914.8374&2hi=0,5526165,OEM,Trang sức,,149.000 ₫,Xtop VN,," Vòng Đá Thạch Anh Đen MS25 được chế tác thủ công từ đá tự nhiên gia công một cách tinh xảo, theo các tiêu chí đánh giá về màu sắc, độ sạch, độ trong và kiểu cắt sắc nét. Với thiết kế tinh tế, màu sắc nổi bật là một món trang sức không thể thiếu với phái đẹp mang lại vẻ sang trọng, quý phái giúp bạn tự tin thể hiện cá tính. Bên cạnh món trang sức giá trị vòng tay còn mang nhiều lợi ích cho chủ nhân. Đá tự nhiên được hình thành từ sâu trong lòng đất, trải qua nhiều điều kiện địa chất phức tạp trong thời gian dài nên nó mang nguồn năng lượng tinh khiết, tích cực thích hợp làm món trang sức phong thủy quý giá. Cách chọn màu đá phong thuỷ theo mệnh: Mệnh Kim: vàng, vàng đậm, trắng, bạc, nâu. Mệnh Hỏa: đỏ, hồng, cam, tím, vàng đậm, nâu. Mệnh Thủy: đen, xanh dương, vàng, trắng. Mệnh Mộc: xanh lá, xanh dương, đen. Mệnh Thổ: đỏ, hồng, cam, tím, vàng đậm, nâu. ",""""""
tiki.vn,https://tiki.vn/vong-tay-da-ma-nao-den-lien-khoi-p902784.html?src=category-page-914.8374&2hi=0,902784,Ngọc Quý Gemstones,Trang sức,,255.000 ₫,Ngọc Quý Gemstones,," Vòng Tay Đá Mã Não Đen Liền Khối được làm từ loại đá mã não với màu đen liền khối sang trọng và quý phái. Đá mã não là một loại biến thể của đá thạch anh, được hình thành từ nham thạch núi lửa hay vỏ ốc, xương cá sau hàng triệu năm tích lũy. Theo dân gian, mang vòng tay mã não có tác dụng mang lại may mắn, thịnh vượng và bảo vệ chủ nhân khỏi các xung năng lượng xấu, tà khí, giúp tinh thần được ổn định, giao tiếp được thuận lợi hơn. Bên cạnh đó, mang vòng đá mã não cũng giúp bảo vệ sức khỏe, điều hòa hoạt động của gan, làm giảm cảm giác mết mỏi,... Sản phẩm thích hợp cho cả nam và nữ mang để mang lại may mắn và thịnh vượng. ",""""""
tiki.vn,https://tiki.vn/vong-tay-nu-buom-handmade-phong-thuy-may-man-p7665755.html?src=category-page-914.8374&2hi=0,7665755,OEM,Trang sức,,74.700 ₫,Chonmua365,, Vòng Tay Nữ Bướm Handmade Phong Thủy May Mắn - Sản phẩm handmade được làm thủ công nên số lượng có hạn cho mỗi kiểu vòng. Nguyên liệu làm từ sợi tơ lụa cao cấp và các hạt charm và đá tự nhiên. Phù hợp làm phụ kiện thời trang cá tính và độc đáo. Màu sắc lẫn hình dáng của hạt charm hoàn toàn khác biệt với các sản phẩm thủ công thông thường khác. ,""""""
tiki.vn,https://tiki.vn/nhan-nu-ma-vang-timeless-mk407-p9729045.html?src=category-page-914.8374&2hi=1,9729045,OEM,Trang sức,,99.000 ₫,Bờm Store 2016,," Nhan nu dep là đồ trang sức được sử dụng phổ biến trong đời sống, đặc biệt là dùng để tượng trưng cho sự gắn bó kết đôi, cho hôn nhân và hạnh phúc. Hơn thế, nhẫn còn là một vật phẩm phong thủy. Sau đây, chúng tôi xin giới thiệu tới quý khách 1 mẫu nhẫn nữ đẹp : Nhẫn nữ, nhẫn cặp nữ mạ vàng cao cấp Timeless MK407 Mẫu nhẫn đẹp được thiết kế từ chất liệu cao cấp, không rỉ sét, có thể tiếp xúc với nước (đi mưa, rửa tay) Tổng thể nhẫn mạ vàng vô cùng hài hòa, bắt mắt và tinh tế. Ngay từ giây đầu tiên chạm mắt với nhẫn mạ vàng , bạn có thể cảm nhận rất rõ phong thái tinh tế sang trọng và thanh cao. ",""""""
tiki.vn,https://tiki.vn/bo-trang-suc-pearl-and-peal-tatiana-dh2183-p2372945.html?src=category-page-914.8374&2hi=1,2372945,Tatiana,Trang sức,,109.000 ₫,Tatiana,," Bộ Trang Sức Pearl And Peal Tatiana DH2183 là phụ kiện không thể thiếu cho bạn gái, không chỉ trong những buổi tiệc, những dịp đặc biệt quan trọng mà trong cuộc sống hàng ngày phụ nữ cũng cần những chiếc vòng tay, bông tai, vòng cổ... để tô điểm cho vẻ ngoài của mình thêm phần quý phái và nổi bật. Được thiết kế có kiểu dáng đơn giản, gia công đẹp mắt, sẽ là lựa chọn hoàn hảo cho các cô nàng mỗi khi tham gia các bữa tiệc, hẹn hò cùng bạn bè tôn nét nữ tính, sang trọng và không kém phần hiện đại. Không chỉ có tác dụng tô điểm vẻ đẹp, mà còn giúp phái đẹp thể hiện gu riêng của mình. Thiết kế tinh tế, sang trọng, đầy nữ tính cho bạn thoải mái ""mix - match"" với các trang phục khác nhau. Thể hiện cá tính của bản thân với sản phẩm đến từ Tatiana. Với thiết kế đơn giản, kiểu dáng đẹp mắt ấn tượng sẽ tăng phần hiện đại cho bạn gái. ",""""""
tiki.vn,https://tiki.vn/lac-tay-phong-thuy-con-coc-cao-cap-vt213-vt214-p10704838.html?src=category-page-914.8374&2hi=1,10704838,OEM,Trang sức,,300.000 ₫,Xinchao1000,, ,""""""
tiki.vn,https://tiki.vn/bong-tai-khoen-tron-dinh-da-tatiana-bh2951-bac-p2048715.html?src=category-page-914.8374&2hi=1,2048715,Tatiana,Trang sức,,89.000 ₫,Tatiana,," Bông Tai Khoen Tròn Đính Đá Tatiana BH2951 - Bạc là phụ kiện không thể thiếu cho bạn gái, không chỉ trong những buổi tiệc, những dịp đặc biệt quan trọng mà trong cuộc sống hàng ngày phụ nữ cũng cần những chiếc vòng tay, bông tai, vòng cổ... để tô điểm cho vẻ ngoài của mình thêm phần quý phái và nổi bật. Bông tai được thiết kế có kiểu dáng đơn giản, gia công đẹp mắt, sẽ là lựa chọn hoàn hảo cho các cô nàng mỗi khi tham gia các bữa tiệc, hẹn hò cùng bạn bè tôn nét nữ tính, sang trọng và không kém phần hiện đại. Bông tai không chỉ có tác dụng tô điểm vẻ đẹp, mà còn giúp phái đẹp thể hiện gu riêng của mình. Thiết kế tinh tế, sang trọng, đầy nữ tính cho bạn thoải mái ""mix - match"" với các trang phục khác nhau. Thể hiện cá tính của bản thân với sản phẩm đến từ Tatiana. Với thiết kế đơn giản, kiểu dáng đẹp mắt ấn tượng sẽ tăng phần hiện đại cho bạn gái. ",""""""
tiki.vn,https://tiki.vn/vong-deo-tay-da-nau-vang-gan-ty-huu-dinh-da-khac-rong-phong-thuy-tam-thanh-phat-p7932043.html?src=category-page-914.8374&2hi=1,7932043,TÂM THÀNH PHÁT,Trang sức,,159.000 ₫,Phong Thủy Cải Vận,," Chất liệu : Đá Số lượng : 1 vòng Size : 10li - 12li -14li Chiều dài dây 16cm, tặng kèm thêm hột Hợp mệnh Kim và Thổ 10li : Hạt nhỏ dành cho nữ 12li : Hạt vừa phù hợp cả nam và nữ 14li : Hạt to phù hợp nam Lưu ý : sản phẩm thực tế có thể có màu đậm hoặc nhạt hơn so với hình ảnh Hình minh họa chọn size Size 10li hạt nhỏ dành cho nữ ",""""""
tiki.vn,https://tiki.vn/bong-tai-ma-bac-drop-sana-tatiana-bb3284-bac-p2864833.html?src=category-page-914.8374&2hi=1,2864833,Tatiana,Trang sức,,79.000 ₫,Tatiana,," Bông Tai Mạ Bạc Drop Sana Tatiana BB3284 được thiết kế tinh tế thể hiện nét đẹp nữ tính, cùng họa tiết xinh xắn cho bạn gái thêm nét trẻ trung, nổi bật và đầy sang trọng. Phong cách hiện đại, được chế tác tỉ mỉ với đường nét sắc sảo, tôn vinh nét duyên dáng giúp cho bạn gái thêm phần nữ tính và xinh đẹp. Bông tai được làm từ chất liệu 30% Bạc 925 cao cấp phối hợp với họa tiết đã tạo cho sản phẩm một nét đẹp dịu dàng, duyên dáng và thời trang cho bạn gái hiện đại. Sở hữu thiết kế ấn tượng, độc đáo, chắc chắn bạn sẽ vô cùng hài lòng khi được tự mình trải nghiệm vẻ đẹp của phụ kiện trang sức với thiết kế tinh xảo này. Đây là một sản phẩm phù hợp làm quà tặng cho bạn gái hay cho những người phụ nữ mà bạn yêu thương, mang đến niềm vui, vẻ đẹp, sự trẻ trung và thời trang cho nữ giới. ",""""""
tiki.vn,https://tiki.vn/vong-tay-da-thach-anh-vang-ty-huu-thien-nhien-p10685424.html?src=category-page-914.8374&2hi=0,10685424,Denver,Trang sức,,169.000 ₫,Anna Trần Shop,, Vòng tay đá Thạch Anh Vàng tỳ hưu thiên nhiên Đá thiên nhiên 100%. Màu sắc cực đẹp Do là đá tự nhiên nên càng đeo càng sáng bóng Thiết kế tinh xảo Có hộp quà bằng gỗ cao cấp Kích thước vòng phù hợp cho cổ tay từ 16 - 21cm ,""""""
tiki.vn,https://tiki.vn/vong-tay-phong-thuy-da-mat-meo-xanh-la-ms41-hop-menh-moc-thuy-cho-nam-nu-p9021496.html?src=category-page-914.8374&2hi=0,9021496,OEM,Trang sức,,159.000 ₫,Xtop VN,," Vòng đá mắt mèo xanh lá MS41 được coi là một trong những loại vòng đá được rất nhiều người sử dụng với mong muốn gặp được nhiều may mắn, thuận lợi trong công việc. Vậy ngoài những điều trên thì các bạn còn biết gì về loại vòng đá này nữa không? Hãy cùng chúng tôi tìm hiểu nhé. 1. Tìm hiểu về vòng đá mắt mèo xanh lá MS41 Để nhắc về nguồn gốc của loại đá này chúng ta hãy cùng tìm về với nền văn hóa Hy Lạp cổ đại. Theo người Hy Lạp, đá mắt mèo có tên tiếng anh là Cymophane nghĩa là “ánh sáng di chuyển”. Đá mắt mèo xanh lá được đánh giá cao bởi vẻ bề ngoài tuy giản dị nhưng đầy cuốn hút, nhìn mát mắt. Màu xanh lá được coi là màu sắc mang lại may mắn nữa đó. 2. Công dụng của vòng đá mắt mèo xanh lá MS41 + Giúp người dùng may mắn và thành công hơn trong công việc: Đối với những đồ trang sức từ đá mắt mèo xanh lá như vòng tay phong thủy, mặt dây chuyền sẽ rất thích hợp với các nghệ sĩ, nhạc sĩ, diễn viên, những người làm về nghệ thuật. Với công dụng và nguồn năng lượng của mình sẽ giúp họ có được công việc ổn định và gặp nhiều may mắn hơn. + Đá mắt mèo xanh lá giúp người dùng cải thiện các mối quan hệ xã hội: Quan hệ xã hội được coi là một trong những việc vô cùng quan trọng đối với người dùng, việc này rất tốt cho người dùng trong cả công việc cũng như trong cuộc sống. Đặc biệt, khi đeo trang sức đá mắt mèo, bạn sẽ cảm giác được mình trở nên dịu dàng, ôn hòa hơn để có thể giao tiếp tốt trong các mối quan hệ xã hội. + Giúp người dùng trở nên tự tin hơn Theo phong thủy, vòng đá phong thủy đá mắt hổ còn giúp tăng sự tự tin, và lòng biết ơn. Khơi dậy cảm xúc thanh bình và thái độ tích cực trong mọi việc và trong cuộc sống. ",""""""
tiki.vn,https://tiki.vn/cai-ao-ry-a-74101-1-xanh-p5049631.html?src=category-page-914.8374&2hi=0,5049631,RY-A,Trang sức,,58.000 ₫,PHỤ KIỆN THỜI TRANG RY-A,," Phụ kiện thời trang RY-A mang đến bạn sản phẩm Cài áo RY-A 74101-1 (Xanh) với thiết kế đẹp và chất lượng cao cấp. Nguyên liệu: cài áo kim dài, chất liệu kim loại, trang trí hoa vải lụa. Kích thước: 5cm x 9cm. Phụ kiện cài áo có thể kết hợp trang trí cho trang phục dự tiệc, dạo phố hoặc trang phục công sở, đặc biệt thích hợp trong các dịp lễ cưới, lễ tiệc hoặc sự kiện trang trọng. Sản phẩm này là món quà tặng tuyệt vời cho người thân yêu trong các dịp đặc biệt. ",""""""
tiki.vn,https://tiki.vn/bong-tai-dai-drop-pearl-tatiana-bb2719-bac-p1700291.html?src=category-page-914.8374&2hi=1,1700291,Tatiana,Trang sức,,89.000 ₫,Tatiana,," Bông Tai Khoen Tròn Parels BH2980 là phụ kiện không thể thiếu cho bạn gái, không chỉ trong những buổi tiệc, những dịp đặc biệt quan trọng mà trong cuộc sống hàng ngày phụ nữ cũng cần những chiếc vòng tay, bông tai, vòng cổ... để tô điểm cho vẻ ngoài của mình thêm phần quý phái và nổi bật. Bông tai được thiết kế có kiểu dáng đơn giản, gia công đẹp mắt, sẽ là lựa chọn hoàn hảo cho các cô nàng mỗi khi tham gia các bữa tiệc, hẹn hò cùng bạn bè tôn nét nữ tính, sang trọng và không kém phần hiện đại. Bông tai không chỉ có tác dụng tô điểm vẻ đẹp, mà còn giúp phái đẹp thể hiện gu riêng của mình. Thiết kế tinh tế, sang trọng, đầy nữ tính cho bạn thoải mái ""mix - match"" với các trang phục khác nhau. Thể hiện cá tính của bản thân với sản phẩm đến từ Tatiana. Với thiết kế đơn giản, kiểu dáng đẹp mắt ấn tượng sẽ tăng phần hiện đại cho bạn gái. ",""""""
tiki.vn,https://tiki.vn/bong-tai-tassel-oval-basic-tatiana-bh2267r-do-p1948283.html?src=category-page-914.8374&2hi=1,1948283,Tatiana,Trang sức,,82.000 ₫,Tatiana,," Bông Tai Tassel Oval Basic Tatiana BH2267R - Đỏ với sự sắc sảo trong từng đường nét thiết kế chắc chắn sẽ thu hút sự chú ý của các cô nàng ngay từ ánh nhìn đầu tiên. Bông tai Tatiana được chế tác tinh xảo từ chất liệu hợp kim xi mạ mang đến độ bền và độ bóng đẹp hoàn hảo giúp cho đôi tai của bạn nữ thêm phần nổi bật và cuốn hút. Thiết kế kiểu dáng thời trang, hiện đại, dễ mix-match tạo set đồ năng động giúp bạn nữ tự tin hơn khi bước xuống phố trong những buổi cà phê, dạo chơi cùng bạn bè. ",""""""
tiki.vn,https://tiki.vn/nhan-ma-bac-thai-kim-co-hoa-du-ky-tatiana-nb2307-bac-p1700279.html?src=category-page-914.8374&2hi=1,1700279,Tatiana,Trang sức,,55.000 ₫,Tatiana,," Nhẫn Mạ Bạc 925 Olive Tatiana NB1006 là phụ kiện không thể thiếu cho bạn gái, không chỉ trong những buổi tiệc, những dịp đặc biệt quan trọng mà trong cuộc sống hàng ngày phụ nữ cũng cần những chiếc vòng tay, bông tai, nhẫn... để tô điểm cho vẻ ngoài của mình thêm phần quý phái và nổi bật. Nhẫn được thiết kế có kiểu dáng đơn giản, gia công đẹp mắt, sẽ là lựa chọn hoàn hảo cho các cô nàng mỗi khi tham gia các bữa tiệc, hẹn hò cùng bạn bè tôn nét nữ tính, sang trọng và không kém phần hiện đại. Nhẫn không chỉ có tác dụng tô điểm vẻ đẹp, mà còn giúp phái đẹp thể hiện gu riêng của mình. Thiết kế tinh tế, sang trọng, đầy nữ tính cho bạn thoải mái ""mix - match"" với các trang phục khác nhau. Thể hiện cá tính của bản thân với sản phẩm đến từ thương hiệu Tatiana. Với thiết kế đơn giản, kiểu dáng đẹp mắt ấn tượng sẽ tăng phần hiện đại cho bạn gái. ",""""""
