Domain,Url,Product_id,Brand,Category,Model,Price,Seller,Tags,Info,Others
tiki.vn,https://tiki.vn/lac-tay-bang-bac-nu-bnlt18-p1949455.html?src=category-page-914.8374&2hi=0,1949455,OEM,Trang sức,,132.300 ₫,Chonmua365,," Lắc tay bằng bạc nữ BNLT-18 với thiết kế trẻ trung, nữ tính và mang nhiều ý nghĩa về tình yêu. Hai trái tim bạc lồng vào nhau kết hợp sắc tím của viên đá thạch anh tượng trưng cho một tình yêu gắn bó, chung thuỷ và lãng mạn của các cặp đôi. Chiếc lắc tay bạc nữ BNLT-18 này là món quà tuyệt vời cho người ấy trong các dịp kỷ niệm đặc biệt. Món trang sức bạc nữ cao cấp, đặc biệt này sẽ là minh chứng tình yêu vĩnh cửu của hai người! Lắc tay bằng bạc nữ BNLT-18 với sắc tím mộng mơ, lãng mạn của đá thạch anh hoà quyện với sự lung linh, trắng sáng của chất liệu Bạc S925 ITALY. Tổng thể tạo nên chiếc lắc tay bạc cho nữ bắt mắt, sang trọng và mang nhiều ý nghĩa trong tình yêu. Kết hợp kỹ thuật đính đá thạch anh tinh xảo, chất lượng tốt nhất tạo những sản phẩm chất lượng tiêu chuẩn Châu Âu – Không Gỉ – Không Phai Màu – Không Gây Ngứa – Cam Kết 1 đền 10 Nếu Sai – Đồng thời 1 đổi 1 trong 30 ngày nếu hỏng/lỗi do nhà SX. ",""""""
tiki.vn,https://tiki.vn/bong-tai-bac-y-s925-dang-dai-dinh-kim-cuong-hinh-buom-bt53-p9608831.html?src=category-page-914.8374&2hi=0,9608831,OEM,Trang sức,,109.000 ₫,Chonmua365,," Bông Tai Bạc Ý S925 Dáng Dài Đính Kim Cương Hình Bướm BT53 Bông tai bạc Ý s925 Bông tai bạc ý s925 với mẫu mã đa dạng, phong phú đem tới cho chị em sự lựa chọn ưng ý nhất. Thiết kế tinh tế, thời trang, thể hiện gu thẩm mỹ, cái tôi của người đeo. Bông Tai bạc ý s925 giúp chị em tự tin khi gặp bạn bè người thân từ đi chơi, dự tiệc, gặp mặt đối tác, dạ hội Kiểu dáng sang trọng Bông tai bạc ý s925 với thiết kế kiểu dáng thời trang sang trọng Phong cách trẻ trung Phong cách thiết kế trẻ trung, hiện đại style Hàn Quốc cho bạn sự năng động, quyến rũ LÝ DO BẠN NÊN LỰA CHỌN BÔNG TAI BẠC Ý s925 Bông tai bạc ý 925 thiết kế tinh tế thời trang, thể hiện gu thẩm mỹ cái tôi của bạn. Sản phẩm giúp bạn bảo vệ sức khỏe tránh cảm, tránh gió Món quà vô cùng ý nghĩa cho người mình yêu thương Thể hiện gu thẩm mĩ, cái tôi của bạn Chất liệu Bạc theo tiêu chuẩn quốc tế Bạc 925 là tiêu chuẩn quốc tế của trang sức bạc trong đó 92,5% là trọng lượng Bạc nguyên chất còn lại 7.5% là các hợp kim khác chủ yếu là đồng tạo nên độ cứng, độ bóng sáng, bền đẹp cho sản phẩm. Do bạc nguyên chất quá mềm nên chi tiết nhỏ tinh tế nhiều kiểu dáng, đặc biệt là khi gắn nhiều viên đá bé nên người ta phải cho thêm các hợp chất khác để tạo nên độ bền, độ cứng và sáng bóng, chính vì vậy mỗi thiết kế trang sức bạc 925 đều tinh xảo hơn thời trang hơn, điều mà bạc nguyên chất không thể làm được ",""""""
tiki.vn,https://tiki.vn/bong-tai-han-quoc-khoen-tron-ca-tinh-tatiana-bh2444-bac-p1218075.html?src=category-page-914.8374&2hi=1,1218075,Tatiana,Trang sức,,65.000 ₫,Tatiana,," Bông Tai Hàn Quốc Khoen Tròn Cá Tính Tatiana BH2444 với thiết kế đơn giản hình tròn nhưng không kém phần nổi bật giúp bạn gái thêm phần xinh xắn và thu hút. Được sản xuất từ Hợp kim tạo sự sáng bóng, lung linh. Bông tai giúp tôn vinh nét duyên dáng, thanh tú cho bạn gái thêm phần nữ tính và xinh đẹp. Dễ kết hợp với các phụ kiện khác có sự tương đồng về chất liệu như: Đồng hồ, nhẫn, lắc tay, dây chuyền,... Đây là một sản phẩm phù hợp làm quà tặng cho bạn gái hay cho những người phụ nữ mà bạn yêu thương. ",""""""
tiki.vn,https://tiki.vn/bong-tai-han-quoc-the-rose-tatiana-bh2280-bac-p1948297.html?src=category-page-914.8374&2hi=1,1948297,Tatiana,Trang sức,,89.000 ₫,Tatiana,," Bông Tai Korea Triangle Pearl Tatiana BH2060B - Bạc với sự sắc sảo trong từng đường nét thiết kế chắc chắn sẽ thu hút sự chú ý của các cô nàng ngay từ ánh nhìn đầu tiên. Bông tai Tatiana được chế tác tinh xảo từ chất liệu hợp kim xi mạ mang đến độ bền và độ bóng đẹp hoàn hảo giúp cho đôi tai của bạn nữ thêm phần nổi bật và cuốn hút. Thiết kế kiểu dáng thời trang, hiện đại, dễ mix-match tạo set đồ năng động giúp bạn nữ tự tin hơn khi bước xuống phố trong những buổi cà phê, dạo chơi cùng bạn bè. ",""""""
tiki.vn,https://tiki.vn/kim-cuong-nhan-tao-fascino-gems-dang-tron-6-00-mm-mau-tcf-p3728733.html?src=category-page-914.8374&2hi=0,3728733,FASCINO,Trang sức,,149.000 ₫,FASCINO,," Kim Cương Nhân Tạo Fascino Gems THẺ GUARANTEE CARD: KIM CƯƠNG NHÂN TẠO FACINO GEMS FASCINO GEMS là một thương hiệu thời trang chuẩn Châu Âu với nhiều năm kinh nghiệm trong ngành thời trang và đá quý, kỹ thuật chế tác và cắt mài tinh xảo, kỹ thuật tổng hợp và đánh bóng bề mặt tuyệt vời đã cho ra đời những viên pha lê, đá tổng hợp, đá thiên nhiên, kim cương nhân tạo với độ lấp lánh, độ trong, cứng, màu sắc và đẹp mắt y như kim cương tự nhiên mà khó có thể phân biệt bằng mắt thường. “Kim cương nhân tạo là loại hạt Cubic Zirconia, với kiểu cắt chuẩn Châu Âu Diamond Cut và độ cứng đạt 8.5 Mohs, so với kim cương tự nhiên có độ cứng là 10.0 Mohs (Mohs là thang chuẩn dùng để đo độ cứng cho các khoáng vật)”. Trong những năm gần đây, với kỹ thuật xử lý màu tiên tiến chúng tôi đã cho ra đời các dòng sản phẩm đá màu đặc biệt gần với màu tự nhiên của kim cương như Fancy Pink (Hồng), Fancy Blue (Xanh), Fancy Green (Xanh Lá), Fancy Yellow (Vàng), Fancy Purple (Tím khoai môn), Fancy Brown (Nâu) và các màu cơ bản như Red (Đỏ), Green (Xanh Lá), Blue (Xanh), Mint Green (Xanh Ngọc), Amber (Trà),… ​ Kim cương nhân tạo đạt tiêu chuẩn nước D trong khi các viên kim cương tự nhiên thường là nước F, nước E là hiếm và nước D hầu như không tìm thấy trong tự nhiên). Với công nghệ tổng hợp hiện đại, viên kim cương nhân tạo không bị than, bị lẫn tạp chất hay bị vết nứt tự nhiên luôn tìm thấy ở những viên kim cương tự nhiên. Một viên kim cương nhân tạo khi được chế tác xử lý đúng quy cách phải có 57 mặt cắt theo tiêu chuẩn của Hiệp hội Kim cương Thế giới, mặt trên có 25 giác cắt và mặt dưới có 32 giác cắt, khi nhìn qua kính chuyên dụng từ trên mặt xuống sẽ nhìn thấy hình 8 mũi tên và 8 trái tim khi nhìn từ dưới đáy lên. “Kim cương tự nhiên vẫn cuốn hút với vẻ đẹp hoàn mỹ và vĩnh cửu và là món trang sức được bao người ao ước đang ngày càng trở nên khan hiếm trong thiên nhiên. Chính điều này đã khiến cho giá thành của “ông vua của thế giới đá quý” vô cùng đắt đỏ và không phải ai cũng có đủ khả năng để có thể sở hữu. Nếu các bạn có từng nghe nói đến kim cương máu Nam Phi, chắc bạn cũng biết để có được những viên kim cương hoàn mỹ cho người tiêu dùng phải đánh đổi bằng máu đó là chuyện thường thấy ở xứ sở kim cương Nam Phi. ​ ​ ",""""""
tiki.vn,https://tiki.vn/lac-tay-hoa-cuc-nho-bac-s925-xinh-xan-p10573342.html?src=category-page-914.8374&2hi=0,10573342,OEM,Trang sức,,69.300 ₫,Chonmua365,," Một trong những phụ kiện có lẽ không thể thiếu đối với chị em phụ nữ đó chính là chiếc lắc tay. Món đồ giúp tô điểm thêm cho đôi tay mềm mại của bạn trở nên thật cuốn hút và gợi cảm. Lưu ý: Để sản phẩm luôn được sáng bóng, các bạn nên bảo quản sản phẩm ở nơi khô ráo, tránh tiếp xúc sản phẩm với các hóa chất tẩy rửa cao. Dùng giấy hoặc vải mềm hay hộp đựng trang sức chuyên dụng để bảo quản khi bạn không có nhu cầu đeo nữa (nên làm sạch và làm khô trước khi cất giữ). ",""""""
tiki.vn,https://tiki.vn/day-chuyen-arrow-and-pearl-tatiana-dh2593-bac-p2373009.html?src=category-page-914.8374&2hi=1,2373009,Tatiana,Trang sức,,109.000 ₫,Tatiana,," Dây Chuyền Arrow And Pearl Tatiana DH2593 (Bạc) là phụ kiện không thể thiếu cho bạn gái, không chỉ trong những buổi tiệc, những dịp đặc biệt quan trọng mà trong cuộc sống hàng ngày phụ nữ cũng cần những chiếc vòng tay, bông tai, vòng cổ để tô điểm cho vẻ ngoài của mình thêm phần quý phái và nổi bật. Được thiết kế có kiểu dáng đơn giản, gia công đẹp mắt, sẽ là lựa chọn hoàn hảo cho các cô nàng mỗi khi tham gia các bữa tiệc, hẹn hò cùng bạn bè tôn nét nữ tính, sang trọng và không kém phần hiện đại. Không chỉ có tác dụng tô điểm vẻ đẹp, mà còn giúp phái đẹp thể hiện gu riêng của mình. Thiết kế tinh tế, sang trọng, đầy nữ tính cho bạn thoải mái ""mix - match"" với các trang phục khác nhau. Thể hiện cá tính của bản thân với sản phẩm đến từ Tatiana. Với thiết kế đơn giản, kiểu dáng đẹp mắt ấn tượng sẽ tăng phần hiện đại cho bạn gái. ",""""""
tiki.vn,https://tiki.vn/vong-tay-mem-bac-950-fascino-p2165873.html?src=category-page-914.8374&2hi=0,2165873,OEM,Trang sức,,580.000 ₫,FASCINO,," Vòng tay bằng bạc 950, là loại bạc có tỉ lệ bạc cao nhất hiện nay 95% Fit hầu hết các loại charm ",""""""
tiki.vn,https://tiki.vn/vo-ng-tay-charm-nu-tini-t125-p597379.html?src=category-page-914.8374&2hi=1,597379,Tini,Trang sức,,105.000 ₫,Đồng Hồ 247,," Vòng Tay Charm Nữ Tini T125 - phụ kiện thời trang vừa tôn lên vẻ quyến rũ, vừa thể hiện được nét cá tính của riêng bạn! Nếu như bạn nghĩ những set đồ phụ kiện thời trang của mình chỉ có thể là những chiếc nhẫn hay sợi dây chuyền thì thật sai lầm! Hãy để những chiếc vòng đeo tay đẹp trở thành style thêm nổi bật và tôn lên phong cách cho bạn! Đây cũng chính là món quà tặng vô cùng ý nghĩa, mang lại cho người nhận sự bất ngờ thú vị. Với các hạt charm được chạm khắc tinh xảo đầy ấn tượng kết hợp với các hoạ tiết độc đáo sẽ tạo nên một điểm nhấn đặc biệt cho đôi tay bạn. Sắc đỏ chủ đạo trên vòng tay làm tôn lên nét đẹp quyến rũ, tinh tế cho các bạn nữ. ",""""""
tiki.vn,https://tiki.vn/lac-tay-qua-chau-showfay-jewelry-tb0001-bac-p829179.html?src=category-page-914.8374&2hi=1,829179,Showfay Jewelry,Trang sức,,79.000 ₫,WIX SHOP,," Lắc Tay Quả Châu Showfay Jewelry TB0001 - Bạc với chất liệu hợp kim bạc 925 và Copper kết hợp đá Zircon nhân tạo đã tạo nên ấn tượng cá tính cho sản phẩm và không kém phần sang trọng. Dễ dàng phối với nhiều loại trang phục. Một chút đơn giản, một chút nhẹ nhàng nhưng đầy thu hút với kiểu dáng hiện đại, nữ tính, đáng yêu... Là qùa tặng ý nghĩa cho người bạn yêu thương, người thân, đồng nghiệp... ",""""""
tiki.vn,https://tiki.vn/bo-2-vong-tay-da-san-ho-8-ly-tang-hop-qua-bang-go-cao-cap-p6745617.html?src=category-page-914.8374&2hi=0,6745617,OEM,Trang sức,,169.000 ₫,Anna Trần Shop,," Bộ 2 vòng tay đá san hô 8 ly + Tặng hộp quà bằng gỗ cao cấp Vòng tay bao giờ cũng có hộp BẰNG GỖ bảo quản sang trọng kèm theo. Đá thiên nhiên 100%. Không phải loại đá quý. Là đá loại 1 Màu sắc cực đẹp Chất đá sáng. Đeo càng ngày càng sáng. Thiết kế tinh xảo Có hộp quà BẰNG GỖ sang trọng cho Quý khách làm quà tặng Hiện nay do 1 số shop bán đá giả và đá nhân tạo nhưng vẫn gộp chung với chúng tôi làm ảnh hưởng đến uy tín shop. Vì thế, Nếu quý khách mua hàng của shop vui lòng lưu ý: -Vòng tay bao giờ cũng có hộp bảo quản bằng gỗ sang trọng kèm theo. Shop cung cấp cho Quý khách là: Đá thiên nhiên 100%. Không phải loại đá quý. Là đá loại 1 Màu sắc cực đẹp Chất đá sáng. Đeo càng ngày càng sáng. Thiết kế tinh xảo Có hộp quà sang trọng cho Quý khách làm quà tặng Chiều dài dây: 18cm. Phù hợp cho cổ tay từ 17-20cm ",""""""
tiki.vn,https://tiki.vn/vong-da-ma-nao-xanh-la-ms202-cho-nguoi-menh-moc-thuy-p8315834.html?src=category-page-914.8374&2hi=0,8315834,OEM,Trang sức,,109.000 ₫,Xtop VN,," Chiều dài dây 10cm Tên gọi Mã Não(Agat) bắt nguồn từ tiếng Hy Lạp cổ Ahates – có nghĩa là hạnh phúc. Đá mã não là đá tự nhiên được hình thành chủ yếu trong hốc đá sau các đợt phun trào núi lữa và tạo thành các dịch nhiệt độ thấp. Đá mã mão là biểu tượng của sức khỏe, sự hưng thịnh và trường thọ, ngoài ra còn dùng để trừ tà rất thích hợp dùng làm bùa hộ mệnh. Đồ trang sức bằng agate làm cho chủ của nó trở nên dễ mến trong giao tiếp và biết ăn nói, cũng như bảo vệ chủ chống lại kẻ thù thâm độc. Bằng cách hấp thụ năng lượng có hại, agate có thể bảo vệ chủ chống lại những xung năng lượng, là loại đá của nữ thần màu mỡ – bảo trợ cho những chủ trang trại và người làm vườn. Nhẫn gắn mặt đá agate làm cho người đàn ông trở nên quyến rũ hơn trong mắt phụ nữ. agate là biểu tượng của chòm sao Kim Ngưu và Song Tử trong cung hoàng đạo, năng lượng cảm thụ của âm có tác dụng tới tất cả các luân xa tuỳ thuộc vào màu sắc của đá. Những em bé đang đi học tiếp xúc nhiều với đá mã não sẽ thông minh, linh hoạt, học giỏi, tính thích nghi cao. Nhân viên tiếp thị đeo vào người vòng tay đá mã não có thể tăng cường khả năng thân mật, linh hoạt ứng biến, ngoại giao giỏi, rất có lợi cho hoạt động tiếp thị, nâng cao hiệu quả công việc. Trong buồng the đặt đá mã não sẽ làm tăng thêm sự ái ân vợ chồng, làm cho cuộc sống buồng the càng thêm mặn mà. Đặc tính chữa bệnh: Agate làm tăng tiềm năng, giúp điều trị bệnh ho lâu ngày và bệnh ở vùng họng. Người ta tin rằng, agate giúp làm giảm co giật, chống lại sự sợ hãi, bảo vệ cơ thể chống lại bệnh nhiễm khuẩn và bệnh ở dạ dày. agate có khả năng làm trung hoà độ axit dịch dạ dày, cũng như giải độc cho cơ thể. Có ý kiến cho rằng agate màu xanh da trời có tác dụng tích cực đối với tuyến giáp; mặt – vì vậy có tác dụng trị bệnh ở hệ hô hấp, tiêu hoá và một phần ở gan và đường mật. agate có tác dụng tích cực đối với hệ tuần hoàn, giúp điều trị rối loạn nội tiết và bệnh nhiễm virut. Loại dạng rêu có tác động chữa bệnh đối với da và và cơ quan hô hấp, loại dạng cành cây có tác dụng tốt đối với bệnh ở dạ dày. Tinh thể mã não là một tinh thể tuyệt vời để làm cân bằng và hài hòa cơ thể, tinh thần và cả tâm linh. Nó cũng làm sạch và ổn định tâm trí, loại bỏ sự tiêu cực. Mã não kích thích và củng cố khả năng phân tích, giúp suy nghĩ rõ ràng và lý trí hơn cũng như làm ta tập trung hơn vào một nhiệm vụ hiện thời. Hơn nữa, nó cũng cho ta quyền đến gần và lấy cảm hứng từ vùng đất tâm linh. Tinh thể mã não rất tốt khi được dùng với người đang mang thai vì nó làm dịu những cơn đau, giúp cả người mẹ và đứa bé bình tâm cũng như cân bằng lại trong suốt thời gian có thai. Sau khi sinh, tinh thể mã não ngăn tình trạng lệch dạ con. Những người da nóng, da gà, bao gồm cả chứng hay ra mồ hôi tay mồ hôi chân, nếu thường xuyên tiếp xúc với đá mã não có thể cải thiện được tình trạng trên. ",""""""
tiki.vn,https://tiki.vn/bo-trang-suc-ngoc-trai-long-vu-bnt-610-bao-ngoc-jewelry-freesize-p10163953.html?src=category-page-914.8374&2hi=0,10163953,Bảo Ngọc Jewelry,Trang sức,,650.000 ₫,Bảo Ngọc Jewelry,," - Chất liệu: Bạc S925 Xi Mạ Vàng Kết Hợp Với Ngọc Trai Nước Ngọt Tự Nhiên - Màu Sắc : Trắng - Bộ sản phẩm gồm : dây chuyền + mặt dây chuyền + nhẫn + bông tai - Kích thước hạt ngọc: 4-5 ly - Kích thước: chiều dài 45cm ( chưa tính mặt dây), nhẫn được thiết kế freesize có thể tùy chỉnh theo cỡ tay - Thiết kế thời trang - sang trọng thích hợp với các buổi tiệc Ý nghĩa của Bộ Trang Sức Ngọc Trai Lông Vũ BNT-610 Hình ảnh lông vũ vốn ẩn chứa rất nhiều ý nghĩa. Bộ Trang Sức Ngọc Trai Lông Vũ BNT-610 tạo hình lông vũ mang ý nghĩa của tự do, sự can đảm, khao khát của con người mong muốn được bay cao, bay xa. Vì thế, những thiết kế trang sức tại Bảo Ngọc cũng vậy, lông vũ, biểu tượng lông vũ cũng là biểu trưng cho sự cao quý, ấn tượng, đẹp đẽ và thông minh. Như những loài chim mang trong mình lông vũ tuyệt đẹp vậy. Ngoài ra, thiết kế thêm một viên ngọc trai sang trọng, nhỏ nhắn đính giữa từng món trang sức, quả là tuyệt tác mà những nhà thiết kế nghĩ ra để chiếc lông vũ bớt trống trải, thêm kiêu kỳ, sang trọng. ",""""""
tiki.vn,https://tiki.vn/vong-choker-kim-loai-dinh-da-elizabeth-vc-14000-299-p705034.html?src=category-page-914.8374&2hi=0,705034,Elizabeth Shop,Trang sức,,56.700 ₫,Chonmua365,," Vòng Cổ Choker Kim Loại Đính Đá Elizabeth VC-14000-299 với thiết kế đơn giản nhưng tinh tế, mang đến sự quyến rũ, duyên dáng cho những ai sở hữu nó. Kiểu dáng Choker - vòng cổ ôm sát cổ tôn nét kiêu kỳ, quyến rũ của chiếc cổ xinh xắn với phong cách hiện đại và ấn tượng thể hiện sự khỏe khoắn, cá tính, tạo điểm nhấn bắt mắt cho chiếc cổ cao đầy kiêu hãnh, duyên dáng và gợi cảm. Vòng cổ choker vẫn không có dấu hiệu “hạ nhiệt”! Bất cứ lứa tuổi nào cũng đều phù hợp với loại vòng cổ này. Choker cao cổ mang đến phong cách tuyệt vời cho các cô gái. Chiếc vòng tập trung vào cổ và xương đòn khiến các nàng càng thêm sexy và có chút phóng khoáng. Là chiếc vòng cổ tuy đơn giản nhưng rất đẹp và nhiều phong cách. Dễ dàng phối hợp với trang phục mỗi khi đi chơi hoặc dự tiệc Phù hợp làm quà tặng cho bạn gái hay cho những người phụ nữ mà bạn yêu thương, mang đến niềm vui, vẻ đẹp, sự trẻ trung và thời trang dành cho phái nữ. ",""""""
tiki.vn,https://tiki.vn/lac-tay-da-thach-anh-cao-cap-tang-hop-qua-bang-go-cao-cap-p6749073.html?src=category-page-914.8374&2hi=0,6749073,OEM,Trang sức,,179.000 ₫,Anna Trần Shop,," Lắc tay đá Thạch Anh cao cấp + Tặng hộp quà bằng gỗ cao cấp Vòng tay bao giờ cũng có hộp BẰNG GỖ bảo quản sang trọng kèm theo. Đá thiên nhiên 100%. Không phải loại đá quý. Là đá loại 1 Màu sắc cực đẹp Chất đá sáng. Đeo càng ngày càng sáng. Thiết kế tinh xảo Có hộp quà BẰNG GỖ sang trọng cho Quý khách làm quà tặng Hiện nay do 1 số shop bán đá giả và đá nhân tạo nhưng vẫn gộp chung với chúng tôi làm ảnh hưởng đến uy tín shop. Vì thế, Nếu quý khách mua hàng của shop vui lòng lưu ý: -Vòng tay bao giờ cũng có hộp bảo quản bằng gỗ sang trọng kèm theo. Shop cung cấp cho Quý khách là: Đá thiên nhiên 100%. Không phải loại đá quý. Là đá loại 1 Màu sắc cực đẹp Chất đá sáng. Đeo càng ngày càng sáng. Thiết kế tinh xảo Có hộp quà sang trọng cho Quý khách làm quà tặng Kích thước hạt: 10ly Chiều dài dây: 19cm. Phù hợp cho cổ tay từ 18-21cm ",""""""
tiki.vn,https://tiki.vn/lac-kieng-bac-s925-ket-hop-ngoc-trai-lk-5202-p10101688.html?src=category-page-914.8374&2hi=0,10101688,Bảo Ngọc Jewelry,Trang sức,,651.000 ₫,Bảo Ngọc Jewelry,," - Ngọc Trai Nước Ngọt Tự Nhiên - Bạc S925 ITALY Cao Cấp - Chiều Dài Lắc Tay: 15cm +3cm Tùy Chỉnh - Màu Sắc: Trắng Gây bất ngờ với thiết kế lạ mắt khi chiếc Lắc kiềng bạc s925 kết hợp ngọc trai LK-5202 một đầu được đính ngọc trai còn đầu còn lại là chiếc lá trong hình dạng của “lông vũ” mềm mại. Như thể món đồ trang sức bạc nữ này muốn truyền tải một thông điệp đến người đeo cũng như người quan sát sự mềm mại, uyển chuyển vô cùng linh hoạt của đôi tay người đeo. Hơn nữa viên đá quý tự nhiên màu xanh được đính trên chiếc lá giúp bạn thể hiện được sự tươi mới, sức sống mãnh kiệt và sự trẻ trung của chính mình. Sự xuất hiện của viên đá quý màu xanh trên chiếc Lắc kiềng bạc s925 kết hợp ngọc trai LK-5202 sẽ giúp bạn phần nào thể hiện được vẻ đẹp tươi sáng và trẻ trung của chính mình. ",""""""
tiki.vn,https://tiki.vn/nhan-nam-retro-1801-bac-p1655325.html?src=category-page-914.8374&2hi=0,1655325,OEM,Trang sức,,69.300 ₫,Chonmua365,," Nhẫn Nam Retro 1801 kiểu dáng nhẫn giành cho các bạn nam với họa tiết khắc trên mặt nhẫn phù hợp với nhiều hình dáng tay cũng như độ tuổi, đặc biệt sẽ giúp bạn che được khuyết điểm của ngón tay như hình dáng khúc khủy hoặc ngón tay dài. Chất liệu hợp kim độ bền cao, bóng đẹp. Sản phẩm dễ kết hợp với các loại phụ kiện khác cùng chất liệu như đồng hồ, dây chuyền,… ",""""""
tiki.vn,https://tiki.vn/day-chuyen-giot-nuoc-p2207899.html?src=category-page-914.8374&2hi=0,2207899,OEM,Trang sức,,114.300 ₫,Chonmua365,," Dây Chuyền Giọt Nước được thiết kế tinh xảo, độc đáo. Dễ dàng phối hợp với mọi loại trang phục. Hàng chuẩn đẹp. Tập trung tất cả mọi sự nữ tính mà một cô gái cần có. Chỉ cần trưng diện sản phẩm này, bạn sẽ nổi bật ở bất cứ nơi đâu mà bạn bước chân đến. Sản phẩm là quà tặng lý tưởng và ý nghĩa dành tặng cho các chị em phụ nữ vào những dịp quan trọng như lễ tình nhân, ngày Phụ Nữ Việt Nam, Quốc Tế Phụ Nữ, hoặc ngày của mẹ. LƯU Ý: Không nên đeo quá lâu một loại trang sức, phụ kiện duy nhất. Tránh tiếp xúc với các loại hóa chất tẩy rửa. Chịu khó lau chùi sản phẩm bằng khăn mềm. Khi không sử dụng, nên bảo quản trong hộp kín hoặc túi plastic kín miệng. ",""""""
tiki.vn,https://tiki.vn/lac-tay-da-ma-nao-cao-cap-an02-p4621721.html?src=category-page-914.8374&2hi=0,4621721,OEM,Trang sức,,179.000 ₫,Anna Trần Shop,, Lắc tay đá mã não cao cấp AN02 Đá thiên nhiên 100%. Không phải loại đá quý. Là đá loại 1 Màu sắc cực đẹp Chất đá sáng bóng Thiết kế tinh xảo Có hộp quà sang trọng cho Quý khách làm quà tặng ,""""""
