Domain,Url,Product_id,Brand,Category,Model,Price,Seller,Tags,Info,Others
tiki.vn,https://tiki.vn/mat-day-chuyen-co-4-la-thach-anh-tim-pdflcame01-vietgemstones-p3765865.html?src=category-page-914.8374&2hi=0,3765865,VIETGEMSTONES,Trang sức,,450.000 ₫,VietGemstones,," Mặt dây chuyền Cỏ bốn lá Thạch anh tím (Amethyst) Tương truyền cỏ 4 lá xuất hiện từ tuyền thuyết của người Ireland kể rằng, trước đây thánh Patrik đã sử dụng hình ảnh của chiếc cỏ 3 lá quen thuộc để thuyết giảng cho những người theo Đạo Chúa về 3 ngôi: Cha, con và thánh thần trong Cơ đốc giáo. Vì thế hình tượng cỏ 3 lá rất linh thiêng trong lòng những con chiên ngoan đạo. Điều đặc biệt hơn là trong 10.000 chiếc cỏ 3 lá thông thường mới có một chiếc cỏ 4 lá. Và người ta tin rằng, cỏ 4 lá có khả năng mang lại sự may mắn cho người sở hữu chúng. Những câu chuyện dân gian truyền tụng về khả năng kì diệu của loài cỏ này đã tồn tại từ rất lâu. Chúng vốn là những chiếc lá vô cùng hiếm hoi xuất hiện trên hàng ngàn những cây cỏ 3 lá quen thuộc. Nếu ai vô tình tìm thấy nó một cách tình cờ thì sẽ gặp nhiều may mắn trong cuộc sống. Bốn chiếc lá tượng trưng cho bốn điều may mắn trong cuộc sống: Lá thứ nhất chiếc lá của Niềm hi vọng Lá thứ hai chiếc lá của Niềm tin Lá thứ ba chiếc lá của Tình yêu Lá thứ tư chiếc lá của May mắn Bốn món quà đó chính là món quà thượng đế tặng cho mỗi đứa trẻ khi chào đời. Nhưng những điều tốt đẹp đó sẽ tồn tại mãi mãi nếu như đứa trẻ đó có một trái tim dũng cảm, sẵn sàng đi tìm, đương đầu với khó khăn thử thách. Thạch anh tím Đá thạch anh tím (Amethyst) là một loại đá quý được yêu thích từ thời xa xưa bởi vẻ đẹp kiêu sa, lộng lẫy cùng nhiều tác dụng kỳ diệu. Nó là loại đá được hoàng gia Anh ưa chuộng, được đính trên vương miện của nữ hoàng Catherine cũng như hoàng gia Ai Cập cổ đại: - Chống lại bùa ngải, ma thuật: nghe có vẻ khó tin nhưng đá thạch anh tím có công dụng trừ tà, chống việc thôi miên, trộm cướp. Đá tự nhiên hấp thu tinh hoa của thiên nhiên, trải qua hàng triệu năm khiến nó mang năng lượng mạnh mẽ có thể trấn tà. Thời xưa các pháp sư thường mang theo đá thạch anh tím bên người để chống lại ma quỷ, thế lực tà ác. Ngày nay đeo vòng tay, dây chuyền thạch anh tím, bạn có thể ngăn ngừa những điều không may như bỏ bùa, thôi miên, lừa gạt… Ngoài ra bạn phải luôn giữ được tâm lý vững vàng, có như vậy tác dụng của những viên đá phong thủy mới được phất huy tốt nhất. - Đem tới may mắn, bình an: Năng lượng từ đá thạch anh tím hỗ trợ bạn gột rửa tác nhân xấu trong cơ thể và trong tâm hồn, giúp bạn cảm thấy bình an hơn. Lúc đó bạn sẽ thấy mọi việc suôn sẻ hơn, từ gia đình, các mối quan hệ xã hội cho tới công việc làm ăn. - Người Hy Lạp thường mang theo một viên đá thạch anh tím khi tham gia các cuộc vui để tránh bị say xỉn, chúng cũng được dùng để chế tác thành ly, cốc đựng bia rượu, hoặc ngâm một viên đá nhỏ trong rượu để làm cho mùi vị của rượu trở nên đặc biệt hơn. - Thạch anh tím hỗ trợ tích cực cho não bộ, giúp giải tỏa căng thẳng và chống đau đầu, người già hoặc những người đang trong tình trạng căng thẳng có thể đặt thạch anh tím trong phòng ngủ để cải thiện giấc ngủ, giúp ngủ sâu và ngon giấc. - Đối với nhà tu hành, các thiền sư, loại đá này là công cụ hỗ trợ trong quá trình thiền định để giúp họ gột rửa tâm hồn và đạt cảnh giới cao hơn. - Thạch anh tím tạo sự sảng khoái, tư duy sáng tạo, đặc biệt tốt cho người hoạt động trong lĩnh vực nghệ thuật. Leonardo Da Vinci đã từng nói ” năng lượng diệu kỳ của thạch anh tím giúp giải phóng con người ta khỏi giới hạn, chúng giải phóng bộ não, kích thức sự sáng tạo, và dẫn lối con người đến ánh sáng của chân lý ” Màu tím thủy chung của thạch anh tím là món quà tuyệt vời cho người phụ nữ, chúng cũng được cho là làm cho phụ nữ hướng thiện và sống thủy chung. Mặt dây chuyền Cỏ bốn lá Thạch Anh Tím mang đến may mắn, bình an trong cuộc sống, giúp cho con người giải phóng bản thân ra khỏi giới hạn, kích thích sự sáng tạo và dẫn lối con ngời tới ánh sáng của chân lý. Mặt dây chuyền Cỏ bốn lá Thạch Anh Tím hỗ trợ tốt cho người mệnh Thổ và mệnh Hỏa. Xem thêm sản phẩm tại đây. ",""""""
tiki.vn,https://tiki.vn/bong-tai-star-drop-pearl-tatiana-bb2436-bac-p1218069.html?src=category-page-914.8374&2hi=1,1218069,Tatiana,Trang sức,,89.000 ₫,Tatiana,," Bông Tai Star Drop Pearl Tatiana BB2436 với thiết kế dáng dài hình ngôi sao tỏa sáng, nổi bật tạo nên sự thu hút, ấn tượng. Được sản xuất từ Hợp kim tạo sự sáng bóng, lung linh. Bông tai giúp tôn vinh nét duyên dáng, thanh tú cho bạn gái thêm phần nữ tính và xinh đẹp. Dễ kết hợp với các phụ kiện khác có sự tương đồng về chất liệu như: Đồng hồ, nhẫn, lắc tay, dây chuyền,... Đây là một sản phẩm phù hợp làm quà tặng cho bạn gái hay cho những người phụ nữ mà bạn yêu thương. ",""""""
tiki.vn,https://tiki.vn/day-chuyen-inox-hoa-kho-jhn0015-p2254469.html?src=category-page-914.8374&2hi=0,2254469,OEM,Trang sức,,47.500 ₫,Ngôi Nhà Trang Sức,," Dây chuyền Inox hoa khô - Dây chuyền Inox (Thép không gỉ) - Không đen, không gỉ sét - Không gây dị ứng - Mặt thuỷ tinh cứng chống va đập - Đường kính kính mặt 14mm - Hoa thật ép khô - Chiều dài dây 50cm Hướng dẫn bảo quản: - Không đeo trang sức khi tham gia các hoạt động thể thao và khi đi ngủ. - Thường xuyên lau chùi sản phẩm bằng khăn khô sạch để tăng độ bền của sản phẩm - Tránh tiếp xúc sản phẩm với hoá chất ( như nước hoa, các loại nước tẩy rửa….) ",""""""
tiki.vn,https://tiki.vn/lac-tay-kiem-lac-chan-co-bon-la-may-man-p10786917.html?src=category-page-914.8374&2hi=0,10786917,OEM,Trang sức,,42.300 ₫,Chonmua365,," Trang sức không chỉ là vật trang trí, phản ánh gu thẩm mỹ của người đeo mà còn tôn vẻ đẹp và khí chất của phụ nữ hiện đại. Một phụ nữ xinh đẹp, lịch thiệp luôn biết mình cần gì để thu hút sự chú ý, khẳng định vị trí của mình. Bộ sưu tập nữ trang với đủ thể loại, phù hợp với nhiều điều kiện sử dụng là lự chọn tốt đối với bạn. Phối hợp trang sức với y phục đúng lúc, đúng kiểu sẽ khiến mọi người phải trầm trồ thán phục. Lưu ý: Để sản phẩm luôn được sáng bóng, khách hàng có thể bảo quản sản phẩm ở nơi khô ráo, tránh tiếp xúc sản phẩm với các hóa chất tẩy rửa cao. Dùng giấy hoặc vải mềm hay hộp đựng trang sức chuyên dụng để bảo quản khi bạn không có nhu cầu đeo nữa (nên làm sạch và làm khô trước khi cất giữ). ",""""""
tiki.vn,https://tiki.vn/bong-tai-bang-da-thoi-trang-an03-p4621747.html?src=category-page-914.8374&2hi=0,4621747,OEM,Trang sức,,99.000 ₫,Anna Trần Shop,, Bông tai bằng đá thời trang AN03 Đá thiên nhiên 100%. Không phải loại đá quý. Là đá loại 1 Màu sắc cực đẹp Chất đá sáng bóng Thiết kế tinh xảo ,""""""
tiki.vn,https://tiki.vn/nhan-cao-roxy-fox-showfay-jewelry-tr0004-bac-freesize-p795233.html?src=category-page-914.8374&2hi=1,795233,Showfay Jewelry,Trang sức,,79.000 ₫,WIX SHOP,," Nhẫn Cáo Roxy Fox Showfay Jewelry TR0004 - Bạc mang theo nét quyến rũ, ma mị của mắt cáo với đường nét họa tiết uyển chuyển, có độ trong suốt, được mài cắt cẩn thận, tán sắc hoàn hảo mang đến sự lung linh cho sản phẩm. Phong cách mới lạ, thu hút sẽ là item giúp những cô nàng cá tính thêm phần nổi bật trước đám đông. Chất liệu hợp kim bạc có độ bền cực cao, chống oxi hóa hiệu quả và tuyệt đối an toàn cho ngay cả những làn da nhạy cảm. Chất liệu này hoàn toàn không chứa chì, Cadimi hay Atimon độc hại. Sản phẩm dễ kết hợp với các loại phụ kiện khác cùng chất liệu như đồng hồ, dây chuyền, lắc tay… Đồng thời, vẻ ngoài tinh khiết của sản phẩm giúp bạn dễ diện cùng với nhiều loại trang phục khác nhau, tôn lên vẻ đẹp và sự sang trọng cho các bạn nữ. Chú thích: Về phần thiết kế nhẫn freesize, sản phẩm giống như hình ảnh trong phần mô tả. Thiết kế nhẫn không nối liền cố định theo 1 kích thước cụ thể, mà có khoảng hở để người đeo có thể bóp nhẫn theo kích thước vòng ngón tay. Vì vậy nhẫn phù hợp cho mọi size ngón tay. ",""""""
tiki.vn,https://tiki.vn/bao-li-xi-vang-24k-kim-hoi-ancarat-p10032637.html?src=category-page-914.8374&2hi=1,10032637,ANCARAT,Trang sức,,299.000 ₫,Ancarat,," Bao Lì Xì Vàng 24K Kim Hợi Ancarat với chất liệu vàng 9999, thay vì những phong bao lì xì giấy thông thường hay món quà nặng nề, người ta lựa chọn những bao lì xì đồng vàng 9999 để trưng bàn thờ cầu may, bỏ tủ tiền/két sắt cầu tài hay làm quà tặng biếu cấp trên, người thân, khách hà vì kiểu lì xì này vừa lạ, vừa đẹp mắt, lại gọn nhẹ và đảm bảo giá trị kinh tế. Xã hội càng phát triển, xu hướng tặng quà cũng dần khác biệt. Ngày nay, người ta chú trọng những món quà tặng vừa độc đáo, lại phải ý nghĩa và phong thủy. Vậy nên, lì xì vàng ròng xuất hiện đã đổi gió mới cho thị trường quà tặng. Cam kết: Tất cả các sản phẩm vàng của Ancarat sẽ được bảo hành miễn phí 12 tháng đầu về kỹ thuật và nước xi, thắt dây vải miễn phí đối với sản phẩm charm. Ancarat miễn phí đánh bóng, siêu âm làm sạch miễn phí trọn đời. ",""""""
tiki.vn,https://tiki.vn/vong-tay-go-sua-do-dang-cap-p7050847.html?src=category-page-914.8374&2hi=1,7050847,VFASHION,Trang sức,,160.000 ₫,Tatiana,," Đền tiền 300% nếu phát hiện hàng giả, kém chất lượng. 100% cam kết sản phẩm tự nhiên, gia công thủ công, đeo càng lâu vòng càng đẹp. Gỗ nhập tuổi thọ ít nhất 40 năm qua tuyển chọn, bảo hành chất lượng trọn đời, vòng đeo càng lâu càng có giá trị. Có đủ các kích cỡ đảm bảo độ phù hợp và tính thẩm mỹ cao cho mọi lưá tuổi. TẠI SAO VÒNG GỖ SƯA ĐỎ ĐƯỢC MỆNH DANH LÀ ÔNG HOÀNG CỦA TÀI LỘC, MAY MẮN Về phong thủy và làm ăn: vòng được làm từ gỗ sưa đỏ tượng trưng cho long mạch, có năng lượng cao, tránh tà ma, năng lượng xấu, có thể cải thiện phú quý tài lộc, đeo bên mình để trấn tà khí cũng như hút các năng lượng phú quý. Về sức khoẻ: mùi hương gỗ sưa đỏ có thể xua tan đi mọi căng thẳng của bạn, lấy lại được sự thoải mái và tràn đầy năng lượng, thông thường loại gỗ thiên nhiên có mùi thơm là loại gỗ có phước báo lớn. Đặc biệt, gỗ sưa mùi hương rất nhẹ, đeo lâu lâu, có nhiệt độ và ma sát mới lên mùi. Đeo lên tay thì vùng da đeo sẽ thấy hồng hào và đầy sức sống, phù hợp với mọi lứa tuổi từ bé sơ sinh đến người già. THAM KHẢO CHỌN SIZE VÒNG CHO PHÙ HỢP Nam: 10 li phù hợp dành cho những người thích đeo vòng nhỏ nhắn hoặc cân nặng khoảng từ 40-50kg. 12 li phù hợp dành cho những người khoảng 51->65kg. 14 li phù hợp dành cho những người khoảng 66->75kg. 16 li phù hợp dành cho những người khoảng 76kg trở lên. Nữ: Thường chọn vòng 10 li sẽ nhỏ nhắn, nữ tính sẽ phù hợp nhất. Đây chỉ là chỉ số tham khảo, sự lựa còn phụ thuộc vào sở thích, tính cách cá nhân riêng của từng người. ",""""""
tiki.vn,https://tiki.vn/mat-day-chuyen-van-thu-bo-tat-da-obsidian-vton-p798841.html?src=category-page-914.8374&2hi=0,798841,Ngọc Quý Gemstones,Trang sức,,189.000 ₫,Ngọc Quý Gemstones,," Mặt Dây Chuyền Văn Thù Bồ Tát Đá Obsidian Ngọc Quý Gemstones VTON được chạm khắc từ đá obsidian hình thành từ nham thạch núi lửa và có màu đen, bề mặt bóng như thủy tinh. Loại đá obsidian giúp ổn định thận và huyết áp, đặc biệt là những người gặp vấn đề liên quan đến huyết áp. Ngoài ra đá này còn tăng cường hệ miễn dịch trong cơ thể và giúp đường ruột dạ dày giúp hấp thụ năng lượng tốt. Về mặt tâm linh, đá obsidian làm tăng sức mạnh, ý chí, niềm tin vào cuộc sống, khơi dậy cảm giác kiên định và lòng tin vào bản thân. Bên cạnh đó, sản phẩm còn chạm khắc hình tượng Văn Thù bồ Tát là biểu tượng của sự thông minh, trí tuệ sáng; giúp công việc, học hành, thi cử của bạn được suôn sẻ, thành công. Vì vậy đây là sản phẩm mang lại cho bạn sức khỏe tốt và mang lại may mắn cho cuộc sống. ",""""""
tiki.vn,https://tiki.vn/bong-tai-korea-rolling-tatiana-bh2414-vang-p1218061.html?src=category-page-914.8374&2hi=1,1218061,Tatiana,Trang sức,,67.000 ₫,Tatiana,," Bông Tai Korea Rolling Tatiana BH2414 với thiết kế kiểu dáng tròn đơn giản nhưng không kém phần nổi bật tạo nên sự thu hút, ấn tượng. Được sản xuất từ Hợp kim tạo sự sáng bóng, lung linh. Bông tai giúp tôn vinh nét duyên dáng, thanh tú cho bạn gái thêm phần nữ tính và xinh đẹp. Dễ kết hợp với các phụ kiện khác có sự tương đồng về chất liệu như: Đồng hồ, nhẫn, lắc tay, dây chuyền,... Đây là một sản phẩm phù hợp làm quà tặng cho bạn gái hay cho những người phụ nữ mà bạn yêu thương. ",""""""
tiki.vn,https://tiki.vn/nhan-set-vong-hoa-han-quoc-tatiana-nh2273-xanh-p2372813.html?src=category-page-914.8374&2hi=1,2372813,Tatiana,Trang sức,,49.000 ₫,Tatiana,," Nhẫn Set Vòng Hoa Hàn Quốc Tatiana NH2273 (Xanh) là phụ kiện không thể thiếu cho bạn gái, không chỉ trong những buổi tiệc, những dịp đặc biệt quan trọng mà trong cuộc sống hàng ngày phụ nữ cũng cần những chiếc vòng tay, bông tai, nhẫ để tô điểm cho vẻ ngoài của mình thêm phần quý phái và nổi bật. Nhẫn được thiết kế có kiểu dáng đơn giản, gia công đẹp mắt, sẽ là lựa chọn hoàn hảo cho các cô nàng mỗi khi tham gia các bữa tiệc, hẹn hò cùng bạn bè tôn nét nữ tính, sang trọng và không kém phần hiện đại. Nhẫn không chỉ có tác dụng tô điểm vẻ đẹp, mà còn giúp phái đẹp thể hiện gu riêng của mình. Thiết kế tinh tế, sang trọng, đầy nữ tính cho bạn thoải mái ""mix - match"" với các trang phục khác nhau. Thể hiện cá tính của bản thân với sản phẩm đến từ thương hiệu Tatiana. Với thiết kế đơn giản, kiểu dáng đẹp mắt ấn tượng sẽ tăng phần hiện đại cho bạn gái. ",""""""
tiki.vn,https://tiki.vn/nhan-titan-don-gian-co-the-lam-nhan-cap-nc179-p4301547.html?src=category-page-914.8374&2hi=0,4301547,OEM,Trang sức,,135.000 ₫,PONPON SHOP,," Nhẫn cặp titan inox nguyên khối cao cấp 100% không đen không rĩ,ngâm nước thoải mái. Cam kết hình ảnh đúng 100% sản phẩm thực tế. Mẫu mã độc đáo - sang trọng - ý nghĩa. ",""""""
tiki.vn,https://tiki.vn/vong-tay-da-mat-ho-hat-luu-p6934505.html?src=category-page-914.8374&2hi=0,6934505,OEM,Trang sức,,202.000 ₫,GAIA,," Hiện nay, hầu hết mọi người đều sắm cho mình 1 số đồ trang sức như: vòng tay, nhẫn dây chuyền,..v.v. Nhưng có thật sự là những món đồ đó có ý nghĩa như thế và hợp với mình không thì ít người có thể lựa chọn chính xác. Sau đây Gaia sẽ hướng dẫn quý anh chị cách lựa chọn vòng tay đá hợp phong thủy và mang lại may mắn về mọi mặt Anh chị có thể lựa chọn theo nhiều phương pháp như: mệnh niên, mệnh quái, bát tự..v.v Về mệnh niên: ( xem màu theo ngũ hành ) thì anh chị có thể lựa theo năm sinh âm lịch của mình nam nữ đều giống nhau, dùng để xem tử vi, tuổi kết hôn. Về mệnh quái : Dùng để xem màu sắc tương sinh hòa hợp, xem hướng nhà, vị trí chỗ ngồi..v.v cùng 1 năm sinh âm lịch , nhưng nam nữ khác nhau ( Cái này sẽ chính xác hơn mệnh niên) Về bát tự : Xem theo ngày tháng năm sinh + giờ sinh + giới tính. Xem theo phương pháp này sẽ biết anh chị đang cần hoặc thiếu ngũ hành nào bổ sung để cân bằng ngũ hành và cho gia chủ vượng hơn. ( Cái này khó hơn, mất thời gian hơn). Khi đã biết ngũ hành của mình anh chị có thể lựa chọn theo màu sắc của ngũ hành đó hoặc màu sắc tương sinh của ngũ hành đó vd: Ngũ hành thủy: màu xanh dương, đen, xám,. Màu tương sinh: trắng, vàng ánh kim,bạc, kem Ngũ hành kim : màu trắng, ánh kim, bạc, kem. Màu tương sinh: vàng đậm , nâu đất, cam Ngũ hành thổ : vàng đậm, nâu đất , cam. Màu tương sinh: hồng, đỏ, tím Ngũ hành hỏa: hồng, đỏ, tím. Màu tương sinh: xanh lá cây, xanh ngọc. Ngũ hành mộc: xanh lá cây, xanh ngọc: Màu tương sinh: xanh dương, đen, xám, ghi VÒNG TAY ĐÁ MẮT HỔ Đá mắt hổ là 1 thành viên quan trọng của dòng tóc thạch anh. Nó hàm chứa nhiều chất amiăng xếp thành những dãy song song. Chúng dễ phản ứng với ánh sáng tạo nên những nhấp nháy như mắt hổ. Từ trường của loại đá này rất tốt giúp kích ứng thần kinh thái dương, nên dùng để chữa bệnh. Còn xét về mặt phong thủy thì đá mắt hổ giúp tăng tài khí, chiêu tài, tăng uy lực. ",""""""
tiki.vn,https://tiki.vn/bong-tai-bac-da-thien-nhien-5-menh-ngu-hanh-ancarat-b3-p6766485.html?src=category-page-914.8374&2hi=0,6766485,ANCARAT,Trang sức,,159.000 ₫,Ancarat,," Trang sức là một điểm nhấn không thể thiếu của các cô gái, đặc biệt là bông tai bởi lẽ nó làm cho gương mặt phái đẹp bừng sáng và rạng rỡ hơn bao giờ hết. Dù là một cô nàng sành điệu hay một cô gái yêu thích sự đơn giản, item bông tai bạc gắn đá thiên nhiên mang phong cách tối giản từ Ancarat đều thích hợp. Bởi item này vừa làm đẹp lại vừa có thể chọn đeo theo màu ngũ hành hợp mệnh để gia tăng sức khỏe và may mắn! ** Thông tin sản phẩm ** Sản phẩm: Bông tai bạc đá thiên nhiên 5 mệnh ngũ hành Ancarat B3 Thương hiệu: Ancarat Chất Liệu: Bạc 925 - Đá thiên nhiên Xuất xứ: Việt Nam Ý nghĩa: Bình anh, may mắn ** Hướng dẫn bảo quản ** Không để sản phẩm tiếp xúc với các loại mỹ phẩm và hóa chất Vệ sinh trang sức thường xuyên bằng nước rửa trang sức chuyên dụng, sau đó rửa lại bằng nước và lau khô. Cất giữ trong hộp khi không sử dụng ",""""""
tiki.vn,https://tiki.vn/vong-co-choker-da-dinh-trai-tatiana-cd2005-vang-p1218099.html?src=category-page-914.8374&2hi=1,1218099,Tatiana,Trang sức,,99.000 ₫,Tatiana,," Vòng Cổ Choker Đá Đính Trai Tatiana CD2005 - Xu hướng Tattoo Choker bắt nguồn từ những năm 80, 90, là đại diện tiêu biểu cho phong cách Gothic Punk hầm hố hot nhất thời điểm đó. Sự trở lại của những xu hướng Retro giúp kiểu vòng cổ độc đáo này lại gây sốt một lần nữa trong giới trẻ. Vòng cổ ôm sát cổ tôn nét kiêu kỳ, quyến rũ và rạng rỡ của chiếc cổ xinh xắn. Dây đeo thể hiện sự khỏe khoắn, cá tính, các cô nàng tha hồ khoe chiếc cổ cao đầy kiêu hãnh, duyên dáng và gợi cảm. Đây là sự lựa chọn lý tưởng cho những ai thực sự đam mê hình ảnh cổ điển, nhẹ nhàng và thanh lịch ",""""""
tiki.vn,https://tiki.vn/day-chuyen-bac-nu-mat-co-4-la-dinh-da-xanh-duong-dcn0158-p10042780.html?src=category-page-914.8374&2hi=0,10042780,OEM,Trang sức,,280.000 ₫,Trang Sức TNJ,," - Dây chuyền bạc nữ mặt cỏ 4 lá đính đá xanh dương DCN0158 được khách hàng lựa chọn nhiều nhất - Bộ sản phẩm: 1 dây + mặt sản phẩm - Đóng gói: sản phẩm có hộp đựng sang trọng đi kèm - Dây chuyền bạc nữ mặt cỏ 4 lá đính đá rất phù hợp để làm quà tặng cho dịp lễ tết Valentine, 20/10, Noel, sắp tới. Đây là sản phẩm độc đáo với các bạn nữ và là món quà ý nghĩa cho các chàng trai đang tìm kiếm quà tặng trong các dịp lễ sinh nhật - Thông tin chi tiết về sản phẩm: Chất liệu bạc cao cấp 925. Độ trắng sáng cao, không lo bị đen, xỉn màu. Chất liệu bạc 925: 92,5% bạc nguyên chất phần còn lại là hợp chất làm tăng độ cứng và sáng bóng cho sản phẩm. Hàng y hình shop chụp, sản phẩm đã được kiểm duyệt nên các bạn yên tâm về mẫu mã và chất lượng nhé ",""""""
