Domain,Url,Product_id,Brand,Category,Model,Price,Seller,Tags,Info,Others
tiki.vn,https://tiki.vn/lac-tay-nam-bac-ta-bac-hieu-minh-ltn012-free-size-p2613257.html?src=category-page-914.8374&2hi=0,2613257,Bạc Hiểu Minh,Trang sức,,900.000 ₫,Bạc Hiểu Minh,," Lắc Tay Nam Bạc Ta Bạc Hiểu Minh LTN012 (Free Size) được làm từ chất liệu chứa 92,5% bạc nguyên chất còn lại là các chất phụ gia tạo độ bóng và độ cứng. Lắc có kiểu dáng sang trọng, màu bạc sáng, dễ dàng kết hợp với trang phục và các phụ kiện khác. Việc khéo léo kết hợp chất liệu bạc cao cấp cùng đường nét hoa văn tinh tế, lắc tay bằng bạc sẽ là phụ kiện mang đến cho phái đẹp nét duyên dáng, cuốn hút. Sản phẩm giúp tôn thêm nét đẹp vốn có, tạo cho bạn sự tự tin, nam tính và đầy quyến rũ. Bạn dễ dàng phối hợp với nhiều trang phục và những buổi dạ tiệc sang trọng lẫn môi trường làm việc. ",""""""
tiki.vn,https://tiki.vn/bong-tai-metal-drop-pearl-tatiana-bh2341t-trang-p1948357.html?src=category-page-914.8374&2hi=0,1948357,Tatiana,Trang sức,,77.000 ₫,Tatiana,," Bông Tai Metal Drop Pearl Tatiana BH2341T - Trắng với sự sắc sảo trong từng đường nét thiết kế chắc chắn sẽ thu hút sự chú ý của các cô nàng ngay từ ánh nhìn đầu tiên. Bông tai Tatiana được chế tác tinh xảo từ chất liệu hợp kim xi mạ mang đến độ bền và độ bóng đẹp hoàn hảo giúp cho đôi tai của bạn nữ thêm phần nổi bật và cuốn hút. Thiết kế kiểu dáng thời trang, hiện đại, dễ mix-match tạo set đồ năng động giúp bạn nữ tự tin hơn khi bước xuống phố trong những buổi cà phê, dạo chơi cùng bạn bè. ",""""""
tiki.vn,https://tiki.vn/vong-tay-thach-anh-cam-charm-hoa-tiet-hinh-ong-ma-vang-sang-trong-ht03-co-hjat-10li-co-kem-tui-nhung-cao-cap-p2856699.html?src=category-page-914.8374&2hi=1,2856699,OEM,Trang sức,,139.000 ₫,THỜI TRANG TOPE,," Vòng tay đá thạch anh đem lại nhiều may mắn trong cuộc sống, công việc, đẩy lùi vận rủi, hỗ trợ sức khỏe, thu hút tài lộc, thịnh vượng. Vừa là phụ kiện giúp bạn thể hiện phong cách và cá tính của mình, vừa có ý nghĩa là một vật cầu may mắn, an lành đến cho chủ nhân. Là món quà rất ý nghĩa dành tặng cho bạn bè, người thân của bạn. Cỡ hạt: 8 li Kiểu hạt: hạt tròn trơn Kiểu vòng: kết hợp hạt trắng, gắn charm lá vàng thời trang Màu sắc: thạch anh cam ( hợp mạng thổ) ",""""""
tiki.vn,https://tiki.vn/vong-co-hu-khong-tang-bo-tat-thach-anh-xanh-4-3cm-p8030890.html?src=category-page-914.8374&2hi=0,8030890,OEM,Trang sức,,260.000 ₫,868,," Hư Không Tạng Bồ Tát là vị phật tượng trưng cho sự thông tuệ và sự bảo vệ. Đôi mắt của ngài có thể nhìn thông tất cả kho tàng trên thế gian, nhưng ngài không màng đến mà xem tất cả như hư không. Chính vì thế mà pháp danh của ngài là Hư Không Tạng. Hư Không Tạng Bồ Tát - Ánh sáng thông tuệ và tâm sáng Trong kinh phật có ghi lại, Ngài tay phải mang kiếm có liệt hỏa rực sáng tượng trưng cho sức mạnh của sự bảo vệ. Tay trái ngài mang nhành hoa sen hoặc viên ngọc sáng biểu trưng cho sự thông tuệ và tâm trong sáng. Khi mang hình tượng Hư Không Tạng Bồ Tá bên mình sẽ giúp bản thân tăng cường sức mạnh lý trí, tránh khỏi những cám dỗ của vật chất, tà ma đồng thời giúp thanh tịnh đầu óc cho một tâm trí mạnh khỏe, sáng suốt. Hư Không Tạng Bồ Tát là vị phật bản mệnh cho những người tuổi Sửu và tuổi Dần. Thông tin sản phẩm: Vòng cổ Hư Không Tạng Bồ Tát thạch anh xanh 4.3cm Xuất xứ : Đài loan Kích thước : mặt dây chuyền : 2.9cm x 4.3cm, Chất liệu : đá thạch anh Ý nghĩa: Phật Hư Không Tạng Bồ tát bổ trợ cho người tuổi Sửu, Dần có trí tuệ cao siêu, mang sức mạnh nhân từ, cứu giúp chúng sinh trong nước và lửa. Ngài giúp những người sinh năm Sửu và Dần tăng thêm trí nhớ, phù hộ cho họ có của cải dồi dào, gia đình yên vui hoà hợp. Ngoài ra còn bổ trợ tốt về sức khỏe. Bộ sản phẩm bao gồm mặt Phật. dây vòng cổ và móc mặt dây chuyền bằng Ti-tan mạ-vàng PVD ( công nghệ mạ-vàng tiên tiến nhất hiện nay trên thế giới, không gây ô nhiễm môi trường. Tuổi thọ vật liệu sau khi phủ lớp PVD thường cao gấp 3 - 4 lần ) ",""""""
tiki.vn,https://tiki.vn/vong-tay-tram-do-108-hat-p11808106.html?src=category-page-914.8374&2hi=0,11808106,OEM,Trang sức,,400.000 ₫,vongtayphongthuy,," Gỗ trầm hương hay người ta vẫn gọi mùi hương của trời từ xưa đã được các bậc vua chúa vô cùng yêu chuộng bởi không những có giá trị về tâm linh mà còn tốt cho sức khỏe. Vòng Trầm Dó Bầu chuỗi 108 hạt sử dụng nguyên liệu từ Trầm Dó Bầu được thiết kế tinh xảo, tinh tế chắc chắn sẽ khiến bạn yêu ngay từ lần đầu gặp gỡ. Tiền thân của gỗ trầm hương là cây Dó Bầu, gỗ của cây khi chưa có tinh dầu trầm tích tụ thì rất nhẹ và trắng. Mùi hương trầm là một trong những loại hương được biết đến như một tác nhân tích cực, thúc đẩy hệ thần kinh giao cảm trong mỗi người, giúp con người cảm thấy gắn kết và gần gũi với nhau cũng như với môi trường tự nhiên. Năng lượng trong trầm hương nguyên chất tỏa ra có thể hóa giải các xung đột về năng lượng của con người cũng như vạn vật, giúp con người hài hòa hơn với môi trường xung quanh. – Theo kinh Phật, cuộc đời của chúng ta liên tục nối tiếp trong ba đời từ quá khứ đến hiện tại và tương lai. Như vậy, trong ba đời ta đã tạo thành 108 thứ phiền não để làm hành trang trong đoạn đường sanh tử không cùng tận. Kinh Phật dạy: “Nếu như muốn tiêu trừ các phiền não chướng, nên xâu chuỗi 108 hạt, luôn đem theo bên mình, hoặc đi đứng nằm ngồi, lần chuỗi niệm Phật, niệm Pháp, niệm Tăng, lần chuỗi trì niệm danh hiệu Phật càng nhiều càng tốt. Nếu như mãn 20 vạn biến thì có thể đạt đến Thân Tâm Bất Loạn. Thiết kế đẹp mắt, tinh tế, màu săc sang trọng chắc chắn sẽ không làm bạn thất vọng khi cầm trên tay chuỗi hạt linh thiêng này ",""""""
tiki.vn,https://tiki.vn/vong-tay-phong-thuy-nam-da-thach-anh-den-ms54-p10376375.html?src=category-page-914.8374&2hi=0,10376375,OEM,Trang sức,,129.000 ₫,Xtop VN,," òng đeo tay đá thạch anh đen MS54 được chế tác từ loại đá thạch anh đen khai thác trong tự nhiên. Để có được sản phẩm vòng đá thạch anh đen như hiện tại thì người ta phải trải qua các kỹ thuật chế tác khác nhau như mài, cắt… Người ta còn gọi đá thạch anh đen là Morion. Loại đá này gần như là không trong suốt và chỉ có ánh sáng xuyên qua những lá mỏng mà thôi. Sản phẩm được mix thêm charm Tỳ hưu. Trong phong thủy, Tỳ hưu là con vật linh thiêng, ăn vàng bạc và không có hậu môn. Vì vậy nó tượng trưng cho tài lộc, chuyên canh giữ châu báu. Vòng đá mã não kết hợp với Tỳ hưu sẽ tăng cường năng lượng phong thủy, giúp chủ nhân thành công. Đá thạch anh đen chủ yếu được tìm thấy ở những mạch nhiệt dịch. Người ta phát hiện loại đá này ở nhiều nước trên thế giới như Ukraina, Kazacxtan. Poland. Brazil, Madagaska. Tại Việt Nam chúng ta cũng có thạch anh đen nhưng trữ lượng không nhiều ở Lâm Đồng. Vòng đá thạch anh đen MS54 là loại đá tự nhiên hấp thụ những nguồn năng lượng âm của đất trời. Việc đeo vòng đá thạch anh đen sẽ giúp cải thiện vận may, sức khỏe. Hỗ trợ cho chủ nhân làm ăn phát đạt hơn. Giúp mang đến cho người đeo sự bình an, có cảm giác được che chở, bảo vệ. Vòng đá thạch anh đen cũng giúp mang lại cho chủ nhân khả năng linh cảm tốt hơn. đen giúp làm tăng khả năng tưởng tượng và kích thích sự phát triển trí óc. Đeo vòng đá thạch anh đen giúp cải thiện những mối quan hệ, giúp chủ nhân khi đeo sẽ được cải thiện tình cảm vợ chồng, tình cảm nam nữ và các mối quan hệ ngoài xã hội một cách hiệu quả. ",""""""
tiki.vn,https://tiki.vn/bong-tai-tua-rua-long-vu-tatiana-bh2321t-trang-p1948323.html?src=category-page-914.8374&2hi=1,1948323,Tatiana,Trang sức,,89.000 ₫,Tatiana,," Bông Tai Tua Rua Lông Vũ Tatiana BH2321T - Trắng với sự sắc sảo trong từng đường nét thiết kế chắc chắn sẽ thu hút sự chú ý của các cô nàng ngay từ ánh nhìn đầu tiên. Bông tai Tatiana được chế tác tinh xảo từ chất liệu 30% bạc 925 + đồng mang đến độ bền và độ bóng đẹp hoàn hảo giúp cho đôi tai của bạn nữ thêm phần nổi bật và cuốn hút. Thiết kế kiểu dáng thời trang, hiện đại, dễ mix-match tạo set đồ năng động giúp bạn nữ tự tin hơn khi bước xuống phố trong những buổi cà phê, dạo chơi cùng bạn bè. ",""""""
tiki.vn,https://tiki.vn/nhan-ma-bac-cao-cap-mondays-love-mk184-p3284881.html?src=category-page-914.8374&2hi=0,3284881,OEM,Trang sức,,79.000 ₫,Bờm Store 2016,," Nhẫn Mạ Bạc Cao Cấp Mondays Love MK184 được làm từ chất liệu cao cấp tạo độ bóng và độ cứng. Nhẫn bằng vàng hoặc bạc lại càng có ý nghĩa vì người phương Đông cho rằng vàng bạc tượng trưng cho sự vĩnh cửu, danh vọng và quyền lực. Có thể mix món phụ kiện này với bộ trang phục yêu thích khi đi tiệc, đi dạo, đi làm,... để tạo điểm nhấn cá tính mà mạnh mẽ hơn. Hướng dẫn chon size: ",""""""
tiki.vn,https://tiki.vn/kim-cuong-nhan-tao-dang-tron-86-giac-fascino-gems-phat-loc-p10820713.html?src=category-page-914.8374&2hi=0,10820713,FASCINO,Trang sức,,199.000 ₫,FASCINO,," Kim Cương Nhân Tạo Dạng Tròn 86 Giác 8.0mm - Fascino Gems PHÁT LỘC Với công nghệ cắt mài độc đáo từ Châu Âu, giác cắt 86 giác (Phát Lộc) mang đến cho viên kim cương nhân tạo độ sáng lấp lánh cùng với thiết kế màu đỏ xuân mang lại tài lộc cho chủ nhân. Các size đá từ 2.0mm - 3.0mm thường dùng để đính trên răng, một dòng sản phẩm tuyệt vời cho nụ cười đẹp như mùa thu tỏa nắng. Các size đá 4.5 mm, 5.4 mm thường được dùng để làm hoa tay hoặc kết vòng đeo tay với nhiều viên đá sáng lấp lánh. Các size đá 6.3mm, 7.0mm, 8.0mm thường được dùng làm đá chủ cho nhẫn xoàn hoặc mặt dây chuyền. Kim Cương Nhân Tạo 86 Giác Dạng Tròn 8.0 mm Màu Trắng Mệnh Kim - LƯU Ý ĐÁ MÀU GIÁ CAO HƠN ĐÁ TRẮNG TỪ 50% DO PHÔI ĐÁ CAO HƠN VÀ CÔNG NGHỆ TẠO MÀU TCF CẦN KỸ THUẬT CAO HƠN. KIM CƯƠNG NHÂN TẠO FASCINO GEMS MỆNH KIM FASCINO GEMS là một thương hiệu thời trang chuẩn Châu Âu với nhiều năm kinh nghiệm trong ngành thời trang và đá quý, kỹ thuật chế tác và cắt mài tinh xảo, kỹ thuật tổng hợp và đánh bóng bề mặt tuyệt vời đã cho ra đời những viên pha lê, đá tổng hợp, đá thiên nhiên, kim cương nhân tạo với độ lấp lánh, độ trong, cứng, màu sắc và đẹp mắt y như kim cương tự nhiên mà khó có thể phân biệt bằng mắt thường. “Kim cương nhân tạo là loại hạt Cubic Zirconia, với kiểu cắt chuẩn Châu Âu Diamond Cut và độ cứng đạt 8.5 Mohs, so với kim cương tự nhiên có độ cứng là 10.0 Mohs (Mohs là thang chuẩn dùng để đo độ cứng cho các khoáng vật)”. ​ Kim cương nhân tạo đạt tiêu chuẩn nước D trong khi các viên kim cương tự nhiên thường là nước F, nước E là hiếm và nước D hầu như không tìm thấy trong tự nhiên). Với công nghệ tổng hợp hiện đại, viên kim cương nhân tạo không bị than, bị lẫn tạp chất hay bị vết nứt tự nhiên luôn tìm thấy ở những viên kim cương tự nhiên. Một viên kim cương nhân tạo khi được chế tác xử lý đúng quy cách phải có 57 mặt cắt theo tiêu chuẩn của Hiệp hội Kim cương Thế giới, mặt trên có 25 giác cắt và mặt dưới có 32 giác cắt, khi nhìn qua kính chuyên dụng từ trên mặt xuống sẽ nhìn thấy hình 8 mũi tên và 8 trái tim khi nhìn từ dưới đáy lên. Ngoài giác cắt chuẩn kim cương 57 giác, chúng tôi còn nghiên cứu các giác cắt mới lạ và độc đáo ngày càng phong phú và đa dạng. Viên 86 giác, một con số may mắn mang nhiều tài lộc cho chủ nhân, viên 120 giác để kỷ niệm 120 năm thành lập và phát triển của tập đoàn, giác cắt Lucky Star kế thừa và phát huy từ giác cắt theo công nghệ Nhật Bản và các giác cắt khác mà chúng tôi gọi chung là FANCY SHAPE. “Kim cương tự nhiên vẫn cuốn hút với vẻ đẹp hoàn mỹ và vĩnh cửu và là món trang sức được bao người ao ước đang ngày càng trở nên khan hiếm trong thiên nhiên. Chính điều này đã khiến cho giá thành của “ông vua của thế giới đá quý” vô cùng đắt đỏ và không phải ai cũng có đủ khả năng để có thể sở hữu. Nếu các bạn có từng nghe nói đến kim cương máu Nam Phi, chắc bạn cũng biết để có được những viên kim cương hoàn mỹ cho người tiêu dùng phải đánh đổi bằng máu đó là chuyện thường thấy ở xứ sở kim cương Nam Phi. VÀI ĐIỀU VỀ CHỌN MÀU ĐÁ THEO PHONG THỦY Mạng Thổ nên chọn các màu: Đỏ, Hồng, Tím (Hỏa), Nâu, Vàng (Thổ) Mạng Kim nên chọn các màu: Nâu, Vàng (Thổ), Trắng, Vàng Sẫm (Kim) Mạng Thủy nên chọn các màu: Trắng, Vàng Sẫm (Kim), Lam, Xám (Thủy) Mạng Mộc nên chọn các màu: Lam, Xám (Thủy), xanh lục (Mộc) Mạng Hỏa nên chọn các màu: xanh lục (Mộc), Đỏ, Hồng, Tím (Hỏa) Xem bảng tra đá màu hợp cung mệnh và cung mệnh theo tuổi bên dưới ​ ​ XEM CÁC SẢN PHẨM KHÁC CỦA SHOP: ",""""""
tiki.vn,https://tiki.vn/vong-da-dep-accessories-pta29-xanh-duong-p795665.html?src=category-page-914.8374&2hi=1,795665,Đẹp Accessories,Trang sức,,149.000 ₫,Tiki Trading,," Vòng Đá Đẹp Accessories PTA29 - Xanh Dương sẽ là món quà tuyệt vời dành cho mọi người khi mang nó, là lá bùa mang lại may mắn và bình yên khiến người mang trở nên lạc quan, yêu đời, con người có cái nhìn trong sáng, tốt đẹp hơn cuộc sống. Màu xanh dương sáng, được mài giũa tỉ mỉ, với đường kính 1cm, kích cỡ 12 ly, khi đeo không bị thô ráp, hay sần sùi, vẻ đẹp và mang đến sự thịnh vượng cho người sở hữu. Là bùa hộ mệnh, có khả năng tăng cường sức mạnh thể chất, khuyến khích sự sáng tạo, giúp tinh thần minh mẫn, tập trung và sẽ mang lại may mắn, tài lộc và trừ tà cho chủ nhân. Loại vòng tay đá mắt mèo thích hợp cho các bạn nữ, theo phong thủy, mang vòng đá sẽ đem lại nhiều may mắn, tôn lên vẻ đẹp của người sở hữu và thịnh vượng cho gia chủ. ",""""""
tiki.vn,https://tiki.vn/vong-tay-nu-ma-bac-dinh-pha-le-showme-sm-vt20001-p1662611.html?src=category-page-914.8374&2hi=0,1662611,Showme,Trang sức,,199.000 ₫,Show Me,," Vòng Tay Nữ Mạ Bạc Đính Pha Lê Showme SM-VT20001 được thiết kế tinh tế thể hiện nét đẹp nữ tính, cùng họa tiết đính pha lê xinh xắn cho bạn gái thêm nét trẻ trung, nổi bật và đầy sang trọng. Vòng tay được gia công vô cùng tinh xảo từ chất liệu hợp kim mạ bạc sáng bóng với đường nét họa tiết tỉ mỉ, độc đáo. Điểm nổi bật của chiếc vòng tay chính là chi tiết đính đá pha lê lấp lánh tạo sự lôi cuốn, thu hút. Với chất liệu cao cấp vòng tay không bị tối màu khi tiếp xúc với không khí, nước và mồ hôi cho bạn nữ thoải mái trong mọi hoạt động. Kiểu dáng đẹp mắt, thời trang chiếc vòng phù hợp để đeo đi học, đi làm hay đi chơi, hoặc có thể dùng làm quà tặng đặc biệt cho bạn bè, người thân. ",""""""
tiki.vn,https://tiki.vn/vong-deo-tay-nam-titan-hinh-ngon-lua-do-p10056649.html?src=category-page-914.8374&2hi=0,10056649,OEM,Trang sức,,49.000 ₫,dochoipc,," Vòng Đeo Tay Nam Titan Hình Ngọn Lửa - Đỏ được làm từ chất liệu nhựa tổng hợp và hợp kim cao cấp giúp cho người sử dùng đeo sáng hơn và thời gian lâu xuống màu hơn. Sản Phẩm được thiết kế mang phong cách lịch lãm và tinh tế. Kiểu dáng hình ngọn lửa, đây là sản phẩm chuyên biệt dành cho nam giới. Thời trang mạnh mẽ, dễ dàng phối hợp với nhiều loại trang phục khác nhau. ",""""""
tiki.vn,https://tiki.vn/vong-tay-da-ma-nao-trang-ms28-vong-tay-phong-thuy-hop-menh-kim-thuy-hoa-cho-nam-va-nu-p9846088.html?src=category-page-914.8374&2hi=0,9846088,OEM,Trang sức,,99.000 ₫,Xtop VN,," 1. Đá mã não trắng là gì ? Đá mã não trắng có tên quốc tế là White Agate, bắt nguồn từ tên của dòng sông Achetes ở Sicily. Nơi mà nó được tìm thấy lần đầu bởi Theophrastus, một nhà địa chất người Hi Lạp. 2. Công dụng của vòng đá mã não trắng MS28 Về đặc tính, mã não trắng là một biến thể của thạch anh, nhưng vẻ bề ngoài có rất nhiều điểm khác biệt. Đá rất dai, có độ bền cao. Khi được chế tác sẽ có bề mặt bóng mịn, hầu như không có vết xước. Mã não trắng có màu trắng đục như thạch dừa non, khác với màu trắng trong suốt của thạch anh. Về ý nghĩa phong thủy, mã não trắng là viên đá biểu tượng cho sự hưng thịnh, tài lộc. Người mang loại đá này thì tiền tài, công danh khởi sắc, phát đạt. Vòng đá mã não MS28 có thể chống lại vận hạn, những năng lượng xấu tác động đến chủ nhân. Mã não trắng còn tăng sự tự tin của bản thân, nâng cao khả năng biểu đạt ngôn ngữ. Mã não trắng hợp với những người mệnh Kim, mệnh Thủy. Còn chờ đợi gì nữa mà không nhanh tay đặt hàng để sở hữu chiếc vòng này cho gia đình và người thân của bạn. ",""""""
tiki.vn,https://tiki.vn/choker-zic-zac-ca-tinh-p3893607.html?src=category-page-914.8374&2hi=0,3893607,OEM,Trang sức,,39.000 ₫,Baymax Shop,, Choker zic zắc cá tính dễ phối hợp với quần áo Chất liệu: đá + inox không gỉ Đóng gói cẩn thận vận chuyển nhanh chóng ,""""""
tiki.vn,https://tiki.vn/day-chuyen-bac-nu-mat-3-khoi-lap-phuong-sang-trong-m33-p7222601.html?src=category-page-914.8374&2hi=1,7222601,OEM,Trang sức,,170.000 ₫,GAIA,," Dây chuyền 3 hạt bạc đơn giản - M33 3 hạt bạc hình lập phương trông rất vuông vức, đầy đặn được xử lý chải mờ tạo hiệu ứng lấp lánh nên dù trông có vẻ đơn giản nhưng lại rất nổi bật. Và tại sao lại là 3 hạt bạc mà không phải là 4, 5 hay 6??? Số 3 có nghĩa là ""tam"" mà theo quan niệm dân gian, các con số như “Tam lục” (36) tượng trưng cho “tài lộc”, “Tam bát” (38) tượng trưng cho “tài phát” Sợi dây chuyền rất thích hợp với những cô nàng đơn giản, không thích cầu kỳ, phô trương. ",""""""
tiki.vn,https://tiki.vn/bong-tai-han-quoc-pink-blossom-tatiana-bh2246h-hong-p1948263.html?src=category-page-914.8374&2hi=1,1948263,Tatiana,Trang sức,,93.000 ₫,Tatiana,," Bông Tai Hàn Quốc Pink Blossom Tatiana BH2246H - Hồng với sự sắc sảo trong từng đường nét thiết kế chắc chắn sẽ thu hút sự chú ý của các cô nàng ngay từ ánh nhìn đầu tiên. Bông tai Tatiana được chế tác tinh xảo từ chất liệu hợp kim xi mạ mang đến độ bền và độ bóng đẹp hoàn hảo giúp cho đôi tai của bạn nữ thêm phần nổi bật và cuốn hút. Thiết kế kiểu dáng thời trang, hiện đại, dễ mix-match tạo set đồ năng động giúp bạn nữ tự tin hơn khi bước xuống phố trong những buổi cà phê, dạo chơi cùng bạn bè. ",""""""
tiki.vn,https://tiki.vn/vong-co-choker-layer-triangle-tatiana-cd2395-p2599985.html?src=category-page-914.8374&2hi=1,2599985,Tatiana,Trang sức,,69.000 ₫,Tatiana,," Vòng Cổ Choker Layer Triangle Tatiana CD2395 mang xu hướng Tattoo Choker bắt nguồn từ những năm 80, 90, là đại diện tiêu biểu cho phong cách Gothic Punk hầm hố hot nhất thời điểm đó. Sự trở lại của những xu hướng Retro giúp kiểu vòng cổ độc đáo này lại gây sốt một lần nữa trong giới trẻ. Vòng cổ ôm sát cổ tôn nét kiêu kỳ, quyến rũ và rạng rỡ của chiếc cổ xinh xắn. Dây đeo thể hiện sự khỏe khoắn, cá tính, các cô nàng tha hồ khoe chiếc cổ cao đầy kiêu hãnh, duyên dáng và gợi cảm. Đây là sự lựa chọn lý tưởng cho những ai thực sự đam mê hình ảnh cổ điển, nhẹ nhàng và thanh lịch. ",""""""
tiki.vn,https://tiki.vn/bong-tai-ma-bac-pearl-mix-butterfly-tatiana-bb2849-bac-p2048767.html?src=category-page-914.8374&2hi=1,2048767,Tatiana,Trang sức,,82.000 ₫,Tatiana,," Bông Tai Mạ Bạc Pearl Mix Butterfly Tatiana BB2849 - Bạc là phụ kiện không thể thiếu cho bạn gái, không chỉ trong những buổi tiệc, những dịp đặc biệt quan trọng mà trong cuộc sống hàng ngày phụ nữ cũng cần những chiếc vòng tay, bông tai, vòng cổ... để tô điểm cho vẻ ngoài của mình thêm phần quý phái và nổi bật. Bông tai được thiết kế có kiểu dáng đơn giản, gia công đẹp mắt, sẽ là lựa chọn hoàn hảo cho các cô nàng mỗi khi tham gia các bữa tiệc, hẹn hò cùng bạn bè tôn nét nữ tính, sang trọng và không kém phần hiện đại. Bông tai không chỉ có tác dụng tô điểm vẻ đẹp, mà còn giúp phái đẹp thể hiện gu riêng của mình. Thiết kế tinh tế, sang trọng, đầy nữ tính cho bạn thoải mái ""mix - match"" với các trang phục khác nhau. Thể hiện cá tính của bản thân với sản phẩm đến từ Tatiana. Với thiết kế đơn giản, kiểu dáng đẹp mắt ấn tượng sẽ tăng phần hiện đại cho bạn gái. ",""""""
tiki.vn,https://tiki.vn/lac-tay-vong-tay-bac-s925-co-bon-la-may-man-p10565942.html?src=category-page-914.8374&2hi=0,10565942,OEM,Trang sức,,87.300 ₫,Chonmua365,," Bí quyết làm nên một set đồ hoàn hảo cho phái đẹp là sự phối hợp tinh tế giữa bộ trang phục và phụ kiện thời trang đi kèm. Cho dù bạn có đang mặc một bộ trang phục đơn giản thì chỉ cần một chiếc lắc tay hoặc đôi hoa tai nhỏ lấp lánh thôi cũng đủ để khiến bạn trông thật thời trang và phong cách. Lắc tay, vòng tay cỏ bốn lá nữ ngọt ngào đơn giản mang phong cách Nhật Bản và Hàn Quốc sẽ là một món đồ trang sức đầy ý nghĩa để làm quà tặng. Lưu ý: Để sản phẩm luôn được sáng bóng, các bạn nên bảo quản sản phẩm ở nơi khô ráo, tránh tiếp xúc sản phẩm với các hóa chất tẩy rửa cao. Dùng giấy hoặc vải mềm hay hộp đựng trang sức chuyên dụng để bảo quản khi bạn không có nhu cầu đeo nữa (nên làm sạch và làm khô trước khi cất giữ). ",""""""
