Domain,Url,Product_id,Brand,Category,Model,Price,Seller,Tags,Info,Others
mediamart.vn,https://mediamart.vn/may-giat/electrolux/may-giat-inverter-14-kg-electrolux-ewt1454dcwa.htm,,Electrolux,Máy giặt,Máy giặt Inverter 14 Kg Electrolux EWT1454DCWA,12.040.000,,," . Giặt sạch hơn, tiết kiệm chất tẩy rửa hơn. Vận hành êm ái, bền bỉ và tiết kiệm năng lượng. Tùy chỉnh thời gian giặt chăm sóc tốt hơn cho quần áo của bạn. Tùy chỉnh mực nước giặt chăm sóc áo quần tốt hơn. . . . . Hình ảnh tham khảo: Máy giặt Inverter 14 Kg Electrolux EWT1454DCWA. . . . . . . . . . . . . . . . . . . . . . . . Thông số kỹ thuật: Máy giặt Inverter 14 Kg Electrolux EWT1454DCWA. . . . ĐẶC ĐIỂM SẢN PHẨM. . . Kiểu máy giặt. . Cửa ngang. . . . Kiểu lồng giặt. . Lồng đứng. . . . Khối lượng giặt. . 14Kg. . . . Tốc độ quay vắt (vòng/ phút). . 850 vòng/phút. . . . Truyền động. . Bằng dây Curoa. . . . Bảng điều khiển. . Tiếng Anh. . . CÔNG NGHỆ. . . Công nghệ giặt. . ShowerSpray. . . . Thiết kế lồng giặt. . Lồng giặt Hive. . . . Tính năng. . Điều chỉnh thời gian giặt, Tiết kiệm nước, Tiết kiệm điện. . . THÔNG TIN CHUNG. . . Số người sử dụng. . trên 6 người (trên 8.5 Kg). . . . Chất liệu lồng giặt. . Thép không gỉ. . . . Xuất xứ. . Thái Lan. . . . Bảo hành. . 24 tháng. . . . . . . . . Thông tin: Máy giặt Inverter 14 Kg Electrolux EWT1454DCWA. . . Giặt sạch hơn, tiết kiệm chất tẩy rửa hơn. . Công nghệ trộn thông minh EliteMix tự động trộn dung dịch nước giặt và nước xả vải trước khi giặt, giúp quần áo bạn sạch hơn, nhẹ nhàng hơn ngay cả với nhiệt độ thấp. Máy có hiệu năng giúp giặt sạch hơn tới 15% và tiết kiệm 27% nước giặt và nước xả vải. Mang lại cho bạn áo quần trắng đẹp và sự hài lòng. . . Vận hành êm ái, bền bỉ và tiết kiệm năng lượng. . Động cơ sử dụng công nghệ Inverter giúp máy vận hành êm ái hơn và đặt hiệu suất cao hơn 22% so với động cơ thông thường mà vẫn duy trì khả năng giặt mạnh mẽ. Động cơ được bảo hành 10 năm.. . . Tùy chỉnh thời gian giặt chăm sóc tốt hơn cho quần áo của bạn. . Chức năng tùy chỉnh thời gian giúp bạn làm chủ thời gian với nhiều tùy chọn như chế độ giặt 20 phút, chế độ giặt 45 phút phù hợp cho các loại đồ cần giặt.Chức năng tùy chỉnh thời gian có 3 lựa chọn chính giúp bạn điều chỉnh tăng giảm thời gian giặt theo ý muốn.. . . Tùy chỉnh mực nước giặt chăm sóc áo quần tốt hơn. . Chức năng tự điều chỉnh mực nước giặt cho phép giặt áo quần với hiệu năng sử dụng nước cao nhất. Dòng máy được tích hợp cảm biến tự động xác định mực nước giặt phù hợp nhất theo lượng đồ giặt của bạn. Bạn cũng có thể tùy chỉnh tăng giảm theo ý muốn một cách dễ dàng.. . . An toàn hơn và sử dụng dễ dàng hơn. . Nắp máy giặt được thiết kế thời trang với nguyên liệu bền bỉ giúp đóng mở dễ dàng không gây tiếng ồn và an toàn với người sử dụng. Mặt nắp được thiết kế phẳng với chất liệu chống xước cao cấp vừa tiết kiệm diện tích vừa đảm bảo thời trang và lau chùi dễ dàng.. . . . . . . Tư Vấn Mua Máy giặt. . . . . . ",""""""
mediamart.vn,https://mediamart.vn/may-giat/electrolux/may-giat-inverter-8-kg-electrolux-ewf8025eqwa.htm,,Electrolux,Máy giặt,Máy giặt Inverter 8 Kg Electrolux EWF8025EQWA,9.490.000,,," . Giảm thiểu nếp nhăn, vải vóc luôn mềm mại. Giặt đồ len một cách dễ dàng. Vận hành êm ái, bền bỉ và tiết kiệm năng lượng. Thao tác bỏ và lấy áo quần một cách dễ dàng. . . . . Hình ảnh tham khảo: Máy giặt Inverter 8 Kg Electrolux EWF8025EQWA. . . . . . . . . . . . . . . Thông số kỹ thuật: Máy giặt Inverter 8 Kg Electrolux EWF8025EQWA. . . . ĐẶC ĐIỂM SẢN PHẨM. . . Kiểu máy giặt. . Cửa ngang. . . . Kiểu lồng giặt. . Lồng ngang. . . . Khối lượng giặt. . 8Kg. . . . Tốc độ quay vắt (vòng/ phút). . 1200 vòng/phút. . . . Truyền động. . Bằng dây Curoa. . . . Bảng điều khiển. . Tiếng Anh. . . CÔNG NGHỆ. . . Công nghệ giặt. . ShowerSpray. . . . Thiết kế lồng giặt. . Lồng giặt Hive. . . . Tính năng. . Điều chỉnh thời gian giặt, Tiết kiệm nước, Tiết kiệm điện. . . THÔNG TIN CHUNG. . . Số người sử dụng. . 4 - 5 người (7.5 - 8.5 Kg). . . . Chất liệu lồng giặt. . Thép không gỉ. . . . Xuất xứ. . Thái Lan. . . . Bảo hành. . 24 tháng. . . . . . . . . Thông tin: Máy giặt Inverter 8 Kg Electrolux EWF8025EQWA. . . Giảm thiểu nếp nhăn, vải vóc luôn mềm mại. . Công nghệ giặt bằng hơi nước ở giai đoạn giặt cuối cùng giúp giảm thiểu các vết nhăn trên quần áo lên đến 22% và giúp quần áo phẳng phiu. Ở nhiệt độ 40C, máy giặt giúp loại bỏ 99.9% tác nhân gây dị ứng và vi khuẩn từ bụi bẩn hay vật nuôi. Bạn không những thấy rõ mà còn cảm nhận được sự tuyệt vời này.. . . Giặt đồ len một cách dễ dàng. . Đồ len cao cấp của bạn sẽ được giặt một cách an toàn với chức năng giặt đồ len đã được cấp chứng nhận Woolmark. Chức năng chuyên dụng này giúp đạt được hiệu quả làm sạch đồ len tối ưu mà vẫn không gây bết khi giặt, nhờ vậy áo quần của bạn luôn mới.. . . Vận hành êm ái, bền bỉ và tiết kiệm năng lượng. . Động cơ sử dụng công nghệ Inverter giúp máy vận hành êm ái hơn và đặt hiệu suất cao hơn 22% so với động cơ thông thường mà vẫn duy trì khả năng giặt mạnh mẽ. Động cơ được bảo hành 10 năm.. . . Thao tác bỏ và lấy áo quần một cách dễ dàng. . Với cửa size 3XL đã được cải thiện, bạn có thể mở cửa rộng hơn 12%* để giúp cho việc bỏ và lấy quần áo dễ dàng hơn bao giờ hết. *so sánh với loại máy giặt có cửa size 2XL.. . . Mở cửa để giặt thông minh hơn. . Chức năng thêm đồ giặt cho phép bạn bỏ thêm quần áo trong vòng 15 phút đầu tiên của chu trình giặt. Bạn sẽ không còn quần áo dư thừa sau khi giặt.. . . Thời gian giặt đa dạng giúp chăm sóc tốt hơn. . Chu trình giặt nhanh 15 phút là một trong những chu trình giặt nhanh nhất trên thị trường hiện nay, thích hợp cho những loại áo quần mặc hàng ngày. Chu trình giặt hàng ngày 60 phút phù hợp với khối lượng áo quần lớn hơn. Bạn có thể tùy chọn nhiệt độ giặt để phù hợp với nhu cầu, điều kiện của bạn.. . . . . . . Tư Vấn Mua Máy giặt. . . . . . ",""""""
mediamart.vn,https://mediamart.vn/may-giat/aqua/may-giat-aqua-10kg-aqdd1000c-long-ngang.htm,,AQua,Máy giặt,Máy giặt AQUA 10KG AQD-D1000C lồng ngang,14.490.000,,," . Động cơ truyền động trực tiếp DD Inverter. Đường kính lồng giặt 525mm. Bảng điều khiển có nút cảm ứng. Thiết kế lồng giặt Pillow giảm sờn vải. . . . . Hình ảnh tham khảo: Máy giặt AQUA 10KG AQD-D1000C lồng ngang. . . . . . . . . . . . . . . Thông số kỹ thuật: Máy giặt AQUA 10KG AQD-D1000C lồng ngang. . . . ĐẶC ĐIỂM SẢN PHẨM. . . Kiểu máy giặt. . Cửa ngang. . . . Kiểu lồng giặt. . Lồng ngang. . . . Khối lượng giặt. . 10Kg. . . . Tốc độ quay vắt (vòng/ phút). . 1400 vòng/phút. . . . Truyền động. . Bằng dây Curoa. . . . Bảng điều khiển. . Tiếng Việt. . . CÔNG NGHỆ. . . Chế độ giặt. . 16 chương trình giặt. . . . Tính năng. . Giặt bằng nước nóng, Hẹn giờ, Khóa trẻ em, Vắt cực khô. . . THÔNG TIN CHUNG. . . Số người sử dụng. . trên 6 người (trên 8.5 Kg). . . . Chất liệu lồng giặt. . Thép không gỉ. . . . Trọng lượng (kg). . 37 kg. . . . Xuất xứ. . Việt Nam. . . . Bảo hành. . 24 tháng. . . . . . . . . Thông tin: Máy giặt AQUA 10KG AQD-D1000C lồng ngang. . . Động cơ truyền động trực tiếp (DD Inverter) giúp máy giặt hoạt động êm ái, tiết kiệm điện năng.. . . Chất liệu đặc biệt cho vòng đệm cửa có tác dụng kháng khuẩn và chống nấm mốc, giúp khu vực này sạch và vệ sinh hơn.. . . Các nút chọn chương trình hay tùy chỉnh sẽ bị khóa khi máy giặt hoạt động, nhằm tránh lỗi chương trình do sự tò mò chạm bảng điều khiển ngoài ý muốn từ con trẻ, góp phần an toàn cho trẻ em.. . . . . . . Tư Vấn Mua Máy giặt. . . . . . ",""""""
mediamart.vn,https://mediamart.vn/may-giat/lg/may-giat-long-doi-lg-twin-wash-giat-9kg-2kg-fc1409s2w-tg2402ntww.htm,,LG,Máy giặt,Máy giặt lồng đôi LG Twin Wash Giặt 9Kg+2Kg (FC1409S2W& TG2402NTWW),25.190.000,,," . Công nghệ Twin wash giúp giặt theo khối lượng tiện dụng.. Công nghệ sấy Eco Hybrid tiết kiệm điện năng, nước & thời gian.. Công nghệ 6 chuyển động giặt - 6Motion DD.. Công nghệ hơi nước True Steam, Giặt 3 Tiết kiệm Turbowash.. . . . . Hình ảnh tham khảo: Máy giặt lồng đôi LG Twin Wash Giặt 9Kg+2Kg (FC1409S2W& TG2402NTWW). . . . . . . . . . . . . . . . . . . . . . . . . . . . . . . . . . . . . . . . . . . . . . . . . . . . . . . . . . . . . . . Thông số kỹ thuật: Máy giặt lồng đôi LG Twin Wash Giặt 9Kg+2Kg (FC1409S2W& TG2402NTWW). . . . ĐẶC ĐIỂM SẢN PHẨM. . . Kiểu máy giặt. . Cửa ngang. . . . Kiểu lồng giặt. . Lồng ngang. . . . Khối lượng giặt. . 11 kg. . . . Tốc độ quay vắt (vòng/ phút). . 1400 vòng/phút. . . . Truyền động. . Dẫn động trực tiếp. . . . Bảng điều khiển. . Đang cập nhật. . . CÔNG NGHỆ. . . Chế độ giặt. . 12 chương trình giặt. . . . Công nghệ giặt. . 6 Motions, TurboWash, Công nghệ hơi nước True Steam, Công nghệ sấy Eco Hybrid, Công nghệ Twin wash. . . . Tính năng. . Giặt bằng nước nóng, Tính năng sấy, Tiết kiệm điện, Khóa trẻ em, Chức năng chẩn đoán thông minh, Giặt hơi nước diệt khuẩn, Vệ sinh lồng giặt, Điều khiển cảm ứng, Công nghệ thông minh Smart ThinQ, Giặt Riêng biệt và Đồng thời. . . THÔNG TIN CHUNG. . . Số người sử dụng. . trên 6 người (trên 8.5 Kg). . . . Chất liệu lồng giặt. . Thép không gỉ. . . . Xuất xứ. . Hàn Quốc. . . . . . . . . Thông tin: Máy giặt lồng đôi LG Twin Wash Giặt 9Kg+2Kg (FC1409S2W& TG2402NTWW). . . . LG TWINWash™. . HƠN CẢ MỘT CHIẾC MÁY GIẶT,ĐÓ LÀ NGHỆ THUẬT. . . Giặt Riêng Biệt. . TWINWash là chiếc máy giặt có thể thỏa mãn mọi nhu cầu giặt. Giặt các mẻ giặt lớn, thông thường ở máy giặt cửa trước phía trên, hoặc sử dụng máy giặt cửa trên riêng bên dưới cho quần áo tinh xảo hoặc một số áo quần nhỏ mà không cần chờ đủ một mẻ áo quần.. . . Tiết Kiệm Thời Gian. . Giảm thời gian giặt chỉ còn một nửa!. Giờ đây bạn có thể hoàn thành tới hai mẻ áo quần trong 49 phút với LG TWINWash™. . . Thiết Kế Công Thái Học Thông Minh. . TWINWash™ giúp việc giặt giũ dễ dàng hơn theo nhiều cách, bắt đầu từ việc giảm thiểu việc phải cúi lưng hay khom đầu gối. Máy giặt cửa trước được thiết kế đặt bên trên giúp việc đưa quần áo vào tốn ít công sức hơn.. . . Giặt Hơi Nước TrueSteam™. . Ngừa 99,9% Tác Nhân Dị Ứng. . Công nghệ Giặt Hơi nước TrueSteam™ mang tới các chu trình Allergy Care (Ngừa Dị ứng), Steam Refresh (Làm mới bằng hơi nước) và Steam Softener™. Hãy cải thiện chất lượng cuộc sống bằng việc duy trì một môi trường lành mạnh, không có tác nhân gây dị ứng.. . . 6 Chuyển động DD. . Chăm Sóc Tối Ưu cho Mọi Loại Vải. . Chọn một chương trình giặt và công nghệ 6 chuyển động giặt 6motionDD sẽ tự điều khiển tốc độ và chiều quay của lồng giặt theo nhiều hướng để phù hợp với từng loại vải, từ đó chăm sóc vải tối ưu và giặt áo quần siêu sạch.. . . Dẫn Động Trực Tiếp Inverter. . Giảm Rung Ồn, Tăng Bền Bỉ. . Không chỉ có một, mà hai Động cơ Dẫn động trực tiếp Inverter sẽ nâng cao hiệu năng giặt mà không gây tiếng ồn. Công nghệ Dẫn động trực tiếp Inverter sử dụng ít bộ phận chuyển động hơn, từ đó giảm độ rung và tăng độ bền. Ngoài ra, động cơ tiêu tốn ít năng lượng hơn, giảm mức tiêu thụ điện.. . . Máy Giặt & Sấy Tích Hợp Trong Một. . Máy giặt tích hợp sấy của LG là một trong công nghệ hàng đầu của máy giặt. Tiết kiệm không gian và dành được nhiều chỗ hơn cho gia đình bạn. Máy giặt sấy kết hợp của LG cho phép bạn giặt và sấy quần áo sạch sẽ mà không cần máy sấy riêng.. . . Tiết Kiệm Nước, Tiết Kiệm Thời Gian với EcoHybrid. . Công nghệ EcoHybrid có thể tiết kiệm nước hoặc rút ngắn thời gian của chu trình sấy. Bạn có thể chọn chế độ Sấy Eco để giảm lượng nước sử dụng bằng 0 hoặc Sấy Thông thường để giảm thời gian sấy của cả chu trình và tiết kiệm điện năng sử dụng.. . . Thêm Đồ Giặt. . Nếu quên một món đồ cần giặt, bạn vẫn có thể thêm vào sau khi bắt đầu chu trình giặt. LG TWINWash™ có trang bị nút ""Add Item"" (Thêm đồ giặt), cho phép bạn mở cửa trong khi giặt để thêm bất cứ đồ giặt bỏ quên nào.. . . Kết Nối Thông Minh với WiFi. . Công nghệ SmartThinQ™ cho phép bạn vận hành hoặc theo dõi máy giặt từ bất cứ đâu, bất cứ khi nào. Bạn có thể theo dõi mức tiêu hao năng lượng hoặc sử dụng Tải xuống chu trình để thêm nhiều chu trình giặt mới được phát triển cho dòng máy của bạn.. . . . . . . Tư Vấn Mua Máy giặt. . . . . . ",""""""
mediamart.vn,https://mediamart.vn/may-giat/lg/may-giat-long-doi-lg-twin-wash-giat-85kg-2kgsay-5kg-fc1408d4w-tg2402ntww.htm,,LG,Máy giặt,Máy giặt lồng đôi LG Twin Wash Giặt 8.5Kg+2Kg/sấy 5Kg (FC1408D4W& TG2402NTWW),29.190.000,,," . Công nghệ Twin wash giúp giặt theo khối lượng tiện dụng.. Công nghệ sấy Eco Hybrid tiết kiệm điện năng, nước & thời gian.. Công nghệ 6 chuyển động giặt - 6Motion DD.. Công nghệ hơi nước Spa steam, Giặt 3 Tiết kiệm Turbowash.. . . . . Hình ảnh tham khảo: Máy giặt lồng đôi LG Twin Wash Giặt 8.5Kg+2Kg/sấy 5Kg (FC1408D4W& TG2402NTWW). . . . . . . . . . . . . . . . . . . . . . . . . . . . . . . . . . . . . . . . . . . . . . . . . . . . . . . . . . . . Thông số kỹ thuật: Máy giặt lồng đôi LG Twin Wash Giặt 8.5Kg+2Kg/sấy 5Kg (FC1408D4W& TG2402NTWW). . . . ĐẶC ĐIỂM SẢN PHẨM. . . Kiểu máy giặt. . Cửa ngang. . . . Kiểu lồng giặt. . Lồng ngang. . . . Khối lượng giặt. . 11 kg. . . . Tốc độ quay vắt (vòng/ phút). . 1400 vòng/phút. . . . Truyền động. . Dẫn động trực tiếp. . . . Bảng điều khiển. . Đang cập nhật. . . CÔNG NGHỆ. . . Chế độ giặt. . 12 chương trình giặt. . . . Công nghệ giặt. . 6 Motions, TurboWash, Công nghệ hơi nước Spa steam, Công nghệ sấy Eco Hybrid, Công nghệ Twin wash. . . . Tính năng. . Giặt bằng nước nóng, Tính năng sấy, Tiết kiệm điện, Khóa trẻ em, Chức năng chẩn đoán thông minh, Giặt hơi nước diệt khuẩn, Vệ sinh lồng giặt, Điều khiển cảm ứng, Công nghệ thông minh Smart ThinQ, Giặt Riêng biệt và Đồng thời. . . THÔNG TIN CHUNG. . . Số người sử dụng. . trên 6 người (trên 8.5 Kg). . . . Chất liệu lồng giặt. . Thép không gỉ. . . . Xuất xứ. . Hàn Quốc. . . . . . . . . Thông tin: Máy giặt lồng đôi LG Twin Wash Giặt 8.5Kg+2Kg/sấy 5Kg (FC1408D4W& TG2402NTWW). . . . Chống lại tác nhân gây dị ứng bằng hơi nước. . Chu trình Allergy Care sử dụng nước và nhiệt độ để tạo ra hơi nước khử trùng siêu hạng, làm sạch tác nhân dị ứng trên quần áo một cách nhẹ nhàng nhất. Tính năng này giảm tới 99,9% chất gây dị ứng, như phấn hoa, bọ ve có thể gây ra dị ứng hoặc các vấn đề với đường hô hấp.. . . Thêm đồ trong khi giặt. . Nếu bạn quên cho đồ giặt vào nhưng máy đã chạy, chỉ cần nhấn ""Add Item"" (Thêm đồ giặt) và thêm mọi loại đồ giặt từ tất nhỏ cho đến áo khoác lớn. Vải bông, hỗn hợp, giặt nhẹ nhàng, giặt nhanh 14 phút, cho dù bạn chọn chế độ nào, bạn cũng có thể mở cửa* ngay lập tức (dưới 3 giây)** trong khi giặt.. . . Bảo vệ tối ưu cho vải với 6 Chuyển động DD. . Chọn chương trình giặt và công nghệ 6 chuyển động giặt kết hợp với động cơ dẫn động trực tiếp điều khiển lồng giặt theo nhiều hướng, giúp chăm sóc vải đúng cách trong khi vẫn đảm bảo hiệu năng giặt cực sạch.. . . Giảm rung, giảm ồn. . Động cơ dẫn động trực tiếp là trái tim mang đến sức mạnh cho máy giặt, có độ tin cậy rất cao và cực kì êm ái. Chúng tôi biết đây là một trong những động cơ máy giặt tốt nhất trên thị trường, đó là lý do vì sao tất cả máy giặt của chúng tôi đều có thời gian bảo hành 10 năm cho động cơ. Quả là một mức bảo hành tuyệt vời phải không?. . . Tiện ích thông minh với NFC. . Từ việc tải xuống các chu trình giặt bổ sung cho đến chẩn đoán và giải quyết vấn đề trục trặc, máy giặt của bạn đang ngày càng thông minh hơn. Dễ dàng tương tác với máy giặt và tiếp cận những công nghệ mới nhất với tính năng NFC Tag On.. . . Máy Giặt & Sấy Tích Hợp Trong Một. . Máy giặt tích hợp sấy của LG là một trong công nghệ hàng đầu của máy giặt. Tiết kiệm không gian và dành được nhiều chỗ hơn cho gia đình bạn. Máy giặt sấy kết hợp của LG cho phép bạn giặt và sấy quần áo sạch sẽ mà không cần máy sấy riêng.. . . . . . . Tư Vấn Mua Máy giặt. . . . . . ",""""""
mediamart.vn,https://mediamart.vn/may-giat/aqua/may-giat-aqua-9-kg-aqws90at-long-dung.htm,,AQua,Máy giặt,Máy giặt AQua 9 Kg AQW-S90AT lồng đứng,5.490.000,,," . Máy giặt lồng đứng, 9 Kg, Công nghệ giặt MultiJet. Tốc độ quay vắt cao 840 vòng/phút - vắt cực khô trong thời gian ngắn.. Bộ lọc xơ vải tiện lợi.. Đa dạng sự lựa chọn với 8 chương trình hoạt động.. . . . . Hình ảnh tham khảo: Máy giặt AQua 9 Kg AQW-S90AT lồng đứng. . . . . . . . . . . . . . . . . . . . . . . . . . . . . . . . . . . . . . . . . . . . . Thông số kỹ thuật: Máy giặt AQua 9 Kg AQW-S90AT lồng đứng. . . . ĐẶC ĐIỂM SẢN PHẨM. . . Kiểu máy giặt. . Cửa trên. . . . Kiểu lồng giặt. . Lồng đứng. . . . Khối lượng giặt. . 9Kg. . . . Tốc độ quay vắt (vòng/ phút). . 840 vòng/phút. . . . Truyền động. . Bằng dây Curoa. . . . Lượng nước tiêu thụ (lít). . 125 lít. . . . Công suất (W). . 445. . . . Bảng điều khiển. . Tiếng Việt. . . CÔNG NGHỆ. . . Chế độ giặt. . 8 chương trình giặt. . . . Công nghệ giặt. . Multi Jet Wash Action. . . . Tính năng. . Tự khởi động lại khi có điện, Khóa trẻ em, Vắt cực khô. . . THÔNG TIN CHUNG. . . Số người sử dụng. . trên 6 người (trên 8.5 Kg). . . . Chất liệu lồng giặt. . Thép không gỉ. . . . Trọng lượng (kg). . 37 kg. . . . Xuất xứ. . Việt Nam. . . . Bảo hành. . 24 tháng. . . . . . . . . Thông tin: Máy giặt AQua 9 Kg AQW-S90AT lồng đứng. . . Thiết kế đơn giản, tiện dụng. Máy giặt Aqua AQW-S90AT sở hữu thiết kế đơn giản, nhỏ gọn, vô cùng tiện dụng, kết hợp cùng gam màu trắng xám thanh lịch hứa hẹn sẽ rất phù hợp với không gian nội thất sang trọng của gia đình bạn. Với khối lượng giặt 9 kg, máy giặt này là thích hợp với những gia đình có trên 6 thành viên hoặc có nhu cầu giặt giũ lớn.. . . Công nghệ giặt MultiJet. Công nghệ giặt MultiJet trên máy giặt Aqua AQW-S90AT tạo ra nhiều luồng nước phun liên tục bên trong lồng giặt, hòa tan nhanh chóng bột giặt và giúp bột giặt thấm sâu vào từng sợi vải. Các luồng nước từ nhiều hướng giúp bề mặt quần áo tiếp xúc hoàn toàn với nước giặt, làm sạch các vết bẩn cứng đầu, mang lại hiệu quả giặt giũ tối ưu.. . . Bảng điều khiển đặt bên tay phải tiện lợi. Việc thiết kế này sẽ giúp người dùng lấy và cho quần áo ra vào dễ dàng. Ngoài ra, nó còn giúp bảo vệ bảng điều khiển không bị vào nước khi lấy quần áo ướt mới giặt xong ra khỏi máy.. . . Khóa trẻ em. Tiện ích khóa trẻ em giúp bạn yên tâm làm việc mà không phải trông chừng con nhỏ khi máy giặt hoạt động. Tính năng này sẽ khóa bàn phím điều khiển máy giặt, phát ra thông báo khi nắp máy bị mở trong quá trình vận hành đồng thời xả toàn bộ nước ra ngoài phòng ngừa trường hợp trẻ em bị rơi vào trong lồng giặt.. . . Tự khởi động lại khi có điện. Máy giặt Aqua AQW-S90AT được trang bị công nghệ Auto restart tiên tiến, cho phép máy giặt tự khởi động lại và tiếp tục quá trình giặt giũ trước đó trong trường hợp bị cúp điện đột ngột. Công nghệ này giúp bạn tiết kiệm thời gian, thao tác và chi phí sinh hoạt đáng kể do không phải khởi động thủ công máy giặt từ đầu.. . . 8 chương trình hoạt động giặt giũ đa dạng, tiện lợi. Phục vụ tốt cho nhiều loại quần áo với 8 chương trình hoạt động tiện lợi. Có giặt chăn mền là một tính năng nhiều người dùng rất yêu thích.. . . Với mức giá cực kì hấp dẫn cho 1 chiếc máy giặt 9kg thì Điện Máy XANH tin chắc rằng bạn sẽ không phải hối hận khi sở hữu sản phẩm chất lượng này. Máy giặt Aqua 9 kg AQW-S90AT cho hiệu quả giặt sạch rất cao nhờ có công nghệ MultiJet, máy có nhiều chương trình giặt để phù hợp cho nhiều loại vải.. . . . . . Tư Vấn Mua Máy giặt. . . . . . ",""""""
