Domain,Url,Product_id,Brand,Category,Model,Price,Seller,Tags,Info,Others
mediamart.vn,https://mediamart.vn/may-giat/panasonic/may-giat-80kg-panasonic-naf80vs9grv.htm,,Panasonic,Máy giặt,Máy giặt 8 Kg Panasonic NA-F80VS9GRV,5.190.000,,," . Giặt sạch hơn 15% - 20% (so với chương trình giặt thường).. . Giặt sạch đều hơn – tăng cường sức mạnh luồng nước.. . Vận hành ổn định với áp lực nước thấp. . . . . Hình ảnh tham khảo: Máy giặt 8 Kg Panasonic NA-F80VS9GRV. . . . . . . . . . . . . . . . . . . . . . . . . . . . . . . . . . . . . . . . . . . . . . . . . . . Thông số kỹ thuật: Máy giặt 8 Kg Panasonic NA-F80VS9GRV. . . . ĐẶC ĐIỂM SẢN PHẨM. . . Kiểu máy giặt. . Cửa trên. . . . Kiểu lồng giặt. . Lồng đứng. . . . Khối lượng giặt. . 8Kg. . . . Tốc độ quay vắt (vòng/ phút). . 700 vòng/phút. . . . Truyền động. . Bằng dây Curoa. . . . Lượng nước tiêu thụ (lít). . Đang cập nhật. . . . Công suất (W). . Đang cập nhật. . . . Bảng điều khiển. . Đang cập nhật. . . CÔNG NGHỆ. . . Chế độ giặt. . 10 chương trình giặt. . . . Công nghệ giặt. . Eco Aquabeat. . . . Thiết kế lồng giặt. . Lồng giặt SAZANAMI. . . . Tính năng. . Tiết kiệm nước, Tiết kiệm điện, Tự khởi động lại khi có điện, Hẹn giờ, Vệ sinh lồng giặt. . . THÔNG TIN CHUNG. . . Số người sử dụng. . 4 - 5 người (7.5 - 8.5 Kg). . . . Chất liệu lồng giặt. . Thép không gỉ. . . . Trọng lượng (kg). . Đang cập nhật. . . . Xuất xứ. . Việt Nam. . . . Bảo hành. . 24 tháng. . . . . . . . . Thông tin: Máy giặt 8 Kg Panasonic NA-F80VS9GRV. . . . Máy giặt lồng đứng Panasonic NA-F80VS9GRV. . Với chức năng độc đáo giặt siêu sạch, máy giặt lồng đứng Panasonic NA-F80VS9GRV đang là sự lựa chọn hoàn hảo của nhiều người dùng. Không chỉ sở hữu khối lượng giặt 8 kg máy giặt còn có nhiều điểm cộng khác chắc chắn làm hài lòng người dùng.. . . Thiết kế tinh tế và sang trọng. . Với những đường nét đầy vẻ hiện đại và tinh tế, máy giặt Panasonic NA-F80VS9GRV sẽ đem lại sự tươi mới cho căn nhà của bạn. Khối lượng giặt được 8 kg của chiếc máy giặt Panasonic này giúp nó phù hợp với các gia đình có từ 4 đến 5 thành viên.. . . Công nghệ giặt Eco Aquabeat. . Máy giặt Panasonic NA-F80VS9GRV sở hữu công nghệ giặt Eco Aquabeat, dùng sức mạnh của các cánh quạt mâm giặt tạo ra dòng nước xoáy liên tục, hòa tan bột giặt và làm sạch sợi vải tối đa. Kĩ thuật giặt Aquabeat trên máy giặt lồng đứng Panasonic NA-F80VS9GRV tạo ra luồng nước 3 chiều luân chuyển tác động mạnh mẽ lên từng sợi vải giúp đánh tan mọi vết bẩn cứng đầu bám trên quần áo.. . Chương trình giặt Super Clean. . Bên cạnh đó, máy giặt Panasonic NA-F80VS9GRV còn mang chương trình giặt Super Clean với khả năng giặt đều hơn, sạch hơn 15% đến 20% nhờ dòng nước mạnh mẽ và thời gian ngâm áo quần lâu hơn. Máy giặt lồng đứng Panasonic NA-F80VS9GRV sẽ đánh tan các vết bẩn cứng đầu, giúp bạn giặt sạch quần áo dễ dàng hơn.. . . Giặt sạch hiệu quả, bảo vệ quần áo. . Trang bị lồng giặt SAZANAMI cùng công nghệ luồng nước dancing giúp nhào trộn quần áo mạnh mẽ nhưng vẫn có khả năng tránh gây hư tổn sợi vải trên quần áo của bạn. Lồng giặt Sazanami được Panasonic thiết kế đặc biệt trên máy giặt lồng đứng NA-F80VS9GRV giúp giảm thiểu hư hại quần áo so với lồng giặt thông thường, đồng thời giúp quá trình quay vắt hoạt động mạnh và tốt hơn.. . . Chế độ giặt xả Aqua Spin Rinse tiết kiệm nước. . . Ion Bạc Kháng Khuẩn ngăn chặn sự phát triển của vi khuẩn. . Máy giặt lồng đứng Panasonic NA-F80VS9GRV được trang bị Ion Bạc bao phủ giúp ngăn chặn sự phát triển của vi khuẩn trên quần áo tới 99.9%, đồng thời giúp ngăn chặn mùi khó chịu.. . . . Tính năng Foam Wash giúp xóa tan các vết bẩn. . Máy giặt lồng đứng Panasonic NA-F80VS9GRV biến xà phòng trở thành một lớp bọt dày đặc có khả năng xóa tan vết bẩn và bụi bẩn bên trong sợi vải.. . Cơ chế xả mới tiết kiệm nước hiệu quả. . Quá trình xả chính là quá trình sử dụng nước nhiều nhất trong cả chu kì giặt, với cơ chế xả mới giúp giảm lượng nước sử dụng trong suốt quá trình xả một cách hiệu quả.. . . Kỹ thuật luân chuyển luồng nước giúp giặt hiệu quả hơn. . Kỹ thuật này trên máy giặt lồng đứng Panasonic NA-F80VS9GRV tạo ra hai luồng nước đối nghịch giúp nhào lộn quần áo trong lồng giặt, giúp đồ được giặt sạch hơn.. . Nhiều chương trình giặt khác nhau. . Những chương trình giặt đa dạng của máy giặt Panasonic NA-F80VS9GRV phù hợp với từng loại vải, mục đích giặt riêng. Do vậy, bạn sẽ dễ dàng lựa chọn tiện ích cho các lần giặt khác nhau qua các phím bấm trên thân máy giặt.. . . . . . . Tư Vấn Mua Máy giặt. . . . . . ",""""""
mediamart.vn,https://mediamart.vn/may-giat/electrolux/may-giat-9kg-electrolux-ewf12938-inverter.htm,,Electrolux,Máy giặt,Máy giặt 9Kg Electrolux EWF12938 Inverter,11.990.000,,," . - Máy giặt lồng ngang có thiết kế của trước tiện dụng.. - Động cơ Inverter tiết kiệm năng lượng.. - Bảng điều khiển thông minh với màn hình hiển thị.. . . . . Hình ảnh tham khảo: Máy giặt 9Kg Electrolux EWF12938 Inverter. . . . . . . . . . . . . . . . . . . . . Thông số kỹ thuật: Máy giặt 9Kg Electrolux EWF12938 Inverter. . . . ĐẶC ĐIỂM SẢN PHẨM. . . Kiểu máy giặt. . Cửa ngang. . . . Kiểu lồng giặt. . Lồng ngang. . . . Khối lượng giặt. . 9Kg. . . . Tốc độ quay vắt (vòng/ phút). . 1200 vòng/phút. . . . Truyền động. . Bằng dây Curoa. . . . Bảng điều khiển. . Tiếng Anh. . . CÔNG NGHỆ. . . Chế độ giặt. . 9 chương trình giặt. . . . Công nghệ giặt. . Ultra Mix. . . . Thiết kế lồng giặt. . Lồng giặt Lily. . . . Tính năng. . Giặt bằng nước nóng, Khóa trẻ em, Giặt hơi nước diệt khuẩn. . . THÔNG TIN CHUNG. . . Số người sử dụng. . trên 6 người (trên 8.5 Kg). . . . Chất liệu lồng giặt. . Thép không gỉ. . . . Xuất xứ. . Thái Lan. . . . Bảo hành. . 24 tháng. . . . . . . . . Thông tin: Máy giặt 9Kg Electrolux EWF12938 Inverter. . . Thiết kế lồng ngang hiện đại. . Máy giặt Electrolux EWF12938. sở hữu thiết kế lồng ngang hiện đại, kết hợp màu sắc tinh tế phù hợp trong mọi không gian lắp đặt của gia đình bạn. Sản phẩm không những đáp ứng nhu cầu giặt giũ áo quần hàng ngày cho gia đình bạn, còn góp phần làm điểm nhấn cho căn nhà thêm vẻ tiện nghi, sang trọng.. . . . Động cơ Eco Inverter hoạt động siêu êm, tiết kiệm điện. . Máy giặt Electrolux EWF12938. trang bị động cơ Eco Inverter giúp máy vận hành êm ái, không gây rung lắc mạnh, ồn ào ảnh hưởng đến hoạt động xung quanh của bạn và gia đình. Đồng thời động cơ này còn cho hiệu quả tiết kiệm điện năng rất tốt với nhãn năng lượng được đánh giá lên đến 5 sao.. . . . Bảng điều khiển IQ Touch. . Máy giặt Electrolux EWF12938. sử dụng bảng điều khiển IQ Touch kết hợp màn hình LCD rộng, giúp hiển thị mọi nội dung và chương trình cho bạn lựa chọn. Các thao tác vận hành đơn giản chỉ gồm: Xoay núm để chọn chương trình và chạm nhẹ để thiết bị hoạt động.. . . . 9 chương trình giặt thông minh. . Máy giặt Electrolux EWF12938. tích hợp sẵn 9 chương trình giặt thông minh cho người dùng thoải mái lựa chọn, dựa trên từng loại vải, màu sắc khác nhau. Nhờ đó mà áo quần của bạn sẽ được bền màu cũng như có tuổi thọ sử dụng lâu hơn so với việc sử dụng máy giặt thông thường, không có các chương trình giặt chuyên dụng.. . Chức năng giặt hơi nước Vapour Action. . Chức năng giặt hơi nước Vapour Action trên. máy giặt. . Electrolux EWF12938. sẽ giúp quần áo của bạn và gia đình luôn được giặt sạch. Nhờ vào việc thẩm thấu hơi nước, giúp sợi vải nở to hơn, từ đó các chất phụ gia giặt tẩy dễ dàng len lỏi vào bên trong từng sợi vải để đánh bật ngay cả những vết bẩn dù là cứng đầu nhất. Hơn nữa, ngoài khả năng giặt sạch mọi vết bẩn dù khó tẩy nhất, công nghệ giặt hơi nước còn giữ cho áo quần thật mềm mại đồng thời giúp giảm thiểu đến 99.9% các tác nhân gây dị ứng có trên bề mặt vải, bảo vệ cho làn da và sức khỏe của cả gia đình.. . Thêm quần áo ngay cả khi máy đang hoạt động. . Với tính năng Add Cloths, người dùng hoàn toàn có thể dễ dàng thêm vào quần áo bẩn, hay đồ giặt bị bỏ quên vào giặt cùng với những chiếc áo quần đang giặt mà không cần phải chờ đợi đến lần giặt mới. Do đó bạn không những tiết kiệm được lượng nước và điện tiêu thụ đáng kể, mà còn tiết kiệm được thời gian của chính bản thân mình.. . . Tốc độ quay vắt mạnh mẽ 1200 vòng/phút. . Máy giặt Electrolux EWF12938. có tốc độ quay vắt mạnh mẽ lên đến 1200 vòng/phút giúp bạn rút ngắn thời gian phơi đồ sau khi giặt xong. Máy giặt cho phép người dùng tùy chọn các tốc độ vắt phù hợp với nhu cầu sử dụng như: 1200/1000/800/600/400.. . . . Khối lượng giặt áo quần 9kg. . Máy giặt Electrolux EWF12938. trang bị lồng giặt bằng thép không gỉ với dung tích lớn, cho sức chứa áo quần giặt giũ lên đến 9kg. Máy giặt phù hợp sử dụng cho gia đình đông người, có khoảng 6 thành viên. Giờ đây, bạn sẽ không phải lo lắng chuyện giặt giũ áo quần cho cả đại gia đình, chỉ cần bỏ quần áo bẩn vào máy và lựa chọn chương trình thích hợp, giải trí/thư giãn hay làm các công việc yêu thích của mình rồi chờ đồ giặt xong đem phơi là đã hoàn thành nhiệm vụ.. . . . . . . Tư Vấn Mua Máy giặt. . . . . . ",""""""
mediamart.vn,https://mediamart.vn/may-giat/panasonic/may-giat-10-kg-panasonic-naf100v5lrv-long-dung.htm,,Panasonic,Máy giặt,Máy giặt 10 Kg Panasonic NA-F100V5LRV lồng đứng,8.990.000,,," . - Công nghệ giặt tạo bọt Active Foam đánh bay các vết bẩn. - Cảm biến Econavi tiết kiệm điện và nước. - Mâm giặt tạo sóng 2 chiều giặt sạch hiệu quả. - 15 chương trình giặt sạch đa dạng. . . . . . Hình ảnh tham khảo: Máy giặt 10 Kg Panasonic NA-F100V5LRV lồng đứng. . . . . . . . . . . . . . . . . . . . . . . . . . . . . . . . . . . . . . . Thông số kỹ thuật: Máy giặt 10 Kg Panasonic NA-F100V5LRV lồng đứng. . . . ĐẶC ĐIỂM SẢN PHẨM. . . Kiểu máy giặt. . Cửa trên. . . . Kiểu lồng giặt. . Lồng đứng. . . . Khối lượng giặt. . 10Kg. . . . Tốc độ quay vắt (vòng/ phút). . 700 vòng/phút. . . . Truyền động. . Bằng dây Curoa. . . . Lượng nước tiêu thụ (lít). . Đang cập nhật. . . . Bảng điều khiển. . Anh - Việt. . . CÔNG NGHỆ. . . Chế độ giặt. . 15 chương trình giặt. . . . Công nghệ giặt. . cảm biến ECONAVI, Hệ thống ActiveFoam, Mâm giặt sóng kép, Luồng nước Dancing. . . . Thiết kế lồng giặt. . Lồng giặt SAZANAMI. . . . Tính năng. . Bộ phận lọc xơ vải, Tiết kiệm nước, Khóa trẻ em. . . THÔNG TIN CHUNG. . . Số người sử dụng. . trên 6 người (trên 8.5 Kg). . . . Chất liệu lồng giặt. . Thép không gỉ. . . . Trọng lượng (kg). . 38 kg. . . . Xuất xứ. . Việt Nam. . . . Bảo hành. . 24 tháng. . . . . . . . . Thông tin: Máy giặt 10 Kg Panasonic NA-F100V5LRV lồng đứng. . . Thiết kế hiện đại, tinh tế. . Máy Giặt Cửa Trên Panasonic NA-F100V5LRV (10kg) - Bạc. có thiết kế hiện đại, sang trọng, phù hợp với nhiều không gian đặt khác nhau, tạo điểm nhấn tinh tế cho không gian nội thất gia đình.. . . Dễ sử dụng và vệ sinh. . Chiều cao phía trước thấp hơn, cửa mở rộng hơn giúp tầm nhìn quan sát được dễ dàng hơn. Bạn có thể lau chùi lồng giặt một cách đơn giản.. . . Bảo vệ quần áo khỏi nguy cơ hư tổn với lồng giặt Sazanami hiện đại. . Với lồng giặt sazanami làm từ thép không gỉ, tăng khả năng giặt sạch mạnh mẽ cho quần áo mà còn bảo vệ cho từng sợi vải khỏi nguy cơ bị hư hỏng hoặc sờn. Bên cạnh đó còn giúp quần áo của gia đình bạn luôn được bền đẹp như mới.. . . Hiệu quả giặt vượt trội. . Mâm giặt active wave pulsator có khả năng tạo ra nguồn nước xoáy đa chiều mạnh mẽ, mang nước giặt có chứa chất tẩy rửa len lỏi sâu vào từng sợi vải, đánh bay mọi vết bẩn cứng đầu nhất, cho quần áo luôn ở trạng thái sạch sẽ, tinh tươm.. . . Tiết kiệm xà phòng với hệ thống ActiveFoam. . Hệ thống ActiveFoam trong vận hành, xà phòng sẽ được đánh tan thành các bọt khí li ti, siêu mịn, thẩm thấu sâu vào từng sợi vải, mang lại hiệu quả giặt tẩy đáng kinh ngạc, đồng thời giúp bạn tiết kiệm được xà phòng giặt một cách tối ưu nhất, hiệu quả nhất.. . . Cách thức hoạt động của hệ thống ActiveFoam. . . Tiết kiệm điện năng tiêu thụ. . Chế độ Econavi tích hợp trong dòng máy giặt giúp tiết kiệm điện thông minh và cực kỳ hiệu quả, cho bạn tận hưởng cảm giác thoải mái và không tốn kém tiền tiện và nước.. . . Giặt hàng ngày dễ dàng hơn. . Với khối lượng giặt lên đến 10kg, bạn tha hồ giặt giũ quần áo, chăn mền của gia đình mình mà không lo quá tải.. . . . . . . Tư Vấn Mua Máy giặt. . . . . . ",""""""
mediamart.vn,https://mediamart.vn/may-giat/electrolux/may-giat-9kg-electrolux-ewf12944-inverter.htm,,Electrolux,Máy giặt,Máy giặt 9Kg Electrolux EWF12944 Inverter,9.990.000,,," . - Máy giặt lồng ngang có thiết kế của trước tiện dụng.. - Động cơ Inverter tiết kiệm năng lượng.. - Bảng điều khiển thông minh với màn hình hiển thị.. . . . . Hình ảnh tham khảo: Máy giặt 9Kg Electrolux EWF12944 Inverter. . . . . . . . . . . . . . . . . . . . . . . . . . . . . . . . . . . . . . . Thông số kỹ thuật: Máy giặt 9Kg Electrolux EWF12944 Inverter. . . . ĐẶC ĐIỂM SẢN PHẨM. . . Kiểu máy giặt. . Cửa ngang. . . . Kiểu lồng giặt. . Lồng ngang. . . . Khối lượng giặt. . 9Kg. . . . Tốc độ quay vắt (vòng/ phút). . 1200 vòng/phút. . . . Truyền động. . Bằng dây Curoa. . . . Bảng điều khiển. . Tiếng Anh. . . CÔNG NGHỆ. . . Chế độ giặt. . 8 chương trình giặt. . . . Tính năng. . Giặt bằng nước nóng, Khóa trẻ em, Giặt hơi nước diệt khuẩn. . . THÔNG TIN CHUNG. . . Số người sử dụng. . trên 6 người (trên 8.5 Kg). . . . Chất liệu lồng giặt. . Thép không gỉ. . . . Xuất xứ. . Thái Lan. . . . Bảo hành. . 24 tháng. . . . . . . . . Thông tin: Máy giặt 9Kg Electrolux EWF12944 Inverter. . . Thiết kế lồng ngang hiện đại. . Máy Giặt Cửa Trước Inverter Electrolux EWF12944. sở hữu thiết kế lồng ngang hiện đại kết hợp với màu sắc tinh tế, sản phẩm phù hợp lắp đặt trong mọi không gian nội thất. Máy giặt không những đáp ứng nhu cầu giặt giũ áo quần hàng ngày cho gia đình bạn, còn góp phần làm cho ngôi nhà thêm tiện nghi.. . . Công nghệ Inverter tiết kiệm điện. . Máy giặt Electrolux EWF12944 sử dụng công nghệ Inverter giúp nâng cao hiệu quả giặt tẩy, tiết kiệm việc sử dụng điện nước của gia đình bạn hàng tháng.. . . 8 Chương trình giặt tự động. . Electrolux EWF12944 tích hợp sẵn 8 chương trình giặt tự động thông minh cho phép người dùng chọn lựa dễ dàng. Ngoài ra, máy còn nhiều tiện ích khác như: Chức năng khóa an toàn trẻ em, giặt nước nóng giúp làm sạch sâu và giặt hơi nước giúp đánh bay mọi vết bẩn dù cứng đầu nhất.. . . Khối lượng giặt lên đến 9kg. . Máy giặt Electrolux trang bị lồng giặt bằng thép không gỉ, sáng bóng vững chắc, tuổi thọ sử dụng bền lâu. Lồng giặt với dung tích lớn cho khả năng giặt giũ áo quần lên đến 9kg, rất phù hợp với gia đình đông người, có trên 6 thành viên.. . . . . . . Tư Vấn Mua Máy giặt. . . . . . ",""""""
mediamart.vn,https://mediamart.vn/may-giat/toshiba/may-giat-12-kg-toshiba-awduh1200gv-long-dung.htm,,Toshiba,Máy giặt,Máy giặt 12 Kg Toshiba  AW-DUH1200GV lồng đứng,10.890.000,,," . Công nghệ siêu bọt khí Nano (UFB). Đột phá với sức mạnh vượt trội Power Wash. Mâm giặt 3D 6 cánh. Động cơ truyền động trực tiếp DD Inverter. Cửa lồng giặt rộng. Thiết kế nắp máy giặt an toàn. . . . . Hình ảnh tham khảo: Máy giặt 12 Kg Toshiba AW-DUH1200GV lồng đứng. . . . . . . . . . . . . . . . . . . . . . . . Thông số kỹ thuật: Máy giặt 12 Kg Toshiba AW-DUH1200GV lồng đứng. . . . ĐẶC ĐIỂM SẢN PHẨM. . . Kiểu máy giặt. . Cửa trên. . . . Kiểu lồng giặt. . Lồng đứng. . . . Khối lượng giặt. . 12Kg. . . . Tốc độ quay vắt (vòng/ phút). . 770 vòng/phút. . . . Truyền động. . Dẫn động trực tiếp. . . . Bảng điều khiển. . Tiếng Anh. . . CÔNG NGHỆ. . . Chế độ giặt. . 8 chương trình giặt. . . . Công nghệ giặt. . Mâm giặt Mega Power Wash, UFB siêu bọt khí NANO, Hiệu ứng thác nước đôi. . . . Thiết kế lồng giặt. . Lồng giặt Magic Drum. . . . Tính năng. . Điều chỉnh thời gian giặt, Tiết kiệm nước, Tiết kiệm điện, Khóa trẻ em, Vắt cực khô. . . THÔNG TIN CHUNG. . . Số người sử dụng. . trên 6 người (trên 8.5 Kg). . . . Chất liệu lồng giặt. . Thép không gỉ. . . . Trọng lượng (kg). . 47 kg. . . . Xuất xứ. . Thái Lan. . . . Bảo hành. . 24 tháng. . . . . . . . . Thông tin: Máy giặt 12 Kg Toshiba AW-DUH1200GV lồng đứng. . . Máy giặt đời mới sang trọng và hiện đại. . Vừa ra mắt vào năm 2017, máy giặt Toshiba Inverter 11 kg AW-DUH1200GV có thiết kế vỏ ngoài bằng thép mạ kẽm vô cùng sang trọng, lịch lãm, hứa hẹn sẽ mang lại vẻ đẹp hiện đại cho không gian nội thất của gia đình. Nếu gia đình bạn trên 6 thành viên thì chiếc máy giặt Toshiba 11 kg này sẽ là sự lựa chọn đáng cân nhắc.. . . Công nghệ Inverter vận hành êm ái, tiết kiệm điện năng hiệu quả. . Ngay cả khi sở hữu khối lượng giặt lớn, chiếc máy giặt Toshiba này vẫn vận hành một cách êm ái, bền bỉ và tiết kiệm điện năng hiệu quả cho gia đình bạn nhờ được trang bị công nghệ Inverter với động cơ truyền động trực tiếp bền & êm.. . . Mâm giặt Mega Power Wash kết hợp thác nước đôi giặt sạch mạnh mẽ, giảm xoắn rối tối đa. . Sự kết hợp giữa mâm giặt Mega Power Wash cùng hiệu ứng thác nước đôi của máy giặt Toshiba AW-DUH1200GV không chỉ mang lại khả năng giặt sạch quần áo mạnh mẽ mà nó còn góp phần giảm xoắn rối tối đa, bạn không phải tốn thời gian là ủi sau mỗi lần giặt nữa.. . . Công nghệ UFB siêu bọt khí NANO tiết kiệm xà phòng, đánh bay mọi vết bẩn cứng đầu. . Với. công nghệ UFB siêu bọt khí NANO. máy giặt sẽ đánh tan bọt xà phòng thành các hạt khí li ti thẩm thấu sâu vào quần áo, tiết kiệm xà phòng nhưng vẫn đảm bảo khả năng đánh bay mọi vết bẩn cứng đầu nhất có trên quần áo.. . . Độc đáo với hệ thống suy luận ảo Fuzzy Logic tiết kiệm nước và thời gian. . Điểm nổi bật phải nhắc đến ở chiếc máy giặt Toshiba này chính là trang bị. hệ thống suy luận ảo Fuzzy Logic. . Nhờ trang bị này máy giặt có thể cân bằng lượng nước và tùy chỉnh thời gian hợp lý với lượng quần áo có trong lồng giặt vô cùng hiện đại và độc đáo.. . . . . . . Tư Vấn Mua Máy giặt. . . . . . ",""""""
