Domain,Url,Product_id,Brand,Category,Model,Price,Seller,Tags,Info,Others
mediamart.vn,https://mediamart.vn/may-giat/samsung/may-giat-long-ngang-105kg-say-6kg-samsung-wd10k6410ossv.htm,,Samsung,Máy giặt,Máy giặt lồng Ngang 10.5Kg + Sấy 6Kg Samsung WD10K6410OS/SV,19.990.000,,," . Giặt sạch vượt trội với công nghệ giặt bong bóng Eco Bubble.. Máy giặt cửa trước có thể thêm đồ trong lúc giặt.. Công nghệ Inverter vận hành êm ái, bền bỉ, tiết kiệm điện năng.. Máy giặt kết hợp máy sấy quần áo tiện lợi.. . . . . Hình ảnh tham khảo: Máy giặt lồng Ngang 10.5Kg + Sấy 6Kg Samsung WD10K6410OS/SV. . . . . . . . . . . . . . . . . . . . . . . . . . . . . . . . . Thông số kỹ thuật: Máy giặt lồng Ngang 10.5Kg + Sấy 6Kg Samsung WD10K6410OS/SV. . . . ĐẶC ĐIỂM SẢN PHẨM. . . Kiểu máy giặt. . Cửa ngang. . . . Kiểu lồng giặt. . Lồng ngang. . . . Khối lượng giặt. . 10.5Kg. . . . Tốc độ quay vắt (vòng/ phút). . 1400 vòng/phút. . . . Truyền động. . Bằng dây Curoa. . . . Bảng điều khiển. . Anh - Việt. . . CÔNG NGHỆ. . . Chế độ giặt. . 10 chương trình giặt. . . . Công nghệ giặt. . ECO Bubble, Giặt phun Speed Spray. . . . Thiết kế lồng giặt. . Lồng giặt kim cương. . . . Tính năng. . Giặt bằng nước nóng, Tính năng sấy, Tiết kiệm điện, Vệ sinh lồng giặt, Thêm đồ khi đang giặt. . . THÔNG TIN CHUNG. . . Số người sử dụng. . trên 6 người (trên 8.5 Kg). . . . Chất liệu lồng giặt. . Thép không gỉ. . . . Trọng lượng (kg). . 72 kg. . . . Xuất xứ. . Việt Nam. . . . Bảo hành. . 24 tháng. . . . . . . . . Thông tin: Máy giặt lồng Ngang 10.5Kg + Sấy 6Kg Samsung WD10K6410OS/SV. . . Máy giặt sấy với cửa Add Wash hiện đại, mới lạ. Máy giặt Samsung 10.5 kg WD10K6410OS/SV là một chiếc máy giặt cửa trước có thiết kế hiện đại, trẻ trung sẽ là điểm nhấn cho không gian nội thất của bạn. Không chỉ vậy, máy giặt còn được trang bị tính năng sấy, giúp quần áo của gia đình nhanh chóng khô ráo, đặc biệt vào những ngày mưa.. . . Với cửa phụ Add Wash mới lạ, bạn sẽ dễ dàng cho thêm đồ vào máy trong lúc giặt, một việc làm mà các dòng máy giặt cửa trước truyền thống không hỗ trợ.. . . Khối lượng giặt 10.5 kg. Máy giặt Samsung với khối lượng giặt lên đến 10.5 kg, chính là sự lựa chọn đáng cân nhắc cho các gia đình đông thành viên (6 người trở lên).. . . Tiết kiệm xà phòng nhưng vẫn giặt sạch hiệu quả. Nhờ vào công nghệ Eco Bubble có khả năng đánh tan bột giặt thành bong bóng xà phòng, máy giặt Samsung WD10K6410OS/SV không chỉ giúp gia đình bạn tiết kiệm xà phòng mà còn giúp xà phòng thấm sâu vào từng sợi vải, đẩy lùi mọi vết bẩn cứng đầu.. . . Khử trùng cho quần áo. Được trang bị tính năng giặt hơi Air Wash, quần áo của bạn sẽ luôn được khử mùi và kháng khuẩn mạnh mẽ, bảo vệ sức khỏe cho mọi thành viên trong gia đình.. . . Động cơ biến tần Inverter tiết kiệm điện. Là một chiếc máy giặt Inverter được trang bị động cơ biến tần kỹ thuật số Inverter, máy giặt Samsung WD10K6410OS/S giúp tiết kiệm điện năng hiệu quả và vận hành bền bỉ đến 20 năm.. . . Các tính năng nổi bật khác. Ngoài những tính năng kể trê, chiếc máy giặt Samsung 10.5 kg WD10K6410OS/SV còn được trang bị các chức năng nổi bật khác cần được nhắc đến như:. +Thiết kế lồng giặt kim cương: Thiết kế lồng giặt kim cương sẽ giúp tăng cường hiệu quả giặt sạch nhưng vẫn bảo vệ quần áo tối ưu nhất. . . +Tự vệ sinh lồng giặt: Độc đáo với tính năng tự động vệ sinh lồng giặt, chiếc máy giặt Samsung này sẽ giúp bạn tiết kiệm được thời gian làm vệ sinh bên trong máy giặt.. +Chế độ giặt nhanh tiện lợi: Bạn không có nhiều thời gian để chờ đợi? Đừng lo lắng, với chế độ giặt nhanh, máy giặt Samsung 10.5 kg WD10K6410OS/SV sẽ giúp bạn có thể giúp bạn hoàn thiện mẻ giặt của mình nhanh chóng và tiện lợi.. . . . . . Tư Vấn Mua Máy giặt. . . . . . ",""""""
mediamart.vn,https://mediamart.vn/may-giat/midea/may-giat-95kg-midea-man9507-long-dung.htm,,Midea,Máy giặt,Máy giặt 9.5Kg Midea MAN-9507 lồng đứng,5.890.000,,," . - Khối lượng giặt: 9.5kg. - Nhiều chương trình giặt khác nhau. - Tính năng hẹn giờ hiệu quả. - Tốc độ quay vắt mạnh mẽ . . . . . Hình ảnh tham khảo: Máy giặt 9.5Kg Midea MAN-9507 lồng đứng. . . . . . . . . . . . . . . . . . . . . . . . Thông số kỹ thuật: Máy giặt 9.5Kg Midea MAN-9507 lồng đứng. . . . ĐẶC ĐIỂM SẢN PHẨM. . . Kiểu máy giặt. . Cửa trên. . . . Kiểu lồng giặt. . Lồng đứng. . . . Khối lượng giặt. . 9.5Kg. . . . Tốc độ quay vắt (vòng/ phút). . 800 vòng/phút. . . . Truyền động. . Bằng dây Curoa. . . . Lượng nước tiêu thụ (lít). . Đang cập nhật. . . . Công suất (W). . Đang cập nhật. . . . Bảng điều khiển. . Đang cập nhật. . . CÔNG NGHỆ. . . Chế độ giặt. . 16 chương trình giặt. . . . Tính năng. . Tiết kiệm nước, Tiết kiệm điện, Hẹn giờ, Khóa trẻ em. . . THÔNG TIN CHUNG. . . Số người sử dụng. . trên 6 người (trên 8.5 Kg). . . . Chất liệu lồng giặt. . Thép không gỉ. . . . Trọng lượng (kg). . Đang cập nhật. . . . Xuất xứ. . Việt Nam. . . . Bảo hành. . 24 tháng. . . . . . . . . Thông tin: Máy giặt 9.5Kg Midea MAN-9507 lồng đứng. . . . . . . . Tư Vấn Mua Máy giặt. . . . . . ",""""""
mediamart.vn,https://mediamart.vn/may-giat/toshiba/may-giat-9kg-toshiba-dc1000cvwb-inverter-xanh-duong.htm,,Toshiba,Máy giặt,"Máy giặt 9 Kg Toshiba DC1000CV(WB), lồng đứng, Inverter, xanh dương",8.290.000,,," . - Loại máy giặt: Lồng đứng. - Khối lượng giặt (kg): 9 Kg. - Tốc độ quay vắt (có tải): 900 Vòng/phút. - Điện năng tiêu thụ: Giặt thường: 520 - Vắt: 130 W. - Công nghệ: truyền động trực tiếp. - Tiết kiệm điện, tiết kiệm nước, tiết kiệm thời gian. - Màu sắc: Xanh dương. - Kích thước (CxRxS) mm: 960 x 600 x 569. . . . . Hình ảnh tham khảo: Máy giặt 9 Kg Toshiba DC1000CV(WB), lồng đứng, Inverter, xanh dương. . . . . . . . . . . . . . . . . . . . . . . . . . . . . . . . . Thông số kỹ thuật: Máy giặt 9 Kg Toshiba DC1000CV(WB), lồng đứng, Inverter, xanh dương. . . . ĐẶC ĐIỂM SẢN PHẨM. . . Kiểu máy giặt. . Cửa trên. . . . Kiểu lồng giặt. . Lồng đứng. . . . Khối lượng giặt. . 9Kg. . . . Tốc độ quay vắt (vòng/ phút). . 900 vòng/phút. . . . Truyền động. . Dẫn động trực tiếp. . . . Lượng nước tiêu thụ (lít). . 137 lít. . . . Công suất (W). . 520. . . . Bảng điều khiển. . Anh - Việt. . . CÔNG NGHỆ. . . Chế độ giặt. . 9 chương trình giặt. . . . Công nghệ giặt. . Mâm giặt Hybrid Powerful. . . . Thiết kế lồng giặt. . Lồng giặt ngôi sao pha lê. . . . Tính năng. . Bộ phận lọc xơ vải, Tiết kiệm nước, Tiết kiệm điện, Hẹn giờ, Khử mùi kháng khuẩn. . . THÔNG TIN CHUNG. . . Số người sử dụng. . trên 6 người (trên 8.5 Kg). . . . Chất liệu lồng giặt. . Thép không gỉ. . . . Trọng lượng (kg). . 39 kg. . . . Xuất xứ. . Thái Lan. . . . Bảo hành. . 24 tháng. . . . . . . . . Thông tin: Máy giặt 9 Kg Toshiba DC1000CV(WB), lồng đứng, Inverter, xanh dương. . . Thiết kế hiện đại. Máy giặt Toshiba AW-DC1000CV có thiết kế hiện đại và sang trọng, tiện nghi cho không gian sống của bạn.. . . Công nghệ giặt tiên tiến. Máy giặt đem đến độ chính xác cao trong việc phân loại lượng quần áo cũng như kiểm soát tốc độ quay của lồng giặt giúp cho việc giặt giũ thật tiện lợi và hoàn hảo.. . . Khối lượng giặt giũ lớn. Máy giặt có khối lượng giặt đến 9kg giúp bạn thoải mái giặt giũ quần áo cho cả nhà.. . . Rút ngắn thời gian phơi quần áo. Máy giặt Toshiba có chức năng vắt cực khô kết hợp hệ thống khe hút khí vòng cung tạo nên luồng khí thổi cực mạnh giúp quần áo của bạn mau khô sau khi giặt.. . . Thiết kế lồng giặt tiên tiến. Máy giặt có lồng giặt được thiết kế rất nhiều gờ nổi hình ngôi sao chà xát vào quần áo giúp quần áo trở nên sạch sẽ sau khi giặt.. . . Đột phá với bộ truyền động trực tiếp. Máy giặt Toshiba AW-DC1000CV có tốc độ quay của mâm giặt nhanh và mạnh hơn so với các máy giặt thông thường giúp việc giặt giũ của bạn trở nên dễ dàng.. . . Tốc độ quay vắt 900 vòng/ phút. Máy giặt có tốc độ quay vắt 900 vòng/ phút giúp quần áo sạch mọi vết bẩn.. . . Tiết kiệm 3 trong 1. Máy giặt được trang bị hệ thống thông minh tự cân chỉnh mực nước phù hợp với từng lượng đồ giặt giúp bạn tiết kiệm nước và rút ngắn thời gian giặt.. . . Nhiều chế độ giặt đa dạng. Máy giặt có nhiều chế độ giặt giúp bạn dễ dàng giặt giũ với nhiều loại quần áo.. . . . . . . Tư Vấn Mua Máy giặt. . . . . . ",""""""
mediamart.vn,https://mediamart.vn/may-giat/lg/may-giat-155kg-lg-t2555vs2m.htm,,LG,Máy giặt,Máy giặt 15.5kg LG T2555VS2M,12.490.000,,," . Máy giặt lồng đứng 15.5Kg, Giặt 6 chuyển động - 6 motion. Công nghệ Smart Inverter - Tiết kiệm điện hiệu quả. Tính năng giặt xoay chiều TurboDrum. Chẩn đoán thông minh Smart Diagnosis. . . . . Hình ảnh tham khảo: Máy giặt 15.5kg LG T2555VS2M. . . . . . . . . . . . . . . . . . . . . . . . . . . . . . . . . . . . . . . . . . . . . . . . . . . Thông số kỹ thuật: Máy giặt 15.5kg LG T2555VS2M. . . . ĐẶC ĐIỂM SẢN PHẨM. . . Kiểu máy giặt. . Cửa trên. . . . Kiểu lồng giặt. . Lồng đứng. . . . Khối lượng giặt. . 15.5Kg. . . . Truyền động. . Bằng dây Curoa. . . . Bảng điều khiển. . Tiếng Việt. . . CÔNG NGHỆ. . . Chế độ giặt. . 10 chương trình giặt. . . . Công nghệ giặt. . 6 Motions, Turboshot. . . . Tính năng. . Tiết kiệm nước, Tiết kiệm điện, Hẹn giờ, Vệ sinh lồng giặt. . . THÔNG TIN CHUNG. . . Số người sử dụng. . trên 6 người (trên 8.5 Kg). . . . Chất liệu lồng giặt. . Thép không gỉ. . . . Xuất xứ. . Thái Lan. . . . Bảo hành. . 24 tháng. . . . . . . . . Thông tin: Máy giặt 15.5kg LG T2555VS2M. . . Tiết kiệm năng lượng với công nghệ Smart Inverter. . Công nghệ Smart Inverter loại bỏ các hoạt động không cần thiết bằng cách điều khiển điện năng tiêu thụ một cách tối ưu.. . . Inverter (Biến tần) là gì ?. . Động cơ kiểu bật/tắt thông thường có hiệu quả năng lượng thấp. Tuy nhiên, công nghệ Inverter (biến tần) hoạt động liên tục bằng cách tăng giảm độ sáng mà không cần phải tắt hẳn, từ đó mang tới mức tiết kiệm năng lượng cao hơn.. . . Máy giặt với Smart Inverter. . Máy giặt Smart Inverter điều chỉnh mức tiêu thụ năng lượng ở mức tối ưu theo công suất yêu cầu.. . . Bền Bỉ & Giảm Rung Ồn. . Động cơ Smart Inverter không chỉ giảm rung và ồn tối đa mà còn tăng sự bền bỉ của động cơ. Động cơ sẽ được bảo hành lên tới 10 năm.. . . Chuyển động thông minh Smart Motion. . Smart Motion là 3 chuyển động giặt do động cơ Smart Inverter tạo ra, để mang tới khả năng giặt tối ưu cho từng loại vải. Sự kết hợp tối ưu giúp chăm sóc áo quần hoàn hảo.. . . Giặt xoay chiều TurboDrum™. . TurboDrum™ mang tới hiệu năng giặt mạnh mẽ và khả năng đánh bật cả các vết bẩn cứng đầu nhất nhờ xoáy nước mạnh mẽ, tạo ra bởi việc xoay đảo hướng lồng giặt và mâm giặt ngược chiều nhau.. . . Đấm nước Punch+3. . Punch+3 tạo ra các dòng nước theo phương thẳng đứng, đưa đồ giặt lên và xuống liên tục, mang tới hiệu quả giặt đồng đều.. . . Giặt sơ tự động. . Chỉ với một chạm, vết bẩn khó giặt sẽ biến mất. Hãy để đôi bàn tay của bạn nghỉ ngơi và để máy giặt làm công việc của chúng!. . . Thác nước vòng cung. . Các Thác nước vòng cung giúp hòa tan bột giặt nhanh chóng để dễ dàng thẩm thấu vào áo quần, đồng thời giảm thiểu cặn bột giặt còn sót lại gây dị ứng và mẩn ngứa. . . Chẩn đoán thông minh Smart Diagnosis™. . Smart Diagnosis™ giúp chẩn đoán và khắc phục các sự cố sản phẩm, giảm số lần phải đến bảo dưỡng tốn chi phí và không thuận tiện. . . Thiết kế an toàn và thuận tiện. . Thiết kế phong cách và bền bỉ, đảm bảo sự thuận tiện và an toàn, đồng thời mang đến những tính năng hiệu quả và đổi mới.. . . . . . . . Tư Vấn Mua Máy giặt. . . . . . ",""""""
mediamart.vn,https://mediamart.vn/may-giat/lg/may-giat-135kg-lg-t2553vs2m.htm,,LG,Máy giặt,Máy giặt 13.5kg LG T2553VS2M,10.990.000,,," . Máy giặt lồng đứng 13.5Kg, Giặt 6 chuyển động - 6 motion. Công nghệ Smart Inverter - Tiết kiệm điện hiệu quả. Tính năng giặt xoay chiều TurboDrum. Chẩn đoán thông minh Smart Diagnosis. . . . . Hình ảnh tham khảo: Máy giặt 13.5kg LG T2553VS2M. . . . . . . . . . . . . . . . . . . . . . . . . . . . . . . . . . . . . . . . . . . . . . . . Thông số kỹ thuật: Máy giặt 13.5kg LG T2553VS2M. . . . ĐẶC ĐIỂM SẢN PHẨM. . . Kiểu máy giặt. . Cửa trên. . . . Kiểu lồng giặt. . Lồng đứng. . . . Khối lượng giặt. . 13.5 kg. . . . Truyền động. . Bằng dây Curoa. . . . Bảng điều khiển. . Tiếng Việt. . . CÔNG NGHỆ. . . Chế độ giặt. . 10 chương trình giặt. . . . Công nghệ giặt. . 6 Motions, Turboshot. . . . Tính năng. . Tiết kiệm nước, Tiết kiệm điện, Hẹn giờ, Vệ sinh lồng giặt. . . THÔNG TIN CHUNG. . . Số người sử dụng. . trên 6 người (trên 8.5 Kg). . . . Chất liệu lồng giặt. . Thép không gỉ. . . . Xuất xứ. . Thái Lan. . . . Bảo hành. . 24 tháng. . . . . . . . . Thông tin: Máy giặt 13.5kg LG T2553VS2M. . . Tiết kiệm năng lượng với công nghệ Smart Inverter. . Công nghệ Smart Inverter loại bỏ các hoạt động không cần thiết bằng cách điều khiển điện năng tiêu thụ một cách tối ưu.. . . Inverter (Biến tần) là gì ?. . Động cơ kiểu bật/tắt thông thường có hiệu quả năng lượng thấp. Tuy nhiên, công nghệ Inverter (biến tần) hoạt động liên tục bằng cách tăng giảm độ sáng mà không cần phải tắt hẳn, từ đó mang tới mức tiết kiệm năng lượng cao hơn.. . . Máy giặt với Smart Inverter. . Máy giặt Smart Inverter điều chỉnh mức tiêu thụ năng lượng ở mức tối ưu theo công suất yêu cầu.. . . Bền Bỉ & Giảm Rung Ồn. . Động cơ Smart Inverter không chỉ giảm rung và ồn tối đa mà còn tăng sự bền bỉ của động cơ. Động cơ sẽ được bảo hành lên tới 10 năm.. . . Chuyển động thông minh Smart Motion. . Smart Motion là 3 chuyển động giặt do động cơ Smart Inverter tạo ra, để mang tới khả năng giặt tối ưu cho từng loại vải. Sự kết hợp tối ưu giúp chăm sóc áo quần hoàn hảo.. . . Giặt xoay chiều TurboDrum™. . TurboDrum™ mang tới hiệu năng giặt mạnh mẽ và khả năng đánh bật cả các vết bẩn cứng đầu nhất nhờ xoáy nước mạnh mẽ, tạo ra bởi việc xoay đảo hướng lồng giặt và mâm giặt ngược chiều nhau.. . . Đấm nước Punch+3. . Punch+3 tạo ra các dòng nước theo phương thẳng đứng, đưa đồ giặt lên và xuống liên tục, mang tới hiệu quả giặt đồng đều.. . . Giặt sơ tự động. . Chỉ với một chạm, vết bẩn khó giặt sẽ biến mất. Hãy để đôi bàn tay của bạn nghỉ ngơi và để máy giặt làm công việc của chúng!. . . Thác nước vòng cung. . Các Thác nước vòng cung giúp hòa tan bột giặt nhanh chóng để dễ dàng thẩm thấu vào áo quần, đồng thời giảm thiểu cặn bột giặt còn sót lại gây dị ứng và mẩn ngứa. . . Chẩn đoán thông minh Smart Diagnosis™. . Smart Diagnosis™ giúp chẩn đoán và khắc phục các sự cố sản phẩm, giảm số lần phải đến bảo dưỡng tốn chi phí và không thuận tiện. . . Thiết kế an toàn và thuận tiện. . Thiết kế phong cách và bền bỉ, đảm bảo sự thuận tiện và an toàn, đồng thời mang đến những tính năng hiệu quả và đổi mới.. . . . . . . . Tư Vấn Mua Máy giặt. . . . . . ",""""""
mediamart.vn,https://mediamart.vn/may-giat/hitachi/may-giat-95kg-hitachi-sfs95xc-long-dung-bom-tro-luc.htm,,Hitachi,Máy giặt,"Máy giặt 9,5kg Hitachi SF-S95XC lồng đứng (bơm trợ lực)",7.250.000,,," . Công nghệ Beat Wave Wash giặt mạnh mẽ, nhanh chóng làm sạch quần áo.. Giặt thẩm thấu 4 bước đưa chất giặt tẩy đậm đặc thấm sâu từng sợi vải, đánh bay mọi vết bẩn cứng đầu.. Tích hợp bơm trợ lực, cung cấp nguồn nước mạnh cho máy hoạt động tốt ở những khu vực nước yếu.. Tiện lợi nhờ chức năng chống rối đồ giặt.. . . . . Hình ảnh tham khảo: Máy giặt 9,5kg Hitachi SF-S95XC lồng đứng (bơm trợ lực). . . . . . . . . . . . . . . Thông số kỹ thuật: Máy giặt 9,5kg Hitachi SF-S95XC lồng đứng (bơm trợ lực). . . . ĐẶC ĐIỂM SẢN PHẨM. . . Kiểu máy giặt. . Cửa trên. . . . Kiểu lồng giặt. . Lồng đứng. . . . Khối lượng giặt. . 9.5Kg. . . . Tốc độ quay vắt (vòng/ phút). . 600 vòng/phút. . . . Truyền động. . Bằng dây Curoa. . . . Lượng nước tiêu thụ (lít). . 154. . . CÔNG NGHỆ. . . Chế độ giặt. . 11 chương trình giặt. . . . Công nghệ giặt. . Beat Wave Wash, Giặt thẩm thấu 4 bước. . . . Tính năng. . Bộ phận lọc xơ vải, Khử mùi kháng khuẩn, Bơm trợ lực cấp nước mạnh, Điều chỉnh luồng nước Water Power. . . THÔNG TIN CHUNG. . . Số người sử dụng. . 4 - 5 người (7.5 - 8.5 Kg). . . . Chất liệu lồng giặt. . Thép không gỉ. . . . Xuất xứ. . Thái Lan. . . . Bảo hành. . 12 tháng. . . . . . . . . Thông tin: Máy giặt 9,5kg Hitachi SF-S95XC lồng đứng (bơm trợ lực). . . . . 1.TIỆN ÍCH VƯỢT TRỘI: TÍCH HỢP BƠM TRỢ LỰC. . Giặt nhanh hơn với bơm cấp nước cực mạnh: Khi nguồn cấp nước áp lực thấp. . Nhờ được tích hợp hệ thống bơm, bạn không còn phải lo lắng về nguồn cấp nước, ngay cả khi áp lực nước rất thấp.. . . . 2.TIỆN ÍCH VƯỢT TRỘI: Chống rối đồ giặt. . Khi chu kỳ quay kết thúc, mâm giặt tiếp tục chuyển động theo chiều kim đồng hồ và ngược chiều kim đồng hồ để đồ giặt rơi khỏi thành lồng giặt nhờ đó gỡ rối chúng. Tính năng độc đáo này của máy giặt Hitachi giúp cho việc lấy đồ giặt ra khỏi lồng giặt dễ dàng hơn nhiều. Không bị rối đồng nghĩa với quần áo ít bị nhăn.. . . . 3.TIỆN ÍCH VƯỢT TRỘI: Beat Wave Wash. . Giặt với chuyển động nén, đảo, chà xát mạnh mẽ. . . 4.TIỆN ÍCH VƯỢT TRỘI: Giặt 4 bước. . Dung dịch chất giặt tẩy đậm đặc, thấm sâu vào sợi vải giúp đánh bật những vết bẩn cứng đầu.. . . 5.TIỆN ÍCH VƯỢT TRỘI: Các chương trình giặt tiết kiệm. . Mang đến nhiều lựa chọn chương trình giặt thân thiện hơn với môi trường, tùy thuộc vào điều kiện và lượng quần áo cần giặt.. . . Tiết kiệm nước. . . Tiêu thụ ít nước hơn với thời gian giặt nhanh hơn. Lý tưởng cho quần áo ít bẩn.. . . . Tiết kiệm điện. . . Tiêu thụ điện năng ít hơn với thời gian giặt lâu hơn. . . . Giặt ít. . . Lý tưởng cho việc giặt nhanh quần áo lót hoặc các đồ nhỏ khác. Chế độ này giúp bạn tiết kiệm đồng thời cả nước và chất giặt tẩy, mang tính kinh tế và thân thiện với môi trường.. . . 6.TIỆN ÍCH VƯỢT TRỘI:. . Thiết kế nắp kính. . Nắp máy bằng kính cường lực phong cách – dễ quan sát, với tay nắm thiết kế mới thuận tiện cho người dùng. Nắp máy mở- đóng nhẹ nhàng nhờ hệ thống lò xo trợ lực. . . . . . Tư Vấn Mua Máy giặt. . . . . . ",""""""
mediamart.vn,https://mediamart.vn/may-giat/samsung/may-giat-long-ngang-samsung-8kg-ww80k5410wwsv.htm,,Samsung,Máy giặt,Máy giặt 8 Kg Samsung Addwash WW80K5410WW/SV hơi nước,8.490.000,,," . Máy giặt lồng ngang 8kg, 14 chương trình giặt . . Thêm đồ khi đang giặt. với Add Door. Tiết kiệm điện với công nghệ Inverter, Smart Check chẩn đoán lỗi tự động. Công nghệ Eco Bubble giặt sạch tối ưu, công nghệ ngân bong bóng giúp đánh bay các vết bẩn. . . . . Hình ảnh tham khảo: Máy giặt 8 Kg Samsung Addwash WW80K5410WW/SV hơi nước. . . . . . . . . . . . . . . . . . . . . . . . . . . . . . . . . . . . . . . . . . Thông số kỹ thuật: Máy giặt 8 Kg Samsung Addwash WW80K5410WW/SV hơi nước. . . . ĐẶC ĐIỂM SẢN PHẨM. . . Kiểu máy giặt. . Cửa ngang. . . . Kiểu lồng giặt. . Lồng ngang. . . . Khối lượng giặt. . 8Kg. . . . Tốc độ quay vắt (vòng/ phút). . 1400 vòng/phút. . . . Truyền động. . Bằng dây Curoa. . . . Bảng điều khiển. . Tiếng Việt. . . CÔNG NGHỆ. . . Chế độ giặt. . 14 chương trình giặt. . . . Công nghệ giặt. . ECO Bubble. . . . Thiết kế lồng giặt. . Lồng giặt kim cương. . . . Tính năng. . Vắt khô nhanh, Tiết kiệm điện, Hẹn giờ, Khóa trẻ em, Tự động vệ sinh lồng giặt , Chức năng chẩn đoán thông minh, Giặt hơi nước diệt khuẩn, Khử mùi kháng khuẩn, Vắt cực khô. . . THÔNG TIN CHUNG. . . Số người sử dụng. . 4 - 5 người (7.5 - 8.5 Kg). . . . Chất liệu lồng giặt. . Thép không gỉ. . . . Trọng lượng (kg). . 69 kg. . . . Xuất xứ. . Việt Nam. . . . Bảo hành. . 24 tháng. . . . . . . . . Thông tin: Máy giặt 8 Kg Samsung Addwash WW80K5410WW/SV hơi nước. . . Chế Độ Giặt Bổ Sung. Bỏ quên một chiếc áo cần giặt? Add Wash cho phép bạn dễ dàng và đơn giản thêm vào quần áo sót lại khi máy đang giặt. Bạn cũng có thể cho vào quần áo giặt tay cần được xả và vắt khô.. . . * Cửa phụ có thể được mở bất kỳ lúc nào khi nhiệt độ trong lồng giặt dưới 50℃.. . . Sức Mạnh Giặt Giũ Của Bong Bóng Xà Phòng. Công nghệ Eco Bubble™ giặt sạch mạnh mẽ, thậm chí ở nhiệt độ thấp*. Bột giặt được đánh tan thành bong bóng, nhanh chóng thấm sâu vào sợi vải và loại bỏ chất bẩn dễ dàng trong khi vẫn bảo vệ quần áo và tiết kiệm năng lượng.. . . * Thử nghiệm với IEC 60456-2010 (WF80F5E5U4W) và Cotton 40° (WF0702WKU). . . Loại Bỏ Vết Bẩn Khó Chịu Nhất. Công nghệ Ngâm Bong Bóng giúp đánh bật mọi vết bẩn cứng đầu chỉ với một nút nhấn. Vết bẩn dễ dàng bị hòa tan và loại bỏ một cách hiệu quả.. . . . . . . * Thử nghiệm với IEC 60456 (WF80F5E5U4) và (WF0702WKU).. . . Vận Hành Thông Minh - Bền Bỉ Với Thời Gian. Công nghệ Biến Tần Kỹ Thuật Số sử dụng nam châm mạnh đem lại hiệu suất tốt hơn, giảm tiếng ồn hiệu quả và tiêu thụ ít năng lượng hơn một Động Cơ Đa Năng. Bạn sẽ yên tâm về độ bền của máy với chế độ bảo hành 11 năm.. . . Xử Lý Sự Cố Dễ Dàng. Ứng dụng tự kiểm tra sự cố - Smart Check trên thiết bị di động thông minh giúp chẩn đoán lỗi và đưa ra các giải pháp xử lý dễ dàng. Bạn có thể tiết kiệm thời gian và chi phí cho dịch vụ sửa chữa.. . . . . . . Tư Vấn Mua Máy giặt. . . . . . ",""""""
