Domain,Url,Product_id,Rating,Comment,Review Time,Bought Time
adayroi.com,https://www.adayroi.com/mi-jumbo-koreno-vi-kim-chi-paldo-goi-1kg-p-PRI193625?offer=PRI193625_CHK,PRI193625,5,vận chuyển nhanh chóng. rẻ hơn nhiều.bạn shipper còn nbieetj tình đóng cổng giúp nữa. tuyệt vời 😚?,2017-07-16 00:31:00,
adayroi.com,https://www.adayroi.com/mi-jumbo-koreno-vi-kim-chi-paldo-goi-1kg-p-PRI193625?offer=PRI193625_CHK,PRI193625,5,"tiếc thật, nhà cung cấp không giao quận 7 nếu không toi đã mua cả thùng",2017-06-12 23:12:00,
adayroi.com,https://www.adayroi.com/mi-jumbo-koreno-vi-kim-chi-paldo-goi-1kg-p-PRI193625?offer=PRI193625_CHK,PRI193625,1,"cái này ở Đà Nẵng cứ đứt hàng miết là sao nhỉ, lúc có lúc không",2017-06-08 11:21:00,
adayroi.com,https://www.adayroi.com/mi-vi-bo-cay-paldo-goi-1kg-p-PRI3410?offer=PRI3410_CHK,PRI3410,5,"Sợi mì dai ngon, gia vị đậm, với một số người có thể hơi mặn nếu cho cả gói gia vị. Nói chung mình thấy ngon hơn hẳn các loại mì khác.",2017-11-14 21:06:00,
adayroi.com,https://www.adayroi.com/mi-vi-bo-cay-paldo-goi-1kg-p-PRI3410?offer=PRI3410_CHK,PRI3410,5,Rất ưng ý 👍,2017-08-30 10:01:00,
adayroi.com,https://www.adayroi.com/mi-vi-bo-cay-paldo-goi-1kg-p-PRI3410?offer=PRI3410_CHK,PRI3410,5,"Hàng giao đầy đủ, không bể",2017-08-22 20:16:00,
adayroi.com,https://www.adayroi.com/mi-vi-bo-cay-paldo-goi-1kg-p-PRI3410?offer=PRI3410_CHK,PRI3410,5,"Mì dai, hương vị đậm đà, hơi cay",2017-08-02 13:21:00,
adayroi.com,https://www.adayroi.com/mi-vi-bo-cay-paldo-goi-1kg-p-PRI3410?offer=PRI3410_CHK,PRI3410,5,Mỳ rất ngon đang giảm giá nên phải mua ngay,2017-07-30 10:01:00,
adayroi.com,https://www.adayroi.com/mi-vi-bo-cay-paldo-goi-1kg-p-PRI3410?offer=PRI3410_CHK,PRI3410,4,giá hơi cao nhưng đúng là tiền nào của đó :),2015-06-11 15:42:00,
adayroi.com,https://www.adayroi.com/mi-koreno-vi-tom-goi-1kg-p-PRI11356?offer=PRI11356_CHK,PRI11356,5,Sao mình không mua hàng được nữa Ad nhỉ?,2017-08-30 16:23:00,
