Domain,Url,Product_id,Rating,Comment,Review Time,Bought Time
lazada.vn,https://www.lazada.vn/products/wiko-u-feel-go-16gb-ram-3gb-4000mah-xam-den-hang-phan-phoichinh-thuc-i150508617-s158182391.html?search=1,150508617,5,"San pham ok, full box ",2017-10-21 11:53:04,2017-10-11 02:46:45
lazada.vn,https://www.lazada.vn/products/dtdd-1280-ban-le-gia-si-sieu-ben-bao-hanh-1-doi-1-den-i248448099-s324986457.html?search=1,248448099,1," ất vọng! quá tệ điện thoại dùng b5 phút cam sạc không được , dùng thêm 5 phút mất nguồn . Điện thoai trung Quốc không phải nokia chính hãng.mong lazada tẩy chay hàng này",2018-11-09 23:12:56,2018-11-06 13:43:28
lazada.vn,https://www.lazada.vn/products/dtdd-1280-ban-le-gia-si-sieu-ben-bao-hanh-1-doi-1-den-i248448099-s324986457.html?search=1,248448099,1, tệ.!! ko nên mua.....mua về lắp sim vào gọi thử thì Lòa dè ko nghe gì được....còn mà hình thì nhòe xuất hiện kẻ ngang trên màn hình đọc tin nhân ko được ,2018-11-29 16:09:07,2018-11-19 23:58:38
lazada.vn,https://www.lazada.vn/products/dtdd-1280-ban-le-gia-si-sieu-ben-bao-hanh-1-doi-1-den-i248448099-s324986457.html?search=1,248448099,5," điện thoại rất khoẻ, rớt 2 lần mà gắn vào xài bình thường, máy nghe gọi tốt, tiện lợi. đt đáng tiền mua thật",2018-11-14 17:03:13,2018-11-07 09:47:13
lazada.vn,https://www.lazada.vn/products/dtdd-1280-ban-le-gia-si-sieu-ben-bao-hanh-1-doi-1-den-i248448099-s324986457.html?search=1,248448099,5," sản phẩm chất lượng, máy mới nguyên tem. nghe gọi rõ ràng, đủ pin sạc. Mong là dùng được bền lâu, hiện tại bây giờ thấy khá hài lòng",2018-11-05 08:35:02,2018-11-03 06:26:40
lazada.vn,https://www.lazada.vn/products/dtdd-1280-ban-le-gia-si-sieu-ben-bao-hanh-1-doi-1-den-i248448099-s324986457.html?search=1,248448099,5," mới đặt hôm qua nay đã có hàng, khui hộp thấy máy mới nguyên có tem bảo hành đàng hoàng, loa lớn nghe gọi ổn. Pin thì tầm trung chủ yếu là mua máy main zin xài, dùng được 1-2 ngày. nói chung là đáng đồng tiền bỏ ra.",2018-11-07 05:31:55,2018-11-05 04:16:11
lazada.vn,https://www.lazada.vn/products/dtdd-1280-ban-le-gia-si-sieu-ben-bao-hanh-1-doi-1-den-i248448099-s324986457.html?search=1,248448099,3," điện thoại dùng được, pin cũng lâu hết, 2 ngày mới hết nhưng hết pin sạt lại không đc, vẫn có tín hiệu pin vào, nhấp nháy nhưng không lên pin, sạt cả đêm ngày vẫn cứ thế,  cứ tí là báo ""tút"" pin yếu.....phải tháo pin ra sạt rời mới đc. không hài lòng",2018-11-17 06:28:51,2018-11-07 07:34:34
lazada.vn,https://www.lazada.vn/products/dtdd-1280-ban-le-gia-si-sieu-ben-bao-hanh-1-doi-1-den-i248448099-s324986457.html?search=1,248448099,1, Máy trung quốc.loa dè không nghe được.,2018-11-29 14:00:30,2018-11-24 06:39:58
lazada.vn,https://www.lazada.vn/products/dtdd-1280-ban-le-gia-si-sieu-ben-bao-hanh-1-doi-1-den-i248448099-s324986457.html?search=1,248448099,1, hàng trung quốc sài đc 3 ngày hư mẹ luôn,2018-11-28 13:07:44,2018-11-09 11:32:57
lazada.vn,https://www.lazada.vn/products/dtdd-1280-ban-le-gia-si-sieu-ben-bao-hanh-1-doi-1-den-i248448099-s324986457.html?search=1,248448099,1, dt tq k nen mua,2018-11-20 23:20:06,2018-11-10 01:52:30
lazada.vn,https://www.lazada.vn/products/dtdd-1280-ban-le-gia-si-sieu-ben-bao-hanh-1-doi-1-den-i248448099-s324986457.html?search=1,248448099,5, Ve sai dc 2 ngay k len nguon nua la sao,2018-12-02 00:00:06,2018-11-26 09:26:32
lazada.vn,https://www.lazada.vn/products/dtdd-1280-ban-le-gia-si-sieu-ben-bao-hanh-1-doi-1-den-i248448099-s324986457.html?search=1,248448099,1," dt moi mua ve xài duoc vai ngay, gio bi tắt nguồn luôn roi. xạc bin vo xíu lai bi tắt nguồn. ",2018-11-12 01:43:58,2018-11-05 14:47:31
lazada.vn,https://www.lazada.vn/products/dtdd-1280-ban-le-gia-si-sieu-ben-bao-hanh-1-doi-1-den-i248448099-s324986457.html?search=1,248448099,4, hang xai đc nhung ko biet sau này the nào,2018-11-16 15:47:40,2018-11-13 02:04:24
lazada.vn,https://www.lazada.vn/products/dtdd-1280-ban-le-gia-si-sieu-ben-bao-hanh-1-doi-1-den-i248448099-s324986457.html?search=1,248448099,5, mua về xài không được,2018-11-28 02:27:59,2018-11-12 16:39:35
lazada.vn,https://www.lazada.vn/products/dtdd-1280-ban-le-gia-si-sieu-ben-bao-hanh-1-doi-1-den-i248448099-s324986457.html?search=1,248448099,2, dài tạm dc... ,2018-11-17 06:26:13,2018-11-11 12:07:08
lazada.vn,https://www.lazada.vn/products/dtdd-1280-ban-le-gia-si-sieu-ben-bao-hanh-1-doi-1-den-i248448099-s324986457.html?search=1,248448099,5," nghe gọi to rõ, kết nối mạng tốt. đủ chức năng như mô tả. rấ đáng tiền",2018-11-15 07:30:59,2018-11-08 07:26:54
lazada.vn,https://www.lazada.vn/products/dtdd-1280-ban-le-gia-si-sieu-ben-bao-hanh-1-doi-1-den-i248448099-s324986457.html?search=1,248448099,4, nhìn đẹp hình thức ok hết còn đâu chưa xài thử chưa biết ,2018-11-15 07:12:35,2018-11-09 03:43:00
lazada.vn,https://www.lazada.vn/products/dtdd-1280-ban-le-gia-si-sieu-ben-bao-hanh-1-doi-1-den-i248448099-s324986457.html?search=1,248448099,5," sản phẩm ok, còn nguyên team và đặc biệt giao hàng nhanh...uy tín",2018-11-09 08:23:49,2018-11-07 12:33:28
lazada.vn,https://www.lazada.vn/products/dtdd-1280-ban-le-gia-si-sieu-ben-bao-hanh-1-doi-1-den-i248448099-s324986457.html?search=1,248448099,5, hang tốt ,2018-11-12 07:25:19,2018-11-09 12:44:05
lazada.vn,https://www.lazada.vn/products/xiaomi-mi-6x-64gb-ram-6gb-kim-nhung-den-hang-nhap-khau-op-lung-cuong-luc-tai-nghe-i211416791-s264644968.html?search=1,211416791,5,"hàng rất ok sai 2 ngay rui thay cung ok. nhung dang sai tieng anh chua cai tv dc thay cung hoi kho khan ti
	Giao hàng đúng như mô tả, đóng gói bao bì tốt
",2018-07-16 12:04:35,2018-07-10 17:04:11
lazada.vn,https://www.lazada.vn/products/xiaomi-mi-6x-64gb-ram-6gb-kim-nhung-den-hang-nhap-khau-op-lung-cuong-luc-tai-nghe-i211416791-s264644968.html?search=1,211416791,5, kính cường lực không phải của mi6x,2018-11-26 15:42:41,2018-11-03 00:54:42
lazada.vn,https://www.lazada.vn/products/xiaomi-mi-6x-64gb-ram-6gb-kim-nhung-den-hang-nhap-khau-op-lung-cuong-luc-tai-nghe-i211416791-s264644968.html?search=1,211416791,5," 	nhận hàng đúng hạn, sản phẩm nhận được nguyên seal, đẹp đầy đủ phụ kiện. sản phẩm rất đáng để mua.
",2018-07-16 12:00:55,2018-07-10 18:04:38
lazada.vn,https://www.lazada.vn/products/xiaomi-mi-6x-64gb-ram-6gb-kim-nhung-den-hang-nhap-khau-op-lung-cuong-luc-tai-nghe-i211416791-s264644968.html?search=1,211416791,5," máy đẹp, xài mượt, pin trâu. chịu",2018-11-18 12:00:31,2018-07-08 01:43:24
lazada.vn,https://www.lazada.vn/products/xiaomi-mi-6x-64gb-ram-6gb-kim-nhung-den-hang-nhap-khau-op-lung-cuong-luc-tai-nghe-i211416791-s264644968.html?search=1,211416791,1," Giao hàng xong gọi cho số ở phiếu bảo hành thì sai số , gọi  số khác  gọi được thì ko ai nghe máy và k gọi lại hỗ trợ. ",2018-10-23 14:19:05,2018-10-21 07:43:50
lazada.vn,https://www.lazada.vn/products/xiaomi-mi-6x-64gb-ram-6gb-kim-nhung-den-hang-nhap-khau-op-lung-cuong-luc-tai-nghe-i211416791-s264644968.html?search=1,211416791,5, Mua hàng hôm 9 tháng 9 với giá 4tr500 thật sự rất hài lòng cảm ơn shop,2018-11-13 17:26:09,2018-09-09 16:46:36
lazada.vn,https://www.lazada.vn/products/xiaomi-mi-6x-64gb-ram-6gb-kim-nhung-den-hang-nhap-khau-op-lung-cuong-luc-tai-nghe-i211416791-s264644968.html?search=1,211416791,5," nhận máy đc 2 bửa thấy xài cũng ok, mà việc cài tiếng Việt hơi phiền, phải đợi 15 ngày sau mới làm đc.",2018-08-20 06:13:00,2018-08-13 01:42:11
lazada.vn,https://www.lazada.vn/products/xiaomi-mi-6x-64gb-ram-6gb-kim-nhung-den-hang-nhap-khau-op-lung-cuong-luc-tai-nghe-i211416791-s264644968.html?search=1,211416791,4," Shop tư vấn nhiệt tình. Đóng gói cẩn thận. Chất lượng sản phẩm đúng như mô tả.
	sai 2 ngay rui thay cung ok. nhung dang sai tieng anh chua cai tv dc thay cung hoi kho khan ti
	Giao hàng đúng như mô tả, đóng gói bao bì tốt",2018-07-16 12:14:38,2018-07-10 18:43:41
lazada.vn,https://www.lazada.vn/products/xiaomi-mi-6x-64gb-ram-6gb-kim-nhung-den-hang-nhap-khau-op-lung-cuong-luc-tai-nghe-i211416791-s264644968.html?search=1,211416791,4," Tôi nhận được sản phẩm có ngoại quang giống quảng cáo như hình. Đầy đủ đồ khuyến mãi. Tất cả đều hoạt động tốt. Shop tư vấn nhiệt tình. Giải quyết hậu mãi nhanh gọn
	hàng nguyên siu đầy đủ phụ kiện kèm theo máy chấtlượng nói chung là OK sẽ ủng hộ lazada nhiều",2018-07-16 12:13:46,2018-07-10 18:37:46
lazada.vn,https://www.lazada.vn/products/xiaomi-mi-6x-64gb-ram-6gb-kim-nhung-den-hang-nhap-khau-op-lung-cuong-luc-tai-nghe-i211416791-s264644968.html?search=1,211416791,3," nhận hàng đúng hạn, sản phẩm nhận được nguyên seal, đẹp đầy đủ phụ kiện. sản phẩm rất đáng để mua.
	Sản phẩm nguyên seal rất hài lòng, có tai nghe cũng rất đẹp và hộp cường lực để tự dán cho máy, vừa mua xong thì giảm 100k",2018-07-16 12:12:59,2018-07-10 18:32:29
lazada.vn,https://www.lazada.vn/products/xiaomi-mi-6x-64gb-ram-6gb-kim-nhung-den-hang-nhap-khau-op-lung-cuong-luc-tai-nghe-i211416791-s264644968.html?search=1,211416791,5," Ưu điểm: máy đẹp, pin trâu, chip xử lý nhanh. Chụp hình bình thường Nhược điểm: ram 3Gb mà mặc định trống còn có 1,5GB. Cài tiếng Việt hơi phức tạp (cái này do mình yêu cầu thôi) (seal chỉ là một màng nylon bao bọc cái hộp) Máy kèm 1 ốp nhựa đen trong suốt, 1 cường lực và tai nghe rất đẹp.",2018-07-16 12:12:14,2018-07-10 18:26:28
lazada.vn,https://www.lazada.vn/products/xiaomi-mi-6x-64gb-ram-6gb-kim-nhung-den-hang-nhap-khau-op-lung-cuong-luc-tai-nghe-i211416791-s264644968.html?search=1,211416791,5," 	Minh moi nhan hang. Phai noi la qua ok. Dt rat muot, dep lam luon. Chi co dieu la ve phai tu cai CH play va nhung ung dung khac. Tai vi chu yeu la phan mem cua TQ. Pin trau nua. Noi chung la rat hai long

",2018-07-16 12:11:30,2018-07-10 18:21:28
lazada.vn,https://www.lazada.vn/products/xiaomi-mi-6x-64gb-ram-6gb-kim-nhung-den-hang-nhap-khau-op-lung-cuong-luc-tai-nghe-i211416791-s264644968.html?search=1,211416791,4," Máy khá đẹp, chất lượng ban đầu tốt. nhưng khâu giao hàng lâu, và nếu ai không rành về điện thoại thì không nên mua bảng xách tay nhé, cài đủ thứ mới dùng được. mình thì cảm thấy hài lòng với SP này. ",2018-07-16 12:10:09,2018-07-10 18:14:00
lazada.vn,https://www.lazada.vn/products/xiaomi-mi-6x-64gb-ram-6gb-kim-nhung-den-hang-nhap-khau-op-lung-cuong-luc-tai-nghe-i211416791-s264644968.html?search=1,211416791,5," Máy khá đẹp, chất lượng ban đầu tốt. nhưng khâu giao hàng lâu, và nếu ai không rành về điện thoại thì không nên mua bảng xách tay nhé, cài đủ thứ mới dùng được. mình thì cảm thấy hài lòng với SP này. ",2018-07-16 12:07:24,2018-07-10 17:55:07
lazada.vn,https://www.lazada.vn/products/xiaomi-mi-6x-64gb-ram-6gb-kim-nhung-den-hang-nhap-khau-op-lung-cuong-luc-tai-nghe-i211416791-s264644968.html?search=1,211416791,5," hàng nguyên siu đầy đủ phụ kiện kèm theo máy chấtlượng nói chung là OK sẽ ủng hộ lazada nhiều
	Shop tư vấn nhiệt tình. Đóng gói cẩn thận. Chất lượng sản phẩm đúng như mô tả.",2018-07-16 12:06:27,2018-07-10 17:51:06
lazada.vn,https://www.lazada.vn/products/xiaomi-mi-6x-64gb-ram-6gb-kim-nhung-den-hang-nhap-khau-op-lung-cuong-luc-tai-nghe-i211416791-s264644968.html?search=1,211416791,5, Đặt hàng 3 ngày là nhận được máy Máy giao đúng yêu cầu nguyên seal Không móp méo trầy xướt Hiện dùng không lỗi lầm hay đơ,2018-07-16 11:59:36,2018-07-10 17:59:04
lazada.vn,https://www.lazada.vn/products/xiaomi-mi-6x-64gb-ram-6gb-kim-nhung-den-hang-nhap-khau-op-lung-cuong-luc-tai-nghe-i211416791-s264644968.html?search=1,211416791,5," 
	Máy dùng ổn. Chưa phát hiện lỗi. Rom Tàu nên hơi khó xài. Hi vọng sẽ up rom Việt Nam Sớm. Cường lực quá kém, giống như tặng cường lực không phải của máy này vậy.
",2018-07-16 11:57:15,2018-07-10 17:50:49
lazada.vn,https://www.lazada.vn/products/xiaomi-mi-6x-64gb-ram-6gb-kim-nhung-den-hang-nhap-khau-op-lung-cuong-luc-tai-nghe-i211416791-s264644968.html?search=1,211416791,5," 	Máy dùng ổn. Chưa phát hiện lỗi. Rom Tàu nên hơi khó xài. Hi vọng sẽ up rom Việt Nam Sớm. Cường lực quá kém, giống như tặng cường lực không phải của máy này vậy.
",2018-07-16 11:56:11,2018-07-10 17:25:26
lazada.vn,https://www.lazada.vn/products/xiaomi-mi-6x-64gb-ram-6gb-kim-nhung-den-hang-nhap-khau-op-lung-cuong-luc-tai-nghe-i211416791-s264644968.html?search=1,211416791,5," 	Máy khá đẹp, chất lượng ban đầu tốt. nhưng khâu giao hàng lâu, và nếu ai không rành về điện thoại thì không nên mua bảng xách tay nhé, cài đủ thứ mới dùng được. mình thì cảm thấy hài lòng với SP này. 
",2018-07-16 11:55:30,2018-07-10 17:16:44
lazada.vn,https://www.lazada.vn/products/xiaomi-mi-6x-64gb-ram-6gb-kim-nhung-den-hang-nhap-khau-op-lung-cuong-luc-tai-nghe-i211416791-s264644968.html?search=1,211416791,5," Shop tư vấn nhiệt tình. Đóng gói cẩn thận. Chất lượng sản phẩm đúng như mô tả.
  Shop tư vấn nhiệt tình. Đóng gói cẩn thận. Chất lượng sản phẩm đúng như mô tả.
",2018-07-17 03:43:01,2018-07-10 18:43:22
lazada.vn,https://www.lazada.vn/products/xiaomi-mi-6x-64gb-ram-6gb-kim-nhung-den-hang-nhap-khau-op-lung-cuong-luc-tai-nghe-i211416791-s264644968.html?search=1,211416791,5," Thời gian giao hàng hơi chậm
",2018-09-17 08:18:29,2018-09-09 15:40:59
lazada.vn,https://www.lazada.vn/products/xiaomi-mi-6x-64gb-ram-6gb-kim-nhung-den-hang-nhap-khau-op-lung-cuong-luc-tai-nghe-i211416791-s264644968.html?search=1,211416791,4, hàng nguyên seal. giao chuẩn,2018-09-12 09:28:55,2018-09-07 01:51:00
lazada.vn,https://www.lazada.vn/products/xiaomi-mi-6x-64gb-ram-6gb-kim-nhung-den-hang-nhap-khau-op-lung-cuong-luc-tai-nghe-i211416791-s264644968.html?search=1,211416791,1, Cho tai nghe dỏm mà cũng cho. ,2018-09-11 05:24:50,2018-09-06 03:00:54
lazada.vn,https://www.lazada.vn/products/xiaomi-mi-6x-64gb-ram-6gb-kim-nhung-den-hang-nhap-khau-op-lung-cuong-luc-tai-nghe-i211416791-s264644968.html?search=1,211416791,3, Không có tiếng việt . mình k biết unlock để 15 ngày sau up rum.mà cũng k biết up rum kiểu gì.c,2018-07-16 12:08:16,2018-07-10 17:59:51
lazada.vn,https://www.lazada.vn/products/xiaomi-mi-6x-64gb-ram-6gb-kim-nhung-den-hang-nhap-khau-op-lung-cuong-luc-tai-nghe-i211416791-s264644968.html?search=1,211416791,5," 	Giao hàng nhanh đóng gói cẩn thận đúng yêu cầu. Tuyệt vời
",2018-07-16 11:59:03,2018-07-10 17:56:27
lazada.vn,https://www.lazada.vn/products/xiaomi-mi-6x-64gb-ram-6gb-kim-nhung-den-hang-nhap-khau-op-lung-cuong-luc-tai-nghe-i211416791-s264644968.html?search=1,211416791,5,Gold Đóng gói kỹ..hàng oke😀,2018-07-03 13:05:44,2018-06-29 08:49:09
lazada.vn,https://www.lazada.vn/products/xiaomi-mi-6x-64gb-ram-6gb-kim-nhung-den-hang-nhap-khau-op-lung-cuong-luc-tai-nghe-i211416791-s264644968.html?search=1,211416791,5,"giao hàng nhanh, tai nghe hơi tệ ",2018-08-06 09:19:03,2018-08-02 01:51:25
lazada.vn,https://www.lazada.vn/products/xiaomi-mi-6x-64gb-ram-6gb-kim-nhung-den-hang-nhap-khau-op-lung-cuong-luc-tai-nghe-i211416791-s264644968.html?search=1,211416791,5," hàng nguyên siu đầy đủ phụ kiện kèm theo máy chấtlượng nói chung là OK sẽ ủng hộ lazada nhiều
 ",2018-07-17 03:42:17,2018-07-10 18:36:43
lazada.vn,https://www.lazada.vn/products/xiaomi-mi-6x-64gb-ram-6gb-kim-nhung-den-hang-nhap-khau-op-lung-cuong-luc-tai-nghe-i211416791-s264644968.html?search=1,211416791,5,"Không có tiếng việt . mình k biết unlock để 15 ngày sau up rum.mà cũng k biết up rum kiểu gì.c
 ",2018-07-17 03:41:36,2018-07-10 18:29:15
lazada.vn,https://www.lazada.vn/products/xiaomi-mi-6x-64gb-ram-6gb-kim-nhung-den-hang-nhap-khau-op-lung-cuong-luc-tai-nghe-i211416791-s264644968.html?search=1,211416791,3, hàng đẹp,2018-07-16 12:09:04,2018-07-10 18:05:19
lazada.vn,https://www.lazada.vn/products/lenovo-z5-lenovoz5-tai-tho-2018-64gb-ram-6gb-kim-nhung-hang-nhap-khau-i236971724-s302483596.html?search=1,236971724,5," Máy đẹp tuyệt vời, đang test xem sao thank shop nhe",2018-11-29 16:31:10,2018-11-27 07:15:33
lazada.vn,https://www.lazada.vn/products/dien-thoai-oppo-a3s-ram-2gb-rom-16gb-hang-phan-phoi-chinh-thuc-i239671845-s306129543.html?search=1,239671845,5, Hàng đẹp như ảnh,2018-10-04 10:43:48,2018-09-29 04:49:24
lazada.vn,https://www.lazada.vn/products/dien-thoai-oppo-a3s-ram-2gb-rom-16gb-hang-phan-phoi-chinh-thuc-i239671845-s306129543.html?search=1,239671845,5, Máy rất ok nhé đóng hộp cẩn thận... Giao hàng rất nhanh.. Mỗi tội thiếu tai nge :(,2018-10-19 16:02:27,2018-10-10 10:09:05
lazada.vn,https://www.lazada.vn/products/dien-thoai-asus-zenfone-4a-ram-3gb32gb-pin-4100mha-fullbox-hang-nhap-khau-i245884209-s315549364.html?search=1,245884209,5," Đã nhận được hàng, sản phẩm mới dùng khoảng 5h thấy hài lòng.",2018-11-29 15:06:26,2018-11-26 03:32:53
lazada.vn,https://www.lazada.vn/products/dien-thoai-asus-zenfone-4a-ram-3gb32gb-pin-4100mha-fullbox-hang-nhap-khau-i245884209-s315549364.html?search=1,245884209,5, dùng được một tuần hàng đẹp máy mạnh,2018-10-19 08:48:12,2018-10-08 08:11:04
lazada.vn,https://www.lazada.vn/products/dien-thoai-smartphone-lv6-man-hinh-rong-ket-noi-wifi3g-toc-do-cao-bao-hanh-12-thang-full-box-tang-kem-op-lung-i213251157-s267071818.html?search=1,213251157,5, hàng bị lôi có nhiều kẻ sọc và màn hình rất mờ tôi muốn đổi sản pham khác,2018-11-20 05:09:31,2018-11-11 03:54:15
lazada.vn,https://www.lazada.vn/products/dien-thoai-smartphone-lv6-man-hinh-rong-ket-noi-wifi3g-toc-do-cao-bao-hanh-12-thang-full-box-tang-kem-op-lung-i213251157-s267071818.html?search=1,213251157,4," Xài rất là mượt mà nhưng hơi khó ân vỉ lâu lâu ấn nó không đc ăn cho lắm,nhưng không sao
Có lẽ trong tương lai mình sẽ đặt thêm",2018-10-19 06:33:46,2018-10-16 11:33:59
lazada.vn,https://www.lazada.vn/products/dien-thoai-smartphone-lv6-man-hinh-rong-ket-noi-wifi3g-toc-do-cao-bao-hanh-12-thang-full-box-tang-kem-op-lung-i213251157-s267071818.html?search=1,213251157,2,nhanh het pin  đt còn 45% pin  khỏi động lại còn 7 ℅ pin,2018-07-14 05:41:19,2018-07-10 07:38:08
lazada.vn,https://www.lazada.vn/products/dien-thoai-smartphone-lv6-man-hinh-rong-ket-noi-wifi3g-toc-do-cao-bao-hanh-12-thang-full-box-tang-kem-op-lung-i213251157-s267071818.html?search=1,213251157,1, làm ăn như cc giao đt lỗi rồi đổi trả ko đuợc,2018-09-10 10:02:52,2018-09-02 12:44:01
lazada.vn,https://www.lazada.vn/products/xiaomi-mi-8-lite-128gb-ram-6gb-hang-phan-phoi-chinh-thuc-i248734228-s326545024.html?search=1,248734228,5," Hàng nguyên seal như cam kết, giao hàng tương đối nhanh. Hài lòng.",2018-11-20 16:36:56,2018-11-11 16:57:25
lazada.vn,https://www.lazada.vn/products/fujitsu-docomo-regza-moi-100-13mp-van-tay-chong-nuoc-i105973818-s138101340.html?search=1,105973818,3,"Mới nhận hàng hồi chiều... Mình xem Youtube thì bị treo... Tắt ứng dụng trong quản lý ứng dụng thì máy luôn hiện lên thông báo ""Youtube đã dừng"" ở màn hình chính. Tắt đi lại hiện lên lại ... Sau một hồi quay tay miệt mài để bật lại ứng dụng thì máy đã trở lại trạng thái bình thường... Bản ROM này ko được ổn định lắm....",2017-11-23 18:23:30,2017-11-18 22:21:54
lazada.vn,https://www.lazada.vn/products/fujitsu-docomo-regza-moi-100-13mp-van-tay-chong-nuoc-i105973818-s138101340.html?search=1,105973818,2, Hang cu pin het mot cach la thuong.,2018-11-14 12:29:45,2017-12-13 13:59:05
lazada.vn,https://www.lazada.vn/products/fujitsu-docomo-regza-moi-100-13mp-van-tay-chong-nuoc-i105973818-s138101340.html?search=1,105973818,3,"Cũng ok Chiếc đt này nhanh nóng máy với có hiện tượng pin ảo, rất dễ tuột pin
Xài cũng tạm ổn
Lúc đầu tưởng xài pin lâu, nên mua đt nhỏ gọn này sơ cua nhưng mà thấy mau hao pin quá",2017-10-18 10:13:05,2017-10-07 04:21:51
lazada.vn,https://www.lazada.vn/products/fujitsu-docomo-regza-moi-100-13mp-van-tay-chong-nuoc-i105973818-s138101340.html?search=1,105973818,1,"Quá dở Mau hết pin, cảm biến vân tay chậm, CH play vào ko đc...",2018-05-12 15:23:43,2018-04-27 02:59:34
lazada.vn,https://www.lazada.vn/products/fujitsu-docomo-regza-moi-100-13mp-van-tay-chong-nuoc-i105973818-s138101340.html?search=1,105973818,1,giao hàng chậm máy bị lỗi hệ thống gọi nhiều cuộc 19001007 xin đổi trả không nhấc máy!,2017-10-27 02:47:37,2017-10-21 16:52:59
lazada.vn,https://www.lazada.vn/products/fujitsu-docomo-regza-moi-100-13mp-van-tay-chong-nuoc-i105973818-s138101340.html?search=1,105973818,4,Fcff May co tai Duoc ung dung khong,2017-11-14 08:46:07,
lazada.vn,https://www.lazada.vn/products/fujitsu-docomo-regza-moi-100-13mp-van-tay-chong-nuoc-i105973818-s138101340.html?search=1,105973818,4, sản phẩm tốt. đúng mô tả. nhưng dung lượng pin hơi ít.,2017-10-27 00:50:35,2017-10-12 23:07:34
lazada.vn,https://www.lazada.vn/products/fujitsu-docomo-regza-moi-100-13mp-van-tay-chong-nuoc-i105973818-s138101340.html?search=1,105973818,5,Ok Có sài dc wifi ko shop .cai nay chói dc thien long bác bo 3d ko,2017-10-14 03:06:25,
lazada.vn,https://www.lazada.vn/products/fujitsu-docomo-regza-moi-100-13mp-van-tay-chong-nuoc-i105973818-s138101340.html?search=1,105973818,1,"Một sao Chất lượng quá kém, chỉ để nghe gọi thôi chứ k vào mạng được",2017-12-26 08:49:32,2017-12-14 06:16:58
lazada.vn,https://www.lazada.vn/products/fujitsu-docomo-regza-moi-100-13mp-van-tay-chong-nuoc-i105973818-s138101340.html?search=1,105973818,5,ok ngon trong giá tiền,2017-10-04 10:14:55,
lazada.vn,https://www.lazada.vn/products/fujitsu-docomo-regza-moi-100-13mp-van-tay-chong-nuoc-i105973818-s138101340.html?search=1,105973818,5," sp đẹp, tốt trong tầm giá .tuy nhiên danh bạ ko nhập được tiếng việt .giao hàng nhanh.",2018-07-14 06:21:43,2018-07-10 00:38:22
lazada.vn,https://www.lazada.vn/products/fujitsu-docomo-regza-moi-100-13mp-van-tay-chong-nuoc-i105973818-s138101340.html?search=1,105973818,1,mao het pin dung thi k cam dc 3h. mua r nan,2018-01-11 15:51:04,2017-12-25 13:27:07
lazada.vn,https://www.lazada.vn/products/fujitsu-docomo-regza-moi-100-13mp-van-tay-chong-nuoc-i105973818-s138101340.html?search=1,105973818,3, Pin khong duoc lau va bat song kem,2017-11-29 23:16:35,2017-11-23 05:47:25
lazada.vn,https://www.lazada.vn/products/fujitsu-docomo-regza-moi-100-13mp-van-tay-chong-nuoc-i105973818-s138101340.html?search=1,105973818,3,F08d Gọi nghe rất OK pin yếu sóng không khỏe rất yếu,2017-12-11 12:41:07,2017-11-02 05:35:12
lazada.vn,https://www.lazada.vn/products/fujitsu-docomo-regza-moi-100-13mp-van-tay-chong-nuoc-i105973818-s138101340.html?search=1,105973818,2,"Pin quá kém, phụ kiện kèn theo không đúng manual. Pin quá kém, phụ kiện kèn theo không đúng manual.",2018-01-10 10:23:00,2017-12-01 08:45:42
lazada.vn,https://www.lazada.vn/products/fujitsu-docomo-regza-moi-100-13mp-van-tay-chong-nuoc-i105973818-s138101340.html?search=1,105973818,1,Khá tệ Pin tuột rất nhanh :(((((,2017-12-05 16:26:12,2017-11-10 14:47:46
lazada.vn,https://www.lazada.vn/products/fujitsu-docomo-regza-moi-100-13mp-van-tay-chong-nuoc-i105973818-s138101340.html?search=1,105973818,4,"Nhiều chức năng, dùng tốt nhưng cũng dể trầy vỏ ",2018-03-28 06:07:29,2017-12-12 10:40:13
lazada.vn,https://www.lazada.vn/products/dien-thoai-zip8-2-sim-hang-chinh-hang-bao-hanh-12-thang-tang-op-lung-i143195850-s147968963.html?search=1,143195850,1," các bạn đừng thấy rẻ đẹp mà mua...điện thoại mua về sử dụng chưa được 3 ngày thì đủ thứ lỗi....đang sử dụng chỉ cần mình lướt nhanh là tự động đơ máy,không tắt nguồn không tắt màn hình được....xài được 2 ngày thì báo dừng ứng dụng...rồi khôi phục cài đặt gốc thì mấy ngày trời chưa xong....nói chung là xài đéo ổn 
",2018-09-20 06:27:58,2018-09-15 08:59:52
lazada.vn,https://www.lazada.vn/products/dien-thoai-zip8-2-sim-hang-chinh-hang-bao-hanh-12-thang-tang-op-lung-i143195850-s147968963.html?search=1,143195850,1,Hàng dỏm Mọi người đừng có thấy rẻ mà mua mình mới mua hai chiếc về tet thử thì mic bị rè rè điện thoại bên kia ko nghe được gì nếu lỗi lỗi một cái thôi đằng này hai cái đều bị thất vọng vô cùng đợi tới 26/3 mới đổi trả đc,2018-03-21 10:19:44,2018-03-18 02:56:23
lazada.vn,https://www.lazada.vn/products/dien-thoai-zip8-2-sim-hang-chinh-hang-bao-hanh-12-thang-tang-op-lung-i143195850-s147968963.html?search=1,143195850,4,"tốt dùng xem youtobe rất tốt máy hơi lắc khi chơi liên quân nhưng mạng ổn định xem youtobe không bị giật cũng hay. pin máy hơi thấp nên cần cai thiện. 
",2018-05-28 12:24:05,2018-05-13 17:55:46
