Domain,Url,Product_id,Rating,Comment,Review Time,Bought Time
lazada.vn,https://www.lazada.vn/products/xiaomi-mi-4-ram-3gb-hang-nhap-khau-i231738970-s294225775.html?search=1,231738970,5, Tốt,2018-11-24 08:32:24,2018-11-17 12:35:41
lazada.vn,https://www.lazada.vn/products/xiaomi-mi-4-ram-3gb-hang-nhap-khau-i231738970-s294225775.html?search=1,231738970,2," man hinh de khong may be man hinh khi chua su dung  , mong ho tro toi bao hanh man hinh ! thanks",2018-11-01 14:55:55,2018-10-18 10:10:13
lazada.vn,https://www.lazada.vn/products/xiaomi-mi-4-ram-3gb-hang-nhap-khau-i231738970-s294225775.html?search=1,231738970,3, khá ổn trong tầm giá nhưng sóng 3g chưa ổn định nhiều lúc bật không lên,2018-11-01 11:47:05,2018-10-07 22:35:38
lazada.vn,https://www.lazada.vn/products/xiaomi-mi-4-ram-3gb-hang-nhap-khau-i231738970-s294225775.html?search=1,231738970,5, máy dùng ngon,2018-10-26 14:40:03,2018-10-15 23:44:02
lazada.vn,https://www.lazada.vn/products/xiaomi-mi-4-ram-3gb-hang-nhap-khau-i231738970-s294225775.html?search=1,231738970,5," Máy dùng rất tốt, giá cả phải chăng, rất thích hợp cho học sinh sinh viên. Sẽ ghé lại !",2018-10-14 08:22:26,2018-10-05 15:33:33
lazada.vn,https://www.lazada.vn/products/xiaomi-mi-4-ram-3gb-hang-nhap-khau-i231738970-s294225775.html?search=1,231738970,1," Shop bán máy đã được dựng lại
Chứ không phải máy mới 100%
Không hài lòng!!",2018-10-09 05:45:03,2018-10-04 10:34:23
lazada.vn,https://www.lazada.vn/products/xiaomi-mi-4-ram-3gb-hang-nhap-khau-i231738970-s294225775.html?search=1,231738970,5," sản phẩm ok. gửi lần 1 thiếu khay sim, báo shop gửi lại free, còn tặng kèm tai nghe xịn nữa chứ",2018-10-01 10:47:45,2018-09-23 06:41:38
lazada.vn,https://www.lazada.vn/products/xiaomi-mi-4-ram-3gb-hang-nhap-khau-i231738970-s294225775.html?search=1,231738970,5, 5 sao hi vọng nhà bán giữ lời hứa tặng thêm tai nghe,2018-09-28 07:14:37,2018-09-22 19:17:00
lazada.vn,https://www.lazada.vn/products/xiaomi-mi-4-ram-3gb-hang-nhap-khau-i231738970-s294225775.html?search=1,231738970,5, Máy mới như mô tả có điều chế độ chờ pin rất hao qua 1 đêm(6h) từ 68% xuống còn 49%,2018-09-27 04:46:38,2018-09-21 06:11:05
lazada.vn,https://www.lazada.vn/products/xiaomi-mi-4-ram-3gb-hang-nhap-khau-i231738970-s294225775.html?search=1,231738970,5, Hàng tốt. Máy xài hơi nóng nhưng với giá vậy ổn rồi.,2018-09-25 17:55:33,2018-09-06 16:03:15
lazada.vn,https://www.lazada.vn/products/xiaomi-mi-4-ram-3gb-hang-nhap-khau-i231738970-s294225775.html?search=1,231738970,5, Nói chung giá cả hợp lí mà có thể chiến game nặng ngon lành. Có mỗi điểm hay nóng máy thoi,2018-09-25 11:04:22,2018-09-14 09:44:08
lazada.vn,https://www.lazada.vn/products/xiaomi-mi-4-ram-3gb-hang-nhap-khau-i231738970-s294225775.html?search=1,231738970,5, Hàng chuẩn rất đẹp thank shop.,2018-09-23 18:52:36,2018-09-19 07:43:46
lazada.vn,https://www.lazada.vn/products/xiaomi-mi-4-ram-3gb-hang-nhap-khau-i231738970-s294225775.html?search=1,231738970,5," Giao hàng nhanh. Máy dùng đc,  tiếc là ko phải bản 64gb. ",2018-09-23 09:43:06,2018-09-19 22:25:38
lazada.vn,https://www.lazada.vn/products/xiaomi-mi-4-ram-3gb-hang-nhap-khau-i231738970-s294225775.html?search=1,231738970,5, Máy chạy ngon mượt.  Nhưng nhanh hết pin,2018-09-23 07:56:11,2018-09-18 09:09:21
lazada.vn,https://www.lazada.vn/products/xiaomi-mi-4-ram-3gb-hang-nhap-khau-i231738970-s294225775.html?search=1,231738970,5, Hàng đẹp và chất như quảng cáo ,2018-09-22 13:06:38,2018-09-17 06:32:46
lazada.vn,https://www.lazada.vn/products/xiaomi-mi-4-ram-3gb-hang-nhap-khau-i231738970-s294225775.html?search=1,231738970,5, shop làm an rất oke hàng rất đẹp ,2018-09-22 12:06:47,2018-09-15 15:05:56
lazada.vn,https://www.lazada.vn/products/xiaomi-mi-4-ram-3gb-hang-nhap-khau-i231738970-s294225775.html?search=1,231738970,4, Điện thoại thì ok. Bộ sạc thấy rởm rởm sao í. Như hàng lô vậy,2018-09-20 14:06:02,2018-09-17 04:53:31
lazada.vn,https://www.lazada.vn/products/xiaomi-mi-4-ram-3gb-hang-nhap-khau-i231738970-s294225775.html?search=1,231738970,5, Shop phục vụ tốt,2018-09-19 11:02:39,2018-09-13 21:54:17
lazada.vn,https://www.lazada.vn/products/xiaomi-mi-4-ram-3gb-hang-nhap-khau-i231738970-s294225775.html?search=1,231738970,5," Giao hàng đúng hẹn,sp đẹp sài mượt,pin khá trâu.sản phẩm tốt trong tầm giá. bền thì chờ thời gian.",2018-09-19 03:50:40,2018-09-11 10:19:48
lazada.vn,https://www.lazada.vn/products/xiaomi-mi-4-ram-3gb-hang-nhap-khau-i231738970-s294225775.html?search=1,231738970,5, Hàng chấp nhận được ,2018-09-18 04:33:43,2018-09-10 08:11:31
lazada.vn,https://www.lazada.vn/products/xiaomi-mi-4-ram-3gb-hang-nhap-khau-i231738970-s294225775.html?search=1,231738970,5," Máy mới 100%, mình rất hài lòng",2018-09-15 09:45:58,2018-09-06 15:15:59
lazada.vn,https://www.lazada.vn/products/xiaomi-mi-4-ram-3gb-hang-nhap-khau-i231738970-s294225775.html?search=1,231738970,5, sản phẩm tốt. khuyến mại cao,2018-09-14 05:06:10,2018-09-01 09:21:09
lazada.vn,https://www.lazada.vn/products/xiaomi-mi-4-ram-3gb-hang-nhap-khau-i231738970-s294225775.html?search=1,231738970,5, giao đây đủ phụ kiện,2018-09-12 02:41:39,2018-08-18 10:26:36
lazada.vn,https://www.lazada.vn/products/xiaomi-mi-4-ram-3gb-hang-nhap-khau-i231738970-s294225775.html?search=1,231738970,5, Với giá như vậy là 1 lựa chọn quá tuyệt.Chúc shop luôn đắt hàng.,2018-09-11 12:03:29,2018-09-05 15:16:16
lazada.vn,https://www.lazada.vn/products/xiaomi-mi-4-ram-3gb-hang-nhap-khau-i231738970-s294225775.html?search=1,231738970,5, đóng gói cẩn thận. giao hàng đúng ngày,2018-09-07 12:17:44,2018-09-03 12:15:55
lazada.vn,https://www.lazada.vn/products/xiaomi-mi-4-ram-3gb-hang-nhap-khau-i231738970-s294225775.html?search=1,231738970,5, Máy xài tốt lắm ạ,2018-08-31 07:35:01,2018-08-28 04:53:37
lazada.vn,https://www.lazada.vn/products/xiaomi-mi-4-ram-3gb-hang-nhap-khau-i231738970-s294225775.html?search=1,231738970,5," Hàng full box như mô tả, sử dụng tốt, ",2018-08-27 11:44:58,2018-08-19 15:19:22
lazada.vn,https://www.lazada.vn/products/xiaomi-mi-4-ram-3gb-hang-nhap-khau-i231738970-s294225775.html?search=1,231738970,5, Quá tốt so với tầm giá!,2018-08-23 14:57:02,2018-08-20 03:20:43
lazada.vn,https://www.lazada.vn/products/xiaomi-mi-4-ram-3gb-hang-nhap-khau-i231738970-s294225775.html?search=1,231738970,5, sản phẩm tốt,2018-08-23 10:22:49,2018-08-17 12:38:00
lazada.vn,https://www.lazada.vn/products/xiaomi-mi-4-ram-3gb-hang-nhap-khau-i231738970-s294225775.html?search=1,231738970,5, hàng cx ổn so v tầm gía.. shop phuc vụ nhiệt tìn,2018-08-22 11:19:45,2018-08-17 15:30:19
lazada.vn,https://www.lazada.vn/products/xiaomi-mi-4-ram-3gb-hang-nhap-khau-i231738970-s294225775.html?search=1,231738970,5," đóng gói kỹ càng, máy đẹp, chấ lượng ok",2018-08-21 03:41:17,2018-08-17 04:56:08
lazada.vn,https://www.lazada.vn/products/xiaomi-mi-4-ram-3gb-hang-nhap-khau-i231738970-s294225775.html?search=1,231738970,5, ok ngon nên mua tầm giá quá tốt cho 1 sản phẩm,2018-08-17 14:11:39,2018-08-15 05:23:01
lazada.vn,https://www.lazada.vn/products/xiaomi-mi-4-ram-3gb-hang-nhap-khau-i231738970-s294225775.html?search=1,231738970,5, okm,2018-10-10 11:13:25,2018-10-03 03:46:43
lazada.vn,https://www.lazada.vn/products/xiaomi-mi-4-ram-3gb-hang-nhap-khau-i231738970-s294225775.html?search=1,231738970,5, good,2018-10-09 02:44:10,2018-10-02 14:01:04
lazada.vn,https://www.lazada.vn/products/xiaomi-mi-4-ram-3gb-hang-nhap-khau-i231738970-s294225775.html?search=1,231738970,5, Ngon,2018-09-28 05:57:13,2018-09-15 06:38:15
lazada.vn,https://www.lazada.vn/products/xiaomi-mi-4-ram-3gb-hang-nhap-khau-i231738970-s294225775.html?search=1,231738970,5, hàng ok,2018-09-05 04:59:55,2018-08-30 01:25:16
lazada.vn,https://www.lazada.vn/products/xiaomi-mi-4-ram-3gb-hang-nhap-khau-i231738970-s294225775.html?search=1,231738970,5, good,2018-08-31 06:19:17,2018-08-26 13:06:14
lazada.vn,https://www.lazada.vn/products/xiaomi-mi-4-ram-3gb-hang-nhap-khau-i231738970-s294225775.html?search=1,231738970,5, tốt,2018-08-27 15:18:59,2018-08-20 05:14:56
lazada.vn,https://www.lazada.vn/products/xiaomi-mi3-ram-2gb-hang-nhap-khau-i238106279-s303856028.html?search=1,238106279,1," Shop ăn nói có vẻ ngọt nhưng sp giao rất lâu và không có sạc (sạc là sp kèm máy) + tai nghe cho kèm ( hứa). Liên hệ shop nói sẽ freeship cho sp thiếu trong vòng 2 ngày có và mình tracking liên tục vì mua dt cùi bắp để sử dụng cho công việc. Và vì ngại thấy ăn nói dễ thương nên ck trước mua cái tripod giá 90k để gởi kèm sp phải bù thì tới nay là ngày thứ 8 vẫn không thấy sạc đậu nên dt chỉ mượn sạc được 1 lần thử coi lên nguồn ko, hết pin thì quăng xó tới hnay. Ngoài ra, sp cảm ứng cùi, máy chỉ onl chat chat thì đơ, sim về phải dùng dao gọt, nói chung chỉ dc 1 ngày thì hết pin nên ko có thêm nhận xét. Tóm lại, ai mua thấy thiếu đồ yêu cầu lazada cho trả ngay. Đừng nghe lời shop dạ dạ, rồi để qua ngày 8, họ kéo dài thời gian để ko trả dc. Cảm giác cực kì tức giận. Đừng bảo tiền 1tr mấy thì đừng đòi hỏi. Xin thưa, bạn làm ăn thì nên có uy tín dù sp chỉ 1k đồng. Nếu có 0 sao. Tôi sẽ đánh 0 hoặc âm sao ",2018-11-10 20:16:45,2018-10-28 15:15:15
lazada.vn,https://www.lazada.vn/products/xiaomi-mi3-ram-2gb-hang-nhap-khau-i238106279-s303856028.html?search=1,238106279,5," Nhận được hàng trên tay sau bao ngày, cảm nhận đầu tiên là hàng đóng gói ok, kỹ lưỡng, mở máy lên thử cảm nhận thấy khá mượt, màn hình đẹp, cũng ko ngờ tầm giá này mà được máy khá tốt như vậy, điều mình ko ngờ nhất là đc shop tặng kính cường lực vs ốp lưng, bộ sạc sạc chậm nên được shop hỗ trợ bộ sạc mới, nói chung shop khá nhiệt tình, khi nào cần sẽ mua thêm ủng hộ shop",2018-11-03 13:22:35,2018-10-27 06:43:34
lazada.vn,https://www.lazada.vn/products/xiaomi-mi3-ram-2gb-hang-nhap-khau-i238106279-s303856028.html?search=1,238106279,5," Sản phẩm OK, không bàn đến chất lượng vì chưa đủ thời gian kiểm chứng, sạc chết như những gì các khách hàng trước nhận xét nhưng vẫn ổn vì thực ra kiểu sạc này chắc chẳng ai dùng nữa đâu, có một cái không vừa lòng nhưng không liên quan đến shop, đó là bạn shipper không gọi được cho mình mà vẫn đến giao hàng, đưa hoá đơn của mình cho người khác xem, điều này làm mình cảm thấy không vui, chỉ vậy thôi! Thanks shop, cho shop 5 sao vì sản phẩm tốt!",2018-11-14 07:36:20,2018-11-10 17:08:24
lazada.vn,https://www.lazada.vn/products/xiaomi-mi3-ram-2gb-hang-nhap-khau-i238106279-s303856028.html?search=1,238106279,1," Đồ đểu, mua 2 cái trong đó 1 cái đầu tiên pin rất nóng, sau đó thì màn hình đen xì và không thể làm gì được chỉ là cục gạch bỏ đi. Nói chung, không nên mua .",2018-11-11 10:39:00,2018-10-13 03:46:05
lazada.vn,https://www.lazada.vn/products/xiaomi-mi3-ram-2gb-hang-nhap-khau-i238106279-s303856028.html?search=1,238106279,5," Ad ơi, sao mình mua con xiaomi về rồi, mình lấy điện thoại khác gọi vào điện thoại xiaomi thì có 15 giây là nó tự tắt v ad.. mong ad chỉ giùm cho
",2018-09-29 00:28:26,2018-09-24 12:52:26
lazada.vn,https://www.lazada.vn/products/xiaomi-mi3-ram-2gb-hang-nhap-khau-i238106279-s303856028.html?search=1,238106279,1," Ko biết sau này thế nào nhưng giờ dùng thấy rất mượt và tốt. Sản phẩm đóng gói kĩ,  giao hàng tiêu chuẩn.  Chỉ có điều là mình đặt máy màu đen shop lại gửi màu bạc,  xạc ko phải xạc xịn nên xạc hơi lâu,  và ko được tặng kèm ốp lưng và cường lực như mua ở các cửa hàng khác",2018-09-17 14:05:25,2018-09-13 04:19:04
lazada.vn,https://www.lazada.vn/products/xiaomi-mi3-ram-2gb-hang-nhap-khau-i238106279-s303856028.html?search=1,238106279,5, sản phẩm quá chán mới mua dùng được tháng liệt cảm ứng ,2018-11-21 13:32:34,2018-10-08 11:41:50
lazada.vn,https://www.lazada.vn/products/xiaomi-mi3-ram-2gb-hang-nhap-khau-i238106279-s303856028.html?search=1,238106279,5," xài tốt , máy chạy nhanh đúng ram 😍😍",2018-11-15 01:31:20,2018-11-11 08:12:49
lazada.vn,https://www.lazada.vn/products/xiaomi-mi3-ram-2gb-hang-nhap-khau-i238106279-s303856028.html?search=1,238106279,5," Sản phẩm tốt , giá rẻ cho một sản phẩm vượt trội. Shop tư vấn và hỗ trợ tốt. Sẽ giới thiệu cho bạn bè mua ủng hộ shop",2018-10-02 16:18:38,2018-09-22 17:28:35
lazada.vn,https://www.lazada.vn/products/xiaomi-mi3-ram-2gb-hang-nhap-khau-i238106279-s303856028.html?search=1,238106279,3, Hàng dùng tốt. Chỉ mỗi cái sạc là đểu. Mua 2 cái điện thoại thì gặp 2 cái sạc đểu.  Sạc cả buổi ko đầy,2018-09-29 04:07:38,2018-09-24 16:15:59
lazada.vn,https://www.lazada.vn/products/xiaomi-mi3-ram-2gb-hang-nhap-khau-i238106279-s303856028.html?search=1,238106279,4," máy ngon dùng ok. bị lỗi nhẹ phần dây sạc và shop có hỗ trợ sạc mới
Mua hàng màu đen mà shop lại giao cho màu xám",2018-09-18 14:15:14,2018-09-11 06:17:49
lazada.vn,https://www.lazada.vn/products/xiaomi-mi3-ram-2gb-hang-nhap-khau-i238106279-s303856028.html?search=1,238106279,4, may duoc..nhung ko hai long ve bin..voi muc gia nay thi co the chap nhan duoc..,2018-11-03 05:26:06,2018-10-29 19:32:04
lazada.vn,https://www.lazada.vn/products/xiaomi-mi3-ram-2gb-hang-nhap-khau-i238106279-s303856028.html?search=1,238106279,2, Hàng da qua su dung. Pin mau tuột. So imei ko trung voi may. ,2018-10-31 13:34:28,2018-10-24 01:12:33
lazada.vn,https://www.lazada.vn/products/xiaomi-mi3-ram-2gb-hang-nhap-khau-i238106279-s303856028.html?search=1,238106279,5," Dùng rất tốt, rất mượt mà",2018-09-07 13:28:20,2018-09-04 05:38:57
lazada.vn,https://www.lazada.vn/products/xiaomi-mi3-ram-2gb-hang-nhap-khau-i238106279-s303856028.html?search=1,238106279,4, máy dùng ok mỗi tội pin hơi giấy ,2018-10-30 07:11:32,2018-10-26 22:57:57
lazada.vn,https://www.lazada.vn/products/xiaomi-mi3-ram-2gb-hang-nhap-khau-i238106279-s303856028.html?search=1,238106279,4, máy không phải mới tinh ,2018-10-28 01:44:54,2018-09-16 15:37:38
lazada.vn,https://www.lazada.vn/products/xiaomi-mi3-ram-2gb-hang-nhap-khau-i238106279-s303856028.html?search=1,238106279,1, May mua ve duoc mot ngay la hong,2018-10-21 11:56:34,2018-10-16 09:27:58
lazada.vn,https://www.lazada.vn/products/xiaomi-mi3-ram-2gb-hang-nhap-khau-i238106279-s303856028.html?search=1,238106279,5," Máy đẹp, giống như quảng cáo, giá cả hợp lý. Tôi rất hài lòng. cảm ơn nhà bán hàng.",2018-09-21 09:38:16,2018-09-19 06:03:37
lazada.vn,https://www.lazada.vn/products/xiaomi-mi3-ram-2gb-hang-nhap-khau-i238106279-s303856028.html?search=1,238106279,1," Máy đểu , vừa được 2 ngày đã hỏng pin làm tôn mat 300k",2018-09-19 22:41:06,2018-09-05 00:57:35
lazada.vn,https://www.lazada.vn/products/xiaomi-mi3-ram-2gb-hang-nhap-khau-i238106279-s303856028.html?search=1,238106279,5, Ok,2018-11-16 15:32:55,2018-11-11 11:16:18
lazada.vn,https://www.lazada.vn/products/xiaomi-mi3-ram-2gb-hang-nhap-khau-i238106279-s303856028.html?search=1,238106279,5, rất hài lòng về tính năng của điện thoại ,2018-10-30 15:32:32,2018-10-22 08:05:19
lazada.vn,https://www.lazada.vn/products/xiaomi-mi3-ram-2gb-hang-nhap-khau-i238106279-s303856028.html?search=1,238106279,5, Lấy về quay tay dc,2018-10-19 05:01:49,2018-10-14 03:39:54
lazada.vn,https://www.lazada.vn/products/xiaomi-mi3-ram-2gb-hang-nhap-khau-i238106279-s303856028.html?search=1,238106279,5, Quá tốt trong tầm giá,2018-10-13 12:18:50,2018-10-07 02:37:13
lazada.vn,https://www.lazada.vn/products/xiaomi-mi3-ram-2gb-hang-nhap-khau-i238106279-s303856028.html?search=1,238106279,5, Rất tốt cam ứng mượt. ,2018-10-06 05:40:22,2018-09-28 03:22:59
lazada.vn,https://www.lazada.vn/products/xiaomi-mi3-ram-2gb-hang-nhap-khau-i238106279-s303856028.html?search=1,238106279,5," May tam thay on,chay manh nhung hoi nong qua tot so voi tam gia",2018-10-02 08:26:24,2018-09-25 05:33:17
lazada.vn,https://www.lazada.vn/products/xiaomi-mi3-ram-2gb-hang-nhap-khau-i238106279-s303856028.html?search=1,238106279,5, Hàng đẹp như ảnh,2018-09-25 12:42:29,2018-09-21 11:23:03
lazada.vn,https://www.lazada.vn/products/xiaomi-mi3-ram-2gb-hang-nhap-khau-i238106279-s303856028.html?search=1,238106279,5, Máy đẹp cấu hình mượt nói chung rất hài lòng.,2018-09-22 23:57:22,2018-09-19 04:18:39
lazada.vn,https://www.lazada.vn/products/xiaomi-mi3-ram-2gb-hang-nhap-khau-i238106279-s303856028.html?search=1,238106279,5, Điện thoại đẹp,2018-09-18 05:46:51,2018-09-13 11:20:41
lazada.vn,https://www.lazada.vn/products/xiaomi-mi3-ram-2gb-hang-nhap-khau-i238106279-s303856028.html?search=1,238106279,5, may on những lô co cuc sac,2018-09-10 02:19:24,2018-09-05 12:11:41
lazada.vn,https://www.lazada.vn/products/xiaomi-mi3-ram-2gb-hang-nhap-khau-i238106279-s303856028.html?search=1,238106279,5, Tốt ngon,2018-10-07 09:54:34,2018-09-10 01:27:27
lazada.vn,https://www.lazada.vn/products/dien-thoai-lv6-2-sim-ram-1gb-bh-1-nam-i155752797-s165584688.html?search=1,155752797,5, Chưa nói lên điều gì!!!!  Hỏng rồi shop bảo hành dùm ,2018-10-29 00:00:56,2018-10-12 16:49:37
lazada.vn,https://www.lazada.vn/products/dien-thoai-lv6-2-sim-ram-1gb-bh-1-nam-i155752797-s165584688.html?search=1,155752797,3," Bắt sóng WIFI kém, hút sóng yếu nữa, k chuyển đc bộ nhớ trong sang thẻ nhớ SD",2018-11-08 10:25:40,2018-11-04 00:35:11
lazada.vn,https://www.lazada.vn/products/dien-thoai-lv6-2-sim-ram-1gb-bh-1-nam-i155752797-s165584688.html?search=1,155752797,4," May tốt lắm chị  choi cũng mươc mà , nhung diên thoai ko tai nhieu ứng dung cho lam nhung cung tot
",2018-09-15 05:45:57,2018-09-13 03:31:23
lazada.vn,https://www.lazada.vn/products/dien-thoai-lv6-2-sim-ram-1gb-bh-1-nam-i155752797-s165584688.html?search=1,155752797,5," dùng thử thấy rất hay không có gì để nói
",2018-08-26 08:55:01,2018-08-13 00:19:02
lazada.vn,https://www.lazada.vn/products/dien-thoai-lv6-2-sim-ram-1gb-bh-1-nam-i155752797-s165584688.html?search=1,155752797,4,được nói chung giờ tôi thử được để tôi sử dụng xem sao,2018-04-28 09:19:09,2018-04-23 02:52:01
lazada.vn,https://www.lazada.vn/products/wiko-u-feel-go-16gb-ram-3gb-4000mah-xam-den-hang-phan-phoichinh-thuc-i150508617-s158182391.html?search=1,150508617,3,Ba sao Mh có đặt 1 chiếc đt wiko hôm nay nhân viên giao hàng nhưng lại không cho mình mở hộp ra kiểm tra máy. Không biết bên trong hộp như thế nào làm sao mh dám nhận. Mh đã k nhận hàng. Làm sao để gửi phản hồi cho họ nhỉ. Lần trc mh cũng mua 1 chiếc đt wiko trên lazada rồi nhân viên cho mở ra kiểm tra rồi mới lấy. Mà lần này thì không ???,2018-01-02 13:45:03,2017-12-29 13:03:16
lazada.vn,https://www.lazada.vn/products/wiko-u-feel-go-16gb-ram-3gb-4000mah-xam-den-hang-phan-phoichinh-thuc-i150508617-s158182391.html?search=1,150508617,1,"Một sao Đây là chiếc điện thoại có cảm ứng kém nhất trong 5 chiếc điện thoại tôi từng mua của lazada, thỉnh thoảng còn để chấm thoải mái cứ trơ trơ . Mọi người nên cân nhắc khi mua nhé",2017-12-23 12:49:49,2017-11-11 06:34:20
lazada.vn,https://www.lazada.vn/products/wiko-u-feel-go-16gb-ram-3gb-4000mah-xam-den-hang-phan-phoichinh-thuc-i150508617-s158182391.html?search=1,150508617,4, Máy rất tốt. Nhưng pin tụt hơi nhanh số với dung lượng 4000mah. Mẫu mã đẹp. nói chung tốt trong tầm giá.,2018-09-23 23:41:33,2018-09-18 13:00:23
lazada.vn,https://www.lazada.vn/products/wiko-u-feel-go-16gb-ram-3gb-4000mah-xam-den-hang-phan-phoichinh-thuc-i150508617-s158182391.html?search=1,150508617,5,"Sanrphaamr tốt, nhiều tính năng, pin khủng, giá rẻ Mới mua đc 15 ngày thấy dùng tốt, độ phân giải cao, kính IPS tốt, pin 4000 bằng máy tính bảng SAMSUNG 7in rồi 3 ngày không phải nạp nhiều tính năng hay, giá rất rẻ, cảm giác cầm lướt Web chắc tay, cấu hình cao nên tốc độ nhanh, Androi 6.0 nói chung cấu hình như vậy giá đó ko hãng nào có.....các bạn nên mua...",2017-09-21 01:37:18,2017-09-08 03:56:31
lazada.vn,https://www.lazada.vn/products/wiko-u-feel-go-16gb-ram-3gb-4000mah-xam-den-hang-phan-phoichinh-thuc-i150508617-s158182391.html?search=1,150508617,5," Điện thoại đẹp, mượt, sạc hơi nóng nhưng nhanh, camera chụp ảnh tốt, màn hình màu sáng chuẩn,  pin trâu,... Tất cả đều tốt trong tầm giá.",2018-08-22 14:58:15,2018-08-18 15:21:51
lazada.vn,https://www.lazada.vn/products/wiko-u-feel-go-16gb-ram-3gb-4000mah-xam-den-hang-phan-phoichinh-thuc-i150508617-s158182391.html?search=1,150508617,3,"chất lượng tạm được, giá cả cạnh tranh chất lượng tạm được, tuy pin dung lượng lớn nhưng tuột rất nhanh kể cả không sử dụng, bỏ qua đêm tuột mất 10%, có lẻ dùng chip mediatek nên không tiết kiệm điện năng tốt thua cả wiko fab pin chỉ 2800 chác khác biệt là quallcom, chạy chíp mediatek quá tệ",2017-12-08 12:21:27,2017-12-04 01:11:29
lazada.vn,https://www.lazada.vn/products/wiko-u-feel-go-16gb-ram-3gb-4000mah-xam-den-hang-phan-phoichinh-thuc-i150508617-s158182391.html?search=1,150508617,2,Máy chậm.pin không trâu lắm ram như 1g ch Chơi game không mượt facebook zalo ổn liên quân vào trễ 26 giây...,2018-03-18 01:46:40,2018-03-15 09:42:47
lazada.vn,https://www.lazada.vn/products/wiko-u-feel-go-16gb-ram-3gb-4000mah-xam-den-hang-phan-phoichinh-thuc-i150508617-s158182391.html?search=1,150508617,5," Sản phẩm đúng mô tả.ram 3Gb,Rom 16Gb, nguyên seal chính hãng,tốt trong tầm giá .giao hàng nhanh .",2018-10-12 12:33:40,2018-09-26 07:33:01
lazada.vn,https://www.lazada.vn/products/wiko-u-feel-go-16gb-ram-3gb-4000mah-xam-den-hang-phan-phoichinh-thuc-i150508617-s158182391.html?search=1,150508617,5, Hãng dùng tốt giá hợp lý,2018-10-12 07:47:41,2018-08-27 09:10:51
lazada.vn,https://www.lazada.vn/products/wiko-u-feel-go-16gb-ram-3gb-4000mah-xam-den-hang-phan-phoichinh-thuc-i150508617-s158182391.html?search=1,150508617,5, Giá tốt so với cấu hình,2018-09-29 08:05:46,2018-09-17 02:25:13
lazada.vn,https://www.lazada.vn/products/wiko-u-feel-go-16gb-ram-3gb-4000mah-xam-den-hang-phan-phoichinh-thuc-i150508617-s158182391.html?search=1,150508617,3,Phụ kiện kèm theo máy Sao thấy phụ kiện có ốp lưng và miếng dán màn hình.mà lúc nhận hàng lại ko có thế shop,2017-09-20 11:15:49,2017-09-17 11:27:19
lazada.vn,https://www.lazada.vn/products/wiko-u-feel-go-16gb-ram-3gb-4000mah-xam-den-hang-phan-phoichinh-thuc-i150508617-s158182391.html?search=1,150508617,5, 4 sao rữi= 4 sao cho sp và 5 sao cho anh Ship,2018-09-13 04:50:54,2018-09-06 02:30:01
lazada.vn,https://www.lazada.vn/products/wiko-u-feel-go-16gb-ram-3gb-4000mah-xam-den-hang-phan-phoichinh-thuc-i150508617-s158182391.html?search=1,150508617,5,Cái điện thoại có chơi được liên quân ko Cái điện thoại có chơi được liên quân ko,2017-10-07 05:20:43,
lazada.vn,https://www.lazada.vn/products/wiko-u-feel-go-16gb-ram-3gb-4000mah-xam-den-hang-phan-phoichinh-thuc-i150508617-s158182391.html?search=1,150508617,3,"Trung bình Sản phẩm khá dày,vân tay nhạy,lướt web khá nóng,pin trung bình,qua đêm sụt 15% pin.",2017-10-27 00:48:26,2017-10-20 04:18:10
lazada.vn,https://www.lazada.vn/products/wiko-u-feel-go-16gb-ram-3gb-4000mah-xam-den-hang-phan-phoichinh-thuc-i150508617-s158182391.html?search=1,150508617,3,Wiko Cảm ứng có lúc không nhạy .phải bấm mạnh mới ăn,2017-12-16 05:34:40,2017-12-04 13:02:36
lazada.vn,https://www.lazada.vn/products/wiko-u-feel-go-16gb-ram-3gb-4000mah-xam-den-hang-phan-phoichinh-thuc-i150508617-s158182391.html?search=1,150508617,5,Điện thoại có chơi được liên quân ko Điện thoại có chơi được liên quân ko vây,2017-10-07 05:24:02,
lazada.vn,https://www.lazada.vn/products/wiko-u-feel-go-16gb-ram-3gb-4000mah-xam-den-hang-phan-phoichinh-thuc-i150508617-s158182391.html?search=1,150508617,5,"Tốt Máy pin dai, sạc rất nhanh, hài lòng về sản phẩm!",2017-12-17 05:08:39,2017-12-07 15:48:05
lazada.vn,https://www.lazada.vn/products/wiko-u-feel-go-16gb-ram-3gb-4000mah-xam-den-hang-phan-phoichinh-thuc-i150508617-s158182391.html?search=1,150508617,5,Năm sao ,2017-09-14 23:06:32,
lazada.vn,https://www.lazada.vn/products/wiko-u-feel-go-16gb-ram-3gb-4000mah-xam-den-hang-phan-phoichinh-thuc-i150508617-s158182391.html?search=1,150508617,5,good ,2017-09-22 08:35:25,2017-09-15 02:14:43
lazada.vn,https://www.lazada.vn/products/wiko-u-feel-go-16gb-ram-3gb-4000mah-xam-den-hang-phan-phoichinh-thuc-i150508617-s158182391.html?search=1,150508617,5,Có hỗ trợ thẻ nhớ không ,2017-10-22 02:50:44,
lazada.vn,https://www.lazada.vn/products/wiko-u-feel-go-16gb-ram-3gb-4000mah-xam-den-hang-phan-phoichinh-thuc-i150508617-s158182391.html?search=1,150508617,3,Dùng tốt. Pin lâu khoảng 2 ngày ,2017-10-20 11:55:48,2017-10-15 10:40:04
