Domain,Url,Product_id,Brand,Category,Model,Price,Seller,Tags,Info,Others
mediamart.vn,https://mediamart.vn/may-dem-tien/silicon/may-dem-tien-thong-minh-silicon-mc9900n-the-he-2018.htm,,Silicon,Máy đếm tiền,Máy đếm tiền thông minh Silicon MC-9900N - Phát hiện tiền Siêu giả,6.999.000,,," . - Công nghệ mới nhất phần mềm phát hiện tiền giả, siêu giả mới cập nhật. - Thiết kế kiểu dáng đứng hiện đại, kích thước nhỏ gọn kết hợp với gam màu trắng đen sang trọng,. - Sử dụng 16 mắt cực tím hồng ngoại để kiểm tra hình chìm - tiền siêu giả Polymer, có đa mắt màu để kiểm tra tiền giả.. - Người dùng có thể loại ra được các đồng tiền khác loại lẫn trong số tiền đang đếm giúp phân loại tiền một cách dẽ dàng​. . . . . Hình ảnh tham khảo: Máy đếm tiền thông minh Silicon MC-9900N - Phát hiện tiền Siêu giả. . . . . . . . . . . . . . . . . . Thông số kỹ thuật: Máy đếm tiền thông minh Silicon MC-9900N - Phát hiện tiền Siêu giả. . . . Bộ lọc. . . . . . . . Thông tin: Máy đếm tiền thông minh Silicon MC-9900N - Phát hiện tiền Siêu giả. . . Máy đếm tiền Silicon MC-9900N, thế hệ 2018, tốc độ đếm 7 giây/100 tờ tiền, máy đếm tiền có độ chính xác cực cao hơn các sản phẩm cùng loại. . Thương hiệu Silicon ra mắt dòng máy đếm tiền thế hệ mới 2018 MC-9900N. Sản phẩm chất lượng cao, đếm cực chính xác so với các sản phẩm cùng loại. Bên cạnh đó mẫu mã thiết kế sang trọng và đặt biệt giá cả phải chăng luôn là sự lựa chọn thông minh đáp ứng tốt nhất nhu cầu khách hàng.. . Máy đếm tiền Silicon MC-9900N thế hệ 2018 thiết kế thời trang, gọn nhẹ; máy đếm tiền tự tự động, đếm được cả tiền giấy và polime, máy có cả chức năng phân biệt tiền và giấy, phát hiện các loại tiền giả. Máy ấn định số đếm, đếm cộng dồn. Hiển thị màn hình LCD, có mặt số LED kéo dài. Silicon MC-9900N đang rất phổ biến trên thị trường và được người tiêu dùng ưa thích.. . . . . . Máy đếm tiền thông minh Silicon MC-9900N. . CÔNG DỤNG:. . – Sản phẩm máy đếm tiền thế hệ mới Silicon MC-9900N có khả năng đếm tiền giấy và polime, VNĐ và ngoại tệ, phát hiện tiền giả và các tính năng đếm mở rộng khác.. . – Máy đếm tiền Silicon MC-9900N có thiết kế vừa vặn, khả năng cơ động cao nên rất phù hợp với các doanh nghiệp, công ty, hộ gia đình…. . . . . Máy có tốc độ đếm 7giây/100 tờ tiền. . ƯU ĐIỂM VƯỢT TRỘI:. . – Máy đếm tiền Silicon MC-9900N nhỏ gọn, dễ di chuyển cũng như tiết kiệm diện tích khi sử dụng.. . – Các nút bấm mềm mại và dễ sử dụng, hiển thị màn hình LED để bạn và người đối diện có thể đồng thời quan sát và thao tác. Thậm chí máy còn được trang bị một màn hình kéo dài cho phép nhiều người cùng theo dõi việc đếm tiền của máy.. . – Tốc độ đếm siêu nhanh ≥1000 tờ/phút, đếm chuẩn xác 100%, không bị kẹt tiền, không rắt tiền.. . –. Máy đếm tiền Silicon MC-9900N. ấn định số tờ cần đếm, đếm cộng dồn, đếm mẻ, giúp tiết kiệm thời gian và thuận tiện hơn cho bạn trong công việc.. . – Máy đếm tiền cao cấp thông minh, có mức độ kiểm giả Polymer siêu giả chính xác nhất trên thị trường Việt Nam hiện nay.. . Máy có kích thước 370 x 330 x 272mm, trọng lượng 7kg. . TIÊU CHUẨN CHẤT LƯỢNG:. . – Sản phẩm máy đếm tiền thế hệ mới Silicon MC-9900N được sản xuất theo đúng tiêu chuẩn công nghệ hiện đại của Hoa Kỳ, với có đầy đủ các chứng nhận CO, CQ.. . THÔNG SỐ KỸ THUẬT:. . Máy đếm tiền thông minh Silicon MC-9900N ( Thế hệ mới 2018 ). . – Máy đếm tiền cao cấp thông minh, có mức độ kiểm giả Polymer siêu giả chính xác nhất trên thị trường Việt Nam hiện nay.. . – Hoàn toàn tự động nhận biết mệnh giá Polymer. Kiểm tra được tiền lẫn loại.. . – Có chức năng tách tờ.. . – Có chức năng chia mẻ (ấn định số tờ đếm). . – Có hệ thống hút bụi dưới đáy. . – Sử dụng 16 mắt cực tím hồng ngoại để kiểm tra hình chìm (tiền siêu giả Polymer). . – Có đa mắt màu để kiểm tiền siêu giả.. . – Tự động kiểm tra tình trạng kỹ thuật máy khi bật nguồn.. . – Có cổng RS232 để nâng cấp phần mềm khi có chương trình mới.. . – 1 Màn hình hiển thị kỹ thuật số, hiển thị 0 – 9999.. . Thông số kỹ thuật chi tiết:. . – Tốc độ máy :. 7giây/100 tờ tiền. . – Điện áp: 220V – 50Hz ( 60Hz).. . – Công Suất : 75W.. . – Kích Thước : 370 x 330 x 272mm.. . – Trọng Lượng sản phẩm : 7 kg.. . – Trọng Lượng cả bao bì : 8 kg.. . – Xuất xứ: Liên doanh. . Bảo hành 12 tháng. . Công nghệ Mỹ, chính hãng. . PHỤ KIỆN THEO MÁY:. . – 1 Bộ linh kiện. . – 1 Sợi dây nguồn. . HƯỚNG DẪN SỬ DỤNG MÁY ĐẾM TIỀN AN TOÀN, HIỆU QUẢ:. . – Đặt máy đếm tiền ở nơi khô ráo sạch sẽ, tránh bụi bẩn, tránh để máy ở những nơi có ánh sáng mạnh.. . – Để bắt đầu sử dụng, cắm nguồn ở sau máy. Cắm giắc màn hình kéo dài vào nếu có nhu cầu sử dụng. Sau đó, bật công tắc nguồn (I). – Để bắt đầu đếm, ta tiến hành xòe tiền rồi thả tiền vào khay, máy sẽ tự động đếm. Màn hình hiển thị mệnh giá và số lượng tiền.. . – Sau thời gian dài sử dụng, nếu phát hiện thấy máy có hiện tượng đếm thiếu tiền do các bánh răng cao su kéo tiền bị mòn, các bạn có thể xử lý bằng cách: Điều chỉnh nút lò xo ở sau máy theo chiều kim đồng hồ, nâng máng để tiền sát với bánh răng, khi đó sẽ giải quyết được hiện tượng đếm thiếu tiền. Nếu hiện tượng vẫn tiếp diễn thì cần thay bánh răng cao su.. . – Tắt máy và rút ổ điện ra khỏi máy dùng chổi mềm vệ sinh sạch sẽ máy theo định kỳ.. . . . . . Tư Vấn Mua Máy đếm tiền. . . . . . ",""""""
mediamart.vn,https://mediamart.vn/may-dem-tien/silicon/may-dem-tien-silicon-mc8plus-dung-cho-ngan-hang.htm,,Silicon,Máy đếm tiền,Máy đếm tiền silicon MC-8PLUS - Dùng cho ngân hàng,21.520.000,,," . - Máy đếm tiền Silicon 8Plus có kiểu dáng thiết kế nhỏ gọn, sang trọng, rất bắt mắt trong phòng làm việc.. - Toàn bộ hệ thống mắt thần, bộ cảm biến được lắp đặt khép kín trong hộp kiếng bảo quản tránh bụi bẩn, tăng tuổi thọ của may lên gấp nhiều lần so với máy thông thường.. - Sử dụng 02 bộ mắt đếm riêng biệt đảm bảo độ chính xác khi đếm lượng tiền lớn và liên tục những loại máy đếm tiền khác trên thị trường không đảm bảo chính xác.. - Có khả năng nhận, đếm, cộng tổng, phát hiện giả tự động ngay cả khi đưa 3 loại tiền VND, USD, EURO vào đếm đồng thời.. . . . . Hình ảnh tham khảo: Máy đếm tiền silicon MC-8PLUS - Dùng cho ngân hàng. . . . . . . . . . . . . . . Thông số kỹ thuật: Máy đếm tiền silicon MC-8PLUS - Dùng cho ngân hàng. . . . Bộ lọc. . . . . . . . Thông tin: Máy đếm tiền silicon MC-8PLUS - Dùng cho ngân hàng. . . MÁY ĐẾM SIÊU GIẢ VÀ PHÂN LOẠI TIỀN 2 NGĂN SILICON MC-8PLUS. Máy đếm tiền Silicon 8Plus là dòng máy mới ra mắt trên thị trường hiện nay, đột phá về thiết kiểu dáng, thiết kế sang trọng, nhỏ gọn, thích hợp dùng cho văn phòng, cơ quan, trong ngân hàng hoặc tại kho bạc... giúp người dùng quản lý và đếm tiền cực nhanh nhất, cực chính xác. Máy đếm được các loại tiền VND, USD, EURO, Bảng anh, Nhân dân tệ, có chế độ đếm Auto (có nghĩa là khi đặt các loại tiền của các nước vào, máy sẽ tự nhận biết). . Máy đếm tiền siêu giả và phân loại tiền 2 ngăn Silicon 8Plus. Máy đếm tiền Silicon 8Plus có 2 khay đựng tiền, một khay chính (bên dưới) và một khay phụ (phía trên). Ngăn chứa tiền của khay chính chứa khoảng 200 tờ tiền và ngăn khay phụ chứa khoảng 100 tờ. Máy bắt tiền giả bằng công nghệ mới, bắt bằng hình ảnh đi qua nhiều mắt đếm cảm biến, nhiều bánh răng nên cho độ chính xác cao hơn các dòng máy khác.. . . 2 khay đếm tiền riêng biệt. Máy đếm tiền Silicon 8Plus có thiết kế hiện đại, màu trắng sang trọng, nhìn tổng thể cả chiếc máy đếm tiền rất hài hòa và đẹp mắt. Máy có kích thước lần lượt chiều cao 31.5cm, chiều rộng 28cm và dài 26cm, tổng trọng lượng toàn máy khoảng 10kg.. Khung máy làm hoàn toàn bằng thép không gỉ, màn hình hiển thị phía trước của máy và có màn hình kéo dài giúp cho người sử dụng máy dễ dàng quan sát hơn trong quá trình thực hiện các công việc.. . . Màn hình phía trước máy hiển thị số đếm giúp cho người sử dụng dễ dàng quan sát hơn. . Đặc điểm nổi bật nhất của SILICON 8PLUS là dòng máy chuyên dùng cho cường độ đếm tiền, kiểm tra nhận dạng chính xác tiền giả với cho độ chính xác cao nhờ Bộ cảm biến chụp ảnh 2 mặt tờ tiền (Double CIS).. Không chỉ có tính năng vượt trội, sản phẩm còn sở hữu vẻ ngoài có tính thẩm mỹ cao với kích thước nhỏ gọn là lựa chọn hoàn hảo cho phòng thu ngân, kế toán, kho bạc, tiệm vàng.... . . Máy đếm tiền Silicon 8lpus đếm và phát hiện nghi giả. . Máy đếm các loại tiền ngoại tệ USD, EURO, RMB, GBP (Có thể cài đặt thêm theo từng yêu cầu đặt hàng).. . Ngoài các mắt đọc Tia UV, hồng ngoại (IR), từ tính (MG) máy có trang bị công nghệ hoàn toàn mới: Công nghệ chụp ảnh toàn bộ 2 mặt tờ tiền (Double CIS): sử dụng bộ cảm biến hình ảnh quét chụp lại toàn bộ 2 mặt của tờ tiền, giúp phát hiện chính xác các chi tiết trên mọi tờ tiền khi đi qua máy, từ đó phát hiện tiền thật và tiền giả, mệnh giá tiền, cộng tổng, phân biệt lẫn loại, phân biệt và sắp xếp chiều tờ tiền, phát hiện các chi tiết như số serial từng tờ tiền .... . . Máy đếm tiền Silicon 8Plus, chuyên gia xử lý tiền và đếm tiền hàng đầu thế giới. . * Các chức năng của Máy đếm tiền Silico 8Plus:. . - MIX CF: Chức năng tổng các loại tiền: Khi cho nhiều mệnh giá tiền vào mày cùng một lúc, máy sẽ đếm như nhau, không chọn lọc. Sau khi đếm xong sẽ hiển thị tổng số tờ ra màn hình.. - SDCV: Chức năng tách tờ tiền đầu tiên, đếm mệnh giá tờ đầu tiên trong cùng cọc tiền lẫn loại với các mệnh giá. Máy sẽ lọc các tờ cùng loại với mệnh giá tờ đầu tiên xuống khay chính (khay dưới). Những mệnh giá còn lại sẽ được đẩy lên hết trên khay phụ.. - SDC CF: Chức năng phân biệt các loại tiền.. - COUNT: Đếm thường, đếm số tờ bằng mắt đếm.. - MIX ADD: Chức năng Đếm cộng dồn. - VAL BAT: Chức năng đếm đẩy tất cả mệnh giá tiền lên khay phụ (khay trên).. . ƯU ĐIỂM CỦA. MÁY ĐẾM TIỀN SILICON 8PLUS:. - Máy đếm tiền Silicon 8Plus có kiểu dáng thiết kế nhỏ gọn, sang trọng, rất bắt mắt trong phòng làm việc. - Toàn bộ hệ thống mắt thần, bộ cảm biến được lắp đặt khép kín trong hộp kiếng bảo quản tránh bụi bẩn, tăng tuổi thọ của may lên gấp nhiều lần so với máy thông thường.. . Bảng điều khiển các chức năng của Máy Silicon 8Plus. - Sử dụng 02 bộ mắt đếm riêng biệt đảm bảo độ chính xác khi đếm lượng tiền lớn và liên tục những loại máy đếm tiền khác trên thị trường không đảm bảo chính xác.. - Có khả năng nhận, đếm, cộng tổng, phát hiện giả tự động ngay cả khi đưa 3 loại tiền VND, USD, EURO vào đếm đồng thời.. . Máy đếm được cả tiền VND, USD, EURO, bảng anh, nhân dân tệ. - Có khả năng đọc số serial của các tờ tiền USD, EURO và so sánh với các tờ tiền giả lưu trong bộ nhớ máy để cảnh báo cho người dùng.. - Ngoài ra máy còn chức năng nổi bật hơn các dòng máy khác,. Silicon 8Plus có khả năng lật mặt (hoặc đảo mặt). tờ tiền trong quá trình đếm, rất tiện lợi cho người sử dụng.. - Máy có thiết kế thêm màn hình kéo dài giúp người dùng dễ dàng quan sát. Có hệ thống làm mát, cổng USB để nâng cấp khi có phần mềm mới, tiền mệnh giá mới, tiền giả mới.... . CÁC TÍNH NĂNG CỦA MÁY ĐẾM TIỀN SILICON 8PLUS:. -. Công nghệ phát hiện tiền giả bằng công nghệ chụp ảnh CIS: Quét toàn bộ 2 mặt của tờ tiền, Count, UV, MG, IR, CIS dual, SDC.. . . Khay đặt tiền thiết kế khu vực phía trên màn hình điều khiển. - Loại tiền tệ: VNĐ và ngoại tệ USD, EURO, RMB, GBP (Có thể cài đặt thêm theo từng yêu cầu đặt hàng).. . . Máy đếm tiền Silicon 8plus, đếm tiền VNĐ. . . Máy đếm tiền Silicon 8plus, đếm tiền USD. . Máy đếm tiền USD cho độ chính xác cao. . . Máy đếm tiền Silicon 8plus, đếm bảng anh. . Máy đếm tiền Silicon 8plus, đếm EURO. - Chứng nhận kiểm định của Ngân hàng trung ương Châu Âu ECB 2017. - Đếm 1 lần nhiều mệnh giá của 3 loại tiền VND,USD, EURO, cộng tổng, phát hiện giả. . Khay nhả tiền, bánh răng cửa hướng tiền được thiết kế bởi nhựa cao cấp. . THÔNG SỐ KỸ THUẬT:. - Cập nhập phần mềm mới, cập nhập các tờ tiền giả mới dễ dàng qua cổng USB. - Tốc độ đếm: 3 cấp tốc độ 800-900-1000 tờ/phút. - Khay nạp tiền vào (Ngăn trên cùng): sức chứa tối đa 500 tờ và nạp liên tục.. - Ngăn loại bỏ (Ngăn đầu ra ở giữa) : tối đa 100 tờ.. - Ngăn chứa tiền đạt tiêu chuẩn (ngăn đầu ra dưới cùng): 200 tờ.. - Kích thước tờ tiền có thể đếm: 60x85x0.08mm ~ 100 x 190x0.12mm. - Kích thước sản phẩm: 280mm Rộng x 260mm Dài x 315mm Cao.. - Màn hình LCD 3.5inch. - Trọng lượng thiết bị khoảng: 10 Kg.. - Nguồn điện sử dụng: DC100 - 240 VAC 50/60Hz 1Pha.. - Nâng cấp phần mềm: RJ11, USB.. . . Máy có thiết kế nổi bật với 2 ngăn phân loại tiền. . KIỂM ĐẾM VÀ PHÂN LOẠI TIỀN VNĐ.. - Kiểm, đếm và phát hiện tiền VNĐ nghi giả.. - Kiểm, đếm lẫn loại các mệnh giá (MIX).. - Kiểm, đếm theo mệnh giá được chọn. - Kiểm, đếm theo mệnh giá đầu tiên đi vào máy. - Kiểm, đếm tờ tiền theo hướng (ORI), theo mặt (FACE).. - Cộng tổng.. . . ĐẾM 1 LOẠI NGOẠI TỆ CÙNG 1 THỜI ĐIỂM HOẶC ĐẾM LẪN 3 LOẠI VND, USD VÀ EURO CÙNG LÚC. - Kiểm, đếm và phát hiện USD, EURO, RMB, GBP nghi giả.. - Kiểm, đếm lẫn loại các mệnh giá (MIX).. - Kiểm, đếm theo mệnh giá được chọn. - Kiểm, đếm theo mệnh giá đầu tiên đi vào máy. - Kiểm, đếm tờ tiền theo hướng (ORI), theo mặt (FACE).. - Cộng tổng.. . *** Tuỳ chọn Nâng cao: QUÝ KHÁCH HÀNG CÓ THỂ YÊU CẦU NÂNG CẤP PHẦN MỀM ĐỂ ĐẾM ĐƯỢC TỐI ĐA 10 trong số 32 ĐỒNG TIỀN CÁC NƯỚC DƯỚI ĐÂY:. . . . . . Item. . . . Currency. (Loại tiền). . . . Country/Area. (Quốc gia/Vùng lãnh thổ). . . . . . . . Item. . . . Currency. (Loại tiền). . . . Country/Area. (Quốc gia/Vùng lãnh thổ). . . . . . 1. . . . VND. . . . Việt Nam Đồng. . . . . . . . 17. . . . PLN. . . . Zloty Ba Lan. . . . . . 2. . . . EUR. . . . Euro. . . . . . . . 18. . . . TWD. . . . Đôla Đài Loan mới. . . . . . 3. . . . USD. . . . Đôla Mỹ. . . . . . . . 19. . . . LBP. . . . Bảng Lebanon. . . . . . 4. . . . GBP. . . . Bảng Anh. . . . . . . . 20. . . . PHP. . . . Peso Philippines. . . . . . 5. . . . BRL. . . . Real Brazil. . . . . . . . 21. . . . MOP. . . . Pataca Macau. . . . . . 6. . . . MYR. . . . Ringgit Malaysia. . . . . . . . 22. . . . LAK. . . . Kip Lào. . . . . . 7. . . . IDR. . . . Rupiah Indonesia. . . . . . . . 23. . . . SGD. . . . Đôla Singapore. . . . . . 8. . . . LKR. . . . Rupee Sri Lankan. . . . . . . . 24. . . . AUD. . . . Đôla Úc. . . . . . 9. . . . INR. . . . Rupee Ấn Độ. . . . . . . . 25. . . . JPY. . . . Yên Nhật. . . . . . 10. . . . CNY. . . . Nhân dân tệ. . . . . . . . 26. . . . ILS. . . . New Shekel Israel. . . . . . 11. . . . THB. . . . Bạt Thái. . . . . . . . 27. . . . HKD. . . . Đôla Hồng Kông. . . . . . 12. . . . KWD. . . . Dinar Kuwaiti. . . . . . . . 28. . . . KHR. . . . Riel Campuchia. . . . . . 13. . . . MMK. . . . Kyat Myanmar. . . . . . . . 29. . . . CAD. . . . Đôla Canada. . . . . . 14. . . . TRL. . . . Lira Thổ Nhĩ Kỳ. . . . . . . . 30. . . . KRW. . . . Won Hàn Quốc. . . . . . 15. . . . RON. . . . Leu Romania. . . . . . . . 31. . . . RUB. . . . Ruble Nga. . . . . . 16. . . . ZAR. . . . Rand Nam Phi. . . . . . . . 32. . . . MXN. . . . Peso Mexico. . . . . . DANH SÁCH ĐƠN VỊ TIỀN TỆ CỦA CÁC QUỐC GIA VÀ VÙNG LÃNH THỔ TRÊN THẾ GIỚI. . CHỨC NĂNG MỞ RỘNG:. - Có thể kết nối và in ra máy in (option).. . MỘT SỐ HÌNH ẢNH KHÁC CỦA MÁY ĐẾM TIỀN SILICON 8PLUS:. . . Cổng cắm nguồn điện 3 chân sau máy. . . Bộ dây điện đi kèm cực kì chắc chắn. . . Công tắc bật/tắt nguồn điện. . Cổng USB kết nối máy tính, khi cần cập nhật phần mềm nâng cao. . . . . . Tư Vấn Mua Máy đếm tiền. . . . . . ",""""""
