Domain,Url,Product_id,Brand,Category,Model,Price,Seller,Tags,Info,Others
adayroi.com,https://www.adayroi.com/binh-nuoc-nong-lanh-chong-giat-rossi-eco-20l-p-781792?offer=781792_092105,781792,Rossi,Máy nước nóng,Bình nước nóng lạnh chống giật Rossi Eco 20L,1.750.000đ,Xuân Thành,Máy nước nóng Rossi,"- Ruột bình bảo ôn tráng kim cương nhân tạo. - Bộ điều khiển nhiệt hoạt động chính xác, tuổi thọ cao. - Thanh gia nhiệt thông minh tráng men. - Thanh Magie được lắp đặt bảo vệ tối ưu chống ăn mòn. - Đèn LED đỏ báo hiệu thanh gia nhiệt đang hoạt động. - Hệ thống an toàn đồng bộ yên tâm sử dụng, vận hành. Điện áp 220V Thời hạn bảo hành 7 (năm) Model Eco 20L Kích thước 42 x 42 x 38 (cm) Xuất xứ Việt Nam Dung tích 20L. Bình nước nóng RossiECO tiết kiệm điện là bước đột phá mới trong công nghệ tạo ra nguồn nước nóng nhanh chóng và được phòng thí nghiệm Cotherm – Pháp kiểm nghiệm và chứng nhận tiết kiệm điện năng lên tới 15%. Thiết kế nhỏ gọn, phù hợp căn hộ hiện đại Bình nước nóng lạnh chống giật Rossi Eco 20L sở hữu kiểu dáng nhỏ gọn, mỏng với dung tích bình đun 20lít, phù hợp với không gian căn hộ hiện đại, các căn hộ chung cư, tòa nhà cao tầng. Sản phẩm có màu sắc phối hợp bắt mắt góp phần làm nổi bật lên nội thất phòng tắm của gia đình bạn. Ruột bình bảo ôn tráng kim cương nhân tạo Ruột bình bảo ôn tráng kim cương nhân tạo, tăng độ bền của sản phẩm, khả năng giữ nhiệt tốt, hạn chế bám cặn hoặc ăn mòn sản phẩm trong quá trình sử dụng. Làm nóng nước nhanh chóng Thanh gia nhiệt thông minh tráng men hiệu suất cao làm nóng nước nhanh chóng, tiết kiệm điện năng. Thêm vào đó, thanh Magie được lắp đặt bảo vệ tối ưu ruột bình chống lại sự ăn mòn, làm tăng tuổi thọ cho bình nước nóng. Đèn báo trạng thái hoạt động Bình nước nóng lạnh chống giật Rossi Eco 20L trang bị đèn báo thông minh giúp người dùng dễ dàng nhận biết khi nào thanh gia nhiệt đang hoạt động. Từ đó bạn có thể biết khi nào nước đã nóng đủ độ để sẵn sàng tắm. * Chú ý : Bình nước nóng các hãng Ariston, Ferroli, Picenza, Rossi, Midea đều được bảo hành tại nhà khách. Khi cần bảo hành chỉ cần báo tổng đài của hãng đó là thợ của hãng đến tận nhà bảo hành. Tuyệt đối ko tháo bình đã lắp trả về cho nhà cung cấp.",""""""
adayroi.com,https://www.adayroi.com/voi-nuoc-nong-truc-tiep-voi-inox-cong-kangaroo-kg239-p-PRI1049576?offer=PRI1049576_M-PVT,PRI1049576,Kangaroo,Máy nước nóng,Vòi nước nóng trực tiếp (vòi inox cong) Kangaroo KG239,1.350.000đ,KANGAROO ONLINE,"Máy nước nóng trực tiếp Kangaroo,Kangaroo,KG239","- Nóng nhanh trong 5 giây. - Điều chỉnh nước nóng theo nhu cầu. - Đầu vòi xoay 360 độ tiện dụng. - Lắp đặt dễ dàng, tiết kiệm điện năng. Điện áp 220V Nguồn gốc Chính hãng Model KG239. Vòi nước nóng trực tiếp (vòi inox cong) Kangaroo KG239 là sự kết hợp hoàn hảo giữ bình nóng lạnh và vòi nước. Sản phẩm sở hữu nhiều tính năng ưu việt nổi bật, đáp ứng tối đa nhu cầu sử dụng của người dùng. Vòi có khả năng làm nóng nhanh trong 5 giây. Nhiệt độ sau 5 giây có từ 35-55 độ C (tùy thuộc vào lưu lượng nước đầu ra), do đó sản phẩm rất thích hợp với nhiều môi trường khác nhau, như rửa bát, rửa tay/chân,... mà không cần phải trộn nước nóng lạnh. Cấu tạo chung củadòngsảnphẩmvòi nước nóng trực tiếp Kangaroo Đầu vòi được thiết kế thông minh với khả năng xoay 360 độ, đem đến sự tiện dụng tối đa cho người dùng. Bạn có thể xoay nhiều hướng khác nhau mà không mất công với tay đến vòi. Sản phẩm được thiết kế đảm bảo an toàn cho thiết bị dùng điện, khi có nước chảy qua đủ áp lực (0.04-0.6Mpa) thiết bị mới làm việc, không có nước hoặc nước không đủ áp lực thì tiếp điểm không đóng điện thiết bị không làm việc. thiết bị có dây nguồn kèm bộ chống giật ELCB chống rò điện, đạt tiêu chuẩn tương thích điện từ EMC không gây ảnh hưởng đến các thiết bị dùng điện khác. Tính năng nổi bật của dòng sản phẩm vòi nước nóng trực tiếp chung Vòi nước nóng trực tiếp (vòi inox cong) Kangaroo KG239 đảm bảo tiết kiệm điện năng tối đa cho cả gia đình. Khi sử dụng nước nóng thì mới tiêu hao điện, nếu không dùng nước nóng thì không tốn điện, không như các TB điện khác phải duy trì thời gian đun nhất định, không sử dụng nước nóng vẫn tiêu hao điện để duy trì, do vậy sử dụng vời nước nóng trực tiếp sẽ tiết kiệm điện năng rất nhiều. Đặc biệt, sản phẩm lắp đặt rất dễ dàng. Chỉ cần dùng vòi mềm nối giữa đầu cấp nước nguồn với với đầu vào của thiết bị là có thể cấp nước cho thiết bị hoạt động. #ảnh: Internet",""""""
adayroi.com,https://www.adayroi.com/binh-nong-lanh-chong-giat-rossi-r15ti-smart-15l-trang-men-kim-cuong-nhan-tao-p-781804?offer=781804_092105,781804,Rossi,Máy nước nóng,Bình nóng lạnh chống giật Rossi R15Ti Smart 15L (Tráng men kim cương nhân tạo),1.490.000đ,Xuân Thành,Máy nước nóng Rossi,"- Thiết kế sang trọng, tinh tế. - Ruột bình tráng men kim cương nhân tạo siêu bền. - Thanh gia nhiệt thông minh tráng men làm nóng nước nhanh . - Tiết kiệm đến 15% điện năng tiêu thụ. - Bộ ổn nhiệt thông minh chống cháy khô . - Hệ thống an toàn đồng bộ yên tâm khi sử dụng. Điện áp 220V Bảo hành Chính hãng: 7 năm với bình chứa, linh kiện điện 1 năm Model R15Ti Smart Kích thước 40 x 40 x 33 (cm) Xuất xứ Việt Nam Dung tích 15L. Thiết kế sang trọng, tinh tế Bình nóng lạnh chống giật Rossi R15Ti Smart 15L sở hữu kiểu dáng sang trọng, màu sắc phối kết hợp tinh tế, đem đến cho không gian nội thất phòng tắm của gia đình bạn thêm tiện nghi, hiện đại. Sản phẩm thuộc dòng bình nước nóng gián tiếp, có dung tích 15lít, phù hợp với gia đình có từ 3đến 4thành viên. Ruột bình tráng men kim cương nhân tạo Kim cương nhân tạo có tính chất vật lý và hóa học giống như kim cương thiên nhiên, là chất cách điện tốt và đặc biệt không giãn nở khi nhiệt độ thay đổi. Ruột bình nóng lạnh Rossi Ti Smart được tráng men kim cương nhân tạo siêu bền, cho khả năng giữ nhiệt tốt, hạn chế bám cặn hoặc ăn mòn sản phẩm sau thời gian dài sử dụng. Tiết kiệm điện năng đến 15% Bình nước nóng thông minh Rossi Ti Smart được phòng thí nghiệm Cotherm – Pháp kiểm nghiệm và chứng nhận tiết kiệm điện năng lên tới 15%. Do đó bạn hoàn toàn có thể yên tâm sử dụng và lắp đặt bình nóng lạnh Rossi Ti Smart cho gia đình mình. Thanh gia nhiệt thông minh tráng men làm nóng nước nhanh Thanh gia nhiệt tráng men hiệu suất cao làm nóng nước nhanh chóng, tiết kiệm điện năng. Kết hợp bộ ổn nhiệt thông minh chống cháy khô cho sản phẩm có độ an toàn tuyệt đối và tuổi thọ cao khi vận hành. Hệ thống an toàn đồng bộ yên tâm khi sử dụng Ngoài ra, sản phẩm còn tích hợp hệ thống an toàn đồng bộ giúp cho người dùng yên tâm khi sử dụng và dễ dàng xử lý khi có sự cố xảy ra. * Chú ý : Bình nước nóng các hãng Ariston, Ferroli, Picenza, Rossi, Midea đều được bảo hành tại nhà khách. Khi cần bảo hành chỉ cần báo tổng đài của hãng đó là thợ của hãng đến tận nhà bảo hành. Tuyệt đối ko tháo bình đã lắp trả về cho nhà cung cấp.",""""""
adayroi.com,https://www.adayroi.com/binh-nong-lanh-chong-giat-rossi-r15ti-15l-p-781897?offer=781897_092105,781897,Rossi,Máy nước nóng,Bình nóng lạnh chống giật Rossi R15Ti 15L,1.540.000đ,Xuân Thành,Máy nước nóng Rossi,"- Thiết kế sang trọng, tinh tế. - Thanh gia nhiệt thông minh tráng men làm nóng nước nhanh . - Tiết kiệm đến 15% điện năng tiêu thụ. - Bộ ổn nhiệt thông minh chống cháy khô . - Hệ thống an toàn đồng bộ yên tâm khi sử dụng. Điện áp 220V Model R15Ti Kích thước 40 x 40 x 33 (cm) Xuất xứ Việt Nam Dung tích 15L. Thiết kế sang trọng, tinh tế Bình nóng lạnh chống giật Rossi R15Ti 15L sở hữu kiểu dáng sang trọng, màu sắc phối kết hợp tinh tế, đem đến cho không gian nội thất phòng tắm của gia đình bạn thêm tiện nghi, hiện đại. Sản phẩm thuộc dòng bình nước nóng gián tiếp, có dung tích 15lít, phù hợp với gia đình có từ 3đến 4thành viên. Tiết kiệm điện năng đến 15% Bình nước nóng thông minh Rossi Ti được phòng thí nghiệm Cotherm – Pháp kiểm nghiệm và chứng nhận tiết kiệm điện năng lên tới 15%. Do đó bạn hoàn toàn có thể yên tâm sử dụng và lắp đặt bình nóng lạnh Rossi Ti cho gia đình mình. Thanh gia nhiệt thông minh tráng men làm nóng nước nhanh Thanh gia nhiệt tráng men hiệu suất cao làm nóng nước nhanh chóng, tiết kiệm điện năng. Kết hợp bộ ổn nhiệt thông minh chống cháy khô cho sản phẩm có độ an toàn tuyệt đối và tuổi thọ cao khi vận hành. Hệ thống an toàn đồng bộ yên tâm khi sử dụng Ngoài ra, sản phẩm còn tích hợp hệ thống an toàn đồng bộ giúp cho người dùng yên tâm khi sử dụng và dễ dàng xử lý khi có sự cố xảy ra. * Chú ý : Bình nước nóng các hãng Ariston, Ferroli, Picenza, Rossi, Midea đều được bảo hành tại nhà khách. Khi cần bảo hành chỉ cần báo tổng đài của hãng đó là thợ của hãng đến tận nhà bảo hành. Tuyệt đối ko tháo bình đã lắp trả về cho nhà cung cấp.",""""""
adayroi.com,https://www.adayroi.com/binh-nuoc-nong-ferroli-hotdog-e-5l-chong-giat-cong-suat-1500w-trang-tang-doi-day-cap-nuoc-p-493092?offer=493092_092105,493092,Ferroli,Máy nước nóng,"Bình nước nóng Ferroli Hotdog E 5L chống giật, công suất 1500W (trắng) - Tặng đôi dây cấp nước",1.570.000đ,Xuân Thành,Máy nước nóng Ferroli,"*Tặng đôi dây cấp nước. - Công suất làm nóng 1500W. - Cơ chế sử dụng dễ dàng. - Bình chứa được sản xuất trên dây chuyền tự động hoàn toàn. - Lòng bình có khả năng cách nhiệt tối ưu. Công suất 1500W Điện áp 220V Bảo hành Bảo hành 8 năm đối với bình chứa và 2 năm đối với linh kiện điện tử Hướng dẫn sử dụng Cắm đúng điện áp 220V Model Hotdog 5-1.5 Kích thước 35,5 x 28 x 22,3 (cm) Dung tích 5L Chất liệu Nhựa, thép, nhôm. Bình nước nóng Ferroli Hotdog 5L công suất 1500W là một sản phẩm sở hữu hầu hết các tính năng tiêu chuẩn của một máy nước nóng gia đình. Sản phẩm sở hữucơ chế sử dụng dễ dàng, thiết kế ở vị trí chính diện vừa tầm với. Sản phẩm có kích thước nhỏ gọn, được dùng chủ yếu cùng với bồn rửa tay, máy rửa bát... Bình chứa được sản xuất trên dây chuyền tự động hoàn toàn. Lớp men Titan đặc biệt được phủ kín bề mặt ruột bình bằng công nghệ tĩnh điện tiên tiến nhất hiện nay, sau đó được nung nóng ở nhiệt độ 850 độ C, làm cho bề mặt ruột bình thành một mặt phẳng trơn mịn, chống rò rỉ điện, cực kỳ an toàn. Lòng bình chứa có một phần được cấu tạo bằng lớp bọt tổng hợp Polyurethane đậm đặc không chứa CFC - một ""khí nhà kính"" gây hại tầng Ozone, đây là lớp cách nhiệt đảm bảo hạn chế sự thất thoát nhiệt và tổn thất năng lượng. Bình nước nóng Ferroli Hotdog 5L công suất 1500W được tráng Titan siêu bền, trang bị đèn LED báo nhiệt chính xác. Sản phẩm cóthiết kế hiện đại, trang nhã, dễ dàng hòa hợp với mọi phong cách trang trí trong không gian gia đình. Thông số kỹ thuật - Áp lực nước: 0.8MPa Thông tin thương hiệu Công ty TNHH Ferroli Asean là thành viên của tập đoàn Ferroli - một doanh nghiệp với 100% vốn đầu tư của Italia chuyên sản xuất các thiết bị về nhiệt bao gồm: bình nước nóng trực tiếp, gián tiếp; bình nước nóng năng lượng mặt trời; máy bơm nhiệt (heatpump)… Nhà máy Ferroli được đầu tư kỹ lưỡng với đầy đủ cơ sở vật chất hiện đại, dây chuyền sản xuất tiên tiến hoàn toàn tự động. Hệ thống điều khiển bằng máy tính rất hiệu quả nhằm đảm bảo những tiêu chuẩn ở mức độ chất lượng cao nhất. Đội ngũ kỹ sư, công nhân chuyên nghiệp, được đào tạo với trình độ hạng ưu, đáp ứng mọi yêu cầu sản xuất nghiêm ngặt.",""""""
adayroi.com,https://www.adayroi.com/binh-nuoc-nong-chong-giat-rossi-amore-ra15sq-15l-trang-p-601007?offer=601007_092105,601007,Rossi,Máy nước nóng,Bình nước nóng chống giật Rossi Amore RA15SQ 15L (Trắng),1.580.000đ,Xuân Thành,Máy nước nóng Rossi,"- Ruột bình tráng men kim cương nhân tạo. - Thiết kế phù hợp với mọi không gian phòng tắm. - Công nghệ làm nóng nhanh tối ưu, tiết kiệm điện năng. - Hệ thống chống rò điện ELCB đảm bảo an toàn khi sử dụng. Công suất 2500W Điện áp 220V Thời hạn bảo hành 7 (năm) Model RA15SQ Xuất xứ Việt Nam Dung tích 15L Chất liệu Kim cương nhân tạo. Ruột bình nóng lạnh RossiRA15SQ ​​ được tráng 3 lớp men kim cương nhân tạo có khả năng chống chọi lại với áp suất của nước nóng trong thời gian dài. Không gây hiện tượng tạo cặn, bong tróc, đặc biệt ruột bình còn có khả năng giữ nhiệt lâu, hạn chế tối đa mức độ thất thoát nhiệt. Bình được thiết kế chế độ chống cháy khô cho thanh đốt nếu nguồn nước cấp vào bình thiếu, ngăn chặn khả năng cháy bình hay rò điện. Đóng vai trò bảo vệ người dùng khỏi bị điện giật trong trường hợp rò rỉ điện, hệ thống ELCB được đặt trên dây nguồn và được hiệu chỉnh để phản ứng (cắt điện)khi phát hiện có sự cố rò rỉ điện, giúp bạn an tâm khi sử dụng. Bìnhđược trang bị một van an toàn có chức năng điều tiết nguồn nước, đảm bảo áp suất trong ruột bình không quá cao giúp cho việc sử dụng bình được lâu bền hơn, độ bền sản phẩm cao. Bộ ổn nhiệt képgiúp bình hoạt động ổn định, tiết kiệm điện năng.Thanh magie chống đóng cặntrong ruột bình và thanh đốt, đảm bảo an toàn cho sức khỏe người sử dụng. Bình nóng lạnh Rossi RA15SQ​​ với dung tích 15L đáp ứng đầy đủ nhu cầu sử dụng trong gia đình, kiểu dáng nhỏ gọn, tiết kiệm diện tích, góp phần tô điểm cho không gian phòng tắm thêm hiện đại và sang trọng.",""""""
adayroi.com,https://www.adayroi.com/may-nuoc-nong-chong-giat-khong-bom-ariston-sb35e-vn-trang-tang-1-day-cap-nuoc-p-601014?offer=601014_092105,601014,Ariston,Máy nước nóng,Máy nước nóng chống giật không bơm Ariston SB35E-VN (Trắng) - Tặng 1 dây cấp nước,1.588.000đ,Xuân Thành,Máy nước nóng Ariston,"- Thiết kế mang phong cách Italia. - Nhiều công suất làm nóng. - Hệ thống an toàn đồng bộ. - Bình không có bơm tăng áp nên thích hợp với gia đình có áp lực nước mạnh. Công suất 3500W Điện áp 220V Thời hạn bảo hành 2 (năm) Model SB35E-VN Xuất xứ Việt Nam. Thiết kế mang phong cách Italia Được tạo nên bởi nhà thiết kế nổi tiếng người Ý - Umberto Palermo, máy nước nóng Ariston SB35E-VN mang đậm phong cách thời thượng với kiểu dáng vuông vức toát lên sự mạnh mẽ và vô cùng sang trọng. Dù được đặt ở bất kỳ vị trí nào, Ariston SB35E-VN chắc chắn cũng sẽ làm nổi bật không gian ngôi nhà tắm của bạn. Nhiều công suất làm nóng Máy nước nóng Ariston SB35E-VN có nhiều chế độ tùy chỉnh công suất và nhiệt độ nước khác nhau, phù hợp với nhu cầu riêng của từng thành viên trong gia đình. Bạn có thể thoải mái điều chỉnh nước nóng hay ấm vừa tùy vào điều kiện thời tiết và sở thích mỗi ngày. Hệ thống an toàn đồng bộ Để đảm bảo an toàntrong quá trình sử dụng, Ariston SB35E-VN được trang bị nhiều tính năng bảo vệ vượt trội như: cầu dao chống giật lưỡng cực ELCB tự động kiểm tra và ngắt điện ở cả 2 cực (dây pha và dây trung tính) khi phát hiện rò rỉ điện, tiêu chuẩn tương thích điện từ EMC, mạch điện PCB siêu bền, thiết kế chống thấm nước IP25 theo tiêu chuẩn an toàn Châu Âu IEC60529,… Với hệ thống an toàn này, bạn có thể hoàn toàn yên tâm sử dụng mà không lo gặp phải bất kỳ sự cố nào.",""""""
adayroi.com,https://www.adayroi.com/binh-nuoc-nong-truc-tiep-ariston-sb35e-vn-3500w-trang-p-PRI1288396?offer=PRI1288396_092105,PRI1288396,Ariston,Máy nước nóng,Bình nước nóng trực tiếp Ariston SB35E-VN 3500W (Trắng),1.588.000đ,Xuân Thành,Máy nước nóng trực tiếp Ariston,"- Thiết kế mang phong cách Italia. - Nhiều công suất làm nóng. - Hệ thống an toàn đồng bộ. - Bình không có bơm tăng áp nên thích hợp với gia đình có áp lực nước mạnh. Công suất 3500W Trọng lượng 1.6kg Điện áp 220V Thời hạn bảo hành 24 tháng Màu sắc Trắng Model SB35E-VN Kích thước 234 x 110 x 297 (mm) Xuất xứ Việt Nam. Thiết kế mang phong cách Italia Được tạo nên bởi nhà thiết kế nổi tiếng người Ý - Umberto Palermo, máy nước nóng Ariston SB35E-VN mang đậm phong cách thời thượng với kiểu dáng vuông vức toát lên sự mạnh mẽ và vô cùng sang trọng. Dù được đặt ở bất kỳ vị trí nào, Ariston SB35E-VN chắc chắn cũng sẽ làm nổi bật không gian ngôi nhà tắm của bạn. Nhiều công suất làm nóng Máy nước nóng Ariston SB35E-VN có nhiều chế độ tùy chỉnh công suất và nhiệt độ nước khác nhau, phù hợp với nhu cầu riêng của từng thành viên trong gia đình. Bạn có thể thoải mái điều chỉnh nước nóng hay ấm vừa tùy vào điều kiện thời tiết và sở thích mỗi ngày. Hệ thống an toàn đồng bộ Để đảm bảo an toàntrong quá trình sử dụng, Ariston SB35E-VN được trang bị nhiều tính năng bảo vệ vượt trội như: cầu dao chống giật lưỡng cực ELCB tự động kiểm tra và ngắt điện ở cả 2 cực (dây pha và dây trung tính) khi phát hiện rò rỉ điện, tiêu chuẩn tương thích điện từ EMC, mạch điện PCB siêu bền, thiết kế chống thấm nước IP25 theo tiêu chuẩn an toàn Châu Âu IEC60529,… Với hệ thống an toàn này, bạn có thể hoàn toàn yên tâm sử dụng mà không lo gặp phải bất kỳ sự cố nào.",""""""
adayroi.com,https://www.adayroi.com/binh-nuoc-nong-gian-tiep-chong-giat-rossi-r20ti-20l-trang-p-593451?offer=593451_092105,593451,Rossi,Máy nước nóng,Bình nước nóng gián tiếp chống giật Rossi R20Ti 20L (Trắng),1.588.000đ,Xuân Thành,Máy nước nóng gián tiếp Rossi,"- Thiết kế sang trọng, hiện đại. - Dung tích bình đun 20 lít. - Thanh đốt tráng men Titan chống ăn mòn. - Bộ ổn định nhiệt kép. - Cọc đốt kép giúp nước nóng nhanh. Bảo hành 07 năm, tại nhà Model R20Ti  Kích thước 42 x 42 x 38 cm Xuất xứ Việt Nam Dung tích 20L. Thiết kế sang trọng, hiện đại Bình nước nóng gián tiếp chống giật Rossi R20Ti sở hữu kiểu dáng hiện đại, màu sắc phối kết hợp tinh tế, phù hợp lắp đặt trong mọi không gian nội thất. Với dung tích bình đun 20 lít, thiết bị rất phù hợp sử dụng cho gia đìnhcó khoảng 2 - 3 thành viên. Thanh đốt tráng men Titan chống ăn mòn Bình nước nóng gián tiếp chống giật Rossi R20Ti sử dụng thanh đốt tráng men Titan giúp bảo vệ thanh đốt chống ăn mòn của các cặn bẩn, kim loại trong nước. Nhờ đó mà tuổi thọ thanh đốt được kéo dài hơn và hạn chế tiêu hao năng lượng, cho hiệu quả tiết kiệm điện đáng kể. Bộ ổn định nhiệt kép Thiết bị ổn định nhiệt giữ vai trò rất quan trọng đối với máy nước nóng, với 2 chức năng chính: bộ cảm biến thứ nhất sẽ dừng quá trình làm nóng khi nước đã đạt đến nhiệt độ mong muốn, bộ cảm biến thứ hai sẽ tự động ngắt nguồn điện trong trường hợp nhiệt quá cao để bảo đảm an toàn cho người sử dụng. #nguồn: Internet",""""""
adayroi.com,https://www.adayroi.com/binh-nong-lanh-chong-giat-rossi-r20ti-smart-20l-trang-men-kim-cuong-nhan-tao-p-781801?offer=781801_092105,781801,Rossi,Máy nước nóng,Bình nóng lạnh chống giật Rossi R20Ti Smart 20L (Tráng men kim cương nhân tạo),1.588.000đ,Xuân Thành,Máy nước nóng Rossi,"- Thiết kế sang trọng, tinh tế. - Ruột bình tráng men kim cương nhân tạo siêu bền. - Thanh gia nhiệt thông minh tráng men làm nóng nước nhanh . - Tiết kiệm đến 15% điện năng tiêu thụ. - Bộ ổn nhiệt thông minh chống cháy khô . - Hệ thống an toàn đồng bộ yên tâm khi sử dụng. Điện áp 220V Thời hạn bảo hành 7 (năm) Model R20Ti Smart Kích thước 42 x 42 x 38 (cm) Xuất xứ Việt Nam Dung tích 20L. Thiết kế sang trọng, tinh tế Bình nóng lạnh chống giật Rossi R20Ti Smart 20L sở hữu kiểu dáng sang trọng, màu sắc phối kết hợp tinh tế, đem đến cho không gian nội thất phòng tắm của gia đình bạn thêm tiện nghi, hiện đại. Sản phẩm thuộc dòng bình nước nóng gián tiếp, có dung tích 20 lít, phù hợp với gia đình có từ 2 đến 3 thành viên. Ruột bình tráng men kim cương nhân tạo Kim cương nhân tạo có tính chất vật lý và hóa học giống như kim cương thiên nhiên, là chất cách điện tốt và đặc biệt không giãn nở khi nhiệt độ thay đổi. Ruột bình nóng lạnh Rossi Ti Smart được tráng men kim cương nhân tạo siêu bền, cho khả năng giữ nhiệt tốt, hạn chế bám cặn hoặc ăn mòn sản phẩm sau thời gian dài sử dụng. Tiết kiệm điện năng đến 15% Bình nước nóng thông minh Rossi Ti Smart được phòng thí nghiệm Cotherm – Pháp kiểm nghiệm và chứng nhận tiết kiệm điện năng lên tới 15%. Do đó bạn hoàn toàn có thể yên tâm sử dụng và lắp đặt bình nóng lạnh Rossi Ti Smart cho gia đình mình. Thanh gia nhiệt thông minh tráng men làm nóng nước nhanh Thanh gia nhiệt tráng men hiệu suất cao làm nóng nước nhanh chóng, tiết kiệm điện năng. Kết hợp bộ ổn nhiệt thông minh chống cháy khô cho sản phẩm có độ an toàn tuyệt đối và tuổi thọ cao khi vận hành. Hệ thống an toàn đồng bộ yên tâm khi sử dụng Ngoài ra, sản phẩm còn tích hợp hệ thống an toàn đồng bộ giúp cho người dùng yên tâm khi sử dụng và dễ dàng xử lý khi có sự cố xảy ra. * Chú ý : Bình nước nóng các hãng Ariston, Ferroli, Picenza, Rossi, Midea đều được bảo hành tại nhà khách. Khi cần bảo hành chỉ cần báo tổng đài của hãng đó là thợ của hãng đến tận nhà bảo hành. Tuyệt đối ko tháo bình đã lắp trả về cho nhà cung cấp.",""""""
