Domain,Url,Product_id,Brand,Category,Model,Price,Seller,Tags,Info,Others
adayroi.com,https://www.adayroi.com/may-tam-nong-ariston-an-15-lux-2-5-fe-t-p-1659064?offer=1659064_113098,1659064,Ariston,Máy nước nóng,Máy tắm nóng Ariston AN 15 LUX 2.5 FE-T,3.489.000đ,Điện máy Toàn Cầu,Máy nước nóng Ariston,"- Dung tích 15 lít, công suất 2500W. - Thiết kế phù hợp với mọi không gian phòng tắm. - Thanh đốt bằng đồng đảm bảo an toàn cho sức khỏe người dùng. - Công nghệ làm nóng nhanh tối ưu, tiết kiệm điện năng. - Hệ thống an toàn đồng bộ TSS tích hợp ELCB. - Ổn định và cân bằng nhiệt. Nguồn điện 220V Công suất 2500W Trọng lượng 8.5kg Dài 360mm Điện áp 220V Cao 318mm Rộng 360mm Bảo hành 5 tháng Tên gọi chung Máy tắm nóng Model AN 15 LUX 2.5 FE-T. Máy tắm nóng Ariston AN 15LUX 2.5 FE-T​ với thiết kế thanh đốt bằng chất liệu đồng nguyên chất, tăng hơn so với 50% tuổi thọ so với thanh đốt bằng thép không gỉ thông thường. Máy tắm nóng Ariston AN 15LUX 2.5 FE-T sử dụng lớp men Titan đóng vai trò là chiếc áo bảo vệ thanh đốt khỏi sự ăn mòn của các cặn bẩn, làm gia tăng tuổi thọ thanh đốt và hạn chế tiêu hao năng lượng Thiết bị ổn định nhiệt giữ vai trò rất quan trọng đối với máy nước nóng, với 2 chức năng chính: bộ cảm biến thứ nhất sẽ dừng quá trình làm nóng khi nước đã đạt đến nhiệt độ mong muốn, bộ cảm biến thứ hai sẽ tự động ngắt nguồn điện trong trường hợp nhiệt quá cao để bảo đảm an toàn cho người sử dụng Máy tắm nóng Ariston AN 15LUX 2.5 FE-T có dung tích dự trữ nguồn nước nóng lên đến 15lít đem lại sự thuận tiện cho người dùng với nguồn nước nóng được duy trì liên tục ở nhiệt độ ổn định, từ đó hạn chế việc khởi động máy nhiều lần Hệ thống an toàn ELCB : Đóng vai trò bảo vệ người dùng khỏi bị điện giật trong trường hợp rò rỉ điện, hệ thống ELCB được đặt trên dây nguồn và được hiệu chỉnh để phản ứng (cắt điện) trong thời gian 1/1000 giây khi phát hiện có sự cố rò rỉ điện, giúp bạn an tâm tận hưởng ",""""""
adayroi.com,https://www.adayroi.com/binh-nuoc-nong-gian-tiep-ariston-sl30b-30l-p-PRI891450?offer=PRI891450_M-PYY,PRI891450,Ariston,Máy nước nóng,Bình nước nóng gián tiếp Ariston SL30B 30L,3.492.000đ,GIA VIET D,"Máy nước nóng gián tiếp Ariston,SL30B","- Bình chứa tráng men Titan. - Thanh đốt bằng đồng. - Công nghệ Flexomix. - Lớp cách nhiệt mật độ cao. - Nút tùy chỉnh nhiệt độ. - Vỏ chống thấm nước. Công suất 2500W Trọng lượng 16.5kg Điện áp 220V Thời hạn bảo hành 7 năm Model SL30B Kích thước 710 x 423 x 323 (mm) Xuất xứ Việt Nam Dung tích 30L Chất liệu Tráng men Titan, thanh đốt đồng. - Bình nước nóng gián tiếp Ariston SL30B30L với điểm nhấn là đường cong Latinh trang nhã cùng kiểu dáng tinh gọn, sản phẩmtạo cảm quan hài hòa với thiết kế phòng tắm hiện đại. - Bìnhcó cấu trúc đặc biệt đơn giản cho phép dễ dàng kiểm tra và bảo trì khi cần thiết. Ống dẫn nước với các cực magie nằm ở đáy bình chứa nên dễ dàng thay thế, kéo dài tuổi thọ của thiết bị. - Bình chứa tráng men Titan, ELCB chống rò rỉ điện, tiết kiệm điện năng, thiết bị ổn định nhiệt, vỏ chống thấm nước, cho thời gian sử dụng dài lâu và an toàn khi sử dụng. - Thanh đốt bằng đồngcóưu điểm kéo dài tuổi thọ,tăng hơn 50% so với thanh đốt bằng thép không gỉ thông thường. Nhờ sử dụng 100% nguyên liệu an toàn,không mạ kền, có tác dụng kháng khuẩn,thanh đốt bằng đồng đem lại nguồn nước trong lành, tốt hơn cho sức khỏe người sử dụng. - Cấu trúc bình chứacho phép sản phẩm đạt tốc độ gia nhiệt nhanh hơnso với các sản phẩm khác hiện có trên thị trường. - Bình nước nóng gián tiếp Ariston SL30B30L là sự kết hợp hoàn hảo giữa thiết kế và công nghệ,đem đến tiện nghi đỉnh caokhi trang bị đèn báo kép màu xanh hiển thị thời điểm nước nóng sẵn sàng ởbình chứa.",""""""
adayroi.com,https://www.adayroi.com/may-tam-nong-ariston-an-30-rs-2-5-fe-mt-p-PRI909779?offer=PRI909779_121004,PRI909779,Ariston,Máy nước nóng,"Máy tắm nóng Ariston AN 30 RS 2,5 FE-MT",3.499.000đ,VINPRO,"Máy nước nóng Ariston,Bình tắm ARISTON AN 30 RS 2","- Công suất làm nóng 2500W. - Thiết kế phù hợp với mọi không gian phòng tắm. - Công nghệ làm nóng nhanh tối ưu, tiết kiệm điện năng. - Thanh đốt bằng đồng đảm bảo an toàn cho sức khỏe. Công suất 2500W Trọng lượng 13kg Điện áp 220V Model AN 30 RS 2,5 FE-MT Kích thước 44.7 x 44.7 x 38 cm Dung tích 30L Chất liệu Tráng men titan, đồng. - Máy tắm nóng Ariston AN 30 RS 2,5 FE-MT được thiết kế kiểu dáng sang trọng, tinh tế tích hợp những tính năng của công nghệ mớinhất nhằm bảo đảm an toàn cho người sử dụng, thân thiện qua tín hiệu đèn báo nước nóng sẵn sàng và các công nghệ nhằm duy trì tối đa tuổi thọ của thiết bị, cho bạn và gia đình antâm tận hưởng làn nước ấm nóng với mọi tiện nghi trong tầm tay. - Bình chứa tráng men Titan, ELCB chống rò rỉ điện, tiết kiệm điện năng, thiết bị ổn định nhiệt, vỏ chống thấm nước, cho thời gian sử dụng dài lâu và an toàn khi sử dụng. -Ariston sáng chế công nghệ thanh đốt tự làm sạch bằng việc tích hợp chất liệu hợp kim thép không gỉ và công nghệ xử lý bề mặt tiên tiến. Bề mặt sáng bóng giúp giảm thiểu cặn bẩn bám trên thanh đốt, nhờ vậy tỉ suất trao đổi nhiệt giữa thanh đốt và nước luôn đạt mức tối ưu kể cả sau thời gian dài sử dụng. - Thiết bị ổn định nhiệt và kiểm soát độ an toàn TBSTcủa máy nước nóng với chức năng kép: bộ cảm biến thứ nhất sẽ dừng quá trình làm nóng khi nước đã đạt đến nhiệt độ mong muốn (giúp tiết kiệm năng lượng), bộ cảm biến thứ hai sẽ tự động ngắt nguồn điện trong trường hợp nhiệt quá cao (bảo đảm an toàn cho người sử dụng). - Đèn báo nước nóng sẵn sànglà chức năng thân thiện với người dùng giúp bạn chủ động thời gian và giảm hao phí điện năng. Sau khi nước đã đạt đến nhiệt độ lý tưởng, đèn LEDmàu xanh sẽ sáng lên báo hiệu nước nóng sẵn sàng. - Bình nước nóng Ariston AN 30 RS 2,5 FE-MT sử dụng thanh đốt bằng đồngvới ưu điểm kéo dài tuổi thọ,tăng hơn 50% so với thanh đốt bằng thép không gỉ thông thường. Nhờ sử dụng 100% nguyên liệu an toàn,không mạ kền, có tác dụng kháng khuẩn,thanh đốt bằng đồng đem lại nguồn nước trong lành, tốt hơn cho sức khỏe người sử dụng. Thông số kỹ thuật - Thời gian gia nhiệt (△T = 35 độ C): 31phút - Nhiệt độ hoạt động tối đa: 76 độ C - Áp suất hoạt động tối đa: 0.75Mpa",""""""
adayroi.com,https://www.adayroi.com/binh-nuoc-nong-ariston-slim2-20-rs-mt-20-lit-p-1894003?offer=1894003_092105,1894003,Ariston,Máy nước nóng,Bình nước nóng Ariston Slim2 20 RS MT - 20 lít,3.500.000đ,Xuân Thành,"Máy nước nóng gián tiếp Ariston,Ariston Slim2 20 RS MT,Máy tắm nóng ariston,Bình nước nóng","- Bình chứa tráng men Titan cho độ bền vượt trội. - Hệ thống an toàn đồng bộ tích hợp ELCB chống giật . - Lớp cách nhiệt mật độ cao . - Tiết kiệm điện năng chuẩn 5 sao. - Vỏ bình chống thấm nước, an toàn khi sử dụng. Nguồn điện 220V Công suất 2500W Trọng lượng 12kg Bảo hành Bảo hành chính hãng 7 năm với bình chứa, linh kiện điện 1 năm. Bảo hành tại nhà khách hàng trên toàn quốc Model Slim2 20 RS MT Kích thước 704 x 301 x 282mm Dung tích 20L Chất liệu Bình chứa tráng men Titan, Vỏ chống thấm nước. Thanh đốt bằng đồng bền vượt trội Đồng kim loại có ưu điểm làm nóng nhanh, kéo dài tuổi thọ của thanh đốt: tăng hơn 50% so với thanh đốt bằng thép không gỉ thông thường. Nhờ sử dụng 100% nguyên liệu an toàn – không mạ kền, có tác dụng kháng khuẩn – thanh đốt bằng đồng đem lại nguồn nước trong lành, tốt hơn cho sức khỏe người sử dụng. ELCB và bộ ổn định nhiệt điện tử TBST Thiết bị ổn định nhiệt giữ vai trò rất quan trọng đối vớimáy nước nóng Ariston Slim2 20 RS MT . Bộ cảm biến đầu tiênsẽ dừng quá trình làm nóng khi nước đã đạt đến nhiệt độ mong muốn, bộ cảm biến thứ hai sẽ tự động ngắt nguồn điện trong trường hợp nước nóng vượt quá ngưỡng nhiệt độ cao của máy để bảo đảm an toàn cho người sử dụng. Công nghệ Ion bạc làm sạch nước Thấu hiểu nhu cầu được sử dụng nước sạch và an toàn của người tiêu dùng, Ariston đã phát triển công nghệ Ion bạc với khả năng kháng khuẩn, làm sạch nước. Các khối cầu Ion bạc Ag+ nằm trong ống dẫn đặc biệt được đặt cố định tại đường nước vào trong bình chứa. Nước khi chảy qua ống để vào bình chứa sẽ tiếp xúc với các khối cầu này. Các hạt Ion bạc sẽ là những dũng sĩ ngăn cản sự sinh sôi và giảm quá trình phát triển của vi khuẩn trong bình chứa đến 80%. Đèn báo nước nóng sẵn sàng Bình nước nóng Ariston Slim2 20 RS MT - 20 lít trang bị đèn báo nước nóng sẵn sàng sẽ giúp bạn và người thân dễ dàng nhận biết khi nào nước đã nóng đủ độ để có thể sử dụng. Do đó, bạn sẽ tránh được tình trạng đun nước lâu quá gây hao tổn điện, hay trường hợp nước vẫn chưa nóng đủ độ dẫn đến bị lạnh khi tắm. Vỏ chống thấm nước Vỏ bình được thiết kế chống thấm nước, vì vậy bạn hoàn toàn có thể yên tâm lắp đặt trong nhà tắm. Nhờ khả năng chống thấm nên bình vận hành an toàn khi gặp độ ẩm cao, không bị rò rỉ điện ra ngoài.",""""""
adayroi.com,https://www.adayroi.com/binh-nuoc-nong-ferroli-qqevo-ae-50l-chong-can-chong-giat-cong-suat-2500w-tang-doi-day-cap-nuoc-p-PRI418005?offer=PRI418005_BC6,PRI418005,Ferroli,Máy nước nóng,"Bình nước nóng Ferroli QQEvo AE 50L, chống cặn, chống giật, công suất 2500W - Tặng đôi dây cấp nước",3.594.000đ,FERROLI AS,"Máy nước nóng Ferroli,Ferroli QQEvo AE 50L","*** Tặng đôi dây cấp nước. - Công suất 2500W cho thời gian làm nóng nhanh. - Ruột bình phủ lớp men Titan chống rò rỉ điện. - Trang bị 2 rơ le kiểm soát nhiệt độ và chống chay nổ. - Trang bị đèn LED báo nhiệt chính xác. Công suất 2500W Trọng lượng 14.5kg Điện áp 220V Bảo hành Bảo hành 8 năm đối với bình chứa và 2 năm đối với linh kiện điện tử Hướng dẫn sử dụng Cắm đúng điện áp 220V, điều chỉnh nhiệt độ làm nóng phù hợp nhu cầu. Thường xuyên xả cặn để lòng bình bền hơn. Model QQ 50AE Kích thước 74 x 37 x 39 cm Hướng dẫn bảo quản Lắp ở vị trí cao, xa tầm với trẻ nhỏ, đồng thời hạn chế tiếp xúc thường xuyên với nước. Dung tích 50L Chất liệu Nhựa, thép, nhôm. Bình nước nóng Ferroli QQEvo AE 50L, chống cặn, chống giật, công suất 2500W là một sản phẩm sở hữu hầu hết các tính năng tiêu chuẩn của một máy nước nóng gia đình. Với cơ chế sử dụng dễ dàng, nút điều chỉnh nhiệt độ được tích hợp trực tiếp trên vỏ máy, thiết kế ở vị trí chính diện vừa tầm với, dễ điều chỉnh. Bình chứa được sản xuất trên dây chuyền tự động hoàn toàn. Lớp men Titan đặc biệt được phủ kín bề mặt ruột bình bằng công nghệ tĩnh điện tiên tiến nhất hiện nay, sau đó được nung nóng ở nhiệt độ 850 độ C, làm cho bề mặt ruột bình thành một mặt phẳng trơn mịn, chống rò rỉ điện, cực kỳ an toàn. Người sử dụng có thể linh hoạt đóng mở van thoát nước, sục xả bình định kỳ với chỉ một thao tác vặn công tắc. Không phải tốn công sức, tiền bạc để gọi thợ sửa chữa, tiết kiệm thêm nhiều khoản chi phí sinh hoạt gia đình. Công nghệ tráng men được nghiên cứu nhằm ngăn ngừa mảng bám, giảm các tác hại do cặn nước gây ra, đảm bảo hiệu xuất thanh nhiệt luôn được duy trì song song với tuổi thọ. Bên cạnh rơ le tự động kiểm soát nhiệt độ trong bình, sản phẩm bình nước nóng của Ferroli còn trang bị thêm rơ le chống cháy khô. Rơ le sẽ tự ngắt khi nhiệt độ trong bình quá 90 độ C và chỉ có thể hoạt động trở lại khi có sự kiểm tra của kỹ thuật để ngăn sự cố thanh nhiệt bị đốt khô. Lòng bình chứa có một phần được cấu tạo bằng lớp bọt tổng hợp Polyurethane đậm đặc không chứa CFC - một ""khí nhà kính"" gây hại tầng Ozone, đây là lớp cách nhiệt đảm bảo hạn chế sự thất thoát nhiệt và tổn thất năng lượng. Mỗi sản phẩm của Ferroli đều được tráng Titan siêu bền, trang bị đèn LED báo nhiệt chính xác, cùng phong cách thiết kế hiện đại, trang nhã, dễ dàng hòa hợp với mọi phong cách trang trí trong không gian gia đình. Thông số kỹ thuật - Áp lực nước: 0.8MPa - Phương thức lắp đặt: Nằm ngang treo tường Thông tin thương hiệu Công ty TNHH Ferroli Asean là thành viên của tập đoàn Ferroli - một doanh nghiệp với 100% vốn đầu tư của Italia chuyên sản xuất các thiết bị về nhiệt bao gồm: bình nước nóng trực tiếp, gián tiếp; bình nước nóng năng lượng mặt trời; máy bơm nhiệt (heatpump)…Nhà máy Ferroli được đầu tư kỹ lưỡng với đầy đủ cơ sở vật chất hiện đại, dây chuyền sản xuất tiên tiến hoàn toàn tự động. Hệ thống điều khiển bằng máy tính rất hiệu quả nhằm đảm bảo những tiêu chuẩn ở mức độ chất lượng cao nhất. Đội ngũ kỹ sư, công nhân chuyên nghiệp, được đào tạo với trình độ hạng ưu, đáp ứng mọi yêu cầu sản xuất nghiêm ngặt.",""""""
adayroi.com,https://www.adayroi.com/may-tam-nong-ariston-an-15-lux-2-5-fe-p-PRI1314264?offer=PRI1314264_M-PYY,PRI1314264,Ariston,Máy nước nóng,Máy tắm nóng Ariston AN 15 LUX 2.5 FE,3.612.000đ,GIA VIET D,"Máy nước nóng Ariston,AN 15 LUX 2.5 FE","- Công suất làm nóng 2500W. - Thiết kế phù hợp với mọi không gian phòng tắm. - Công nghệ làm nóng nhanh tối ưu, tiết kiệm điện năng. - Thanh đốt bằng đồng đảm bảo an toàn cho sức khỏe. Công suất 2500W Trọng lượng 8.5kg Điện áp 220V Model AN 15 LUX 2.5 FE Kích thước 36 x 36 x 34.2 cm Dung tích 15L Chất liệu Tráng men titan, đồng. - Máy tắm nóng Ariston Andris AN 15 LUX 2.5 FE lấy cảm hứng từ đường nét uốn lượn gọn gàng, mềm mại của chiếc xe đua thể thao và của những công trình kiến trúc Ý danh tiếng, thiết kế UP đem đến sức sống mới cho dòng sản phẩm máy nước nóng Ariston với đường cong Latinhkhơi gợi cảm giác gia đình gần gũi và mang dấu ấn tương lai. Hòa quyện trong đường cong tuyệt hảo, Andris LUX với màu sắc đen trắng đem lại cảm quan sang trọng cho phòng tắm của bạn. - Thiết kế hai ống được ngăn cách bởi lớp Ôxít Magiê, hệ thống thanh đốt hai lớp cảm ứng bằng đồngbảo vệ người sử dụng khỏi những nguy cơ rò rỉ điện nhờ hệ thống cảm ứng thông minh. Sau thời gian sử dụng, khi lớp vật liệu thứ nhất bị hỏng do rạn nứt hoặc bị ăn mòn, hệ thống cảm ứng sẽ ngay lập tức phát hiện ra sự cố và cảnh báo cho người sử dụng: đèn báo nước đang được làm nóng và đèn báo nước nóng sẵn sàng sẽ liên tục cùng nhấp nháy. Dù thanh đốt vẫn an toàn nhờ lớp vật liệu thứ hai chưa bị ăn mòn, máy nước nóng sẽ ngừng hoạt động để bạn liên lạc với nhân viên bảo hành đến kiểm tra và khôi phục hệ thống hai lớp cảm ứng cho thanh đốt. -Thiết bị ổn định nhiệt giữ vai trò rất quan trọng đối với máy nước nóng, với 2 chức năng chính: bộ cảm biến thứ nhất sẽ dừng quá trình làm nóng khi nước đã đạt đến nhiệt độ mong muốn, bộ cảm biến thứ hai sẽ tự động ngắt nguồn điện trong trường hợp nhiệt quá cao để bảo đảm an toàn cho người sử dụng. - Thấu hiểu nhu cầu được sử dụng nước sạch và an toàn của người tiêu dùng, Ariston đã phát triển công nghệ Ion bạc với khả năng kháng khuẩn, làm sạch nước. Các khối cầu Ion bạc Ag+ nằm trong ống dẫn đặc biệt được đặt cố định tại đường nước vào trong bình chứa. Nước khi chảy qua ống để vào bình chứa sẽ tiếp xúc với các khối cầu này. Các hạt Ion bạc sẽ là những dũng sĩ ngăn cản sự sinh sôi và giảm quá trình phát triển của vi khuẩn trong bình chứa đến 80%. - Bình nước nóng Ariston Andris AN 15 LUX 2.5 FE 15L​ sử dụng lớp men Titan đóng vai trò là chiếc áo bảo vệ thanh đốt khỏi sự ăn mòn của các cặn bẩn, làm gia tăng tuổi thọ thanh đốt và hạn chế tiêu hao năng lượng. - Lần đầu tiên, một chiếc máy nước nóng có thể giao tiếp với người sử dụng thông qua đèn LED xanh báo hiệu nước nóng sẵn sàng để tắm, giúp bạn chủ động về thời gian và tiết kiệm điện. Thông số kỹ thuật - Thời gian gia nhiệt (△T = 35 độ C): 15 phút - Nhiệt độ hoạt động tối đa: 76 độ C - Áp suất hoạt động tối đa: 0.75Mpa",""""""
adayroi.com,https://www.adayroi.com/binh-nuoc-nong-ariston-andris2-rs-mt-30-lit-p-1892069?offer=1892069_092105,1892069,Ariston,Máy nước nóng,Bình nước nóng Ariston Andris2 RS MT 30 lít,3.660.000đ,Xuân Thành,"Máy nước nóng gián tiếp Ariston,Ariston Andris2 RS MT ,Máy tắm nóng ariston,Bình nước nóng","- Bình chứa tráng men Titan cho độ bền vượt trội. - Hệ thống an toàn đồng bộ tích hợp ELCB chống giật . - Lớp cách nhiệt mật độ cao . - Tiết kiệm điện năng chuẩn 5 sao. - Vỏ bình chống thấm nước, an toàn khi sử dụng. Nguồn điện 220V Công suất 2500W Trọng lượng 13kg Bảo hành Bảo hành chính hãng 7 năm với bình chứa, linh kiện điện 1 năm. Bảo hành tại nhà khách hàng trên toàn quốc Model Andris2 RS MT 30 Kích thước 447 x 380 x 447mm Xuất xứ Việt Nam Dung tích 30L Chất liệu Bình chứa tráng men Titan, Vỏ chống thấm nước. Với khả năng tùy chỉnh mức nhiệt độ dễ dàng kết hợp đèn LED báo nước nóng sẵn sàng, Ariston ANDRIS2 RS MT mang đến cho người sử dụng sự tiện nghi và thoải mái bất tận. Bên cạnh đó, ANDRIS2 RS MT sử dụng thanh đốt 100% Đồng để mang lại hiệu quả làm nóng nhanh, chống bám cặn và bền bỉ với thời gian, hơn hẳn tiêu chuẩn phổ biến trên thị trường sử dụng thanh đốt bằng INOX/thép không gỉ (sản phẩm thông thường) với công nghệ tráng men, cho độ bền vượt trội. Thanh đốt bằng đồng bền vượt trội Đồng kim loại có ưu điểm làm nóng nhanh, kéo dài tuổi thọ của thanh đốt: tăng hơn 50% so với thanh đốt bằng thép không gỉ thông thường. Nhờ sử dụng 100% nguyên liệu an toàn – không mạ kền, có tác dụng kháng khuẩn – thanh đốt bằng đồng đem lại nguồn nước trong lành, tốt hơn cho sức khỏe người sử dụng. Công nghệ Ion bạc làm sạch nước Thấu hiểu nhu cầu được sử dụng nước sạch và an toàn của người tiêu dùng, Ariston đã phát triển công nghệ Ion bạc với khả năng kháng khuẩn, làm sạch nước. Các khối cầu Ion bạc Ag+ nằm trong ống dẫn đặc biệt được đặt cố định tại đường nước vào trong bình chứa. Nước khi chảy qua ống để vào bình chứa sẽ tiếp xúc với các khối cầu này. Các hạt Ion bạc sẽ là những dũng sĩ ngăn cản sự sinh sôi và giảm quá trình phát triển của vi khuẩn trong bình chứa đến 80%. ELCB và Bộ ổn định nhiệt điện tử TBST Thiết bị ổn định nhiệt giữ vai trò rất quan trọng đối với máy nước nóng Ariston Andris2 RS MT 30 , với 2 chức năng chính. Bộ cảm biến đầu tiên sẽ dừng quá trình làm nóng khi nước đã đạt đến nhiệt độ mong muốn, bộ cảm biến thứ hai sẽ tự động ngắt nguồn điện trong trường hợp nước nóng vượt quá ngưỡng nhiệt độ cao của máy để bảo đảm an toàn cho người sử dụng. Đèn báo nước nóng sẵn sàng Bình nước nóng Ariston Andris2 RS MT 30 lít trang bị đèn báo nước nóng sẵn sàng sẽ giúp bạn và người thân dễ dàng nhận biết khi nào nước đã nóng đủ độ để có thể sử dụng. Do đó, bạn sẽ tránh được tình trạng đun nước lâu quá gây hao tổn điện, hay trường hợp nước vẫn chưa nóng đủ độ dẫn đến bị lạnh khi tắm. Vỏ chống thấm nước Vỏ bình được thiết kế chống thấm nước, vì vậy bạn hoàn toàn có thể yên tâm lắp đặt trong nhà tắm. Nhờ khả năng chống thấm nên bình vận hành an toàn khi gặp độ ẩm cao, không bị rò rỉ điện ra ngoài.",""""""
