Domain,Url,Product_id,Brand,Category,Model,Price,Seller,Tags,Info,Others
adayroi.com,https://www.adayroi.com/binh-nuoc-nong-ariston-andris-an-15-rs-2-5-fe-15l-p-1659351?offer=1659351_113098,1659351,Ariston,Máy nước nóng,Bình nước nóng Ariston Andris AN 15 RS 2.5 FE 15L,2.686.000đ,Điện máy Toàn Cầu,Máy nước nóng Ariston,"- Công suất làm nóng 2500W. - Thiết kế phù hợp với mọi không gian phòng tắm. - Công nghệ làm nóng nhanh tối ưu, tiết kiệm điện năng. - Thanh đốt bằng đồng đảm bảo an toàn cho sức khỏe. Nguồn điện 220V Công suất 2500W Trọng lượng 8.5kg Điện áp 220V Bảo hành 5 năm Nguồn gốc Chính hãng Model AN 15 RS 2.5 FE Kích thước 36 x 36 x 31.8 cm Xuất xứ Việt Nam Dung tích 15L. - Bình nước nóng Ariston Andris AN 15 RS 2.5 FE 15L​​ được thiết kế kiểu dáng sang trọng, tinh tế tích hợp những tính năng của công nghệ mớinhất nhằm bảo đảm an toàn cho người sử dụng, thân thiện qua tín hiệu đèn báo nước nóng sẵn sàng và các công nghệ nhằm duy trì tối đa tuổi thọ của thiết bị, cho bạn và gia đình antâm tận hưởng làn nước ấm nóng với mọi tiện nghi trong tầm tay. - Bình chứa tráng men Titan, ELCB chống rò rỉ điện, tiết kiệm điện năng, thiết bị ổn định nhiệt, vỏ chống thấm nước, cho thời gian sử dụng dài lâu và an toàn khi sử dụng. -Ariston sáng chế công nghệ thanh đốt tự làm sạch bằng việc tích hợp chất liệu hợp kim thép không gỉ và công nghệ xử lý bề mặt tiên tiến. Bề mặt sáng bóng giúp giảm thiểu cặn bẩn bám trên thanh đốt, nhờ vậy tỉ suất trao đổi nhiệt giữa thanh đốt và nước luôn đạt mức tối ưu kể cả sau thời gian dài sử dụng. - Thiết bị ổn định nhiệt và kiểm soát độ an toàn TBSTcủa máy nước nóng với chức năng kép: bộ cảm biến thứ nhất sẽ dừng quá trình làm nóng khi nước đã đạt đến nhiệt độ mong muốn (giúp tiết kiệm năng lượng), bộ cảm biến thứ hai sẽ tự động ngắt nguồn điện trong trường hợp nhiệt quá cao (bảo đảm an toàn cho người sử dụng). - Đèn báo nước nóng sẵn sànglà chức năng thân thiện với người dùng giúp bạn chủ động thời gian và giảm hao phí điện năng. Sau khi nước đã đạt đến nhiệt độ lý tưởng, đèn LEDmàu xanh sẽ sáng lên báo hiệu nước nóng sẵn sàng. - Bình nước nóng Ariston Andris AN 15 RS 2.5 FE 15L​​ sử dụng thanh đốt bằng đồngvới ưu điểm kéo dài tuổi thọ,tăng hơn 50% so với thanh đốt bằng thép không gỉ thông thường. Nhờ sử dụng 100% nguyên liệu an toàn,không mạ kền, có tác dụng kháng khuẩn,thanh đốt bằng đồng đem lại nguồn nước trong lành, tốt hơn cho sức khỏe người sử dụng. Thông số kỹ thuật - Thời gian gia nhiệt (△T = 35 độ C): 15 phút - Nhiệt độ hoạt động tối đa: 76 độ C - Áp suất hoạt động tối đa: 0.75Mpa",""""""
adayroi.com,https://www.adayroi.com/binh-tam-nuoc-nong-gian-tiep-ferroli-verdi-te-15l-2500w-p-PRI909225?offer=PRI909225_121004,PRI909225,Ferroli,Máy nước nóng,Bình tắm nước nóng gián tiếp Ferroli VERDI-TE 15L 2500W,2.690.000đ,VINPRO,"Máy nước nóng gián tiếp Ferroli,Bình tắm gián tiếp Ferroli VERDI 15L TE","- Dây nguồn chống giật ELCB. - Lớp cách nhiệt không chứa CFC. - Đèn LED hiển thị trạng thái. - Nút xoay điều chỉnh nhiệt. - Lựa chọn 3 mức công suất, tiết kiệm điện. - Van xả cặn tiện ích. Công suất 2500W Trọng lượng 11.8kg Điện áp 220V Màu sắc Trắng phối cam Hướng dẫn sử dụng Cắm đúng điện áp 220V, điều chỉnh nhiệt độ làm nóng phù hợp nhu cầu Model VERDI-TE 15L Kích thước 511 x 308 x 306 mm Hướng dẫn bảo quản Lắp ở vị trí cao, xa tầm với trẻ nhỏ, đồng thời hạn chế tiếp xúc thường xuyên với nước Dung tích 15L. -Bình tắm nước nóng gián tiếp Ferroli VERDI-TE 15L 2500Wlà một sản phẩm sở hữu hầu hết các tính năng tiêu chuẩn của một máy nước nóng gia đình. Với cơ chế sử dụng dễ dàng, nút điều chỉnh nhiệt độ được tích hợp trực tiếp trên vỏ máy, thiết kế ở vị trí chính diện vừa tầm với, dễ điều chỉnh. - Các chuyên gia của Ferroli đã nghiên cứu và phát triển thanh Anode Mg với kích thước lớn hơn giúp gia tăng thời gian bị ăn mòn và kéo dài tuổi thọ cho bình chứa. Đồng thời, Mg sau quá trình Anode có tác dụng làm mềm nước, loại bỏ phần nào độc tố và cặn vôi, cho chất lượng nước tốt hơn. - Người sử dụng có thể linh hoạt đóng mở van thoát nước, sục xả bình định kỳ với chỉ một thao tác vặn công tắc. Không phải tốn công sức, tiền bạc để gọi thợ sửa chữa, tiết kiệm thêm nhiều khoản chi phí sinh hoạt gia đình. - Lòng bình chứa có một phần được cấu tạo bằng lớp bọt tổng hợp Polyurethane đậm đặc không chứa CFC - một ""khí nhà kính"" gây hại tầng Ozone, đây là lớp cách nhiệt đảm bảo hạn chế sự thất thoát nhiệt và tổn thất năng lượng. - Bên cạnh rơ le tự động kiểm soát nhiệt độ trong bình, sản phẩm bình nước nóng của Ferroli còn trang bị thêm rơ le chống cháy khô. Rơ le sẽ tự ngắt khi nhiệt độ trong bình quá 90 độ C và chỉ có thể hoạt động trở lại khi có sự kiểm tra của kỹ thuật để ngăn sự cố thanh nhiệt bị đốt khô. - Mỗi sản phẩm của Ferroli đều được tráng Titan siêu bền, trang bị đèn LED báo nhiệt chính xác, cùng phong cách thiết kế hiện đại, trang nhã, dễ dàng hòa hợp với mọi phong cách trang trí trong không gian gia đình. - Tùy theo điều kiện thời tiết, khí hậu theo mùa mà người sử dụng có thể lựa chọn mức công suất phù hợp từ 1000W - 1500W - 2500W, đảm bảo hiệu suất làm nóng nhanh, tiết kiệm năng lượng. Thông tin thương hiệu Ferroli là thương hiệu nổi tiếng với các thiết bị về nhiệt bao gồm: bình nước nóng trực tiếp, gián tiếp; bình nước nóng năng lượng mặt trời; máy bơm nhiệt (heatpump)… Nhà máy Ferroli được đầu tư kỹ lưỡng với đầy đủ cơ sở vật chất hiện đại, dây chuyền sản xuất tiên tiến hoàn toàn tự động. Hệ thống điều khiển bằng máy tính rất hiệu quả nhằm đảm bảo những tiêu chuẩn ở mức độ chất lượng cao nhất. Đội ngũ kỹ sư, công nhân chuyên nghiệp, được đào tạo với trình độ hạng ưu, đáp ứng mọi yêu cầu sản xuất nghiêm ngặt.",""""""
adayroi.com,https://www.adayroi.com/binh-nong-lanh-ariston-an15r-15l-p-PRI935940?offer=PRI935940_092105,PRI935940,Ariston,Máy nước nóng,Bình nóng lạnh Ariston AN15R 15L,2.460.000đ,Xuân Thành,"Máy nước nóng Ariston,AN15R","- Bình chứa tráng men Titan. - Tiết kiệm điện năng. - Công nghệ Flexomix. - Nút tùy chỉnh nhiệt độ. - Vỏ chống thấm nước. Công suất 2500W Trọng lượng 8.5kg Điện áp 220V Thời hạn bảo hành 7 năm Model AN15R Kích thước 36 x 36 x 31,8 cm Xuất xứ Việt Nam Dung tích 15L Chất liệu Men titan, đồng. -Máy nước nóng gián tiếp Ariston AN15Rvới phần bình chứa được tráng men titan cao cấp, bền bỉ, không chứa các hóa chất gây hại, đảm bảo an toàn cho sức khỏe người dùng. Vỏ ngoài chống thấm nước, ngăn nước xâm nhập vào bên trong, giúp tăng độ bền cho máy. -Núm tắt mở và điều chỉnh lưu lượng nước cùng nhiệt độ dạng xoay giúp bạn dễ dàng tùy chọn dựa theo nhu cầu và sở thích của từng thành viên trong gia đình.Phần đèn LED được thiết kế kèm theo máy sẽ giúp bạn chủ động về thời gian khi dễ dàng nhận biết khi nào nước nóng sẵn sàng để tắm. -Được trang bịcông nghệ đột phá với lớp cách nhiệt mật độ cao, giúp giảm thiểu sự thất thoát nhiệt, từ đó khả năng giữ nhiệt cũng được gia tăng cũng nhưtiết kiệm điện năng tối đa.Bên cạnh đó, với thanh đốt tự làm sạch độc quyền của Ariston cùngcông nghệ xử lý bề mặt tiên tiến, sẽ giúp sự trao đổi nhiệt giữa thanh đốt và nước luôn đạt mức tối ưu trong suốt quá trình sử dụng. - Hệ thống kiểm soát nhiệt hiệu suất cao được trang bị sẵncó tác dụng ngăn chặn nguồn nước có nhiệt độ quá cao gây ra nguy hiểm cho người dùng. - Sản phẩm sử dụng công nghệ Flexomix với 2 chức năng chính: dừng quá trình làm nóng khi nước đã đạt đến nhiệt độ mong muốn và tự động ngắt nguồn điện khi nhiệt độ hoạt động quá cao, giúp đảm bảo an toàn tối đa cho người sử dụng. Ngoài ra, máy còn được tích hợp hệ thống thanh đốt bằng đồng chất lượng cao, có tác dụng bảo vệ người dùngkhỏi những nguy cơ rò rỉ điện trong suốt quá trình sử dụng một cách toàn diện. ",""""""
adayroi.com,https://www.adayroi.com/may-nuoc-nong-legend-le-7000ep-4500w-nhieu-mau-p-PRI1261801?offer=PRI1261801_M-R7N,PRI1261801,Legend,Máy nước nóng,Máy nước nóng Legend LE-7000EP 4500W (Nhiều màu),2.699.000đ,ĐIỆN MÁY KIM THI,Máy nước nóng Legend,"- Công suất 4500W cho khả năng làm nóng nhanh. - Vỏ máy được thiết kế chống văng nước, ngăn nước xâm nhập. - Thiết kế đặc biệt với bộ cảm ứng lưu lượng nước tự động. - Bộ chống giật và chống rò rỉ điện ELCB. - Rơ-le nhiệt kép có khả năng tự động ngắt ở nhiệt độ 55 độ C chống bỏng. ** Lưu ý. : Sản phẩm giao màu ngẫu nhiên. Công suất 4500W Điện áp 220V Bảo hành 12 tháng Kích thước 35,6 x 24,6 x 11,9 (cm) Chất liệu Nhựa. Máy nước nóng Legend LE-7000EP 4500W (Nhiều màu) có vỏ máy được thiết kếchống văng nước, ngăn nước xâm nhập vào bên trong, giúp tăng độ bền cho sản phẩm.Kiểu dáng nhỏ gọn, tiết kiệm không gian kết hợp màu sắc tươi sáng, góp phần mang đến phong cách sang trọng và hiện đại cho không gian phòng tắm nhà bạn. Sản phẩmđược trang bị vòi sen với 5 kiểu phun tùy chỉnh,bạn có thểtùy ý lựa chọn theo nhu cầu cũng nhưsở thích,mang lại cảm giác thư giãn thoải mái cho mọi thành viên trong gia đình. Thiết kế đặc biệt với bộ cảm ứng lưu lượng nước có khả năng tự động vận hành máy khi đã đủ áp lực nước và tự động tắt khi áp lực nước quá yếu. Bộ chống giật và chống rò rỉ điện ELCB hiện đại được tích hợp sẵn với độ nhạy cao, góp phần đảm bảo an toàn tối đa cho bạn trong quá trình sử dụng. Phần rơ-le nhiệt kép có khả năng tự động ngắt ở nhiệt độ 55 độ C, giúp chống bỏng và chống cháy bầu đun, vừa an toàn cho người dùng, vừa mang đến tuổi thọ lâu dài cho sản phẩm. Máy nước nóng Legend LE-7000EP 4500Wsở hữu kiểu dáng nhỏ gọn, dễ dàng lắp đặt.",""""""
adayroi.com,https://www.adayroi.com/may-nuoc-nong-gian-tiep-ariston-an15rs-15l-p-PRI891358?offer=PRI891358_M-PYY,PRI891358,Ariston,Máy nước nóng,Máy nước nóng gián tiếp Ariston AN15RS 15L,2.724.000đ,GIA VIET D,"Máy nước nóng gián tiếp Ariston,AN15RS","- Bình chứa tráng men Titan. - Hệ thống an toàn đồng bộ TSS tích hợp ELCB. - Tiết kiệm điện năng. - Công nghệ Flexomix. - Lớp cách nhiệt mật độ cao. - Nút tùy chỉnh nhiệt độ. - Vỏ chống thấm nước. Công suất 2500W Trọng lượng 8.5kg Điện áp 220V Model AN15RS Kích thước 36 x 36 x 31,8 cm Dung tích 15L Chất liệu Men titan, đồng. -Máy nước nóng gián tiếp Ariston AN15RSvới phần bình chứa được tráng men titan cao cấp, bền bỉ, không chứa các hóa chất gây hại, đảm bảo an toàn cho sức khỏe người dùng. Vỏ ngoài chống thấm nước, ngăn nước xâm nhập vào bên trong, giúp tăng độ bền cho máy. -Núm tắt mở và điều chỉnh lưu lượng nước cùng nhiệt độ dạng xoay giúp bạn dễ dàng tùy chọn dựa theo nhu cầu và sở thích của từng thành viên trong gia đình.Phần đèn LED được thiết kế kèm theo máy sẽ giúp bạn chủ động về thời gian khi dễ dàng nhận biết khi nào nước nóng sẵn sàng để tắm. -Được trang bịcông nghệ đột phá với lớp cách nhiệt mật độ cao, giúp giảm thiểu sự thất thoát nhiệt, từ đó khả năng giữ nhiệt cũng được gia tăng cũng nhưtiết kiệm điện năng tối đa.Bên cạnh đó, với thanh đốt tự làm sạch độc quyền của Ariston cùngcông nghệ xử lý bề mặt tiên tiến, sẽ giúp sự trao đổi nhiệt giữa thanh đốt và nước luôn đạt mức tối ưu trong suốt quá trình sử dụng. - Hệ thống kiểm soát nhiệt hiệu suất cao được trang bị sẵncó tác dụng ngăn chặn nguồn nước có nhiệt độ quá cao gây ra nguy hiểm cho người dùng. - Sản phẩm sử dụng công nghệ Flexomix với hệ thống an toàn đồng bộ TSS tích hợp ELCB với 2 chức năng chính: dừng quá trình làm nóng khi nước đã đạt đến nhiệt độ mong muốn và tự động ngắt nguồn điện khi nhiệt độ hoạt động quá cao, giúp đảm bảo an toàn tối đa cho người sử dụng. Ngoài ra, máy còn được tích hợp hệ thống thanh đốt bằng đồng chất lượng cao, có tác dụng bảo vệ người dùngkhỏi những nguy cơ rò rỉ điện trong suốt quá trình sử dụng một cách toàn diện. Thông tin bảo hành: - Bảo hành theo phiếu bảo hànhtại hãng ARISTON - Vỏ bình bảo hành 2 năm, ruột bình bảo hành 5 năm Thông tin thương hiệu: Ariston là chuyên gia toàn cầu trong lĩnh vực làm nóng nước và những sản phẩm gia nhiệt, góp phần mang đến cho mọi gia đình trên toàn thế giới những giải pháp tiện nghi với thiết kế hiệu quả và chất lượng cao từ Ý. Với sự hiện diện trên toàn cầu và sự am hiểu sâu sắc về nhu cầu của người tiêu dùng tại từng nước, Ariston luôn nhận được sự tin tưởng của hàng triệu gia đình trên toàn thế giới. Trong hơn 50 năm qua, sản phẩm của Ariston đã có mặt tại hơn 150 quốc gia và luôn được các chuyên gia đánh giá cao vì những nỗ lực không ngừng nhằm cải tiến sản phẩm, giúp cho việc lắp đặt và bảo trì trở nên đơn giản và nhanh chóng hơn.",""""""
adayroi.com,https://www.adayroi.com/binh-nuoc-nong-ferroli-qqevo-tse-30l-co-thanh-dot-trang-bac-chong-giat-tang-doi-day-cap-nuoc-p-PRI418140?offer=PRI418140_BC6,PRI418140,Ferroli,Máy nước nóng,"Bình nước nóng Ferroli QQEvo TSE 30L có thanh đốt tráng bạc, chống giật - Tặng đôi dây cấp nước",2.746.000đ,FERROLI AS,"Máy nước nóng Ferroli,Ferroli QQEvo TSE 30L","*** Tặng đôi dây cấp nước. - Công suất làm nóng 1000W - 1500W - 2500W. - Ruột bình phủ lớp men Titan chống rò rỉ điện. - Trang bị 2 rơ le kiểm soát nhiệt độ và chống chay nổ. - Trang bị đèn LED báo nhiệt chính xác. Công suất 2500W Trọng lượng 12.4kg Điện áp 220V Bảo hành Bảo hành 8 năm đối với bình chứa và 2 năm đối với linh kiện điện tử Hướng dẫn sử dụng Cắm đúng điện áp 220V, điều chỉnh nhiệt độ làm nóng phù hợp nhu cầu Model QQSi 30 Kích thước 60.5 x 33.7 x 31.5 cm Hướng dẫn bảo quản Lắp ở vị trí cao, xa tầm với trẻ nhỏ, đồng thời hạn chế tiếp xúc thường xuyên với nước Dung tích 30L Chất liệu Nhựa, thép, nhôm. Bình nước nóng Ferroli QQEvo TSE 30L có thanh đốt tráng bạc, chống giật 1000W - 1500W - 2500W là một sản phẩm sở hữu hầu hết các tính năng tiêu chuẩn của một máy nước nóng gia đình. Với cơ chế sử dụng dễ dàng, nút điều chỉnh nhiệt độ được tích hợp trực tiếp trên vỏ máy, thiết kế ở vị trí chính diện vừa tầm với, dễ điều chỉnh. Các chuyên gia của Ferroli đã nghiên cứu và phát triển thanh Anode Mg với kích thước lớn hơn giúp gia tăng thời gian bị ăn mòn và kéo dài tuổi thọ cho bình chứa. Đồng thời, Mg sau quá trình Anode có tác dụng làm mềm nước, loại bỏ phần nào độc tố và cặn vôi, cho chất lượng nước tốt hơn. Bình chứa được sản xuất trên dây chuyền tự động hoàn toàn. Lớp men Titan đặc biệt được phủ kín bề mặt ruột bình bằng công nghệ tĩnh điện tiên tiến nhất hiện nay, sau đó được nung nóng ở nhiệt độ 850 độ C, làm cho bề mặt ruột bình thành một mặt phẳng trơn mịn, chống rò rỉ điện, cực kỳ an toàn. Người sử dụng có thể linh hoạt đóng mở van thoát nước, sục xả bình định kỳ với chỉ một thao tác vặn công tắc. Không phải tốn công sức, tiền bạc để gọi thợ sửa chữa, tiết kiệm thêm nhiều khoản chi phí sinh hoạt gia đình. Bộ chống rò điện (ELCB) là thiết bị an toàn sẽ ngắt kết nối giữa thiết bị với mạch điện bất cứ khi nào hệ thống phát hiện rò điện, đặc biệt là khi cơ thể con người chạm phải các phần mạng điện của thiết bị. Điểm đặc biệt nữa của sản phẩm là ứng dụng 3 mức nhiệt lựa chọn bên hông máy. Tùy theo điều kiện thời tiết, khí hậu theo mùa mà người sử dụng có thể lựa chọn mức công suất phù hợp từ 1000W - 1500W - 2500W, đảm bảo hiệu suất làm nóng nhanh, tiết kiệm năng lượng. Bên cạnh rơ le tự động kiểm soát nhiệt độ trong bình, sản phẩm bình nước nóng của Ferroli còn trang bị thêm rơ le chống cháy khô. Rơ le sẽ tự ngắt khi nhiệt độ trong bình quá 90 độ C và chỉ có thể hoạt động trở lại khi có sự kiểm tra của kỹ thuật để ngăn sự cố thanh nhiệt bị đốt khô. Lòng bình chứa có một phần được cấu tạo bằng lớp bọt tổng hợp Polyurethane đậm đặc không chứa CFC - một ""khí nhà kính"" gây hại tầng Ozone, đây là lớp cách nhiệt đảm bảo hạn chế sự thất thoát nhiệt và tổn thất năng lượng. Thanh đốt hoạt động giúp giải phóng I-on bạc (Ag), phát tán vào môi trường nước trong bình chứa giúp diệt khuẩn, giữ cho nước tươi, sạch hơn. Thanh đốt mạ bạc có độ bền cao, hiệu suất làm việc lớn, tiết kiệm điện năng và thời gian làm nóng. Mỗi sản phẩm của Ferroli đều được tráng Titan siêu bền, trang bị đèn LED báo nhiệt chính xác, cùng phong cách thiết kế hiện đại, trang nhã, dễ dàng hòa hợp với mọi phong cách trang trí trong không gian gia đình. Thông số kỹ thuật - Áp lực nước: 0.8MPa - Phương thức lắp đặt: Nằm ngang treo tường Thông tin thương hiệu Công ty TNHH Ferroli Asean là thành viên của tập đoàn Ferroli - một doanh nghiệp với 100% vốn đầu tư của Italia chuyên sản xuất các thiết bị về nhiệt bao gồm: bình nước nóng trực tiếp, gián tiếp; bình nước nóng năng lượng mặt trời; máy bơm nhiệt (heatpump)…Nhà máy Ferroli được đầu tư kỹ lưỡng với đầy đủ cơ sở vật chất hiện đại, dây chuyền sản xuất tiên tiến hoàn toàn tự động. Hệ thống điều khiển bằng máy tính rất hiệu quả nhằm đảm bảo những tiêu chuẩn ở mức độ chất lượng cao nhất. Đội ngũ kỹ sư, công nhân chuyên nghiệp, được đào tạo với trình độ hạng ưu, đáp ứng mọi yêu cầu sản xuất nghiêm ngặt.",""""""
adayroi.com,https://www.adayroi.com/binh-nuoc-nong-ngang-son-ha-gal-30n-30l-p-PRI1303927?offer=PRI1303927_M5H,PRI1303927,Sơn Hà,Máy nước nóng,Bình nước nóng ngang Sơn Hà GAL 30N 30L,2.750.000đ,M5H,Máy nước nóng Sơn Hà,"- Thiết kế kiểu dáng sang trọng, hiện đại và thông minh. - Sử dụng vật liệu INCOLOY siêu bền với hệ thống cảm biến thông minh. - Thanh gia nhiệt kép làm nước trong bình nóng rất nhanh. - Ruột bình có khả năng chịu áp suất cao, tráng men titan chống bám cặn. Công suất 2500W Trọng lượng 14kg Điện áp 220V Bảo hành 12 (tháng) Màu sắc Trắng Model GAL 30N Kích thước 73 x 38 x 41 (cm) Xuất xứ Việt Nam Dung tích 30L Chất liệu Nhựa, kim loại. Thiết kế sang trọng, hiện đại với công nghệ tiên tiến Bình nước nóng ngang Sơn Hà GAL 30N 30L sử dụng thanh đốt làm từ INCOLOY 840 tráng men - bước đột phá trong công nghệ chế tạo hợp kim trên thế giới - giúp rút ngắn thời gian làm nóng, chống đóng cặn và tăng tuổi thọ cọc đốt. Với khả năng chống oxy hóa và ăn mòn cao trong mọi điều kiện môi trường khắc nghiệt ở nhiệt độ cao, thanh gia nhiệt tráng men của bình nước nóng Galaxy được bảo hành vĩnh viễn. Khả năng làm nóng nhanh, độ bền cao, chống bám cặn Hệ thống cảm biến thông minh, tự động ngắt nguồn điện theo nhiệt độ cài đặt và chế độ ngắt an toàn khi quá nhiệt, đảm bảo an toàn cho người sử dụng. Thanh gia nhiệt kép có biên dạng tiêu chuẩn làm nước trong bình nóng rất nhanh. Ruột bình có khả năng chịu áp suất cao, được tráng men titanium siêu bền, quản lý sản xuất theo tiêu chuẩn công nghệ kỹ thuật của Đức. Thanh Magie tiêu chuẩn Châu Âuchống bám cặn và giảm sự ăn mòn ruột bình, cọc đốt. Giữ nhiệt lâu, an toàn khi sử dụng Lớp bảo ôn bằng vật liệu Polyurethane (PU) dày theo tiêu chuẩn quốc tế về giữ nhiệt. Hệ thống kiểm soát an toàn chống giật tích hợp ELCB chuẩn theo tiêu chuẩn Châu Âu, van an toàn chống áp cao. Chống ăn mòn và thân thiện với môi trường Công nghệ của Italy giúp tăng tính chịu nhiệt độ và áp lực cao, không bị bong tróc, chống ăn mòn của mọi nguồn nước, đảm bảo độ bền tối đa cho sản phẩm. Đặc biệt tráng men titanium giúp bình giữ nhiệt lâu hơn, chống rò rỉ điện năng, nâng cao chất lượng nước, thân thiện với môi trường và an toàn cho người sử dụng ",""""""
