Domain,Url,Product_id,Brand,Category,Model,Price,Seller,Tags,Info,Others
adayroi.com,https://www.adayroi.com/binh-nuoc-nong-vuong-son-ha-gal-20v-20l-p-PRI1303887?offer=PRI1303887_M5H,PRI1303887,Sơn Hà,Máy nước nóng,Bình nước nóng vuông Sơn Hà GAL 20V 20L,2.150.000đ,M5H,Máy nước nóng Sơn Hà,"- Thiết kế kiểu dáng sang trọng, hiện đại và thông minh. - Sử dụng vật liệu INCOLOY siêu bền với hệ thống cảm biến thông minh. - Thanh gia nhiệt kép làm nước trong bình nóng rất nhanh. - Ruột bình có khả năng chịu áp suất cao, tráng men titan chống bám cặn. Công suất 2500W Trọng lượng 10kg Điện áp 220V Bảo hành 12 (tháng) Màu sắc Trắng Model GAL 20V Kích thước 44 x 43,5 x 45 (cm) Xuất xứ Việt Nam Dung tích 20L Chất liệu Nhựa, kim loại. Thiết kế sang trọng, hiện đại với công nghệ tiên tiến Bình nước nóng vuông Sơn Hà GAL 20V 20L sử dụng thanh đốt làm từ INCOLOY 840 tráng men - bước đột phá trong công nghệ chế tạo hợp kim trên thế giới - giúp rút ngắn thời gian làm nóng, chống đóng cặn và tăng tuổi thọ cọc đốt. Với khả năng chống oxy hóa và ăn mòn cao trong mọi điều kiện môi trường khắc nghiệt ở nhiệt độ cao, thanh gia nhiệt tráng men của bình nước nóng Galaxy được bảo hành vĩnh viễn. Khả năng làm nóng nhanh, độ bền cao, chống bám cặn Hệ thống cảm biến thông minh, tự động ngắt nguồn điện theo nhiệt độ cài đặt và chế độ ngắt an toàn khi quá nhiệt, đảm bảo an toàn cho người sử dụng. Thanh gia nhiệt kép có biên dạng tiêu chuẩn làm nước trong bình nóng rất nhanh. Ruột bình có khả năng chịu áp suất cao, được tráng men titanium siêu bền, quản lý sản xuất theo tiêu chuẩn công nghệ kỹ thuật của Đức. Thanh Magie tiêu chuẩn Châu Âuchống bám cặn và giảm sự ăn mòn ruột bình, cọc đốt. Giữ nhiệt lâu, an toàn khi sử dụng Lớp bảo ôn bằng vật liệu Polyurethane (PU) dày theo tiêu chuẩn quốc tế về giữ nhiệt. Hệ thống kiểm soát an toàn chống giật tích hợp ELCB chuẩn theo tiêu chuẩn Châu Âu, van an toàn chống áp cao. Chống ăn mòn và thân thiện với môi trường Công nghệ của Italy giúp tăng tính chịu nhiệt độ và áp lực cao, không bị bong tróc, chống ăn mòn của mọi nguồn nước, đảm bảo độ bền tối đa cho sản phẩm. Đặc biệt tráng men titanium giúp bình giữ nhiệt lâu hơn, chống rò rỉ điện năng, nâng cao chất lượng nước, thân thiện với môi trường và an toàn cho người sử dụng ",""""""
adayroi.com,https://www.adayroi.com/binh-nuoc-nong-rossi-saphir-rs22sl-22l-p-1337752?offer=1337752_092105,1337752,Rossi,Máy nước nóng,Bình nước nóng Rossi Saphir RS22SL 22L,2.150.000đ,Xuân Thành,Máy nước nóng Rossi,"Ruột tráng men Sapphire siêu bền. Công nghệ tự làm sạch ruột bình. Vỏ bằng nhựa ABS nguyên sinh. Bộ chống rò điện ELCB an toàn tuyệt đối. Lớp bảo ôn Polyurethane giữ nhiệt 72 giờ. Kiểu dáng sang trọng được thiết kế từ chuyên gia Ý. - Ruột tráng men Sapphire siêu bền. - Công nghệ tự làm sạch ruột bình. - Vỏ bằng nhựa ABS nguyên sinh. - Bộ chống rò điện ELCB an toàn tuyệt đối. - Lớp bảo ôn Polyurethane giữ nhiệt 72 giờ. - Kiểu dáng sang trọng được thiết kế từ chuyên gia Ý. Công suất 2500W Điện áp 220V Thời hạn bảo hành 7 năm Model RS22SL Kích thước 600 x 305 x 270 (mm) Xuất xứ Việt Nam Dung tích 22L Chất liệu Ruột tráng men Sapphire, vỏ nhựa ABS nguyên sinh. Rossi Saphir là thương hiệu bình nước nóng cao cấp của Tập đoàn Tân Á Đại Thành. Sản phẩm mang phong cách thiết kế Ý. Tích hợp những tính năng hiện đại của bình nước nóng thế hệ mới với mục tiêu mang đến cho khách hàng trải nghiệm cao cấp từ cuộc sống tiện nghi. Sapphire có tính chất vật lý, là chất cách điện tốt và đặc biệt không giãn nở khi nhiệt độ thay đổi. Công nghệ này giúp tăng độ bền của sản phẩm, khả năng giữ nhiệt tốt, đồng thời không bám cặn hoặc ăn mòn sau thời gian dài sử dụng. Bình nước nóng Rossi Saphir RS22SL có thiết kế bắt mắt và nhỏ gọn, phù hợp với không gian căn hộ hiện đại, chung cư cao cấp, dễ thao tác, tiện lắp đặt. Hệ thống chống rò điện ELCB đạt chuẩn an toàn Châu Âu, khi có sự cố về điện, hệ thống sẽ ngắt, đảm bảo an toàn tuyệt đối cho người sử dụng. Các đặc tính nổi bật Ruột bình tráng men Sapphire siêu bền Công nghệ tự làm sạch ruột bình Thanh gia nhiệt siêu bền giúp làm nóng nước nhanh Vỏ nhựa bằng nguyên liệu nhựa ABS nguyên sinh chịu được áp lực, va đập và giúp tăng tuổi thọ bình nóng lạnh rossi Bộ ổn nhiệt có độ chính xác cao gồm 2 chế độ an toàn được nhập khẩu từ Pháp giúp tiết kiệm 15% điện năng Bộ chống rò điện ELCB siêu nhậy an toàn tuyệt đối khi sử dụng Lớp bảo ôn Polyurethane nhập khẩu từ Tập đoàn Dow (Mỹ) giúp giữ nhiệt lên đến 72 giờ Kiểu dáng sang trọng được thiết kế từ chuyên gia Ý Thanh đốt kép Hoạt động độc lập hoặc đồng thời hai chế độ công suất 1000W và 1500W, tiết kiệm điện Tiết kiệm 9.2% điện năng khi sử dụng chế độ 2 cọc đốt Tiết kiệm 40% điện năng khi sử dụng chế độ 1 cọc đốt",""""""
adayroi.com,https://www.adayroi.com/binh-nuoc-nong-ngang-son-ha-ocean-oce-15n-15l-p-PRI1303802?offer=PRI1303802_M5H,PRI1303802,Sơn Hà,Máy nước nóng,Bình nước nóng ngang Sơn Hà Ocean OCE 15N 15L,2.200.000đ,M5H,Máy nước nóng Sơn Hà,"- Thiết kế kiểu dáng sang trọng, hiện đại và thông minh. - Sử dụng vật liệu INCOLOY siêu bền với hệ thống cảm biến thông minh. - Thanh gia nhiệt kép làm nước trong bình nóng rất nhanh. - Ruột bình có khả năng chịu áp suất cao, tráng men titan chống bám cặn. Công suất 2500W Trọng lượng 9kg Điện áp 220V Bảo hành 12 (tháng) Màu sắc Trắng Model OCE 15N Kích thước 60,3 x 34 x 35,5 (cm) Xuất xứ Việt Nam Dung tích 15L Chất liệu Nhựa, kim loại. Thiết kế sang trọng, hiện đại theo phong cách Ý Bình nước nóng ngang Sơn Hà Ocean OCE 15N 15L được lấy cảm hứng từ làn nước biển xanh biếc, là sự kết hợp tinh tế của vẻ đẹp tự nhiên với khả năng sáng tạo tài tình,sự kiêu hãnh của biển với nét tinh tế, giản dị vốn có từ các sản phẩm của Sơn Hà. Bình nước nóngđược thiết kế mang phong cách Ý,tỉ mỉ đến từng chi tiết nhỏ, mang lại sự thanh thoát, vẻ đẹp tinh tế và sang trọng cho sản phẩm và tiện nghi cho cuộc sống hiện đại. Khả năng làm nóng nhanh, tiết kiệm điện năng Thanh gia nhiệt nằm bên trong bình sử dụng vật liệu INCOLOY siêu bền, làm nóng nhanh, tiết kiệm điện năng đến 42%. Hệ thống cảm biến thông minh, tự động ngắt nguồn điện theo nhiệt độ cài đặt và chế độ ngắt an toàn khi quá nhiệt, đảm bảo an toàn cho người sử dụng. Độ bền cao, chống bám cặn Thanh gia nhiệt kép có biên dạng tiêu chuẩn làm nước trong bình nóng rất nhanh. Ruột bình có khả năng chịu áp suất cao, sử dụng vật liệu cao cấp. Thanh Magie tiêu chuẩn Châu Âu, cùng với lớp tráng men titan bên trong ruột bình tăng khả năng chống bám cặn tuyệt đối, cải tiến này giúp tăng độ bền của bình. Giữ nhiệt lâu, an toàn khi sử dụng Lớp bảo ôn bằng vật liệu Polyurethane (PU) dày theo tiêu chuẩn quốc tế về giữ nhiệt. Hệ thống kiểm soát an toàn chống giật tích hợp ELCB chuẩn theo tiêu chuẩn Châu Âu, tự động đóng ngắt khi dòng điện >30mA. Thời gian đóng ngắt 0,32ms. Chống ăn mòn và thân thiện với môi trường Công nghệ của Italy giúp tăng tính chịu nhiệt và áp lực cao, không bị bong tróc, chống ăn mòn mọi nguồn nước đảm bảo độ bền tối đa cho sản phẩm. Ngoài ra, lớp titanium giúp bình giữ nhiệt lâu hơn, chống rò rỉ điện năng tốt hơn, nâng cao chất lượng nước, thân thiện với mội trường và an toàn cho người sử dụng. ",""""""
adayroi.com,https://www.adayroi.com/binh-nuoc-nong-rapido-greta-ge-15l-chong-giat-2500w-p-2141145?offer=2141145_094174,2141145,Rapido,Máy nước nóng,"Bình nước nóng Rapido Greta-GE 15L, chống giật 2500W",2.200.000đ,NHIET CHAU,"Máy nước nóng Rapido,Bình nước nóng Rapido Greta-GE 15L, chống giật 2500W,Bình nước nóng,Rapido","- Bình chứa tráng men Titan siêu bền. - Chức năng cài đặt nhiệt độ. - Vỏ nhựa ABS chống va đập. - Dây nguồn chống giật ELCB. Công suất 2500W Điện áp 220V Thời hạn bảo hành 8 năm và 2 năm Model Greta-GE Kích thước 480 x 290 x 295 mm Xuất xứ Việt Nam Dung tích 15L Chất liệu Nhựa ABS. Bình nước nóng Rapido Greta-GE 15L, chống giật 2500W được thiết kế và sản xuất tại Nhà máy Ferroli theo tiêu chuẩn Châu Âu độc đáo, sang trọng, hiện đại và tiết kiệm điện. Thanh MG anode lớn đứng độc lập Mg anode có tác dụng làm mềm nước, bảo vệ ruột bình và cho chất lượng nước tốt hơn. Các chuyên gia của Rapido đã nghiên cứu và phát triển thanh anode Mg với kích thước lớn hơn giúp gia tăng thời gian bị ăn mòn và kéo dài tuổi thọ cho bình chứa.Thanh MG anode lớn đứng độc lập giúp dễ dàng thay thế. Tuổi thọ của thanh đốt và thanh MG anode cũng được tăng lên do không bị tác động bởi hoạt động của nhau. Bình chứa tráng men Titan siêu bền Bình chứa được sản xuất trên dây chuyền tự động hoàn toàn. Lớp men Titan đặc biệt được phủ kín bề mặt ruột bình bằng công nghệ tĩnh điện tiên tiến nhất hiện nay, sau đó được nung nóng ở nhiệt độ 850 độ C làm cho bề mặt ruột bình thành một mặt phẳng thống nhất, chống rò rỉ điện và nâng cao chất lượng nước. Dây nguồn chống giật ELCB Bộ chống rò điện (ELCB) là thiết bị an toàn sẽ ngắt kết nối giữa thiết bị với mạch điện bất cứ khi nào xuất hiện rò điện thông qua cơ thể con người khi chạm phải các phần mạng điện của thiết bị. Vỏ nhựa được làm bằng các hạt nhựa nguyên chất có khả năng chống va đập, hạn chế oxy hóa giúp bình luôn giữ được màu sắc và hình dáng ban đầu.Việc vệ sinh bình sẽ trở nên dễ dàng hơn, người sử dụng có thể tự tháo van, xả cặn, sục rửa bình mà không cần phải gọi dịch vụ sửa chữa. Cho phép tùy chỉnh nhiệt độ thuận tiện, đáp ứng nhu cầu sử dụng. Luôn luôn duy trì nhiệt độ nước ổn định.Được cấu tạo bằng lớp bọt tổng hợp Polyurethane đậm đặc không có CFC, lớp cách nhiệt đảm bảo giảm được sự thất thoát nhiệt và tổn thất năng lượng. Lớp bảo ôn Polyurethane dày hơn, được nén chặt và lắp đầy mọi lỗ hổng giúp tăng khả năng giữ nhiệt lên tới 48h.",""""""
adayroi.com,https://www.adayroi.com/binh-nuoc-nong-ferroli-qqevo-me-20l-chong-giat-cong-suat-2500w-tang-doi-day-cap-nuoc-p-PRI417932?offer=PRI417932_BC6,PRI417932,Ferroli,Máy nước nóng,"Bình nước nóng Ferroli QQEvo ME 20L, chống giật, công suất 2500W - Tặng đôi dây cấp nước",2.205.000đ,FERROLI AS,"Máy nước nóng Ferroli,Ferroli QQEvo ME 20L","*** Tặng đôi dây cấp nước. - Công suất 2500W cho thời gian làm nóng nhanh. - Ruột bình phủ lớp men Titan chống rò rỉ điện. - Trang bị 2 rơ le kiểm soát nhiệt độ và chống chay nổ. - Trang bị đèn LED báo nhiệt chính xác. Công suất 2500W Trọng lượng 10.6kg Điện áp 220V Bảo hành Bảo hành 8 năm đối với bình chứa và 2 năm đối với linh kiện điện tử Hướng dẫn sử dụng Cắm đúng điện áp 220V, điều chỉnh nhiệt độ làm nóng phù hợp nhu cầu. Thường xuyên xả cặn để lòng bình bền hơn Model QQEvo 20ME Kích thước 60 x 30 x 28 cm Hướng dẫn bảo quản Lắp ở vị trí cao, xa tầm với trẻ nhỏ, đồng thời hạn chế tiếp xúc thường xuyên với nước Dung tích 20L Chất liệu Nhựa, thép, nhôm. Bình nước nóng Ferroli QQEvo ME 20L, chống giật, công suất 2500W là một sản phẩm sở hữu hầu hết các tính năng tiêu chuẩn của một máy nước nóng gia đình. Với cơ chế sử dụng dễ dàng, nút điều chỉnh nhiệt độ được tích hợp trực tiếp trên vỏ máy, thiết kế ở vị trí chính diện vừa tầm với, dễ điều chỉnh. Các chuyên gia của Ferroli đã nghiên cứu và phát triển thanh Anode Mg với kích thước lớn hơn giúp gia tăng thời gian bị ăn mòn và kéo dài tuổi thọ cho bình chứa. Đồng thời, Mg sau quá trình Anode có tác dụng làm mềm nước, loại bỏ phần nào độc tố và cặn vôi, cho chất lượng nước tốt hơn. Bình chứa được sản xuất trên dây chuyền tự động hoàn toàn. Lớp men Titan đặc biệt được phủ kín bề mặt ruột bình bằng công nghệ tĩnh điện tiên tiến nhất hiện nay, sau đó được nung nóng ở nhiệt độ 850 độ C, làm cho bề mặt ruột bình thành một mặt phẳng trơn mịn, chống rò rỉ điện, cực kỳ an toàn. Người sử dụng có thể linh hoạt đóng mở van thoát nước, sục xả bình định kỳ với chỉ một thao tác vặn công tắc. Không phải tốn công sức, tiền bạc để gọi thợ sửa chữa, tiết kiệm thêm nhiều khoản chi phí sinh hoạt gia đình. Bên cạnh rơ le tự động kiểm soát nhiệt độ trong bình, sản phẩm bình nước nóng của Ferroli còn trang bị thêm rơ le chống cháy khô. Rơ le sẽ tự ngắt khi nhiệt độ trong bình quá 90 độ C và chỉ có thể hoạt động trở lại khi có sự kiểm tra của kỹ thuật để ngăn sự cố thanh nhiệt bị đốt khô. Lòng bình chứa có một phần được cấu tạo bằng lớp bọt tổng hợp Polyurethane đậm đặc không chứa CFC - một ""khí nhà kính"" gây hại tầng Ozone, đây là lớp cách nhiệt đảm bảo hạn chế sự thất thoát nhiệt và tổn thất năng lượng. Mỗi sản phẩm của Ferroli đều được tráng Titan siêu bền, trang bị đèn LED báo nhiệt chính xác, cùng phong cách thiết kế hiện đại, trang nhã, dễ dàng hòa hợp với mọi phong cách trang trí trong không gian gia đình. Thông số kỹ thuật - Áp lực nước: 0.8MPa - Phương thức lắp đặt: Nằm ngang treo tường Thông tin thương hiệu Công ty TNHH Ferroli Asean là thành viên của tập đoàn Ferroli - một doanh nghiệp với 100% vốn đầu tư của Italia chuyên sản xuất các thiết bị về nhiệt bao gồm: bình nước nóng trực tiếp, gián tiếp; bình nước nóng năng lượng mặt trời; máy bơm nhiệt (heatpump)…Nhà máy Ferroli được đầu tư kỹ lưỡng với đầy đủ cơ sở vật chất hiện đại, dây chuyền sản xuất tiên tiến hoàn toàn tự động. Hệ thống điều khiển bằng máy tính rất hiệu quả nhằm đảm bảo những tiêu chuẩn ở mức độ chất lượng cao nhất. Đội ngũ kỹ sư, công nhân chuyên nghiệp, được đào tạo với trình độ hạng ưu, đáp ứng mọi yêu cầu sản xuất nghiêm ngặt.",""""""
adayroi.com,https://www.adayroi.com/binh-nuoc-nong-rossi-ra30-sq-30-lit-p-PRI978144?offer=PRI978144_QPQ,PRI978144,Rossi,Máy nước nóng,Bình nước nóng Rossi RA30 SQ 30 lít,2.223.000đ,TANADAITHA,"Máy nước nóng Rossi,Rossi,RA30 SQ","- Ruột bình tráng men kim cương nhân tạo siêu bền. - Thanh gia nhiệt 2 lớp cảm ứng an toàn, tiết kiệm điện. - ​Hệ thống chống giật ELCB, tuyệt đối an toàn cho người sử dụng. - Tích hợp 5 chế độ an toàn cho người dùng khi sử dụng. Điện áp 220V Bảo hành 36 Nguồn gốc Chính hãng Model RA30 SQ Hướng dẫn bảo quản Xả cặn đáy bình khoảng 6 tháng đến 1 năm một lần Dung tích 30L Chất liệu Ruột bình tráng kim cương nhân tạo. Bình nước nóng Rossi Amore là thương hiệu bình nước nóng cao cấp của Tập đoàn Tân Á Đại Thành. Sản phẩm mang phong cách thiết kế Ý, tích hợp các tính năng hiện đại của bình nước nóng thế hệ mới với mục tiêu mang đến cho khách hàng trải nghiệm cao cấp từ cuộc sống tiện nghi. Bình nước nóng Rossi AmoreRA30 SQ 30 lít​tích hợp 5 chế độ an toàn: Van an toàn xuất xứ ITALY đảm bảo an toàn khi sử dụng ​Sử dụng bộ chống rò điện ELCB siêu nhạy, an toàn tuyệt đối khi sử dụng Bộ ổn nhiệt nhập khẩu từ Pháp với 2 chế độ an toàn Khả năng chống cháy khô tự bảo vệ thanh đốt Ngắt đun tự độngkhi đạt nhiệt độ Đặc biệt nổi bật của bình nước nóng Rossi RA30 SQ 30 lít​: Ruột bình tráng men kim cương nhân tạo siêu bền Thanh gia nhiệt 2 lớp cảm ứng an toàn, tiết kiệm điện ​Hệ thống chống giật ELCB, tuyệt đối an toàn cho người sử dụng",""""""
adayroi.com,https://www.adayroi.com/binh-nuoc-nong-rossi-ra15-sl-15-lit-p-PRI977402?offer=PRI977402_QPQ,PRI977402,Rossi,Máy nước nóng,Bình nước nóng Rossi RA15 SL 15 lít,2.223.000đ,TANADAITHA,"Máy nước nóng Rossi,RA15 SL,Rossi","- Ruột bình tráng men kim cương nhân tạo . - Thanh gia nhiệt với 3 chế độ cho mức độ tùy chọn. - Đường xả cặn tiện ích tích hợp với thanh Magie đường kính lớn. - Tích hợp 5 chế độ an toàn cho người dùng khi sử dụng. Điện áp 220V Bảo hành 36 Nguồn gốc Chính hãng Model RA15 SL Kích thước 530 x 305 x 270mm Hướng dẫn bảo quản Xả cặn đáy bình khoảng 6 tháng đến 1 năm một lần Dung tích 15L Chất liệu Ruột bình tráng kim cương nhân tạo. Bình nước nóng Rossi Amore là thương hiệu bình nước nóng cao cấp của Tập đoàn Tân Á Đại Thành. Sản phẩm mang phong cách thiết kế Ý, tích hợp các tính năng hiện đại của bình nước nóng thế hệ mới với mục tiêu mang đến cho khách hàng trải nghiệm cao cấp từ cuộc sống tiện nghi. Bình nước nóng Rossi Amore RA15 SL 15 líttích hợp 5 chế độ an toàn: Van an toàn xuất xứ ITALY đảm bảo an toàn khi sử dụng ​Sử dụng bộ chống rò điện ELCB siêu nhậy, an toàn tuyệt đối khi sử dụng Bộ ổn nhiệt nhập khẩu từ Pháp với 2 chế độ an toàn Khả năng chống cháy khô tự bảo vệ thanh đốt Ngắt khi đạt nhiệt độ Đặc biệt nổi bật của bình nước nóng Rossi RA15 SL 15 lít: Ruột bình tráng men kim cương nhân tạo siêu bền Thanh gia nhiệt với 3 chế độ cho mức độ tùy chọn cao, phù hợp khí hậu thời tiết theo mùa: 1000W - 1500W - 2500W Đường xả cặn tiện ích tích hợp với thanh Magie đường kính lớn Dung tích bìnhđun: 15 lít",""""""
adayroi.com,https://www.adayroi.com/binh-nuoc-nong-chong-giat-rossi-saphir-rs-32-sq-30l-p-593501?offer=593501_092105,593501,Rossi,Máy nước nóng,Bình nước nóng chống giật Rossi Saphir RS 32 SQ 30L,2.230.000đ,Xuân Thành,Máy nước nóng Rossi,"- Kiểu dáng sang trọng được thiết kế từ chuyên gia Ý. - Ruột bình tráng men Sapphire siêu bền. - Công nghệ tự làm sạch ruột bình. - Thanh gia nhiệt siêu bền giúp làm nóng nước nhanh. - Vỏ nhựa bằng nguyên liệu nhựa ABS nguyên sinh . - Bộ ổn nhiệt có độ chính xác, tiết kiệm 15% điện năng. - Bộ chống rò điện ELCB siêu nhậy an toàn tuyệt đối khi sử dụng. - Lớp bảo ôn Polyurethane nhập khẩu từ Tập đoàn Dow (Mỹ), giữ nhiệt lên đến 72 giờ. Bảo hành 07 năm, tại nhà Model Saphir RS 32 SQ Kích thước 45 x 45 x 38 cm Xuất xứ Việt Nam Dung tích 30L. Kiểu dáng sang trọng Bình nước nóng chống giật Rossi Saphir RS 32 SQ sở hữu kiểu dáng sang trọng, được thiết kế từ chuyên gia Ý, đem đến cho không gian nội thất phòng tắm của gia đình bạn thêm tiện nghi, hiện đại. Sản phẩm thuộc dòng bình nước nóng gián tiếp, có dung tích 30 lít, phù hợp với gia đình có từ 3 đến 4 thành viên. Ruột bình tráng men Sapphire siêu bền Men Sapphire được cấu tạo đặc biệt có chứa tinh thể nano sapphire được phân tán đều trong men và nổi lên bề mặt trong quá trình thiêu kết ở nhiệt độ cao. Men sapphire có giá trị cao và chỉ được dùng để phủ lên các đồ trang sức cho vẻ đẹp hoàn mỹ. Ruột bình nước nóng Rossi Saphir được tráng men Sapphire nhân tạo siêu bền, tăng khả năng tự làm sạch các mảng bám cặn trong ruột bình và tăng tuổi thọ sản phẩm. Thanh gia nhiệt làm nóng nước nhanh Bình nước nóng Rossi Saphir còn có khả năng làm nóng nước nhanh nhờ thanh gia nhiệt chất lượng, lớp bảo ôn Polyurethane cao cấp từ Tập đoàn Dow (Mỹ) giữ nhiệt lên tới 72 giờ. Đặc biệt, sản phẩm có ưu điểm tiết kiệm điện năng tới 15% đã được thử nghiệm và chứng nhận tại phòng thí nghiệm Cotherm (Pháp). Đảm bảo an toàn khi sử dụng Vấn đề an toàn được đánh giá là vô cùng quan trọng đối với tác thiết bị điện, điện tử và bình nước nóng cũng không ngoại lệ. Bình nước nóng Rossi Saphir tích hợp chế độ bảo vệ an toàn tuyệt đối hoàn toàn yên tâm cho người sử dụng. Bộ ổn nhiệt hai chế độ an toàn của Tập đoàn Cotherm – Pháp giúp tăng cường khả năng bảo vệ cao nhất. Bộ chống rò rỉ điện ELCB giúp phát hiện ra sự cố rò rỉ điện dù là nhỏ nhất và tự động ngắt mạch điện. Thanh rơ le tự ngắt điện khi nước đạt nhiệt độ và khả năng chống cháy khô. Vỏ nhựa bằng nguyên liệu nhựa ABS nguyên sinh Vỏ nhựa được làm bằng chất liệu nhựa ABS nguyên sinh tăng khả năng chịu áp lực lớn, va đập mạnh và giúp tăng tuổi thọ sản phẩm. Hơn nữa, chất liệu nhựa trơn bóng còn giúp người dùng dễ dàng lau chùi vệ sinh bụi bẩn bám khi lâu ngày sử dụng. #nguồn: Internet",""""""
