Domain,Url,Product_id,Brand,Category,Model,Price,Seller,Tags,Info,Others
sendo.vn,https://www.sendo.vn/combo-2-bao-220g-ca-phe-rang-xay-hang-1-sang-18-thunder-no3-1864-cafe-11562025.html/,11562025,1864 CAFÉ,Đồ uống,Combo 2 Bao 220g Cà Phê Rang Xay Hạng 1 Sàng 18 THUNDER No.3 1864 CAFÉ,141000,SHOP 1864 CAFÉ,," THUỘC TÍNH SẢN PHẨM Xuất xứ: Việt Nam. CHI TIẾT SẢN PHẨM Cà phê tinh khiết không tẩm không độn 1864 CAFÉ® Hiện nay việc tẩm hóa chất, hương liệu, chất phụ gia, chất bảo quản vào trong thành phần cà phê thương mại là rất phổ biến, có thể do ảnh hưởng của thói quen từ trước hoặc qua sách truyện. Có những “chuyên gia” cho rằng tẩm thêm hương, thêm vị, bơ, rượu, độn bắp, đậu nành, ca cao thì cà phê mới đậm đà thơm ngon, uống được. Lý do là những cà phê tẩm độn này sử dụng nhân xanh Robusta, vị đắng hương nồng nên buộc phải thêm “gia vị” cho dễ uống. Từ đó mỗi Nhà Sản xuất có một bí quyết tẩm, ướp riêng, hướng đến nhóm khách hàng của họ.Trên thế giới, phần lớn cà phê không tẩm không độn là một thức uống rất phổ biến, thơm, ngon do đa phần Nhà Sản xuất sử dụng nhân xanh Arabica. Sự khác biệt giữa hai chủng cà phê này khái lược như sau:Robusta: vị đậm đắng, hương nồng, nồng độ cafein cao. Trồng ở độ cao dưới 1.000m, có năng suất cao, có khả năng kháng bệnh rất tốt, Robusta thường dùng để trích lấy cafein sản xuất bánh, kẹo, hoặc thức uống. Arabica: mùi thơm phong phú và đa dạng, hậu ngọt, đắng nhẹ, chua nhẹ, hàm lượng cafein chỉ bằng ½ Robusta, khó trồng, độ cao trên 1.000m, khí hậu đòi hỏi phải phù hợp. Giá nhân xanh Arabica trên sàn London luôn cao hơn nhân xanh Robusta.Giới thiệu 1864 CAFÉ®Từ năm 2015, Công ty 1864 café nghiên cứu, sản xuất thành công và đưa ra thị trường trong nước cũng như xuất khẩu dòng cà phê hoàn toàn TINH KHIẾT KHÔNG TẨM KHÔNG ĐỘN nhờ áp dụng công nghệ Hydro Jet, sử dụng được nhân xanh Robusta Việt Nam, mà không cần tẩm hay độn thêm phụ gia, vẫn mang đến cho người thưởng thức hương thơm đa dạng như mùi chocolate, trái cây khô và vị không quá đắng, hậu ngọt. Là nước trồng cà phê Robusta nhiều nhất thế giới, hạt cà phê Robusta Việt Nam của vùng Cao nguyên Việt Nam đậm chất và nồng nàn, hàm lượng cafein cao đến 4%, thích hợp gu thưởng thức cà phê đá, cà phê sữa đá của người Việt Nam hoặc những người thích cảm giác sảng khoái bắt đầu cho ngày mới.Cà phê thương hiệu quốc tế 1864 CAFÉ® là dòng cà phê hoàn toàn tinh khiết, không tẩm hóa chất bảo quản, hóa chất tạo bọt, tạo vị, tạo hương cà phê, vani, chồn, chocolate, không tẩm dầu, bơ, rượu, caramen và cũng không độn bắp, đậu nành, xác cau, kể cả ca cao … Để được chất lượng như vậy Chúng tôi phải sử dụng hạt nhân xanh nguyên liệu chất lượng cao Hạng 1, cỡ hạt trên sàng 18/64 in (theo TCVN 4193: 2014), thành phẩm được bảo quản trong bao bì hợp kim Aluminium 5 lớp, đạt chuẩn ATVSTP, có van 1 chiều chống oxy hóa và Zip lock tiện lợi.Các sản phẩm cà phê hoàn toàn TINH KHIẾT KHÔNG TẨM KHÔNG ĐỘN thương hiệu quốc tế 1864 CAFÉ® hiện nay trên thị trường có các loại chính sau:Dòng cà phê THUNDER®: hướng tới khách hàng Việt Nam.THUNDER® No.1 Nhiều Robusta, có nồng độ cafein cao, thích hợp cho cà phê đá, cà phê sữa đá (người mẫn cảm với cafein tránh dùng loại này).THUNDER® No.2 Tỷ lệ Robusta cao, thích hợp cho cà phê sữa đá.THUNDER® No.3 Robusta và Arabica cân bằng, đặc biệt dành riêng cho cà phê đá, cà phê sữa đá đậm đà, thơm ngon.THUNDER® No.4 Hương, vị nhẹ nhàng, thơm ngon thích hợp cho cà phê đá.THUNDER® No.5 Nhiều Arabica, thích hợp cho cà phê nóng.THUNDER® No.6,7,8 Chủ yếu là Arabica, thích hợp cho cà phê nóng không đường hoặc dùng pha Espresso, Syphon, V60, Chemex.Tuy nhiên do hàm lượng cafein cao Quý khách cũng nên cân nhắc không uống khi bụng đói, buổi chiều muộn, người có tiền sử bệnh tim mạch, mẫn cảm với cafein hoặc có chỉ định của bác sĩ. Để pha được 01 ly cà phê ngon chỉ cần 15g cà phê, tương đương 01 kg cà phê THUNDER® pha được hơn 60 ly (đã được khách hàng kiểm chứng xác thực và đánh giá cao).Hướng dẫn sử dụng:Lần đầu sử dụng, mở bao cà phê bằng cách dùng kéo hoặc xé bằng tay ngay rãnh xé. Đóng bao bằng cách vuốt thẳng khóa nhựa.Hướng dẫn bảo quản:Luôn đóng kín miệng bao và để nơi khô ráo, thoáng mát. Tránh để gần hóa chất và các sản phẩm có mùi.Không để trực tiếp dưới ánh sáng mặt trời, nơi có nhiệt độ cao.Hướng dẫn pha phin:Cho vào phin inox từ 10g đến 20g cà phê bột, lắc đều nhẹ, cài nắp gài nhẹ nhàng (tuyệt đối không nén chặt), để tránh cà phê bị trào đổ vào phin khoảng 20ml nước sôi 93°C, chờ 01 phút cho cà phê ngấm đều châm thêm 45ml nước sôi nữa, sau đó cho thêm đường, nước đá, sữa tùy thích.Lưu ý: Nên sử dụng nước lọc không mùi, vị để pha cà phê. Nếu dùng cà phê nóng không đường, sữa thì nên pha loãng theo tỷ lệ 10g cho 180ml nước theo tiêu chuẩn SCA.Dòng cà phê Doanh nhân phin giấy Nhật Bản Origami mang phong cách tiện dụng, nhanh chóng, công nghiệp, phục vụ Quý Khách hàng là doanh nhân luôn bận rộn, di chuyển thường xuyên và những vị đang trên đường du lịch vẫn luôn có những ly cà phê thơm, ngon mang lại cảm giác tỉnh táo sảng khoái tuyệt vời. Dòng cà phê Doanh nhân phin giấy Nhật Bản Origami hiện nay gồm:Thunder Origami 1: vị đắng, nhiều cafein, thơm ít, thích hợp uống cà phê đá, cà phê sữa đá.Thunder Origami 3: mùi rất thơm, hậu ngọt, đặc biệt dùng uống cà phê đá, cà phê sữa đá rất ngon.Thunder Origami 5: thơm nhẹ nhàng, tinh tế chủ yếu dùng để pha cà phê nóng.Thunder Origami 7: chủ yếu là Arabica nên rất thơm, đặc biệt cho cà phê nóng không thêm đường, sữa.Thunder Origami Exquisite: là cà phê Exquisite hảo hạng, hương và vị đặc trưng cho từng vùng trồng cà phê nổi tiếng trên thế giới, là loại cà phê rất hiếm, đắt tiền, đặc biệt chỉ uống nóng, không đường, sữa, nên pha loãng với 200ml nước sôi.Cách pha: lưu ý khi dùng sản phẩm cà phê Doanh nhân phin giấy Nhật Bản nên sử dụng nước tinh khiết không mùi. Theo phòng Cupping thì lượng nước được tính từ 50ml đến 100ml là chuẩn. Tuy nhiên tùy khẩu vị để tăng độ đậm có thể chỉ cần 30ml nước sôi, vị sẽ đắng hơn, thêm sữa, đường, đá tùy thích.Dòng sản phẩm dành cho máy hoàn toàn tự động (superautomatic) cho chất lượng như barista chuyên nghiệp, do sử dụng công nghệ đột phá Anti-Residue™ hạt cà phê được rang chín tới hoàn toàn, không bị dầu (oil) phủ bên ngoài, khác với loại cà phê rang “mộc” có vị chua, khó uống. Dòng cà phê này hoàn toàn phù hợp với các cách pha espresso, latté, cappuccino, latté macchiato, americano, flat white…Đồng thời cũng dùng được trên tất cả các dòng máy thương hiệu: Jura, Faema, Rancilio, De'Longhi, Gaggia, Philips Saeco, Nivona, Bosch, Nuova Simonelli, Melitta, La Cimbali, Fagor, KRUPS, Miele…Đặc biệt hơn hết là dòng sản phẩm cà phê EXQUISITE® Specialty Coffee, là loại cà phê theo mùa (Season Coffee), được nhiều chuyên gia đánh giá là dòng sản phẩm cà phê ngon nhất trên thế giới, thường chỉ dành cho người sành uống, Specialty Coffee là dòng cà phê đạt tất cả các tiêu chuẩn khắt khe của Hiệp Hội Cà Phê Hảo Hạng quốc tế SCA, bắt đầu từ hạt giống chọn trồng cho đến chọn kiểu pha thành thức uống. Tham gia vào việc cùng tạo nên dòng cà phê hảo hạng đòi hỏi phải có kỹ thuật cao, kiến thức và lòng đam mê. Đối với các công đoạn sản xuất, chất lượng cao nhất, độc nhất là mục tiêu phải đạt được. Người thưởng thức Specialty Coffee cần có hiểu biết, có lòng đam mê, tính nghệ thuật, kiến thức khoa học vì là một nhân tố trong chuỗi xây dựng cho loại thức uống Specialty Coffee. Cũng vì là loại cà phê hiếm, quý, đắt tiền nên Specialty Coffee chưa được phổ biến rộng rãi.Dòng cà phê Exquisite Coffee gồm:Cà phê hảo hạng Specialty Coffee El Salvador El Borbollón.Cà phê hảo hạng Specialty Coffee Kenya Rukera.Cà phê hảo hạng Specialty Coffee Rwanda Musasa Mbilima.Cà phê hảo hạng Specialty Coffee Guatemala Finca Puerta Verde.Cà phê hảo hạng Specialty Coffee Ethiopia Yirgacheffe Gelana Abaya Tore Grade 1.Cà phê hảo hạng Specialty Coffee El Salvador La Providencia.Lưu ý: Loại cà phê này thường được pha bằng bình pha Syphon, tuy nhiên cũng có thể dùng các bình pha khác như V60, Chemex, Mokapot, Phin inox…hoặc các loại máy pha Espresso. Chỉ uống nóng, không thêm đường, sữa, mật ong…Thông qua thương hiệu quốc tế 1864 CAFÉ® Chúng tôi mong muốn mang đến cho Quý khách những trải nghiệm về Specialty Coffee như những chuyến phiêu lưu qua các vùng trồng cà phê nổi tiếng trên thế giới, thưởng thức và hài lòng với hương vị độc đáo của từng loại Specialty Coffee.• Trọn bộ sản phẩm bao gồm 02 x bao 220g cà phê rang xay Arabica và Robusta hạng 1 (R118a). • Xuất xứ: Việt Nam • Hạn sử dụng: 01 năm kể từ ngày sản xuất • Ngày sản xuất: Vui lòng xem trên bao bì sản phẩm. • Xác nhận công bố số: 2210/2017 ATTPHCM – XNCB cấp ngày 06/10/2017.Một lần nữa, xin chân thành cám ơn Quý khách đã quan tâm ủng hộ sản phẩm cà phê tinh khiết, không tẩm, không độn, thương hiệu quốc tế 1864 CAFÉ® của Chúng tôi. ","{""shop_info"": {""phone_number"": ""0986765118"", ""rating_count"": 308, ""good_review_percent"": 98.50746, ""shop_name"": ""SHOP 1864 CAF\u00c9"", ""rating_avg"": 4.7, ""shop_id"": 398684, ""shop_url"": ""shop/1864cafe"", ""product_total"": 49, ""warehourse_region_name"": ""H\u1ed3 Ch\u00ed Minh""}, ""counter_view"": 0, ""order_count"": 34, ""full_category_id"": ""1/2/1171/1227/1228""}"
sendo.vn,https://www.sendo.vn/mam-dau-nanh-nguyen-so-yen-mach-500g-10746520.html/,10746520,,Đồ uống,mầm đậu nành nguyên sơ yến mạch 500g,35000,sữa bỉm bibi,," THUỘC TÍNH SẢN PHẨM Nhãn hiệu: 100 Plus. CHI TIẾT SẢN PHẨM Xuất phát từ việc cần thiết phải bổ sung nội tiết tố, giữ mãi nét khỏe đẹp của chị em, các nhà khoa học đã nghiên cứu và tìm ra thành phần isoflavon được chiết xuất từ tinh chất mầm đậu nành chuyên giải quyết triệt để mọi vấn đề: Estrogen bị trục trặc, ngưng trệ, sự xuống cấp nhan sắc với những vết nám, sạm, da nhăn, tóc khô xơ, dễ rụng, mỡ bụng, ngực lép… suy giảm sức khỏe và chức năng sinh lý bên trong cơ thể.Như vậy Estrogen thảo dược từ tinh chất mầm đậu nành nguyên xơ không chỉ đơn thuần là loại “bí quyết” được chị em đồn thổi mà chính là giải pháp tránh được mọi rắc rối để có được sắc xuân vẹn tròn.- Sử dụng cho những đối tượng: Nam giới & phụ nữ từ 18 tuổi trở lên!– Người có mong muốn tăng size vòng 1 lên Big size!– Cải thiện nội tiết tố– Đẹp da, giữ cân, tóc mượt, tiêu nám, tàng nhang– Cải thiện sinh lý nữ nhất là phụ nữ tuổi 35 trở lên về những vấn đề như tiền mãn kinh!– Cải thiện vấn đề “khô hạn” thiếu sức sống!– Mầm đậu, liệu pháp số 1 cân bằng nội tiết tố Estrogen- Với bột mầm đậu nành tăng 3cm vòng 1 là điều dễ dàng Một đôi gò bồng nở nang, săn chắc tự nhiên luôn là ước mơ của phụ nữ. Ngày nay, không cần phải dùng những biện pháp nguy hiểm, bạn hiệu quả cao có thể tăng 3cm vòng 1 chỉ với việc chăm chỉ sử dụng mầm đậu nành. Bởi trong đậu nành có một lượng lớn Isoflavones một chất tương tự như hoocmon estrogen giúp nở ngực, bù đắp sự thiếu hụt estrogen ở nữ giới, kích thích phát triển lớp mỡ đệm và tăng cường sự săn chắc cho bầu ngực, hiệu quả kích thích cao gấp 5 lần so với sự phát triển thông thường. ","{""shop_info"": {""phone_number"": ""0396056311"", ""rating_count"": 253, ""good_review_percent"": 93.84615, ""shop_name"": ""s\u1eefa b\u1ec9m bibi"", ""rating_avg"": 4.5, ""shop_id"": 372166, ""shop_url"": ""shop/sua-bim-bibi"", ""product_total"": 132, ""warehourse_region_name"": ""Nam \u0110\u1ecbnh""}, ""counter_view"": 0, ""order_count"": 14, ""full_category_id"": ""1/2/1171/1227/2606""}"
sendo.vn,https://www.sendo.vn/ca-phe-giam-can-thai-lan-11961486.html/,11961486,,Đồ uống,Cà phê giảm cân Thái Lan,150000,kimanh296,," THUỘC TÍNH SẢN PHẨM Nhãn hiệu: Beck's. Xuất xứ: Thái Lan. CHI TIẾT SẢN PHẨM ☕☕Cà phê giảm cân Idol Slim Coffee được nhập khẩu từ Thái Lan ➡️Hiện đang được hàng triệu khách hàng ở Thái Lan tin dùng và đã giảm cân thành công. Sản phẩm có mùi vị cực kỳ thơm ngon, dễ uống, với thành phần được chiết xuất 100% từ thiên nhiên ✅CÔNG DỤNG: Giảm cân một cách hiệu quả bằng cơ chế tiêu hao phần mỡ dư thừa bên trong cơ thể, kiểm soát lượng calo tiêu thụ, đem lại kết quả giảm cân nhanh chóng và bền vững cho người sử dụng. Idol Slim Coffee giúp bạn hạn chế cảm giác thèm ăn ngọt. Cà phê giảm cân Idol Slim Coffee hạn chế gây ra các tác dụng phụ nên rất an toàn cho người sử dụng. Hỗ trợ giúp hạn chế sự tăng cân trở lại. Sản phẩm giảm cân Idol Slim Coffee sử dụng cho cả Nam và Nữ. Chỉ với 1 hộp sau khi sử dụng cho bạn thân hình như ý . ----------------------------- 1 liệu trình tốt nhất là 1 tháng 3 hộp ","{""shop_info"": {""phone_number"": ""0986786126"", ""rating_count"": 575, ""good_review_percent"": 97.01492, ""shop_name"": ""kimanh296"", ""rating_avg"": 4.9, ""shop_id"": 124145, ""shop_url"": ""shop/kimanh296"", ""product_total"": 75, ""warehourse_region_name"": ""H\u00e0 N\u1ed9i""}, ""counter_view"": 0, ""order_count"": 29, ""full_category_id"": ""1/2/1171/1227/1228""}"
sendo.vn,https://www.sendo.vn/tra-nu-voi-500g-11416245.html/,11416245,,Đồ uống,trà nụ vối 500g,60000,hoabi90,," THUỘC TÍNH SẢN PHẨM Nhãn hiệu: 100 Plus. Xuất xứ: Việt Nam. CHI TIẾT SẢN PHẨM Trà nụ vối kl: Cách dùng rất đơn giản như pha chè Hàng chất lượng, đảm bảo Liên hệ: 01697051830 Face: 0904155703 - Hoa Nguyen ","{""shop_info"": {""phone_number"": ""0397051830"", ""rating_count"": 265, ""good_review_percent"": 84.32204, ""shop_name"": ""hoabi90"", ""rating_avg"": 4, ""shop_id"": 325338, ""shop_url"": ""shop/hoabi90"", ""product_total"": 315, ""warehourse_region_name"": ""H\u00e0 Giang""}, ""counter_view"": 0, ""order_count"": 8, ""full_category_id"": ""1/2/1171/1227/1231""}"
