Domain,Url,Product_id,Brand,Category,Model,Price,Seller,Tags,Info,Others
sendo.vn,https://www.sendo.vn/ca-phe-giam-can-idol-slim-coffee-9979917.html/,9979917,,Đồ uống,CÀ PHÊ GIẢM CÂN IDOL SLIM COFFEE,90000,Thailand,," THUỘC TÍNH SẢN PHẨM Xuất xứ: Thái Lan. CHI TIẾT SẢN PHẨM Giới thiệu sản phẩm Cà phê giảm cân Idol Slim CoffeeBạn muốn giảm cân nhanh chóng? Bạn muốn có 1 dáng vóc đẹp? Nhưng lại sợ phải dùng thuốc để giảm cân, và không tốt cho sức khỏe của mình. Với Cà phê giảm cân Idol Slim Coffee sẽ là một liệu pháp giảm cân an toàn và tuyệt vời nhất đối với bạn.Được nhập khẩu từ Thái Lan, cà phê giảm cân Idol Slim Coffee hiện đang được hàng triệu khách hàng ở Thái Lan tin dùng và đã giảm cân thành công. Sản phẩm có mùi vị cực kỳ thơm ngon, dễ uống, với thành phần được chiết xuất 100% từ tự nhiên. Thông tin sản phẩm Cà phê giảm cân Idol Slim Coffee– Thức uống cafe cho bạn dáng vóc chuẩn và an toàn bằng cách nào là câu hỏi được truyền tai nhau hằng ngày của phái đẹp nói riêng và cả cánh đàn ông nói chung. Hiện nay tình trạng thừa cân, béo phì đang tǎng lên với tốc độ nhanh chóng và đáng báo động trên thế giới ở tất cả những quốc gia phát triển và các quốc gia đang phát triển. Đây thật sự là một mối đe dọa tiềm ẩn trong tương lai. Tại các nước đang phát triển, bệnh béo phì tồn tại song song với tình trạng thiếu dinh dưỡng, tình trạng này gặp nhiều ở thành phố hơn là so với nông thôn do thói quen sinh hoạt thiếu khoa học. Ở Việt Nam con số thống kê người mắc bệnh béo phì ngày càng gia tăng và đang có xu hướng tăng cao lên. Bị nhẹ thì mất dáng kém xinh, nặng thì mắc bệnh béo phì gây ảnh hưởng không tốt đến hệ tim mạch và một loạt các hệ lụy khác từ chứng dư thừa cân.– Vậy làm thế nào để Giảm cân hiệu quả và an toàn đây? Trong các bài viết được chia sẻ trước đây trên các diễn đàn thì đã có những chia sẻ về bí quyết giữ dáng, cách ăn uống khoa học và lành mạnh để giảm thiểu nguy cơ mắc bệnh béo phì. Nhưng ngày nay với nhịp sống hối hả lo toan nhiều cái như thế này không phải ai cũng có thời gian dành riêng cho mình để tập gym, yoga, erobic, chơi thể thao…và có thể thay đổi thói quen ăn uống hợp lý. Hôm nay ở bài viết này chúng tôi xin chia sẻ bí quyết Giảm cân hiệu quả và an toàn nhất được Bộ Y Tế kiểm định gắt gao và công nhận sản phẩm cafe giảm cân Coffee Idol Slim đạt chuẩn chất lượng. – Cafe giảm cân Coffee Idol Slim được sản xuất ở Thái Lan và được nhập khẩu tại bệnh viện Quốc tế Yanhee Hàn Quốc. Coffee Idol Slim được chiết xuất từ các thành phần từ thiên nhiên cùng với đó là sự kết hợp với L-Collagen Canittine chiết xuất từ đậu và cây xương rồng giúp bạn Giảm cân một cách hiệu quả và vô cùng an toàn theo cơ chế tăng tốc độ tiêu hóa các chất béo. Bên cạnh đó, Coffee Idol Slim còn giúp bạn hạn chế được các cơn thèm ăn, với chiết xuất từ collagen làn da của bạn sẽ trở nên trắng mịn mà không bị nhăn sạm sau quá trình giảm cân. Sản phẩm giảm cân này không hề gây ra tác dụng phụ, không ảnh hưởng đến cơ quan não bộ và hoàn toàn không có thuốc an thần ở trong sản phẩm.– Đặc biệt, với thành phần chính, L – carnitine Collagen, được chiết xuất từ giống đậu thân trắng và cây xương rồng, có tác dụng giúp đốt cháy chất béo, tiêu hao lượng mỡ thừa, đồng thời đào thải các độc tố ra bên ngoài, giải thoát chất béo một cách an toàn qua hệ bài tiết, ngăn ngừa sự hấp thu các chất béo và tích trữ lượng mỡ thừa hiệu quả. Idol Slim Coffee còn giúp người giảm cân kiềm chế cảm giác thèm ăn ngọt rất tốt và kiểm soát lượng calo tiêu thụ để hỗ trợ giảm cân tối đa.– Sản phẩm hỗ trợ sự giảm cân dựa trên cơ chế tự nhiên, bằng cách tiêu hao lượng mỡ dư thừa trong cơ thể, hạn chế lượng calo tiêu thụ, mang lại kết quả giảm cân bền vững cho người sử dụng, không hề gây ra tác dụng phụ, đặc biệt không tăng cân trở lại. Hãy bắt đầu ngày làm việc mới bằng với một ly cà phê Idol Slim Coffee vào mỗi buổi sáng, không những có tác dụng giảm cân hiệu quả, mà còn làm cho tinh thần của chúng ta thoải mái hơn, hiệu quả trong công việc được nâng cao hơn. Công dụng sản phẩm Cà phê giảm cân Idol Slim CoffeeGiảm cân một cách hiệu quả bằng cơ chế tiêu hao phần mỡ dư thừa bên trong cơ thể, kiểm soát lượng calo tiêu thụ, đem lại kết giảm cân quả nhanh chóng và bền vững cho người sử dụng.Idol Slim Coffee giúp bạn tạo cảm giác thèm ăn và hạn chế cảm giác thèm ăn ngọt.Cà phê giảm cân Idol Slim Coffee hạn chế gây ra các tác dụng phụ nên rất an toàn cho người sử dụng.Hỗ trợ giúp hạn chế sự tăng cân trở lại.Sản phẩm giảm cân Idol Slim Coffee sử dụng cho cả Nam và Nữ.Thành phần sản phẩm Cà phê giảm cân Idol Slim CoffeeSugar freeL-CarnitineCollagenĐược chiết xuất từ đậu thân trắng và cây xương rồng.Ít béoSugar-FreeCorel sterol 0%.Có Crucarlose là chất làm ngọt thay đường.⇒ Tất cả các thành phần có trong Cà Phê Giảm Cân Idol Slim Coffee đã được qua thẩm định, đánh giá về mặt y tế an toàn: Không gây ra tác dụng phụ, không chất hóa học, chất bảo quản, không thuốc an thần, không chất kích thích gây ảnh hưởng đến bộ thần kinh trung ương não bộ. Hướng dẫn sử dụng sản phẩm Cà phê giảm cân Idol Slim Coffee⇒ Hòa tan1 gói Cà phê Idol Slim Coffee với 150 ml nước uống.⇒ Dùng đều đặn 1 gói mỗi ngày, uống khoảng 30 phút trước bữa ăn đầu tiên.⇒ Sử dụng Cà phê giảm cân Idol Slim Coffee thường xuyên mỗi ngày bạn sẽ nhận thấy sự khác biệt rõ rệt chỉ trong vòng 7 ngày đầu tiên khi sử dụng sản phẩm.*Lời khuyên khi sử dụng Cà phê giảm cân Idol Slim Coffee– Để quá trình sử dụng Cà phê giảm cân Idol Slim Coffee đạt hiệu quả cao nhất bạn cần đảm bảo:+ Hạn chế sử dụng các chất kích thích như: bia, rượu, thuốc lá,… trong quá trình giảm cân.+ Uống từ 2-4 lít mỗi ngày để giúp làn da được tươi trẻ, mịn màng, da không bị khô, nhăn nheo sau quá trình giảm cân.+ Không nên ăn quá nhiều các chất béo và đồ ngọt vào bữa ăn tối (nên ăn trước 8h tối).*Lưu ý→ Tùy thuộc vào cơ địa của mỗi người có thể đạt một kết quả khác nhau khi sử dụng sản phẩm.→ Sản phẩm không dùng cho trẻ em dưới 12 tuổi và phụ nữ đang trong quá trình mang thai.IDOL SLIM COFFEEIDOL SLIM COFFEE ","{""shop_info"": {""phone_number"": ""0901990898"", ""rating_count"": 110, ""good_review_percent"": 82.97872, ""shop_name"": ""Thailand"", ""rating_avg"": 4.1, ""shop_id"": 378984, ""shop_url"": ""shop/thailand"", ""product_total"": 75, ""warehourse_region_name"": ""B\u00ecnh D\u01b0\u01a1ng""}, ""counter_view"": 0, ""order_count"": 12, ""full_category_id"": ""1/2/1171/1227/1228""}"
sendo.vn,https://www.sendo.vn/ca-phe-nguyen-chat-tin-coffee-robusta-500g-10302408.html/,10302408,,Đồ uống,Cà phê nguyên chất TÍN COFFEE ROBUSTA 500g,72000,matongphuochy789,," THUỘC TÍNH SẢN PHẨM Xuất xứ: Việt Nam. CHI TIẾT SẢN PHẨM 🎗Cà phê nguyên chất TÍN COFFEE ROBUSTACÀ PHÊ TÍN NGUYÊN CHẤTTÍN tự hào là nhà cung cấp cà phê hạt nguyên chất chất lượng nhất – giá cạnh tranh nhất trên thị trường. 🎗Thành phần: hạt cà phê trồng ở Gia Lai, là nguyên liệu thiên nhiên nguyên chất 100%🎗Bạn đã thưởng thức hương vị đậm đà của cà phê Nguyên chất Gia Lai? 🎗Hương vị cà phê nguyên chất từ Cao nguyên đầy gió. Từng Hạt cà phê được chăm chút kĩ lưỡng, được trồng trọt theo đúng quy trình kĩ thuật tại vườn nhà. Không tẩm bất cứ phụ gia hay hoá chất nào, Vì Mong muốn khách hàng được thưởng thức đến hương vị tinh khiết nhất từ hạt ngọc cao nguyên. 🎗Có cả cà phê nguyên hạt cũng như cà phê đã rang xay để phục vụ theo nhu cầu quý khách.🎖Những điều chỉ có ở cà phê nguyên chất:🎗Điều đặc biệt ở Cafe nguyên chất Màu nước cà phê luôn có màu nâu cánh gián đến nâu đậm, dù bạn rang nó đến nhiệt độ cao bao nhiêu , thời gian bao lâu, thì khi xay ra bột cafe vẫn ko có màu đen thui. Độ sánh không đáng kể🎗Mùi thơm từ hạt cafe rang nguyên chất rất quyến rũ và đặc trưng, lại rất dịu dàng, sâu lắng...Hương vị: Có vị chua, thơm và lượng caffeien thấp hơn Cafe Robusta.🎗Với cam kết về chất lượng cà phê nguyên chất, cùng chính sách dùng thử trước khi mua nhằm đảm bảo quyền lợi khách hàng cao nhất, mình rất mong nhận được sự ủng hộ của các bạn gần xa. Vì sức khoẻ của bạn và gia đình hãy lựa chọn nguồn cung cấp cà phê uy tín và đảm bảo.🎗Uy tín - chất lượng là tiêu chí hàng đầu.🎗Tuyệt đối không pha trộn thành phần nào khác.🎗Bao thử thoải mái, hoàn tiền lại 100% nếu phát hiện cà phê giả, kém chất lượng.🎗Mua càng nhiều càng rẻ, nếu các bạn là của hàng hay đại lý có nhu cầu lấy sĩ vui lòng liên hệ trực tiếp với shop để lấy giá tốt nhất.🎖Liên hệ: 0963820779 Ngoài ra, mình cung cấp thêm những sản phẩm: rang say theo yêu cầu của khách hàngCam kết của shop:Đảm bảo chuẩn- đủ ngày-đủ chín tự nhiên Uy tín –chất lương là tiêu chí hàng đầu. TUYỆT ĐỐI KHÔNG lấy mật từ đường KHÔNG pha trộn bất kì thành phần nào khác. BAO THỬthoải mái,Hoàn tiền lại 100% nếu phát hiện mật giả, kém chất lượng. MUA càng NHIỀU càng RẺ.Nếu các bạn là của hàng hay đại lý có nhu cầu lấy sỉ vui lòng liên hệ trực tiếpxem thêm các sản phẩm khác của shop: http://sendo.vn/shop/matongphuochy789Khi mua sản phẩm này tại SHOP PHƯỚC HỶ shop ngay hôm nay. Cà phê nguyên chất TÍN COFFEE ROBUSTA- Bạn sẽ được bao đổi bất kỳ sản phẩm nào khác của shop trong vòng 6 tháng nếu không ưng ý với sản phẩm hiện tại.- Bạn cũng có thể trả lại hàng nếu không thích mua nữa, shop cam kết hoàn 100% tiền sản phẩm cho bạn.- Hàng luôn có tại kho của shop nên thời gian giao hàng đến tay các bạn cũng sẽ được ngắn đi rất nhiều.Cảm ơn bạn đã xem sản phẩm của mình, chúc bạn một ngày mua sắm vui vẻ.HÃY ẤN MUA NGAY ĐỂ NHẬN TẤT CẢ NHỮNG ƯU ĐÃI TỪ SHOP NHÉ. Chúng tôi sẽ cung cấp cho quý khách hàng những sản phẩm cà phê chất lượng cao nhất và cạnh tranh nhất thị trường ! ","{""shop_info"": {""phone_number"": ""0911093377"", ""rating_count"": 794, ""good_review_percent"": 94.19643, ""shop_name"": ""matongphuochy789"", ""rating_avg"": 4.4, ""shop_id"": 383582, ""shop_url"": ""shop/matongphuochy789"", ""product_total"": 37, ""warehourse_region_name"": ""Gia Lai""}, ""counter_view"": 0, ""order_count"": 4, ""full_category_id"": ""1/2/1171/1227/1228""}"
sendo.vn,https://www.sendo.vn/ca-phe-bot-rang-xay-hang-1-sang-1864-thunder-no1-klt-220g-1864-cafe-11564098.html/,11564098,1864 CAFÉ,Đồ uống,Cà Phê Bột Rang Xay Hạng 1 Sàng 1864 THUNDER No.1 KLT 220g - 1864 CAFÉ,37000,SHOP 1864 CAFÉ,," THUỘC TÍNH SẢN PHẨM Xuất xứ: Việt Nam. CHI TIẾT SẢN PHẨM Cà phê tinh khiết không tẩm không độn 1864 CAFÉ® Hiện nay việc tẩm hóa chất, hương liệu, chất phụ gia, chất bảo quản vào trong thành phần cà phê thương mại là rất phổ biến, có thể do ảnh hưởng của thói quen từ trước hoặc qua sách truyện. Có những “chuyên gia” cho rằng tẩm thêm hương, thêm vị, bơ, rượu, độn bắp, đậu nành, ca cao thì cà phê mới đậm đà thơm ngon, uống được. Lý do là những cà phê tẩm độn này sử dụng nhân xanh Robusta, vị đắng hương nồng nên buộc phải thêm “gia vị” cho dễ uống. Từ đó mỗi Nhà Sản xuất có một bí quyết tẩm, ướp riêng, hướng đến nhóm khách hàng của họ.Trên thế giới, phần lớn cà phê không tẩm không độn là một thức uống rất phổ biến, thơm, ngon do đa phần Nhà Sản xuất sử dụng nhân xanh Arabica. Sự khác biệt giữa hai chủng cà phê này khái lược như sau:Robusta: vị đậm đắng, hương nồng, nồng độ cafein cao. Trồng ở độ cao dưới 1.000m, có năng suất cao, có khả năng kháng bệnh rất tốt, Robusta thường dùng để trích lấy cafein sản xuất bánh, kẹo, hoặc thức uống. Arabica: mùi thơm phong phú và đa dạng, hậu ngọt, đắng nhẹ, chua nhẹ, hàm lượng cafein chỉ bằng ½ Robusta, khó trồng, độ cao trên 1.000m, khí hậu đòi hỏi phải phù hợp. Giá nhân xanh Arabica trên sàn London luôn cao hơn nhân xanh Robusta.Giới thiệu 1864 CAFÉ®Từ năm 2015, Công ty 1864 café nghiên cứu, sản xuất thành công và đưa ra thị trường trong nước cũng như xuất khẩu dòng cà phê hoàn toàn TINH KHIẾT KHÔNG TẨM KHÔNG ĐỘN nhờ áp dụng công nghệ Hydro Jet, sử dụng được nhân xanh Robusta Việt Nam, mà không cần tẩm hay độn thêm phụ gia, vẫn mang đến cho người thưởng thức hương thơm đa dạng như mùi chocolate, trái cây khô và vị không quá đắng, hậu ngọt. Là nước trồng cà phê Robusta nhiều nhất thế giới, hạt cà phê Robusta Việt Nam của vùng Cao nguyên Việt Nam đậm chất và nồng nàn, hàm lượng cafein cao đến 4%, thích hợp gu thưởng thức cà phê đá, cà phê sữa đá của người Việt Nam hoặc những người thích cảm giác sảng khoái bắt đầu cho ngày mới.Cà phê thương hiệu quốc tế 1864 CAFÉ® là dòng cà phê hoàn toàn tinh khiết, không tẩm hóa chất bảo quản, hóa chất tạo bọt, tạo vị, tạo hương cà phê, vani, chồn, chocolate, không tẩm dầu, bơ, rượu, caramen và cũng không độn bắp, đậu nành, xác cau, kể cả ca cao … Để được chất lượng như vậy Chúng tôi phải sử dụng hạt nhân xanh nguyên liệu chất lượng cao Hạng 1, cỡ hạt trên sàng 18/64 in (theo TCVN 4193: 2014), thành phẩm được bảo quản trong bao bì hợp kim Aluminium 5 lớp, đạt chuẩn ATVSTP, có van 1 chiều chống oxy hóa và Zip lock tiện lợi.Các sản phẩm cà phê hoàn toàn TINH KHIẾT KHÔNG TẨM KHÔNG ĐỘN thương hiệu quốc tế 1864 CAFÉ® hiện nay trên thị trường có các loại chính sau:Dòng cà phê THUNDER®: hướng tới khách hàng Việt Nam.THUNDER® No.1 Nhiều Robusta, có nồng độ cafein cao, thích hợp cho cà phê đá, cà phê sữa đá (người mẫn cảm với cafein tránh dùng loại này).THUNDER® No.2 Tỷ lệ Robusta cao, thích hợp cho cà phê sữa đá.THUNDER® No.3 Robusta và Arabica cân bằng, đặc biệt dành riêng cho cà phê đá, cà phê sữa đá đậm đà, thơm ngon.THUNDER® No.4 Hương, vị nhẹ nhàng, thơm ngon thích hợp cho cà phê đá.THUNDER® No.5 Nhiều Arabica, thích hợp cho cà phê nóng.THUNDER® No.6,7,8 Chủ yếu là Arabica, thích hợp cho cà phê nóng không đường hoặc dùng pha Espresso, Syphon, V60, Chemex.Tuy nhiên do hàm lượng cafein cao Quý khách cũng nên cân nhắc không uống khi bụng đói, buổi chiều muộn, người có tiền sử bệnh tim mạch, mẫn cảm với cafein hoặc có chỉ định của bác sĩ. Để pha được 01 ly cà phê ngon chỉ cần 15g cà phê, tương đương 01 kg cà phê THUNDER® pha được hơn 60 ly (đã được khách hàng kiểm chứng xác thực và đánh giá cao).Hướng dẫn sử dụng:Lần đầu sử dụng, mở bao cà phê bằng cách dùng kéo hoặc xé bằng tay ngay rãnh xé. Đóng bao bằng cách vuốt thẳng khóa nhựa.Hướng dẫn bảo quản:Luôn đóng kín miệng bao và để nơi khô ráo, thoáng mát. Tránh để gần hóa chất và các sản phẩm có mùi.Không để trực tiếp dưới ánh sáng mặt trời, nơi có nhiệt độ cao.Hướng dẫn pha phin:Cho vào phin inox từ 10g đến 20g cà phê bột, lắc đều nhẹ, cài nắp gài nhẹ nhàng (tuyệt đối không nén chặt), để tránh cà phê bị trào đổ vào phin khoảng 20ml nước sôi 93°C, chờ 01 phút cho cà phê ngấm đều châm thêm 45ml nước sôi nữa, sau đó cho thêm đường, nước đá, sữa tùy thích.Lưu ý: Nên sử dụng nước lọc không mùi, vị để pha cà phê. Nếu dùng cà phê nóng không đường, sữa thì nên pha loãng theo tỷ lệ 10g cho 180ml nước theo tiêu chuẩn SCA.Dòng cà phê Doanh nhân phin giấy Nhật Bản Origami mang phong cách tiện dụng, nhanh chóng, công nghiệp, phục vụ Quý Khách hàng là doanh nhân luôn bận rộn, di chuyển thường xuyên và những vị đang trên đường du lịch vẫn luôn có những ly cà phê thơm, ngon mang lại cảm giác tỉnh táo sảng khoái tuyệt vời. Dòng cà phê Doanh nhân phin giấy Nhật Bản Origami hiện nay gồm:Thunder Origami 1: vị đắng, nhiều cafein, thơm ít, thích hợp uống cà phê đá, cà phê sữa đá.Thunder Origami 3: mùi rất thơm, hậu ngọt, đặc biệt dùng uống cà phê đá, cà phê sữa đá rất ngon.Thunder Origami 5: thơm nhẹ nhàng, tinh tế chủ yếu dùng để pha cà phê nóng.Thunder Origami 7: chủ yếu là Arabica nên rất thơm, đặc biệt cho cà phê nóng không thêm đường, sữa.Thunder Origami Exquisite: là cà phê Exquisite hảo hạng, hương và vị đặc trưng cho từng vùng trồng cà phê nổi tiếng trên thế giới, là loại cà phê rất hiếm, đắt tiền, đặc biệt chỉ uống nóng, không đường, sữa, nên pha loãng với 200ml nước sôi.Cách pha: lưu ý khi dùng sản phẩm cà phê Doanh nhân phin giấy Nhật Bản nên sử dụng nước tinh khiết không mùi. Theo phòng Cupping thì lượng nước được tính từ 50ml đến 100ml là chuẩn. Tuy nhiên tùy khẩu vị để tăng độ đậm có thể chỉ cần 30ml nước sôi, vị sẽ đắng hơn, thêm sữa, đường, đá tùy thích.Dòng sản phẩm dành cho máy hoàn toàn tự động (superautomatic) cho chất lượng như barista chuyên nghiệp, do sử dụng công nghệ đột phá Anti-Residue™ hạt cà phê được rang chín tới hoàn toàn, không bị dầu (oil) phủ bên ngoài, khác với loại cà phê rang “mộc” có vị chua, khó uống. Dòng cà phê này hoàn toàn phù hợp với các cách pha espresso, latté, cappuccino, latté macchiato, americano, flat white…Đồng thời cũng dùng được trên tất cả các dòng máy thương hiệu: Jura, Faema, Rancilio, De'Longhi, Gaggia, Philips Saeco, Nivona, Bosch, Nuova Simonelli, Melitta, La Cimbali, Fagor, KRUPS, Miele…Đặc biệt hơn hết là dòng sản phẩm cà phê EXQUISITE® Specialty Coffee, là loại cà phê theo mùa (Season Coffee), được nhiều chuyên gia đánh giá là dòng sản phẩm cà phê ngon nhất trên thế giới, thường chỉ dành cho người sành uống, Specialty Coffee là dòng cà phê đạt tất cả các tiêu chuẩn khắt khe của Hiệp Hội Cà Phê Hảo Hạng quốc tế SCA, bắt đầu từ hạt giống chọn trồng cho đến chọn kiểu pha thành thức uống. Tham gia vào việc cùng tạo nên dòng cà phê hảo hạng đòi hỏi phải có kỹ thuật cao, kiến thức và lòng đam mê. Đối với các công đoạn sản xuất, chất lượng cao nhất, độc nhất là mục tiêu phải đạt được. Người thưởng thức Specialty Coffee cần có hiểu biết, có lòng đam mê, tính nghệ thuật, kiến thức khoa học vì là một nhân tố trong chuỗi xây dựng cho loại thức uống Specialty Coffee. Cũng vì là loại cà phê hiếm, quý, đắt tiền nên Specialty Coffee chưa được phổ biến rộng rãi.Dòng cà phê Exquisite Coffee gồm:Cà phê hảo hạng Specialty Coffee El Salvador El Borbollón.Cà phê hảo hạng Specialty Coffee Kenya Rukera.Cà phê hảo hạng Specialty Coffee Rwanda Musasa Mbilima.Cà phê hảo hạng Specialty Coffee Guatemala Finca Puerta Verde.Cà phê hảo hạng Specialty Coffee Ethiopia Yirgacheffe Gelana Abaya Tore Grade 1.Cà phê hảo hạng Specialty Coffee El Salvador La Providencia.Lưu ý: Loại cà phê này thường được pha bằng bình pha Syphon, tuy nhiên cũng có thể dùng các bình pha khác như V60, Chemex, Mokapot, Phin inox…hoặc các loại máy pha Espresso. Chỉ uống nóng, không thêm đường, sữa, mật ong…Thông qua thương hiệu quốc tế 1864 CAFÉ® Chúng tôi mong muốn mang đến cho Quý khách những trải nghiệm về Specialty Coffee như những chuyến phiêu lưu qua các vùng trồng cà phê nổi tiếng trên thế giới, thưởng thức và hài lòng với hương vị độc đáo của từng loại Specialty Coffee.• Trọn bộ sản phẩm bao gồm 01 x bao 220g cà phê rang xay Arabica và Robusta hạng 1 (R118a). • Xuất xứ: Việt Nam • Hạn sử dụng: 01 năm kể từ ngày sản xuất • Ngày sản xuất: Vui lòng xem trên bao bì sản phẩm. • Xác nhận công bố số: 2210/2017 ATTPHCM – XNCB cấp ngày 06/10/2017.Một lần nữa, xin chân thành cám ơn Quý khách đã quan tâm ủng hộ sản phẩm cà phê tinh khiết, không tẩm, không độn, thương hiệu quốc tế 1864 CAFÉ® của Chúng tôi. ","{""shop_info"": {""phone_number"": ""0986765118"", ""rating_count"": 308, ""good_review_percent"": 98.50746, ""shop_name"": ""SHOP 1864 CAF\u00c9"", ""rating_avg"": 4.7, ""shop_id"": 398684, ""shop_url"": ""shop/1864cafe"", ""product_total"": 49, ""warehourse_region_name"": ""H\u1ed3 Ch\u00ed Minh""}, ""counter_view"": 0, ""order_count"": 70, ""full_category_id"": ""1/2/1171/1227/1228""}"
sendo.vn,https://www.sendo.vn/bot-cacao-caravelle-vinacacao-300g-11871334.html/,11871334,Vinacacao,Đồ uống,Bột cacao Caravelle - VINACACAO 300g,61000,Vinacacao,," THUỘC TÍNH SẢN PHẨM Xuất xứ: Việt Nam. CHI TIẾT SẢN PHẨM Được sản xuất cho các bà nội trợ chế biến thực phẩm dùng bột Cacao như rau câu, bánh brownie, bánh kem hoặc để pha vào sữa dùng cho trẻ em biếng ăn, ngán sữa bột. Bột Caravelle là sản phẩm chế biến lý tưởng dùng trong nhà hàng, khách sạn, quán cafe.Thành phần : Cacao thiên nhiên nguyên chất 100%.Cách bảo quản : Bảo quản nơi khô ráo và thoáng mát ở nhiệt độ 15°C – 25°C, tránh ánh sáng trực tiếp.TOP 5 LỢI ÍCH KHÔNG THỂ CHỐI CÃI CỦA CACAO NGUYÊN CHẤT1 - Ngừa ung thư.2 - Ổn định huyết áp.3 - Giảm cân.4 - Da sáng đẹp, trẻ lâu. 👶5 - Giảm stress, ""Happy brain"".Cacao được coi là một thực phẩm thuần khiết và lành mạnh cho cơ thể. Tác dụng của cacao trong việc cải thiện sức khỏe là rất lớn và đã được chứng minh qua các nghiên cứu khoa học cũng như thực nghiệm thực tế.❔ Sử dụng cacao nguyên chất được lợi gì?- Da đẹp, dáng xinh, tràn đầy năng lượng.- Ngăn ngừa bệnh tật, dùng được cho người ăn kiêng, tiểu đường. - Vui vẻ hơn vì được ăn những thứ mình thích nhưng không lo hại sức khỏe. ","{""shop_info"": {""phone_number"": ""0908002294"", ""rating_count"": 42, ""good_review_percent"": 92.30769, ""shop_name"": ""Vinacacao"", ""rating_avg"": 4.5, ""shop_id"": 415691, ""shop_url"": ""shop/vietnamcacao"", ""product_total"": 37, ""warehourse_region_name"": ""H\u1ed3 Ch\u00ed Minh""}, ""counter_view"": 0, ""order_count"": 11, ""full_category_id"": ""1/2/1171/1227/1231""}"
