Domain,Url,Product_id,Rating,Comment,Review Time,Bought Time
adayroi.com,https://www.adayroi.com/tu-lanh-1-canh-aqua-aqr-95ar-ss-93-lit-p-PRI988718?offer=PRI988718_M-QOE,PRI988718,3,,2018-10-13 14:45:00,
adayroi.com,https://www.adayroi.com/tu-lanh-sharp-sj-x201e-ds-196l-inverter-p-PRI1259434?offer=PRI1259434_M-QOE,PRI1259434,4,,2018-08-29 17:43:00,
adayroi.com,https://www.adayroi.com/tu-lanh-samsung-rt19m300bgs-sv-216-lit-p-PRI1290708?offer=PRI1290708_M-QOE,PRI1290708,4,,2018-10-18 13:04:00,
adayroi.com,https://www.adayroi.com/tu-lanh-sharp-sj-x251e-sl-241-lit-inverter-p-PRI931338?offer=PRI931338_121004,PRI931338,4,"tủ nhận đẹp, máy ban đầu chạy êm. còn lại cần thêm thời gian thẩm định",2017-10-10 16:58:00,
adayroi.com,https://www.adayroi.com/tu-lanh-sharp-sj-x251e-sl-241-lit-inverter-p-PRI931338?offer=PRI931338_121004,PRI931338,5,Tủ này 1 năm tiêu thu khoảng bao nhiêu điện vay qtv,2017-03-25 18:41:00,
adayroi.com,https://www.adayroi.com/tu-lanh-panasonic-nr-bl267vsv1-234-lit-inverter-p-PRI1147998?offer=PRI1147998_121004,PRI1147998,4,"tủ lạnh này nhìn đẹp quá, em rất thích mà chưa có tiền mua, đợi cuối tháng lãnh lương sẽ sút liền",2017-05-15 15:59:00,
adayroi.com,https://www.adayroi.com/tu-lanh-hitachi-r-h350pgv4-sls-290-lit-inverter-p-PRI31395?offer=PRI31395_121004,PRI31395,5,"Mình đặt hàng rồi nhé. ADAYROI giao hàng sớm cho mình, cần gấp đấy.",2015-12-30 15:41:00,
adayroi.com,https://www.adayroi.com/tu-lanh-hitachi-r-h350pgv4-sls-290-lit-inverter-p-PRI31395?offer=PRI31395_121004,PRI31395,5,"Thiết kế đơn giản mà sang trọng, đẹp quá. Có lương chắc pải rinh em này về.",2015-12-10 15:50:00,
adayroi.com,https://www.adayroi.com/tu-lanh-hitachi-r-h350pgv4-sls-290-lit-inverter-p-PRI31395?offer=PRI31395_121004,PRI31395,4,"Tủ lạnh Hitachi R-H350PGV4(SLS), 290 lít, Inverter hàng nhập khẩu, ADR có giá rẻ hơn so với các Siêu thị bán lẻ.",2015-12-10 14:32:00,
adayroi.com,https://www.adayroi.com/tu-lanh-hitachi-r-h350pgv4-sls-290-lit-inverter-p-PRI31395?offer=PRI31395_121004,PRI31395,5,"Tủ lạnh Hitachi R-H350PGV4(SLS) này của Thái, có bạn nào dùng của Nhật rồi không? Tư vấn cho mình với.",2015-12-08 00:16:00,
adayroi.com,https://www.adayroi.com/tu-lanh-hitachi-r-h350pgv4-sls-290-lit-inverter-p-PRI31395?offer=PRI31395_121004,PRI31395,5,Mẹ mình đang nghía em này nhưng chưa biết hiệu quả thế nào,2015-12-08 00:14:00,
adayroi.com,https://www.adayroi.com/tu-lanh-hitachi-r-h350pgv4-sls-290-lit-inverter-p-PRI31395?offer=PRI31395_121004,PRI31395,5,"Tủ lạnh R-H350PGV4(SLS)  phù hợp cho gia đình có từ 4,6 người, dung tích của tủ lạnh đủ đảm bảo đáp ứng nhanh và đầy đủ nhu cầu bảo quản thực phẩm, làm đá nhanh cho mọi thành viên trong gia đình. Ngoài ra tủ này còn có chức năng tự xả đông. Rất tiện lợi",2015-12-07 17:39:00,
adayroi.com,https://www.adayroi.com/tu-lanh-samsung-rt32k5532s8-sv-320-lit-inverter-p-PRI676632?offer=PRI676632_121004,PRI676632,4,"Tủ lạnh Samsung RT32K5532S8/SV, 320 lít, Inverter này làm đá rất nhanh nhé",2017-05-15 16:23:00,
adayroi.com,https://www.adayroi.com/tu-lanh-hitachi-r-vg400pgv3-gbw-335-lit-inverter-p-PRI663979?offer=PRI663979_ODC,PRI663979,4,Tủ lạnh này màu gì đây ạ?,2017-04-11 08:40:00,
adayroi.com,https://www.adayroi.com/tu-lanh-toshiba-gr-tg46vpdz-xk1-409-lit-inverter-p-PRI664655?offer=PRI664655_121004,PRI664655,4,Hà Nội hết hàng này rồi sao?,2017-06-14 22:53:00,
adayroi.com,https://www.adayroi.com/tu-lanh-hitachi-r-vg470pgv3-gbw-395-lit-inverter-p-PRI992213?offer=PRI992213_M-QOE,PRI992213,5,"sản phẩm tốt, dịch vụ tốt",2017-09-10 10:01:00,
adayroi.com,https://www.adayroi.com/tu-lanh-hitachi-r-vg470pgv3-gbk-395-lit-inverter-p-PRI31456?offer=PRI31456_121004,PRI31456,5,"Con Tủ lạnh Hitachi R-VG470PGV3(GBK), 395 lít, Inverter có màu nâu hay bạc không vậy Adayroi?",2015-12-22 14:50:00,
adayroi.com,https://www.adayroi.com/tu-lanh-hitachi-r-vg470pgv3-gbk-395-lit-inverter-p-PRI31456?offer=PRI31456_121004,PRI31456,5,Sản phẩm này có màu trắng không ? Mình muốn mua một cái nhưng màu trắng,2015-12-15 10:22:00,
adayroi.com,https://www.adayroi.com/tu-lanh-hitachi-r-vg470pgv3-gbk-395-lit-inverter-p-PRI31456?offer=PRI31456_121004,PRI31456,5,Sản phẩm Tủ lạnh Hitachi R-VG470PGV3(GBK) được bảo hành bao lâu vậy ad ơi?,2015-12-10 17:14:00,
adayroi.com,https://www.adayroi.com/tu-lanh-hitachi-r-vg470pgv3-gbk-395-lit-inverter-p-PRI31456?offer=PRI31456_121004,PRI31456,4,"Mình thích tủ lạnh của thương hiệu HITACHI lắm, rất là bền mà ổn định nữa. Đây là thương hiệu uy tín mà người dân sống tại Nhật rất tin dùng.",2015-12-10 09:18:00,
adayroi.com,https://www.adayroi.com/tu-lanh-samsung-rt38k5982sl-sv-394-lit-inverter-p-PRI676667?offer=PRI676667_121004,PRI676667,5,"Sản phẩm dùng tốt, giá cả hợp lý gia đình rất thích",2017-08-26 09:20:00,
adayroi.com,https://www.adayroi.com/tu-lanh-samsung-rt38k5982sl-sv-394-lit-inverter-p-PRI676667?offer=PRI676667_121004,PRI676667,4,"Tủ lạnh Samsung RT38K5982SL/SV này ít tốn điện lắm, làm đá rất nhanh",2017-05-15 15:57:00,
adayroi.com,https://www.adayroi.com/tu-lanh-samsung-rt38k5982sl-sv-394-lit-inverter-p-PRI676667?offer=PRI676667_121004,PRI676667,5,"Tủ lạnh thiết kế hiện đại, phù hợp vs không gian nội thất, ADR giao hàng nhanh chóng, mình rất hài lòng khi mua sắm trên ADR",2017-01-18 11:24:00,
adayroi.com,https://www.adayroi.com/tu-lanh-toshiba-gr-wg58vdaz-gg-546-lit-inverter-p-PRI31724?offer=PRI31724_121004,PRI31724,4,ad ơi cho hỏi mặt kính gương vậy có bị trầy khi va chạm không,2015-12-15 16:49:00,
adayroi.com,https://www.adayroi.com/tu-lanh-toshiba-gr-wg58vdaz-gg-546-lit-inverter-p-PRI31724?offer=PRI31724_121004,PRI31724,5,Miễn phí công lắp đặt là như nào vậy bạn?,2015-12-14 14:47:00,
adayroi.com,https://www.adayroi.com/tu-lanh-toshiba-gr-wg58vdaz-gg-546-lit-inverter-p-PRI31724?offer=PRI31724_121004,PRI31724,4,"Tủ lạnh Toshiba GR-WG58VDAZ được trang bị bộ lọc sinh học góc Aldehyde khử mùi tốt những loại thực phẩm lên men mà trước đây không thể khử được như rượu, nước tương, đậu nành,…..",2015-12-14 14:37:00,
adayroi.com,https://www.adayroi.com/tu-lanh-mitsubishi-electric-mr-v50eh-brw-414-lit-inverter-p-PRI873334?offer=PRI873334_121004,PRI873334,5,giao hàng nhanh. nhân viên nhiệt tình,2017-08-05 13:47:00,
adayroi.com,https://www.adayroi.com/tu-lanh-mitsubishi-electric-mr-v50eh-brw-414-lit-inverter-p-PRI873334?offer=PRI873334_121004,PRI873334,5,"Tủ lạnh thiết kế hiện đại, phù hợp vs không gian nội thất, ADR giao hàng nhanh chóng, mình rất hài lòng khi mua sắm trên ADR",2017-01-18 11:23:00,
adayroi.com,https://www.adayroi.com/tu-lanh-mitsubishi-electric-mr-cx46ej-brw-v-358-lit-inverter-p-PRI913746?offer=PRI913746_121004,PRI913746,5,Đẹp và được.,2017-07-11 21:01:00,
adayroi.com,https://www.adayroi.com/tu-lanh-toshiba-gr-wg66vdaz-gg-loai-lon-600-lit-p-PRI31487?offer=PRI31487_121004,PRI31487,5,"Công nghệ Inverter, công nghệ khử mùi kép Double Deodorizer, chế độ Eco Mode tiết kiệm. Toshiba- nơi hội tụ công nghệ.",2015-12-22 16:41:00,
adayroi.com,https://www.adayroi.com/tu-lanh-toshiba-gr-wg66vdaz-gg-loai-lon-600-lit-p-PRI31487?offer=PRI31487_121004,PRI31487,5,OH dung tích tới 600 ư sao nhiều thế nhỉ,2015-12-15 16:50:00,
adayroi.com,https://www.adayroi.com/tu-lanh-2-canh-panasonic-nr-bx418gkvn-363-lit-p-PRI901156?offer=PRI901156_121004,PRI901156,3,"Tủ lạnh 2 cánh Panasonic NR-BX418GKVN, 363 lít này mặt trước là gương (kính) hay là thép ? tủ màu trắng hay đen ?
Nếu cánh t",2017-09-28 09:19:00,
adayroi.com,https://www.adayroi.com/tu-lanh-2-canh-panasonic-nr-bx418gkvn-363-lit-p-PRI901156?offer=PRI901156_121004,PRI901156,5,Sản phẩm này chuẩn xuất xú Thailan không vậy adayroi? Mình không liên hệ được số hotline,2017-08-11 18:32:00,
adayroi.com,https://www.adayroi.com/tu-lanh-hitachi-r-sg38fpgv-gbk-375l-inverter-p-PRI1132508?offer=PRI1132508_121004,PRI1132508,4,,2018-10-02 14:43:00,
adayroi.com,https://www.adayroi.com/tu-lanh-side-by-side-inverter-lg-gr-b247jds-613-lit-xam-p-PRI1208368?offer=PRI1208368_121004,PRI1208368,5,Giao hàng có khiêng lên lầu lắp đặt ko vậy bạn ơi?,2017-09-29 02:56:00,
adayroi.com,https://www.adayroi.com/tu-lanh-side-by-side-inverter-lg-gr-b247jds-613-lit-xam-p-PRI1208368?offer=PRI1208368_121004,PRI1208368,5,"sản phẩm đẹp, giao hàng nhanh sau 2 ngày đặt hàng",2017-09-26 15:43:00,
adayroi.com,https://www.adayroi.com/tu-lanh-side-by-side-inverter-lg-gr-b247jds-613-lit-xam-p-PRI1208368?offer=PRI1208368_121004,PRI1208368,5,"Đẹp, hiện đại",2017-08-15 16:27:00,
adayroi.com,https://www.adayroi.com/tu-lanh-hitachi-r-wb545pgv2-gbw-455-lit-inverter-p-PRI931259?offer=PRI931259_121004,PRI931259,5,Tủ này Vin có màu đen không?,2017-10-10 16:58:00,
adayroi.com,https://www.adayroi.com/tu-lanh-side-by-side-samsung-rs552nruasl-sv-591-lit-inverter-p-PRI853215?offer=PRI853215_ODC,PRI853215,5,,2018-11-12 10:33:00,
adayroi.com,https://www.adayroi.com/tu-lanh-side-by-side-samsung-rs552nruasl-sv-591-lit-inverter-p-PRI853215?offer=PRI853215_ODC,PRI853215,4,,2018-11-06 14:36:00,
adayroi.com,https://www.adayroi.com/tu-lanh-side-by-side-samsung-rs552nruasl-sv-591-lit-inverter-p-PRI31693?offer=PRI31693_121004,PRI31693,5,Model này và model RS554NRUA1J/SV có thông số y hệt nhau mà sao giá chênh nhau đến 6 triệu vậy ad?,2017-04-01 23:34:00,
adayroi.com,https://www.adayroi.com/tu-lanh-side-by-side-samsung-rs552nruasl-sv-591-lit-inverter-p-PRI31693?offer=PRI31693_121004,PRI31693,5,"Tủ lạnh tiết kiệm điện và làm đá cực nhanh, ADR giao hàng nhanh chóng, mình rất hài lòng khi mua sắm trên ADR",2017-01-18 11:34:00,
adayroi.com,https://www.adayroi.com/tu-lanh-side-by-side-samsung-rs554nrua1j-sv-543-lit-inverter-p-PRI31694?offer=PRI31694_121004,PRI31694,5,"Thiết kế sang trọng, đẹp mắt, nhà mình mà lớn là sẽ để dành tiền.",2015-06-12 00:35:00,
adayroi.com,https://www.adayroi.com/tu-lanh-doc-lap-gorenje-nrk6192tx-329-lit-p-PRI457679?offer=PRI457679_LOW,PRI457679,2,"Cho mình hỏi chút về tính năng "" hệ thống ghi nhớ thông minh""  như nào? có tác dụng gì hả ad???",2015-11-30 00:46:00,
adayroi.com,https://www.adayroi.com/tu-lanh-doc-lap-gorenje-nrk62jsy2b-mau-sac-den-p-PRI456944?offer=PRI456944_LOW,PRI456944,5,Tủ này thiết kế thật đẹp mắt và thông minh cho sự lưu trữ tối ưu. Là một người nội trợ nhìn là sẽ hiểu ngay.,2015-12-01 16:04:00,
adayroi.com,https://www.adayroi.com/tu-lanh-hitachi-r-s700gpgv2-gbk-589-lit-inverter-p-PRI364545?offer=PRI364545_121004,PRI364545,5,<3<3<3 giấc mơ của tui,2017-04-23 14:11:00,
adayroi.com,https://www.adayroi.com/tu-lanh-side-by-side-hitachi-r-m700gpgv2-gs-584-lit-inverter-p-PRI31251?offer=PRI31251_121004,PRI31251,5,"Tủ lạnh màu bạc sang trọng, phù hợp vs không gian nội thất, tiết kiệm điện, ADR giao hàng nhanh chóng, mình rất hài lòng khi mua sắm trên ADR",2017-01-18 11:35:00,
adayroi.com,https://www.adayroi.com/tu-lanh-hitachi-r-m700gpgv2-gbk-584-lit-inverter-p-PRI364540?offer=PRI364540_121004,PRI364540,5,Giao hàng đúng hẹn.,2017-09-26 22:37:00,
adayroi.com,https://www.adayroi.com/tu-lanh-hitachi-r-m700gpgv2-gbk-584-lit-inverter-p-PRI364540?offer=PRI364540_121004,PRI364540,5,"Tủ lạnh này còn hàng ở Vinpro ko? Mấy hôm trước thấy tính mua, hôm nay mở lại đã thấy hết.",2017-08-13 19:48:00,
adayroi.com,https://www.adayroi.com/tu-lanh-doc-lap-retro-gorenje-nrk60328oco-p-PRI532561?offer=PRI532561_LOW,PRI532561,5,"Nhìn những sản phẩm của Gorenje mà thích quá, ước gì có thể dùng thử để trải nghiệm :o",2015-12-01 16:03:00,
adayroi.com,https://www.adayroi.com/tu-lanh-panasonic-nr-f610gt-x2-588-lit-inverter-p-PRI659250?offer=PRI659250_121004,PRI659250,5,"Sản phẩm khá tốt, nhân viên giao nhận và lắp đặt nhiệt tình",2017-11-03 18:50:00,
adayroi.com,https://www.adayroi.com/tu-lanh-hitachi-r-m700gpgv2x-mir-584-lit-inverter-p-PRI31397?offer=PRI31397_121004,PRI31397,5,"Tủ lạnh thiết kế sang trọng, tiết kiệm điện và làm đá cực nhanh, ADR giao hàng nhanh chóng, mình rất hài lòng khi mua sắm trên ADR",2017-01-18 11:18:00,
adayroi.com,https://www.adayroi.com/tu-lanh-hitachi-r-m700gpgv2x-mir-584-lit-inverter-p-PRI31397?offer=PRI31397_121004,PRI31397,4,Cho hỏi với những sản phẩm giá trị cao như con Tủ lạnh Hitachi R-M700GPGV2X trên đây thì Adayroi có trợ giá thêm Giftcode giảm giá nào không ah?,2015-12-22 17:10:00,
adayroi.com,https://www.adayroi.com/tu-lanh-hitachi-r-m700gpgv2x-mir-584-lit-inverter-p-PRI31397?offer=PRI31397_121004,PRI31397,5,Nhờ có công nghệ inverter mà tôi yên tâm sử dụng chúng khỏi lo tiền điện nữa rồi,2015-12-22 17:07:00,
adayroi.com,https://www.adayroi.com/tu-lanh-hitachi-r-m700gpgv2x-mir-584-lit-inverter-p-PRI31397?offer=PRI31397_121004,PRI31397,3,"Với tổng dung tích 584 lít, tủ lạnh Hitachi R-M700GPGV2X 584 lít phù hợp với những gia đình từ 8-10 người, mang đến cho bạn nhiều không gian hơn để lưu trữ những sản phẩm bạn yêu thích.",2015-12-22 14:47:00,
adayroi.com,https://www.adayroi.com/tu-lanh-hitachi-r-m700gpgv2x-mir-584-lit-inverter-p-PRI31397?offer=PRI31397_121004,PRI31397,5,"Có cả vòi lấy nước ngoài nữa, thật là tiện lợi",2015-12-15 00:50:00,
adayroi.com,https://www.adayroi.com/tu-lanh-hitachi-r-m700gpgv2x-mir-584-lit-inverter-p-PRI31397?offer=PRI31397_121004,PRI31397,5,"Tủ lạnh Hitachi R-M700GPGV2X(MIR), 584 lít, Inverter tiện nghi và bảo vệ gia đình bạn tối ưu",2015-12-14 17:33:00,
adayroi.com,https://www.adayroi.com/tu-lanh-hitachi-r-m700gpgv2x-mir-584-lit-inverter-p-PRI31397?offer=PRI31397_121004,PRI31397,5,"Tiện lợi, đẹp và sang trọng nữa chứ.",2015-06-12 00:32:00,
adayroi.com,https://www.adayroi.com/tu-lanh-side-by-side-hitachi-r-m700agpgv4x-dia-584-lit-inverter-p-PRI31396?offer=PRI31396_121004,PRI31396,4,Đỉnh cao công nghệ là đây. Gần 70 triệu. Không biết bao giờ mới với tay tới,2015-12-22 17:05:00,
adayroi.com,https://www.adayroi.com/tu-lanh-side-by-side-hitachi-r-m700agpgv4x-dia-584-lit-inverter-p-PRI31396?offer=PRI31396_121004,PRI31396,4,"Sản phẩm hỗ trợ công nghệ inverter điều chỉnh hoạt động máy nén hiệu quả giúp tăng hiệu suất hoạt động của tủ lạnh đồng thời hạn chế tiêu hao điện năng lãng phí, giúp bạn tiết kiệm tiền điện hàng tháng của gia đình nhé.",2015-12-22 14:47:00,
adayroi.com,https://www.adayroi.com/tu-lanh-side-by-side-hitachi-r-m700agpgv4x-dia-584-lit-inverter-p-PRI31396?offer=PRI31396_121004,PRI31396,5,"Hitachi R-M700AGPGV4X với công nghệ tiên tiến vượt bậc, mang đến những trải nghiệm hoàn toàn khác biệt, sự đẳng cấp cho không gian ngôi nhà bạn",2015-12-15 11:33:00,
adayroi.com,https://www.adayroi.com/tu-lanh-side-by-side-hitachi-r-m700agpgv4x-dia-584-lit-inverter-p-PRI31396?offer=PRI31396_121004,PRI31396,5,Mình thích uống nước đá hehe cũng hên là tủ lạnh hitachi có chức năng làm đá,2015-12-14 17:24:00,
adayroi.com,https://www.adayroi.com/tu-lanh-side-by-side-hitachi-r-m700agpgv4x-dia-584-lit-inverter-p-PRI31396?offer=PRI31396_121004,PRI31396,5,"Mình rất tin tưởng khi mua hàng của thương hiệu Vinpro, chất lượng rất tốt và giá phải chăng. Kể cả đồ rau củ hay sữa giao cũng rất Ok và nhanh chứ chưa nói gì đến hàng cồng kềnh. Giờ khỏi lo đi chợ hằng ngày nữa, chỉ cần order đồ rồi chờ ở nhà và cất vô tủ lạnh này là xong ah.",2015-12-10 17:29:00,
adayroi.com,https://www.adayroi.com/tu-lanh-hitachi-r-vg470pgv3-gbk-395-lit-inverter-p-PRI663986?offer=PRI663986_ODC,PRI663986,3,,2018-10-21 10:14:00,
adayroi.com,https://www.adayroi.com/tu-lanh-hitachi-r-vg470pgv3-gbk-395-lit-inverter-p-PRI663986?offer=PRI663986_ODC,PRI663986,5,"Tủ lạnh này có màu sắc đẹp, sang trọng cộng thêm khả năng tiết kiệm điện rất tốt, dung tích cũng tương đối lớn. Mình mua rất nhiều thực phẩm mà vẫn yên tâm tủ đựng được đủ. Rất hài lòng về sản phẩm",2017-01-18 15:14:00,
adayroi.com,https://www.adayroi.com/tu-lanh-hitachi-r-vg470pgv3-gbk-395-lit-inverter-p-PRI663986?offer=PRI663986_ODC,PRI663986,5,"Mình tin tưởng mấy thương hiệu này nên mình đã sử dụng qua nhiều dòng sản phẩm khác nhau. Lúc quyết định nâng cấp thay tủ lạnh mới, mình chọn em này. Lọc khử mùi Nano, hàng Thái nên dùng yên tâm hơn nhiều.",2017-01-18 11:21:00,
adayroi.com,https://www.adayroi.com/tu-lanh-hitachi-r-vg470pgv3-gbk-395-lit-inverter-p-PRI663986?offer=PRI663986_ODC,PRI663986,5,Định săm con này về ăn tết mà không biết bây giờ đặt thì bên ADR có giao hàng về kịp cho mình không?,2017-01-18 11:13:00,
adayroi.com,https://www.adayroi.com/tu-lanh-hitachi-r-vg470pgv3-gbk-395-lit-inverter-p-PRI663986?offer=PRI663986_ODC,PRI663986,5,"Hitachi sản xuất tủ lạnh nhìn sang lắm, bước chân vào bếp thấy sáng hẳn 1 góc",2017-01-18 00:27:00,
adayroi.com,https://www.adayroi.com/-tu-lanh-sharp-sj-fx631v-sl-626l-inverter-p-378838?offer=378838_121004,378838,3,,2018-10-16 16:11:00,
adayroi.com,https://www.adayroi.com/tu-lanh-sharp-sj-fx630v-st-626-lit-inverter-p-PRI964095?offer=PRI964095_M-QOE,PRI964095,5,,2018-11-15 13:04:00,
adayroi.com,https://www.adayroi.com/tu-lanh-sharp-sj-fx630v-st-626-lit-inverter-p-PRI964095?offer=PRI964095_M-QOE,PRI964095,5,"Admin cho mình hỏi một số vấn đề sau nhé,
1/ Có sự chênh lệch giữa giá tủ lạnh này ở các shop. Vậy chất lượng hàng có tương đồng nhau không?

2/ Đây là hàng nguyên đai nguyên kiện hay hàng trưng bày?

3/ Bên mình có hỗ trợ lắp đặt không?

4/ Điều kiện bảo hành như thế nào? Bảo hành chính hãng hay bảo hành theo phiếu adayroi? Khi cần đổi trả thì phải làm ntn?

Admin phản hồi giúp mình nhé. Mình cám ơn",2017-11-15 16:51:00,
adayroi.com,https://www.adayroi.com/tu-lanh-sharp-sj-fx630v-st-626-lit-inverter-p-PRI964095?offer=PRI964095_M-QOE,PRI964095,5,Rất chuyên nghiệp!,2017-11-15 16:51:00,
adayroi.com,https://www.adayroi.com/tu-lanh-sharp-sj-fx630v-st-626-lit-inverter-p-PRI964095?offer=PRI964095_M-QOE,PRI964095,5,"Tủ dùng êm, thiết kế nội thất rất tiện, sạch sẽ ko bị lẫn đồ sống và đồ ăn ngay.",2017-08-22 10:12:00,
adayroi.com,https://www.adayroi.com/tu-lanh-sharp-sj-fx630v-st-626-lit-inverter-p-PRI964095?offer=PRI964095_M-QOE,PRI964095,5,"nhân viên giao nhận nhiệt tình, cẩn thận. Hàng đẹp nguyên hộp",2017-06-30 00:01:00,
adayroi.com,https://www.adayroi.com/tu-lanh-toshiba-gr-m28vubz-ub-226l-inverter-p-1243412?offer=1243412_ODC,1243412,3,,2018-11-04 09:14:00,
adayroi.com,https://www.adayroi.com/tu-lanh-sharp-sj-176e-dss-165l-inverter-p-294054?offer=294054_ODC,294054,5,,2018-11-11 13:07:00,
adayroi.com,https://www.adayroi.com/tu-lanh-sharp-sj-176e-dss-165l-inverter-p-294054?offer=294054_ODC,294054,5,,2018-11-04 20:25:00,
adayroi.com,https://www.adayroi.com/tu-lanh-sharp-sj-176e-dss-165l-inverter-p-294054?offer=294054_ODC,294054,5,"cp này độ bền cao này, dùng mãi mà vẫn chạy tốt : )",2018-10-26 16:40:00,
adayroi.com,https://www.adayroi.com/tu-lanh-sharp-sj-176e-dss-165l-inverter-p-294054?offer=294054_ODC,294054,3,,2018-10-22 12:25:00,
adayroi.com,https://www.adayroi.com/tu-lanh-sharp-sj-176e-dss-165l-inverter-p-294054?offer=294054_ODC,294054,5,"Tủ lạnh vừa dùng cho gia đình nhỏ hoặc người độc thân. Máy êm, kích thước vừa phải & giá thành hợp lý.",2018-10-21 19:17:00,
adayroi.com,https://www.adayroi.com/tu-lanh-sharp-sj-176e-dss-165l-inverter-p-294054?offer=294054_ODC,294054,5,"sản phẩm tốt, đẹp, vừa túi tiền.",2018-10-06 13:14:00,
adayroi.com,https://www.adayroi.com/tu-lanh-sharp-sj-176e-dss-165l-inverter-p-294054?offer=294054_ODC,294054,5,sp chất  lượng,2018-09-29 19:44:00,
adayroi.com,https://www.adayroi.com/tu-lanh-sharp-sj-x201esl-196-lit-inverter-p-PRI1188804?offer=PRI1188804_ODC,PRI1188804,5,Đúng như website,2018-10-22 23:03:00,
adayroi.com,https://www.adayroi.com/tu-lanh-lg-gn-l315ps-333-lit-inverter-p-714083?offer=714083_ODC,714083,1,,2018-10-17 05:18:00,
adayroi.com,https://www.adayroi.com/tu-lanh-lg-gn-l315ps-333-lit-inverter-p-714083?offer=714083_ODC,714083,3,,2018-10-17 05:16:00,
adayroi.com,https://www.adayroi.com/tu-lanh-2-canh-sharp-apricot-sj-x316e-ds-314l-inverter-p-PRI965083?offer=PRI965083_M-QOE,PRI965083,5,mẫu mã đẹp. hiện chưa dùng nên chưa biết chất lượng 😉,2017-11-14 21:01:00,
adayroi.com,https://www.adayroi.com/tu-lanh-2-canh-sharp-apricot-sj-x316e-ds-314l-inverter-p-PRI965083?offer=PRI965083_M-QOE,PRI965083,5,"sản phẩm oki, giao hàng đúng hẹn, nhân viên nhiệt tình.",2017-10-05 11:38:00,
adayroi.com,https://www.adayroi.com/tu-lanh-sharp-sj-fx630v-be-626-lit-inverter-p-PRI1281654?offer=PRI1281654_M-QOE,PRI1281654,5,Mình ở bình định đặt hàng thế nào?,2017-11-14 21:12:00,
adayroi.com,https://www.adayroi.com/tu-lanh-sharp-sj-fx630v-be-626-lit-inverter-p-PRI1281654?offer=PRI1281654_M-QOE,PRI1281654,5,very good good,2017-10-26 14:58:00,
adayroi.com,https://www.adayroi.com/tu-lanh-electrolux-eum0900sa-92-lit-p-1322767?offer=1322767_M-QOE,1322767,5,,2018-11-12 10:04:00,
adayroi.com,https://www.adayroi.com/tu-lanh-electrolux-eum0900sa-92-lit-p-1322767?offer=1322767_M-QOE,1322767,4,,2018-11-11 14:44:00,
adayroi.com,https://www.adayroi.com/tu-lanh-electrolux-eum0900sa-92-lit-p-1322767?offer=1322767_M-QOE,1322767,4,,2018-11-11 14:09:00,
adayroi.com,https://www.adayroi.com/tu-lanh-electrolux-eum0900sa-92-lit-p-1322767?offer=1322767_M-QOE,1322767,5,trông tưởng nhỏ mà đựng được nhiều đồ ăn phết (y),2018-10-26 16:42:00,
adayroi.com,https://www.adayroi.com/tu-lanh-electrolux-eum0900sa-92-lit-p-1322767?offer=1322767_M-QOE,1322767,4,,2018-10-23 14:55:00,
adayroi.com,https://www.adayroi.com/tu-lanh-electrolux-eum0900sa-92-lit-p-1322767?offer=1322767_M-QOE,1322767,5,,2018-10-21 01:13:00,
