Domain,Url,Product_id,Rating,Comment,Review Time,Bought Time
tiki.vn,https://tiki.vn/loi-sua-moc-tien-tu-12-thao-duoc-quy-p4393127.html?src=category-page-2549.10416&2hi=1,4393127,1,"KHÔNG HÀI LÒNG. Hộp trà đã bị khui cùng với 2 sản phẩm khác trong kiện hàng, đóng gói không đảm bảo",2018-10-23 09:27:12,2018-10-20 14:44:04
tiki.vn,https://tiki.vn/loi-sua-moc-tien-tu-12-thao-duoc-quy-p4393127.html?src=category-page-2549.10416&2hi=1,4393127,5,"Cực kì hài lòng. Đã sử dụng nhiều sản phẩm, lần đầu tiên tìm được lợi sữa phù hợp, sữa về nhiều và đặc lắm ạ. Cám ơn Mộc Tiên.",2018-10-09 04:31:09,2018-10-04 01:41:21
tiki.vn,https://tiki.vn/loi-sua-moc-tien-tu-12-thao-duoc-quy-p4393127.html?src=category-page-2549.10416&2hi=1,4393127,5,"Cực kì hài lòng. Mình uống 2 liệu trình sữa mới về đều và đặc, nên mom nào mà mới uống chưa hiệu quả thì hãy kiên trì uống nhá.",2018-09-25 02:50:52,
tiki.vn,https://tiki.vn/sua-bau-enfamama-a-400g-huong-choco-p413234.html?src=category-page-2549.10416&2hi=1,413234,3,"Hạn sử dụng không tốt. Sữa bình thường HSD là 2 năm, nhưng Tiki giao hàng hsd quá cận, mình ko để ý đã nhận sản phẩm, không hài lòng về điều này",2018-03-28 06:18:21,2017-10-18 03:48:45
tiki.vn,https://tiki.vn/thuc-pham-chuc-nang-medicalci-d3-30-vien-p1370371.html?src=category-page-2549.10416&2hi=1,1370371,5,"Dùng tốt. Mình đang nuôi con bằng sữa mẹ nên cần bổ sung thêm canxi. Dùng sản phẩm thấy tốt, chân không bị tê về đêm nữa.",2018-10-22 04:44:08,2018-10-12 05:22:57
tiki.vn,https://tiki.vn/sua-bot-nutricare-mom-moi-dinh-duong-cho-me-bau-cho-con-bu-400g-900g-p5449091.html?src=category-page-2549.10416&2hi=0,5449091,5,"Sữa bột Nutricare. Chất lượng sản phẩm khá tốt,phù  hợp với giá tiền. Đóng gói cẩn thận.",2018-11-29 08:25:09,2018-11-06 15:35:42
tiki.vn,https://tiki.vn/sua-dolsure-mum-danh-cho-me-mang-thai-va-cho-con-bu-900g-p504969.html?src=category-page-2549.10416&2hi=0,504969,5,"Sữa Dolsure. Sữa có mùi thơm nhẹ, ngọt vừa, uống cũng khá ngon.",2018-12-19 11:36:48,2018-12-02 14:51:28
tiki.vn,https://tiki.vn/folic-acid-400mcg-plus-iron-bo-sung-sat-va-folic-100-vien-kbm01-p7654012.html?src=category-page-2549.10416&2hi=0,7654012,5,"Thiếu máu nên dùng. Sản phẩm này rất tốt, ai thiếu máu nên dùng hằng ngày, vừa có sắt vừa có axit folic. Tiki giao hàng nhanh và chuyên nghiệp.",2019-01-04 05:08:06,
tiki.vn,https://tiki.vn/com-loi-sua-galactogil-phap-24-goi-p6683359.html?src=category-page-2549.10416&2hi=0,6683359,5,"Chất lượng sản phẩm tuyệt vời!. Hàng Pháp dùng rất hiệu quả nha các mẹ. Tiki mua là an tâm chính hãng, giao hàng cực nhanh luôn!",2018-11-30 10:45:59,
tiki.vn,https://tiki.vn/dau-gac-ep-lanh-nguyen-chat-gold-50ml-p1067210.html?src=category-page-2549.10416&2hi=1,1067210,4,"Hài lòng. Mình mua dùng cho bé ăn dặm, chất lượng ok, tuy nhiên lọ đựng  thì mình thấy ko đẹp lắm, giống mấy lọ đựng mình thấy bán  ở mấy cửa hàng bán ngoài chợ quá.",2018-01-24 16:42:45,2018-01-13 14:22:00
tiki.vn,https://tiki.vn/sua-bau-enfamama-a-400g-huong-vani-p413228.html?src=category-page-2549.10416&2hi=1,413228,5,Tốt. Con mình hay biếng ăn nên mình đã mua rất nhiều sữa cho bé uống nhưng bé vẫn ghét uống sữa. Từ khi bạn mình tặng hộp sữa bột này con mình và không thấy bé biếng ăn nữa và rất thích uống sữa. Sữa ngon mà không ngấy giúp bé tăng chiều cao và IQ của trẻ. Sản phẩm tốt cho mọi trẻ đang lớn.,2015-04-16 02:51:52,
tiki.vn,https://tiki.vn/sua-bot-danh-cho-me-bau-anmum-materna-huong-vanilla-400g-p513842.html?src=category-page-2549.10416&2hi=1,513842,4,"Sữa ngon chất lượng. Chất lượng sữa ngon, date còn xa tuy nhiên hộp sữa bụi bặm, dơ, gỉ sét ở viền, đặt 2 lon nhưng chỉ giao dc 1 lon. Hy vọng Tiki sẽ vệ sinh sạch sẽ, bảo quản hàng tốt hơn nhất là thực phẩm.",2018-10-11 00:57:32,2018-08-17 09:13:42
tiki.vn,https://tiki.vn/sua-bot-danh-cho-me-bau-anmum-materna-huong-vanilla-400g-p513842.html?src=category-page-2549.10416&2hi=1,513842,4,"Hài lòng. Mua lâu rồi hn mới viết nhận xét. sữa này mình uống ko hợp. béo và khá ngấy  nên cố đc gần 1/3 hộp. mùi thì thơm. Mẹ nào mà ko uống đc béo thì nên mia loại có hương gì đó cho đỡ ngán. hàng tiki giao nhanh, đóng gói cẩn thận.",2017-12-26 14:34:13,2017-08-10 18:20:02
tiki.vn,https://tiki.vn/hop-sua-nuoc-anmum-materna-vanilla-4-x-125-ml-p725643.html?src=category-page-2549.10416&2hi=1,725643,4,"Sữa ngon dễ uống. Sữa dễ uống, vị sô cô la ngon hơn vani. Tuy nhiên hôm qua đi big C thấy giá bán có 34.500 đồng không khuyến mại, mới biết Tiki bán đắt hơn giá thị trường, dù đã giảm 8%??? Nhà mình ở xa siêu thị nên vẫn mong tiki bán đúng giá  để mua tại Tiki cho tiện.",2018-10-06 23:45:25,
tiki.vn,https://tiki.vn/hop-sua-nuoc-anmum-materna-vanilla-4-x-125-ml-p725643.html?src=category-page-2549.10416&2hi=1,725643,5,"Cực kì hài lòng. Đóng gói cẩn thận, sản phẩm chất lượng, Đóng gói cẩn thận, sản phẩm chất lượng",2018-04-09 16:16:55,2017-10-09 07:56:14
tiki.vn,https://tiki.vn/hop-sua-nuoc-anmum-materna-vanilla-4-x-125-ml-p725643.html?src=category-page-2549.10416&2hi=1,725643,4,Hài lòng. uống khá ngon nhưng k thấy bán cả thùng nên k thích mua lẻ như vậy.,2017-12-15 04:52:47,2017-11-10 09:38:40
tiki.vn,https://tiki.vn/hop-sua-nuoc-anmum-materna-chocolate-4-x-125-ml-p725601.html?src=category-page-2549.10416&2hi=1,725601,5,"Cực kì hài lòng. Đóng gói cẩn thận, sản phẩm chất lượng Đóng gói cẩn thận, sản phẩm chất lượng",2018-04-09 16:17:14,2017-10-06 01:59:03
tiki.vn,https://tiki.vn/hop-sua-nuoc-anmum-materna-chocolate-4-x-125-ml-p725601.html?src=category-page-2549.10416&2hi=1,725601,5,"gia tot , sua ngon. Gia tot ! Shop vui long cap nhat them hang ban tet , minh mua hang ma san pham khong du giao",2018-01-24 03:46:56,2018-01-09 14:07:35
tiki.vn,https://tiki.vn/thuc-pham-chuc-nang-momvita-30-vien-p1370369.html?src=category-page-2549.10416&2hi=1,1370369,5,Giá sản phẩm. Sao giá lại rẻ vậy mình xem Web 192.000 cơ mà. liệu có phải hàng giả không,2018-08-31 08:08:52,
tiki.vn,https://tiki.vn/thuc-pham-chuc-nang-momvita-30-vien-p1370369.html?src=category-page-2549.10416&2hi=1,1370369,5,Hài lòng^^. Giá cả phải chăng. Mình đang nuôi con bằng sữa mẹ thấy dùng rất ổn,2018-08-03 15:23:22,2018-07-01 04:23:36
tiki.vn,https://tiki.vn/sua-bau-enfamama-a-900g-huong-choco-p413238.html?src=category-page-2549.10416&2hi=1,413238,1,Giao không đúng sữa !. Giao không đúng sữa mua socola mà giao vani làm ăn cẩu thả !,2018-08-22 09:21:11,2018-08-17 15:57:11
tiki.vn,https://tiki.vn/sua-bau-enfamama-a-900g-huong-choco-p413238.html?src=category-page-2549.10416&2hi=1,413238,5,"Sản phẩm tốt. Sp chính hãng, hoà tan hết với nc ấm. Tuy nhiên thì vk mình uống ko đc nhiều",2018-07-31 05:30:11,2018-07-11 06:28:43
tiki.vn,https://tiki.vn/sua-bau-enfamama-a-900g-huong-choco-p413238.html?src=category-page-2549.10416&2hi=1,413238,3,"Bình thường. Tiki giao hàng quá chậm, chậm gần 1 tuần. Sản phẩm như mô tả.",2018-07-16 03:14:19,2018-06-24 02:45:54
tiki.vn,https://tiki.vn/sua-bau-enfamama-a-900g-huong-choco-p413238.html?src=category-page-2549.10416&2hi=1,413238,1,"GIÁ CAO HƠN SO VỚI THỊ TRƯỜNG. GIÁ CAO HƠN SO VỚI THỊ TRƯỜNG NHA TIKI, CẦN XEM XÉT LẠI",2018-04-06 06:50:04,2018-03-28 06:09:53
tiki.vn,https://tiki.vn/sua-bau-enfamama-a-900g-huong-choco-p413238.html?src=category-page-2549.10416&2hi=1,413238,5,Hàng tốt. Hàng rất tốt.date lâu.Ba lô được tặng không tốt lắm,2017-09-11 07:40:13,2017-09-05 15:33:47
tiki.vn,https://tiki.vn/sua-bau-enfamama-a-900g-huong-vani-p413229.html?src=category-page-2549.10416&2hi=1,413229,5,"Sữa dễ uống, tiki giảm giá mạnh. Mang bầu 2 đứa đều uống dòng này, đứa trước uống hương socôla, đứa này uống vani. Mua ngoài cửa hàng gần nhà 450k, thấy bên tiki có chương trình km đặt mua 2 hôm có. Trước giờ tiki luôn giai hàng cẩn thận và nhanh chóng. Cảm ơn tiki và sẽ ủng hộ trang bán hàng uy tín này!",2018-10-19 03:22:53,2018-10-16 06:28:41
tiki.vn,https://tiki.vn/sua-bau-enfamama-a-900g-huong-vani-p413229.html?src=category-page-2549.10416&2hi=1,413229,4,"Tốt. Sữa Bột Mead Johnson Enfamama A+ Vanilla MAV906F (900g) là sản phẩm sữa khá tốt cho các bé.
Ưu điểm: sữa cho nhiều chất dinh dưỡng bên trong, bảo quản khá ổn, thành phần sữa cũng tốt, tương đối tốt cho các bé và các bà mẹ khi mang thai.
Khuyết điểm: lúc uống sữa thì vị nhạt nên dễ gây ngán cho người sử dụng.",2015-05-02 09:32:26,
tiki.vn,https://tiki.vn/sua-bau-enfamama-a-900g-huong-vani-p413229.html?src=category-page-2549.10416&2hi=1,413229,4,"Sữa chất lượng. Lúc mang thai bé nhà mình, mình được bệnh viện cho dùng thử sản phẩm sữa này. Mình có xem xét thành phần của sữa và thấy sản phẩm có đầy đủ các chất cho bé như: DHA (giúp bé thông minh), sắt (tốt cho máu),.. với tỷ lệ khối lượng đầy đủ. Khi mình uống cảm giác hơi nhạt, dễ gây ngán.",2015-04-11 09:30:06,
tiki.vn,https://tiki.vn/vien-uong-ba-bau-blue-pharma-30-vien-p1330565.html?src=category-page-2549.10416&2hi=0,1330565,3,"Tiki nên xem xét lại đối tác. Mình mua hàng tiki cũng lâu rồi nhưng chưa từng thất vọng như vậy. Các sp của tiki đều cam kết còn 1 nửa hsd trở lên , nhiều sp sale gần hết hạn thì cũng ghi rõ. Nhưng sp này thì không. Hộp ngoài lọ thì cũ nát, bụi bặm k đc lau sạch. Thuốc hsd 3 năm thì sx từ 2016, hsd chỉ đầu 2019 , tức là chưa tới nửa năm nữa hết hạn. Với giá thành như vậy mình có thể mua đc sp tốt hơn với thái độ phục vụ khách hàng tốt hơn từ các hãng dược khác. Cảm ơn tiki",2018-09-20 12:50:06,2018-08-15 05:10:53
tiki.vn,https://tiki.vn/sua-bot-danh-cho-me-bau-anmum-materna-huong-chocolate-400g-p513846.html?src=category-page-2549.10416&2hi=1,513846,5,hoàn hảo. chất lượng đạt chuẩn. thơm ngon bổ dưỡng. đáng đồng tienf bát gạo,2018-05-28 09:24:23,2018-01-03 17:47:13
tiki.vn,https://tiki.vn/sua-bot-danh-cho-me-bau-anmum-materna-huong-chocolate-400g-p513846.html?src=category-page-2549.10416&2hi=1,513846,5,Cực kì hài lòng. Sưa rất dê uống va ngon...huong vi socola thơm ngon lam,2017-07-17 08:05:45,
tiki.vn,https://tiki.vn/sua-bot-danh-cho-me-bau-anmum-materna-huong-chocolate-400g-p513846.html?src=category-page-2549.10416&2hi=1,513846,5,"sữa ngon. Sữa ngon, dễ uống, mình thấy hợp với sữa này, sẽ tiếp tục ủng họ",2017-05-25 04:02:38,2017-05-16 01:41:53
tiki.vn,https://tiki.vn/sua-bot-danh-cho-me-bau-anmum-materna-huong-chocolate-800g-p513966.html?src=category-page-2549.10416&2hi=1,513966,5,"Cực kì hài lòng. giá quá rẻ so với mình mua ngoài tạp hóa luôn ấy, sữa này rất dễ uống, ngon",2018-11-26 08:06:12,
tiki.vn,https://tiki.vn/sua-bot-danh-cho-me-bau-anmum-materna-huong-chocolate-800g-p513966.html?src=category-page-2549.10416&2hi=1,513966,2,"Giao hàng không đúng. Mình đặt hàng là hương chocolate mà giao là hương vani, trong khi đó hóa đơn in ra vẫn là hương chocolate. Lần đầu mua hàng của tiki mà thất vọng quá",2018-11-12 08:39:10,2018-11-06 07:23:08
tiki.vn,https://tiki.vn/sua-bot-danh-cho-me-bau-anmum-materna-huong-chocolate-800g-p513966.html?src=category-page-2549.10416&2hi=1,513966,5,"Chat luong va gia ca tuyet voi. San pham dong goi can than. Giao hang nhanh, chat luong tot. Tiki ban hang rat tin cay",2018-09-29 15:35:32,2018-06-10 06:04:04
tiki.vn,https://tiki.vn/sua-bot-danh-cho-me-bau-anmum-materna-huong-chocolate-800g-p513966.html?src=category-page-2549.10416&2hi=1,513966,5,"Sản phẩm tốt. Tốt, giao hàng nhanh, sản phẩm mới nhưng sản phẩm cập nhật hơi lâu, muốn mua thêm mà báo hết hàng",2018-09-14 06:20:00,2018-09-05 03:00:53
tiki.vn,https://tiki.vn/sua-bot-danh-cho-me-bau-anmum-materna-huong-chocolate-800g-p513966.html?src=category-page-2549.10416&2hi=1,513966,5,"Sữa uống không bị ngán. Sữa vị socola uống rất ngon, đặc biệt là không bị ngán. Mình khá kén sữa vì không thích sữa quá béo nhưng đây là loại sữa mình uống lần đầu khi mang thai và thích luôn. Khuyên các mom khác nên dùng",2018-07-09 08:16:49,2018-07-03 07:29:43
tiki.vn,https://tiki.vn/sua-bot-danh-cho-me-bau-anmum-materna-huong-chocolate-800g-p513966.html?src=category-page-2549.10416&2hi=1,513966,5,Cực kì hài lòng. sữa dễ uống vì mùi chocola rất thơm. mình rất thích sữa này,2017-10-13 06:06:37,2017-07-30 01:16:30
tiki.vn,https://tiki.vn/thuc-pham-tang-cuong-vi-chat-dinh-duong-mori-mama-huong-socola-200g-p451403.html?src=category-page-2549.10416&2hi=0,451403,5,"Ngon, bổ. Sữa thơm phức à. Pha 1 ly mà thơm cả phòng luôn í. Vị socola nên không gây ngán như Vani. Sữa ngọt dịu, hơi béo xíu thôi, nói chung là ngon và dễ uống cực kỳ luôn ấy. Soi hàm lượng dinh dưỡng lại càng thích nha, đủ các dưỡng chất thiết yếu cho bé bi phát triển khoẻ mạnh",2016-07-10 04:31:01,2016-06-01 02:27:52
tiki.vn,https://tiki.vn/thuc-pham-tang-cuong-vi-chat-dinh-duong-mori-mama-huong-socola-200g-p451403.html?src=category-page-2549.10416&2hi=0,451403,5,"Thơm ngon dễ uống.. Mình mua cho vợ, pha nước ấm hơi chậm tan, sữa thơm ngon, nhạt dễ uống, uống hàng ngày không ngán, hỗ trợ tiêu hóa tốt, giúp không bị táo bón nữa :)
Tiki giao hàng rất nhanh, nhưng đóng gói kỹ quá mức cần thiết, lãng phí giấy xốp quá.",2016-06-11 15:05:25,2016-05-27 09:15:47
tiki.vn,https://tiki.vn/thuc-pham-tang-cuong-vi-chat-dinh-duong-mori-mama-huong-socola-200g-p451403.html?src=category-page-2549.10416&2hi=0,451403,4,"Sữa lạt dễ uống. Sữa lạt, không mùi, dễ uống, không ngán. Loại vani hơi ngọt và có mùi sữa,mình uống không được nhưng loại socola thì nhắm mắt uống cứ như uống nước bình thường. Mình toàn uống loại này thôi.
Mấy loại sữa hiệu khác có mùi sắt và rất ngọt, riêng loại Morimama lại rất lạt, hầu như không cảm thấy vị ngọt.",2016-04-08 09:50:27,2016-03-07 04:49:12
tiki.vn,https://tiki.vn/thuc-pham-tang-cuong-vi-chat-dinh-duong-mori-mama-huong-socola-200g-p451403.html?src=category-page-2549.10416&2hi=0,451403,4,"ngon, bổ. Sản phẩm của Nhật Bản nên mình rất yên tâm về chất lượng. Sữa ngon, không gây ngấy nên mẹ bầu bị nghén vẫn có thể uống được. Giá khá cao so với các loại sữa bầu khác, tuy nhiên mua ở Tiki được giảm giá nên cũng khá ổn.
Điểm trừ: Theo mình thấy hơi ngọt nên phải pha loãng hơn công thức, sữa mịn nên dễ vón cục, phải khuấy kỹ.",2016-04-07 11:51:31,2016-03-09 10:06:26
tiki.vn,https://tiki.vn/thuc-pham-tang-cuong-vi-chat-dinh-duong-mori-mama-huong-socola-200g-p451403.html?src=category-page-2549.10416&2hi=0,451403,4,"Ngon lắm. Sữa này uống ngon, dễ uống, sản phẩm của Nhật thì đảm bảo chất lượng rồi, mình thích vị socola hơn là vị vani. Mong tiki có nhiều chương trình khuyến mại hơn nữa để các mẹ bầu và cho con bú có thể thưởng thức sữa vừa ngon vừa đảm bảo",2016-03-05 10:11:01,2015-10-14 07:14:10
tiki.vn,https://tiki.vn/thuc-pham-tang-cuong-vi-chat-dinh-duong-mori-mama-huong-socola-200g-p451403.html?src=category-page-2549.10416&2hi=0,451403,5,"Sản phẩm tốt. Đây là lần đầu tiên mua sữa này trên tiki, cũng có nhiều lo lắng. Nhưng nhận được sản phẩm thì hoàn toàn đồng ý: bao bì, đóng gói sản phẩm...
Chất lượng sản phẩm tốt, có vị ngọt hơn so với hàng xách tay từ Nhật. Hộp chỉ có 1 gói nên dùng muỗng múc ra, hàng nhập thì làm thành từng gói sẵn tiện hơn.",2015-12-08 06:57:38,2015-12-06 14:40:36
tiki.vn,https://tiki.vn/sua-bot-danh-cho-me-bau-anmum-materna-huong-vanilla-800g-p513971.html?src=category-page-2549.10416&2hi=1,513971,4,"Hàng mới date còn dài. Hàng ok có điều giá vẫn chưa cạnh tranh lắm so với bên ngoài ,được cái giao tận nơi nên rất tiện",2018-12-13 06:08:20,
tiki.vn,https://tiki.vn/sua-bot-danh-cho-me-bau-anmum-materna-huong-vanilla-800g-p513971.html?src=category-page-2549.10416&2hi=1,513971,5,"Anmum 800. Mình đã mua hàng, thấy đóng gói hơi rộng hộp sữa bị lăn qua lăn lại, may mà ko móp, lần sau mong tiki chọn size hộp phù hợp hơn",2018-10-18 00:44:50,2018-10-12 01:54:51
tiki.vn,https://tiki.vn/sua-bot-danh-cho-me-bau-anmum-materna-huong-vanilla-800g-p513971.html?src=category-page-2549.10416&2hi=1,513971,5,Cực kì hài lòng. Giao nhanh giá rẻ đóng gói đẹp nhưng chất lượng chưa bik nhưng nhìn ok,2018-05-31 13:28:45,2018-05-23 04:11:37
tiki.vn,https://tiki.vn/sua-bot-danh-cho-me-bau-anmum-materna-huong-vanilla-800g-p513971.html?src=category-page-2549.10416&2hi=1,513971,5,Cực kì hài lòng. sữa ít béo rất là dễ uống. hơn những loại khác Mình rất hài lòng,2018-05-16 05:14:21,
tiki.vn,https://tiki.vn/sua-bot-danh-cho-me-bau-anmum-materna-huong-vanilla-800g-p513971.html?src=category-page-2549.10416&2hi=1,513971,5,"Rất hài lòng. Đã uống qua nhiều loại, nhưng loại này mình thích và dễ uống.",2017-12-22 09:42:54,
tiki.vn,https://tiki.vn/sua-bot-danh-cho-me-bau-anmum-materna-huong-vanilla-800g-p513971.html?src=category-page-2549.10416&2hi=1,513971,2,"giao hàng. giao hàng quá chậm so với dự kiến, đóng gói cẩn thận, giá hợp lý",2017-11-28 13:42:10,2017-11-21 13:47:22
tiki.vn,https://tiki.vn/hat-chia-den-hieu-mr-johnny-250g-p2050135.html?src=category-page-2549.10416&2hi=1,2050135,3,"Hạt nở không đều. Hạt chia được đóng gói trong hũ thủy tinh rất đẹp. Tuy nhiên, mình nhận thấy hạt nở không đều và bị vón cục, khác hẳn với những đơn hàng trước",2018-12-13 07:36:38,2018-10-08 09:07:07
tiki.vn,https://tiki.vn/hat-chia-den-hieu-mr-johnny-250g-p2050135.html?src=category-page-2549.10416&2hi=1,2050135,5,Chất lượng tốt. Rất hài lòng với chất lượng sản phẩm và phục vụ của Công ty TNHH ĐT TM XNK Minh Hương.,2018-11-23 00:58:02,2018-11-11 10:00:55
tiki.vn,https://tiki.vn/hat-chia-den-hieu-mr-johnny-250g-p2050135.html?src=category-page-2549.10416&2hi=1,2050135,5,"Đúng như thông tin trên tiki.vn. Giao hàng nhanh, chất lượng sản phẩm tốt, bao bì bằng hũ thủy tinh rất đẹp và an toàn!
Mình rất hài lòng! Cảm ơn tiki.vn và Công ty TNHH ĐT TM XNK Minh Hương!",2018-11-17 06:40:09,2018-10-03 03:30:08
tiki.vn,https://tiki.vn/hat-chia-den-hieu-mr-johnny-250g-p2050135.html?src=category-page-2549.10416&2hi=1,2050135,5,Tốt. Lọ rất đẹp nhé...........................................................,2018-08-08 01:03:57,2018-07-23 01:44:55
tiki.vn,https://tiki.vn/crm-hop-sua-nuoc-anmum-materna-vanilla-4-x-125-ml-p889360.html?src=category-page-2549.10416&2hi=1,889360,5,"Cực kì hài lòng. Sữa tốt , mình mua ở ngoài rất khó k ngờ lên tiki là có ngay",2018-08-04 04:48:06,2018-07-30 07:05:02
tiki.vn,https://tiki.vn/tra-dinh-duong-dang-com-loi-sua-danh-cho-san-phu-hipp-2348-200g-p1363107.html?src=category-page-2549.10416&2hi=1,1363107,5,"Cực kì hài lòng. - Tiki đóng gói cẩn thận.
- Giao hàng nhanh.
- Sản phẩm kích thích tuyến sữa hiệu quả sau 5 ngày. Cảm ơn Tiki!",2018-08-16 16:01:08,2018-07-24 18:01:03
tiki.vn,https://tiki.vn/crm-hop-sua-nuoc-anmum-materna-chocolate-4-x-125-ml-p889338.html?src=category-page-2549.10416&2hi=1,889338,5,"Sữa ngon. Mình đã mua sữa bột rồi, mua thêm hộp sữa nước nữa để mang đi những lúc không chế sữa bột được. Vị socola uống ngon và thích hơn vị vani",2018-07-09 08:20:10,2018-07-03 07:29:44
tiki.vn,https://tiki.vn/crm-hop-sua-nuoc-anmum-materna-chocolate-4-x-125-ml-p889338.html?src=category-page-2549.10416&2hi=1,889338,5,Tuyệt Vời. Thơm - Ngon - Dễ Uống -  Giá cả hợp lý. đóng gói đẹp cẩn thận,2018-05-28 09:23:19,2018-05-10 04:06:45
tiki.vn,https://tiki.vn/crm-hop-sua-nuoc-anmum-materna-chocolate-4-x-125-ml-p889338.html?src=category-page-2549.10416&2hi=1,889338,4,"nhận xét. Mình rất hài lòng về sản phẩm, sản phẩm uống rất ngon và tiện ích",2018-05-14 03:17:11,2018-04-09 06:51:53
tiki.vn,https://tiki.vn/crm-hop-sua-nuoc-anmum-materna-chocolate-4-x-125-ml-p889338.html?src=category-page-2549.10416&2hi=1,889338,2,"Giao thiếu quà tặng kèm. Biết trước chắn chắc sẽ giao thiếu hàng quà tặng kèm. Ko ngạc nhiên, ko cần gửi lại.",2018-04-12 04:18:12,2018-04-10 14:18:18
tiki.vn,https://tiki.vn/crm-hop-sua-nuoc-anmum-materna-chocolate-4-x-125-ml-p889338.html?src=category-page-2549.10416&2hi=1,889338,4,"Sản phẩm tốt. Sản phẩm rất tiện dụng, sữa ngon, hộp nhỏ dễ uống. Tuy nhiên giá sản phẩm hơi cao hơn giá siêu thị một chút, mong tiki có chương trình giảm giá cho sản phẩm.",2018-01-29 02:04:58,2017-10-10 06:14:27
tiki.vn,https://tiki.vn/crm-hop-sua-nuoc-anmum-materna-chocolate-4-x-125-ml-p889338.html?src=category-page-2549.10416&2hi=1,889338,5,Cực kì hài lòng. rất tốt. cảm thấy hài lòng. giao hàng rất nhanh. thích,2017-10-11 02:24:26,2017-10-09 02:42:36
tiki.vn,https://tiki.vn/crm-hop-sua-nuoc-anmum-materna-chocolate-4-x-125-ml-p889338.html?src=category-page-2549.10416&2hi=1,889338,5,good. sữa này vợ bầu mình dùng ngon hương chocolate dễ dùng,2017-10-01 00:55:05,2017-09-22 07:06:30
tiki.vn,https://tiki.vn/crm-sua-bot-danh-cho-me-bau-anmum-materna-huong-chocolate-800g-p889320.html?src=category-page-2549.10416&2hi=1,889320,5,"Tốt. Sản phẩm tốt, sản xuất năm 2017, hạn sử dụng đầu năm 2019, nói chung chấp nhận được, nếu date xa hơn nữa thì quá tuyệt vời",2018-09-04 08:58:15,2018-08-23 01:12:31
tiki.vn,https://tiki.vn/crm-sua-bot-danh-cho-me-bau-anmum-materna-huong-chocolate-800g-p889320.html?src=category-page-2549.10416&2hi=1,889320,5,"Sản phẩm giao nhanh, chính hãng, sử dụng tốt. Hài lòng, đề xuất của anh chị đã được lãnh đạo duyệt theo nội dung pur 2077",2018-08-23 07:01:48,2018-08-13 02:18:14
tiki.vn,https://tiki.vn/crm-sua-bot-danh-cho-me-bau-anmum-materna-huong-vanilla-400g-p889214.html?src=category-page-2549.10416&2hi=1,889214,5,"Sữa it béo. Vợ minh bầu uống sưa này rất hợp, ko bị ngán, phù hợp cho người bị nghén",2018-09-15 15:28:29,2018-09-10 11:37:05
tiki.vn,https://tiki.vn/crm-sua-bot-danh-cho-me-bau-anmum-materna-huong-chocolate-400g-p889304.html?src=category-page-2549.10416&2hi=1,889304,5,"dễ uống. Sữa dễ uống, ít béo nên ko bị ngấy so với các hãng sữa khác",2018-08-22 08:45:50,2018-08-17 08:35:49
tiki.vn,https://tiki.vn/crm-sua-bot-danh-cho-me-bau-anmum-materna-huong-chocolate-400g-p889304.html?src=category-page-2549.10416&2hi=1,889304,5,"Bị nhầm vị sữa. Sữa dễ uống, ngon. Mỗi tội bị nhầm vị sữa: Em lấy hương vani mà không hiểu sao nhận hàng xong về nhà mở ra là vị socola. Nhưng không sao vì vẫn uống được",2018-03-26 07:28:42,2018-03-21 02:49:54
tiki.vn,https://tiki.vn/crm-sua-bot-danh-cho-me-bau-anmum-materna-huong-chocolate-400g-p889304.html?src=category-page-2549.10416&2hi=1,889304,5,sữa nhãn mac còn nguyên. giao hàng rất nhanh. thái độ phục vụ rất tốt. chuyên nghiệp.,2017-12-15 09:54:23,2017-12-14 02:52:36
tiki.vn,https://tiki.vn/tra-vang-tui-loc-loi-sua-giam-mo-bung-wonmom-40g-p751831.html?src=category-page-2549.10416&2hi=1,751831,4,"Hài lòng. Trà dễ uống, mình sau sinh nên đang uống và thấy có sữa nhiều, lợi tiểu",2018-12-20 10:46:26,2018-12-11 01:40:10
tiki.vn,https://tiki.vn/tra-vang-tui-loc-loi-sua-giam-mo-bung-wonmom-40g-p751831.html?src=category-page-2549.10416&2hi=1,751831,3,"Bình thường, giá hơi cao. Tác dụng bình thường, dễ uống, ko đắng lắm, ko thấy vị ngọt sau khi uống như mọi ng nói :? Giá đắt hơn loại Ánh Ngọc",2018-10-10 16:11:36,2018-09-10 06:51:55
